所属主题,文章数量,特征词,主题强度
Topic0,33,产品、公司、技术、发行人、芯片、情况、客户、领域、生产、电子、行业、系统、市场、收入、研发、相关、设备、有限公司、智能、销售,0.2
Topic1,10,隔膜、干法、发行人、产品、湿法、工艺、公司、电池、临床试验、技术、设备、销售、情况、相关、市场、锂电池、治疗、储能、客户、药物,0.060606
Topic2,18,技术、公司、发行人、产品、服务、数据、相关、研发、客户、平台、情况、企业、药物、研究、行业、临床、领域、业务、市场、设备,0.10909
Topic3,16,公司、发行人、产品、技术、情况、相关、有限公司、客户、控制、股份、回复、企业、销售、智能、业务、问询、项目、协议、投资、股东,0.09697
Topic4,21,公司、发行人、技术、产品、客户、有限公司、情况、收入、万元、相关、项目、检测、设备、智能、市场、股东、股份、销售、芯片、系统,0.12727
Topic5,17,公司、发行人、技术、产品、智能、控制、情况、相关、投资、股份、股东、研发、基金、领域、客户、装备、平台、企业、销售、协议,0.10303
Topic6,39,发行人、公司、产品、客户、技术、情况、有限公司、芯片、业务、相关、股份、销售、研发、收入、市场、回复、万元、控制、项目、金额,0.23636
Topic7,11,产品、发行人、公司、技术、客户、设备、电子、情况、智能、市场、研发、系统、有限公司、场景、制造、行业、领域、服务、提供、设计,0.066667
