页码链接,用户id,用户,用户名链接,来自用户名,发表日期,点赞量,转发量,评论数量,content,分词
https://weibo.com/ajax/statuses/searchProfile?uid=6115560351&page=1&q=%E4%BA%9A%E8%BF%90%E4%BC%9A,6115560351,国是直通车,,,2023年09月23日 15:45,2,6,1,第19届亚运会开幕式将于23日晚在杭州举行。记者从中国移动了解到，中国移动通信保障团队已完成赛事指挥中心的多次综合技术演练以及开闭幕式指挥中心的开幕式全流程演练。作为杭州亚运会的主会场，杭州奥体中心体育场可容纳8万人。浙江移动网管中心总经理 程路接受采访时表示，中国移动结合3（大规模天线阵列）、多频分层、超大上行等通信技术，对各大体育场馆运用了一套自主研发的超密组网方式，可以使每个场馆的4和5网络容量弹性可扩展，这将为开幕式主场馆容纳现场观众约8万多人的密集状态下，能流畅使用网络提供保证。 ​,亚运会 开幕式 晚在 杭州 中国移动 中国移动通信 保障 团队 赛事 指挥 中心 综合 技术 演练 闭幕式 指挥 中心 开幕式 流程 演练 杭州 亚运会 主会场 杭州 奥体中心 体育场 容纳 浙江 网管 中心 总经理 程路 接受 采访 中国移动 大规模 天线 阵列 分层 超大 上行 通信 技术 体育场馆 一套 自主 研发 超密 组网 方式 场馆 网络 容量 弹性 扩展 开幕式 主场 容纳 现场 观众 万多 密集 状态 能流畅 网络 提供 保证
https://weibo.com/ajax/statuses/searchProfile?uid=6115560351&page=1&q=%E4%BA%9A%E8%BF%90%E4%BC%9A,6115560351,国是直通车,,,2023年09月23日 12:00,132,416,142,依水而生， 大美杭州！当钱塘江大桥的景观灯与杭州奥体中心体育馆的夜莲之景遥相辉映，当西湖画舫与承载“江南忆”的吉祥物“琮、莲、宸“共同组成新时代的中国风，一出传统文化与现代体育的交织，别具一格的东方神韵点亮了钱塘江畔的这座千年之城。而拍下这一幕的则是无数网友手中的 90 +手机，在50万像素、人像模式、夜景模式等影像黑科技的加持下，水墨青黛与全亚洲健儿的相遇构成了一副最美的团结、友谊与进步的画卷。 ​,依水 大美 杭州 钱塘江 大桥 景观灯 杭州 奥体中心 体育馆 夜莲 遥相 辉映 西湖 画舫 承载 江南 吉祥物 时代 中国 一出 传统 文化 体育 交织 别具一格 东方 神韵 点亮 钱塘江 千年 拍下 一幕 无数 手中 像素 模式 夜景 模式 影像 科技 加持 水墨 青黛 亚洲 健儿 相遇 一副 最美 团结 友谊 画卷
https://weibo.com/ajax/statuses/searchProfile?uid=3604378011&page=3&q=%E4%BA%9A%E8%BF%90%E4%BC%9A,3604378011,中国新闻社,,,2023年09月23日 16:22,0,1,0,西子湖畔，钱塘江岸，杭州第19届亚运会大幕即将开启，亚运之光映照神州大地。中新网亚运会开幕特别节目联动杭州、雅加达、仁川、广州、曼谷、北京六座亚运之城，回望亚运路上的光荣与梦想，共赴心相融之约。 ​,西子湖畔 钱塘江 杭州 亚运会 大幕 开启 亚运 映照 神州大地 中新网 亚运会 开幕 特别节目 联动 杭州 雅加达 仁川 广州 曼谷 北京 六座 亚运 回望 亚运 路上 光荣 梦想 共赴 相融
https://weibo.com/ajax/statuses/searchProfile?uid=3604378011&page=3&q=%E4%BA%9A%E8%BF%90%E4%BC%9A,3604378011,中国新闻社,,,2023年09月23日 12:30,2,25,3,今天是，也是中国农民丰收节，向辛勤劳作的人们致敬。他们就像农田里的艺术家，把最美的作品铺满大地，。今天也是杭州亚运会开幕的日子，祝福！ ​,中国 农民 丰收 辛勤 劳作 致敬 农田 艺术家 最美 作品 铺满 大地 杭州 亚运会 开幕 日子 祝福
https://weibo.com/ajax/statuses/searchProfile?uid=3604378011&page=3&q=%E4%BA%9A%E8%BF%90%E4%BC%9A,3604378011,中国新闻社,,,2023年09月23日 07:00,0,10,2,不知不觉，秋分已至，正是农事活动繁忙之时。据说，秋分有两层含义，一来这天正好在秋季90天的中间，有“平分秋色”之意，二来也指平分昼夜。同样在今日，杭州亚运会开幕式即将举行。丹桂飘香，付出终有回报。期待运动员们在赛场上创造佳绩，加油！,秋分 已至 农事 活动 繁忙 秋分 两层 含义 这天 正好 秋季 平分秋色 平分 昼夜 今日 杭州 亚运会 开幕式 丹桂 飘香 付出 回报 期待 运动员 赛场 创造 佳绩 加油
https://weibo.com/ajax/statuses/searchProfile?uid=3840768703&page=1&q=%E4%BA%9A%E8%BF%90%E4%BC%9A,3840768703,工人日报,,,2023年09月27日 15:06,1,4,0,曾经以为，中国已经是第三次举办亚运会了，杭州亚运会不至于让人太激动，但现在看来，未必。59岁的李玲蔚，34岁的孙培原，15岁的陈烨，似乎正好是三代中国体育人的代表。他们拥有不同的亚运记忆，但相同的是，这些亚运时光都会成为他们人生最美的珍藏，成为他们最宝贵的精神财富。而中华体育精神正是在这些时光的流传中，生不息、代传承。即使你只是一个为杭州亚运会鼓掌的人，只是偶尔点开了亚运会视频，然后被鼓舞、被感动，那一刻，也是属于你的亚运时光。还犹豫什么？趁时光正好，去享受属于你的亚运好时光吧！ ​,中国 第三次 举办 亚运会 杭州 亚运会 激动 未必 李玲蔚 孙培原 陈烨 正好 三代 中国 体育 代表 拥有 亚运 记忆 亚运 时光 人生 最美 珍藏 宝贵 精神财富 中华 体育精神 时光 流传 不息 传承 杭州 亚运会 鼓掌 点开 亚运会 鼓舞 感动 那一刻 亚运 时光 犹豫 时光 正好 享受 亚运 好时光
https://weibo.com/ajax/statuses/searchProfile?uid=3840768703&page=1&q=%E4%BA%9A%E8%BF%90%E4%BC%9A,3840768703,工人日报,,,2023年09月27日 10:38,2,11,1,9月27日上午，杭州亚运会滑板女子街式决赛中，年仅13岁的中国姑娘崔宸曦夺得金牌。另外一名中国选手曾文蕙获得银牌。祝贺！未来可期！ ,上午 杭州 亚运会 滑板 女子 街式 决赛 中国 姑娘 崔宸 夺得 金牌 一名 中国 选手 曾文蕙 银牌 祝贺 未来
https://weibo.com/ajax/statuses/searchProfile?uid=3840768703&page=1&q=%E4%BA%9A%E8%BF%90%E4%BC%9A,3840768703,工人日报,,,2023年09月26日 19:20,0,4,0,杭州亚运会乒乓球女团决赛，由国乒女团迎战日本队。 3比1战胜早田希娜，-乒乓球 3比2战胜平野美宇， 3比1战胜张本美和，国乒女团3比0战胜日本队。 ​,杭州 亚运会 乒乓球 女团 决赛 国乒 女团 迎战 日本队 战胜 田希娜 乒乓球 战胜 美宇 战胜 张本 美和 国乒 女团 战胜 日本队
https://weibo.com/ajax/statuses/searchProfile?uid=3840768703&page=1&q=%E4%BA%9A%E8%BF%90%E4%BC%9A,3840768703,工人日报,,,2023年09月26日 15:49,0,2,1, 杭州亚运会乒乓球女子团体决赛，中国队孙颖莎率先出战，3比1战胜日本队的早田希娜。四局比分：1-6、12-10、8-1、1-9。陈梦-乒乓球、王曼昱继续加油！ ​,杭州 亚运会 乒乓球 女子 团体 决赛 中国队 孙颖莎 率先 出战 战胜 日本队 田希娜 四局 比分 陈梦 乒乓球 王曼昱 加油
https://weibo.com/ajax/statuses/searchProfile?uid=3840768703&page=1&q=%E4%BA%9A%E8%BF%90%E4%BC%9A,3840768703,工人日报,,,2023年09月26日 12:28,0,2,2, 9 月 26日，在刚结束的杭州亚运会 10 米气步枪混合团体决赛中，中国组合盛李豪/黄雨婷获得金牌。,结束 杭州 亚运会 气步枪 混合 团体 决赛 中国 组合 盛李豪 黄雨婷 金牌
https://weibo.com/ajax/statuses/searchProfile?uid=3840768703&page=1&q=%E4%BA%9A%E8%BF%90%E4%BC%9A,3840768703,工人日报,,,2023年09月26日 09:30,0,1,0,今天，杭州亚运会将决出39枚金牌。①国乒男团决赛对阵韩国，；②0后冠军盛李豪、黄雨婷联手出战男女10米气步枪混合团体决赛；③女子40米自由泳，李冰洁冲击本届亚运会个人第三金；④，中国对阵马来西亚。你最期待哪场比赛 ​,杭州 亚运会 决出 金牌 国乒 男团 决赛 对阵 韩国 冠军 盛李豪 黄雨婷 联手 出战 男女 气步枪 混合 团体 决赛 女子 自由泳 李冰 冲击 本届 亚运会 第三 中国 对阵 马来西亚 期待 哪场 比赛
https://weibo.com/ajax/statuses/searchProfile?uid=3840768703&page=1&q=%E4%BA%9A%E8%BF%90%E4%BC%9A,3840768703,工人日报,,,2023年09月25日 21:20,0,5,1,25日晚，杭州亚运会击剑女子个人花剑决赛举行。最终，中国选手黄芊大比分战胜日本选手上野优佳，夺得金牌。这也是中国队在本届亚运会上取得的首枚击剑项目金牌。 ​,日晚 杭州 亚运会 击剑 女子 花剑 决赛 最终 中国 选手 黄芊 大比分 战胜 日本 选手 上野 优佳 夺得 金牌 中国队 本届 亚运会 首枚 击剑 金牌
https://weibo.com/ajax/statuses/searchProfile?uid=3840768703&page=1&q=%E4%BA%9A%E8%BF%90%E4%BC%9A,3840768703,工人日报,,,2023年09月25日 19:03,155,1138,140,杭州亚运会霹雳舞宣传片《正当燃》正式发布，和-王一博一起期待霹雳舞赛事的“惊艳亮相”！突破框架，舞出自我，一起燃起来！ ,杭州 亚运会 霹雳舞 宣传片 正当 正式 发布 王一博 期待 霹雳舞 赛事 惊艳 亮相 突破 框架 出自 燃起
https://weibo.com/ajax/statuses/searchProfile?uid=3840768703&page=1&q=%E4%BA%9A%E8%BF%90%E4%BC%9A,3840768703,工人日报,,,2023年09月25日 18:10,1,3,0,她说，参加比赛是为自己表演，为职业生涯画上完美句号。今晚，一起见证目前职业生涯最长的女子体操运动员丘索维金娜的杭州亚运“首秀”。,参加 比赛 表演 职业生涯 完美 句号 今晚 见证 职业生涯 最长 女子 体操 运动员 丘索维 金娜 杭州 亚运
https://weibo.com/ajax/statuses/searchProfile?uid=3840768703&page=1&q=%E4%BA%9A%E8%BF%90%E4%BC%9A,3840768703,工人日报,,,2023年09月25日 16:34,0,2,0,9月25日，杭州亚运会男子10米气步枪个人赛，中国队选手盛李豪以253环的成绩夺得金牌，创造新的世界纪录、亚洲纪录、赛会纪录。,杭州 亚运会 男子 气步枪 个人赛 中国队 选手 盛李豪 成绩 夺得 金牌 创造 世界纪录 亚洲纪录 赛会 纪录
https://weibo.com/ajax/statuses/searchProfile?uid=3840768703&page=1&q=%E4%BA%9A%E8%BF%90%E4%BC%9A,3840768703,工人日报,,,2023年09月25日 16:03,0,4,1,今天，亚运会乒乓球女子团体半决赛，中国队孙颖莎王曼昱陈梦-乒乓球以3比0的成绩战胜泰国队，晋级决赛。决赛中，她们将与日本队和韩国队之间的胜者争夺冠军！为姑娘们加油！,亚运会 乒乓球 女子 团体 半决赛 中国队 孙颖莎 王曼昱 陈梦 乒乓球 成绩 战胜 泰国队 晋级 决赛 决赛 日本队 韩国队 之间 胜者 争夺 冠军 姑娘 加油
https://weibo.com/ajax/statuses/searchProfile?uid=3840768703&page=1&q=%E4%BA%9A%E8%BF%90%E4%BC%9A,3840768703,工人日报,,,2023年09月25日 15:25,0,1,1,今天，杭州亚运会赛艇女子八人单桨有舵手决赛，中国队夺得金牌！至此，本届亚运会赛艇项目比赛全部结束，中国赛艇队参加13个单项，共夺得1金2银。！,杭州 亚运会 赛艇 女子 单桨 舵手 决赛 中国队 夺得 金牌 至此 本届 亚运会 赛艇 比赛 结束 中国 赛艇 参加 单项 夺得
https://weibo.com/ajax/statuses/searchProfile?uid=3840768703&page=1&q=%E4%BA%9A%E8%BF%90%E4%BC%9A,3840768703,工人日报,,,2023年09月24日 20:31,0,4,0,杭州亚运会女乒团体1/4决赛，中国队3-0击败越南队，晋级半决赛。赛后，越南女团找国乒队员们签名留念。马龙：这一幕我熟。 ​,杭州 亚运会 女乒 团体 决赛 中国队 击败 越南 晋级 半决赛 赛后 越南 女团 国乒 队员 签名 留念 马龙 一幕
https://weibo.com/ajax/statuses/searchProfile?uid=3840768703&page=1&q=%E4%BA%9A%E8%BF%90%E4%BC%9A,3840768703,工人日报,,,2023年09月24日 19:38,0,0,0,在24日举行的杭州亚运会游泳比赛中，中国选手张雨霏摘得游泳项目女子20米蝶泳金牌，这是中国游泳队本届亚运会第1金。,杭州 亚运会 游泳 比赛 中国 选手 张雨霏 摘得 游泳 女子 金牌 中国 游泳队 本届 亚运会
https://weibo.com/ajax/statuses/searchProfile?uid=3840768703&page=1&q=%E4%BA%9A%E8%BF%90%E4%BC%9A,3840768703,工人日报,,,2023年09月24日 13:09,4,3,0,截至目前，中国队已在杭州亚运会收获9枚金牌，你们都是好样的！转发祝贺，一起重温夺金时刻，我们为你们骄傲！,中国队 杭州 亚运会 收获 金牌 好样 祝贺 重温 夺金 时刻 骄傲
https://weibo.com/ajax/statuses/searchProfile?uid=3840768703&page=1&q=%E4%BA%9A%E8%BF%90%E4%BC%9A,3840768703,工人日报,,,2023年09月24日 12:45,0,4,0,七枚金牌！小编手速都追不上了！ ​,七枚 金牌 小编 手速 追不上
https://weibo.com/ajax/statuses/searchProfile?uid=3840768703&page=1&q=%E4%BA%9A%E8%BF%90%E4%BC%9A,3840768703,工人日报,,,2023年09月24日 11:46,0,0,0,9月24日，杭州亚运会赛艇女子双人双桨决赛，中国组合鲁诗雨/沈双美夺得金牌！赛艇男子双人双桨决赛中，中国组合张亮、刘治宇拿下金牌。 ​,杭州 亚运会 赛艇 女子 双人 双桨 决赛 中国 组合 鲁诗雨 沈双美 夺得 金牌 赛艇 男子 双人 双桨 决赛 中国 组合 张亮 刘治宇 拿下 金牌
https://weibo.com/ajax/statuses/searchProfile?uid=3840768703&page=1&q=%E4%BA%9A%E8%BF%90%E4%BC%9A,3840768703,工人日报,,,2023年09月24日 10:25,0,1,0, 9月24日上午，在刚结束的杭州亚运会武术男子长拳项目比赛中，中国选手武术孙培原获得金牌。,上午 结束 杭州 亚运会 武术 男子 长拳 比赛 中国 选手 武术 孙培原 金牌
https://weibo.com/ajax/statuses/searchProfile?uid=3840768703&page=1&q=%E4%BA%9A%E8%BF%90%E4%BC%9A,3840768703,工人日报,,,2023年09月24日 10:07,0,2,1,9月24日，杭州第19届亚运会射击女子10米气步枪团体赛在富阳银湖体育中心精彩上演，中国队派出黄雨婷、韩佳予、王芝琳三人出战。经过六轮比拼，中国队最终以1896环的成绩拿下团体金牌，同时创下新的亚洲纪录。,杭州 亚运会 射击 女子 气步枪 团体赛 富阳 银湖 体育中心 精彩 上演 中国队 派出 黄雨婷 韩佳予 王芝 琳三人 出战 六轮 比拼 中国队 最终 成绩 拿下 团体 金牌 创下 亚洲纪录
https://weibo.com/ajax/statuses/searchProfile?uid=1726918143&page=1&q=%E4%BA%9A%E8%BF%90%E4%BC%9A,1726918143,中国青年报,,,2023年09月27日 21:39,2,28,10,杭州亚运会女篮比赛9月27日开赛，中国女篮在首场小组赛中，以101:46的大比分击败实力较弱的蒙古女篮，取得开门红。本场比赛，中国女篮主力悉数上场，归队最晚的李梦得到了10分，韩旭高效地贡献了15分，伤愈复出的李月汝出场了17分54秒。显然，主帅郑薇希望通过这种强度不高的比赛，帮助李月汝逐渐找回比赛状态，她本场比赛得到了18分。中国女篮下一个小组赛对手将是印尼女篮。 ​,杭州 亚运会 女篮 比赛 开赛 中国女篮 首场 小组赛 大比分 击败 实力 较弱 蒙古 女篮 开门红 本场 比赛 中国女篮 主力 悉数 上场 归队 最晚 李梦 韩旭 高效 贡献 伤愈 复出 李月汝 出场 主帅 郑薇 希望 强度 不高 比赛 李月汝 找回 比赛 状态 本场 比赛 中国女篮 小组赛 对手 印尼 女篮
https://weibo.com/ajax/statuses/searchProfile?uid=1726918143&page=1&q=%E4%BA%9A%E8%BF%90%E4%BC%9A,1726918143,中国青年报,,,2023年09月27日 21:23,3,47,13,在9月27日晚结束的杭州亚运会男女410米混合泳接力决赛上，中国队派出徐嘉余、覃海洋、张雨霏、杨浚瑄的强大阵容，夺得此项目冠军已不是中国队的目标，打破世界纪录才是中国队的想法。4名中国选手齐心协力，最终拿下冠军并打破亚洲纪录，距离世界纪录仅差0秒。不过，中国队有此实力，留待巴黎奥运会再破世界纪录也未尝不可。 ​,日晚 结束 杭州 亚运会 男女 混合泳 接力 决赛 中国队 派出 徐嘉余 海洋 张雨霏 强大 阵容 夺得 冠军 中国队 目标 打破 世界纪录 中国队 想法 中国 选手 齐心协力 最终 拿下 冠军 打破 亚洲纪录 距离 世界纪录 中国队 实力 留待 巴黎 奥运会 世界纪录 未尝不可
https://weibo.com/ajax/statuses/searchProfile?uid=1726918143&page=1&q=%E4%BA%9A%E8%BF%90%E4%BC%9A,1726918143,中国青年报,,,2023年09月27日 19:49,0,17,6,“感觉非常艰难，非常累，因为每一局的对手都很强。”9月27日傍晚，韦奕第9轮顺利战胜蒙古棋手苏米亚后赢得杭州亚运会国际象棋男子个人赛冠军。他说亚运夺冠的难度不亚于征战奥赛：“上午第8轮时，我压力比较大，因为如果连胜势头被止住的话，冠军就有可能被别人抢走，到第9轮反而没压力了，心态好了不少，不觉得紧张。”27日上午第8轮较量，韦奕遭遇越南特级大师黎俊明，韦奕局面一度吃紧，但黎俊明没能将优势延续并且意外犯错，这让韦奕就此迈上金牌之路。 ​,艰难 一局 对手 傍晚 韦奕第 顺利 战胜 蒙古 棋手 米亚 赢得 杭州 亚运会 国际象棋 男子 个人赛 冠军 亚运 夺冠 难度 不亚于 征战 奥赛 上午 压力 连胜 势头 止住 冠军 抢走 压力 心态 紧张 上午 较量 遭遇 越南 特级 大师 黎俊明 局面 一度 吃紧 黎俊明 没能 优势 延续 意外 犯错 韦奕 迈上 金牌
https://weibo.com/ajax/statuses/searchProfile?uid=1726918143&page=1&q=%E4%BA%9A%E8%BF%90%E4%BC%9A,1726918143,中国青年报,,,2023年09月27日 19:20,0,35,19,杭州亚运会击剑项目团体赛打响。在9月27日举行的男子团体花剑决赛中，中国队以38：45不敌韩国队，摘得银牌。本场比赛战况焦灼，双方始终交替领先，这支由征战过里约奥运会的老将陈海威领衔，许杰、吴斌、曾昭然组成的中国队在比赛中作风顽强，延续了在今年米兰世锦赛夺银的状态。而由奥运冠军孙一文领衔的中国重剑女团，在半决赛中惜败韩国队，收获铜牌。 ​,杭州 亚运会 击剑 团体赛 打响 男子 团体 花剑 决赛 中国队 不敌 韩国队 摘得 银牌 本场 比赛 战况 焦灼 始终 交替 领先 征战 过里 奥运会 老将 陈海威 领衔 许杰 吴斌 昭然 中国队 比赛 作风 顽强 延续 米兰 世锦赛 状态 奥运冠军 一文 领衔 中国 重剑 女团 半决赛 惜败 韩国队 收获 铜牌
https://weibo.com/ajax/statuses/searchProfile?uid=1726918143&page=1&q=%E4%BA%9A%E8%BF%90%E4%BC%9A,1726918143,中国青年报,,,2023年09月27日 19:00,2,29,15,薛晨和夏欣怡可以撑起半部亚运女子沙排冠军史。198年曼谷亚运会，沙排被正式列入亚运比赛项目。而今年34岁的老将薛晨曾和队友在206多哈亚运会、2010广州亚运会夺得女子沙排冠军，26岁的夏欣怡则和队友在2014仁川亚运会和2018雅加达亚运会夺得该项目金牌。如今，两位“沙场”名将携手续写传奇，实现中国女子沙排亚运六连冠。,薛晨 欣怡 撑起 半部 亚运 女子 沙排 冠军 曼谷 亚运会 沙排 正式 列入 亚运 比赛项目 老将 薛晨曾 队友 多哈 亚运会 广州 亚运会 夺得 女子 沙排 冠军 欣怡 队友 仁川 亚运会 雅加达 亚运会 夺得 金牌 两位 沙场 名将 携手 续写 传奇 中国 女子 沙排 亚运 六连冠
https://weibo.com/ajax/statuses/searchProfile?uid=1726918143&page=1&q=%E4%BA%9A%E8%BF%90%E4%BC%9A,1726918143,中国青年报,,,2023年09月27日 17:26,4,45,10,在9月27日下午刚结束的杭州亚运会女子体操全能决赛上，17岁的中国小将左彤夺得冠军，中国队老将章瑾因为在高低杠项目上出现失误，最终排名第四。和体操女团冠军一样，自中国队在1974年参加亚运会以来，女子体操全能冠军也从未旁落，今天，左彤继续捍卫了中国队的这一荣誉。 ​,下午 结束 杭州 亚运会 女子 体操 全能 决赛 中国 小将 左彤 夺得 冠军 中国队 老将 章瑾 高低杠 失误 最终 排名 第四 体操 女团 冠军 中国队 参加 亚运会 女子 体操 全能冠军 旁落 左彤 捍卫 中国队 这一 荣誉
https://weibo.com/ajax/statuses/searchProfile?uid=1726918143&page=1&q=%E4%BA%9A%E8%BF%90%E4%BC%9A,1726918143,中国青年报,,,2023年09月27日 16:55,19,383,36,9月27日正在进行的杭州亚运会体操女子全能决赛上，中国队老将章瑾在高低杠项目上罕见地三次掉下器械，令人心疼。但她坚持完赛，全场观众为她的不屈精神鼓掌加油。目前比赛仍在进行之中，章瑾已经顺利完成跳马、高低杠、平衡木的比赛，暂列第五位。另一名中国选手左彤目前暂列第一位。,杭州 亚运会 体操 女子 全能 决赛 中国队 老将 章瑾 高低杠 罕见 三次 器械 令人 心疼 完赛 全场 观众 不屈 精神 鼓掌 加油 比赛 之中 章瑾 顺利完成 跳马 高低杠 平衡木 比赛 暂列 第五位 另一名 中国 选手 左彤 暂列 第一位
https://weibo.com/ajax/statuses/searchProfile?uid=1726918143&page=1&q=%E4%BA%9A%E8%BF%90%E4%BC%9A,1726918143,中国青年报,,,2023年09月27日 15:57,8,32,9,9月27日下午，继崔宸曦、曾文蕙包揽女子项目前两名后，刚结束的杭州亚运会滑板男子街式决赛中，16岁的张杰和19岁的苏建军分别获得冠军、季军。本次亚运会，中国队在滑板的4个项目中，一共获得3金2银2铜。中国轮滑协会秘书长魏勇表示，本次亚运会的成绩将会带动更多青少年参与到滑板运动中。,下午 崔宸 曾文蕙 包揽 女子 两名 结束 杭州 亚运会 滑板 男子 街式 决赛 张杰 建军 冠军 季军 本次 亚运会 中国队 滑板 一共 中国 轮滑 协会 秘书长 魏勇 本次 亚运会 成绩 带动 青少年 参与 滑板 运动
https://weibo.com/ajax/statuses/searchProfile?uid=1726918143&page=1&q=%E4%BA%9A%E8%BF%90%E4%BC%9A,1726918143,中国青年报,,,2023年09月27日 15:42,9,133,28, 韩联社26日报道称，在杭州亚运会上爆冷出局、引发“拒绝握手”争议的韩国男网种子选手权纯雨通过大韩体育会公开了一封亲笔道歉信。他在信中表示：“我向所有支持国家代表队比赛的国民和在场观众表示真诚的歉意。对不起。”接着，他写道：“再次向因我的无礼行为而感到不快的萨姆瑞吉选手表示诚挚的歉意。” 在此前的亚运会比赛上韩国男网种子选手权纯雨爆冷输给比自己世界排名落后50多名的泰国选手卡西迪特•萨姆瑞吉，赛后，权纯雨当场将球拍摔碎，并拒绝与对手握手。,韩联社 报道 杭州 亚运会 爆冷 出局 引发 拒绝 握手 争议 韩国 男网 种子选手 权纯雨 体育 公开 一封 亲笔 道歉信 支持 国家 代表队 比赛 国民 在场 观众 真诚 歉意 对不起 写道 无礼 感到 不快 萨姆瑞 选手 诚挚 歉意 此前 亚运会 比赛 韩国 男网 种子选手 权纯雨 爆冷 输给 世界排名 落后 多名 泰国 选手 卡西迪 萨姆瑞 赛后 权纯雨 球拍 摔碎 拒绝 对手 握手
https://weibo.com/ajax/statuses/searchProfile?uid=1726918143&page=1&q=%E4%BA%9A%E8%BF%90%E4%BC%9A,1726918143,中国青年报,,,2023年09月27日 15:34,12,315,26,杭州亚运会网球项目9月27日结束了女单四分之一决赛的争夺。中国选手郑钦文在和韩国选手朴昭炫的对决中，以7:6、6:0连下两盘，大比分2:0顺利杀入四强。赛后，郑钦文在接受采访时表示，今天其实自己在比赛中也犯了一些错误，但之后提升了比赛的专注力，顺利拿下了比赛。 ​除此之外，郑钦文还透露了另一个让自己提升比赛状态的方式，来听她怎么说吧。,杭州 亚运会 网球 结束 女单 四分之一 决赛 争夺 中国 选手 郑钦文 韩国 选手 朴昭炫 对决 连下 两盘 大比分 顺利 杀入 赛后 郑钦文 接受 采访 比赛 错误 提升 比赛 专注 顺利 拿下 比赛 郑钦文 透露 提升 比赛 状态 方式
https://weibo.com/ajax/statuses/searchProfile?uid=1726918143&page=1&q=%E4%BA%9A%E8%BF%90%E4%BC%9A,1726918143,中国青年报,,,2023年09月27日 15:00,4,54,9,5年间，两届亚运会，电竞完成了从“实习”到“转正”的蜕变；人力资源和社会保障部也将“电子竞技运营师”和“电子竞技员”列为新职业，电子竞技指导服务从业者开始进入大众视线；对各行业的挑战以及其他产业的变迁，都让电竞成为不可回避的时代热词。可关注度和知晓度并不相等，反而因备受关注，电竞总会出现在舆论的两端，一边鼓吹“电竞偶像”，另一边痛斥“网瘾少年”，可中间的地带，似乎鲜有探究。 ​,年间 两届 亚运会 实习 转正 蜕变 人力资源 社会保障部 电子竞技 运营 电子竞技 列为 职业 电子竞技 指导 服务 从业者 大众 视线 行业 挑战 产业 变迁 回避 时代 热词 关注度 知晓 备受 关注 总会 舆论 两端 鼓吹 偶像 另一边 痛斥 网瘾 少年 地带 鲜有 探究
