页码链接,用户id,用户,用户名链接,来自用户名,发表日期,点赞量,转发量,评论数量,content,分词
https://weibo.com/ajax/statuses/searchProfile?uid=7211561239&page=1&q=%E4%BA%9A%E8%BF%90%E4%BC%9A,7211561239,央视频,,,2023年09月30日 17:00,0,4,0,当中秋国庆遇上亚运会，盼运动健儿荣耀归！金秋时节，央视频央友圈亚运互动开启浙江金华之旅~参与中秋与国庆的梦幻联动活动，完成指定任务即可点亮金华专属城市海报，全部集齐更有超多惊喜等着你！ ​,中秋 国庆 遇上 亚运会 运动 健儿 荣耀 金秋 时节 央友 亚运 互动 开启 浙江 金华 参与 中秋 国庆 梦幻 联动 活动 指定 即可 点亮 金华 专属 城市 海报 集齐 惊喜
https://weibo.com/ajax/statuses/searchProfile?uid=7211561239&page=1&q=%E4%BA%9A%E8%BF%90%E4%BC%9A,7211561239,央视频,,,2023年09月30日 16:34,1,7,1,乘绿色大巴，游诗画杭州！总台亚运会新媒体节目《诗画杭州》，把演播室搬到大巴车里！大巴穿梭在绿水青山间，主持人、嘉宾与您一起赏如诗如画景致，聊亚运逸闻趣事。本期您将看到：女排前国手薛明和总台主持人共游梦想小镇，从亚运赛事聊到女排征程，从小镇古今聊到创业梦想；总台记者去亚运会橄榄球比赛场地亲身体验，橄榄球训练到底难不难？速进！​,绿色 大巴 游诗 杭州 亚运会 媒体 节目 诗画 杭州 大巴车 大巴 穿梭 绿水青山 嘉宾 如诗如画 景致 亚运 逸闻趣事 本期 女排 国手 薛明 共游 梦想 小镇 亚运 赛事 聊到 女排 征程 小镇 古今 聊到 创业 梦想 亚运会 橄榄球 比赛场地 体验 橄榄球 训练 不难
https://weibo.com/ajax/statuses/searchProfile?uid=7211561239&page=1&q=%E4%BA%9A%E8%BF%90%E4%BC%9A,7211561239,央视频,,,2023年09月30日 14:16,61,525,73,杭州亚运会女子铅球决赛，巩立姣“霸主地位”无可撼动，最终以19米实现亚运三连冠。和央视频雅迪电动车官方微博一“骑”感受巅峰时刻。 ​,杭州 亚运会 女子 铅球 决赛 巩立 霸主 地位 无可 撼动 最终 亚运 三连冠 感受 巅峰 时刻
https://weibo.com/ajax/statuses/searchProfile?uid=7211561239&page=1&q=%E4%BA%9A%E8%BF%90%E4%BC%9A,7211561239,央视频,,,2023年09月30日 13:40,1,4,1,上海著名画家、上海大学美术学院教授陈家泠说道，亚运会体现了人类的生命之美、创作之美、竞争之美、和谐之美，是艺术跟体育的一种交响乐。“接天莲叶无穷碧，映日荷花别样红”，在他眼中，亚运会就像荷花一样充满生命力，因此他以荷花为主题，为创作了《荷美》 ​,上海 著名画家 上海大学 美术学院 教授 陈家 说道 亚运会 体现 人类 生命 创作 竞争 和谐 艺术 体育 一种 交响乐 接天 莲叶 无穷 荷花 别样红 眼中 亚运会 荷花 充满 生命力 荷花 主题 创作 荷美
https://weibo.com/ajax/statuses/searchProfile?uid=7211561239&page=1&q=%E4%BA%9A%E8%BF%90%E4%BC%9A,7211561239,央视频,,,2023年09月30日 11:35,1,4,1,谁能读懂江湖？谁能十八般武艺样精通？本期，一起到杭州西溪水乡，寻一位深藏不露的老师傅说一段历史，学一门武艺，再做一场遥远的江湖梦！，解锁更多亚运之城的打开方式~,读懂 江湖 十八般武艺 精通 本期 杭州 西溪 水乡 一位 深藏不露 老师傅 一段 历史 一门 武艺 一场 遥远 江湖梦 解锁 亚运 之城 打开方式
https://weibo.com/ajax/statuses/searchProfile?uid=7354234663&page=1&q=%E4%BA%9A%E8%BF%90%E4%BC%9A,7354234663,大湾区之声,,,2023年09月30日 23:12,0,7,0,亚运会幕后工作者究竟有多拼？趁比赛间隙互动起来,亚运会 幕后 工作者 比赛 间隙 互动
https://weibo.com/ajax/statuses/searchProfile?uid=1656831930&page=1&q=%E4%BA%9A%E8%BF%90%E4%BC%9A,1656831930,环球资讯,,,2023年09月30日 15:56,4,25,5,今天，杭州亚运会网球男单决赛，中国选手张之臻直落两盘击败日本选手绵贯阳介，摘得金牌。这是时隔29年中国队再夺亚运网球男单冠军。恭喜！ ​,杭州 亚运会 网球 决赛 中国 选手 张之臻 直落 两盘 击败 日本 选手 绵贯 阳介 摘得 金牌 时隔 中国队 亚运 网球 冠军 恭喜
https://weibo.com/ajax/statuses/searchProfile?uid=1977902724&page=1&q=%E4%BA%9A%E8%BF%90%E4%BC%9A,1977902724,看台海,,,2023年09月30日 22:43,0,4,0,亚运会幕后工作者究竟有多拼？趁比赛间隙互动起来 ​,亚运会 幕后 工作者 比赛 间隙 互动
https://weibo.com/ajax/statuses/searchProfile?uid=1977902724&page=1&q=%E4%BA%9A%E8%BF%90%E4%BC%9A,1977902724,看台海,,,2023年09月30日 21:21,1,2,0, 9月29日，杭州亚运会女子垒球项目比赛进入超级轮和排位赛环节。当晚，绍兴棒（垒）球体育文化中心垒球场座无虚席，中国女垒以1:0战胜中国台北队，赛后两队互相致意，气氛融洽。 正如比赛期间场馆体育展示与颁奖仪式主任朱军说：“月圆人团圆，希望今晚的比赛能成为两岸运动健儿共度中秋的美好回忆，也为推动两岸体育、文化交流贡献力量。,杭州 亚运会 女子 垒球 比赛 超级 排位赛 环节 当晚 绍兴 体育 文化 中心 垒球场 座无虚席 中国 女垒 战胜 中国台北队 赛后 两队 致意 气氛 融洽 比赛 期间 场馆 体育 颁奖仪式 主任 朱军 圆人 团圆 希望 今晚 比赛 两岸 运动 健儿 共度 中秋 美好 回忆 推动 两岸 体育 文化交流 贡献力量
https://weibo.com/ajax/statuses/searchProfile?uid=1977902724&page=1&q=%E4%BA%9A%E8%BF%90%E4%BC%9A,1977902724,看台海,,,2023年09月30日 20:10,0,1,0,亚运会决赛，中国队中国台北队，观众席的标语亮了! ​,亚运会 决赛 中国队 中国台北队 观众席 标语
https://weibo.com/ajax/statuses/searchProfile?uid=1977902724&page=1&q=%E4%BA%9A%E8%BF%90%E4%BC%9A,1977902724,看台海,,,2023年09月30日 16:45,1,0,1,在30日下午刚结束的网球混双决赛中，中国台北组合梁恩硕、黄琮豪6-2/3-6/4-10遭印度组合博萨莱、博潘纳逆转，获得银牌。 ​,下午 结束 网球 混双 决赛 中国台北 组合 梁恩硕 黄琮豪 印度 组合 博萨莱 博潘纳 逆转 银牌
https://weibo.com/ajax/statuses/searchProfile?uid=1977902724&page=1&q=%E4%BA%9A%E8%BF%90%E4%BC%9A,1977902724,看台海,,,2023年09月30日 13:57,0,1,0, 9月30日，杭州第19届亚运会网球女双比赛在杭州奥体中心网球中心“小莲花”球场举行。两对中国台北选手在决赛中上演精彩对决，最终詹皓晴、詹咏然2:0战胜梁恩硕、李亚轩获得冠军。 ​,杭州 亚运会 网球 比赛 杭州 奥体中心 网球 中心 莲花 球场 两对 中国台北 选手 决赛 上演 精彩 对决 最终 詹皓 詹咏 战胜 梁恩硕 李亚轩 冠军
https://weibo.com/ajax/statuses/searchProfile?uid=2280198017&page=1&q=%E4%BA%9A%E8%BF%90%E4%BC%9A,2280198017,解放军报,,,2023年09月30日 22:02,11,70,5,中国军网杭州9月30日。在刚结束的杭州亚运会田径男子10米决赛中，中国选手谢震业以9秒97的成绩获得冠军。转发，祝贺！ ​,中国 军网 杭州 结束 杭州 亚运会 田径 男子 决赛 中国 选手 谢震业 成绩 冠军 祝贺
https://weibo.com/ajax/statuses/searchProfile?uid=2280198017&page=1&q=%E4%BA%9A%E8%BF%90%E4%BC%9A,2280198017,解放军报,,,2023年09月30日 21:59,6,53,5,中国军网杭州9月30日。在刚结束的杭州亚运会田径女子10米决赛中，中国选手葛曼棋以1秒23的成绩获得冠军。祝贺！ ​,中国 军网 杭州 结束 杭州 亚运会 田径 女子 决赛 中国 选手 葛曼棋 成绩 冠军 祝贺
https://weibo.com/ajax/statuses/searchProfile?uid=2280198017&page=1&q=%E4%BA%9A%E8%BF%90%E4%BC%9A,2280198017,解放军报,,,2023年09月30日 20:21,6,61,4,刚，杭州亚运会跳水女子双人10米跳台决赛，中国组合全红婵、陈芋汐陈乐惊艳亮相，以巨大优势夺得金牌。中国队实现亚运会跳水女子双人10米跳台六连冠。看“水花消失术”图集↓，祝贺！,杭州 亚运会 跳水 女子 双人 跳台 决赛 中国 组合 全红 芋汐 陈乐 惊艳 亮相 优势 夺得 金牌 中国队 亚运会 跳水 女子 双人 跳台 六连冠 水花 消失 图集 祝贺
https://weibo.com/ajax/statuses/searchProfile?uid=2280198017&page=1&q=%E4%BA%9A%E8%BF%90%E4%BC%9A,2280198017,解放军报,,,2023年09月30日 16:25,7,61,5,9月27日下午，杭州第19届亚运会体操女子个人全能决赛在黄龙体育中心体育馆举行，即将年满23岁的“老将”章瑾虽然最终位列第四，却收到了来自全场的掌声。 从实力来看，资格赛排名第一的章瑾占据优势，没有人会想到，不仅这枚个人全能金牌与章瑾无缘，她在比赛中还经历了令人痛心的过程。三次掉杠，不仅章瑾从未有过，就是从整个国际体操比赛的过往看，也极其罕见。“那一刻我真的想要放弃”，章瑾在赛后表示，第三次掉下杠的时候，她几乎崩溃了。如果命运不公，便打破这命运！第四次，章瑾动作完毕稳落地。虽然高低杠的失误基本宣告了她提前退出了金牌的争夺，但她却没有放弃，在接下来的两项中，她分别拼下了全场第二和第一的两个高分，将自己一度落到第10名的总分提升到第四名。赛后章瑾说“其实，不气馁、不放弃、永不言败是每一位运动员的本分，我只是做了我应该做的。”29日，在女子自由操决赛中，章瑾一套动作一气呵成、行云流水，最终获得了13分的好成绩。当大屏幕上她的名字最终位列第一时，她激动地向观众席挥手，现场，掌声雷动！体育的魅力是什么呢？体育的魅力，在于弘扬和展现出的生命之美，在于诠释拼搏向上、挑战超越极限的人生之志，在于传递播撒希望，不向命运屈服的钢铁意志，而这正是体育带个我们的最大魅力，更是你我热爱体育的根本原因。人生之路，道阻且长。普通如你我，在学习中、工作中、生活中，终究会面对一些困境，终究会身处一些艰难中。 我们能做的，不仅是面对人生“繁花美景”时的热情，也要有面对人生“波涛汹涌”时的从容。生活总是这样，不能叫人处满意。你不可能只接受它的“好”，而逃避它的“坏”。亚运赛场，我们看到了23岁姑娘章瑾经历的“坏”，看到了她面对挫折时的坚毅，面对困难时的永不言弃，更看到了搏击风雨后，她最终收获了属于自己职业生涯的“彩虹”。请相信吧，生活中一切困难永远只是你人生的注脚，定义你人生的只有你自己。你最终会发现，那些曾经遇到的困难，受过的苦、扛过的压，终究会成为你站的更高、看的更远的“垫脚石”！跨过去，再回首，轻舟已过万重山！,下午 杭州 亚运会 体操 女子 个人全能 决赛 黄龙 体育中心 体育馆 年满 老将 章瑾 最终 位列 第四 收到 全场 掌声 实力 资格赛 排名 第一 章瑾 占据 优势 人会 想到 个人全能 金牌 章瑾 无缘 比赛 经历 令人 痛心 过程 三次 章瑾 从未有过 是从 国际 体操比赛 过往 罕见 那一刻 真的 想要 放弃 章瑾 赛后 第三次 下杠 崩溃 命运 不公 打破 命运 第四次 章瑾 动作 完毕 落地 高低杠 失误 宣告 提前 退出 金牌 争夺 放弃 两项 拼下 全场 第一 两个 高分 一度 落到 总分 提升 第四名 赛后 章瑾 气馁 放弃 永不言败 一位 运动员 本分 女子 自由操 决赛 章瑾 一套 动作 一气呵成 行云流水 最终 成绩 大屏幕 名字 最终 位列 第一 激动 观众席 挥手 现场 掌声雷动 体育 魅力 体育 魅力 弘扬 展现出 生命 诠释 拼搏 向上 挑战 超越 极限 人生 传递 播撒 希望 命运 屈服 钢铁 意志 体育 魅力 更是 热爱 体育 根本原因 人生 道阻 学习 工作 生活 终究会 面对 困境 终究会 身处 艰难 面对 人生 繁花 美景 热情 面对 人生 波涛汹涌 从容 生活 满意 接受 逃避 亚运 赛场 姑娘 章瑾 经历 面对 挫折 坚毅 面对 困难 永不言弃 搏击 风雨 最终 收获 职业生涯 彩虹 生活 困难 永远 人生 注脚 定义 人生 最终 发现 困难 受过 扛过 终究会 更远 垫脚石 再回首 轻舟 万重山
https://weibo.com/ajax/statuses/searchProfile?uid=1402977920&page=1&q=%E4%BA%9A%E8%BF%90%E4%BC%9A,1402977920,光明日报,,,2023年09月30日 22:22,3,77,18, 9月30日，杭州亚运会田径女子10米决赛，中国选手葛曼棋收获金牌。祝贺她！,杭州 亚运会 田径 女子 决赛 中国 选手 葛曼棋 收获 金牌 祝贺
https://weibo.com/ajax/statuses/searchProfile?uid=1402977920&page=1&q=%E4%BA%9A%E8%BF%90%E4%BC%9A,1402977920,光明日报,,,2023年09月30日 22:13,3,15,2, 9月30日，在杭州亚运会羽毛球男子团体半决赛中，中国队3:1战胜日本队，闯进决赛。继续加油！,杭州 亚运会 羽毛球 男子 团体 半决赛 中国队 战胜 日本队 闯进 决赛 加油
https://weibo.com/ajax/statuses/searchProfile?uid=1402977920&page=1&q=%E4%BA%9A%E8%BF%90%E4%BC%9A,1402977920,光明日报,,,2023年09月30日 22:02,6,51,8, 刚结束的杭州亚运会田径男子10米决赛，中国选手谢震业夺冠。转发祝贺！ ​,结束 杭州 亚运会 田径 男子 决赛 中国 选手 谢震业 夺冠 祝贺
https://weibo.com/ajax/statuses/searchProfile?uid=1402977920&page=1&q=%E4%BA%9A%E8%BF%90%E4%BC%9A,1402977920,光明日报,,,2023年09月30日 21:12,1,15,5, 9月30日，中国选手严思宇努力再努力的严、何超夺得杭州第19届亚运会跳水项目男子双人3米板决赛金牌。祝贺！,中国 选手 严思宇 努力 努力 何超 夺得 杭州 亚运会 跳水 男子 双人 决赛 金牌 祝贺
https://weibo.com/ajax/statuses/searchProfile?uid=1402977920&page=1&q=%E4%BA%9A%E8%BF%90%E4%BC%9A,1402977920,光明日报,,,2023年09月30日 20:45,3,29,1, 9月30日，杭州第19届亚运会田径男子链球比赛，中国选手王琦以72米的成绩夺得金牌。祝贺！,杭州 亚运会 田径 男子 链球 比赛 中国 选手 王琦 成绩 夺得 金牌 祝贺
https://weibo.com/ajax/statuses/searchProfile?uid=1402977920&page=1&q=%E4%BA%9A%E8%BF%90%E4%BC%9A,1402977920,光明日报,,,2023年09月30日 18:33,5,33,13, 刚，中国选手全红婵、陈芋汐陈乐惊艳亮相，夺得杭州亚运会跳水项目女子双人10米跳台决赛金牌。祝贺！,中国 选手 全红 芋汐 陈乐 惊艳 亮相 夺得 杭州 亚运会 跳水 女子 双人 跳台 决赛 金牌 祝贺
https://weibo.com/ajax/statuses/searchProfile?uid=1402977920&page=1&q=%E4%BA%9A%E8%BF%90%E4%BC%9A,1402977920,光明日报,,,2023年09月30日 18:06,0,12,1, 当亚运会遇上中秋佳节，亚运村处都充满了浓厚的节日氛围。记者昨天来到运动员村，偶遇了中国游泳运动员汪雪儿、中国击剑运动员许诺和中国香港田径运动员梅政揚，他们都在体验节日特色活动。戳视频，来体验沉浸式“探村”吧~,亚运会 遇上 中秋佳节 亚运村 充满 浓厚 节日 氛围 昨天 来到 运动员 偶遇 中国 游泳 运动员 雪儿 中国 击剑 运动员 许诺 中国香港 田径 运动员 梅政揚 体验 节日 特色 活动 体验 沉浸 探村
https://weibo.com/ajax/statuses/searchProfile?uid=1402977920&page=1&q=%E4%BA%9A%E8%BF%90%E4%BC%9A,1402977920,光明日报,,,2023年09月30日 14:26,4,29,2, 9月30日，在杭州亚运会羽毛球女子团体半决赛上，中国队以3比1战胜日本队，晋级决赛。,杭州 亚运会 羽毛球 女子 团体 半决赛 中国队 战胜 日本队 晋级 决赛
https://weibo.com/ajax/statuses/searchProfile?uid=1402977920&page=1&q=%E4%BA%9A%E8%BF%90%E4%BC%9A,1402977920,光明日报,,,2023年09月30日 12:03,3,13,2, 谁家场馆可以看星啊？就在这里，杭州电子科技大学体育馆击剑比赛现场。这视觉效果，你心动了吗？,谁家 场馆 杭州 电子科技 大学 体育馆 击剑 比赛 现场 视觉效果 心动
https://weibo.com/ajax/statuses/searchProfile?uid=1402977920&page=1&q=%E4%BA%9A%E8%BF%90%E4%BC%9A,1402977920,光明日报,,,2023年09月30日 11:39,1,9,0, 杭州亚运会的吉祥物是一组名为“江南忆”的机器人：戴着“神人兽面纹”头饰的“琮”，灵感源自良渚古城遗址；戴着荷叶形头饰，以三潭印月为顶的“莲”，代表西湖；头顶钱江潮的“宸”，额头嵌以拱宸桥图案，代表京杭大运河。本届亚运会将杭州的三大世界文化遗产融入吉祥物的形象设计，融合了杭州的历史人文、自然生态和创新基因。从空中鸟瞰，杭州奥体中心体育场宛若一朵绽放在钱塘江畔的“莲花”，造型效果奇佳。场馆造型取意于古老丝绸纹理与编织体系，建筑体态源于钱塘江水的动态。杭州亚运会奖牌“湖山”，将方形玉琮和圆形奖牌融为一体。就连“小而美”的杭州亚运会奖牌绶带，也采取了润泽渐变的“虹韵紫”“映日红”“水墨白”三色交融，于细微处展露出含蓄深情的杭州生活美学气韵。 ​,杭州 亚运会 吉祥物 一组 名为 江南 机器人 神人 兽面 头饰 灵感 源自 良渚 古城 遗址 荷叶 头饰 三潭印月 代表 西湖 头顶 钱江潮 额头 嵌以 图案 代表 京杭大运河 本届 亚运会 杭州 三大 世界 文化遗产 融入 吉祥物 形象设计 融合 杭州 历史 人文 自然生态 创新 基因 空中 鸟瞰 杭州 奥体中心 体育场 宛若 一朵 绽放 钱塘江 莲花 造型 效果 奇佳 场馆 造型 取意 古老 丝绸 纹理 编织 体系 建筑 体态 源于 钱塘江 动态 杭州 亚运会 奖牌 湖山 方形 玉琮 圆形 奖牌 融为一体 杭州 亚运会 奖牌 绶带 润泽 渐变 虹韵 映日红 水墨 交融 细微处 展露出 含蓄 深情 杭州 生活 美学 气韵
https://weibo.com/ajax/statuses/searchProfile?uid=1663072851&page=1&q=%E4%BA%9A%E8%BF%90%E4%BC%9A,1663072851,中国日报,,,2023年09月30日 22:15,17,185,17,刚，杭州亚运会乒乓球混双金牌赛。王楚钦/孙颖莎战胜林高远/王艺迪，夺得冠军。恭喜！,杭州 亚运会 乒乓球 混双 金牌 王楚钦 孙颖莎 战胜 高远 王艺迪 夺得 冠军 恭喜
https://weibo.com/ajax/statuses/searchProfile?uid=1663072851&page=1&q=%E4%BA%9A%E8%BF%90%E4%BC%9A,1663072851,中国日报,,,2023年09月30日 22:10,5,45,5, 9月29日，杭州亚运会女子10米决赛，最后一名选手在雨中奋力奔跑。现场观众一起为她加油鼓掌。网友：这就是体育精神！,杭州 亚运会 女子 决赛 一名 选手 奋力 奔跑 现场 观众 加油 鼓掌 体育精神
https://weibo.com/ajax/statuses/searchProfile?uid=1663072851&page=1&q=%E4%BA%9A%E8%BF%90%E4%BC%9A,1663072851,中国日报,,,2023年09月30日 21:28,1,26,2,在今天下午结束的杭州亚运会男篮小组赛中，约旦以87-62战胜小组最后一个对手菲律宾，锁定八强席位。约旦队头号得分手朗戴·霍利斯-杰佛森全场得到24分、6个篮板和9次助攻，率队晋级。因为身穿同样的24号球衣，身材、体型和样貌 ​,今天下午 结束 杭州 亚运会 男篮 小组赛 约旦 战胜 小组 对手 菲律宾 锁定 八强 席位 约旦 头号 得分手 霍利斯 佛森 全场 篮板 助攻 率队 晋级 身穿 球衣 身材 体型 样貌
https://weibo.com/ajax/statuses/searchProfile?uid=1663072851&page=1&q=%E4%BA%9A%E8%BF%90%E4%BC%9A,1663072851,中国日报,,,2023年09月30日 20:49,1,31,4,9月30日，何超与严思宇努力再努力的严在亚运会跳水项目男子双人3米板中获胜，拿下中国跳水队杭州亚运第2金。,何超 严思宇 努力 努力 亚运会 跳水 男子 双人 获胜 拿下 中国跳水队 杭州 亚运
https://weibo.com/ajax/statuses/searchProfile?uid=1663072851&page=1&q=%E4%BA%9A%E8%BF%90%E4%BC%9A,1663072851,中国日报,,,2023年09月30日 20:20,19,274,36,今天，杭州亚运会乒乓球女双1/4决赛，中国组合孙颖莎/王曼昱1-3负于日本组合张本美和/木原美悠，陈梦/王艺迪1-3不敌印度组合，止步亚运会8强。国乒加油，下个赛场继续努力！ ​,杭州 亚运会 乒乓球 决赛 中国 组合 孙颖莎 王曼昱 负于 日本 组合 张本 美和 木原 陈梦 王艺迪 不敌 印度 组合 止步 亚运会 国乒 加油 赛场 努力
https://weibo.com/ajax/statuses/searchProfile?uid=1663072851&page=1&q=%E4%BA%9A%E8%BF%90%E4%BC%9A,1663072851,中国日报,,,2023年09月30日 18:06,14,87,5,刚，杭州亚运会跳水女子双人10米跳台决赛，中国组合全红婵、陈芋汐陈乐惊艳亮相，默契展现“水花消失术”，夺得冠军。，祝贺！,杭州 亚运会 跳水 女子 双人 跳台 决赛 中国 组合 全红 芋汐 陈乐 惊艳 亮相 默契 展现 水花 消失 夺得 冠军 祝贺
https://weibo.com/ajax/statuses/searchProfile?uid=1663072851&page=1&q=%E4%BA%9A%E8%BF%90%E4%BC%9A,1663072851,中国日报,,,2023年09月30日 15:30,8,68,8,9月29日，亚运会游泳比赛迎来收官日。在女子50米蝶泳决赛中，中国选手张雨霏分获金银牌，日本选手池江璃花子获得铜牌。在颁奖台上，张雨霏头上和池江手腕上的“熊猫”格外惹眼。张雨霏在赛后表示，那是她送给池江的礼物，希望池江还能再来中国。 ​,亚运会 游泳 比赛 迎来 收官 女子 决赛 中国 选手 张雨霏 分获 金银牌 日本 选手 池江璃 花子 铜牌 颁奖 台上 张雨霏 头上 池江 手腕 熊猫 惹眼 张雨霏 赛后 送给 池江 礼物 希望 池江 中国
https://weibo.com/ajax/statuses/searchProfile?uid=1663072851&page=1&q=%E4%BA%9A%E8%BF%90%E4%BC%9A,1663072851,中国日报,,,2023年09月30日 13:57,2,59,1,今天，杭州亚运会网球男单决赛，中国选手张之臻2比0击败日本选手绵贯阳介，摘得金牌。拼尽全力赢得胜利，恭喜！,杭州 亚运会 网球 决赛 中国 选手 张之臻 击败 日本 选手 绵贯 阳介 摘得 金牌 尽全力 赢得 胜利 恭喜
https://weibo.com/ajax/statuses/searchProfile?uid=1663072851&page=1&q=%E4%BA%9A%E8%BF%90%E4%BC%9A,1663072851,中国日报,,,2023年09月30日 13:32,4,74,10,今天，杭州亚运会女子10米跨栏预赛，。赛后，吴艳妮表示，对12秒80的成绩不太满意，“感觉没有睡醒…”之前的成都大运会上，她跑出个人最好成绩获银牌。明晚，女子10米栏决赛将进行，吴艳妮表示，希望个人成绩再获突破。一起为两位姑娘加油！ ​,杭州 亚运会 女子 跨栏 预赛 赛后 吴艳妮 成绩 满意 睡醒 成都 大运会 成绩 银牌 明晚 女子 决赛 吴艳妮 希望 成绩 突破 两位 姑娘 加油
https://weibo.com/ajax/statuses/searchProfile?uid=1663072851&page=1&q=%E4%BA%9A%E8%BF%90%E4%BC%9A,1663072851,中国日报,,,2023年09月30日 08:04,2,27,7,中国跳水“梦之队”亮相，将在女子双人10米跳台联手上演“水花消失术”；田径赛场； 乒乓球混合双打决赛中国队提前锁定金牌；中国举重队登场…更多精彩， ​一起期待！,中国 跳水 梦之队 亮相 女子 双人 跳台 联手 上演 水花 消失 田径赛 乒乓球 混合双打 决赛 中国队 提前 锁定 金牌 中国 举重队 登场 精彩 期待
https://weibo.com/ajax/statuses/searchProfile?uid=1663072851&page=1&q=%E4%BA%9A%E8%BF%90%E4%BC%9A,1663072851,中国日报,,,2023年09月30日 01:40,18,118,18,9月29日正值中秋佳节，杭州亚运会组委会准备了丰富多彩的活动，力求让来自各地的运动员们、教练员和工作人员们在中国过上一个难忘的中秋节。点击视频，跟着中国日报记者的镜头去看一看吧！​,中秋佳节 杭州 亚运会 组委会 丰富多彩 活动 力求 运动员 教练员 工作人员 中国 难忘 中秋节 点击 跟着 中国日报 镜头 看一看
https://weibo.com/ajax/statuses/searchProfile?uid=1663072851&page=2&q=%E4%BA%9A%E8%BF%90%E4%BC%9A,1663072851,中国日报,,,2023年09月30日 01:22,12,347,20, 29日进行的杭州亚运会乒乓球女子双打1/8决赛中，来自中国香港的杜凱琹、朱成竹组合在0:2落后于韩国队的情况下，连追三局，最终以3:2逆转获胜，进入八强。杜凱琹在赛后采访中坦言，是观众一声的呐喊帮助她们一点追回比分。 ​,杭州 亚运会 乒乓球 女子双打 决赛 中国香港 成竹 组合 落后 韩国队 情况 三局 最终 逆转 获胜 八强 赛后 采访 观众 一声 呐喊 一点 追回 比分
https://weibo.com/ajax/statuses/searchProfile?uid=3515639462&page=1&q=%E4%BA%9A%E8%BF%90%E4%BC%9A,3515639462,科技日报,,,2023年09月30日 22:45,1,6,0,刚，杭州亚运会乒乓球混双决赛，中国组合王楚钦_/孙颖莎4-1战胜-林高远/王艺迪214，获得冠军。祝贺！,杭州 亚运会 乒乓球 混双 决赛 中国 组合 王楚钦 孙颖莎 战胜 高远 王艺迪 冠军 祝贺
