页码链接,用户id,用户,用户名链接,来自用户名,发表日期,点赞量,转发量,评论数量,content,分词
https://weibo.com/ajax/statuses/searchProfile?uid=1726918143&page=1&q=%E4%BA%9A%E8%BF%90%E4%BC%9A,1726918143,中国青年报,,,2023年10月05日 08:28,10,49,19,10月4日晚，在杭州亚运会男篮半决赛被菲律宾男篮逆转之后，中国男篮一度宣布取消赛后新闻发布会。但由于不符合亚运会的相关规则，中国男篮在驱车离开之后，主帅乔尔杰维奇、队长赵继伟以及中国篮协主席姚明又回到了新闻发布会的现场。在恢复召开的新闻发布会上，有媒体记者提问主帅乔尔杰维奇，谁会为本场比赛的失利负责，在乔帅主动揽责时，队长赵继伟突然“插话”力挺乔帅。赵继伟表示，中国篮球不能一输球就把责任推给一个人：“是队员执行力不够，他真的做了很多，是我们做不到或者理解不了。他真的希望中国篮球好，希望年轻球员可以进步。他希望为中国篮球建立一个体系，他知道世界篮球是什么样的，知道世界强队是什么样的。”中国男篮4日在一度领先20分的情况下，以76:7负于菲律宾男篮，没能闯入杭州亚运会男篮比赛的决赛。这次输球是今年夏天中国男篮世界杯惨败无缘奥运会之后的又一次惨痛失利。,日晚 杭州 亚运会 男篮 半决赛 菲律宾 男篮 逆转 中国男篮 一度 取消 赛后 符合 亚运会 相关 规则 中国男篮 驱车 离开 主帅 乔尔杰 维奇 队长 赵继伟 中国篮协 主席 姚明 回到 现场 恢复 媒体 提问 主帅 乔尔杰 维奇 本场 比赛 失利 负责 乔帅 主动 揽责 队长 赵继伟 插话 乔帅 赵继伟 中国篮球 输球 责任 队员 执行力 真的 不到 理解 真的 希望 中国篮球 希望 年轻 球员 希望 中国篮球 建立 体系 世界 篮球 世界 强队 中国男篮 一度 领先 情况 负于 菲律宾 男篮 闯入 杭州 亚运会 男篮 比赛 决赛 输球 今年夏天 中国男篮 世界杯 惨败 无缘 奥运会 惨痛 失利
https://weibo.com/ajax/statuses/searchProfile?uid=1726918143&page=1&q=%E4%BA%9A%E8%BF%90%E4%BC%9A,1726918143,中国青年报,,,2023年10月05日 08:27,2,20,5,10月5日，杭州亚运会赛场将产生36枚金牌，中国选手在举重、拳击、龙舟等项目上具备冲金实力。其中，最受关注的赛事当属在中国队与日本队之间展开的女篮决赛，中国女篮期待卫冕，日本女篮希望重新成为亚洲霸主。田径项目进入收官日，将产生男女马拉松金牌。拳击赛场也将产生最后6金。中青报·中青网数智人记者青小璇将陪伴大家一起感受“智能亚运”。,杭州 亚运会 赛场 金牌 中国 选手 举重 拳击 龙舟 具备 冲金 实力 关注 赛事 中国队 日本队 之间 展开 女篮 决赛 中国女篮 期待 卫冕 日本 女篮 希望 亚洲 霸主 田径项目 收官 男女 马拉松 金牌 拳击 赛场 中青报 中青网 智人 青小璇 陪伴 感受 智能 亚运
https://weibo.com/ajax/statuses/searchProfile?uid=1726918143&page=1&q=%E4%BA%9A%E8%BF%90%E4%BC%9A,1726918143,中国青年报,,,2023年10月05日 07:00,2,27,9,让祖国见证幸福！火箭军某部举行“情定军营 相伴一生”集体婚礼，来“军事天地”栏目感受这份甜蜜！第七届小十月戏剧节暨“文学之桥连五洲”全球华侨华人青少年征文大赛颁奖，来“直播”栏目见证荣耀时刻！亚运会期间，垒球场上，中菲选手一起过生日，来“我们的亚运”栏目分享喜悦！报告显示宠物医生有超670亿元大市场，为何缺人才？宠物医生培养为何难？什么样性格的人适合做宠物医生？来栏目，打开宠物医院的年轻实习生！…中青报客户端热点频道，以及中国青年网、中青在线首屏，一眼就能看到“温暖的”可视化栏目，有青春向上向善好活法的地方，就有中青报温暖的。 ​,祖国 见证 幸福 火箭 某部 情定 军营 相伴 一生 集体婚礼 军事天地 栏目 感受 这份 甜蜜 第七届 十月 戏剧节 文学 之桥 五洲 全球 华侨 华人 青少年 征文 大赛 颁奖 栏目 见证 荣耀 时刻 亚运会 期间 垒球场 选手 过生日 亚运 栏目 分享 喜悦 报告 显示 宠物 医生 亿元 市场 人才 宠物 医生 培养 性格 适合 宠物 医生 栏目 打开 宠物医院 年轻 实习生 中青报 中国 在线 首屏 一眼 温暖 可视化 栏目 青春 向上 向善 活法 地方 中青报 温暖
https://weibo.com/ajax/statuses/searchProfile?uid=1726918143&page=1&q=%E4%BA%9A%E8%BF%90%E4%BC%9A,1726918143,中国青年报,,,2023年10月04日 21:21,17,261,39, 10月4日晚，中国女排在杭州亚运会女排位赛组的一场比赛中以3:0战胜韩国队。比赛中，中国女排也遇到了一些困难。，重要的是队员们要保持拼劲和精气神。,日晚 中国女排 杭州 亚运会 排位赛 一场 比赛 战胜 韩国队 比赛 中国女排 困难 队员 拼劲 精气神
https://weibo.com/ajax/statuses/searchProfile?uid=3840768703&page=2&q=%E4%BA%9A%E8%BF%90%E4%BC%9A,3840768703,工人日报,,,2023年10月04日 09:52,0,3,0,10月4日上午，杭州亚运会混合35公里竞走比赛在智慧新天地沿江观景带展开，由切阳什姐、白雪莹、王钦和贺相红组成的中国队夺得冠军。,上午 杭州 亚运会 混合 公里 竞走比赛 智慧 新天地 沿江 观景 展开 切阳什 白雪 王钦 贺相红 中国队 夺得 冠军
https://weibo.com/ajax/statuses/searchProfile?uid=3840768703&page=2&q=%E4%BA%9A%E8%BF%90%E4%BC%9A,3840768703,工人日报,,,2023年10月04日 09:30,0,0,0, 近日，在杭州亚运会赛场上，机器狗狂奔捡铁饼，四条小腿忙个不停。据了解，这是全球赛事上首次使用机器狗运送铁饼，一场比赛大约可替人跑720米。为中国制造点赞！ ​,近日 杭州 亚运会 赛场 机器 狂奔 四条 小腿 不停 全球 赛事 首次 机器 运送 一场 比赛 替人 中国 制造
https://weibo.com/ajax/statuses/searchProfile?uid=3840768703&page=2&q=%E4%BA%9A%E8%BF%90%E4%BC%9A,3840768703,工人日报,,,2023年10月04日 09:00,8,87,5,杭州亚运会进行中，中国队持续领跑奖牌榜，多位亚运健儿频摘金夺银。张雨霏六金收官，王楚钦包揽四金，年仅17岁的黄雨婷成为杭州亚运会上的首个“三冠王”…网友直呼！荣誉背后是无数艰辛付出，祝贺中国队，致敬所有拼搏！ ​,杭州 亚运会 中国队 持续 领跑 奖牌榜 多位 亚运 健儿 摘金 张雨霏 六金 收官 王楚钦 包揽 四金 黄雨婷 杭州 亚运会 首个 冠王 直呼 荣誉 背后 无数 艰辛 付出 祝贺 中国队 致敬 拼搏
https://weibo.com/ajax/statuses/searchProfile?uid=3840768703&page=2&q=%E4%BA%9A%E8%BF%90%E4%BC%9A,3840768703,工人日报,,,2023年10月03日 23:42,0,0,0,今天，杭州亚运会跳水女子10米跳台决赛，中国选手全红婵夺得冠军，其中全红婵第二跳动作拿到满分，现场7名裁判都打出了10分。赛后全红婵接受采访时直言，自己和东京奥运会时期相比，最大的变化是长高了，体重也有变化。赛后她跟镜头比心，感谢粉丝来现场看比赛。 ​,杭州 亚运会 跳水 女子 跳台 决赛 中国 选手 全红 夺得 冠军 全红 动作 拿到 满分 现场 裁判 打出 赛后 全红 接受 采访 东京 奥运会 时期 相比 变化 体重 变化 赛后 镜头 感谢 粉丝 现场 比赛
https://weibo.com/ajax/statuses/searchProfile?uid=3840768703&page=2&q=%E4%BA%9A%E8%BF%90%E4%BC%9A,3840768703,工人日报,,,2023年10月03日 22:18,4,149,8,今天，杭州亚运会跳水女子10米跳台决赛，中国选手全红婵夺得冠军，陈芋汐摘银，马来西亚选手潘德莱拉获得铜牌。四战亚运，四夺奖牌，马来西亚跳水老将潘德莱拉泪洒赛场：没有人认为我13年后还能夺得奖牌。（工人日报客户端） ​,杭州 亚运会 跳水 女子 跳台 决赛 中国 选手 全红 夺得 冠军 芋汐 马来西亚 选手 潘德 莱拉 铜牌 四战 亚运 奖牌 马来西亚 跳水 老将 潘德 莱拉 赛场 年后 夺得 奖牌
https://weibo.com/ajax/statuses/searchProfile?uid=3840768703&page=2&q=%E4%BA%9A%E8%BF%90%E4%BC%9A,3840768703,工人日报,,,2023年10月03日 18:50,1,3,0,在3日进行的杭州亚运会跳水女子10米跳台决赛中，全红婵第二跳动作拿到满分，现场7名裁判都打出了10分。 ,杭州 亚运会 跳水 女子 跳台 决赛 全红 动作 拿到 满分 现场 裁判 打出
https://weibo.com/ajax/statuses/searchProfile?uid=3840768703&page=2&q=%E4%BA%9A%E8%BF%90%E4%BC%9A,3840768703,工人日报,,,2023年10月03日 18:29,0,1,0,杭州亚运会跳水女子10米跳台决赛，中国选手全红婵夺得冠军，陈芋汐摘银。，网友：“神仙打架”级的较量。两位姑娘都很棒！恭喜！ ​,杭州 亚运会 跳水 女子 跳台 决赛 中国 选手 全红 夺得 冠军 芋汐 神仙 打架 较量 两位 姑娘 很棒 恭喜
https://weibo.com/ajax/statuses/searchProfile?uid=3840768703&page=2&q=%E4%BA%9A%E8%BF%90%E4%BC%9A,3840768703,工人日报,,,2023年10月03日 18:00,1,2,0,杭州亚运会男单比赛后，樊振东接受专访时表示，拿冠军球队每个人都付出难以想象的努力，一直在“争第一”而不是“保第一”。此外：比赛期间，比较紧张，专注比赛。国乒好样的，小胖继续加油！,杭州 亚运会 比赛 樊振东 接受 专访 冠军 球队 付出 难以想象 努力 第一 第一 比赛 期间 紧张 专注 比赛 国乒 好样 小胖 加油
https://weibo.com/ajax/statuses/searchProfile?uid=3840768703&page=2&q=%E4%BA%9A%E8%BF%90%E4%BC%9A,3840768703,工人日报,,,2023年10月03日 16:36,2,38,0,游泳馆里千人合唱《千年等一回》、国庆当天乒乓球赛场高唱《我爱你中国》…最近，杭州亚运会赛场的歌曲串烧彻底火出圈。这些是如何挑选的？具体有哪些人负责？《工人日报》记者专访了杭州奥体中心游泳馆运行团队体育展示与颁奖仪式主任鲁莹，为您揭秘“亚运官方氛围组”！,游泳馆 千人 合唱 千年 一回 国庆 当天 乒乓球赛 高唱 我爱你 中国 杭州 亚运会 赛场 歌曲 串烧 火出圈 挑选 负责 专访 杭州 奥体中心 游泳馆 运行 团队 体育 颁奖仪式 主任 鲁莹 揭秘 亚运 氛围
https://weibo.com/ajax/statuses/searchProfile?uid=3840768703&page=2&q=%E4%BA%9A%E8%BF%90%E4%BC%9A,3840768703,工人日报,,,2023年10月03日 13:30,0,0,0,#中国台北选手回应0秒反超韩国夺冠# #韩国队提前庆祝被0秒极限反超#2日的杭州亚运会轮滑赛场上演了戏剧性一幕：韩国队以为胜利在握而提前庆祝，结果被中国台北队以0秒极限反超，丢掉了男子速度轮滑30米接力金牌。 ​,中国台北 选手 回应 反超 韩国 夺冠 韩国队 提前 庆祝 极限 反超 杭州 亚运会 轮滑 赛场 上演 戏剧性 一幕 韩国队 胜利 在握 提前 庆祝 中国台北队 极限 反超 丢掉 男子 速度 轮滑 接力 金牌
https://weibo.com/ajax/statuses/searchProfile?uid=3840768703&page=2&q=%E4%BA%9A%E8%BF%90%E4%BC%9A,3840768703,工人日报,,,2023年10月03日 12:29,1,0,0,3日上午进行的杭州亚运会跳水女子10米台预赛中，全红婵陈芋汐以排名第一、第二的成绩晋级当晚决赛。继续加油！ ​,上午 杭州 亚运会 跳水 女子 预赛 红婵陈 芋汐 排名 第一 成绩 晋级 当晚 决赛 加油
https://weibo.com/ajax/statuses/searchProfile?uid=3840768703&page=2&q=%E4%BA%9A%E8%BF%90%E4%BC%9A,3840768703,工人日报,,,2023年10月03日 11:37,0,1,0,10月2日，杭州第19届亚运会电子竞技刀塔决赛中，中国队以2比1击败蒙古队，获得该项赛事的金牌。,杭州 亚运会 电子竞技 刀塔 决赛 中国队 击败 蒙古 该项 赛事 金牌
https://weibo.com/ajax/statuses/searchProfile?uid=3840768703&page=2&q=%E4%BA%9A%E8%BF%90%E4%BC%9A,3840768703,工人日报,,,2023年10月03日 10:44,0,11,0,杭州亚运会结束后，国乒的目光已锁定巴黎。王楚钦表示自己输得多了，所以心态更平静，还没有展望巴黎，尽可能在内部竞争中脱颖而出。,杭州 亚运会 结束 国乒 目光 锁定 巴黎 王楚钦 输得 心态 平静 展望 巴黎 内部 竞争 脱颖而出
https://weibo.com/ajax/statuses/searchProfile?uid=3840768703&page=2&q=%E4%BA%9A%E8%BF%90%E4%BC%9A,3840768703,工人日报,,,2023年10月03日 09:24,0,1,0,杭州亚运会上，除了奋勇争先的运动健儿，气氛组也凭实力嗨动全场。游泳比赛前放《千年等一回》，10米跳台播放改编版《你要跳舞吗》，乒乓男团夺冠响起《我是如此相信》.网友直呼“太会整活儿了！”，杭州亚运合集，一起听！ ,杭州 亚运会 奋勇争先 运动 健儿 气氛 实力 全场 游泳 比赛 前放 千年 一回 跳台 播放 改编 跳舞 乒乓 男团 夺冠 响起 直呼 太会 活儿 杭州 亚运 合集
https://weibo.com/ajax/statuses/searchProfile?uid=1726918143&page=2&q=%E4%BA%9A%E8%BF%90%E4%BC%9A,1726918143,中国青年报,,,2023年10月04日 21:09,7,31,7,10月4日晚，绍兴柯桥羊山攀岩中心，中国攀岩队一扫昨日在男、女个人速度决赛中只收获2枚银牌的郁闷，将更加刺激的男子团体速度接力赛（张亮、伍鹏、王欣尚）和女子团体速度接力赛（张少琴、牛笛、邓丽娟）两枚金牌收入囊中。其中女子团体速度接力赛在第三棒逆转印尼队，夺金殊为不易。本届亚运会攀岩项目共设6个单项，在接下来的男、女攀石难度两项全能比赛中，中国攀岩好手仍将全力以赴冲击金牌。 ​,日晚 绍兴 柯桥 羊山 攀岩 中心 中国 攀岩 昨日 速度 决赛 收获 银牌 郁闷 刺激 男子 团体 速度 接力赛 张亮 伍鹏 王欣尚 女子 团体 速度 接力赛 张少琴 牛笛 邓丽娟 两枚 金牌 收入 囊中 女子 团体 速度 接力赛 第三 逆转 印尼队 夺金 殊为 不易 本届 亚运会 攀岩 单项 女攀石 难度 两项 全能 比赛 中国 攀岩 好手 全力以赴 冲击 金牌
https://weibo.com/ajax/statuses/searchProfile?uid=1726918143&page=2&q=%E4%BA%9A%E8%BF%90%E4%BC%9A,1726918143,中国青年报,,,2023年10月04日 20:44,3,15,5,10月4日晚，绍兴柯桥羊山攀岩中心，30余名现场观众不虚此行：除了令人惊叹的“岩壁芭蕾”，暖场的宣传片、背景音乐、灯光秀和热闹互动，都让这场亚运攀岩决赛被包装成“观众最乐于接受的体育产品”—“赛场体育展示”在杭州亚运会为观众提供了良好的观赛体验，按照攀岩赛场体育展示团队的说法，“所做一切，都为观众满意。” ​,日晚 绍兴 柯桥 羊山 攀岩 中心 余名 现场 观众 不虚此行 令人惊叹 岩壁 芭蕾 暖场 宣传片 背景音乐 灯光 热闹 互动 这场 亚运 攀岩 决赛 包装 观众 乐于 接受 体育 产品 赛场 体育 杭州 亚运会 观众 提供 观赛 体验 攀岩 赛场 体育 团队 说法 观众 满意
https://weibo.com/ajax/statuses/searchProfile?uid=1726918143&page=2&q=%E4%BA%9A%E8%BF%90%E4%BC%9A,1726918143,中国青年报,,,2023年10月04日 20:35,2,34,6,10月4日晚进行的杭州亚运会女排位赛组的一场比赛上，中国女排以3:0战胜韩国队（25:12、25:21、25:16）。失去了金软景的韩国女排，整体实力已经下滑到亚洲二流。中国女排直落三局拿下韩国队也在情理之中。不过，比赛第二局中国女排与韩国女排打得较为胶着，甚至一度比分落后。这样的比赛过程对于志在夺取本届亚运会冠军的中国女排来说，还是要引起重视。按照计划，中国女排将在下一场迎战越南队。 ​,日晚 杭州 亚运会 排位赛 一场 比赛 中国女排 战胜 韩国队 软景 韩国 女排 整体实力 下滑 亚洲 二流 中国女排 直落 三局 拿下 韩国队 情理之中 比赛 第二局 中国女排 韩国 女排 胶着 一度 比分 落后 比赛 过程 志在 夺取 本届 亚运会 冠军 中国女排 重视 计划 中国女排 下一场 迎战 越南
https://weibo.com/ajax/statuses/searchProfile?uid=1726918143&page=2&q=%E4%BA%9A%E8%BF%90%E4%BC%9A,1726918143,中国青年报,,,2023年10月04日 19:40,3,15,9,10月4日下午，杭州体育馆，本届亚运会拳击女子54公斤级决赛，中国选手常园2：3惜败朝鲜拳手方哲美，未能捧金而归。“从2018年亚运会到东京奥运会再到这次杭州亚运会，经过4年洗礼，我特别想赢这枚金牌，本来中距离（进攻）是我强项，最近一直练得挺好，但今天没有打出来，打完自己都不觉得累，正常的比赛打完应该很累才对。”常园在赛后毫不吝啬对自己的批评：“其实我应该更专注于比赛，我有的时候想法太多了，接下来备战巴黎奥运会这一年，我应该让自己内心更加强大，努力沉下心来，更上一层楼。”,下午 杭州 体育馆 本届 亚运会 拳击 女子 公斤 决赛 中国 选手 常园 惜败 朝鲜 拳手 方哲美 未能 金而归 亚运会 东京 奥运会 杭州 亚运会 洗礼 特别 金牌 本来 中距离 进攻 强项 比赛 常园 赛后 吝啬 批评 专注 比赛 想法 备战 巴黎 奥运会 一年 内心 强大 努力 沉下 心来 更上一层楼
https://weibo.com/ajax/statuses/searchProfile?uid=1726918143&page=2&q=%E4%BA%9A%E8%BF%90%E4%BC%9A,1726918143,中国青年报,,,2023年10月04日 16:50,7,78,4,竞走名将切阳什姐今天将收获两枚金牌，一枚亚运会金牌来自当下3岁的自己，另一枚奥运金牌本应属于2岁的切阳什姐，但它“迟到”了10年，今晚将以万众瞩目的方式递补到她手中。去年3月，由于伦敦奥运会女子20公里竞走冠军拉什马诺娃的成绩被取消，切阳什姐、刘虹、吕秀芝等3位中国选手有望递补金、银、铜牌。今年3月，国际奥委会执委会宣布部分奥运奖牌的重新分配计划，确定了切阳什姐的奥运冠军身份。而在今晚，奖牌递补仪式将举行。“其实那枚奥运金牌对我来说已经没有太多意义，不会改变我的想法，也不会改变我的目标，或许会带来更大的压力。”在这位曾自嘲“千年老二”的中国竞走名将看来，时过境迁，反而今天夺得的这枚亚运会团体金牌能给她更多信心。,竞走 名将 切阳什 收获 两枚 金牌 一枚 亚运会 金牌 一枚 奥运金牌 切阳什 迟到 今晚 万众瞩目 方式 递补 手中 去年 伦敦 奥运会 女子 公里 竞走 冠军 拉什 诺娃 成绩 取消 切阳什 刘虹 吕秀芝 中国 选手 有望 递补 铜牌 国际奥委会执委会 奥运 奖牌 重新分配 计划 了切 阳什姐 奥运冠军 身份 今晚 奖牌 递补 仪式 奥运金牌 意义 改变 想法 改变 目标 带来 压力 这位 自嘲 千年老二 中国 竞走 名将 时过境迁 夺得 亚运会 团体 金牌 信心
https://weibo.com/ajax/statuses/searchProfile?uid=1726918143&page=2&q=%E4%BA%9A%E8%BF%90%E4%BC%9A,1726918143,中国青年报,,,2023年10月04日 16:21,7,59,13,10月4日，杭州亚运会射箭项目混合团体1/4决赛，在富阳银湖体育中心举行。中国组合海丽玕、魏绍轩以0:6不敌伊朗组合法拉赫、沙巴尼止步8强。比赛中，女选手海丽玕在第二局第一箭中，出现了罕见的脱靶，这在很大程度上影响了个人和团体的发挥。赛后，中国组合和教练，都没有接受采访，海丽玕因为这次失误非常自责，有队友一直陪伴在已经哭红双眼的海丽玕身边，安慰她的情绪。,杭州 亚运会 射箭 混合 团体 决赛 富阳 银湖 体育中心 中国 组合 魏绍轩 不敌 伊朗 组合法 拉赫 沙巴 止步 比赛 女选手 第二局 第一 罕见 脱靶 很大 程度 影响 团体 发挥 赛后 中国 组合 教练 接受 采访 失误 自责 队友 陪伴 双眼 身边 安慰 情绪
https://weibo.com/ajax/statuses/searchProfile?uid=1726918143&page=2&q=%E4%BA%9A%E8%BF%90%E4%BC%9A,1726918143,中国青年报,,,2023年10月04日 15:09,5,26,6, 近日，在杭州亚运会运动员村，一只栩如生的“加油鸭”引起运动员们的关注。这群可爱的“加油鸭”，来自浙江省杭州市余杭区百丈镇，由废弃的木雕碎料和笋壳废物转化而来。 “加油鸭”因其萌酷的外形、小巧精致的设计，受到了运动员的喜爱。土布纺织技艺非遗代表性传承人、传梭博物馆长郑芬兰在接受中青报·中青网记者采访时表示，他们想通过这一只小的“加油鸭”，传递“无废亚运”的理念。,近日 杭州 亚运会 运动员 一只 栩如生 加油 运动员 关注 可爱 加油 浙江省 杭州市 余杭区 百丈 废弃 木雕 碎料 笋壳 废物 转化 加油 因其 外形 小巧 精致 设计 运动员 喜爱 土布 纺织 技艺 代表性 传承 传梭 博物馆 长郑 芬兰 接受 中青报 中青网 采访 一只 加油 传递 亚运 理念
https://weibo.com/ajax/statuses/searchProfile?uid=1726918143&page=2&q=%E4%BA%9A%E8%BF%90%E4%BC%9A,1726918143,中国青年报,,,2023年10月04日 13:59,5,42,8, 10月3日，杭州亚运会女子50公斤级决赛，中国女拳手吴愉（右）对战泰国拳手楚他玛·拉沙。吴愉最终以5:0的比分击败对手，夺得本届亚运会拳击项目的首金。并获得巴黎奥运会门票。,杭州 亚运会 女子 公斤 决赛 中国 拳手 泰国拳 手楚 拉沙 最终 比分 击败 对手 夺得 本届 亚运会 拳击 首金 巴黎 奥运会 门票
https://weibo.com/ajax/statuses/searchProfile?uid=1726918143&page=2&q=%E4%BA%9A%E8%BF%90%E4%BC%9A,1726918143,中国青年报,,,2023年10月04日 12:26,7,80,29, 3：4不敌日本队，中国女足止步本届亚运会女足半决赛，比赛结束后许久，中国女足球员和主教练水庆霞才登上返程的大巴车，对于这场比分差距不大但是技战术能力相对落后的失利，水庆霞说“其实我们比任何人都想赢球”：“但比赛的结果就是这样，我们要接受它，好总结这场比赛。”亚运会的比赛尚未结束，中国女足还将在10月6日举行的铜牌争夺战中迎战乌兹别克斯坦队，但以争冠为目标的中国女足亚运之旅已经可以提前画上句号—令人担心的是，难度更大的巴黎奥运会亚洲区预选赛迫在眉睫，小组赛中国女足与朝鲜、泰国、韩国同组，10月26日便将在厦门主场迎战朝鲜（朝鲜女足进入亚运会决赛），随后10月29日、1月1日对阵泰国、韩国。依照奥运赛制，亚洲预选赛最终阶段为四强交叉淘汰（巴黎奥运会女足比赛亚洲2张门票），其余小组日本、澳大利亚实力超群，对于中国女足而言，亚运成绩尚可，但倘若在亚洲竞争中失去奥运资格，中国女足运动的发展不得不承受新一轮巨大压力。,不敌 日本队 中国女足 止步 本届 亚运会 女足 半决赛 比赛 结束 许久 中国女足 球员 主教练 水庆霞 登上 返程 大巴车 这场 比分 差距 技战术 能力 落后 失利 水庆霞 任何人 赢球 比赛 接受 这场 比赛 亚运会 比赛 尚未 结束 中国女足 铜牌 争夺战 迎战 乌兹别克斯坦 但以 争冠 目标 中国女足 亚运 提前 句号 令人担心 难度 巴黎 奥运会 亚洲区 预选赛 迫在眉睫 小组赛 中国女足 朝鲜 泰国 韩国 同组 厦门 主场 迎战 朝鲜 朝鲜 女足 亚运会 决赛 对阵 泰国 韩国 奥运 赛制 亚洲 预选赛 最终 阶段 交叉 淘汰 巴黎 奥运会 女足 比赛 亚洲 门票 小组 日本 澳大利亚 实力 超群 中国女足 亚运 成绩 尚可 亚洲 竞争 奥运 资格 中国女足 运动 发展 承受 新一轮 压力
https://weibo.com/ajax/statuses/searchProfile?uid=1726918143&page=2&q=%E4%BA%9A%E8%BF%90%E4%BC%9A,1726918143,中国青年报,,,2023年10月04日 12:17,6,114,6,10月3日晚，中国男子410米接力队夺得金牌后，谢震业谈及将于10月4日递补的东京奥运会铜牌，“我们一直在等这枚奖牌，后来被告知会在亚运会接力比赛之后颁发，我觉得它就像一个目标或者传承，让新的接力队员明年（巴黎奥运会）朝着这个方向去努力，我们之前能做到的，他们可以做得更好。” ​,日晚 中国 男子 接力 夺得 金牌 谢震业 谈及 递补 东京 奥运会 铜牌 奖牌 告知 亚运会 接力比赛 颁发 目标 传承 接力 队员 明年 巴黎 奥运会 方向 努力 更好
https://weibo.com/ajax/statuses/searchProfile?uid=1726918143&page=2&q=%E4%BA%9A%E8%BF%90%E4%BC%9A,1726918143,中国青年报,,,2023年10月04日 10:52,4,19,8,10月4日上午，温州龙舟运动中心，杭州亚运会龙舟比赛揭幕。在小龙舟男子直道20米决赛和女子直道20米决赛上，中国男、女队均成功卫冕。,上午 温州 龙舟 运动 中心 杭州 亚运会 龙舟 比赛 揭幕 龙舟 男子 直道 决赛 女子 直道 决赛 中国 女队 成功 卫冕
