评论,fenci,情感分类,主题概率,主题类型
没有麦克风，要是芯片组是的就好了。京东的客服把我的留言删了有点可惜。,麦克风 芯片组 京东 客服 留言 可惜,neg,"[(0, 0.020434171), (1, 0.020484563), (2, 0.020506678), (3, 0.2006091), (4, 0.02047116), (5, 0.69702536), (6, 0.020468963)]",5
光驱读盘的声音有点异常，安装系统时不能读盘。费了好几个小时才搞定,光驱 读盘 声音 异常 安装 系统 读盘 好几个 小时 搞定,neg,"[(0, 0.01308633), (1, 0.92162687), (2, 0.01305973), (3, 0.013040737), (4, 0.01303235), (5, 0.013060546), (6, 0.013093424)]",1
驱动程序安装比较麻烦，安装声卡驱动的时候老不成功，后来发现是没有打声卡的补丁，郁闷了半天！呵呵,驱动程序 安装 麻烦 安装 声卡 驱动 成功 发现 声卡 补丁 郁闷 半天,neg,"[(0, 0.011007425), (1, 0.011019126), (2, 0.71401465), (3, 0.011014762), (4, 0.011002655), (5, 0.011004932), (6, 0.23093648)]",2
询问了的客服，的确是40,询问 客服,neg,"[(0, 0.04769735), (1, 0.7135628), (2, 0.047722593), (3, 0.047705885), (4, 0.04776968), (5, 0.047787685), (6, 0.04775402)]",1
实际可用只有两个，买的连电脑包和鼠标都没有，说是有屏保膜，但发现也没有，自己再买这些东西，和其他地方报价也差不多。也没给装系统，自己去安个比其他电脑麻烦很多,可用 两个 电脑包 鼠标 屏保 发现 东西 地方 报价 没给 系统 电脑 麻烦,neg,"[(0, 0.9384391), (1, 0.010263959), (2, 0.010289955), (3, 0.010248202), (4, 0.01023926), (5, 0.010247383), (6, 0.01027215)]",0
第一、降价太快了，刚买完就降价，京东怎么这么不厚道啊，要降价也得过些时候啊,第一 降价 降价 京东 厚道 降价,neg,"[(0, 0.020454725), (1, 0.8771406), (2, 0.020461235), (3, 0.020448294), (4, 0.020426122), (5, 0.020543987), (6, 0.02052505)]",1
还是有点贵，要是白色和黑色一个价格就好了~~~~最好再送膜啦，键鼠啥的，那样会更开心点~~~~,白色 黑色 价格 键鼠 开心,neg,"[(0, 0.023894027), (1, 0.856612), (2, 0.023952173), (3, 0.023875901), (4, 0.023839427), (5, 0.023922868), (6, 0.023903586)]",1
受的政策限制，性能太差！电池太小！电源线太粗，才几十的功耗，可以用细电线，无端增加了重量！硬盘只分了1个区，！无系统恢复光盘！打字稍用力键盘就会下沉变形，用着有些害怕！,政策 性能 电池 太小 电源线 太粗 几十 功耗 电线 无端 增加 重量 硬盘 只分 个区 系统 恢复 光盘 打字 用力 键盘 下沉 变形 害怕,neg,"[(6, 0.9655403)]",6
如果能有蓝牙的话，就完美了，商务用没蓝牙还是不方便啊，有蓝牙那型号的又带摄像头。另外，我怎么没发现包装箱里有原装的包？大家不是都有的吗？,蓝牙 完美 商务 蓝牙 蓝牙 型号 摄像头 发现 包装箱 原装,neg,"[(0, 0.013005756), (1, 0.0130041195), (2, 0.9219294), (3, 0.013024221), (4, 0.013004922), (5, 0.013008736), (6, 0.013022829)]",2
内存只有1，小了点，自己又买了根2 667装上,内存 装上,neg,"[(0, 0.0476754), (1, 0.047689717), (2, 0.04774684), (3, 0.04773802), (4, 0.047666457), (5, 0.71374387), (6, 0.047739696)]",5
但是从机子本身来说还是有几处不佳之处，左手出散热出口处温度较高；机子表面没有蓝牙开启和关闭指示灯；液晶屏上盖没有锁扣，但是总体来说还是性价比极高的，所以非常满意！,机子 几处 左手 散热 出口处 温度 机子 表面 蓝牙 开启 关闭 指示灯 液晶屏 上盖 锁扣 总体 性价比 极高 满意,neg,"[(2, 0.9570262)]",2
"就是做系统特麻烦,装不了盘.自己很懒.不想去驱动,还有就是我的回车键盘键不好用了.还有就是查鼠标的那个接口也不能用了,应该怎么处理啊",系统 麻烦 不想 驱动 回车 键盘 不好 鼠标 接口,neg,"[(0, 0.014336513), (1, 0.91391444), (2, 0.014371146), (3, 0.014307903), (4, 0.014329838), (5, 0.0143371215), (6, 0.014403086)]",1
底座找不到？扩展不了。原来买的是普屏的200，和这个宽屏的也不能通用啊。,底座 不到 扩展 普屏 通用,neg,"[(0, 0.023927893), (1, 0.024027606), (2, 0.023876581), (3, 0.023847127), (4, 0.023880655), (5, 0.02386331), (6, 0.8565768)]",6
就是刚刚开始磁盘分区比较麻烦，有点热，接口太少,刚刚开始 磁盘分区 麻烦 接口,neg,"[(0, 0.028669015), (1, 0.028794993), (2, 0.02905919), (3, 0.028686164), (4, 0.82732403), (5, 0.028689357), (6, 0.028777208)]",4
不带光驱，读卡器居然没有一个封口垫片，只好拿个-卡套塞进去代用，面后方有些松，屏幕线裸露。,光驱 读卡器 封口 垫片 只好 卡套 塞进去 代用 后方 屏幕 裸露,neg,"[(0, 0.011943141), (1, 0.011943246), (2, 0.92831504), (3, 0.011941612), (4, 0.01193496), (5, 0.011980796), (6, 0.011941232)]",2
外观有点难看，估计是模具的关系吧，还有塑料的外壳感觉很低档，应该是设计的不美观,外观 难看 估计 模具 关系 塑料 外壳 感觉 低档 设计 不美观,neg,"[(0, 0.011972933), (1, 0.0119570205), (2, 0.011974535), (3, 0.011921923), (4, 0.9282352), (5, 0.011988929), (6, 0.011949471)]",4
本本散热比较差，开着游戏时温度直上80，这个要命！！,本本 散热 游戏 温度 要命,neg,"[(0, 0.8567531), (1, 0.023884881), (2, 0.023951892), (3, 0.023847695), (4, 0.023866018), (5, 0.023836998), (6, 0.02385944)]",0
没送包鼠标，不过没什么关系，花个一百多买个好点的也行,没送 鼠标 没什么 关系 一百多,neg,"[(0, 0.22831868), (1, 0.023977058), (2, 0.023867084), (3, 0.023839068), (4, 0.65228224), (5, 0.023850672), (6, 0.023865188)]",4
"价格上太贵,比宏基的贵...整个机器的硬盘就分一个盘,带家庭版系统,要改装其他系统比较麻烦.要保留盘数据,无损分区,还有多操作系统启动问题...系统下,电脑音箱音质明显降低....",价格 太贵 宏基 机器 硬盘 家庭版 系统 改装 系统 麻烦 保留 数据 无损 分区 操作系统 启动 系统 电脑 音箱 音质 明显降低,neg,"[(2, 0.9141526), (5, 0.05323146)]",2
"送的包比较普通,做工也不好,和商城上99块那款东芝笔记本包是一样的,希望能送好点的包",做工 不好 商城 那款 东芝 笔记本 包是 希望,neg,"[(0, 0.015945291), (1, 0.9043448), (2, 0.015909981), (3, 0.015908001), (4, 0.015972761), (5, 0.015995499), (6, 0.015923709)]",1
键盘不是很好 上下左右键有点歪 还有就是 需要适应很累 要好好研究,键盘 上下左右 好好 研究,neg,"[(0, 0.028661061), (1, 0.2471011), (2, 0.41870314), (3, 0.21949418), (4, 0.028618049), (5, 0.028671643), (6, 0.028750863)]",2
机器近乎完美，但这次交易出了很大问题明明九号到货居然等了一个下午都找不到了我的货无辜扣留到十号早上才找到服务态度太差了以后都不敢找他运货了,机器 近乎 完美 交易 很大 明明 九号 到货 下午 不到 无辜 扣留 十号 早上 找到 服务态度 运货,neg,"[(1, 0.117363185), (6, 0.8428355)]",6
发热量也太大了吧，刚开机没多久，仅上网，机器就很热了，就没有下过50度，一直44度以上，不知道是正常的还是我的这台有问题，希望有人指教一下~,发热量 开机 没多久 上网 机器 下过 希望 有人 指教,neg,"[(0, 0.01436181), (1, 0.014374102), (2, 0.014330399), (3, 0.014376057), (4, 0.014318175), (5, 0.014326597), (6, 0.91391283)]",6
但今天提货时，总部自提点的服务不是很好，可能人员不多，我问的问题给我回复的不是很满意。,提货 总部 提点 服务 人员 回复 满意,neg,"[(0, 0.017911468), (1, 0.017933683), (2, 0.017887926), (3, 0.01790625), (4, 0.017873064), (5, 0.89255196), (6, 0.017935604)]",5
键盘手感没有开始的时候好了，,键盘 手感,neg,"[(0, 0.047723297), (1, 0.047667675), (2, 0.047708042), (3, 0.047629956), (4, 0.04764746), (5, 0.04776753), (6, 0.713856)]",6
不是电脑高手千万别买，没有系统，而且主板和有很多限制 导致不能顺利安装 我搞了一天 才勉强搞定，要不是曾经搞过一段时间计算机 还真搞不定这个机器。,电脑高手 千万别 系统 主板 导致 顺利 安装 勉强 搞定 一段时间 计算机 搞不定 机器,neg,"[(0, 0.6288807), (1, 0.010245385), (2, 0.31990218), (3, 0.010234846), (4, 0.0102424985), (5, 0.010228726), (6, 0.010265705)]",0
散热不是很好！！右掌托这里使用久了就比较烫手，别的地方还好！！还有屏幕晃动的比较厉害！！！这点没有强！！,散热 右掌 烫手 地方 还好 屏幕 晃动 厉害,neg,"[(0, 0.41960165), (1, 0.015938198), (2, 0.015926141), (3, 0.015915971), (4, 0.50073904), (5, 0.015935564), (6, 0.015943429)]",4
就是霸王条款，送的200元东券要再消费5000元才能使用，感觉被套了。,霸王 条款 东券 消费 感觉 被套,neg,"[(0, 0.020445418), (1, 0.020461533), (2, 0.02044467), (3, 0.020446563), (4, 0.8773036), (5, 0.020450542), (6, 0.020447653)]",4
散热问题始终有点突出，配置高就功耗高就无可避免地温度高了，另外外壳做工方面还需进一步加强,散热 始终 配置 功耗 无可避免 温度 外壳 做工 进一步,neg,"[(0, 0.014383149), (1, 0.0143636195), (2, 0.014344875), (3, 0.014303382), (4, 0.014344278), (5, 0.01431925), (6, 0.91394144)]",6
转轴设计不好，合上屏幕后后面缝隙很大，手一抓就变形了，只能抓前侧,转轴 设计 不好 屏幕 缝隙 很大 变形 只能 前侧,neg,"[(0, 0.9139109), (1, 0.014340831), (2, 0.01437104), (3, 0.014302091), (4, 0.01431831), (5, 0.01434414), (6, 0.014412686)]",0
确实很……还在磨合期，,确实 磨合期,neg,"[(0, 0.04771475), (1, 0.04768109), (2, 0.713718), (3, 0.047717355), (4, 0.04775023), (5, 0.047713965), (6, 0.047704645)]",2
为什么没有我的赠品呢？,赠品,neg,"[(0, 0.07144597), (1, 0.07166415), (2, 0.0717121), (3, 0.57027876), (4, 0.07183302), (5, 0.07157869), (6, 0.07148732)]",3
玩游戏时和显卡的温度上升较快，但还可以接受，夏天空调房里也没问题。,玩游戏 显卡 温度 接受 夏天 空调 房里,neg,"[(0, 0.017970042), (1, 0.5953322), (2, 0.31496465), (3, 0.017902855), (4, 0.017948572), (5, 0.01792261), (6, 0.017959038)]",1
提货处试机时，第一次开机时按电源好几次，也等了很久，才突然自己启动，不知是什么原因；无调制解调器，虽然用的机会不多，但是偶尔需要传真时很好用；430有配鼠标，这个居然连鼠标也省了,提货 试机 第一次 开机 电源 几次 很久 启动 不知 原因 调制解调器 机会 传真 好用 有配 鼠标 鼠标,neg,"[(0, 0.95225066)]",0
配置貌似不错，号称是游戏王，但我运行1（就原装系统），卡~且发热量大，官方没有系统的驱动，暂未装，据说装了后可能“桌面导航”会用不了，暂未尝试。显示频触碰会有‘弹簧片’似的的颤动感,配置 貌似 不错 号称 游戏王 运行 原装 系统 发热量 官方 系统 驱动 暂未 桌面 导航 暂未 尝试 显示 频触 碰会 弹簧片 颤动,neg,"[(1, 0.96256036)]",1
京东相关回答错误，不是背光屏，键盘不是钢琴烤漆，无线网卡是英特尔5100的！请京东改正。,京东 相关 回答 错误 光屏 键盘 钢琴 烤漆 无线 网卡 英特尔 京东 改正,neg,"[(0, 0.0102248015), (1, 0.9385908), (2, 0.010242221), (3, 0.01022069), (4, 0.010216606), (5, 0.010250425), (6, 0.010254431)]",1
银色的按键感觉很突兀，整体感觉不是非常结实，至少没有惠普6系列的结实。,银色 按键 感觉 突兀 整体 感觉 结实 至少 惠普 系列 结实,neg,"[(0, 0.011927089), (1, 0.011971101), (2, 0.011963762), (3, 0.011935384), (4, 0.9282763), (5, 0.011942925), (6, 0.011983424)]",4
"硬盘声音太响了, 和以前的老光驱里读盘得声音差不多.开始以为是电脑的问题,查了一下,据说很多人都说这是整个本的通病,不影响使用",硬盘 声音 光驱 读盘 声音 电脑 通病 影响,neg,"[(0, 0.015903799), (1, 0.01592948), (2, 0.904522), (3, 0.015885523), (4, 0.01590341), (5, 0.0159183), (6, 0.015937462)]",2
京东的发货速度是没话说的，但圆通真的很慢呀！建议以后不要用圆通了！,京东 发货 速度 没话说 圆通 真的 很慢 建议 圆通,neg,"[(0, 0.014309006), (1, 0.48903117), (2, 0.088575855), (3, 0.1349906), (4, 0.01433801), (5, 0.24443008), (6, 0.014325233)]",1
包难找，结果找到款新秀丽的09款双肩背正好放进去！哈哈，做工有待提高，和华硕比差了点，代工厂太差了，背面的盖板竟然和很多人一样是翘起来的，用手砸下去的！,包难 找到 秀丽 双肩 正好 放进去 做工 有待 提高 华硕 代工厂 背面 盖板 翘起来,neg,"[(1, 0.94259536)]",1
接口太少，只有两个，而且都在机身右下角位置，外接一个鼠标就会觉得很碍事――当然换成蓝牙鼠标就好了。,接口 两个 机身 右下角 位置 鼠标 碍事 换成 蓝牙 鼠标,neg,"[(0, 0.013040689), (1, 0.013051546), (2, 0.013067974), (3, 0.0130139785), (4, 0.6399406), (5, 0.013046159), (6, 0.29483908)]",4
16：9的15寸包目前似乎不太好买，以往的15寸包都放不下，另外口设计有些不合理。,不太好 以往 寸包 放不下 设计 不合理,neg,"[(0, 0.877139), (1, 0.020471245), (2, 0.020500336), (3, 0.02043598), (4, 0.020455249), (5, 0.020470452), (6, 0.020527788)]",0
屏幕分辨率低  对于图形操作很不方便,屏幕 分辨率 图形操作,neg,"[(0, 0.7849066), (1, 0.03595559), (2, 0.035873525), (3, 0.03577465), (4, 0.035848495), (5, 0.03579357), (6, 0.035847552)]",0
竟然我的静音按钮的背光不亮了，才买了10多天，不知道能不能换（今天是第15天，要看京东怎么说啦，）。。。 机子做工还是不够细致，和差距，嘿嘿，很大。,静音 按钮 背光 多天 京东 机子 做工 细致 差距 很大,neg,"[(0, 0.013056592), (1, 0.9216376), (2, 0.013056992), (3, 0.013023018), (4, 0.013027764), (5, 0.013120889), (6, 0.013077212)]",1
系统的评分中得分53，拖了后腿，其他的评分都比较高。达到100%时内存还很充裕。联想自带的那个很不好用。容易没电。容易磕碰留下痕迹。,系统 评分 得分 后腿 评分 内存 充裕 联想 自带 不好 磕碰 留下 痕迹,neg,"[(0, 0.01022577), (1, 0.9386256), (2, 0.010228531), (3, 0.010222097), (4, 0.010234992), (5, 0.010232041), (6, 0.010230971)]",1
接口只有2个，太少了点，不能接太多外接设备！表面容易留下污垢！,接口 接设备 表面 留下 污垢,neg,"[(0, 0.023829494), (1, 0.8569306), (2, 0.023852095), (3, 0.023833113), (4, 0.023875358), (5, 0.023850385), (6, 0.023828948)]",1
比450贵很多，个人认为还是450性价比最高，奇怪的是应该是尺寸越小越贵啊,性价比 奇怪的是 尺寸 越小越,neg,"[(0, 0.028629202), (1, 0.028743172), (2, 0.028911443), (3, 0.8277092), (4, 0.028748777), (5, 0.028629089), (6, 0.028629098)]",3
价格有点高，电池电量消耗过快，机身容易留下指纹，其它的还没有发现！一点人情都没有，赠品一样都没有！可恶！,价格 电池电量 消耗 机身 留下 指纹 发现 一点 人情 赠品 可恶,neg,"[(0, 0.011940526), (1, 0.9283278), (2, 0.011939687), (3, 0.011967227), (4, 0.011938894), (5, 0.011946123), (6, 0.011939769)]",1
系统太崩溃啦，220的盘，也不好用，要重装，装驱动，麻烦,系统 崩溃 不好 重装 驱动 麻烦,neg,"[(0, 0.020471923), (1, 0.020491771), (2, 0.020498512), (3, 0.020517776), (4, 0.020458525), (5, 0.02062157), (6, 0.87693995)]",6
1、出风口温高，别的不热。 2、随机驱动是，没有，不方便。 3、没有1394！ 4、由改的，模具没动省成本，鄙视！ 5、待机短，文档编辑110，高清80。,出风口 温高 随机 驱动 模具 没动 成本 鄙视 待机 文档 编辑 高清,neg,"[(0, 0.93372226), (1, 0.011025669), (2, 0.011098332), (3, 0.011018395), (4, 0.01103098), (5, 0.0110290935), (6, 0.011075259)]",0
本本的发热量大，而且重，如果轻些就好了,本本 发热量,neg,"[(0, 0.04790341), (1, 0.30551317), (2, 0.45541364), (3, 0.047651798), (4, 0.04770281), (5, 0.047858756), (6, 0.047956396)]",2
1、出风口温高，别的不热。,出风口 温高,neg,"[(0, 0.04783854), (1, 0.04767972), (2, 0.7136256), (3, 0.047714468), (4, 0.047693312), (5, 0.047723893), (6, 0.047724493)]",2
显卡低点，识别时3400的，可能驱动没装好，7评估3分，主要是显卡3分，其他5以上。,显卡 低点 识别 驱动 没装好 评估 显卡,neg,"[(0, 0.017897088), (1, 0.017887915), (2, 0.89262146), (3, 0.017899068), (4, 0.01787936), (5, 0.017879823), (6, 0.01793524)]",2
好像风扇的声音有点大，可能是用的时间较长的原因，要是能配上包，鼠标就好了，自己还要去买，另外，没有随机的光盘啊，怎么恢复系统啊？,好像 风扇 声音 是用 时间 原因 能配 鼠标 随机 光盘 恢复 系统,neg,"[(0, 0.011043402), (1, 0.011034301), (2, 0.9337757), (3, 0.011009119), (4, 0.01105533), (5, 0.011044719), (6, 0.011037379)]",2
看500(2746-2)的评论，不太敢换系统；面感觉有点廉价，考虑到整机的价格就可以接受了；另外就是送的东西太少了，而且最最实用的内存和鼠标都不送。。。,评论 系统 感觉 廉价 整机 价格 接受 东西 最最 实用 内存 鼠标,neg,"[(0, 0.011042389), (1, 0.2264127), (2, 0.011042264), (3, 0.122613505), (4, 0.6067959), (5, 0.011046299), (6, 0.011046907)]",4
有点重，感觉重量超过了 400。不能做出厂的镜像光盘，不过说可以申请一张。,感觉 重量 超过 做出 镜像 光盘 申请 一张,neg,"[(0, 0.015927438), (1, 0.9042531), (2, 0.015959581), (3, 0.015922014), (4, 0.016027823), (5, 0.015965682), (6, 0.015944349)]",1
"摄像头不够鲜艳,不知道是自己不会还是电脑问题,颜色调不了,能调的告诉我下",摄像头 鲜艳 电脑 颜色 能调 告诉,neg,"[(0, 0.020469844), (1, 0.020464435), (2, 0.020509241), (3, 0.02051235), (4, 0.020449884), (5, 0.02045486), (6, 0.8771394)]",6
商品没问题！就是京东预定说是1-6天发货，可实际等了10天左右！其实等等也没关系，可是你京东6天发不了货，就别写1-6天可以发货！希望以后可以改进！,商品 京东 预定 发货 没关系 京东 天发 就别 发货 希望 改进,neg,"[(0, 0.011938081), (1, 0.011968636), (2, 0.012019208), (3, 0.7941383), (4, 0.012057359), (5, 0.14589839), (6, 0.0119800065)]",3
重装系统比较麻烦，标准系统盘需要在里修改模式，否则蓝屏,重装系统 麻烦 标准 系统盘 修改 模式 蓝屏,neg,"[(0, 0.01791748), (1, 0.49001673), (2, 0.4202607), (3, 0.01794551), (4, 0.017961783), (5, 0.017915044), (6, 0.017982777)]",1
1、只有系统，装搞了我半天,系统 半天,neg,"[(0, 0.047661617), (1, 0.047812678), (2, 0.047818683), (3, 0.047681805), (4, 0.04765266), (5, 0.047758225), (6, 0.7136143)]",6
1、这款机器的造工问题，比较粗糙，塑料感太重了，这应该是为了轻便而牺牲了材料质量,机器 造工 粗糙 塑料 太重 轻便 牺牲 材料 质量,neg,"[(0, 0.014345228), (1, 0.014368726), (2, 0.014354977), (3, 0.014309311), (4, 0.0695356), (5, 0.8587623), (6, 0.0143238325)]",5
感觉不稳定，用到十二天的时候出现了一次蓝屏（开机十小时以后）。,感觉 稳定 用到 十二天 蓝屏 开机 十小时,neg,"[(0, 0.017898511), (1, 0.017898006), (2, 0.017920127), (3, 0.017892366), (4, 0.017915366), (5, 0.8925632), (6, 0.017912373)]",5
电池续航时间标配2-5小时，在视频期间仅用1小时40分钟左右，不知何故？,电池 续航 时间 标配 小时 视频 期间 小时 分钟 不知 何故,neg,"[(0, 0.011984855), (1, 0.011927873), (2, 0.5940254), (3, 0.01193243), (4, 0.011930418), (5, 0.34623772), (6, 0.011961324)]",2
用了一个星期，硬件出问题了，突然蓝屏，报错是识别不到硬盘。,星期 硬件 蓝屏 报错 识别 不到 硬盘,neg,"[(0, 0.01789138), (1, 0.017902311), (2, 0.018011628), (3, 0.017882435), (4, 0.017900478), (5, 0.017884213), (6, 0.8925275)]",6
发热量大，电池供电时间短，手写屏灵敏度不高，没发现提供直接的手写输入方法。,发热量 电池 供电 时间 手写 灵敏度 发现 提供 手写输入 方法,neg,"[(0, 0.013065584), (1, 0.013099266), (2, 0.013043004), (3, 0.013064559), (4, 0.013056641), (5, 0.013047657), (6, 0.9216233)]",6
随机说明和实际不相符。系统光盘是个空纸片，没有有用的光盘，只有一个单词软件。,随机 相符 系统 光盘 纸片 有用 光盘 单词 软件,neg,"[(0, 0.014309523), (1, 0.014325501), (2, 0.91410553), (3, 0.014306986), (4, 0.014309215), (5, 0.014302926), (6, 0.014340337)]",2
拿到手充电时，电池热的厉害，风扇也转个不停，不知道是不是电池的问题？,拿到 充电 电池 厉害 风扇 不停 电池,neg,"[(0, 0.89269763), (1, 0.017872065), (2, 0.017887512), (3, 0.017870761), (4, 0.017873935), (5, 0.017911667), (6, 0.017886408)]",0
内存频率低，还是 667的，屏幕是16：9的，没16：10的看着舒服,内存 频率 屏幕 看着 舒服,neg,"[(0, 0.023882821), (1, 0.023841552), (2, 0.8568765), (3, 0.02382712), (4, 0.023848895), (5, 0.02386425), (6, 0.023858882)]",2
，总结最多只让人写100字，不够啊，见总结！,多只,neg,"[(0, 0.07162259), (1, 0.07162184), (2, 0.07162238), (3, 0.07162155), (4, 0.07162211), (5, 0.071622126), (6, 0.5702674)]",6
1.不管你装什么东西，肯定是往硬盘里装，所以要找到硬盘，这款是串口的硬盘（），早期版本软件不识别，所以导致找不到硬盘，安装出现蓝屏，感觉安装很难，所以，一定要有串口硬盘的驱动！！！,东西 肯定 硬盘 找到 硬盘 这款 串口 硬盘 早期 版本 软件 识别 导致 不到 硬盘 安装 蓝屏 感觉 安装 串口 硬盘 驱动,neg,"[(2, 0.9625393)]",2
屏幕表现很一般，特别是装了后系统字体看起来有点模糊。建议预算够还是买一台商务机好了。,屏幕 表现 特别 系统 字体 模糊 建议 预算 一台 商务,neg,"[(0, 0.013004491), (1, 0.0130122565), (2, 0.921919), (3, 0.013000927), (4, 0.01303013), (5, 0.0130052185), (6, 0.013027964)]",2
超难装。无奈在网上找个专业的上门40元搞定。试了几天非常满意，宣传一下：小庄13261821032。,超难 无奈 网上 专业 上门 搞定 几天 满意 宣传 小庄,neg,"[(0, 0.013002808), (1, 0.013007705), (2, 0.013007136), (3, 0.10834995), (4, 0.013000806), (5, 0.013000423), (6, 0.8266312)]",6
装个住哪个的我头痛，依然没有成功，放弃了！还是装了，凑合着用吧，习惯了就没问题了！,装个 头痛 依然 成功 放弃 凑合着 习惯,neg,"[(0, 0.01787997), (1, 0.017891007), (2, 0.017890336), (3, 0.017885596), (4, 0.017877998), (5, 0.017888684), (6, 0.8926864)]",6
"装到盘果然这次认到了马上格式化然后进行,嘿嘿结果大家该猜到了装好了，不过后头的事情还有很多哦，装驱动是最最麻烦的了，",装到 认到 格式化 猜到 装好 后头 事情 驱动 最最 麻烦,neg,"[(0, 0.013008419), (1, 0.013011523), (2, 0.8573222), (3, 0.07760373), (4, 0.0130147375), (5, 0.013014482), (6, 0.013024903)]",2
"装系统难装,最好找个专业人士,我已找人装过三次!前两次装过后电脑有啪啪声,最后一次找专卖店的人装,很好,只是感觉风扇声大了点.",系统 专业人士 三次 两次 过后 电脑 啪啪 专卖店 人装 感觉 风扇,neg,"[(0, 0.011957306), (1, 0.9281914), (2, 0.011954645), (3, 0.011957079), (4, 0.01199453), (5, 0.01198223), (6, 0.01196274)]",1
散热性大了点，开机一会就发烫，驱动不怎么好弄，但基本搞定，摄像头不太好,散热 开机 一会 发烫 驱动 搞定 摄像头 不太好,neg,"[(0, 0.90437675), (1, 0.015933162), (2, 0.01598086), (3, 0.015908364), (4, 0.015899347), (5, 0.015896553), (6, 0.016004933)]",0
"系统实在是喜欢不起来.开关机慢.开机有一两声喀喀声.做工一般,没什么质感.音量小,音质不佳.",系统 实在 喜欢 开关机 开机 一两声 做工 没什么 质感 音量 音质,neg,"[(0, 0.012064904), (1, 0.011973941), (2, 0.9282318), (3, 0.011927045), (4, 0.011924551), (5, 0.0119354585), (6, 0.011942344)]",2
就是系统装得我比较麻烦！还要就是本人的技术也比较菜！有水平的买家可以留下一下经验下来哦！呵呵,系统 装得 麻烦 技术 水平 买家 留下 经验,neg,"[(0, 0.015925897), (1, 0.016007608), (2, 0.32448676), (3, 0.5957506), (4, 0.015929582), (5, 0.015968665), (6, 0.015930923)]",3
没包，没胆，没鼠标，系统安装要求系统盘的版本比较高，建议大家不要轻易升级主板.,没胆 鼠标 系统 安装 系统盘 版本 建议 轻易 升级 主板,neg,"[(0, 0.013036089), (1, 0.013060436), (2, 0.5929374), (3, 0.013031034), (4, 0.34185123), (5, 0.013012626), (6, 0.013071191)]",2
"软件方面的不足就不说了,总之是便宜,操作系统和驱动的问题自己解决虽然麻烦点,但可以接受.",软件 便宜 操作系统 驱动 解决 麻烦 接受,neg,"[(0, 0.20648384), (1, 0.7038869), (2, 0.017963778), (3, 0.01788223), (4, 0.017912462), (5, 0.017893989), (6, 0.017976819)]",1
我昨天刚签收，系统还没装好。刚开机一小会儿就听到风扇运转的声音，不知散热是不是真的不太好,昨天 签收 系统 没装 开机 一小 会儿 听到 风扇 运转 声音 不知 散热 真的 不太好,neg,"[(2, 0.9462017)]",2
