评论,fenci,情感分类,主题概率,主题类型
使用电源适配器的时候，其发热量够惊人，有点担心会烧坏，触摸板太灵敏了，触摸板的按键确实有点硬，键盘左上角有一块按的时候会有下陷的毛病。别的地方还好。风扇没有自带调速功能，有点失望，要借助软件调速。,电源适配器 发热量 惊人 担心 烧坏 触摸板 灵敏 触摸板 按键 确实 键盘 左上角 一块 下陷 毛病 地方 还好 风扇 自带 调速 功能 失望 借助 软件 调速,neg,"[(4, 0.73646677), (5, 0.23592785)]",4
1 面温度稍高，但在可接受范围；适配器在充电时会高热，说明书中倒是有提醒,温度 接受 适配器 充电 时会 高热 说明书 提醒,neg,"[(0, 0.32764512), (1, 0.015943257), (2, 0.015931832), (3, 0.01591992), (4, 0.592654), (5, 0.015954074), (6, 0.015951794)]",4
电池续航时间好像没有达到宣传的9小时，跟联想10比，外形稍稍大一些重一些。,电池 续航 时间 好像 宣传 小时 联想 外形 稍稍,neg,"[(0, 0.5042403), (1, 0.014325952), (2, 0.01434028), (3, 0.014315467), (4, 0.01433777), (5, 0.01435669), (6, 0.42408353)]",0
可能是因为6芯电池的关系，还是比较重的，感觉比12寸的61重,是因为 电池 关系 感觉,neg,"[(0, 0.028669056), (1, 0.028645016), (2, 0.028673388), (3, 0.028623559), (4, 0.02880996), (5, 0.82789767), (6, 0.02868131)]",5
不带光驱，换有点吃力，需要做个盘启动,光驱 吃力 启动,neg,"[(0, 0.03578505), (1, 0.035849247), (2, 0.7851395), (3, 0.035741355), (4, 0.03579235), (5, 0.035891455), (6, 0.035801068)]",2
按完 7后 开极品飞车10很卡 不知道原因  左侧腕托处温度比较热,极品飞车 原因 左侧 腕托处 温度,neg,"[(0, 0.024024468), (1, 0.023949089), (2, 0.023994988), (3, 0.5365676), (4, 0.34363216), (5, 0.023918428), (6, 0.023913223)]",3
买完就降价，郁闷，有点沉，重装系统，原机中预装东西丢失挺可惜！,买完 降价 郁闷 重装系统 原机 预装 东西 丢失 可惜,neg,"[(0, 0.014331022), (1, 0.20112394), (2, 0.014377714), (3, 0.72712654), (4, 0.0143160615), (5, 0.014356061), (6, 0.014368664)]",3
使用电源适配器的时候，其发热量够惊人，有点担心会烧坏，触摸板太灵敏了，触摸板的按键确实有点硬，塑料外壳不是很结实，像玩具，没有华硕的大本装配工艺好。,电源适配器 发热量 惊人 担心 烧坏 触摸板 灵敏 触摸板 按键 确实 塑料 外壳 结实 玩具 华硕 大本 装配 工艺,neg,"[(5, 0.95470315)]",5
不是镜面屏；风扇从开机就没停，声音比较大；稍微重了点；,镜面 风扇 开机 没停 声音 稍微,neg,"[(0, 0.020503411), (1, 0.02048648), (2, 0.020539587), (3, 0.020438224), (4, 0.020459946), (5, 0.020510294), (6, 0.8770621)]",6
配套的驱动光盘，质量太差，我的移动光驱认不出，到台机的光驱上读的也很吃力。盘片的质量不让人满意，还好，有网络可以去下载。不过华硕的支持网站，老是显示错误，真晕。,配套 驱动 光盘 质量 光驱 认不出 台机 光驱 上读 吃力 盘片 质量 不让 满意 还好 网络 下载 华硕 支持 网站 显示 错误,neg,"[(5, 0.83555466), (6, 0.13325831)]",5
我算了一下，待机时间差不多六个小时，好像跟宣传中的有些差异。还有更郁闷的是才刚买了两天，京东就有返200元现金的活动了，唉,算了 待机时间 六个 小时 好像 宣传 差异 郁闷 才刚 两天 京东 现金 活动,neg,"[(0, 0.01024567), (1, 0.01027068), (2, 0.010242731), (3, 0.9384066), (4, 0.010236727), (5, 0.010294078), (6, 0.010303536)]",3
1、键盘手感一般。,键盘 手感,neg,"[(0, 0.04772337), (1, 0.047667675), (2, 0.04770805), (3, 0.047629956), (4, 0.04764746), (5, 0.047767248), (6, 0.7138562)]",6
装系统时，要长按2进入主版，这个提示机器上不显示，到网上查到的，默认硬盘分区有好几个，还有一个显示为，后来才反应过来要把所有的分区都删掉，重新格式化，装上的才能读到，不然老是显示都不到。,系统 要长 主版 提示 机器 显示 网上 查到 默认 硬盘分区 好几个 显示 分区 删掉 格式化 装上 显示 不到,neg,"[(5, 0.7023828), (6, 0.25986108)]",5
买的是版本，回来装折腾死我了，还不如给我个只有的裸机了，装系统也方便。,版本 回来 折腾 我个 裸机 系统,neg,"[(0, 0.020437289), (1, 0.020462606), (2, 0.02052266), (3, 0.02044691), (4, 0.020437095), (5, 0.020447748), (6, 0.87724566)]",6
"附带的驱动盘没有正确的无线网卡驱动,也没有快捷键等软件,需要自己去网站下载.",附带 驱动 正确 无线 网卡 驱动 快捷键 软件 网站 下载,neg,"[(0, 0.013001011), (1, 0.013046517), (2, 0.013054004), (3, 0.013011811), (4, 0.013008479), (5, 0.013008164), (6, 0.92187005)]",6
屏幕有些失望，看久了头晕。,屏幕 失望 头晕,neg,"[(0, 0.03582218), (1, 0.035789795), (2, 0.7844135), (3, 0.03578099), (4, 0.03599613), (5, 0.035979394), (6, 0.036218036)]",2
没多久就又降了100元，没有 显示。稍稍有点点重，比想象中。那个那个存储的宣传太扯淡了，我找了好半天那10在哪，结果发现是在网上。我怒，这个算虚假宣传不？,没多久 显示 稍稍 点点 想象 存储 宣传 扯淡 半天 发现 网上 虚假 宣传,neg,"[(0, 0.01024358), (1, 0.0102393115), (2, 0.010231087), (3, 0.01023608), (4, 0.010222522), (5, 0.010252163), (6, 0.93857527)]",6
1.自提点对账太慢了，我买了好久，一直不能评论,提点 对账 太慢 好久 评论,neg,"[(0, 0.023860006), (1, 0.023854623), (2, 0.85649663), (3, 0.02391561), (4, 0.024000397), (5, 0.023938227), (6, 0.02393453)]",2
不知道怎么回事，我的触摸板很不灵敏，与我以前用的笔记本比起来，感觉灵敏度差好远。而且键盘中间是翘起来的，有棚空的感觉。还有触摸板的左右键实在太硬了。每次用力总担心把笔记本压坏。,怎么回事 触摸板 不灵敏 笔记本 感觉 灵敏度 键盘 翘起来 棚空 感觉 触摸板 实在 每次 用力 担心 笔记本 压坏,neg,"[(5, 0.95211494)]",5
采用了传统的笔记本硬盘，型号是以开头，应该是希捷的，因此重量就稍微增加了，背在背包里面重了点，不过还是在情理之内的。,采用 传统 笔记本 硬盘 型号 开头 希捷 重量 稍微 增加 背包 情理 之内,neg,"[(0, 0.010224342), (1, 0.8751894), (2, 0.07360587), (3, 0.010219531), (4, 0.010262741), (5, 0.01023751), (6, 0.010260561)]",1
键盘手感不太好。,键盘 手感 不太好,neg,"[(0, 0.035915278), (1, 0.035739202), (2, 0.03577287), (3, 0.035724796), (4, 0.035729736), (5, 0.035788834), (6, 0.7853293)]",6
原配的驱动盘不错，只是安装无线网卡遇到点麻烦，先用自带光盘上780到771都没有用。后来上网查找，才知道这款机器用的无线网卡是-766。再到网上搜索驱动，下载测试，！,原配 驱动 不错 安装 无线 网卡 麻烦 自带 光盘 上网 查找 机器 无线 网卡 网上 搜索 驱动 下载 测试,neg,"[(1, 0.5474647), (2, 0.41669253)]",1
不明白为什么别人家的电脑都是什么颜色的电脑配什么颜色的包，为啥我买了2台白色了（901和这台），都是一个丑不拉几的黑色土包涅？另外边框好宽哦，什么时候也能“薄无边”呢？,明白 电脑 颜色 电脑 颜色 为啥 白色 黑色 土包 边框 无边,neg,"[(0, 0.011967655), (1, 0.011958994), (2, 0.011965848), (3, 0.32750154), (4, 0.011957028), (5, 0.011952819), (6, 0.6126962)]",6
"没有光驱,重装需要外接光驱,对于电脑新手会很麻烦(没什么人会用吧)",光驱 重装 光驱 电脑 新手 麻烦 没什么 人会用,neg,"[(0, 0.14745128), (1, 0.015947575), (2, 0.01598316), (3, 0.18134344), (4, 0.015900081), (5, 0.6074141), (6, 0.015960405)]",5
1、作为便携本，重了一点，厚了一些,便携 一点,neg,"[(0, 0.04786475), (1, 0.7133096), (2, 0.047721293), (3, 0.04772705), (4, 0.04796346), (5, 0.047695193), (6, 0.04771872)]",1
比预期的要重不少，变压器发热超出预期，放在桌上用居然很烫手，机器风扇声音比较大。,预期 要重 变压器 发热 超出 预期 放在 桌上 烫手 机器 风扇 声音,neg,"[(0, 0.3380361), (1, 0.011050973), (2, 0.011062761), (3, 0.60668385), (4, 0.011047997), (5, 0.011048235), (6, 0.011070076)]",3
稍微有点重，风扇和硬盘有点声音，尤其在晚上安静的时候，另外系统不方便,稍微 风扇 硬盘 声音 晚上 安静 系统,neg,"[(0, 0.017913474), (1, 0.01791529), (2, 0.017972583), (3, 0.017887294), (4, 0.017926648), (5, 0.01793709), (6, 0.8924476)]",6
有点重，有点厚；屏幕外框宽了点，要是窄点就好了；触摸板手感不行。系统用起来非常不习惯。,屏幕 外框 窄点 触摸板 手感 不行 系统 习惯,neg,"[(0, 0.015969204), (1, 0.015933009), (2, 0.015942253), (3, 0.015908672), (4, 0.01592223), (5, 0.9043666), (6, 0.015957976)]",5
键盘手感差，整体做工一般不如，发票质保期写的是“无”，不清楚质保期。,键盘 手感 整体 做工 发票 质保 期写 质保,neg,"[(0, 0.015892904), (1, 0.015918395), (2, 0.015911521), (3, 0.015892018), (4, 0.015905749), (5, 0.01590047), (6, 0.9045789)]",6
过于厚重，当然也可能是我预期的太轻了。发热量较大。另外莫名奇妙的是发票上的质保是“无”，介绍是1年。3包卡上是2年，严重不统一。,厚重 预期 太轻 发热量 较大 莫名 奇妙 发票 质保 介绍 包卡 统一,neg,"[(0, 0.011021163), (1, 0.011013946), (2, 0.011035166), (3, 0.011023145), (4, 0.011022217), (5, 0.011020146), (6, 0.93386424)]",6
光驱有点闹，且读盘不好，我安装换了3张盘，电池时间过短，只有2小时，16：9的屏幕不大习惯,光驱 读盘 不好 安装 张盘 电池 时间 小时 屏幕 习惯,neg,"[(0, 0.013069709), (1, 0.49652848), (2, 0.013064406), (3, 0.013020536), (4, 0.0130464155), (5, 0.43820503), (6, 0.013065405)]",1
电池的容量较小，也就最多2个小时左右的使用时间。集成的显卡稍微弱一些。,电池 容量 小时 时间 集成 显卡 微弱,neg,"[(0, 0.017937252), (1, 0.017887449), (2, 0.017907914), (3, 0.01790979), (4, 0.017927816), (5, 0.01794967), (6, 0.89248013)]",6
本来想买独显的机器，可惜这款不是独显的，如果是的话就更好了。,本来 想买 独显 机器 可惜 独显 更好,neg,"[(0, 0.89244676), (1, 0.01787665), (2, 0.01791921), (3, 0.018076263), (4, 0.01787627), (5, 0.017900717), (6, 0.017904095)]",0
横纹的设计虽然有整体感，但是显得有点跳跃，尤其是打开后，键盘区域也布满横纹，显得杂乱,横纹 设计 整体感 显得 跳跃 打开 键盘 区域 布满 横纹 显得 杂乱,neg,"[(0, 0.011017025), (1, 0.011010695), (2, 0.011016177), (3, 0.011005949), (4, 0.011011654), (5, 0.9339189), (6, 0.0110196)]",5
京东的价格保护不好用，有很多限制条件，下了订单的第二天就降了100，咨询了客服说是可以申请价保，但是提货时却告知因为赠品不一样不能申请价保，所以多花100很郁闷。,京东 价格 保护 不好 条件 订单 第二天 咨询 客服 申请 价保 提货 告知 赠品 申请 价保 郁闷,neg,"[(1, 0.8878112), (4, 0.072333574)]",1
没有预装系统，原版，自己找技术员安装的盗版系统花掉安装调试费100大洋，心里很不爽，他们说不能安装，又郁闷一阵子。,预装 系统 原版 技术员 安装 盗版 系统 花掉 安装 调试 大洋 不爽 安装 郁闷 一阵子,neg,"[(2, 0.3247004), (4, 0.6304807)]",4
完美支持，但是不习惯。装要刷！（很简单，没那么玄）！系统盘必须要带有9驱动！只有开机有一下爆音，开始后完美使用，托盘区有小喇叭图标！,完美 支持 习惯 装要 简单 系统盘 带有 驱动 开机 爆音 完美 托盘 小喇叭 图标,neg,"[(6, 0.94266653)]",6
外观跟我想象的不一样 ，是康博的电脑，一查原来也属于。没有系统，很麻烦的，也没有驱动盘，我觉得应该送驱动盘。到现在我的总线都没驱起来。管网上也没有。,外观 想象 康博 电脑 系统 麻烦 驱动 驱动 总线 网上,neg,"[(0, 0.013016055), (1, 0.013029339), (2, 0.013053177), (3, 0.013014602), (4, 0.013016341), (5, 0.013006092), (6, 0.9218644)]",6
操作系统安装太麻烦了，弄到现在还装不上去，有谁会的请指点下，:183915145,操作系统 安装 麻烦 指点,neg,"[(0, 0.028601147), (1, 0.028676027), (2, 0.8282053), (3, 0.028597208), (4, 0.028636403), (5, 0.028629178), (6, 0.02865473)]",2
不知道为什么的笔记本，只要不是预装系统的机子，装系统及驱动都特困难，又是升级，又是在不知名的地方下载驱动，惠普的网站上的驱动下载形同虚设！真是搞不懂这么大个公司把产品搞得这么复杂！！！！,笔记本 预装 系统 机子 系统 驱动 困难 升级 知名 地方 下载 驱动 惠普 网站 驱动 下载 形同虚设 搞不懂 公司 产品,neg,"[(6, 0.9590515)]",6
声音有爆音，安装系统，驱动非常麻烦，我是专业人员还搞了一天的时间,声音 有爆 安装 系统 驱动 麻烦 专业 人员 时间,neg,"[(0, 0.01432374), (1, 0.01433954), (2, 0.014372869), (3, 0.27379784), (4, 0.014362072), (5, 0.0143685425), (6, 0.6544354)]",6
不支持和未能提供相关该产品硬件的升级网站，且网站公布的可供下载的驱动不全，需要找工程师才能发链接。,支持 未能 提供 相关 产品 硬件 升级 网站 网站 公布 可供 下载 驱动 工程师 链接,neg,"[(1, 0.94617003)]",1
按客服提供的驱动下载地址去下载安装，最后还有一大堆的未知设备！搞了两天都搞不定，最后只能找朋友帮忙.,客服 提供 驱动 下载 地址 下载安装 一大堆 未知 设备 两天 搞不定 只能 朋友 帮忙,neg,"[(2, 0.24023645), (4, 0.71190387)]",4
对女孩子来说重了点，装系统麻烦，无驱动盘，下载烦，要一个个试。。。,女孩子 系统 麻烦 驱动 下载 一个个,neg,"[(0, 0.02045617), (1, 0.31251287), (2, 0.5851644), (3, 0.020455811), (4, 0.020450508), (5, 0.02046342), (6, 0.020496756)]",2
电脑的包装纸盒上有个非常明显的鞋印，想象京东的包装和运输不是用手来操作的。送的礼包里的电脑屏幕保护贴是弯折的，没法用了。,电脑 包装 纸盒 有个 非常明显 鞋印 想象 京东 包装 运输 操作 礼包 电脑屏幕 保护 弯折 没法用,neg,"[(4, 0.9493053)]",4
声卡驱动是大问题,声卡 驱动,neg,"[(0, 0.047640365), (1, 0.047712106), (2, 0.71380246), (3, 0.047647145), (4, 0.047661573), (5, 0.047632106), (6, 0.047904253)]",2
价格贵了一点；还有装超级麻烦，官方网站都没提供的驱动，到现在还没搞定驱动的问题，老蓝屏，建议要装的兄弟慎重考虑。,价格 一点 超级 麻烦 官方网站 提供 驱动 搞定 驱动 老蓝屏 建议 要装 兄弟 慎重考虑,neg,"[(2, 0.5098692), (3, 0.44232443)]",2
如果不能装就要说清楚，现在因为操作系统的事情费了老大劲了，为这个郁闷了好久！！,操作系统 事情 郁闷 好久,neg,"[(0, 0.02861841), (1, 0.028746571), (2, 0.39068708), (3, 0.46590135), (4, 0.028664991), (5, 0.028699258), (6, 0.02868239)]",3
就是专太费劲了.索性用了.就是用不太习惯呢还!,专太 费劲 索性 习惯,neg,"[(0, 0.02862996), (1, 0.028687075), (2, 0.028670363), (3, 0.02862288), (4, 0.028647365), (5, 0.028807726), (6, 0.8279347)]",6
无系统、无驱动光盘、官方网站无全驱动下载，而且部分硬件（显卡和声卡）为定制型号，不能安装公版驱动，安装特别麻烦，需要一定的电脑基础。,系统 驱动 光盘 官方网站 驱动 下载 硬件 显卡 声卡 定制 型号 安装 公版 驱动 安装 特别 麻烦 电脑 基础,neg,"[(2, 0.95707464)]",2
此款机子不为 设计。装机()比较麻烦，折腾了一天总算搞定。不过还是留有不足，就是声音有时有“扑扑”声响。主要还是不兼容的原因，现在就这么用着吧，以后再升级。,此款 机子 设计 装机 麻烦 折腾 总算 搞定 留有 声音 声响 兼容 原因 升级,neg,"[(2, 0.94265443)]",2
京东的发货员是不是几个月没休息了，为朋友买的东西，收货地址是潍坊诸城，他居然发到我这里，而且写的是：中国海洋大学（诸城市 ）。,京东 发货 几个 休息 朋友 东西 收货 地址 潍坊 诸城 发到 中国 海洋大学 诸城市,neg,"[(3, 0.9425987)]",3
"16:9的物理分辨率,整体看起来屏幕比较矮,看高清不错但是玩游戏可能不太习惯需要适应.还有就是送的杀毒软件完全没有太大用处,还不如送鼠标。散热还是个问题。右下角的方向键感觉似乎有些脆弱！",物理 分辨率 整体 屏幕 高清 不错 玩游戏 习惯 杀毒软件 大用处 鼠标 散热 右下角 方向键 感觉 脆弱,neg,"[(1, 0.709544), (4, 0.2483038)]",1
"直接装,装前也要2驱动盘启动，然后许多设备都有？再从网上找驱动，折腾半天终于装好。惠普有病，不提供一张包括所有设备驱动程序的光盘。少，无1394。关机有轻微嘀声。能改项目少。",驱动 启动 设备 网上 驱动 折腾 半天 终于 惠普 提供 一张 包括 设备 驱动程序 光盘 关机 轻微 嘀声 项目,neg,"[(0, 0.49395487), (6, 0.47019926)]",0
开始装了，但是驱动真的很难找...最后放弃了，装了...用带的来备份...,驱动 真的 放弃 用带 备份,neg,"[(0, 0.023833169), (1, 0.023840308), (2, 0.023872), (3, 0.023874244), (4, 0.023866054), (5, 0.023939319), (6, 0.85677487)]",6
安装比较麻烦，关键是一定要找一张带9的安装盘。按照网上说的方法安装后，未发现声卡问题。,安装 麻烦 关键 一张 安装盘 网上 方法 安装 发现 声卡,neg,"[(0, 0.013021065), (1, 0.92178696), (2, 0.013065516), (3, 0.013031675), (4, 0.013017458), (5, 0.013013018), (6, 0.013064289)]",1
里面没有提供硬盘运行模式切换选项，安装原版盘不行，需要用集成驱动的光盘引导安装。官网上居然没有的驱动，只有的，在网上搜了半天才找到其他本友提供的全套驱动。,提供 硬盘 运行 模式 切换 选项 安装 原版 不行 集成 驱动 光盘 引导 安装 网上 驱动 网上 半天 找到 本友 提供 全套 驱动,neg,"[(1, 0.7982475), (6, 0.17189471)]",1
装非常麻烦，需要准备外置软驱，给光驱及南桥装驱动。官方没有驱动下载。只有打客服电话要他们发给你。尤其声卡，极其麻烦。建议菜鸟要装不要买这机子。装的没问题。,麻烦 外置 软驱 光驱 南桥 驱动 官方 驱动 下载 客服 电话 发给你 声卡 麻烦 建议 菜鸟 要装 机子,neg,"[(2, 0.9547344)]",2
南桥是9，其实不是不足，就是告诉各位装要找内带9驱动的盘,南桥 告诉 装要 内带 驱动,neg,"[(0, 0.0238416), (1, 0.023844058), (2, 0.023905037), (3, 0.023847502), (4, 0.023850787), (5, 0.023838473), (6, 0.85687256)]",6
玩的时候有点卡，看高清占用率40%，内存1小了点需要自己加，没带刻录软件！,高清 占用率 内存 刻录 软件,neg,"[(0, 0.023895033), (1, 0.85651726), (2, 0.024001231), (3, 0.023841131), (4, 0.023885073), (5, 0.023973076), (6, 0.023887219)]",1
1.出风口位置，不过早就知道，不妨碍使用；2.无系统，最好事先准备好相关驱动。,出风口 位置 早就 妨碍 系统 事先 相关驱动,neg,"[(0, 0.01788256), (1, 0.017911026), (2, 0.8924932), (3, 0.017893834), (4, 0.017987149), (5, 0.017917374), (6, 0.017914873)]",2
1.  锡箔纸 贴的 做工很差,锡箔纸 做工,neg,"[(0, 0.047682233), (1, 0.047786675), (2, 0.04774777), (3, 0.047691427), (4, 0.047694806), (5, 0.04772593), (6, 0.71367115)]",6
没有无线网卡，但开关，指示灯都有，拆开看了，网卡插槽，天线都预留了，想办法掏一块装上就行。,无线 网卡 开关 指示灯 拆开 网卡 插槽 天线 预留 办法 一块 装上,neg,"[(0, 0.0110220695), (1, 0.011056481), (2, 0.33118197), (3, 0.6136339), (4, 0.011028328), (5, 0.011025085), (6, 0.0110522155)]",3
没有。还有就是下乡补贴产品，怎么没有那个卡呢？还想补贴一下，结果没找到卡，奇怪！,下乡 补贴 产品 补贴 找到 奇怪,neg,"[(0, 0.020451516), (1, 0.020513816), (2, 0.020511778), (3, 0.5331148), (4, 0.020461895), (5, 0.020486688), (6, 0.3644595)]",3
宏基的散热还是个问题。无风扇转速的设定，温度只有44度，机子风扇就转个不停，而且噪音较大。,宏基 散热 风扇 转速 设定 温度 机子 风扇 不停 噪音 较大,neg,"[(0, 0.37480062), (1, 0.011955387), (2, 0.011970589), (3, 0.011930949), (4, 0.011953904), (5, 0.56544966), (6, 0.011938904)]",5
装系统有点小麻烦，花了我两个小时才把系统软件更新全，另外后面的两个，，太挤了，，而且和电原那么近，只能接小个的盘，读卡器没法用。。。。,系统 小麻烦 两个 小时 系统软件 更新 两个 电原 只能 读卡器 没法用,neg,"[(0, 0.011972386), (1, 0.011971547), (2, 0.01196914), (3, 0.9282135), (4, 0.011955731), (5, 0.011955789), (6, 0.011961914)]",3
唯独不能理解的地方时，和内存占用率都很低的时候，鼠标显示等待，就像是死机了，感受不到8600有多强大，纳闷中。。。,唯独 理解 地方 内存 占用率 很低 鼠标 显示 等待 像是 死机 感受 不到 强大 纳闷,neg,"[(0, 0.8823353), (4, 0.07280555)]",0
电池较弱，特别是在的运行下，看1280*720的电影竟然支持不了两小时,电池 较弱 特别 运行 电影 支持 小时,neg,"[(0, 0.01796614), (1, 0.017944012), (2, 0.27937138), (3, 0.6309228), (4, 0.017902797), (5, 0.017921772), (6, 0.017971123)]",3
"因为是16:9的物理分辨率,整体看起来屏幕比较矮,看高清不错但是玩游戏可能不太习惯需要适应.还有就是送的杀毒软件完全没有太大用处,还不如送鼠标",物理 分辨率 整体 屏幕 高清 不错 玩游戏 习惯 杀毒软件 大用处 鼠标,neg,"[(0, 0.011943875), (1, 0.92832047), (2, 0.011945349), (3, 0.011923062), (4, 0.01198518), (5, 0.011923711), (6, 0.011958366)]",1
京东太会糊弄人了，我选定的圆通 ，竟然给发了免费的经济害我多花了8块钱！,京东 糊弄人 选定 圆通 给发 免费 经济 块钱,neg,"[(0, 0.015914558), (1, 0.9044984), (2, 0.01590387), (3, 0.01591193), (4, 0.015905079), (5, 0.015950572), (6, 0.01591558)]",1
续航时间短 有6芯电池就好了 散热差了点 3-5个小时就有点烫手 硬盘没分区只有1个盘 是正版的就好了,续航 时间 电池 散热 小时 烫手 硬盘 分区 个盘 正版,neg,"[(0, 0.6214183), (1, 0.013017023), (2, 0.013051253), (3, 0.013007356), (4, 0.013055147), (5, 0.013037537), (6, 0.3134134)]",0
"1，电池不够强大,续航差点",电池 强大 续航 差点,neg,"[(0, 0.82828194), (1, 0.028593332), (2, 0.028637294), (3, 0.028590607), (4, 0.028645247), (5, 0.028642943), (6, 0.028608624)]",0
"风扇声音大网速太一般了元2的流量,不知道移动是怎么想了.打开一个网页就得几了,能打开几个网页,太贵了.速度太普通了.",风扇 声音 网速 流量 打开 网页 打开 几个 网页 太贵 速度 太普通,neg,"[(0, 0.0110245785), (1, 0.011021066), (2, 0.011027136), (3, 0.011017457), (4, 0.011020185), (5, 0.011048146), (6, 0.9338414)]",6
发热量稍微有点点大！,发热量 稍微 点点,neg,"[(0, 0.035802417), (1, 0.03588573), (2, 0.78491634), (3, 0.035770033), (4, 0.035772633), (5, 0.035884358), (6, 0.035968494)]",2
电池背后部分做工不是特别好，略显松有点点缝隙不仔细看看不出。另外送的白色皮质内胆包觉得稍显大了一点，表面皮质不错，当中纯粹是2块薄薄的海绵板，里面看起来很山寨。电池有点突出当然是指底部。,电池 背后 做工 特别 略显 点点 缝隙 仔细 白色 皮质 内胆 显大 一点 表面 皮质 不错 薄薄的 海绵 山寨 电池 底部,neg,"[(1, 0.9608441)]",1
1、没有附赠鼠标，有点不方便；,附赠 鼠标,neg,"[(0, 0.047832105), (1, 0.7134576), (2, 0.047672458), (3, 0.047698665), (4, 0.047869653), (5, 0.047708295), (6, 0.047761224)]",1
电池、无线网卡问题如下,电池 无线 网卡,neg,"[(0, 0.035836257), (1, 0.03584865), (2, 0.7850875), (3, 0.035821132), (4, 0.035725795), (5, 0.03583209), (6, 0.035848554)]",2
买回来好像有点污点，但愿不是返修机，授权码那张纸感觉很旧，机身有点重,买回来 好像 污点 返修 授权 感觉 机身,neg,"[(0, 0.017896812), (1, 0.017932417), (2, 0.017968368), (3, 0.017928649), (4, 0.01798138), (5, 0.68831354), (6, 0.22197886)]",5
京东货不对版，发来的明明是型号100，但是网页和发票写的却是100，而且手托的地方，微星贴的银色反光标签却写100 。,京东 对版 发来 明明 型号 网页 发票 却是 手托 地方 微星 银色 反光 标签,neg,"[(5, 0.9425638)]",5
说明书太简单了点。装机自带的一些软件没有任何说明。希望以后服务能够做得再细致点。,说明书 简单 装机 自带 软件 希望 服务 细致,neg,"[(0, 0.015903205), (1, 0.90457505), (2, 0.015889678), (3, 0.015916627), (4, 0.015896756), (5, 0.015883848), (6, 0.015934853)]",1
没有其他颜色选择。送货的圆通服务真是一般，只送到楼下，以前京东用邮政快递的送到到家门口的。,颜色 选择 送货 圆通 服务 送到 楼下 京东 邮政 快递 送到 家门口,neg,"[(0, 0.01101719), (1, 0.9338295), (2, 0.011010074), (3, 0.011012681), (4, 0.011028257), (5, 0.0110696945), (6, 0.011032586)]",1
