标题,时间,新闻内容,新闻链接,分词,情感分值
翼型、叶栅空气动力学重点实验室自主开发的NPU-MWA翼型首次成功应...,2022-07-28,西工大新闻网7月28日电（郑可风 刘子侨）近日，受吉林重通成飞新材料有限公司邀请，翼型、叶栅空气动力学重点实验室韩忠华教授、宋文萍教授以及许建华、邓磊、刘子侨和郑可风等师生一行6人前往甘肃武威进行合作交流，并参加首支CGI90.5A叶片下线仪式。吉林重通成飞副总经理、总工程师张石强，甘肃公司总经理张政介绍了公司的发展历史、先进制造工艺和未来规划。吉林重通成飞是中国可再生能源行业协会常务理事单位，吉林省高新技术企业，下设吉林大安、重庆珞璜、内蒙古锡林浩特、甘肃武威、江苏如东五大生产制造基地，主要产品为2MW、2.5/3MW、4MW、5MW、6MW等不同规格型号的陆上与海上风轮叶片，具备年产近2000套风轮叶片能力，是国内风轮叶片的主流配套企业。重点实验室主任韩忠华教授介绍了实验室概况、先进翼型研究的重要意义、实验室的人才培养和代表性创新成果、自主风力机翼型族的设计及应用等。随后，双方就风力机翼型族的风洞试验和NPU-MWA自主翼型族的国产化叶片应用等方面进行了充分的交流讨论，并表示将在多兆瓦级风力机翼型自主研发、叶片气动/结构耦合分析与设计等方面加强合作交流，突破核心关键技术，打破国外在先进风力机翼型族和大型叶片设计等方面的封锁，助力我国风电装备的国产化。重点实验室师生与吉林重通领导和技术人员进行风力机翼型与叶片设计的交流讨论交流会后，实验室师生参加了首支CGI90.5A叶片下线仪式。该叶片长度90.5米，是国内自主多兆瓦级翼型的首次成功应用。NPU-MWA翼型族的成功应用，是我国自主风力机翼型研究的重要里程碑，也是实验室充分发挥翼型研究的特色和优势，并实现产学研合作的又一标志性成果。双方人员在叶片生产一线交流NPU-MWA翼型族包含了相对厚度从18%到60%的8个翼型，具有高设计雷诺数（900万）、高设计升力系数（大于1.2）、高升阻比和低粗糙度敏感性等优良特性，由宋文萍教授和重点实验室主任韩忠华教授主持研发，由实验室副主任高永卫教授以及焦予秦、惠增宏、邓磊等老师完成风洞试验验证，许建华、王跃、宋科等10多位教师和余雷、黄意坚、李扬等20多名硕博士生参与了翼型族的设计、分析与风洞试验验证等工作。NPU-MWA多兆瓦级风力机翼型族风洞试验在国家推进双碳战略的大背景下，实验室未来将加强与国内风电企业合作，共同推动NPU-MWA翼型族在多兆瓦级风力机叶片上的全面应用，并完善翼型谱系，研发针对超大型及小型风力机叶片的新翼型族，助力我国在可再生能源领域的高水平自立自强。审核：宣建林,https://news.nwpu.edu.cn/info/1002/82670.htm,西工大 新闻网 日电 郑可风 刘子 近日 吉林 重通成 飞新 材料 有限公司 邀请 翼型 叶栅 空气 动力学 重点 实验室 韩忠华 教授 宋文萍 教授 建华 邓磊 刘子 郑可风 师生 一行 前往 甘肃 武威 合作 交流 参加 首支 叶片 下线 仪式 吉林 重通 成飞 副总经理 总工程师 张石强 甘肃 公司 总经理 张政 介绍 公司 发展 历史 先进 制造 工艺 未来 规划 吉林 重通 成飞 中国 再生能源 行业协会 常务理事 单位 吉林省 高新技术 企业 下设 吉林 大安 重庆 珞璜 内蒙古 锡林浩特 甘肃 武威 江苏 如东 五大 生产 制造 基地 产品 规格型号 陆上 海上 风轮 叶片 具备 年产 风轮 叶片 能力 国内 风轮 叶片 主流 配套 企业 重点 实验室 主任 韩忠华 教授 介绍 实验室 概况 先进 翼型 研究 意义 实验室 人才培养 代表性 创新 成果 自主 风力机 翼型 设计 风力机 翼型 风洞试验 自主 翼型 国产化 叶片 交流 讨论 兆瓦 风力机 翼型 自主 研发 叶片 气动 结构 耦合 分析 设计 合作 交流 突破 核心 关键技术 打破 国外 先进 风力机 翼型 大型 叶片 设计 封锁 助力 我国 风电 装备 国产化 重点 实验室 师生 吉林 重通 领导 技术人员 风力机 翼型 叶片 设计 交流 讨论 交流会 实验室 师生 参加 首支 叶片 下线 仪式 叶片 长度 国内 自主 兆瓦 翼型 首次 成功 翼型 成功 我国 自主 风力机 翼型 研究 里程碑 实验室 充分发挥 翼型 研究 特色 优势 产学研 合作 标志性 成果 人员 叶片 生产 一线 交流 翼型 包含 厚度 翼型 设计 雷诺数 设计 升力 系数 大于 高升 阻比 粗糙度 敏感性 优良 特性 宋文萍 教授 重点 实验室 主任 韩忠华 教授 主持 研发 实验室 主任 高永卫 教授 焦予 增宏 邓磊 老师 风洞试验 验证 建华 王跃 宋科 多位 教师 余雷 黄意坚 李扬 多名 博士生 参与 翼型 设计 分析 风洞试验 验证 工作 兆瓦 风力机 翼型 风洞试验 国家 推进 双碳 战略 背景 实验室 未来 国内 风电 企业 合作 推动 翼型 兆瓦 风力机 叶片 完善 翼型 谱系 研发 超大型 小型 风力机 叶片 翼型 助力 我国 再生能源 领域 高水平 自立自强 审核 宣建林,0.9903
西北工业大学与华为成立“01创新实验室”，共同推进原始创新,2022-07-28,西工大新闻网7月27日电（张亚男）近日，西北工业大学-华为技术有限公司“01创新实验室”揭牌仪式在我校友谊校区举行。西北工业大学校长助理张艳宁、科学技术研究院院长马炳和、计算机学院副院长邓磊、院长助理郭斌、华为云技术创新部部长漆宝剑、华为云技术创新部HRBP黄国强、华为云边缘云创新Lab主任王烽等出席揭牌仪式。会议由计算机学院院长、01创新实验室主任於志文主持。张艳宁在致辞中表示，西北工业大学与华为技术有限公司双方有着良好的合作基础，希望创新实验室能够充分发挥双方各自的优势，力争产生战略性、引领性的技术成果，携手把创新实验打造成原始创新的基地和校企合作的典范。漆宝剑表示，01创新实验室以计算机领域的基础性技术突破为目标，希望依托西北工业大学的优势学科力量，共同产出具有高影响力的原创性科技成果。随后张艳宁、马炳和、於志文、漆宝剑、黄国强和王烽共同为01创新实验室揭牌。揭牌仪式后举行了实验室技术研讨会，分别由华为云创新Lab主任王烽、计算机学院教授谢磊、创新实验室马可、李梦媛就云机器人、智能语音、边端情景自适应等方面技术进行了交流和研讨。据悉，为响应国家提出的加强“从0到1”原始创新的号召，西工大计算机学院2020年启动了“01创新工程”，围绕“01学术沙龙、01创新实验室、01创新工厂”，着力推进理论、技术、产业的全链条创新。01创新实验室作为整个创新工程的中间环节，承载着将创新思想转化为创新技术的核心功能。01创新实验室依托我校计算机科学与技术国家重点学科，联合华为公司，发挥双方各自优势，力争产生战略性、引领性的技术成果，同时也为我校的“双一流”建设提供重要支撑。（审核：万海东）,https://news.nwpu.edu.cn/info/1002/82663.htm,西工大 新闻网 日电 张亚 近日 西北工业大学 华为技术有限公司 创新 实验室 揭牌 仪式 我校 友谊 校区 西北工业大学 校长助理 张艳宁 科学技术 研究院 院长 马炳 计算机 学院 院长 邓磊 院长 助理 郭斌 华为 技术创新 部长 宝剑 华为 技术创新 黄国强 华为 边缘 创新 主任 王烽 出席 揭牌 仪式 会议 计算机 学院 院长 创新 实验室 主任 志文 主持 张艳宁 致辞 西北工业大学 华为技术有限公司 合作 基础 希望 创新 实验室 充分发挥 优势 力争 战略性 引领 技术 成果 携手 创新 实验 原始 创新 基地 校企 合作 典范 宝剑 创新 实验室 计算机领域 基础性 技术 突破 目标 希望 依托 西北工业大学 优势 学科 力量 产出 影响力 原创性 科技成果 张艳宁 马炳 志文 宝剑 黄国强 王烽 创新 实验室 揭牌 揭牌 仪式 实验室 技术 研讨会 华为 创新 主任 王烽 计算机 学院 教授 谢磊 创新 实验室 马可 李梦媛 机器人 智能 语音 边端 情景 技术 交流 研讨 响应 国家 提出 原始 创新 号召 西工大 计算机 学院 启动 创新 工程 围绕 学术 沙龙 创新 实验室 创新 工厂 着力 推进 理论 技术 产业 链条 创新 创新 实验室 创新 工程 中间环节 承载 创新 思想 转化 创新 技术 核心 功能 创新 实验室 依托 我校 计算机科学 技术 国家 重点学科 联合 华为公司 发挥 优势 力争 战略性 引领 技术 成果 我校 一流 建设 提供 支撑 审核 海东,0.9977
工信部总经济师许科敏调研西工大宁波研究院,2022-07-26,西工大新闻网7月26日电 7月26日上午，工业和信息化部总经济师许科敏一行莅临西工大宁波研究院考察调研。在技术成果展厅，盛其杰院长汇报了研究院在人才引育、科技创新、成果转化和产业发展的有关情况。随后，许科敏一行参观了研究院卫星测运控中心、八英寸硅基MEMS芯片加工线、柔性印刷电子浆料实验室、柔性电子发光材料中试线等技术平台。许科敏对研究院围绕宁波“246万千亿级产业集群”部署创新链取得的成效给予肯定，鼓励研究院加快科技创新步伐，纵深推进产学研融合，为制造强国贡献智慧和力量。工信部规划司二级巡视员贺晓文、宁波市经信局局长张世方等陪同。（审稿：盛其杰）,https://news.nwpu.edu.cn/info/1002/82662.htm,西工大 新闻网 日电 上午 工业 信息化 总经济师 许科敏 一行 莅临 西工大 宁波 研究院 考察 调研 技术 成果 展厅 盛其杰 院长 汇报 研究院 人才 引育 科技 创新 成果 转化 产业 发展 情况 许科敏 一行 参观 研究院 卫星 测运控 中心 八英寸 硅基 芯片 加工 柔性 印刷 电子 浆料 实验室 柔性 电子 发光 材料 中试 技术 平台 许科敏 研究院 围绕 宁波 万千 亿级 产业 集群 部署 创新 成效 给予 肯定 鼓励 研究院 加快 科技 创新 步伐 纵深 推进 产学研 融合 制造 强国 贡献 智慧 力量 工信部 规划司 二级 巡视员 贺晓文 宁波市 经信 局局长 张世方 陪同 审稿 盛其杰,0.9966
“一带一路”航天创新联盟常设秘书处办公室（文昌）在文昌国际航...,2022-07-24,西工大新闻网7月24日电（张桐）2022年7月22日，“一带一路”航天创新联盟常设秘书处办公室（文昌）在文昌国际航天城揭牌。文昌国际航天城管理局副局长王广智，西北工业大学国际合作处处长兼国际教育学院院长张富利以及中外师生代表等参加揭牌仪式。王广智首先代表文昌国际航天城管理局对西工大师生表示热烈欢迎，详细介绍了文昌国际航天城的发展规划和目标，希望能够充分发挥“一带一路”航天创新联盟的国际平台网络优势，持续加强与世界航天同行的深度互动，将航天城建设成为开放型、国际化、创新融合的世界级航天城，为联盟发展做出更大贡献。陈俊表示，在文昌设立办公室将为联盟今后依托海南自贸港的区位优势和借助文昌国际航天城的便利条件，进一步推动航天领域人才培养、科学研究和学术交流打下坚实基础，推动航天科技更好服务人类。随后，文昌国际航天城管理局招商处邱金坤处长以《商业航天的故事》为题，就世界航天产业发展、中国航天历史、文昌航天产业优势等维度与师生进行了精彩分享和互动。张富利在活动总结中指出，文昌国际航天城是海南自由贸易港的重要组成部分，是航天强国建设的重要基地，也是新时代航天国际交流与合作的重要平台和载体。学校将充分发挥航天领域学科优势和“一带一路”航天创新联盟品牌优势，推动联盟内涵式发展，为助力文昌国际航天城建设贡献更大力量。文昌国际航天城是海南自由贸易港11个重点园区之一，是中国首个商业航天发射场。依托海南文昌航天发射场，文昌国际航天城重点发展国际商业航天发射、火箭卫星研制、航天数据应用、航天教育培训等产业，构建火箭链、卫星链、数据链产业生态体系，建设世界一流的国际航天城。2022年4月，文昌国际航天城管理局正式加入“一带一路”航天创新联盟。（审稿：陈俊）,https://news.nwpu.edu.cn/info/1002/82640.htm,西工大 新闻网 日电 张桐 一带 一路 航天 创新 联盟 常设 秘书处 办公室 文昌 文昌 国际 航天城 揭牌 文昌 国际 航天城 管理局 副局长 王广智 西北工业大学 国际 合作 处处长 国际 教育 学院 院长 张富利 中外 师生 代表 参加 揭牌 仪式 王广智 代表 文昌 国际 航天城 管理局 西工大 师生 热烈欢迎 详细 介绍 文昌 国际 航天城 发展 规划 目标 希望 充分发挥 一带 一路 航天 创新 联盟 国际 平台 网络 优势 持续 世界 航天 同行 深度 互动 航天城 建设 开放型 国际化 创新 融合 世界级 航天城 联盟 发展 做出 更大 贡献 陈俊 文昌 设立 办公室 联盟 依托 海南 自贸港 区位 优势 借助 文昌 国际 航天城 便利 条件 进一步 推动 航天 领域 人才培养 科学研究 学术交流 打下 坚实基础 推动 航天 科技 更好 服务 人类 文昌 国际 航天城 管理局 招商 金坤 处长 商业 航天 故事 为题 世界 航天 产业 发展 中国航天 历史 文昌 航天 产业 优势 维度 师生 精彩 分享 互动 张富利 活动 指出 文昌 国际 航天城 海南 自由贸易 组成部分 航天 强国 建设 基地 时代 航天 国际交流 合作 平台 载体 学校 充分发挥 航天 领域 学科 优势 一带 一路 航天 创新 联盟 品牌优势 推动 联盟 内涵式 发展 助力 文昌 国际 航天城 建设 贡献 更大 力量 文昌 国际 航天城 海南 自由贸易 重点 园区 中国 首个 商业 航天 发射场 依托 海南 文昌 航天 发射场 文昌 国际 航天城 重点 发展 国际 商业 航天 发射 火箭 卫星 研制 航天 数据 航天 教育 培训 产业 构建 火箭 卫星 数据链 产业 生态 体系 建设 世界 一流 国际 航天城 文昌 国际 航天城 管理局 正式 一带 一路 航天 创新 联盟 审稿 陈俊,0.9948
西工大三项成果获“吴文俊人工智能科学技术奖”,2022-07-23,"西工大新闻网7月23日电 近日，被誉为我国智能科学技术最高奖“吴文俊人工智能科学技术奖”颁奖盛典在北京举行，66个获奖项目及个人受到表彰奖励。西北工业大学获得3项奖励，其中技术发明奖一等奖1项、自然科学奖二等奖1项、优秀青年奖1项。“吴文俊人工智能科学技术奖”由中国人工智能学会发起主办，得到了我国智能科学研究的开拓者和领军人、首届国家最高科学技术奖获得者、中国科学院院士、中国人工智能学会名誉理事长吴文俊的支持，于2011年1月6日正式设立。迄今，“吴文俊人工智能科学技术奖”已成功召开十一届评审及表彰活动，在我国智能科学技术领域享有盛誉。2021年度吴文俊人工智能科学技术奖获奖名单奖项授奖等级主要完成人成果名称技术发明奖一等奖韩军伟,姚西文,王宁,程塨,布树辉,刘贞报高空无人机对地精准观测技术自然科学奖二等奖许斌,孙富春,杨秦敏,寿莹鑫,王霞面向学习性能提升的不确定非线性系统智能控制优秀青年奖——张鼎文——获奖成果及个人简介：一、高空无人机对地精准观测技术高空无人机作为一种新兴的对地观测平台，因其飞行高度高、监测范围广等显著特点，有效弥补了有人飞机、卫星等传统平台的不足，广泛应用于各领域。然而，高空无人机在执行对地观测任务时仍存在关键技术瓶颈。西工大韩军伟教授团队攻克了多项关键技术，研发了“效率高、检测快、识别准”的高空无人机对地观测技术系统，该项目系统复杂、技术难度大，具有很强的创新性，拥有自主知识产权，授权国家发明专利35项，发表国内外重要期刊论文30余篇。该项目突破了高空长航时无人机在执行对地观测任务中存在的效率低、检测慢、识别差等关键技术瓶颈，整体技术达到了国际先进水平。（实验室固定翼无人机飞行试验）二、面向学习性能提升的不确定非线性系统智能控制新一代飞行器面向远距飞行以及高机动飞行，采用静不稳定设计，系统对外界变化敏感，面对当下飞行器面对的技术困难，亟需发展不确定快变系统的智能控制理论。西工大许斌教授团队项目自2008年开始探讨非线性系统的不确定学习问题，针对非线性系统快时变、静不稳、强干扰对智能控制的挑战，瞄准学习性能提升，提出了学习适应、强化增稳、协同鲁棒的智能控制理论方法。研究成果应用于高超声速飞行器，确保了可控和品质，并开展了C919品模试验提升了乘客舒适性。（许斌教授团队合影）三、张鼎文西北工业大学教授、博导。科睿唯安全球“高被引科学家”。2015赴美国卡耐基梅隆大学进行为期2年的访问研究。获2021 IEEE TCSVT 最佳论文奖，中国图象图形学学会优秀博士论文奖，吴文俊人工智能优秀青年奖等奖励。致力于建立面向开放环境下、具备动态学习能力的新一代计算机视觉学习框架。在IEEE TPAMI 与IJCV发表论文十余篇。担任IEEE TMM 与 TCSVT 的 Leading Guest Editor, 担任 ACM MM 及 ICCV 的 Workshop Organizer。承担国家自然科学基金委企业联合重点项目课题、国家自然科学基金委面上项目等。（张鼎文教授）（审稿：韩军伟 许斌 王丽）",https://news.nwpu.edu.cn/info/1002/82637.htm,西工大 新闻网 日电 近日 被誉为 我国 智能 科学技术 最高奖 吴文俊 人工智能 科学技术 颁奖 盛典 北京 获奖 项目 表彰 奖励 西北工业大学 奖励 技术 发明奖 一等奖 自然科学 二等奖 优秀青年 吴文俊 人工智能 科学技术 中国 人工智能 学会 发起 主办 我国 智能科学 研究 开拓者 领军人 首届 国家 科学技术 获得者 中国科学院 院士 中国 人工智能 学会 名誉 理事长 吴文俊 支持 正式 设立 迄今 吴文俊 人工智能 科学技术 成功 十一届 评审 表彰 活动 我国 智能 科学技术 领域 享有盛誉 年度 吴文俊 人工智能 科学技术 获奖 名单 奖项 授奖 等级 成果 名称 技术 发明奖 一等奖 韩军伟 西文 王宁 布树辉 刘贞报 高空 无人机 精准 观测 技术 自然科学 二等奖 许斌 孙富春 秦敏 寿莹鑫 王霞 面向 学习 性能 提升 非线性 系统 智能 控制 优秀青年 张鼎文 获奖 成果 个人简介 高空 无人机 精准 观测 技术 高空 无人机 一种 新兴 观测 平台 飞行高度 监测 范围广 显著特点 弥补 有人 飞机 卫星 传统 平台 广泛应用 领域 高空 无人机 执行 观测 关键技术 瓶颈 西工大 韩军伟 教授 团队 攻克 多项 关键技术 研发 效率高 检测 识别 高空 无人机 观测 技术 系统 项目 系统 技术难度 很强 创新性 拥有 自主 知识产权 授权 国家 发明专利 发表 国内外 期刊论文 余篇 项目 突破 高空 长航 无人机 执行 观测 效率 检测 识别 关键技术 瓶颈 整体 技术 国际 先进 水平 实验室 固定翼 无人机 飞行 试验 面向 学习 性能 提升 非线性 系统 智能 控制 新一代 飞行器 面向 远距 飞行 机动 飞行 采用 稳定 设计 系统对 外界 变化 敏感 面对 飞行器 面对 技术 困难 亟需 发展 快变 系统 智能 控制 理论 西工大 许斌 教授 团队 项目 探讨 非线性 系统 学习 非线性 系统 时变 静不稳 干扰 智能 控制 挑战 瞄准 学习 性能 提升 提出 学习 强化 增稳 协同 鲁棒 智能 控制 理论 方法 研究成果 超声速 飞行器 确保 可控 品质 品模 试验 提升 乘客 舒适性 许斌 教授 团队 合影 张鼎文 西北工业大学 教授 博导 科睿 科学家 赴美国 卡耐基 梅隆 大学 为期 访问 研究 最佳 论文 中国 图象 图形学 学会 优秀 博士论文 吴文俊 人工智能 优秀青年 奖励 致力于 建立 面向 开放 环境 具备 动态 学习 能力 新一代 计算机 视觉 学习 框架 发表 论文 十余篇 担任 担任 承担 国家自然科学基金 企业 联合 重点项目 课题 国家自然科学基金 面上 项目 张鼎文 教授 审稿 韩军伟 许斌 王丽,0.996
西工大中外青年代表受邀参加世界青年发展论坛,2022-07-23,西工大新闻网7月23日电（王力泉）7月21日，世界青年发展论坛在京开幕。国家主席习近平向论坛致贺信。尼日尔总统巴祖姆、联合国秘书长古特雷斯、世界经济论坛创始人兼执行主席施瓦布等100多位中外嘉宾和100多个国家约2000名青年代表通过线上线下方式参加会议。我校15名中外青年代表受邀前往陕西分会场，与团省委书记、省青联主席徐永胜，团省委统战部部长、省青联秘书长李宗际等共同在陕西分会场参加世界青年发展论坛相关活动。本次论坛在首发“全球青年发展行动计划启动宣传片”后，面向全世界发出《青年优先发展国际倡议》。学校土库曼斯坦籍留学生ASTANOVA ELMIRA在启动宣传片中代表西工大青年坚定发声，表示“我们年轻一代在建设和平，推动更大的发展和改变世界方面发挥着更大的作用”。软件学院2020级本科生周子龙在参加论坛后表示，参加此次世界青年发展论坛让他更加深刻地认识到作为当代中国青年应当有全球视野、国际眼光，要在构建人类命运共同体的实践中贡献青春力量。学校历来高度重视中外青年交流互鉴、互取所长，并于今年6月正式入选团中央留学生平台试点高校（陕西仅2所），作为第一批入选高校，学校以团中央“中外大学生社会实践周”活动开展为契机，结合小切口、多角度的方式增进来华留学生对中华历史、中国文化、中国道路、中国制度的感知和理解，引导中外学生携手共绘同心圆，共同谱写世界青年团结合作的时代新篇章，相关工作获得共青团中央“创青春”官方平台全文报道。未来，校团委将与国际教育学院等相关单位进一步强化协同交流，为青年搭建舞台，引导更多的青年参与到推动构建人类命运共同体的实践中。（审稿：马婷婷）,https://news.nwpu.edu.cn/info/1002/82636.htm,西工大 新闻网 日电 王力泉 世界 青年 发展 论坛 在京开幕 国家 主席 习近平 论坛 贺信 尼日尔 总统 巴祖姆 联合国 秘书长 特雷斯 世界 经济 论坛 创始人 执行主席 施瓦布 多位 中外 嘉宾 多个 国家 青年 代表 上线 方式 参加 会议 我校 中外 青年 代表 受邀 前往 陕西 分会场 团省委 书记 青联 主席 永胜 团省委 统战部 部长 青联 秘书长 李宗际 陕西 分会场 参加 世界 青年 发展 论坛 相关 活动 本次 论坛 首发 全球 青年 发展 行动计划 启动 宣传片 面向 全世界 发出 青年 优先发展 国际 倡议 学校 土库曼斯坦 留学生 启动 宣传片 代表 西工大 青年 坚定 发声 年轻一代 建设 和平 推动 更大 发展 改变 世界 发挥 作用 软件 学院 本科生 周子 参加 论坛 参加 世界 青年 发展 论坛 深刻 当代 中国 青年 全球 视野 国际 眼光 构建 人类 命运 共同体 实践 贡献 青春 力量 学校 历来 高度重视 中外 青年 交流 互鉴 互取 所长 正式 入选 团中央 留学生 平台 试点 高校 陕西 第一批 入选 高校 学校 团中央 中外 大学生 社会 实践 活动 契机 切口 多角度 方式 增进 来华 留学生 中华 历史 中国 文化 中国 道路 中国 制度 感知 理解 引导 中外 学生 携手 共绘 同心圆 谱写 世界 青年 团结合作 时代 新篇章 相关 工作 共青团中央 青春 官方 平台 全文 报道 未来 校团委 国际 教育 学院 相关 单位 进一步 强化 协同 交流 青年 搭建 舞台 引导 青年 参与 推动 构建 人类 命运 共同体 实践 审稿 婷婷,0.9976
