标题,时间,新闻内容,新闻链接,分词,情感分值
西工大与多方签订战略协议  助力煤炭行业高质量发展,2023-02-19,西工大新闻网2月17日电（石佳妹)2月10日，西工大陕西网络创新研究院与陕西涌鑫矿业有限责任公司、国家计算机网络与信息安全管理中心、陕西陕煤榆北煤业榆林信息化运维公司签订煤矿网络安全战略协议。西工大网创院副院长王勇，陕西涌鑫矿业有限责任公司党委书记、董事长谢党虎，国家计算机网络与信息安全管理中心相关负责人，陕西陕煤榆北煤业榆林信息化运维公司相关负责人等出席了此次签订专题会。国家计算机网络与信息安全管理中心相关负责人对煤矿网络安全发展态势及煤炭网络安全的重要性进行了说明。王勇提出，随着智能化建设的不断深入和信息化程度的不断提高，煤矿网络安全已关系到智能化矿井的生产经营，只有将网络安全与智能化同步规划、同步建设、同步运营，才可有效助力煤炭企业生产能效与安全能力的提升，助力煤炭行业高质量发展。谢党虎表示，通过此次煤矿网络安全战略合作，将不断提升智能化矿井网络安全风险辨识能力与风险异常处置能力，形成煤矿网络安全闭环处置能力，充分发挥煤矿网络安全试点示范作用，为行业发展提供经验、贡献力量。陕西陕煤榆北煤业榆林信息化运维公司相关负责人表示，通过合作将陕西涌鑫矿业有限责任公司作为煤炭行业网络安全的示范试点单位，加快构建煤炭网络安全保证体系，全天候、全方位感知网络安全态势，增强网络安全防护能力和威慑能力，保障智能化矿井的安全生产。会上，参会人员共同见证了《煤矿网络安全战略协议书》的签订，并对煤炭行业智能化建设、网络安全等进行了深入讨论交流。（审核：王勇）,https://news.nwpu.edu.cn/info/1002/88209.htm,西工大 新闻网 日电 石佳妹 西工大 陕西 网络 创新 研究院 陕西 涌鑫 矿业 有限责任 公司 国家 计算机网络 信息安全 管理中心 陕西 陕煤 榆北 煤业 榆林 信息化 运维 公司 签订 煤矿 网络安全 战略 协议 西工大 创院 院长 王勇 陕西 涌鑫 矿业 有限责任 公司 党委书记 董事长 谢党 国家 计算机网络 信息安全 管理中心 相关 负责人 陕西 陕煤 榆北 煤业 榆林 信息化 运维 公司 相关 负责人 出席 签订 专题 国家 计算机网络 信息安全 管理中心 相关 负责人 煤矿 网络安全 发展 态势 煤炭 网络安全 重要性 王勇 提出 智能化 建设 不断深入 信息化 程度 提高 煤矿 网络安全 关系 智能化 矿井 生产 经营 网络安全 智能化 同步 规划 同步 建设 同步 运营 助力 煤炭企业 生产 能效 能力 提升 助力 煤炭行业 高质量 发展 谢党 煤矿 网络安全 战略 合作 提升 智能化 矿井 网络安全 风险 辨识 能力 风险 异常 处置 能力 煤矿 网络安全 闭环 处置 能力 充分发挥 煤矿 网络安全 试点 示范作用 行业 发展 提供 经验 贡献力量 陕西 陕煤 榆北 煤业 榆林 信息化 运维 公司 相关 负责人 合作 陕西 涌鑫 矿业 有限责任 公司 煤炭行业 网络安全 示范 试点单位 加快 构建 煤炭 网络安全 保证体系 全天候 全方位 感知 网络安全 态势 增强 网络安全 防护 能力 威慑 能力 保障 智能化 矿井 生产 会上 参会 人员 见证 煤矿 网络安全 战略 协议书 签订 煤炭行业 智能化 建设 网络安全 讨论 交流 审核 王勇,0.0925
校领导带队赴北京相关单位单位走访调研,2023-02-17,西工大新闻网2月15日电（党委学生工作部)2月9日-10日，副校长詹浩带队赴北京相关国防主机单位走访调研，访企拓岗促就业。9日上午，詹浩副校长一行在科工四院四部党委书记周逸陪同下参观了四部展室和黄纬禄精神讲堂，对四部发展历程进行了详细了解。随后双方围绕人才全过程全周期培养支持、科研合作、工程硕博士联合培养等校企合作内容进行了深入交流，进一步推动四部与学校的交流合作。下午，詹浩副校长一行来到航天科工三院进行调研交流，在我校校友、三院党委书记史新兴陪同下重点参观了三院飞航展厅，对三院的发展历程和现状进行深入了解。随后与三院相关领导及校友代表进行了交流座谈，听取校友对学校发展的意见和建议，并重点就人才培养质量提升、人才输送、学生实习就业等内容进行了详细研讨。10日上午，詹浩副校长一行赴航天科工二院走访调研，在二院党委书记马杰陪同下首先参观二院院史展厅，详细了解二院的发展历程。随后双方围绕校企人才培养、联合实验室、辅导员挂职锻炼等内容进行了交流，并听取对学校人才培养、校企合作的相关意见和建议，达成共识，为未来合作确定方向。下午，詹浩副校长一行来到中航技进出口有限责任公司走访调研，在公司党委委员、纪委书记姜鹏陪同下重点参观了公司外贸展厅，集中了解了我国各类型外贸航空装备。随后与中航技老中青三代校友进行了交流座谈，重点听取了校友对学校发展和人才培养的意见和建议，会上，双方就深入校企融合人才培养、搭建海外学习实践平台等内容进行详细交流，进一步拓宽合作广度和深度。航空学院、航天学院、机电学院、无人系统技术研究院、党委学生工作部及校友会相关同志陪同调研。（审核：刘伟）,https://news.nwpu.edu.cn/info/1002/88149.htm,西工大 新闻网 日电 党委 学生 工作部 副校长 詹浩 带队 北京 相关 国防 主机 单位 走访 调研 访企拓岗促 就业 上午 詹浩 副校长 一行 科工 四院 四部 党委书记 周逸 陪同 参观 四部 展室 黄纬禄 精神 讲堂 四部 发展 历程 详细 围绕 人才 全过程 周期 培养 支持 科研 合作 工程 博士 联合 培养 校企 合作 内容 交流 进一步 推动 四部 学校 交流 合作 下午 詹浩 副校长 一行 来到 航天 科工 三院 调研 交流 我校 校友 三院 党委书记 新兴 陪同 重点 参观 三院 飞航 展厅 三院 发展 历程 现状 三院 相关 领导 校友 代表 交流 座谈 听取 校友 学校 发展 意见 建议 重点 人才培养 质量 提升 人才 输送 学生 实习 就业 内容 详细 研讨 上午 詹浩 副校长 一行 航天 科工 二院 走访 调研 二院 党委书记 马杰 陪同 参观 二院 院史 展厅 详细 二院 发展 历程 围绕 校企 人才培养 联合 实验室 辅导员 挂职锻炼 内容 交流 听取 学校 人才培养 校企 合作 相关 意见 建议 达成 共识 未来 合作 方向 下午 詹浩 副校长 一行 来到 中航技 进出口 有限责任 公司 走访 调研 公司 党委委员 纪委书记 姜鹏 陪同 重点 参观 公司 外贸 展厅 我国 类型 外贸 航空 装备 中航技 老中青 三代 校友 交流 座谈 重点 听取 校友 学校 发展 人才培养 意见 建议 会上 校企 融合 人才培养 搭建 海外 学习 实践 平台 内容 详细 交流 进一步 拓宽 合作 广度 深度 航空学院 航天 学院 机电 学院 无人 系统 技术 研究院 党委 学生 工作部 校友会 相关 同志 陪同 调研 审核 刘伟,0.9965
陕西高校思政课省级名师工作室座谈会在西北工业大学召开,2023-02-16,西工大新闻网2月16日电（谢佳君）为做好全省高校思政课省级名师工作室建设，建强思政课教师队伍，推进思政课改革创新，2月15日上午，陕西高校思政课省级名师工作室座谈会在西北工业大学翱翔国际会议中心召开。陕西省教育工作委员会宣传部部长梅争利、副部长王世娟，陕西高校思政课省级名师工作室负责人及所在高校马克思主义学院院长出席了座谈会。会议由王世娟主持。梅争利在座谈会上指出，思政课是落实立德树人根本任务关键课程，思政课教师责任重大，设立陕西高校思政课省级名师工作室，是全国大思政课综合改革试验区，陕西省试点建设的重点项目。对于全省思政课教师，要努力做到六个要和八个相统一要求，奋力推进思政课改革创新，进一步提高思政课思想性、理论性和针对性、亲和力，具有很强的示范引领作用。入选的陕西高校思政课省级名师工作室要有效整合团队力量，聚焦陕西大思政课建设均衡发展，实践中存在的重点难点问题进行专题研究，在服务国家重大需求和地方经济社会发展，开展理论宣讲，建强教师队伍，进行科研攻关，深化课程改革，打造思政金课，推进一体化育人等方面形成代表性成果。会上，“全国高校思政课名师工作室”负责人西安交通大学陆卫明教授、陕西师范大学张琳教授分别就工作室的方法维度、目标维度、策略维度作专题辅导。陆卫明表示，新时代思政课要紧密结合当代学生的特点，要坚持“学生在哪里，思政课就在哪里”，开展形式多样、内容丰富的思政课教学活动，用好新媒体平台，打造线上线下一流思政课程。张琳表示，作为师范类院校，工作室聚焦师范类高校“概论课”教师培养打造具有学校特色的名师团队，充分发挥师范类高校优势，凸显区域特色、专业特色、时代特色、平台特色。随后，与会专家就陕西高校思政课省级名师工作室建设展开交流研讨。王世娟指出，做好省级名师工作室的建设，站位要高、格局要大、团队要强。西北工业大学思政课省级名师工作室代表蒲瑶教授表示要发挥思政教学名师工作室效应，助推思政课高质量发展，打造高素质教育团队，不断地增强思政课高质量发展的牵引力。最后，梅争利作总结讲话并为陕西高校思政课首批建设的15个省级名师工作室授牌并表示祝贺。他指出，建好名师工作室，一是要抓好团队建设，打造高层次的人才梯队；二是要抓好课程创优，锤炼高水平示范金课；三是要抓好科研创新，推出高质量研究成果；四是要抓好宣讲阐释，传播高站位政策理论。切实发挥好引领、带动、辐射作用，为我省“大思政课”建设贡献更大力量西北工业大学党委副书记陈建有在会后与工委宣传部负责同志进行了座谈交流。（审核：蒲传新）,https://news.nwpu.edu.cn/info/1002/88129.htm,西工大 新闻网 日电 谢佳君 做好 全省 高校 思政课 省级 名师 工作室 建设 建强 思政课 教师队伍 推进 思政课 改革 创新 上午 陕西 高校 思政课 省级 名师 工作室 座谈会 西北工业大学 翱翔 国际会议中心 陕西省 教育 工作 委员会 宣传部 部长 争利 部长 王世娟 陕西 高校 思政课 省级 名师 工作室 负责人 高校 马克思主义 学院 院长 出席 座谈会 会议 王世娟 主持 争利 座谈会 指出 思政课 落实 立德 根本任务 关键 课程 思政课 教师 责任重大 设立 陕西 高校 思政课 省级 名师 工作室 全国 大思政课 综合 改革 试验区 陕西省 试点 建设 重点项目 全省 思政课 教师 努力做到 六个 八个 统一 奋力 推进 思政课 改革 创新 进一步提高 思政课 思想性 理论性 针对性 亲和力 很强 示范 引领 作用 入选 陕西 高校 思政课 省级 名师 工作室 整合 团队 力量 聚焦 陕西 大思政课 建设 均衡 发展 实践 重点难点 专题研究 服务 国家 需求 地方 经济社会 发展 理论 宣讲 建强 教师队伍 科研 攻关 深化 课程 改革 打造 思政金课 推进 一体化 育人 代表性 成果 会上 全国 高校 思政课 名师 工作室 负责人 西安交通大学 陆卫明 教授 陕西 师范大学 张琳 教授 工作室 方法 维度 目标 维度 策略 维度 专题 辅导 陆卫明 时代 思政课 紧密结合 当代 学生 学生 思政课 形式多样 内容 思政课 教学活动 媒体 平台 打造 上线 一流 思政 课程 张琳 师范类 院校 工作室 聚焦 师范类 高校 概论 教师 培养 打造 学校 特色 名师 团队 充分发挥 师范类 高校 优势 凸显 区域 特色 专业 特色 时代特色 平台 特色 与会 专家 陕西 高校 思政课 省级 名师 工作室 建设 展开 交流 研讨 王世娟 指出 做好 省级 名师 工作室 建设 站位 格局 团队 要强 西北工业大学 思政课 省级 名师 工作室 代表 蒲瑶 教授 发挥 思政 教学 名师 工作室 效应 助推 思政课 高质量 发展 打造 高素质 教育 团队 增强 思政课 高质量 发展 牵引力 争利 讲话 陕西 高校 思政课 首批 建设 省级 名师 工作室 授牌 表示祝贺 指出 名师 工作室 一是 抓好 团队 建设 打造 高层次 人才 梯队 二是 抓好 课程 创优 锤炼 高水平 示范 金课 三是 抓好 科研 创新 推出 高质量 研究成果 四是 抓好 宣讲 阐释 传播 站位 政策 理论 切实 发挥 引领 带动 辐射 作用 我省 大思政课 建设 贡献 更大 力量 西北工业大学 党委 书记 建有 会后 工委 宣传部 负责同志 座谈 交流 审核 蒲传,0.9972
西北工业大学鲁神赐教授荣获“Thieme Chemistry Journals Award”...,2023-02-13,西工大新闻网2月13日电（喻晓一)近日，Thieme学术出版集团公布了2023年度“Thieme Chemistry Journals Award”国际学术奖的获奖名单，西北工业大学柔性电子研究院鲁神赐教授成功入选。“Thieme Chemistry Journals Award”学术奖设立于1999年，由Thieme数据库三大化学期刊Synthesis、Synlett和Synfacts的学术编委会在全球范围内遴选，每年颁发一次，授予在化学合成等密切相关领域取得出色成果并具有很强发展潜力的青年学者，旨在认可和鼓励年轻一代有机化学家。2023年度，全球范围内共有87人荣获“Thieme Chemistry Journals Award”学术奖。由Synlett主编、2021年诺贝尔化学奖得主Benjamin List教授提名，鲁神赐教授成功入选，成为2023年度该学术奖的得主之一。此次获奖标志着鲁神赐教授的研究工作得到了国际同行的认可。鲁神赐教授2018年11月入职西北工业大学柔性电子研究院，主要从事功能有机分子的高效合成与结构修饰及其在手性光电材料中的应用。迄今为止，以第一作者或通讯作者身份在国际知名化学期刊发表研究论文数十余篇，包括J. Am. Chem. Soc.、Nat. Commun.、Angew. Chem. Int. Ed.(5篇)、ACS Catal.、Org. Lett. (3篇)等学科领域顶级期刊。Thieme出版社官方公告：https://www.thieme.de/en/thieme-chemistry/thieme-chemistry-journals-awardees-107362.htm（审核：王凡华）,https://news.nwpu.edu.cn/info/1002/88079.htm,西工大 新闻网 日电 喻晓一 近日 学术 出版 集团 公布 年度 国际 学术 获奖 名单 西北工业大学 柔性 电子 研究院 鲁神 教授 成功 入选 学术 设立 数据库 三大 化学 期刊 学术 编委会 全球 遴选 颁发 授予 化学合成 密切相关 领域 出色 成果 很强 发展潜力 青年 学者 旨在 认可 鼓励 年轻一代 有机化学家 年度 全球 共有 荣获 学术 主编 诺贝尔化学奖 得主 教授 提名 鲁神 教授 成功 入选 年度 学术 得主 获奖 标志 鲁神 教授 研究 工作 国际 同行 认可 鲁神 教授 月入 西北工业大学 柔性 电子 研究院 功能 有机 分子 高效 合成 结构 修饰 在手 光电 材料 迄今为止 第一 作者 通讯 作者 身份 国际 知名 化学 期刊 发表 研究 论文 数十 余篇 包括 学科 领域 顶级 期刊 出版社 官方 公告 审核 王凡华,0.9973
我校荣获6项陕西省中外合作办学优秀课程思政示范项目,2023-02-13,西工大新闻网2月13日电（张宇)近日，陕西省高等教育学会中外合作办学分会发布《关于公布陕西省中外合作办学优秀课程思政示范项目名单的通知》，确定课程思政管理示范方案6项，课程思政示范课程21门。经精心组织、积极申报，学校荣获优秀课程思政示范项目6项，是本次获奖项目最多、示范方案与课程获奖全覆盖的高校。其中，张莹、闫毅、王军、郑泽邦等四位教授牵头主讲的《Advanced Mathematics 高等数学》《Polymer Degradation》《Alloy Systems and Heat Treatment》《金属 I－变形与强化》获课程思政示范课程，国际合作处张富利、玛丽女王工程学院范晓丽牵头申报的“西北工业大学中外合作办学课程思政管理方案”和“西北工业大学伦敦玛丽女王大学工程学院课程思政管理方案”获课程思政管理示范方案，入选示范项目的相应授课教师、团队，同时认定为陕西省中外合作办学课程思政先进个人和先进团队。学校牢牢把握立德树人的根本任务，严格按照上级要求，高度重视中外合作办学课程思政工作，将课程思政融入中外合作办学人才培养全过程，坚持社会主义核心价值观的引领，为党育人、为国育才。通过推进中外合作办学课程思政建设，积极构建多层次思政示范体系，有效推动我校中外合作办学高质量可持续发展。学校现设有非独立法人中外合作办学机构——西北工业大学伦敦玛丽女王大学工程学院及中外合作办学项目——西北工业大学与德国品牌应用科学大学合作举办工业设计专业硕士研究生教育项目，课程思政的高质量建设提升了合作大学国际化人才培养质量，提高了中外合作办学可持续发展能力。（审核：陈俊）,https://news.nwpu.edu.cn/info/1002/88069.htm,西工大 新闻网 日电 张宇 近日 陕西省 高等教育 学会 中外合作 办学 分会 发布 公布 陕西省 中外合作 办学 优秀 课程 思政 示范 项目 名单 通知 课程 思政 管理 示范 方案 课程 思政 示范 课程 精心组织 申报 学校 荣获 优秀 课程 思政 示范 项目 本次 获奖 项目 示范 方案 课程 获奖 覆盖 高校 张莹 闫毅 王军 郑泽邦 四位 教授 牵头 主讲 高等数学 金属 变形 强化 课程 思政 示范 课程 国际 合作 处张 富利 玛丽 女王 工程学院 范晓丽 牵头 申报 西北工业大学 中外合作 办学 课程 思政 管理 方案 西北工业大学 伦敦 玛丽 女王 大学 工程学院 课程 思政 管理 方案 课程 思政 管理 示范 方案 入选 示范 项目 授课 教师 团队 认定 陕西省 中外合作 办学 课程 思政 先进个人 先进 团队 学校 把握 立德 树人 根本任务 上级 高度重视 中外合作 办学 课程 思政 工作 课程 思政 融入 中外合作 办学 人才培养 全过程 核心 价值观 引领 育人 为国 育才 推进 中外合作 办学 课程 思政 建设 构建 多层次 思政 示范 体系 推动 我校 中外合作 办学 高质量 持续 发展 学校 设有 独立 法人 中外合作 办学 机构 西北工业大学 伦敦 玛丽 女王 大学 工程学院 中外合作 办学 项目 西北工业大学 德国 品牌 应用科学 大学 合作 举办 工业 设计 专业 硕士 研究生 教育 项目 课程 思政 高质量 建设 提升 合作 大学 国际化 人才培养 质量 提高 中外合作 办学 持续 发展 能力 审核 陈俊,0.9959
农工党西工大支部9名党员入选农工党陕西省第八届专门工作委员会,2023-02-13,西工大新闻网2月12日电（陈媛媛)2023年2月10日，经中国农工民主党陕西省第八届委员会常务委员会第三次全体（扩大）会议决定，成立中国农工民主党陕西省第八届委员会专门工作委员会。农工党西工大支部9名党员入选，其中5人任副主任委员，4人任委员。具体名单为：序号姓名职务专门工作委员会名称1郑莉莉副主任委员妇女工作委员会2黄庆华副主任委员科技工作委员会3贾庆安副主任委员科技工作委员会4杨宏玲副主任委员法律工作委员会5张涛副主任委员教育工作委员会6穆亚宏委员医药卫生工作委员会7李小珩委员医药卫生工作委员会8袁平委员医药卫生工作委员会9刘长春委员妇女工作委员会近年来，农工党西工大支部充分发挥界别特长，先后多次开展医疗扶贫、健康义诊、捐赠药品器械等活动，始终坚守抗疫第一线，为全校师生的健康保驾护航，受到学校和农工党陕西省委会的好评。本次多名党员入选专门委员会不仅是对农工党西工大支部工作的肯定，同时也是对支部今后工作的鞭策，激励着全体党员坚定信心，提振精神，再登高峰。下一步，农工党西工大支部将再接再厉，逐步完善支部制度建设，激励党员奋发有为的干劲，以专委会的工作平台为契机，不断提升党员参政议政能力，结合工作实际，为学校“双一流”建设和陕西高质量发展贡献智慧和力量。审核：肖静,https://news.nwpu.edu.cn/info/1002/88059.htm,西工大 新闻网 日电 陈媛媛 中国农工民主党 陕西省 第八届 委员会 常务委员会 第三次 会议 成立 中国农工民主党 陕西省 第八届 委员会 工作 委员会 农工党 西工大 支部 党员 入选 人任 主任委员 人任 委员 名单 序号 姓名 职务 工作 委员会 名称 莉莉 主任委员 妇女 工作 委员会 黄庆华 主任委员 科技 工作 委员会 庆安 主任委员 科技 工作 委员会 杨宏玲 主任委员 法律 工作 委员会 张涛 主任委员 教育 工作 委员会 穆亚宏 委员 医药卫生 工作 委员会 李小珩 委员 医药卫生 工作 委员会 袁平 委员 医药卫生 工作 委员会 刘长春 委员 妇女 工作 委员会 农工党 西工大 支部 充分发挥 界别 特长 医疗 扶贫 健康 义诊 捐赠 药品 器械 活动 始终 坚守 抗疫 第一线 全校师生 健康 保驾护航 学校 农工党 陕西省委 好评 本次 多名 党员 入选 委员会 农工党 西工大 支部 工作 肯定 支部 工作 鞭策 激励 党员 坚定信心 提振 精神 高峰 一步 农工党 西工大 支部 再接再厉 逐步完善 支部 制度 建设 激励 党员 奋发有为 干劲 专委会 工作 平台 契机 提升 党员 参政议政 能力 工作 学校 一流 建设 陕西 高质量 发展 贡献 智慧 力量 审核 肖静,0.9982
