内容,主题概率,主题类型
出行 首选 携程 旅行网 确认 快速 跟踪 始末 推出 领队 服务 出行 踏实 夏威夷 酒店 位于 维基 海滩 位置 优越 周边 阿拉 莫阿娜 中心 步行 前往 酒店 服务 职员 特别 热情 入住 时间 痛快 办理 入住 手续 房间 整洁 飞机 东方航空公司 北京 上海 夏威夷 往返 出发 当天 上海 夏威夷 延误 上海 北京 延误 机上 服务 不敢恭维 难准 难吃 脸难看 特别感谢 夏威夷 向导 六六 办事 利落 细致 特别 耐心 安排 送机 服务 夏威夷 行程 圆满 句号,"[(1, 0.65245515), (2, 0.34186545)]",1
意大利 行程 导游 芳姐 热情好客 全程 开车 步行 全程 陪同 参观 讲解 购物 地方 全程 翻译 品尝 意大利 小吃 推荐 好吃 餐厅 中餐 旅途 分享 意大利 风土人情 文化 收获 颇丰 送到 酒店 房间 中途 身体 舒服 预定 早餐 路上 贴心 巴塞尔 一段 火车 巴黎 感觉 行程 充实 巴黎 段沈导 服务 周到 准时 火车站 商务车 宽敞 私家 服务 比跟团 很大 差别 体验 更好 导游 安排 经验 导游 目的地 人文 历史 用餐 购物 时间 充裕 沈导 询问 景点 耐心 讲解 购物 全程 陪同 贴心 退税 送到 机场 结束 旅行 十分满意 不错 一段 旅程,"[(0, 0.9906725)]",0
携程 幸运 博学多才 导游 谷志华 导游 一路行 解说 尤如 一首首 优美 诗歌 散文 旅途 充满 惊喜 谷导 多年 英国 生活 经历 旅游 知识 态度 服务 沟通 能力 一处 景点 谷导 详细 景点 介绍 风土人情 介绍 第一次 英国 旅游 陌生感 深深 感受 英国伦敦 丘吉尔 庄园 剑桥 牛津 地方 魅力 旅行 真的 超出 预期 感谢 谷导 付出 谷导 家人 身体健康 事业 顺利,"[(2, 0.9850243)]",2
英国文学 爱好者 英剧 傲慢 偏见 唐顿 庄园 呈现 英伦 风情 令人 向往 期待 身临其境 欣赏 富丽堂皇 宫殿 历史悠久 文物 精美绝伦 艺术品 如诗如画 田园 初访 英国 反复 最终 选择 平衡 兼顾 皇家 宫殿 文化 胜地 自然风光 购物 消费 十日游 暑期 旅游 高峰 到来 成行 令人难忘 物超所值 惊喜 行程 伦敦 中心 延着 约克 利物浦 牛津 环绕 英格兰 一圈 囊括 肯辛顿 白金汉宫 温莎 城堡 伦敦 皇家 宫殿 大英博物馆 维多利亚 阿尔伯特 博物馆 西敏寺 约克 教堂 剑桥大学 莎士比亚 故居 丘吉尔 庄园 牛津大学 标志性 历史 文化 胜地 沿途 饱览 英格兰 田园风光 约克 谷地 湖区 美景 品尝 下午茶 丘吉尔 庄园 英式 正餐 经典 牛排 炸鱼 薯条 梅森 哈罗 比斯特 购物 不虚此行 满载而归 特别 值得一提 居英 华裔 导游 王先生 服务 热忱 周到 待人 风趣 幽默 熟悉 英国 历史 文化 趣闻轶事 皇家 逸闻 娓娓道来 敏锐 洞察 客人 需求 给出 中肯 建议 旅行 增添 乐趣,"[(1, 0.6226334), (2, 0.3743366)]",1
王玉潭 导游 司机 优秀 调整 路线 确保 景点 完美 行程 彭布罗克 学院 格林威治 大学 伊顿公 开车 稳当 讲解 幽默 照顾 小朋友 感受 九天 行程 收获 颇丰 英国 留下 美好 印象,"[(0, 0.97426987), (1, 0.012305766), (2, 0.013424357)]",0
特别 行程 家里 老人 孩子 迁就 事情 时间 私人 特别 需求 行程 规划 机票 时间 特别 适合 英国 司导 接机 全程 讲解 想问 解答 专业 天黑 特别 行程 调整 入住 酒店 安排 早餐 真的 周到 下次 出行 安排 推荐 孙导 好事 专业,"[(1, 0.05141018), (2, 0.93907803)]",2
导游 既有 东北 个性 大气 豪爽 个性 具备 英国 绅士 严谨 细腻 行程 安排 不稳 景点 地理 人文 历史 背景 讲解 深入浅出 通俗易懂 配合 喜好 需求 微调 算是 私人 订制 服务 贴心 行程 生日 当天 收到 庆生 礼物 真的 开心,"[(1, 0.08625927), (2, 0.90423274)]",2
夏威夷 想来 地方 大洋 最美 岛屿 舰队 希尔顿 威基 海滩 度假村 应有尽有 彩虹 真真是 面朝 大海 醒来 吃完饭 威基 海滩 闲走 下水 免税店 奢侈品 专柜 走路 分钟,"[(0, 0.013039808), (1, 0.012307288), (2, 0.9746529)]",2
夏威夷 四月份 旅游 淡季 价钱 合适 确实 休闲游 地方 夏威夷 日本 天下 日语 第二语言 华人 询问 九次 找到 日本 希尔顿 威基 海滩 度假 酒店 靠海边 商业街 号称 全球 室外 购物中心 老人 外语 公交 困难 路牌 途径 站点 夏威夷 公交车 标注 途径 时间 意见 夏威夷 那天 预定 拼车 接机 无人 接机 东转西 携程 旅行社 柜台 里边 没人 电话 电话录音 一堆 英语 小时 接机 满意,"[(2, 0.98859596)]",2
去过 地方 感觉 夏威夷 真的 值得 建议 最起码 起步 美景 照片 赘述 几个 海滩 停车 度假型 酒店 停车费 起步 琐碎 时间 海边 最多 限停 小时 停车 时间段 超过 小时 没大 切记 晚上 挪走 真的 警察 拖车 时间 旁边 预付费 停车场 小时 找零 算下来 比停 酒店 便宜 好多 带张 芯片 信用卡 发现 美国 大用处 夏威夷 通道 银联 通道 血亏 夏威夷 一线品牌 包包 欧洲 便宜 买过 度假型 酒店 单独 缴纳 度假村 携程 产品 房价 之中 酒店 一次性 用品 拖鞋 自带 提前 夏威夷 青春 夏威夷 大岛 一生,"[(2, 0.9908011)]",2
满意 旅行 特别 六天 跟团 美国 地接社 纵横 集团 肯尼迪 机场 工作人员 接机 当晚 领队 留下 深刻印象 酒店 酒店 大堂 接下去 五天 一处 讲解 生动有趣 安排 拼团 带队 关键 帅哥 讲解 美国 情况 司机 师傅 辛苦 开车 技术 任劳任怨,"[(0, 0.01065954), (2, 0.9798885)]",2
接机 国庆 关系 一个半 小时 走马观花 时间 紧凑 早出晚归 景点 安排 自助游 尼亚加拉 瀑布 波士顿 小时 车程 辛苦 酒店 安排 经济型 连锁 酒店 有一晚 升级 地方 干净 美国 热水 旅游团 国人 老外 一半 国家 文化 习惯 摩擦 自由 整天 补逛 景点 购物 时间 天会 酒店 华尔街 购物 出行 来回 美联航 准点 正餐 一顿 早餐 点心 一顿 长途飞行,"[(2, 0.98651093)]",2
一趟 行程 整体 满意 美女 导游 郑导 专业 贴心 谢谢 一路 照顾,"[(0, 0.028586812), (1, 0.94121563), (2, 0.030197559)]",1
司机 导游 不错 餐食 满意 自助餐 团餐 行程 紧凑 机场 接机 还好 延误 跟上 算是 幸运 肯尼迪 机场 出关 担心 特地 送到 曼哈顿,"[(0, 0.016290255), (1, 0.0150025245), (2, 0.9687072)]",2
英国 真的 受益匪浅 徐导 介绍 英国 苏格兰 英格兰 乡村 城市 地方 独特 韵味 印象 深刻 剑桥 牛津 两所 拥有 深厚 历史 学府 环境 学习 学子 梦寐以求 事情 旅行 顺利 满意 谢谢 徐导 一路 细致 讲解 机会 英国,"[(0, 0.2689397), (1, 0.010505841), (2, 0.7205544)]",2
英国 满意 行程 住宿 安排 导游 填写 退税 机场 退税 贴心 五星 好评,"[(0, 0.031916134), (1, 0.028767418), (2, 0.93931645)]",2
满意 出国 旅行 售前 丁丽君 耐心 介绍 寻找 合适 产品 主动 介绍 优惠政策 售后 晨曦 不厌其烦 解答 高效 行程 变更 快速 处置 英国 旅途 英国 导游 贾延博 如般 精彩 讲解 快速 驾驶 购物 美食 良心 推荐 摄影 出行 增分 良多 行程 无须 多方 选择 产品 总体 闲适 充足 时间 玩耍 英国 覆盖 英国 各类 景点 住宿 总体 满意 约克 古堡 酒店 曼城 风格 酒店 湖区 度假 别墅 酒店 印象 深刻,"[(2, 0.98848695)]",2
很棒 行程 游玩 十几个 国家 伦敦 喜欢 大都市 英国 乡镇 美景 流连忘返 私团 像是 简易 版本 自由 费心 喜好 行程 重点 推荐 导游 白导 一位 温厚 贴心 导游 大哥 白导 旅途 有用 建议 景点 行程 值得 性价比 游览 规划 详尽 体贴 真心 客户 着想 言行 照顾 感受 旅途 尴尬 因私 中途 停留 多久 一旁 静静 等候 绅士风度 每次 上下车 客户 开门 细心 交代 下车 女士 行李 恪尽职守 任劳任怨 需求 游览 超市 读卡器 担心 顺利 沟通 大热天 奔跑 酒店 入住 技能 专业 驾驶 稳当 景区 小路 门路 陷阱 了然于心 英国 历史背景 熟练 解说 风趣 接地 白导 本次 旅行 点睛之笔 陪伴 旅途 好友 大哥 经历 最让人 舒心 导游 观帖 朋友 支持 选到 异乡 旅途 大大的 福气,"[(1, 0.9419523), (2, 0.054356627)]",1
英国 旅游 感受 英国 悠久 文化 历史 美国 欧洲 西方 国家,"[(0, 0.9319129), (1, 0.030537253), (2, 0.037549894)]",0
满意 行程 安排 轻松 雪山 温泉 瑞士 几大 特色 体验 九月底 风景 很好 不算 旅游 旺季 导游 刘导 德国 本地人 瑞士 热情 细心 行程 安排 服务 周到 酒店 不错 安静 区域 晚上 逛逛,"[(0, 0.97735286), (1, 0.011186464), (2, 0.01146068)]",0
夏威夷 旅游 下榻 喜来登 拉尼 公主 酒店 机场 到达 酒店 点钟 前台 登记 一位 漂亮 小姐 空房间 免费 入住 幸运 酒店 座落 夏威夷 黄金地段 一家 酒店 外观 豪华 威基 海滩 一条 大街 分钟 酒店 周边 好几家 超市 营业 晚上 点钟 东西 交通 珍珠港 钻石 恐龙 景点 巴士站 门口 那条 大街 繁华 商业 大街 商店 林立 晚上 街头 艺人 表演 热闹 夏威夷 日本 酒店 大街 日本 错觉 像是 日本国 夏威夷 感觉 景点 国人 极少 寥寥无几 印度人,"[(0, 0.65346414), (2, 0.3416873)]",0
愉快 事情 订机票 孩子 度假 斤斤计较 酒店 真心 不错 舒服 海景房 特别 海风 做饭 周末 购物 好吃 酒店 周边 海鲜 大龙虾 有名 餐厅 酒店 旁边 米处 超市 东西 孩子 鲜奶 有着落 回国 国内 酒店 大巴 奥莱 往返 美金 划算 大牌 商店 走路 半小时 全部都是 精品,"[(2, 0.98381597)]",2
夏威夷 游记 日行千里 新奇 举家 出游 夏威夷 脉搏 天地 感悟 圆满 珍惜,"[(0, 0.9380697), (1, 0.0312863), (2, 0.03064395)]",0
苏黎世 进出 自由 订单 携程 自营 苏黎世 日内瓦 自由 订单 不知 设计,"[(0, 0.03122563), (1, 0.8644685), (2, 0.10430589)]",1
行程 父母 孩子 领队 全程 服务 导游 热情,"[(0, 0.0435778), (1, 0.90599203), (2, 0.050430186)]",1
直飞 太贵 莫斯科 转机 太累 全程 租车 自驾 携带 行李 停车 太贵 九天 停车费 超过 人民币 油费 租车费 价格不菲 合算 瑞士 通卡 划算 后头 想想 经济 合算 方法 机场 打车 哪几天 买通 买通 三天 足够 城市 大部分 苏黎世 两天 够玩 卢塞恩 三天 酒店 天热 空调 早餐 不行 景点 黄金 环线 体验 少女 力士 鸡肋 特拉 虽是 小镇 少女 坐镇 随处可见 滑翔伞 玩度 日内瓦 中途 伯尔尼 老街 转转 不错 日内瓦 可玩 景点 逛街 购物 瑞士 特产 钟表 军刀 巧克力 下手 徒增 烦恼 购完 湖光山色 风景秀丽,"[(0, 0.9129992), (2, 0.0827767)]",0
结束 旅行 评论 强烈推荐 沈导 旅游 选择 沈导 沈导 那种 幽默 风趣 带团 风格 一路上 说说笑笑 感到 无聊 哈哈哈 哈哈哈 好玩 好吃 沈导 主动 推荐 感兴趣 沈导 沈导 拍照 技术 杠杠 懂得 女孩子 想要 哈哈哈 哈哈哈 沈导 重点 推荐 首选 哈哈哈,"[(1, 0.9812442)]",1
初次 瑞士 自由 行程 路线 旅行 通票 实在 太值 节省 费用 灵活,"[(0, 0.83753544), (1, 0.13138025), (2, 0.031084293)]",0
夏威夷 美丽 神奇 地方 自助游 方式 三个 半天 活动 环岛 环岛 珍珠港 市区 活动 导游 每次 准时 详实 介绍 几天 活动 夏威夷 酒店 威基 几分钟 之遥 漫步 沙滩 潮起潮落 日出日落 时间 公交 城市 逛逛 哈雷 巡游 夏威夷大学 特莱斯 一两天 大岛 玩玩 美丽 休闲 度假胜地,"[(2, 0.983641)]",2
行程 轻松自由 接送 地导 讲解 不错 合适 小孩 全家 出游 值得 推荐 签证 登记 携程 解决,"[(0, 0.028081313), (1, 0.94577765), (2, 0.026141046)]",1
宝宝 天气 炎热 没什么 宝宝 喜欢,"[(0, 0.8901824), (1, 0.052641734), (2, 0.0571759)]",0
夏威夷 出乎 预料 顺利 懒散 悠闲 氛围 特别 适合 发呆 特别 适合,"[(0, 0.029222751), (1, 0.02877432), (2, 0.94200295)]",2
总体 不错 第一次 去半 自助 景点 自由 几天 租车 自驾 威基 海滩 购物 美食 游览 海滩 马路 海景房 不错,"[(0, 0.018802168), (1, 0.017805323), (2, 0.9633925)]",2
自由 轻松 活动 时间 充裕 不累 半天 完事 希尔顿酒店 设施 度假村 退房 游泳池 行程 早餐 酒店 早饭 告知 酒店 办入 房间 依然 提前 入住 收费 酒店 海滩 商业街 阿拉 莫阿纳 不远 位置 不错 行程 石头山 封路 平等 门票 远观 古兰 牧场 体验 好玩 哥斯拉 金刚 骷髅 侏罗纪 世界 淘宝 价格比 携程 上要 建议 淘宝 行程 总体 开心 东航 回来 行李 一件 行李 日本 上海 明明 直飞 行李 转机 不靠,"[(0, 0.9893755)]",0
度假村 环境 真心 不错 要付 美元 度假村 不合理 酒店 办理 入住 其他人 所说 小时 总算 小朋友 多付 美元 提前 半天 入住 事实证明 洗漱 干净 行李 安顿 安心 逛街 行程 安排 赠送 环岛 堵车 都乐 植物园 小镇 路过 珍珠港 时间 展品 项目 不错 推荐 恐龙 大岛 一晚 火山 星星 携程 圆满解决 服务 不错,"[(0, 0.98484373)]",0
导游 旅行 公司 正规 服务 开心 希尔顿酒店 真心 可惜 入住 排队 很久 步行 分钟 可到 商场 散步 发现 万豪 酒店 不错 下次 试下,"[(0, 0.96395636), (1, 0.01609005), (2, 0.019953573)]",0
导游 全程 中文 服务 夏威夷 景色 确实 不错 威基 海滩 环岛 一路 美景 开心,"[(0, 0.03177699), (1, 0.40785262), (2, 0.5603704)]",2
行程 接待 导游 还算 负责 购物 强行 购物 舒服,"[(0, 0.3634434), (1, 0.037164133), (2, 0.5993925)]",2
到达 第一天 结束 先逛 威基 海滩 路上 团队 游遍 欧胡岛 景点 风景 值得 三天 自由 活动 第一天 购物中心 一整天 全世界 露天 购物中心 值得 淘宝 新款 网上 有名 阿甘 餐厅 四楼 第二天 奥莱 衣服 裤子 便宜 一件 一条 大包 酒店 第三天 龙宫 和馥宛 中餐厅 超级 好吃 便宜 谈谈 希尔顿酒店 度假村 不划算 还行 度假村 海滩 冲浪 游泳池 孩子 喜欢 满意 旅游 计划 携程 下次 旅行,"[(0, 0.9879802)]",0
行程 舒适 行程 购物 时间 唯一 特莱斯 时间 导游 热情 不错,"[(0, 0.036247183), (1, 0.03154483), (2, 0.932208)]",2
自助游 省心 自由 活动 时间 安排 一日游 行程 夏威夷 很漂亮 购物,"[(0, 0.0313672), (1, 0.029863367), (2, 0.9387694)]",2
开心 快乐 旅行 躲过 成都 百年难遇 天热汗 风景 美丽 气候宜人 机会,"[(0, 0.03764824), (1, 0.20974566), (2, 0.7526061)]",2
海岛 性价比 不算 美国 氛围 夏威夷 气候 吸引 冲浪 天地 印象 美国 本土 别样 气息 机会 签证 踏遍 美国,"[(0, 0.9625039), (1, 0.017975759), (2, 0.019520294)]",0
行程 太棒了 导游 服务 特别 特别 热情 开朗 每次 准时 到达 酒店 门口 特别 特别 耐心 回答 欧导 特别 风趣 特别 开朗 罗伯特 特别 慈祥 慈眉善目 行程 全家 特别 开心 满意,"[(0, 0.012937181), (1, 0.012505514), (2, 0.97455734)]",2
偷懒 自助游 安排 项目 价格 低于 自助游 套餐 闲情 朋友 自助游 再订 一个个 项目 地接 檀岛 旅游 服务 不错,"[(0, 0.019134596), (1, 0.018218027), (2, 0.9626474)]",2
名不虚传 欧胡岛 跟团 行程 走马观花 珍珠港 外观 建议 自费 上舰,"[(0, 0.037451703), (1, 0.032299332), (2, 0.930249)]",2
行程 轻松 前三天 几天 自由 再订 活动 酒店 升级 彩虹 风景 超好 实在 喜欢 夏威夷 天气 温度 阳台 看书 一上午 导游 不错 介绍 风土人情 自由 东航 飞机 电视 打发 时间 回去 十个 小时 痛苦,"[(0, 0.977775), (1, 0.010288656), (2, 0.011936347)]",0
总体 不错 签证 送机 顺利 导游 中国 热心 行程 安排 小费 夏威夷 美丽 热情 地方,"[(0, 0.76504177), (1, 0.025184773), (2, 0.20977347)]",0
游玩 朋友 小孩 出游 整体 比较满意 夏威夷 值得 旅游 地方 风景 美丽 空气 舒适 东西 不错呀 购物 狠狠 便宜 下次 机会 肯定 小小的 建议 包括 团费 旅游景点 延迟 时间 恐龙 景点 照片 游客 浮潜 体验 恐龙 游泳 浮潜 真的 不错 景点 几次 嫌多 海水 天空 美女 帅哥 保保 眼福,"[(2, 0.9845423)]",2
真的 个人感觉,"[(0, 0.1546784), (1, 0.18177462), (2, 0.663547)]",2
很棒 体验 携程 提供 服务 不错 接机 送机 四个 半天 行程 三天 自由 充实 自由 时间,"[(0, 0.30789238), (1, 0.02237125), (2, 0.6697364)]",2
夏威夷 选择 自助游 挺不错 既定 行程 三天 自主 安排 满意,"[(0, 0.34506547), (1, 0.03825946), (2, 0.6166751)]",2
值得 感受一下 太平洋 气候 舒适 宜人 餐饮 蛮贵,"[(0, 0.9025974), (1, 0.041975245), (2, 0.055427276)]",0
自助 行是 选择 夏威夷 空气 阳光 沙滩 难忘 热情 无论是 接送 组织 出游 安排 井井有条 檀岛 旅行社 真的 下次,"[(0, 0.01997414), (1, 0.6229976), (2, 0.35702828)]",1
很棒 假期 希尔顿 度假村 值得 行程 自由 轻松 非常适合 度假,"[(0, 0.92438805), (1, 0.034097705), (2, 0.04151428)]",0
不错 旅游 蜜月 开心 自由 出游 行程,"[(0, 0.4710528), (1, 0.47506988), (2, 0.053877324)]",1
携程 客服 接洽 愉快 出行 顺利 接团 檀岛 旅游 接触 几位 导游 亲切 热情 特别 岛上 朴实 善良 周到 喜欢 一路 风光旖旎 全程 笑语 欢声 难忘 旅行,"[(0, 0.01414146), (1, 0.518382), (2, 0.46747655)]",1
整体 比较满意 导游 小丽 热情 专业 敬业 未出 流程 安排 签证 一步 指引 体验 不好 指引 体验 望能 改善 流程 提升 客户 体验,"[(0, 0.017118497), (1, 0.015186515), (2, 0.96769494)]",2
度假 不二 去处 节奏 生活 悠闲 方式 美丽 环境 旅途 轻松 充实,"[(0, 0.93704045), (1, 0.03395317), (2, 0.02900634)]",0
不错 经历,"[(0, 0.7112919), (1, 0.14826307), (2, 0.14044504)]",0
小团 特别 行程 安排 自由 导游 负责 行程 安排 妥当 英国 有趣 一行 四个 有趣 一路上 美景 尽收眼底 团购 性价比 不错 购物 自费,"[(0, 0.019631237), (1, 0.015814655), (2, 0.9645541)]",2
行程 安排 一段 飞机 两段 列车 汽车 行车时间 不长 景点 充足 时间 游览 运气 不错 天气 塞纳河 两岸 少女 景色 罗马 讲解 两宫 讲解 超级 大佬 讲解 生动有趣 知识点 满满 领队 樊导 经验丰富 专业 细心 地方 热心 讲解 风土人情 历史 典故 历史 事件 发生 年月日 头头是道 感觉 旅行 一场 文化 体验 酒店 安排 不错 巴黎 酒店 稍微 不错 卢塞恩 湖景 酒店 景色 太美 舒服 早餐 不错 飞机 机票 上午 傍晚 完美 半天 游玩 一整天 飞机 行程 行程 愉快,"[(0, 0.9900111)]",0
为期 十二天 欧洲 行刚 结束 体验 很棒 忍不住 赶紧 评价 先来 行程 安排 选择 旅游 行程 功课 产品 选择 携程 自营 这款 价格 不算 便宜 路线 设计 出行 感觉 物有所值 无论是 团餐 味道 入住 酒店 品质 特别 景点 讲解 专业性 体验 极佳 意犹未尽 本次 领队 导游 樊磊 樊导 经验丰富 负责 行程 提供 保障 旅途 中向 介绍 欧洲 历史 文化 风土人情 旅途 阶段 提供 有用 经验 建议 行程 尽兴 圆满 非常感谢 整体 欧洲 入门 行程 强烈推荐 团友 可爱 期待 旅游,"[(0, 0.9900587)]",0
领队 经验丰富 热心 周到 服务 车上 领队 深入浅出 讲解 当的 历史 人文 地理 事项 喜欢 购物 旅游 讲清楚 采购 退税 注意事项 行程 意法 三国 文化 艺术 历史 自然 精华 涵盖 行程 有张有弛 累坏 游客 无聊 特比 本次 旅途 几个 关键 旅游点 专业 导游 老师 老师 知识 乐于 分享 讲解 高明 老师 限于 深入浅出 脉络分明 谢谢 谢谢 旅行 带来 欢乐,"[(0, 0.17328364), (1, 0.81965053)]",1
欧洲 意法 瑞游 完美 收官 行程 第一天 红眼 航班 带来 疲惫 后期 安排 三国 经典 风光 一览无余 住宿 巴黎 酒店设施 显成 跟着 樊磊 领队 欧洲 文化 人文 恶补 知识点 团队 开心 友好 无忧 喜欢 意大利 宏伟 建筑 雕塑 瑞士 山色 安逸 向往 法国 卢浮宫 购物 凡尔赛 携程 旅游 出行 首选,"[(0, 0.98383784)]",0
历时 欧洲 孩子 开心 一路上 充满 欢乐 感谢 认真负责 领队 唐姗 耐心 专业 讲解 欧洲 文化 发展 顾及 一位 团友 行程 环节 周到 景点 主动 每一 组团 合影留念 旅行 满意,"[(0, 0.015267521), (1, 0.01359504), (2, 0.9711374)]",2
为期 欧洲 法意 三国 顺利 圆满结束 行程 领队 郭之隐 统筹安排 各项 参观 活动 讲解 欧洲 人文 历史 欧洲 历史 文化 初步 行程 团员 提出 有问必答 耐心 细致 解释 提醒 事项 群里 发送 重点 须知 团员 之间 相互 关心 和睦相处 领略 意大利 威尼斯 水城 佛罗伦萨 极致 装饰 巴洛克 建筑风格 罗马 古城 遗迹 充满 历史 沉淀 法国巴黎 艾菲尔铁塔 雄伟 塞纳河畔 浪漫气息 凡尔赛 卢浮宫 名作 名画 令人 叹为观止 瑞士 卢塞恩 清澈 湖泊 少女 雄伟 雪山 瑞士 湖光山色 心旷神怡 法意 三国 难忘 旅程 欧洲 美丽 风景 悠久 历史 美好 旅行 体验 感谢 携程 领队 郭之隐 优质服务 付出 携程,"[(0, 0.9917721)]",0
天气 少女 太阳 特别 冬季 太阳 落下 夜景 夜景 美团友 人数 精致 小团 特别 顺利 导游 知识 经验 一路 讲解 无可挑剔 特别 喜欢 唐导 希望 唐导,"[(0, 0.16758758), (1, 0.014789197), (2, 0.8176232)]",2
欧洲 愉快 开心 结识 团友 超级 负责 唐姗 领队 专业 带领 景点 文化 历史 一路上 见到 仙境 美景 第一次 团游 选择 携程 感觉 值得 特别感谢 团队 细心 耐心 专业 唐姗 领队 行程 顺利 精彩 期待 旅程,"[(0, 0.13805462), (1, 0.27165186), (2, 0.5902935)]",2
安排 资深 讲解 欧洲 历史 领队 细心 周到 读万卷书 万里 习惯 中餐 接受 方便面 喜欢 解馋 整体 行程 不错 值得 推荐,"[(0, 0.96437836), (1, 0.017397203), (2, 0.018224418)]",0
行程 安排 前三天 特别 第一天 刚下 飞机 大巴 去往 公里 威尼斯 日子 行程 安排 不错 强求 购物 领队 服务 领队 姚杰 优秀 欧洲 生活 经历 三个 国家 之间 语言 切换 自如 知识面 精力充沛 应变能力 工作 细致 周到 团队 成员 年龄 姚杰 耐心 不厌其烦 回答 提醒 欧洲 注意事项 避坑 指南 好评 酒店 体验 总体 携程 自营 产品 酒店 不错 行程 瑞士 日内瓦 希尔顿酒店 最差 罗马 温暖 酒店 早餐 不好 房间 电热水壶 周边 东西 餐食 体验 团餐 看好 团餐 总体 不错 中餐 西餐 意大利 特莱斯 牛排 卢浮宫 那天 中餐 好吃 酒店 早餐 不错 现磨 咖啡 现烤 羊角 面包,"[(0, 0.61227506), (2, 0.38374633)]",0
第一次 欧洲 感谢 蔡勇 领队 全程 照顾 欧洲 度过 愉快 时光 行程 安排 巴黎 几天 轻松 自由 活动 时间 充足 参观 博物馆 瑞士 大自然 宁静 花草树木 和谐 瑞士 没住 少女 景观 全团 大哥 没住 景观 大巴车 司机 景观 蔡导 协调 无奈 酒店 多余 房间 留下 一点点 遗憾 携程 官方 态度 不好 订到 房间 网上 查到 两个 房间 块钱 差价 携程 官方 处理意见 赔付 块钱 态度 不好 希望 公平 一位 游客 预定 房间 意大利 路上 蔡导 讲解 欧洲 历史 学习 知识 参观 古罗马 时期 建筑 行程 一点 插曲 不错 体验,"[(0, 0.27548194), (2, 0.71991044)]",2
出行 第一次 好友 携程 运营 主打 放心 行程 安排 第一站 法国巴黎 游览 埃菲尔铁塔 卢浮宫 行程 特别 邀请 专业 中文 讲解员 细心 第二站 瑞士 行程 风景 天花板 真的 太美 金色 山口 火车 全景 窗户 游览 瑞士 高山 湖泊 美景 移民 瑞士 风景 多美 第三站 意大利 游览 水城 威尼斯 吃到 特色 墨鱼 罗马 袁导 特意 邀请 资深 老师 讲解 文艺复兴 时期 宗教 建筑 敬佩 旅程 超出 远远 期望值 下次 我会 妈妈 体会 欧洲游 感谢 导带 顺顺利利 一趟 意义 旅程 谢谢 旅途 身体 适时 谢谢 姐姐 小鹿 妹子 菲菲姐 援助 感谢 摄影师 哥哥 祝愿 生活 美满幸福,"[(0, 0.103423074), (1, 0.8922661)]",1
开心 旅程 陈导 经验丰富 带队 细节 周到 更是 妥妥 知识 点读机 总体 安排 到位 欧洲 风景 宜人 吃住行 挺不错 性价比 超高 团游,"[(0, 0.01829671), (1, 0.01983593), (2, 0.9618674)]",2
妈妈 旅行 一路上 携程 安排 贴心 住宿 用心 地方 挑选 了有 特色 市区 宾馆 早起 舟车劳顿 全程 一点 缺觉 法国 安排 两场 博物馆 解说 看清楚 表扬 随行 导游 袁国志 学识渊博 经验丰富 温柔 耐心 妈妈 团里 年纪 团员 担心 跟不上 节奏 袁导 招呼 袁导 一路 关照 有加 非常感谢 庆幸 选择 携程 自营 产品 真的 放心 选择,"[(0, 0.6747865), (1, 0.31743312)]",0
难忘 法国 意大利 出前 几天 酣畅淋漓 巴黎 购物 不用 早起 行程 宽松 灵活 中途 两天 感受 美丽 瑞士 风景 美不胜收 买表 地方 几天 辗转 意大利 难忘 五百年 历史 庄园 酒店 品尝 酒店 红酒 搭配 公斤 牛排 真真是 最爱 重点 完美 行程 肯定 少不了 一位 专业 导游 点名 感谢 蔡勇 导游 全程 陪伴 照顾 一路上 分享 欧洲 历史 游览 欧洲 建筑 过程 身临其境 代入 提醒 小心 注意安全 购完 牺牲 晚上 休息时间 检查 税单 欧洲游 蔡勇 导游 坚定 选择 携程 没错,"[(0, 0.99011755)]",0
