内容,主题概率,主题类型
领队 蔡勇 业务 能力 每位 团友 关心 有幸 碰到 一位 领队 欧洲 四国 一条 金牌 路线 性价比 不错 建议 罗马 竞技场 内场,"[(0, 0.8777481), (1, 0.10482914), (2, 0.017422767)]",0
总体 感觉 满意 四国 行程 乘车 行程 行程 感受 各国 特色 参考 行程 缩水 不错,"[(0, 0.9521759), (1, 0.023378711), (2, 0.024445362)]",0
行程 安排 游玩 张弛 有度 导游 经验丰富 灵活 变通 酒店 干净 舒适 经典 线路 一路上 导游 详细 介绍 欧洲 地理 宗教 人文 建筑 孩子 欧洲 启蒙 之游 大赞 导游 领队 左波 亲切 随和 热情 耐心 临时 旅游团 大家庭 感觉 老中青 喜欢,"[(0, 0.53668445), (2, 0.45416278)]",0
领队 阿旭 行程 安排 时间 紧凑 景点 浏览 舒服 下次 时间 体验 深度,"[(0, 0.94241744), (1, 0.026846124), (2, 0.030736422)]",0
首次 欧洲游 最佳 选择 领队 专业 有用 建议 安排 妥帖 行程 幸运 地方 天气 帮忙 巴黎 酒店 晚上 走走 巴黎 建议 增加 自由 活动 时间 第一天 酒店 不错,"[(0, 0.9730094), (1, 0.012594434), (2, 0.014396174)]",0
专业 帅哥 导游 好像 时尚 博主 有没有 小伍 带领 可爱 团友 度过 愉快 欧洲 一路 风景 美不胜收 人文景观 罗马 佛罗伦萨 特拉 巴黎 很美 下次 北欧 期待 有缘,"[(0, 0.4027381), (1, 0.5837612), (2, 0.013500667)]",1
父母 欧洲 四国 导游 姚杰 一路上 事无巨细 保证 旅途 舒适 一路上 细心地 提示 财产 枯燥 行车 过程 补充 历史 趣闻 欧洲 社会 概况 行程 充实 紧张 四国 景点 一遍 适合 初次 欧洲 朋友,"[(0, 0.59992605), (1, 0.012072307), (2, 0.38800162)]",0
人带 孩子 旅游 选择 团游 原本 期望值 收获 意外 导游 左波 从业 十二 多年 四川人 博学多才 全程 介绍 历史 一刻不停 旅途 一点 枯燥 十二天 旅程 一晃眼 全程 无微不至 照顾 关心 家人 途中 预定 景点 事先 预定 省去 排队 烦恼 行程 安排 专业 携程 很好 不亏 携程 明星 线路 购物 老佛爷 满载而归 不虚此行 主动 导游 咨询 购物 经验 波波 导游 耐心 实在 介绍 次次 满意 巴黎 退税 波波 填写 资料 饮料 空箱子 购物 买点 第一天 车上 一瓶 可乐 夏天 意大利 消耗量 很大 方便面 足够 用不上 总体 满意 感谢 波波 导游 全程 照顾 下次 机会 参加 波波 导游,"[(0, 0.8081696), (1, 0.18708707)]",0
一场 愉快 旅行 非常感谢 携程 一位 工作人员 满意 人无完人 行程 瑕疵 提出 以利于 携程 改进 有利于 团友 享受 美好 旅程,"[(0, 0.018942783), (1, 0.3816379), (2, 0.5994193)]",2
行程 满意 快乐 领队 徐健 认真负责 选择 携程 期待 旅行,"[(0, 0.48317495), (1, 0.48173627), (2, 0.035088804)]",0
欧洲 行程 满满 总体 不错 导游 周其旭 认真负责 喜欢 天鹅堡 少女 下次 出国 国家 深度 体验 更好,"[(0, 0.9558648), (1, 0.02191393), (2, 0.022221342)]",0
景色 不错 自然风光 幽静 人文 艺术 富有 魅力 不错 下次 依旧会 报团 麻烦 尽兴 导游 服务 很棒,"[(0, 0.36617884), (1, 0.021504005), (2, 0.61231714)]",2
欧洲 顺利 结束 领队 团友 一路上 领队 讲解 到位 知识面 安排 到位 满意 大巴 车辆 一路 跟随 位置 舒服 几个 城市 景点 安排 地陪 讲解 旅游 自由 购物 时间 分配 行程 安排 景点 经典 团友 之间 大家庭 关系融洽 满意 西式早餐 中午 午餐 一餐 自理 喜欢 热水 泡面 自行 压缩 水壶 泡面 带上 三天 调剂 拖鞋 牙刷 牙膏 带上 酒店 提供 行车时间 是从 国家 国家 行程 上在 威尼斯 购物 时间 匆忙 亲戚朋友 要买 东西 遇见 买好 购物点 想买 意大利 品牌 意大利 买好 出境 法国 戴高乐 机场 国内 通道 免税店 法国 东西 购好 意大利 法国 买买,"[(0, 0.7815836), (2, 0.21453948)]",0
第一次 携程 团游 扶老携幼 轻松 原本 行程 希望 一路 十二天 团游 印象 很大 改变 行程 安排 食宿 条件 高于 预期 家人 满意 周其旭 导游 一路 不辞辛苦 周到 服务 热情 解说 非常感谢,"[(0, 0.36320958), (1, 0.39371437), (2, 0.24307604)]",1
美景 拍照 留念 记录 领队 思路清晰 尽心尽职 全程 讲解 历史 带领 自由 半天 帮忙 机场 办理 退税 手续 好评 转眼 结束 舍得 期待 下次 旅行,"[(0, 0.40467918), (1, 0.57780755), (2, 0.017513264)]",1
第一次 出行 欧洲 选择 携程 自营 品质 保障 市中心 酒店 干净 早餐 不错 领队 经验丰富 一路上 介绍 风土人情 一再 关照 注意事项 林导 个子 小小的 能干 下次 选择 携程,"[(0, 0.7252441), (1, 0.014140003), (2, 0.2606159)]",0
携程 旅游 项目 安排 不错 玩儿 文斌 导游 素质 礼貌 知识 丰厚 头脑灵活 本次 出游 满意 本次 团队 满意,"[(0, 0.20259799), (1, 0.77652997), (2, 0.020872045)]",1
出游 体验 鉴证 文艺复兴 辉煌 时期 留下 印记 体验 人文 生活 品尝 最最 美味 牛排 香喷喷 墨鱼 住宿 干净 整洁 老人 孩子 特别 满意 孩子 喜欢 导游 围着 热情 孩子 讲解 历史 欧洲 神话故事 麻烦 周道得 照顾 全团 每一 团员 值得一提的是 蒲导 老公 生日 记住 孩子 悄悄 爸爸 惊喜 法国 操办 难忘 生日 蛋糕 有心 司机 可爱 服务 此行 值得 金牌 领队 陪伴 感恩,"[(0, 0.21023704), (2, 0.7836119)]",2
携程 值得 信赖 线路 经典 导游 荀导 专业 敬业 爱业 五星 产品 值得 推荐 满意 旅游 一段 美好 回忆 导点,"[(0, 0.9631895), (1, 0.018559994), (2, 0.01825059)]",0
不错 周琪旭 导游 细心 全程 照顾 周到 坐车 时间 晕车 朋友 适合,"[(0, 0.03135793), (1, 0.031473912), (2, 0.9371682)]",2
航班 汉莎 空客 舒服 感觉 瑞士 航空 飞机 儿童 提前 预定 全程 四星 酒店 几家 提供 沐浴液 肥皂 衣架 欧洲 酒店 预期 此行 期待 感觉 酒店 团餐 中餐 网上 恶劣 欧洲 大巴 时间 舒服 三段 长途车 小时 那种 领队 节奏 把握 提醒 提醒 用心 长途车 沿途 风景 睡睡觉 时间 一会儿 行程 扫盲 图片 名胜 收获 领队 接讲 背景 知识 建议 中世纪 拿破仑 宗教 知识 建筑风格 拜占庭 哥特 罗马 巴洛克 电影 但丁 密码 天使 魔鬼 事先 东西 脑海 一路 消化 解说 体贴 安排 提升 行程 领队 左波 确实 不错 经验丰富 耐心 十足 年龄 跨度 很大 家庭 小孩 多岁 老者 相互 照顾 意见 统一 心累 值得 一行,"[(0, 0.85534674), (2, 0.14114922)]",0
一趟 旅行 志同道合 旅友 目的地 天气 高素质 导游 幸运 王震 领队 导游 经验丰富 知识面 欧洲 历史 娓娓道来 重温 一遍 加深 旅程 自然 美景 人文 历史 相结合 高性价比 一趟 旅程,"[(0, 0.32676306), (1, 0.45581225), (2, 0.21742469)]",1
开心 愉快 风景 优美 导游 安排 周到 客人 着想 讲解 仔细 满意 好评,"[(0, 0.029823866), (1, 0.94210595), (2, 0.028070135)]",1
开心 旅行 感谢 领队 一路 陪伴 全程 特别 细心 周到 讲解 生动 精彩 司机 专业 特别,"[(0, 0.022320732), (1, 0.95428634), (2, 0.023393)]",1
四国 带队 赵阳 导游 业务素质 细心 周到 管理 有条不紊 井然有序 服务 热情周到 团队 感到 温馨 舒适 特别 不懂 困难 第一 时间 解决 耐心 讲解 一位 责任心 导游,"[(0, 0.27127483), (1, 0.2174019), (2, 0.5113233)]",2
愉快 旅程 想象 惬意 旅途 紧凑 法意 景点 一路 美景 美女 领队 安排 井井有条 一行 八人 老人 居多 领队 更是 照顾 细致 国家 治安 领队 不厌其烦 提醒 走路 司机 沟通 走路 中餐 口味 符合 中国 一晚 帮忙 整理 退税 幸运地 坐上 司机 风趣 幽默 热情 欧洲 性价比 确实 不错 非常感谢 领队 一路 辛苦 有缘 希望 机会 再入,"[(0, 0.22330472), (1, 0.32592666), (2, 0.45076865)]",2
法意 行程 安排 导游 领队 孙进 责任心 行程 讲解 细致 生动 幽默 风趣 内涵 团友 相处 融洽 不愧为 金牌 导游 力荐,"[(0, 0.02083403), (1, 0.9610913), (2, 0.018074634)]",1
满意 导游 文斌 行程 安排 紧凑 浪费 时间 乐于助人 忘记 欧洲 文化 理解 见识 旅游 途中 欣赏 美景 增长 知识 导游 文导 专业 责任心 携程 最强 行程 安排 罗马 巴黎 行程 结尾 享受 瑞士 发达 携程 安排 餐食 不错 文导 安排 每次 不用 排队 开吃 大巴车 新车 平稳 舒适 一点 长途 坐车 感觉 司机 不可思议 酒店 休息 乒乓球 技术 超过 团友 欧洲 希望 文导 导游,"[(0, 0.73676056), (2, 0.25740084)]",0
第一次 家人 欧洲 旅游 经典 路线 幸运 一路 语言 诙谐 幽默 讲解 到位 行程 安排 帅气 荀导 一群 高素质 团友 领略到 异国风光 品尝 欧洲 美食 感受 祖国 强大 特别感谢 荀导 国旗 玉女峰 美丽 雪山 留下 美好 回忆 美景 太多 点评 总体 一句 不虚此行,"[(0, 0.7448712), (1, 0.24611712)]",0
中欧 领队 一路 陪伴 照顾 开心 领队 知识面 欧洲 历史 知识 工作 认真负责 一路上 嘱咐 注意安全 感谢 携程 领队 下次 出游 携程,"[(0, 0.37429488), (1, 0.60808605), (2, 0.017619079)]",1
导游 芝佑 行程 安排 评着 经验 调整 行程 行程 节约 时间 一路 走来 顺利 谢谢 携程 旅游 出行 首选,"[(0, 0.019975448), (1, 0.95967937), (2, 0.020345178)]",1
携程 服务 周到 领队 小宁 全团 返回 总体 老外 热情 黑人 真的 无赖 免费 全程 领队 地导 讲解 行程 早起 晚归 景点 第二点 意大利 购物 时间 紧张 说好 小时 小时 退税 排队 威尼斯 购物 时间 过长 地方 很小 瑞士 买表 建议 卢塞恩 便宜 法国 购物 游玩 整体 巴黎 铁塔 圣母院 太远 几天 行程 几顿 中午 提供 客人 选择 西餐 时间 客人 体验 美食 自行 就餐 时间 太紧 只能 干粮 面包 一路 中餐 面包 真的 体验 特色美食 遗憾 第三 天鹅堡 噱头 提前 几个 不到 路程 堵车 有人 耽搁 景点 建议 法国 路上 略去 景点 增加 景点 时间,"[(0, 0.7603034), (2, 0.2340652)]",0
三口 之家 欧洲 路线 安排 紧凑 永恒 罗马 一路 到达 时尚 巴黎 入住 酒店 品质 饮食 团餐 用餐 环境 不错 菜品 比较简单 清淡 异国他乡 品尝 中式 菜肴 不易 值得一提的是 文斌 领队 认真负责 耐心 细致 讲解 景点 旅游 各类 注意事项 不厌其烦 回答 提出 体现 专业知识 职业 素养 团员 之间 互帮互助 相处 融洽 愉快 旅行,"[(0, 0.9087326), (1, 0.08323991)]",0
旅程 轻松 愉快 适合 省事 轻松 抱团 出游 郭导 工作 很棒 说话 有趣 实在 照顾 老年人 年轻人 打成一片 氛围 导游 调剂 很好 细心 关照 注意事项 提前 帮查 天气预报 提醒 穿衣 餐食 安排 恰是 妥当 大巴 风俗习惯 闲闻 趣事 景点 提醒 最佳 拍照 地点 主动 帮忙 拍照 携程 携程 郭导 可信赖,"[(1, 0.23599547), (2, 0.7562672)]",2
不虚此行 物有所值 金秋 十月 有幸 参加 郭之隐 导游 率团 西欧 四国 愉快 难忘 旅途 郭导 品行 待人 热情 真诚 有问必答 有求必应 业务 通晓 欧洲 人文 讲解 形象 生动 收益 郭导 辛苦 感谢 携程 感谢 郭导 期待 携程 携手 同行 携程 似锦 郭导 快乐,"[(0, 0.556081), (1, 0.010144479), (2, 0.43377453)]",0
行程 线路 行程 满满 酒店 切换 各国 情况 一路 走来 非常感激 董力鸣 导游 游览 欧洲 美景 风趣 幽默 帅气 董导 特别 专业 无论是 外语 能力 讲解 能力 行程 能力 特别 巴黎 创纪录 高温 情况 果断 调整 行程 避开 暑热 顺利 度过 难关 意大利 司机 技术 棒棒 一路 六个 国家 走路 工作难度 辛苦 感激 感激 感激 领队 小管 默默 协助 提醒 集合时间 地点 保驾护航 辛苦 谢谢你们,"[(1, 0.51975274), (2, 0.47418934)]",1
本次 旅行 总体 满意 风景 买买 开心 夸夸 导游 于跃 尽职尽责 旅途 突发状况 很好 解决 退税 真的 很棒 有于 导游 放心,"[(0, 0.2692511), (1, 0.71284527), (2, 0.017903596)]",1
行程 亮点 领队 导游 曾志 行程 敬职 敬责 景点 介绍 详细 细心 照顾 团友 时时刻刻 提醒 团友 注意安全 出关 退税 经验 团友 退税 成功 导游 预计 团友 海关 开箱 检查 登机口 听到 有人 没退 完税 尴尬 欧洲游 景点 紧凑 个人感觉 年纪 选择 轻松 一点 行程 行程 适合 老年人 满满的 走完 值得一提的是 瑞士 真的 超级 值得,"[(0, 0.27289486), (2, 0.71913624)]",2
线路 安排 满意 酒店 住宿 环境 惊喜 感谢 司机 师傅 辛苦 时间 蔡睿 导游 讲解 专业 生动 有趣 尽心尽职 安排 度过 精彩 难忘 欧洲 感谢 蔡导 优秀 导游 下次 选择 携程 期待 下次 旅行,"[(0, 0.36943638), (1, 0.6185245), (2, 0.012039137)]",1
行程 形容 热门 景点 预约 法国 国庆 耽误 一小部分 购物 行程 追赶 回来 太棒了 导游 司机 领队 董导 经验丰富 长得帅 全程 敬业 讲解 历史 故事 旅途 增添 回忆 希望 机会 董导,"[(0, 0.65402496), (1, 0.33341268), (2, 0.012562408)]",0
美好 出行 特别 瑞士 风景 山色 美不胜收 意大利 物价 亲民 采购 导游 超级 不愧为 金牌 导游 值得 五星 好评 父母 出游 回来 赞不绝口 历史 知识 风趣 幽默 退税 不厌其烦 耐心 讲解 提醒 多遍 旅途 增色 期待 下次 出游 有幸,"[(0, 0.71426076), (1, 0.27602762)]",0
郭子龄 领队 讲解 到位 幽默 喜欢 季节 天气 蛮好 不冷不热 欧洲 值得 看一看,"[(0, 0.6018549), (1, 0.23060994), (2, 0.16753513)]",0
精彩 欧洲 四国 打卡 标志性 景点 旅程 有幸 领队 文斌 知识 渊博 帅气 文雅 讲解 到位 热情周到 司机 友好 一帮 可爱 团友 幸福 好运 有缘 相聚,"[(0, 0.123438254), (1, 0.8622787), (2, 0.014283065)]",1
非常感谢 林芝 领队 度过 四国 林导 经验丰富 讲解 完美 热情 携程 旅游 值得 推荐,"[(0, 0.5085524), (1, 0.46531078), (2, 0.026136806)]",0
携程 忠实 用户 超级 会员 提前 十二天 行程 欧洲 四国 团才 全程 配备 全新 大巴车 国航 上海 直飞 米兰 巴黎 上海 省去 转机 辛苦 行程 经典 领队 四川 小伙 左波 认真负责 出发 时刻 提醒 事项 知识 渊博 欧洲 历史 人文 熟悉 一路上 不停 讲解 景点 一路上 不停 提醒 注意安全 不厌其烦 提醒 提醒 提醒 景区 购物 介绍 便利 晚在 巴黎 房间 所有人 退税 税单 填写 贴心 极致 参加 携程 旅行 期待 左波 领队 同行 谢谢 一路 付出,"[(0, 0.4571241), (2, 0.53781563)]",2
谢谢 王导 照顾 关心 一路上 辛苦 一路上 欢声笑语 开心 下次 报团 王导 携程 很棒,"[(0, 0.025664674), (1, 0.79905856), (2, 0.17527682)]",1
行程 满意 景点 长途车 搭配 劳逸结合 时间 慢慢 回忆 品味 食宿 不错 皮蒂 安娜 庄园 酒店 特色 西点 机场 酒店 舒适 德国 肯普腾 宽敞 瑞士 推开 窗子 雪山 法国 兰斯 早餐 丰盛 大巴车 宽敞 干净 斯洛文尼亚 司机 拉索 熟悉 路况 游玩 车上 看护 行李 语言不通 每次 衣服 坐在 驾驶 放心 最最 满意 导游 领队 徐健 讲解 幽默 风趣 贴心 照顾 一位 团员 行程 安排 人性化 佛罗伦萨 行程 天气 调整 景点 先后顺序 山上 米开朗琪罗 广场 佛罗伦萨 全景 阳光 透过 淡淡的 白云 老城区 房顶 圣母 百花 教堂 亭亭玉立 托斯卡纳 艳阳 美景 真的 不虚此行 念叨 一路 心愿 闪烁 埃菲尔铁塔 努力 真的 感动 感谢 完美 物超所值 旅程 徐导 满分,"[(0, 0.6761873), (1, 0.14356339), (2, 0.18024933)]",0
本次 欧洲 周导 阿旭 旅游 路线 生活 周密 安排 很好 旅游 体验 阿旭 衷心 感谢,"[(0, 0.94969547), (1, 0.027562989), (2, 0.02274155)]",0
令人满意 欧洲 行程 安排 紧凑 曾导 带队 经验 时间 提醒 事项 整体 协调 表现 完美 感谢 给予 团队 成员 五星级 体验 棒棒,"[(0, 0.96472114), (1, 0.016800854), (2, 0.018477993)]",0
第一次 出国 旅行 没想到 满意 收获 满满的 感动 领队 文斌 真的 导游 知识 渊博 耐心 细致 工作 留下 深刻 印象 明天 离开 欧洲 美好 感谢 孩子 见到 领队 叔叔 欧洲 感谢 领队 欧洲 司机 大叔 同行 队友 开心 期待 有缘 再见 平安 幸福 好运,"[(0, 0.24693073), (1, 0.7433683)]",1
满意 领队 导游 司机 强强 董力鸣 导游 专业 经验丰富 学识渊博 欧洲 历史 文化 介绍 侃侃而谈 退税 政策 介绍 详细 领队 关注 团员 人身 财务 巴黎 小偷 大声 喝止 司机 驾驶 技术 娴熟 照顾 团员 每次 景点 地方 停车 倒车 撞坏 保险杠 心疼,"[(0, 0.091631934), (1, 0.14878885), (2, 0.7595792)]",2
想到 相处 特别 开心 愉快 赵导 责任心 博学 有趣 可爱 包容 耐心 唯一 希望 保重 身体 感谢 难忘 旅行,"[(0, 0.018512055), (1, 0.96172184), (2, 0.019766089)]",1
一路 舟车劳顿 行驶 公里 一路 欣赏 优美 风景 参观 历史 文化名城 轻松 购物 这段 旅程 划上 完美 句号 感谢 伍队 一路 相伴 耐心 讲解 热心 相助 旅游 选择 携程 选择 放心 中途 孩子 手机 德国 宾馆 伍队 得知 第一 时间 接连 几天 追踪 确认 携程 领队 拿到 手机 快递 真心 感谢 伍队 细心 认真负责 机会 选择 伍队,"[(0, 0.27197734), (1, 0.24792704), (2, 0.48009565)]",2
行程 携程 安排 很好 不愧 公司 司机 导游 不错 大巴 干净 特别 表扬 文斌 导游 一路 解说 不胜其烦 团友 团友 友好 互帮互助 欢声笑语 法意 行程 紧凑 领略到 各国 风情 实在 性价比 酒店 舒服 团餐 寡淡 建议 泡面 榨菜 老干妈 中国 受不了,"[(0, 0.85907024), (1, 0.13158639)]",0
时期 出游 令人难忘 回忆 感谢 团友 感谢 导游 出游 选择 携程,"[(0, 0.03233531), (1, 0.93736446), (2, 0.030300252)]",1
旅程 愉快 紧凑 运气 天鹅堡 景点 赶上 天气 罢工 影响 领队 导游 陈骏 性格开朗 经验丰富 职业 素养 兼顾 团员 游玩 购物 需求 法国 团餐 好吃 意大利 厨师 烧菜 最不 走心 十字 广场 团餐 当晚 上吐下泻 好好 庄园 酒店,"[(0, 0.91522884), (2, 0.07528644)]",0
满意 家庭 旅行 感谢 领队 导游 余鹏 认真负责 专业 全程 合理安排 行程 餐饮 购物 退税 特别 几次 解决 小朋友 突发状况 感谢 余队 满分,"[(0, 0.0159924), (1, 0.5359075), (2, 0.44810012)]",1
蜜月 行程 紧凑 特色 代表性 地点 逛遍 郭导 经验 导游 看遍 风景 历史 地理 文化 跟团 大巴 司机 克罗地亚人 老婆 开心 希望 下次 有缘,"[(0, 0.65146923), (1, 0.3310272), (2, 0.017503541)]",0
旅行 轻松愉快 导游 安排 行程 景点 介绍 详细 团员 开心 喜欢 旅行 小团 司机 开车 很稳 舒适 意大利 古典建筑 奥地利 唯美 小镇 德国 天鹅堡 感受 瑞士 雪山 法国 浪漫 留下 美好 回忆,"[(0, 0.8248377), (1, 0.16347297), (2, 0.011689317)]",0
携程 出游 欧洲 体验 导游 周毅 安排 贴心 周到 线路 安排 住宿 餐饮 购物 退税 周到 细致 一路 还给 讲解 欧洲 历史 全家 受益匪浅 期待 下次 出行,"[(0, 0.015363587), (1, 0.016301125), (2, 0.9683353)]",2
整条 路线 规划 第一天 晚上 时差 第二天 早上 精神 饱满 行程 导人 行程 安排 灵活 老婆 开心 景美 心情 携程,"[(0, 0.8206253), (1, 0.018952077), (2, 0.16042265)]",0
特别感谢 本次 欧洲 导游 孙进 工作 认真负责 朋友 亲人 周到 一路 时时 提醒 关照 本次 欧洲 行画 圆满 句号 感谢 孙导 感谢 携程,"[(0, 0.016235312), (1, 0.96810067), (2, 0.015664004)]",1
老公 出游 总体 满意 文斌 文导人 欧洲 欧洲 历史 文艺 建筑 景点 行程 安排 好吃 周全 详细 讲解 携程 线路 安排 紧凑 惊叹 意大利 罗马 古典 陶醉 瑞士 自然风光 特别 值得一提的是 瑞士 少女 脚下 一晚 第二天 早就 坐火车 少女 瑞士 酒店 国家 少女 团队 上山 远观,"[(0, 0.9792351), (2, 0.012746055)]",0
不错 领队 导游 说古道今 中外 通晓 一路 讲解 一路 风趣 一车 欢笑 解除 长途 车程 乏味 加深了解 欧洲 历史 人文 优质 保证 安排 贴心 服务 体现 携程 品牌 一贯作风 信誉 王导 携程,"[(0, 0.3106828), (1, 0.44453576), (2, 0.24478146)]",1
行程 内容 城市 经典 景点 打卡 导游 董力鸣 专业 负责 讲解 内容 生动有趣 一路 领略 各国 文化 历史 处事 条理清晰 耐心 细心 热心 厉害 赶走 小偷,"[(0, 0.54866505), (1, 0.016270157), (2, 0.43506476)]",0
团餐 不错 团队 小伙伴 互帮互助,"[(0, 0.6908763), (1, 0.24080193), (2, 0.06832174)]",0
回来 修养 几天 一段 行程 安排 紧凑 国家 多个 城市 有点累 风景 没话说 国家 国家 瑞士 值得 餐饮 中餐 差强人意 去过 国家 亮点 领队 罗马 佛罗伦萨 城市 导游 欧洲 历史 如数家珍 关键 十几个 国家 携程 导游 唯一 至少 解说 小时 客题 国家 历史 人文 风土人情 购物 性价比 面面俱到 想到 客观 文斌 导游 评为 携程 星类 导游,"[(0, 0.62234443), (2, 0.37075004)]",0
出行 家人 出行 四国 行程 行程 强度 想象 选择 深度 瑞士 琉森 法国巴黎 不错 城市 带领 出国游 王国 王导 工作 负责 酒店 楼层 房间 用心 选择 合理安排 希望 所有人 舒心 开心 旅行 反复强调 注意事项 讲解 欧洲 历史 风土人情 欧洲 历史 离开 巴黎 那天 上海 台风 滞留 巴黎 事件 开心 事情 原本 时间 正好 留在 巴黎 好好 自由 导游 确实 一件 糟糕 事情 航空公司 协调 突发事件 航站楼 奔波 两天 负责 辛苦 插曲 所有人 离开 导致 赶不上 旅行团 王导 辛苦 王导 领队 一件 吃力不讨好 苦差 一点 差子 出行 小伙伴 出行 王导 相互 照顾 出国 在外 中国 事情 面对 力量,"[(0, 0.75869787), (1, 0.059114963), (2, 0.18218718)]",0
幸运 选择 携程 欧洲 欧洲 旅游 入门级 行程 紧凑 以点带面 第一次 接触 欧洲游 游客 错过 经典 美景 更觉 幸运 了文斌 导游 小文 导游 旅行 亮点 大大的 文导 业务 能力 一流 经典 景点 介绍 娓娓道来 行程 安排 可贵 文导 旅客 所急 热心 解决 旅客 旅程 状况 幸运 一群 素质 旅友 相互理解 相互 上海 上海,"[(0, 0.6681016), (1, 0.16320473), (2, 0.1686937)]",0
女儿 欧洲 团游 满意 整体 行程 安排 环环相扣 不失 轻松 领队 导游 阿毅 见到 专业 导游 不厌其烦 详实 介绍 讲解 展现 一副 欧洲 历史 画卷 真心 感谢 阿毅 朋友 亲切 相处,"[(0, 0.23352887), (1, 0.011963087), (2, 0.7545081)]",2
满意 出游 朋友家 一行 国庆 期间 踏上 欧罗巴 横跨 七个 国度 携程 安排 贴心 周到 推荐,"[(0, 0.5293126), (1, 0.44778994), (2, 0.022897474)]",0
行程 略显 仓促 陈导 认真负责 工作 细致 酒店 不错 景点 特色 少女 游船 博物馆 行程 丰富多彩 抢到 蜜月 套餐 合算 整体 满意,"[(0, 0.8192293), (1, 0.01662676), (2, 0.164144)]",0
酒店 机票 旅游 出行 选择 携程 携程 领队 王震 依然 失望 细心 贴心 无微不至 博古通今 幽默诙谐 灰常好,"[(0, 0.33552426), (1, 0.6433151), (2, 0.021160707)]",1
满意 导游 吃喝拉撒 安排 周到 酒店 不错 环境 干净 卫生 设备齐全,"[(0, 0.9376155), (1, 0.030839752), (2, 0.031544726)]",0
陈导 幽默 风趣 争取时间 逛街 景点 有问必答 导游,"[(0, 0.23232082), (1, 0.20504911), (2, 0.5626301)]",2
欧洲 台风 原因 出发 携程 重视 萧导 领队 特别 认真负责 行程 安排 妥妥 预定 景点 服务周到 业务 精湛 体会 美妙,"[(0, 0.023355179), (1, 0.020119904), (2, 0.9565249)]",2
欧洲 旅行 安排 充实 顺畅 特别感谢 导游 董导 董力鸣 五星 好评 好评 原因 专业 诠释 专业 旅途 坐车 时间 董导 耐心 讲解 国家 历史 政治 经济 人文 艺术 宗教 八卦 面面俱到 级别 文化 内涵 不仅如此 敬业 大巴 睡过去 讲解 觉醒 感动 携程 年老 用户 欧洲 游历 国家 众多 导游 感觉 董导 真的 文化 专业 想来 文化 靠读 走过 苦来 积累 董导 好评 原因 导游 服务 意识 每次 清点人数 安排 住宿 解决问题 阿姨 叔叔 介绍 行程 退税 指导 导游 酷酷 耐心 条理清晰 怀疑 董导 处女座 客人 第一 用心 好评 原因 专业 无缝 切换 讲解 角色 分钟 上身 有趣 幽默 行程 增色 导游 出色 感谢 领队 小何 一路 热心 克罗地亚 司机 拼写 每次 热情帮助 行李 旅程 愉快 风景 感谢 携程 感谢 导游,"[(0, 0.37888634), (1, 0.2667181), (2, 0.3543955)]",0
总体 满意 一点点 建议 阿尔卑斯山区 前一天 提醒 下穿 防滑 鞋子,"[(0, 0.033219114), (1, 0.29366723), (2, 0.67311364)]",2
第二次 参加 携程 自营 两次 导游 经验丰富 下次 自由 之外 跟团 首选,"[(0, 0.030946106), (1, 0.93552333), (2, 0.03353057)]",1
走马观花 旅游 惊艳 意大利 教堂 雕塑 醉心于 德瑞 城堡 法国 时尚,"[(0, 0.9395719), (1, 0.029687192), (2, 0.030740848)]",0
总体 愉快 欧洲 性价比 满意 感觉 大团 专职 领队 领队 导游 肩挑 意外 特别 法国 意大利 中国 游客 团队 旅游 时间 观念 领队 出发 做好 规矩 影响 行程 本团 购物 行程 老佛爷 两处 购物点 远不止 团友 购物 需求 利用 自由 活动 时间 只能 供应商 操作 老练 一分 价钱 一分货 物有所值 心情,"[(0, 0.98514843)]",0
