内容,主题概率,主题类型
行程 第一天 住宿 满意 行程 不错 特别 表扬 刘霖 领队 一路 无微不至 照顾,"[(0, 0.5639104), (1, 0.40498558), (2, 0.031103976)]",0
欧洲游 整体 满意 不到 算是 年纪 相仿 交谈起来 融洽 陈导 带队 有条理 认真负责 团友 车上 欧洲 历史 变迁 游历 欧洲 各国 历史 风土人情 有个 正逢 法国 国庆 陈导 贴心 调整 行程 错峰 参观 景点 排队 参观 省去 时间 司机 意大利人 开车 技术 一级 去往 庄园 酒店 路上 插曲 司机 凭着 熟练 车技 顺利 解决 道路 真心 带队 陈导 司机,"[(0, 0.9866582)]",0
快乐 游程 旅游 行程 安排 倒时差 辛苦 搞定 携程 旅游 品质 一如既往 满意 超值 一站 西班牙 依然 携程 旅游 度假 放心 称心 开心 收获 满满 回忆 无限 循环,"[(0, 0.013811114), (1, 0.9734081), (2, 0.012780768)]",1
行程 不错 自由 活动 时间 充裕 景点 参观 几个 老师 讲解 有趣 专业 中餐 想象 好吃 几天 幸福 事情 中式 团餐 几家 味道 真心 不错 住宿 弗洛 伦萨 酒店 行程 最差 导游 事先 预防针 隔音 差成 真心 还好 第一天 瑞士 法国 几家 不错 干净,"[(0, 0.18167543), (2, 0.8100384)]",2
游程 安排 宽松 走马观花 体验 欧洲 中世纪 安排 几个 场馆 介绍 周详 导游 专业 敬业 无论是 欧洲 人文 地理 了如指掌 车上 健谈 讲解 头头是道 逻辑 主动 予以 接手 解决 接送 服务 到位 令人 放心,"[(0, 0.9766635), (1, 0.0110353725), (2, 0.012301112)]",0
父母 老两口 满意 一路 餐饮 住宿 安排 不错 领队 肯定 满意 一趟 行程,"[(0, 0.027934717), (1, 0.03067404), (2, 0.9413912)]",2
第一次 欧洲 旅游 品牌 旅游 公司 携程 自营 产品 欧洲游 值得 游玩 四国 包括 路线 设计 行程 安排 紧凑 舒适 欣赏 美丽 景色 游玩 举世闻名 古迹 领队 朱林 一位 小伙子 带队 欧洲 旅游 工作 超过 八年 欧洲 历史 风土人情 一路上 介绍 旅游 地理位置 历史风貌 带队 经验 一位 购物 达人 美食家 工作 认真负责 热情 豪爽 每次 外出 游玩 酒店 休息 主动 游客 提携 行李 关照 物品 忘记 游玩 特别 提醒 提防 小偷 晚上 放弃 休息 热情 主动 购物 游客 整理 税单 做好 退税 金额 计算 工作 机场 退税 游客 方便快捷 拿到 退税款 感谢 朱林 领队 事先 做好 工作 住宿 条件 不错 满意 住宿 五星级 酒店 庄园 酒店 外出 大巴 不错 世界 数一数二 品牌 新车 凯斯 沃尔沃 导游 讲解 不错 参观 卢浮宫 凡尔赛宫 深刻理解 旅游 难忘 旅行 强制 消费 携程 希望 遇见 朱林 领队 旅游 丰富多彩 舒心,"[(0, 0.99416476)]",0
完美 体验 完美 旅程 值得 表扬 领队 宗启川 服务 超赞,"[(0, 0.039133508), (1, 0.9237867), (2, 0.037079804)]",1
出游 选择 携程 确实 选对 游程 安排 地方 不愧为 人气 经典 路线 古老 意大利 罗马 美丽 瑞士 浪漫 法国 一路 风光秀丽 特别 瑞士 少女 美的 窒息 酒店 安排 大巴 舒适 司机 车技 一流 中式 团餐 第戎 团餐 太差 改进 三道 墨鱼 太棒了 要点 领队 导游 文斌 四川 成都 帅哥 年纪 知识 渊博 精通 各国 文化 历史 美食 名牌 样样精通 一路 滔滔不绝 讲解 幽默 风趣 旅途 不觉 乏味 细心 周到 年长 游客 特别 关心 一路 照料 退税 详细 告知 流程 检查 一位 游客 税单 直至 机场 陪同 一个个 环节 操作 回程 到达 上海 行李 收齐 护照 登机牌 后才 离去 真心 热爱 职业 工作 敬业 愉快 令人难忘 旅程,"[(0, 0.89569974), (2, 0.100448236)]",0
携程 行程 安排 返程 直飞 不用 迪拜 转机 更好,"[(0, 0.9252929), (1, 0.035444293), (2, 0.039262824)]",0
初次 欧洲 旅游 经典 行程 意大利 瑞士 法国 三个 各具特色 国家 行程 看似 去除 第一天 飞机 游玩 意大利 瑞士 城市 一半 时间 路上 观看 景点 时间 匆忙 好多 教堂 景点 外观 想要 参观 只能 等待 下次 自行 出游 法国 酒庄 巴黎 地方 时间 自由 活动 时间 景点 只能 一二 游览 整体 首次 游览 欧洲 景色 行程 不错 想要 深度 游览 另行安排,"[(0, 0.98543364)]",0
参加 法意 游回来 几天 法意 山水 风光 历史 古迹 导游 全程 服务 时时 脑海 重现 公司 行程 安排 松紧 内容 既有 历史文物 山水 风光 盛名 酒庄 工艺 参访 所到之处 看得 接讲 酒店 早餐 略显 单调 特别 庄园 别墅 酒店 别具 风格 印象 深刻 负责 行程 文斌 导游 心细 周到 协调 能力 凡事 提醒 事项 多天 团员 和谐 事项 安排 出纰漏 收获 满满 物有所值 快乐 旅行,"[(0, 0.98811144)]",0
携程 出境 不想 攻略 机票 酒店 签证 买票 懒人 不二 代价 地方 略显 走马观花 没关系 下次 勤快 深度 一遍,"[(0, 0.96258056), (1, 0.018874984), (2, 0.01854443)]",0
结婚 时间 攻略 出发 一个月 不到 行程 出发 忐忑 回来 真的 真的 旅游 行业 很多年 行程 安排 线路 休息 游玩 购物 并重 品质 线路 推广 真的 不错 一个个 点评 角度 罗马 建筑 太漂亮 两天 时间 锡耶纳 贝加莫 着实 感到 惊喜 小城镇 团队 看不见 中国 米兰 时间 真的 太短 感觉 可惜 威尼斯 时间 看多 苏州 绍兴 江南 古镇 瑞士 少女 惊艳 天气 人品 琉森 那天 天气 不好 无聊 巴黎 浪漫 建议 购物 暴走 感觉 自由,"[(0, 0.5546653), (1, 0.43976927)]",0
特别 特别 满意 旅行 琉森湖 自然 不用说 人间 圣地 此行 值得 意大利 文艺复兴 巧夺天工 建筑物 雕塑 古罗马 废墟 叹为观止 亲子 儿子 人文 艺术 特别 感兴趣 收益 非浅 行程 安排 办法 威尼斯 时间 广场 鸽子 一会儿 可惜 时间 王妍 导游 实在 出人意料 碰到 导游,"[(0, 0.9824295)]",0
舒适 欧洲 蜜月 领队 刘霖 精心安排 行程 顺利 气氛 开心 印象 深刻 瑞士 少女 真的 震撼 身临其境 感受 雪景 壮阔 刘导 认真负责 回程 后在 浦东 机场 一名 团友 处理完毕,"[(0, 0.9740642), (1, 0.013217599), (2, 0.012718204)]",0
感谢 顾导 全程 服务 专业 倾佩 旅途 欣赏 美好 风景 麻烦 行程 安排 地方 解说 专业 祝顾 新年 万事如意 祝福 新年快乐 阖家幸福,"[(0, 0.9613957), (1, 0.01791013), (2, 0.020694206)]",0
本次 欧洲 爸妈 朋友 预定 本来 前期 家中 突发 事情 前往 携程 客服 沟通 圆满 解决 旅行社 携程 景点 行程 安排 爸妈 年龄层 选择 全程无 自费 放心 十几天 旅行 爸妈 朋友 欧洲 风光 宜人 行程 安排 妥当 入住 酒店 比较满意 领队 徐健 留下 深刻 印象 合理安排 调整 行程 更好 领略 风光 喜欢 罗马 建筑 相对来说 罗马 行程 仓促 瑞士 少女 风景 优美 寂静 白雪皑皑 陶醉,"[(0, 0.8777963), (1, 0.11528364)]",0
朱林 领队 太棒 欧洲 感觉 玩乐 安排 妥帖 团友 轻松 度假 干净 欧洲 酒店 中国 酒店设施 房间 味道 团餐 棒棒 带去 老干妈 榨菜 零食 打开 手机 晒图 手机 皂片 手机 携程 明智 义务 打广告,"[(0, 0.9786326), (1, 0.010341167), (2, 0.01102621)]",0
第一次 欧洲 选择 最为 信任 携程 旅行 回来 收获 满满 坚定 携程 旅游 导游 旅程 轻松 愉快 幸运 领队 朱琳 行程 变得 特别 风趣 幽默 导游 应做 工作 一位 朋友 家人 无微不至 关心 照顾 无论是 酒店 前台 一个团 全力以赴 性价比 资源 看在眼里 感动 游览 景点 统筹安排 行程 舒适 享受,"[(0, 0.9826357)]",0
意大利 圣彼得大教堂 雕塑 富丽堂皇 令人 震撼 罗马 厚重 瑞士 安逸 巴黎 浪漫 核心 讲求 活着 品质 意大利 罗马 古迹 弗洛 伦撒 骄傲 威尼斯 美丽 投射 民族 建立 强大 延续 强大 遵守 上帝 训导 约束 一种 精神 强大 精神 支撑 内心 安静 温暖 向善 信仰 力量 阿俊 故事 分享 导游 经历 窗外 魅力 风景 美餐 老婆 去过 欧洲 心情 放松 非要 阳光 喝一杯 咖啡 滑翔 滑雪 草坪 读书 风景 一颗 善良 一种 感激 生命 情怀 上帝 姿态 来到 好好 善待 善待 祝福 幸福 感觉 心态 平和 平静 力所能及 小日子 足够 阿俊 历史 知识 尤为 老婆 旅游 谅解 懂得 理解 旅游 意义 感谢 阿俊 旅游 一路上 总体 行程 期待 国家 深度,"[(0, 0.36761183), (2, 0.6286409)]",2
选择 经典 西欧 线路 老婆 蜜月游 选择 携程 选过 旅行社 类似 路线 成团 最终 携程 确认 成团 情况 选报 这条 线路 一条 值得 等待 线路 旅程 愉快 浏览 历史 文化 名胜 游览 湖光山色 美景 相互 融合 相得益彰 充裕 自由 活动 时间 团游 像是 一个半 自助游 感觉 很棒,"[(0, 0.9830191)]",0
总体 行程 满意 导游 节奏 控制 团友 需求 耐心 解决 整体 行程 总得来说 景点 感觉 贝加莫 老城 锡耶纳 法国 图尔 实在 景点 多余 时间 放在 值得 逗留 景点 小团 行程 体验 感会 每次 远游 选择 携程 小团 感觉 体验 更好 肯定 参加 价格 确实 网站 小团 一点 值得 导游 服务 到位 几十个 导游 提供 服务 喜欢 少女 景点 有个 小小 建议 预订 行程 提醒 客人 少女 高原 全团 感觉 个体 原因 身体 不好 危险 携程 麻烦 团餐 一般般 好吃 导游 努力 几顿 算是,"[(0, 0.5864955), (1, 0.4083888)]",0
第一次 欧洲 选择 携程 超过 预期 惊喜 很棒 领队 行程 路线 设计 团餐 不错 领队 耐心 细致 带队 能力 解决 创造 美好 旅游 体验 选择 携程 正确 回来 用户 点评 感觉 携程 团队 真的 出国 肯定 携程 希望 携程 努力 国内 旅游界 标杆,"[(0, 0.9827068)]",0
整体 行程 贝加莫 图尔 酒庄 增加 经典 行程 更好,"[(0, 0.9131038), (1, 0.049109705), (2, 0.03778642)]",0
不错 行程 整体 安排 值得 推荐 领队 导游 素养 欧洲 旖旎风光 完美 行程 住宿 团餐,"[(0, 0.027932977), (1, 0.023804972), (2, 0.94826204)]",2
蜜月 开心 领导 很棒 一路上 行程 辛苦 团餐 满意 选择 携程,"[(0, 0.9282478), (1, 0.039857112), (2, 0.03189507)]",0
当初 看中 行程 报名 吃住行 总体 满意 王导 知识 涵养 带团 时间 经验 有求必应 细心 耐心,"[(0, 0.66128314), (1, 0.024595264), (2, 0.31412157)]",0
爸爸妈妈 姐姐 岳母 参团 朱林 导游 满意 一路 不辞辛苦 历史 经济 退税 纪念品 细致 强迫 消费 利益 倾向 公道 同行 年轻人 冲着 朱林 导游 希望 老人 携程 报团 出游 导游 领导 朱林 出色,"[(0, 0.011606382), (1, 0.18610318), (2, 0.80229044)]",2
总体 不错 费用 包括 自理 用餐 体验 美食 携程 饭钱 特别 瑞士 本来 携程 定团 导致 用餐 成本 很大 景点 安排 自由 活动 时间 合适 几天 瑞士 巴黎 一大部分 时间 路上 办法 事情 住宿 不错 酒店 一点 一点 干净 整洁 酒店 早餐 实在 几天 想到 早饭 建议 自带 榨菜 团餐 管饱 味道 讲究 一顿 凡尔赛宫 周边 吃到 好吃 良心 中餐 特别感谢 王妍 导游 安排 真的 泪流满面 特别感谢 王妍 领队 认真负责 路上 讲解 一个多 小时 几天 嗓子 真的 学到 历史 习俗 细心 照顾 吃穿住行 团友 房间 酒店 前台 吵架 团友 退税 工作 领队 真的 辛苦,"[(0, 0.99169695)]",0
经典 线路 安排 充足 内容 轻松 时间 旅游 领队 陪同 欧洲 旅游 领队 导游 保姆 理财师 精通 欧洲 历史 讲故事 特别 领队 陈述 兼具 导游 保姆 理财师 历史 老师 职能 旅游 丰富多彩,"[(0, 0.9746753), (1, 0.011824207), (2, 0.013500466)]",0
旅行 圆满结束 领队 赵文 感受 携程 领队 高素质 经验 欧洲 文化 热心 帮忙 整次 行程 吃住 不错 下次 携程 出游,"[(0, 0.785727), (1, 0.19503142), (2, 0.019241564)]",0
朋友 定团 携程 自营 有贵 道理 领队 很棒 喜欢 几顿 团餐 满意 国外 好吃 中国 一顿 团餐 任导 自掏腰包 一路上 地方 任导 左边 右边 机场 路上 结束 行程 讲解 厉害 欧洲 熟悉 地方 干净 早餐 不错 好多 超市 机会 携程 自营 希望 碰到 任导,"[(0, 0.9831639)]",0
任导 团友 负责 提醒 注意安全 团餐 想象 不错 旅行 体验,"[(0, 0.9272589), (1, 0.034750342), (2, 0.03799074)]",0
游程 比较满意 王导 不错 耐心 热情 负责 第一天 希望 第一天 行程 宽松,"[(0, 0.03087056), (1, 0.02914147), (2, 0.93998796)]",2
唐导 特别 热情周到 行程 舒适 巴黎 酒店 房间 很小 不错 开心,"[(0, 0.9332632), (1, 0.033231754), (2, 0.033505104)]",0
出游 不错 导游 阿俊 全程 耐心 照顾 酒店 吓死 感受 夸张 没准 标准 一晚 唯一 遗憾 巴黎 酒店 戒指 贵重物品 保险箱 行程 感觉 坐在 大巴 到此一游 买买 过程 真的 特别 老佛爷 瑞士 买到 手表 瑞士 少女 有点累 山上 时间 上山 好几 小时 火车 团餐 标准 很好 中国 餐厅 口味 中国 饭店,"[(0, 0.98557013)]",0
老公 第一次 欧洲游 沿途 风光 景美 好评 领队 一群 可爱 小伙伴 度过 完美 假期,"[(0, 0.37285665), (1, 0.32968065), (2, 0.29746267)]",0
领队 唐珊 认真负责 讲解 详细 每位 团友 十分关心 不愧 金牌 导游,"[(0, 0.033259254), (1, 0.9346232), (2, 0.03211754)]",1
风景 超级 国游 少女 震撼 太美 随手 超级 美景 团餐 不差 自理 尝试 正宗 意面 提拉 米苏 买买 夸夸 领导 王妍 真心 不错 耐心 事宜 讲解 到位 关心,"[(0, 0.9734851), (1, 0.013205962), (2, 0.013308906)]",0
选择 携程 欧洲游 产品 欧洲 风光 值得 几次 全程 天气 家人 心情舒畅 愉快 意大利 古老 文明 瑞士 湖光山色 法国 国际 时尚 特色 少女 印象 最为 深刻 瑞士 行程 安排 喜欢 瑞士 宁静,"[(0, 0.9772265), (1, 0.011217506), (2, 0.011555987)]",0
满意 旅游 行程 安排 感谢 陈熙 领队 带领 欧洲,"[(0, 0.39554355), (1, 0.565091), (2, 0.039365407)]",1
感谢 任导 衣食住行 无微不至 讲解 特别 认真仔细 专业 行程 安排 不错,"[(0, 0.5509696), (1, 0.41372564), (2, 0.035304792)]",0
感觉 不错 导游 特别 认真负责 省心,"[(0, 0.0605331), (1, 0.056913838), (2, 0.88255304)]",2
行程 安排 酒店 餐饮 比较满意 导游 顾琳 业务 精通 名胜古迹 风土人情 讲解 家庭 需求 关注 尽力,"[(0, 0.024538545), (1, 0.5299347), (2, 0.4455267)]",1
携程 称为 旅游 品牌 科学化 管理 人性化 服务 撑起来 环节 导游 当家的 参加 携程 旅行 有幸 碰到 导游 朱林 花甲之年 年轻 年少 服务 需求面 面具 景点 讲解 绘声绘色 游人 引入 体会 人文 美景 历史 重感 路线 服务 按排 有条不紊 携程 朱林 导游 携程 旅游 行程 携程,"[(0, 0.9819549)]",0
行程 安排 形式 时间 宽裕 自由 活动 时间 传统 团游 赶鸭子 好几个 景点 总体 行程 舒适,"[(0, 0.022863094), (1, 0.02119734), (2, 0.9559396)]",2
领队 朱林 实在 太棒了 满分 尽责 朱林 办事 细致 事情 反复 叮嘱 确保 万无一失 旅程 一个团 当作 解决 想方设法 团友 满意 朱林 尽职 碰到 朱林 鸡血 领队 全程 解说 引经据典 激情 四射 无论是 景点 大巴 不知疲倦 不留 空白 程式化 照本宣科 熟知 历史 人文 学者 脱口秀 几天 着凉 感冒 嗓子 敬业 琐事 意大利 咖啡店 落下 相机 返身 找到 朱林 希望 没想到 朱林 办法 当天 找回 相机 意外 朱林 经验 提前 出发 机场 事实证明 明智 办理 值机 退税 过程 意外 频出 法兰西 磨叽 自大 算是 领教 办好 距离 登机 半小时 补充 一点 朱林 时尚 达人 标准 吃货 对了 自由 对了 优秀 领队 完美 旅程 感谢,"[(2, 0.9923493)]",2
行程 安排 挺舒服 领队 赵文 欧洲 历史 透彻 导游 一站 法国 那位 女士 讲解 携程 不错 一如既往 你家,"[(0, 0.9593026), (1, 0.021004494), (2, 0.019692903)]",0
昨天 刚刚 回国 行程 安排 妥善 大大的 赞赏 导游 王忠 初见 感觉 一位 儒雅 知识分子 毕业 南京 名牌大学 饱读 诗书 行程 经验丰富 突发事件 意大利 关卡 警察 刁难 协调 变通 行程 时间 告诉 免费 厕所 自理 餐食 价廉物美 餐厅 提前 提醒 买好 大牌 货物 省去 老佛爷 地方 排长队 等等等等 感谢 王队 生日 那天 中秋节 大大的 惊喜 异国他乡 吃到 生日蛋糕 团友 月饼 实在 有心 一辈子 忘记 生日 特别 指出 王队 行程 一半 身体 不适 病痛 影响 一点 旅游 质量 任然 任劳任怨 办妥 事宜 回程 不靠 法国 机场 办好 登机牌 整理 税单 法国 机场 办理 退税 法国 工作人员 交涉 行程 团友 友善 和谐 旅程 愉快 导游 王忠 点点滴滴 无微不至 照顾 关怀 令人难忘 任然 一如既往 支持 携程 希望 机会 王导 谢谢 王导,"[(1, 0.30746704), (2, 0.68899626)]",2
领队 服务 安排 时间 卡得 成员 耐心 回答,"[(0, 0.7634892), (1, 0.1863204), (2, 0.050190404)]",0
阿骏 历史 知识 丰厚 故事 绘声绘色 行程 注意事项 讲解 仔细,"[(0, 0.9249485), (1, 0.033921015), (2, 0.04113049)]",0
行程 超乎 想象 好几个 冷门 景点 地区 喜欢 行程 安排 著名 景点 导游 领队 专业 改变 旅行 看法,"[(0, 0.020964568), (1, 0.14765248), (2, 0.831383)]",2
旅行 陈述 导游 带队 整体 游程 有惊无险 罗马 行李 陈导 机场 牺牲 业余时间 行李 免去 后顾之忧 一路上 事无巨细 关照 吃喝拉撒 安排 妥当 跟着 陈导 走遍 天下,"[(0, 0.19652063), (1, 0.015540285), (2, 0.7879391)]",2
五星 好评 肯定 携程 欧洲 招牌 路线 当之无愧 游玩 四国 包括 行程 安排 紧凑 路线 设计 欣赏 美妙绝伦 景色 游玩 举世闻名 古迹 享受 舒适 愉快 假期 品尝 回味无穷 美食 真的 太值 鸡蛋里挑 骨头 参观 山城 贝加莫 半天 让给 购物 增加 瑞士 行程 完美 入住 酒店 总体 满意 莱斯 庄园 别墅 酒店 莫凡彼 酒店 最为 喜欢 独具特色 托斯卡纳 三道 名不虚传 重点 领队 朱林 专业知识 讲解 有声有色 风趣 幽默 不输给 导游 美食 经验丰富 推荐 牛排 千层 法式 蜗牛 港式 牛肉面 口感 俱佳 一路 享受 饕餮 美食 安全意识 意大利 法国 每次 下车 不厌其烦 提醒 包包 看管 贵重物品 亲切 耐心 稳重 自由 活动 时间 时间 拍照 购物 不熟 街道 环境 购物 超时 而晚 集合时间 归队 责备 耐心 上车 携程 团队 令人 放心 舒心 领队 及时处理 原本 行程 安排 不错 出国 肯定 携程,"[(0, 0.99412453)]",0
欧洲游 满意 领队 陈骏 专业 卖相 口才 风趣 幽默 路上 讲解 罗马 欧洲 历史 退税 相关 事宜 介绍 仔细 真心 感谢 一路上 带领 陪伴,"[(0, 0.96569306), (1, 0.01650176), (2, 0.017805208)]",0
几条 负面 评价 出发 担心 没想到 行程 超级 一顿 中餐 真的 食住行 满意 大巴 舒服 外国 司机 超级 幽默 担心 不好 睡袋 全程 好像 一晚 行程 个人感觉 意大利 时间 太久 瑞士 巴黎 瑞士 巴黎 真的 都太美 巴黎 时间 巴黎圣母院 卢浮宫 导游 小伍 第一次 团游,"[(0, 0.32595637), (1, 0.4360003), (2, 0.23804334)]",1
风景 漂亮 行程 舒适 感谢 导游 王妍 一路 提供 细致 讲解 周到 服务,"[(0, 0.44134802), (1, 0.52839285), (2, 0.030259129)]",1
一家 三口 出行 感觉 不错 行程 路线 安排 相对来说 领队 经验 责任心 具备 很高 专业 素养 罗马 第一天 天气炎热 景点 稍微 有点累 孩子 几天 不错 愉快 旅行,"[(0, 0.9712412), (1, 0.013529306), (2, 0.015229512)]",0
不错 行程 用车 导游 用餐 比较突出 讲解 丰富多彩,"[(0, 0.330818), (1, 0.6225986), (2, 0.04658335)]",1
意大利 第一站 行程 中去 城市 最多 地方 瑞士 瑞士 真的 很美 很冷 依旧 感觉 惬意 法国 经典 景点 行程 自由 购物 行程 去掉 第一天 实打实 全程 大巴 跟着 整体 安排 轻松 特别 领队 王忠 王导 幽默 相处 知识面 专业 退税 弄错 每份 检查 一遍 很棒 旅行 机会 王导,"[(2, 0.98272467)]",2
全程 行程 感觉 导游 唐姗 特别 负责 平时 从来不 点评 导游 满分 说不过去 导带,"[(0, 0.025956964), (1, 0.0258337), (2, 0.94820935)]",2
旅行 满意 东西 不累 坐车 时间 安排 安排 几个 小镇 感觉 景点 好多 下次 机会 参加 小镇 旅行团,"[(0, 0.022838566), (1, 0.020032106), (2, 0.9571293)]",2
线路 蛮好 瑞士 时间 少女 滑雪 可惜 领队 负责 一路 介绍 讲解 好评 好似 有个 项目 巴黎 摩天大楼 蒙帕纳斯 游览,"[(0, 0.45545766), (1, 0.5227715), (2, 0.0217709)]",1
五星 好评 领队 朱林 专业知识 扎实 其人 客人 有问必答 一点 不耐烦 团队 成员 细心 关照 地方 再三 第一次 欧洲游 本来 纠结 参团 自由 选择 参团 果不其然 旅行 途中 地方 自由 行所 巴黎 地铁 上海 自由 地铁 花费 长时间 搞清楚 朱导 自由 活动 细心地 地铁票 乘坐 地铁 特地 工作 时间 安排 巴黎圣母院 行程 附带 讲解 角度 行程 第一个 朱导 认真负责 耐心 老公 东西 导购 收银 操作 熟练 花掉 半个 小时 商场 地形 熟悉 半天 营业员 找到 出口 出口 朱导 门口 责备 上车 抱歉 车上 没开 全球通 发现 朱导 给我发 消息 不好意思 出国 突发状况 帮忙 不错 携程 行程 安排 不错 携程,"[(2, 0.9917866)]",2
第一次 携程网 携子 出游 总体 感觉 满意 团队 成员 亲切 友善 团队精神 文明 出游 体现 中国 游客 优良 素质 行程 安排 第一天 辛苦 安排 舒适 用餐 搭配 团餐 质量 接受 家常菜 吃饱 值得一提的是 团队 领队 陈述 不愧 领队 业务素质 工作 能力 感觉 领导 陈述 保姆 老师 周到 细心 在外 旅游 不用 操心 轻松 游玩 即可 事情 欧洲 文化 历史 领略 建筑 长见识 冲着 优秀 领队 下次 出游 选择 携程 希望 失望,"[(0, 0.4980816), (1, 0.49609083)]",0
法意 欧洲 几天 时差 留恋 情愫 沉静 那段 开心 快乐 天里 不禁 感叹 快乐 转眼 即逝 回忆 刻骨铭心 意大利 罗马 古迹 拉开 本次 旅行 序幕 意大利 特有 建筑 传统 瑞士 窒息 自然风光 法国 卢浮宫 叹为观止 绘画 雕刻 艺术 珍品 激发 女性 强大 购买 欲望 老佛爷 一处处 精神 物质 双重 享受 开心 行程 携程 安排 紧凑 期间 给予 自由 时间 团游 感冒 观点 历史性 改变 这份 改变 特别感谢 陈述 导游 全程 尽职 尽责 尽力 满分 一路上 详细 讲述 各国 历史 文化背景 景点 特色 时时 提醒 注意安全 诸多 叮嘱 关心 团友 有人 身体 不适 贴心 药片 专业 素养 敬礼 情怀 衷心 谢谢 陈导 希望 携程 推出 经典 人性化 旅行 线路 培养 类似 陈导 优秀 导游 给予 旅游 爱好者 福利,"[(0, 0.34738827), (1, 0.6492494)]",1
不错 旅行 全程 景点 安排 很棒 住宿 条件 不错 团队餐 还行 导游 专业 素养 讲解 细致 提醒 到位 领队 熊亚 工作 细致 一路上 不厌其烦 提醒 注意事项 合理安排 景点 参观 时间 就餐 时间 第一天 行礼 延误 妥善 安抚 心情 很好 解决 后续 全程 讲解 如数家珍 显示 职业 素养 渊博 知识 不错 旅行,"[(2, 0.98424906)]",2
家里 一行 八个 天玩 三个 国家 不错 瑞士 太漂亮 大部分 酒店 不错 两天 习惯 欧洲 四星 历史 建筑 中国 那种 景色 真的 大巴 司机 可圈可点 导游 陈骏 地方 头头是道 中外历史 感觉 很棒 一肚子 墨水 惊到 负责,"[(0, 0.97824335), (2, 0.01194649)]",0
旅游 选择 携程 行程 安排 充实 既有 耳熟能详 旅游景点 中国 游客 涉足 欧洲 风情 小镇 穿行 意大利 小镇 古老 悠长 巷子 旅行 超出 预期 导游 热心 负责 注重 游客 一路上 顺利 令人 享受 便是 携程 公司 选择 酒店 一路 四星级 酒店 佛罗伦萨 山庄 别墅 法国 第戎 十七世纪 酒店 一路上 感受 欧洲 深厚 浓郁 人文主义 气息 物超所值,"[(0, 0.9866507)]",0
产品 详细 出发 班期 巴黎 摩天大楼 游览 没送 出发,"[(0, 0.0420184), (1, 0.919794), (2, 0.038187582)]",1
本次 领队 陈俊 服务 表示满意 知识 欧洲 进程 历史 知识 古希腊 文明 古罗马 文明 文艺复兴 中国 历史 阐述 游玩 过程 视觉 听觉 完美 安排 不厌其烦 表示满意 行程 安排 建议 罗马 参观 时间 安排 多点 时间 参观 游玩,"[(0, 0.979531), (2, 0.0106262)]",0
领队 朱林 讲解 服务 一级 行程 朱导 始终保持 高度 热情 非常感谢 朱导 一路 用心 安排 特别 机场 有幸 朱导 经验 一点 团友 机场 掐着 事项 顺利 愉快 登机 携程 制定 朱林,"[(0, 0.013587603), (1, 0.012969426), (2, 0.973443)]",2
行程 安排 尽情 游览 美丽 风景 领队 经验 行程 顺利 开心 安心,"[(0, 0.032344304), (1, 0.9368946), (2, 0.030761078)]",1
第一次 携程 欧洲游 行程 松弛 感觉 意大利 威尼斯 留下 美好 回忆 瑞士 风光 实在 唯一 遗憾 法国 景点 购物 孩子 痛苦,"[(0, 0.96491563), (1, 0.017054258), (2, 0.018030116)]",0
