内容,主题概率,主题类型
整体 行程 不算 伦敦 行程 实在 自由 参加 自费 项目 伦敦 市区 景点 伦敦 伦敦 塔桥 威斯敏斯特 教堂 参观 伦敦 经典 无奈 之下 选择 放弃 温莎 城堡 项目 可惜 改善,"[(0, 0.012597236), (1, 0.027272655), (2, 0.9601301)]",2
英国 感觉 失望 伦敦 爱尔兰,"[(0, 0.08817224), (1, 0.29664364), (2, 0.6151841)]",2
英爱之 经典 线路 安排 原先 英国 一无所知 英国 历史 人文 几个 景点 印象 尤为 深刻 王宫 伦敦 白金汉宫 执勤 卫兵 皇家 花园 河畔 漫步 温莎 城堡 周边 徜徉 王室 英国 社会 生活 巨大作用 初步 大英博物馆 见识 英国 深厚 文化 积淀 全人类 文明 结晶 大饱眼福 剑桥 牛津 两座 闻名遐迩 顶尖 学府 领教 英国 教育 实力 莎士比亚 故居 感受 这位 巨匠 人类 文明史 影响力 爱丁堡 卡尔顿 山上 爱丁堡 市区 风貌 尽收眼底 保留 英式 建筑 传统 温德 米尔 湖区 巨人 莫赫 悬崖 几处 自然风光 英国 旅游景点 印象 深刻 游览 大英博物馆 自由行动 放弃 团餐 导游 指点 伦敦 地铁 一日 划算 一路 游览 牛津 摄政 伦敦 塔桥 大本钟 威斯敏斯特 教堂 著名景点 伦敦 地铁 乘坐 几个 英文单词 顺利 回到 酒店 成就感 选择 携程,"[(1, 0.033950534), (2, 0.962611)]",2
旅途 圆满结束 沿途 风景 美不胜收 儿子 领略 英伦 风土人情 自然风光 每次 出游 首选 携程 失望 住宿 环境 优质 餐食 符合 餐标 安排 适合 家庭式 父母 游行 旅行 一路上 美景 相伴 一路上 团友 相互 一路上 旅途 遇上 导游 领队 旅途 最为 快乐 事情,"[(0, 0.2742695), (1, 0.71569407), (2, 0.010036456)]",1
十二天 英爱 行程 圆满结束 英格兰 苏格兰 爱尔兰 城堡 学府 自然风光 一路 学到 直到现在 回味无穷 预定 功课 感觉 携程 行程 价格 便宜 走过 景点 不算 初次 英国 总体 行程 走回头路 自由 活动 时间 景点 经典 深度 最终 选择 携程 行程 季节 英国 旅游 旺季 团里 是因为 成团 换到 也许 缘分 成就 小团 一路 幸运 天气 团友 准时 发生 愉快 意外 家庭 满满 欢声笑语 领队 导游 认真负责 经验丰富 行程 一路 带给 感动 着想 没想到 安排 个人感觉 美中不足 两点 伦敦 景点 包含 伦敦 塔桥 几个 景点 不远 利用 自由 活动 时间 难免 略有 不便 比尔 城堡 内部 开放 期间 游览 花园 游览 时间 相较 行程 景点 略显 乏味 行程 满意 一路 开心,"[(0, 0.5402201), (2, 0.45613772)]",0
整体 感觉 尚可 有限 时间 景点 囊括 印象 深刻 伦敦 爱丁堡 两处 可惜 时间 爱丁堡 行程 安排 紧凑 机会 双脚 步行 感受 爱丁堡 魅力 扣下 颗星 长途 拉车 时间 实在 过分 景点 精彩 景点 逊色 依然 安排 富裕 游览 时间 自理 有限 团餐 招待 档次 急需 提高 几顿 团餐 分量 团餐 享用 时间 紧张 稍慢 耽误 后续 行程 感觉 实在 难过,"[(0, 0.3785139), (1, 0.08250176), (2, 0.53898436)]",2
每次 国外 携程 失望 开心 行程 涵盖 英爱 三岛 实属 不易 行程 安排 不错 人文 自然景观 感受 阴雨 天气 一路 晴好 天气 蓝天白云 旅程 增添 色彩 导游 老王 尽心 尽责 不知 景点 漂亮 角度 拍照 辛苦 谢谢 领队 小薛 热情 负责 安排 住宿 景点 上下车 确认 人数 寻找 掉队 队友 确保 行程 顺利进行 队友 填好 退税 辛苦 谢谢 酒店 满意 酒店 景致 漂亮 不亚于 景点 行程 满意 下次 旅程 选择 携程,"[(0, 0.398361), (1, 0.28309265), (2, 0.31854632)]",0
领队 陶圆 导游 王老爷子 配合 默契 到位 中餐 有缘 下次 再见,"[(0, 0.03034329), (1, 0.37297514), (2, 0.5966816)]",2
行程 安排 紧凑 重点 表扬 领队 导游 服务 不错 考虑周到 讲解 到位 满意,"[(0, 0.029617038), (1, 0.028753862), (2, 0.9416291)]",2
行程 满意 感觉 伦敦 都柏林 更好 行程 爱丁堡 风景 宜人,"[(0, 0.038033184), (1, 0.033837583), (2, 0.92812926)]",2
妈妈 老公 开心 老人家 喜欢 天气,"[(0, 0.060212296), (1, 0.88521534), (2, 0.054572366)]",1
初次 英国 旅游 行程 不错 英格兰 苏格兰 坐船到 爱尔兰 英伦三岛 风景 领略到 关键 王牌 导游 老王 一本 英国 历史 教科书 英国 历史 景点 之间 渊源 团友 着想 提醒 注意安全 购物 检查 货物 品质 提醒 有用 领队 成导 思路清晰 酒店 房间 安排 快速 注意事项 讲清楚 效率 愉快 旅行,"[(1, 0.08376188), (2, 0.9079648)]",2
此行 顺利 天天 晴朗 第三天 有个 团友 阿姨 摔了一跤 领队 冰袋 冷敷 安排 膳食 王导 更是 医保 阿姨 医院 治疗 团友 阿姨 算是 此行 遗憾 王导 领队 每次 最佳 摄影 不厌其烦 拍照 希望 下次 欧洲 领队 希望 伦敦 再多 自由 时间 自费 巴斯 温莎 很棒 伦敦 市区 完整 随便 逛逛 买买 歌剧 音乐会,"[(1, 0.11626226), (2, 0.8758262)]",2
九个 家庭 临时 相亲相爱 团队 领队 国内 导游 地陪 带领 经历 愉快 旅行 欧洲 旅行 还算 住宿 四星 总体 标准 舒适 要说 英国 爱尔兰 薄型 滑雪衫 冲锋衣 失策 得病 回到 火热 一冷 一热 重病 满意 下次 选择 携程 欧耶,"[(0, 0.010693606), (1, 0.70360935), (2, 0.2856971)]",1
英爱之 导游 讲解 用心 热情 景点 安排 满意 领队 安排 精心 服务周到 留下 不错 影响 选择 携程 出行,"[(0, 0.55137604), (1, 0.4259175), (2, 0.022706434)]",0
行程 充实 转眼 结束 劳累 很大 家庭 出游 老人 小孩 承受 导游 专业 经验丰富 风趣 幽默 领队 性格 不错 导游 配合 带来 乐趣 都柏林 发生 愉快 事情 导游 领导 第一 时间 耐心 联络 些许 安慰 打算 出行 朋友 大大的 忠告 英国 打伞 导游 讲解 看管 钱包 建议 团餐 多一点 更好,"[(0, 0.63933796), (2, 0.35264626)]",0
英爱之 不错 适合 父母 同游 大英博物馆 爱丁堡 剑桥 牛津 建议 不想 走马观花 朋友 大不列颠 北爱尔兰 联合王国 历史 爱尔兰 自然风光,"[(0, 0.020554783), (1, 0.3156471), (2, 0.66379815)]",2
英国 早餐 真的 每家 酒店 实在 受不了 团餐 倒胃口 早餐 影响 午餐 晚餐 胃口 建议 早餐 选择性 伦敦 自由 活动 两天 都柏林 自由 活动 一整天 酒厂 博物馆 尝尝 米其林 推荐 餐厅 卡里克 索桥 莫赫 悬崖 值得 卡里克 索桥 先雨 彩虹 很棒 体验,"[(0, 0.37542972), (2, 0.61602885)]",2
喜欢 开森 天气 房间 一点 蛮好,"[(0, 0.05859671), (1, 0.050312586), (2, 0.8910907)]",2
天里 一群 热爱生活 朋友 讲解 记得住 老外 历史 名字 导游 小雪 热情 开车 很稳 司机 领队 林玲 行程 景点 满意 增加 巨石阵 完美,"[(0, 0.016249105), (1, 0.015194699), (2, 0.9685562)]",2
沈欣 领队 十二天 旅程 各个方面 完美 心宜 领队 感谢您 沈欣 小姐,"[(0, 0.93228954), (1, 0.031155156), (2, 0.036555327)]",0
英国 行程 整体 感觉 不错 安排 人文 风景 导游 领队 尽力 负责 信赖 携程,"[(0, 0.94577974), (1, 0.025922503), (2, 0.02829776)]",0
全程 感受 天气 心情 导游 年纪 知识 渊博 通晓 古今 大写 酒店 安排 不错 特别 爱丁堡 高尔夫 酒店 令人 印象 深刻 特别 一句 司机 爱尔兰 小伙子 车技 辛苦 行李 大巴 宽敞 舒服 全程 长时间 拉车 情况 伦敦 停留时间 一点 更好,"[(0, 0.59418005), (2, 0.3962586)]",0
欧洲 去过 国家 英国 好像 惊喜 食物 难吃 安排 建议 自备 食物 比例 多些,"[(0, 0.026770558), (1, 0.023408994), (2, 0.94982046)]",2
第一次 参加 携程 英爱游 六位 年来 国家 东南亚 欧美 留下 遗憾 携程 英爱游 接近 完美 线路 安排 住宿 不错 五星 酒店 天气 帮忙 车上 下雨 停车 参加 携程 帮忙 美女 领队 陶圆 负责 工作 到位 进出 海关 参观 景点 顺利 提出 耐心 解答 六位 老头 导游 小张 东北 小伙 敬业 业务 熟悉 堂堂 生动 英国 历史课 车上 每次 出发 景点 小时 讲解 景点 历史 温莎 城堡 参观 成行 报名 携程 研究 成行 不留 遗憾 下次 旅游 携程,"[(0, 0.10883736), (2, 0.8852498)]",2
第一次 欧洲 选择 携程 英爱 整体 感觉 不错 导游 贾导 细心 负责 景点 讲解 过程 幽默 英国 历史 人文 风情 团员 参观 风景 的同 历史 文化 自由 活动 期间 导会 查去 景点 酒店 路线 值得 表扬 行程 安排 总体 不错 行程 特别 伦敦 意犹未尽 安排 时间 爱尔兰 去不去 无所谓 英国 深度 意义 路上 行车时间 没法 安排 远离 市区 高尔夫 酒店 环境 不错 市区 伦敦 三天 地铁站 出入 中餐 无功 无过 餐厅 水平 堪忧 团餐 真心 吃饱 领队 导游 就点 人数 房卡 回国 那天 看不到 领队人 伦敦 机场 登机口 消息 关心 团员 会误 回到 上海 转盘 箱子 消息 结束 责任感 有待 旅程 开心 天气 出国 携程 团队,"[(0, 0.17981477), (2, 0.8162387)]",2
爸妈 旅游 景点 经典 行程 安排 悠闲 太累 开心,"[(0, 0.042562284), (1, 0.6130044), (2, 0.3444333)]",1
夫妻 二人 参加 英国 爱尔兰 团队 历次 参加 携程 团队 比较满意 出行 领队 陶圆 一位 专业 认真负责 做事 思路清楚 友善 女孩子 酒店 做事 有条理 注意事项 清清楚楚 客人 带来 一路 欢笑 每次 队伍 做好 导游 领队 压后 工作 导游 张南 胜任 导游 这项 工作 每次 上车 景点 介绍 详细 传达 每位 客人 客人 提出 事情 有求必应 爱心 热情 幽默 导游 工作 经验 出行 领队 导游 配合 默契 交通 出行 大巴 宽敞 舒适 一程 都柏林 驾驶员 驾驶 技术 全程 驾驶 平稳 待人 友善 住宿 高尔夫 酒店 住宿 舒适 伦敦 千禧 酒店 房间 简陋 浴室 下水 皇冠 假日酒店 配不上 称号 饮食 西餐 不错 晚餐 西餐 安排 餐厅 环境 食品 不错 中餐 说明书 优质 中式 正餐 确实 感受 优质 景点 安排 长途 乘车 到达 爱丁堡 景点 皇家 英里 大道 赶着 坐船去 爱尔兰,"[(0, 0.027207308), (1, 0.17502233), (2, 0.7977704)]",2
英国 行程 安排 不错 从南到北 英格兰 苏格兰 北爱尔兰 爱尔兰 两个 走遍 行程 时间 景点 累人 自由 不到 适合 初次 英国 游客 喜欢 到此一游 中老年 游客 出行 携程 安排 导游 认真负责 态度 景点 介绍 导游 忽悠 买买 劝诫 真要 便宜 纪念品 旅游界 清新 几处 地段 不错 几处 酒店 不错 鱼与熊掌 体谅 导游 每次 准确 告诉 周边 超市 补充 物资 司机 采购 贴心 一点 疏漏 携程 事先 提醒 欧元 领队 集合 电话 短信 只字未提 全团 欧元 领队 爱尔兰 都柏林 傻眼 身无分文 购物 刷卡 地方 用到 小额 现金 一点 希望 参团 朋友,"[(0, 0.35279632), (2, 0.6427903)]",2
旅游 携程 相比之下 携程 品质 性价比 隐形 消费,"[(0, 0.053436108), (1, 0.05468286), (2, 0.89188105)]",2
英国 之行 开心 踏实 导游 真心 感谢 真心 敬佩 工作 热情 细心 周到 服务 全程 讲解 停歇 走到 知识面 涵盖 特别 妈妈 阿姨 受益匪浅 出境游 担心 语言不通 购物 旅行 导游 领队 玲玲 一行 特别 踏实 语言 沟通 导游 更是 全程 贴心 帮忙 生怕 弄错 税单 填写 指导 清清楚楚 办理 退税 放心 感谢 团队 队友 期待 下次 游客 周晓玫,"[(0, 0.17357183), (1, 0.6322114), (2, 0.1942168)]",1
导游 好评 英国 苏格兰 英格兰 爱尔兰 团游 游客 携程 旅行 领队 林玲 英国 旅游 英国 导游 一路 讲解 旅行团 认真负责 不厌其烦 回答 游客 热心 解决 各类 大大小小 事情 业务知识 知识 参观 途中 导游 仔细 耐心 讲解 特别 英国 人文地理 历史 增加 见闻 赢得 游客 好评 这位 导游 好评 是因为 第八天 前往 巨人 景点 路上 想起 手表 遗忘 酒店 一块 妈妈 瑞士 眼睛 老花 表面 清晰 很着急 不知所措 导游 得知 酒店 安慰 别着急 最终 导游 沟通 催促 导游 酒店 商量 时间 难以 保证 离开 酒店 表寄 想到 表先 寄往 他家 办法 寄到 携程 总部 这块 手表 家里 消费者 当成 解决 态度 值得 学习 赞许 感谢 导游 感谢 携程 旅行社 携程 拥有 一位 员工,"[(0, 0.1835735), (1, 0.32919726), (2, 0.48722923)]",2
行程 累人 温莎 巴斯 值得 爱尔兰 司机 车技 一流 感谢 司机 贾导 寻常路 领略 农庄 路边 山猫 童话般 美景 贾导 很棒 专业 导游 风趣 幽默 随和 体贴 晚饭 伦敦 塔桥 担心 沟通 障碍 贾导 自告奋勇 不计报酬 陪同 一路 守护 坐地铁 感受 百年 之久 地铁 浏览 伦敦 象征 伦敦 正门 伦敦 塔桥 欢笑 伴随 行程 感谢 司机 导游 领队 上图 红衣 小贾 导游,"[(1, 0.35117522), (2, 0.6429565)]",2
总体 二万 团费 十次 自理 温莎 城堡 巴斯 自费 性价比,"[(0, 0.03369672), (1, 0.032137427), (2, 0.9341659)]",2
整条 行程 安排 领队 认真负责 体验 自然景观 人文环境 不错 选择,"[(0, 0.93109894), (1, 0.033751983), (2, 0.035149027)]",0
喜欢 领队 圆圆 热情 乐于助人 一路上 贴心 照顾 队友 地陪 圆圆 带队 出游 嘻嘻,"[(0, 0.03252121), (1, 0.7438152), (2, 0.22366357)]",1
风景 宜人 避暑胜地 昔日 帝国 厚重 历史 风土人情,"[(0, 0.91639984), (1, 0.041031763), (2, 0.04256842)]",0
英国 北爱 精彩 时间 爱尔兰 一点 伦敦 时间 更好 选择 时间 我会 选不去 爱尔兰 伦敦 爱丁堡,"[(0, 0.023541834), (1, 0.29217696), (2, 0.68428123)]",2
时间 美景 特别 特别 希望 携程 能出 深度 走马观花 领队 导游 英国 天气,"[(0, 0.031033408), (1, 0.029491927), (2, 0.93947464)]",2
线路 安排 走回头路 英国 文化 历史 详细 全家 非常感谢 陶圆 领队 爱尔兰 司机 享受 英爱 难忘 旅行,"[(0, 0.022505337), (1, 0.40128604), (2, 0.5762086)]",2
团队 自由 活动 时间 紧张 地方 花点 时间 几年 小小 遗憾 喜欢 爱尔兰 自然风光 购物 休闲 两不误 领队人 不错 漂亮 做事 认真负责 团里 小朋友 热情 机场 办理 现金 退税 超好 导游 一口 东北 咨询 一点 小朋友 读书 事情 热心 解答 家长 层面 自由,"[(0, 0.10268285), (1, 0.010605902), (2, 0.88671124)]",2
英伦三岛 大而全 行程 湖区 能住 一晚 曼彻斯特 市区 球场 没看 不用 过夜 伦敦 威斯敏斯特 教堂 大本钟 白金汉宫 外观 未入 参观 遗憾 莎士比亚 出生地 商业 气息 美丽 温德 米尔 湖区 剑桥 时间 太短 童话般 温莎 小镇 列入 行程 只能 利用 自由 活动 那天,"[(1, 0.045010768), (2, 0.9457914)]",2
顺利 满意 出境游 领队 做事 认真负责 安排 住宿 发短信 确认 保证 行程 顺利 导游 老王 专业 印象 深刻 一路上 领路 谈吐 幽默 风趣 英国 爱尔兰 历史 旅行 收获 颇丰 美景 还长 知识 伦敦 老王 大写 可爱 北京 老头 特别 携程 公司 订单 本来 四个 朋友 家里 意外 成行 提交 签证 材料 期限 按理说 支付 违约金 携程 朋友 家里 情况 一分钱 违约金 全额 退款 朋友 感动 携程 感谢 感谢 人性化 服务 跟着 携程 旅游,"[(0, 0.17426203), (1, 0.3982605), (2, 0.4274775)]",2
本次 英爱游 愉快 行程 接近 完美 天气 时间 阳光明媚 领略 英伦三岛 风光 行程 导游 碰到 老王 不愧为 英国 历史 知识 景点 行程 安排 时间 到位 好多 景点 时间 游客 避开 客流 高峰 节约 排队 等候 时间 自然而然 增加 游览 领队 小薛 负责 每天晚上 短信 提醒 团友 有问必答 行程 感到 贴心 老王 时间 酒店 大堂 指导 团友 退税 行程 住宿 不错 中式 团餐 满意 西餐 本次 行程 遗憾,"[(2, 0.9883794)]",2
英国 万里 导游 尽心尽职 良心 导游 沟通 努力,"[(0, 0.68548125), (1, 0.26555222), (2, 0.04896653)]",0
整体 不错 飞机 晚点 整体 行程 喝生 拉肚子,"[(0, 0.908471), (1, 0.049789418), (2, 0.04173963)]",0
行程 安排 完美 特别 满意 住宿 安排 英国 乡村 高尔夫 酒店 环境 景区 漂亮,"[(0, 0.027304132), (1, 0.024983214), (2, 0.94771266)]",2
本次 旅行 接近 完美 导游 小张 经验丰富 解说 幽默 领队 细心 安排 司机 团友 素质 自由 活动 时间 行程 总体 宽松 自由 活动 时间 领略 风情 初次 扫盲 合格 自助 心仪 目的地 爱丁堡 乡村 海边 深度,"[(0, 0.011508459), (1, 0.010608663), (2, 0.97788286)]",2
伦敦 地区 安排 酒店 描述 郊区 地铁 档次 解决方案,"[(0, 0.42430526), (1, 0.03663837), (2, 0.5390564)]",2
一路行 人文景观 自然景观 英国 历史 文化 大自然 鬼斧神工 周到 细心 导游 领队 舒适 可口 美食 近几年 满意 出国游 感谢 领队 小支 贾导 专业 到位 服务到位,"[(0, 0.18156016), (1, 0.01634105), (2, 0.8020988)]",2
参加 携程 如去 北欧 埃及 比较满意 年前 国旅 英国 天游 念念不忘 年后 英国 发言权 失望 景点 温莎 城堡 爱丁堡 大英博物馆 小时 温莎 城堡 地方 关门 年前 景点 旅游 时间 小时 爱丁堡 半天 时间 只能 漏看 就餐 记得 一顿 午餐 提供 自理 年前 国旅 旅游 一顿 午餐 自理 正餐 到位 正规 西餐 中餐 不错 实际上 携程 团费 旅行社 携程 算是 温莎 城堡 自费 自费 项目 导游 老王 尽责 团队 人数 凑上去 讲解 已快 讲完 遗憾,"[(0, 0.10668483), (2, 0.88834935)]",2
跟着 携程 自营 英国 深度 感觉 不错 总体 满意 导游 领队 敬业 态度 不错 全程 服务 耐心 建议 携程 旅游 团员 导游 配置 语音 讲解 公共场合 听不清 导游 讲解 貌似 旅行团 装备,"[(0, 0.39778444), (1, 0.012022158), (2, 0.59019333)]",2
出游 整体 感觉 比较满意 英伦 风景 不错 历史 人文 知识 旅行 加深 特别 导游 张楠 旅途 热情周到 耐心 细致 历史 人文 讲解 诙谐 幽默 领队 李炜 机场 集合 旅游 过程 细致 旅游 过程 注意事项 短信 提醒 和蔼可亲 团餐 比较满意,"[(0, 0.010689471), (1, 0.010534548), (2, 0.978776)]",2
游程 顺利 景点 安排 到位 领队 导游 敬业 专业 车辆 大巴 舒适 司机 驾驶 技术 一流 服务态度,"[(0, 0.022932457), (1, 0.021662984), (2, 0.9554046)]",2
参加 携程 组织 英爱 真的 开心 放心 一路上 领略 英爱 自然风光 张楠 导游 讲解 英伦三岛 历史 风土人情 更深 路线 选择 运气 英国 天气 一日 多变 时雨 景点 时雨 眼缘 可惜 好多 景点 时间 素质 年轻人 老年人 好心 年轻 团友 解决 语言 交流 困难 吃饭 东西 顺利 一夜 宾馆 房间 分到 地下 一层 二老 发愁 年轻 团友 主动 行李 搬下去 谢谢 二位 好心人,"[(0, 0.42759934), (1, 0.3753944), (2, 0.19700623)]",0
伦敦 张导 水准 所到之处 精彩 讲解 庆幸 领队 上海 给予 关照 一路 走来 工作 身影 张导 领队 下次 选择 携程 推荐 携程 朋友,"[(0, 0.019749986), (1, 0.6755332), (2, 0.3047168)]",1
第一天 团餐 浪费 飞机 飞机 晚餐 行程 安排 参观 时间 匆忙 尽兴 总体 满意 飞机 辛苦 坐车 时间 两三 小时 导游 领队 不错 沟通,"[(0, 0.016589917), (1, 0.014720721), (2, 0.9686893)]",2
英国 有幸 遇上 导游 荣幸 随和 耐心 责任心 导游 尽心尽职 专业知识 业务 能力 名副其实 金牌 导游 旅客 李珍,"[(0, 0.022816507), (1, 0.5940769), (2, 0.38310668)]",1
英爱 旅游 一路 晴天 英伦 地区 天气 全程 崭新 大巴 服务周到 司机 负责 领队 地导 东北 小伙 张楠 留学 英伦 讲解 周到 历史 知识 不厌其烦 关照 微信 互动 活动 尽心 购物 开心 这条 路线 不错 人文 历史 风景 唯一 开心 回来 退税 麻烦 只能 求助 张导 拜托 解决 总得来说 愉快 旅行,"[(1, 0.39712888), (2, 0.5950193)]",2
行程 安排 景点 游览 酒店 特色 庄园 古堡 风格 感受 值得一提的是 张楠 导游 一路上 热情周到 耐心 细致 特别 讲解 风趣 幽默 知识性 英国 历史 深刻 旅行 满意,"[(0, 0.015166686), (1, 0.013931803), (2, 0.9709015)]",2
英国 爱尔兰 值得 国家 文化 风景 自费 项目 值得 爱尔兰 圣三一 学院 图书馆 门票 欧元 欧元 壮观 不愧 世界 十大 最美 图书馆,"[(0, 0.71196455), (1, 0.27063096), (2, 0.017404523)]",0
特别 表扬 领队 陶圆 导游 细心 耐心 不厌其烦 知识面 当成 家人 真的 敬业 不枉 此行 大大的 真的 希望 下次 旅游 携程网,"[(0, 0.017407645), (1, 0.96456), (2, 0.018032368)]",1
行程 伦敦 时间 爱尔兰 体验,"[(0, 0.07209167), (1, 0.35089138), (2, 0.5770169)]",2
行程 中餐 住宿 不错 整体 行程 安排 英格兰 经典 行程 时间 伦敦 自由 时间 苏格兰 爱丁堡 惊鸿一瞥 北爱 爱尔兰 时间 宽松 两个 地方 没什么 爱尔兰 横跨 爱尔兰 东西 海岸 赶到 机场 景点 感觉 拼凑 伦敦 时间 酒店 整体 辛苦,"[(0, 0.010004428), (1, 0.18895952), (2, 0.80103606)]",2
英爱游 依依不舍 结束 留下 深刻 印象 友好 相互 体谅 照顾 准时 准点 听从 导游 安排 导游 地陪 贾导 认真负责 专业 导游 风趣 幽默 随和 体贴 团友 好评 司机 爱尔兰 司机 驾驶 技术 高超 司机 岗位 敬业 早晨 上车时 很远 团友 行李 旅游 难再 重复 导游 司机 印象 长久 记忆 团游 携程 看重 携程 服务 高品位 行程 安排 期待 下次 行程 携程,"[(1, 0.66830164), (2, 0.32495776)]",1
行程 安排 贾导 认真负责 细心 周到 大巴 舒适 满意,"[(0, 0.040973928), (1, 0.04370673), (2, 0.9153193)]",2
行程 用餐 自理 吃饭时间 熟悉 环境 地方 每次 吃饭,"[(0, 0.92111486), (1, 0.0372588), (2, 0.04162629)]",0
行程 总体 感觉 不错 行程 紧凑 城市 景点 带到 领队 导演 专业 一路上 照顾 周到 此行 喜欢 北爱 自然风光 伦敦 知名 景点 不错 团游 好处 不用 费心 安排 行程 路线 交通 肯定 能省 缺点 随心所欲 喜欢 地方 时间 深度 游览 出行 团友 每次 说好 集合时间 准时,"[(2, 0.9829555)]",2
行程 安排 想象 辛苦 感觉 不错 伦敦 自由 行程 更好,"[(0, 0.03864054), (1, 0.033977143), (2, 0.9273823)]",2
本次 行程 结束 回来 得闲 静下心来 分享 行程 设计 英伦三岛 点到面 覆盖 不错 常规性 风景 城堡 建议 这团 行程 本次 行程 车辆 住宿 酒店 不错 行程 停留 爱丁堡 时间 太仓促 历史 文化 保留 世纪 建筑 城市 坐在 车上 爱丁堡 自由 活动 时间 爱丁堡 街道 慢慢 欣赏 各类 建筑风格 想象 年代 繁荣 慢慢 回味 历史 感觉 导游 老王 不错 现年 英国 五千年 历史 云里雾里 敬业精神 值得 特别 团里 几位 过生日 团友 精心 生日蛋糕 召集 团友 生日歌 生日 蜡烛 人情味 本次 领队 不敢恭维 退税 单的 一位 领队 随行,"[(0, 0.26423368), (2, 0.73149043)]",2
旅游 体验 携程 行程 大而全 走马观花 全境 非常适合 第一次 英国 旅游 地方 走到 有个 很好 选择 第二次 深度 地点 伦敦 爱丁堡 非常适合 慢慢 慢慢 运气 原本 担心 英国 无常 天气 下雨 意外 太阳 占多数 头尾 两天 遇上 算有 机会 体验 一把 阴雨天 常态 英伦 人文景观 苏格兰 爱尔兰 自然景观 天气 爆好 伦敦 自由 时间 喜欢 地铁站 走到 博物馆 长时间 遗憾 伦敦 三天 赶往 地方 静下心来 慢慢 欣赏 爱尔兰 地区 海岸线 景观 漂亮 天气 高原 地带 色彩 分明 上车 睡觉 拍到 好看 照片 靠近 海岸线 颜色 漂亮 海天 分界线 平面 色彩 超级 伦敦 都柏林 地区 自由 时间 小镇 够买 顿饭 时间 需求 合理安排 时间 牺牲 吃饭时间 一会儿 反正 英国 汉堡 薯条 不用 特意 地方,"[(0, 0.28919595), (2, 0.7074104)]",2
行程 安排 领略 风光 老人 小孩 适合 王导 幽默 风趣 善解人意 小朋友 喜欢 转机 退税 政策 相比之下 领队 全程 态度 政策 讲解,"[(0, 0.34679258), (1, 0.016617144), (2, 0.6365903)]",2
感受 英伦三岛 旖旎风光 携程 行程 安排 不错 期待 下次 出行,"[(0, 0.04268112), (1, 0.045711536), (2, 0.9116073)]",2
美好 跨年 感受 大不列颠 爱尔兰 历史 文化 领略 英爱 自然风光 王明 领队 热情 细心 凡事 尺度 把握 导游 配合默契 行程 和谐 快乐 核心人物 贾羽伯 导游 英国 了然于胸 讲解 到位 听者 收获,"[(0, 0.5168042), (1, 0.47057673), (2, 0.012619027)]",0
英爱 几个 有名 景点 感觉 大巴车 时间 安排 食宿 不错 特别 酒店 几次 机场,"[(0, 0.025778484), (1, 0.023948846), (2, 0.9502727)]",2
行程 安排 住宿 条件 更好 导游 老王 英国 自然 人文 了如指掌 讲解 生动 安排 感觉 超值,"[(0, 0.44113934), (1, 0.024130717), (2, 0.53472996)]",2
