content,emotion_scroe
很喜欢这款手机，以后会继续买后续产品,0.9554253468213963
很好用，非常满意，，，，到货很快，物流很棒,0.9933422532772179
手机很好用，很流畅，值得购买,0.9978909599915496
不错不错，我喜欢，用后追评，物流很快哟,0.9949202141975699
非常好，很实惠，我非常喜欢这款手机。,0.9941995601937778
送货速度很快，给家人买的，家人很满意,0.9938546406473527
外形外观：屏幕很好，东西很不错,0.9995371567328852
高性能手机，没啥可言，这个价钱非常值！,0.7857519098894248
性价比很高的安卓手机，玩游戏很流畅！,0.9999882946129852
买给妈妈用，妈妈很满意屏幕大很方便。,0.9953430999931078
手机用了一段时间了，系统流畅，非常好用。,0.9709007510758267
手机很不错，买个母亲的，母亲很喜欢！,0.9996378101008591
手机很棒，像素也不错，很好,0.9915314469149444
挺好用的，毫无问题，快递时间也很短,0.33533611997678947
手机不错，是正品，孩子也非常喜欢,0.9958460166215848
性价比超高的一款手机，送给儿子成年的生日礼物。,0.999884478065895
已经是第二次购买了，便宜性价比又高很合适,0.9942493296629178
手机挺好的，非常值得购买，下次还会买这个牌子的,0.9013110247427344
很流畅用着很好，功能很多,0.9976691218358951
东西很棒，很推荐购买，绝了,0.9780624932804803
非常好，手机很流畅，很漂亮,0.9987994537326738
手机体验感很好，很上档次！,0.9933224775216981
物流速度快，手机颜值高，非常好,0.9561689257562862
非常好，物流快，商品有保障，体验好,0.9758803001622419
快递服务很好，收货很快，希望质量也不错。,0.793592515265353
直播活动买的，很划算，感觉不错,0.9672023524805184
非常好，下次还会买，希望京东越做越好，加油,0.9956670773688576
亲民的价格实用的功能，手机真心不错很喜欢！,0.9965002394076068
手感很好，顺滑。值得购买！,0.9754628231626605
性价比很高！活动时间入手非常划算,0.9993597365774247
手机很不错。比某米好多了。性价比高,0.9961507928426327
手感好 物流快 很喜欢,0.9770526763974587
很好 很不错就是预售的价格..,0.9116523065888541
刚收到手机，很轻巧，挺好看的,0.9940417026400543
很赞。国民神机，女朋友很满意,0.9917823965090845
手机不错，快递也很快，很好。,0.9761193089179969
性能不错，拍照效果非常奈斯！,0.9985880969203508
买给爸爸的，收到的反馈还是很好的,0.9333472335923951
性价比超高，现在涨钱了,0.9962148216432353
性价比超高的一款手机，大力推荐。,0.9987333027023542
非常流畅，而且物流很快,0.9902467030253583
送货特别快，买电子设备京东最棒,0.9947236322010631
给家里老人用的，非常好。,0.8694592143573162
真不赖，充电很快很流畅。,0.9976516338286641
便宜实惠，价格适中！非常喜欢,0.9953559338313942
手机挺好的，充电也很快。,0.9475466202404678
打游戏很流畅好评，不错,0.9961726382101586
发货很快，手机非常棒，推荐购买！,0.9971242956550183
快递很快，性价比很高的手机,0.9872385518801444
很不错，客服态度也好。,0.38207346204175574
送货很及时，手机性能不错,0.9908542401518771
双十一买的，活动很优惠,0.7377961231714458
系统体验感绝了，相册反人类设计。,0.9483823920669738
"外形外观：就是真我的传统样子，没有太多变化
拍照效果：还可以，这个价位算不错
运行速度：目前挺快的
待机时间：中度使用一天没问题，从不玩游戏
其他特色：同价位中性价比极高，使用舒适",0.999999993720871
"特意使用了一段时间后再来评测的，2000内备用机，偶尔打打游戏也无压力，带屏下指纹，还要啥自行车。
65w快充也蛮快，散热做的蛮不错。相机一般吧，第一次用realme，体验感还不错。",0.988347074824526
"整体不错，双十一购买活动还是比平时给力，比百亿补贴合适，
外形外观：机身厚度可以，相对于华为Nova5偏长一些
运行速度：平时使用，非中度游戏玩家，性能剩余。
换机助手不好用，可能是不会用的事？那也说明不易上手。",0.9998655370542243
65w快充，ufs3.1闪存，天玑1200的处理器，千元机的要素:屏幕，性能，充电，续航，这台机器满足四分之二。 还额外送了双扬，nfc。加上玻璃后盖，说实话手感还挺好的。 我认为这款机器对得起这个价格，该有的都有，性能也够用，使用了几天，对为备用机而言，个人体验还不错的。,0.9997869197177702
双十一买的，其实天玑1200真的还不错，因为我不打游戏，所以不能给游戏方面的感受，但平时使用基本感觉不到发热，realme系统目前比miui12.5要流畅，虽然没有红外。够用就行，不要盲目提高需求，另外顺丰真的很快,0.9994573284775151
"颜值还不错，充电速度特别赞。拍照饱和度略高，有点遗憾。
运行速度：不错。",0.9999656115560971
手机挺好的，千元机里面算性价比很高了，65瓦快充很给力，手机屏幕显示效果和细腻程度也还好，对得起这个价格了，虽然是塑料机身，但是拿在手里还是有点质感的。 自家有线耳机的，送的肩健不错。,0.9998954940071682
不错不错不错，京东送货很快，售后也好一直在京东买买买，手机手感好，用起来挺流畅的，一般的游戏都带的动。就是稍微有点重，只要再轻一点就更好了,0.9999684029636111
黑色虽然沾点指纹 但是颜值不输白色 赞赞赞赞???????????,0.9999408861579938
"外形外观：neo2T外观比较薄，后边是摄像头有凸起的，如果用手机壳的话还可以。底部有3.5的耳机接口，兼容性更好一些。
屏幕音效：屏幕支持DC调光，显示效果不错。
运行速度：不玩游戏，平时使用流畅度没问题。
待机时间：待机时间无所谓啊，主要是充电快，充电快，电量不够用也能勉强接受。
其他特色：手感挺好的，因为薄。",0.9999953734572932
用了半个月，整体来讲很流畅，外观好看  有一点不满意的地方就是自带的手机壳?   其他都很满意,0.9989835767811379
运行速度快，充电快，手感好，不错的价格。值得购买,0.9994552919612021
屏幕在千元机里面实在是可以了，内存和处理速度日常用没问题，还有个快充是个意外收货，希望能用久一点?,0.8486947277279205
充电特别快，外观漂亮，拍照效果好，信号也不错,0.9990133563157841
外观可以，挺好看的，就是手机壳忍不住要吐槽，就不能换个透明的，白瞎了白色，拍照效果中规中矩，屏幕还可以，入手感觉偏轻，适合女生用,0.9999778797238961
炒鸡喜欢这个手机，颜值高，性能也不错，真的爱不释手，预算2000左右的小伙伴们赶紧充呀,0.9995981130485958
才发布的新机，双十一活动价格优惠力度很大，忍不住下手了，以前的手机本来还可以用现在只有做备用机了。手机手感很好比较轻薄，屏膜显示清晰，高刷屏浏览网页很流畅，性能强劲对于我来说不怎么打游戏完全够用，照相效果不错，我也看不出来差距，平常就是随手拍拍，没太高要求，唯一的遗憾就是12+256G版本没有优惠，128的用两年空间就不够了。,0.9999896660958866
挺好的，使用流畅，玩游戏也没啥压力。续航够用，充电挺快的。6.4寸的屏幕刚刚好，观感清晰。音量键在左侧有点不适应,0.9997450413785395
总的来说还可以，优点充电速度快，早上洗漱的时间电基本上充满了。反应速度快，游戏玩的少，不评价，充电有点发热。缺点屏幕有点发黄吧，颜色偏暖,0.39073912743705774
"拍照效果：拍照效果不怎么好，不过也还可以，正常需求是没问题的
运行速度：很快，很流畅
外形外观：看着也挺美观的",0.9999957475334658
手感好，反应快，物流更快！昨天拍的好今天上午就拿到了。卖家服务真是没得说！祝新年快乐，财源广进！,0.9999124236364464
一百多块钱，可以了，这是买的最好的剃须刀，比几十块钱的好多了,0.014048140959268762
"外形外观：漂亮
屏幕音效：音质不错
运行速度：天机1200比大师版778流畅",0.9999999151353788
手机反应挺快，打游戏也挺好用的，值得拥有。,0.999205529601901
天玑1200的处理器真不是盖的，速度真快，比我的Z11000快的不是一点点，屏幕也好很多，看书久了不会累，拍照清晰度高，,0.9793054917751335
外观漂亮，新机运行速度快，屏幕清晰，拍照效果不错，其它用一阵再评价，图片就不发了，与介绍的一致,0.9996426149994807
用着还不错挺顺手的，也很流畅，感觉挺好的，电池刚好用一个白天，早上八点从95%到五点还有42%的电量，可以用到我八点下班了，就是看别人都是1500多就买到了感觉心里很不平衡，我可是第一天预售就下单了定金100尾款是31号晚上八点支付1699，都不知道别人从哪里来的***，怎么那么便宜，商家还说保价呢？感觉买亏了很生气,0.02098658616479132
还是挺nice的，天玑1200ai处理器使用足够了，电池续航也比想象中耐用，65w闪充半小时能充满，还不错，挺满意,0.9999879058038156
手机不错，运行速度挺快，不重 手感挺好,0.9981560493835616
续航能力强 信号方面能够双5G 电池充电速度够快了 重点是性价比高 如果硬要和其他品牌比 做工方面稳的一比,0.9999628304714727
"外形外观：蛮可以的嘛
屏幕音效：不错哦！
运行速度：目前还是可以的",0.9999387558605211
用着还可以，不过小窗用着不方便，手机还发烫，续航一般冲的快掉的也快,0.6332724123639306
收到心仪的手机各方面都符合，用了两天质量好，顺畅，贴膜耳机套都全，支持点赞,0.8289073277558875
虽然说是适合年轻人打游戏的手机，因为性价比挺高的就给我爸买了一台，收到货他挺喜欢的，用着也挺好的，之前的手机内存小了这款用着应该够了,0.9998768151788665
买给爸爸的，感觉还挺好的，用起来流畅不卡顿，好评,0.9997971383474874
一直以来使用的都是这款手机，然后也被家里人推荐了，一下子就买了两台看看后续怎么样吧，如果可以的话追加评论五星好评，谢谢大家。,0.9492502417461726
总体来说性价比很不错！只是不同品牌的系统要适应下,0.9988546967914872
配送物流快，外形，外观，设计亮点。屏幕音效好。运行速度够。,0.9999444216829346
手机收到了，这是这买的第二部真我手机。在他家买手机放心，手机正品，服务热情，尤其是直播的小姐姐介绍的也专业，还会回购的。犹豫的亲们就在这买吧。,0.9995585970128686
刚买回来，目前看无论是外观，还是手机内部性能，都挺好的,0.9990307221122265
1440多买的，最便宜的1200手机，充电嘎嘎快，手机也挺好的，就是物流有点慢哈哈，这个价位买到这台手机，还买什么自行车，买它就完了。,0.9925602526244803
用了一段时间，还不错，很多功能蛮喜欢,0.997039572128371
手机不错，还是比较适合家里老人的，其他的慢慢体验,0.9968768417899881
刚到这两天把玩了一下，确实不错，打了一些王者给我有一种不一样的体验，还行还行。,0.9954207512227519
顺丰送货，物流很快，手机已经用上了，现在的图片就是用手机照的，图像怎么样大家看啦。,0.4725321298197549
刚从ios过来，正在适应中，不过充电确实挺快的，耗电还行！,0.9501007482814463
手机收到了，物流很快，目前除了充电的时候有点热，别的都挺满意,0.8002886146707208
第一次用真我的手机，感觉是真的不错，拍照清晰，比我的小八大不少,0.9824873761759266
"外形外观：还行很好很棒不错
运行速度：还行",0.9999946887680787
新机不错 超出我的预期了 尤其是拍照,0.8475415947895736
给外甥女买的，说用着不错，舒服快，玩普通游戏不卡,0.9996354682827845
店家发货挺快的，收到气泡保护完好，送有一副耳机，都是全新未拆封的，目前使用一切正常，官方店铺购买确实让人放心！,0.8198612008527779
一直以来都挺喜欢这个品牌的手机了，然后这次出了这么好的一个产品肯定要支持一下，希望这个手机的话以后就越做越好更加的人性化。,0.9986543531886972
手机不错，屏幕素质还可以，相机还是差点意思,0.6687893206615687
"外形外观：白色挺好看的
屏幕音效：屏幕耐摔",0.9996808183526386
还挺好看的，内存够大。,0.934762269544293
真不错外观和好屏幕也不错,0.997740076562157
用了一个月了，很满意，但是开省电模式时候会锁帧,0.7633151956972712
手机很好看，性价比相对高了，客服态度也很好，四星是因为还可以更好，哈哈哈哈。,0.9933520387950187
天玑1200 芯片，试用一天，还可以，挺值了这个价钱,0.8871177391095981
摸起来还不错，不知道以后用怎么样,0.7647276566713301
挺好的，轻薄，运行速度挺快，充电好快。,0.9986658005930299
给爸爸买的，他说蛮好用的,0.9563477952830527
玻璃后盖，天玑1200ai，屏下指纹，性价比王者！,0.18383407911932403
送了手机壳，还好，挺不错的~,0.8904840026359379
东西不错，活动价格便宜，性价比太高了,0.9941821871912262
挺满意的，还有nfc，老公拿到挺开心的。,0.9855931221272256
第一买真我，体验还不错,0.9284948170583708
手机还不错，但是降价太快了，不到两个月，降500,0.058095375636942226
现在使用没出问题，挺好的，出问题追评,0.938199065778945
还行吧，性价比很高，比某夕夕贵15%，emo了,0.9984383774963984
性价比不错，比其他的便宜。处理器也还行,0.9967434122556876
用了半个多月可是可以的，性价比还可以,0.7960579783360702
电池掉电比较快，屏幕有点次。慎拍。,0.16069674410200918
用了还不错，打游戏了都挺快的,0.9910639483566194
手机，我用了现在感觉还挺好的，挺喜欢的,0.9749590817677044
新机灵敏快捷智能  好玩意儿！,0.10818618470673969
帮人买的，还没反馈如何，不过外观不错,0.9675827931858298
员工福利机 颜值还是不错的,0.9525863118921244
手机便宜，性价比高，就是有些发热,0.9662225744905479
便宜，耐看，中规中矩，喜欢。,0.9994007900266855
第一次使用真我手机   好用到起飞,0.6148807777503587
感觉不错还，就是过年当天涨价了,0.7484066678874376
发货速度快，产品顺手，性价比高,0.9939958663072681
跟图片上描述的一致，性价比不错,0.9867672396265755
手机还可以，挺好看的。手感也很好,0.9871205680463155
刚到手感觉手机挺好的挺流畅的,0.9955881660536763
美观大方，使用方法简单,0.9931933592312995
整体比较合格，比较完美,0.9031638821944774
之前也买过送爸妈的，这个买给自己。,0.16398838857850317
不如11/1的价格，机器还不错！,0.9078265881726165
可以值得买我感觉挺不错的,0.9777419289104595
还是喜欢京东购物，购买优惠售后有保障！,0.9794002145996586
手机外形外观，拍照放果可以,0.9891558984495367
瓜子味道不错，价格也不贵,0.28460688637156817
手机不错，款式颜色都不错,0.9786448233388435
性价比高！用后再追加评论,0.940271256560872
手机不错满意的一次购物，物流也快。,0.9879078925146106
颜值还不错后盖是玻璃的,0.5994231534761806
第二个真我手机，值得购买,0.7925305819710405
手机不错，反应挺快的。,0.976467557248527
手机优惠力度可以，性价比不错,0.9319462919777559
还行 对得起这个价格,0.9253186056949367
性价比之选，已经买了3个了,0.9109926959148739
这个价位性价比还是挺好的,0.9957724711923726
考虑许久才决定买的，不错！,0.8990500745167477
帮同学买的反正感觉还行,0.8096633876838507
还可以，不卡，哈哈哈。,0.9858894532755362
一分钱一分货，还不错吧,0.38638000503036085
可以可以，白色没抢到,0.4935671301946898
帮朋友买的，讲还可以。,0.7992222104826512
双11买的，性价比高！,0.9086497169103962
不错好极了nice 啊,0.9745820717619273
给侄女买的生日礼物，这几天工作太忙了   都忘记确认收货了   真不好意思了！手机总体来说还行，测试一下后，基本上没啥问题，生产日期也是10月！第一次用这个牌子 希望能习惯这个系统吧,0.016757805681613225
买来送给妈妈的，以前送她的realme x现在都很流畅，不过以前买的64g都已经不够她用了，这次直接买到256g用两三年应该没问题了。,0.993342433401466
想着游戏机的性能够老人家用了，就淘了一个，凑合吧,0.29741981336429935
单轮配置来讲，这个价格绝对公道,0.9512680946068006
还没使用，先给个好评有问题再回访,0.07893288201996496
希望系统能再优化，更人性化一些,0.6093037081760856
保护膜贴的十分随意，都是气泡，里面都有脏东西……反正感觉没有说的那么好～,0.48608137420162434
这款手机，我觉得在3000元以下绝对是王者，没有之一！性价比之王！因为我本人一直使用的苹果系列，买这个手机之前我是准备买13P的，结果在我不知道的情况下我老婆给我买了这款手机，还骗我说是花了六千大洋！我倒是没想到用起来是这么的丝滑、,0.9967193667219991
缺点: 照相人物脸发黄，原来是手机底色黄，调不了。自拍好看，拍对方较丑，白天拍发暗，晚上又亮过头。手机相册改不了文件名，也排不了序号，乱糟糟的。还有上网常常掉线。优点是充电快，续航5一6小时。,1.5963087636183815e-06
"冲着天玑1200AI来的，实际使用目前还感受不出来，毕竟新机，运行什么都流畅，看网上评测能跑71W,我试了试也跑了差不多68W，比870略低一丢丢。玩游戏一小时也不发热，或者说不会暴热，微温而已，体验不错。照相功能算优秀，微焦表现一般，算比上不足，比下有余，按2000这个价位算的话，算最强之一。唯一不太好是电池容量一般，按我的经验，玩游戏大概也就8小时，平时正常刷视频大概能玩两天吧，20%到充满只用了不到40分钟，算比较快。这个UI我个人用不太习惯。整体手感略轻略瘦，男士，或者说手大的人用起来感受不太好。自带的手机透明套做工太烂，配不上这款手机定位，或者说拉低了手机的档次。综合来说，大缺陷没有，小缺点不少，但2000元的价位对比配置来说，性价比很高了，值得入手。",0.9999999999985916
机子还不错，性价比很高。跑了一下安兔兔，70万分。用着也流畅。但是也有点不足的地方，一是摄像头质量真不怎么样，距离一米拍书架，书籍封面的字体放大就模糊了。真的就像大家说的那样只能扫码！二是系统优化不是很好，很多功能找不到，这可能和上一个手机系统不同要适应有点关系吧。三是nfc功能很鸡肋，复制门禁卡都不行，这一点点功能添加上，不会影响多少成本吧？！第四点，充电头太大了，要占用两个插座口的位置，很不方便。第五，游戏效果不知道，我不玩游戏，游戏都在笔记本上玩。放两张照片，看看白天和晚上的照片效果。最后说一句。这机子适合没有拍照要求的人。,0.9999983075142457
玩半天搞半天，搞得脑袋都大，就是系统还不足以满足需求，还有那个音量键放宽一点也是很好用的。可就是弄得小李小气。整机拿着手感很合适，拨号盘又缺少左右手惯用的方式，女孩子手小拨号也非要两只手。顶上的副麦完全就是个缺陷。用回极简模式文件夹又仅显示4个图标。标准模式又无法调出操作盘。折腾来折腾去还是不习惯。输入法又是个不好用又让我退回谷歌拼音手写，QQi又无法启动。系统不完善啊！好处就是硬件目前基本满足。,7.569628146519847e-09
手机用着还好吧！和华为等大品牌比有些差距。如果重度使用还是不建议购买,0.6773899302659148
第一次在网上买手机，先说快递吧发顺丰就是快，那么远两天就到了。手机用着还是跟上手，个人认为这款手机是中端机中的王者了，我以前手机骁龙660画质特效调到最低都卡，这个手机特效画质调到最高都不会卡，玩一般的游戏都是足够的，游戏体验很不错。摄像头那么大的有3个，反正也很好咱不懂就不说了。唯一一点就是这个充电器大头？大头是不是65W的都这么大?一个头占两个位置，不能竖着插吗?竖着设计绝对比这样横着好！,0.35075164687990656
很不错的手机，拍照也没有想象中的那么差，游戏模式很好用，发热也没有那么烫手，唯一的不足就是游戏模式没有快速连点（希望能改进一下），换装只能靠双手啦,0.9457474375935307
就是充电有点慢，别的都很好，不知道算不算毛病,0.3675476123939091
手机还可以，可是直播间送的耳机用不了，插头是充电插头，现在没多少机型能用，还不如别送，感觉有点给骗了,0.004369098034808783
习惯5星评价！但物流的确延误！疫情期间只能理解。等心焦时真是差点退掉换实体店随便买台算了。，手机性能尚可，拿手中很是厚重！,0.21956865409703819
第一次用真我手机。看中的是屏幕6.4寸，手机配置没话说，但真我的系统真不敢恭维。既然选择了就慢慢适应吧！,0.9711147571591209
我真的是糊了，***过年时2100买的，现在一个月左右掉的2000，黑色那个版本直接掉到一千七，真**牛逼。,0.5048404380349888
"?法精准,这么多neo不知道要搞啥，具体没啥区别，就是细微配件增配减配，实际没多大区别",0.9260190837062996
给父母买的，双十一期间优惠绝对到位了的，发哥处理器稍微失望，从1000用到1100到1200，整体有进步，但还是差点儿火候,0.7767787518185699
自从买了这个商品腰不酸了腿不疼了，干活也有劲儿了，一口气爬80楼不费劲儿了,0.03518719421342076
红米用习惯了，买的新手机用不习惯，拿去孝敬老娘去了。郁闷,0.09304394319445353
夜拍效果 其实很无敌了 至少效果不输其他同价位机型,0.9960784913558922
给家里人用的  比较高   就是容易发烫,0.4334032570587869
耗电有点快 早上充满的电没玩 到家就剩百分之二十了,0.5187696898010307
12.30日下单 不到一个月就降价了，这也太快了吧！,0.0289507477841896
手机还是不错到极点，但是物流特别的慢，不像是顺丰像是龟速顺丰,0.13320756961431923
买了一周2578，现在2418，我去，这价降的我服了，牛啊,0.2727972181459303
很流畅，就是屏幕还差点意思,0.9276462372012715
好用，不建议升级系统,0.3085610975870594
第一次用这个品牌还是有点不习惯,0.4927788517984035
价格一会高，一会低的，,0.10521338244422018
买了没多久就降价三百块钱！真是的！无语！,0.0027428709896796244
发热严重啊，续航也不咋地,0.6033415137653059
上网速度很慢，看***有时候会模糊一下,0.264955425456347
手机已收到，开机体验了一下喇叭声音太差，出厂贴的膜也是有气泡，不退了，给老人用得了！建议大家谨慎购买！,7.196216985083659e-05
不行，越想越生气，美其名曰有价保，可以申请价保，11.1买的，到了11.11就降160块，申请价保也申请不了，问客服，客服说非店铺优惠不能申请价保，这事干的漂亮，跟这卡bug呢，牛哇牛哇,1.5787138410439105e-05
我想买个新手机就是全新的意思，而不是买个二手的，假如二手机要当新机卖的话麻烦你把你用过的软件删掉，这样买主不就不知道了吗,0.0020967606862209998
"说7天价保，双11价保又说非店铺优惠劵不予价保。商量买新退旧，又说订单手机不能串货。反正双11价格降了价保不行，买新退旧不行，都不行。
双11添堵。",6.599393590489555e-07
最差的一次购机，激活后不能退，不激活怎能发现问题！外放声音放在在一个铁罐里发出来，蓝牙耳机高频部分缺失沉闷。提前交的定金，没有2个月掉了200多,2.3911404008480908e-05
"手机电池很差，上一台手机是q系列，差不多两年了，不怎么玩游戏的情况下一天差不多3冲，这个新机，在配置什么都比原来好的情况下，竟然不怎么玩游戏也要一天两冲
官方也别回什么后台运行什么的，我对比过得，同样的后台运行，也就比我的真我q.慢一点而已。其他的目前没什么",0.003826714843966683
外形外观：时尚手感舒服，后盖稍有点粘手屏幕音效：颜色偏暖，还好吧拍照效果：中规中矩运行速度：8G流畅，湿滑~待机时间：满电勉强用一天，中度刷~其他特色：30分钟左右充满,0.9999991854123776
