content,emotion_scroe
第一次用这个牌子的手机，为了英雄联盟。外形外观：惊艳的绿色，真的喜欢屏幕音效：屏幕绝了，和我的fold3差不多。拍照效果：拍照很实用主义，日常完全够了运行速度：玩了一天英雄联盟手游，全程60，王者直接开到120极限帧率，那个丝滑。。待机时间：手机电池超强，充电也快其他特色：到手两日，爱了。,0.9999999999596056
手机运行流畅，充电速度杠杠的。苍蓝颜色会角度不同发生变化，大爱!,0.9996731431426394
超高的性价比是Realme 崛起的重要原因之一，笔者今天为大家评测的就一款外观极富个性且又具备超高性价比的两千元档手机，Realme 真我GT Neo2。       外观设计是Realme的强项之一，产品中既有流光溢彩的GT neo，也有沉稳典雅的大师探索版，GT Neo2则延续了上一代的青春风格，尤其是笔者手中的这个撞色设计个性十足，从不同的光线下面看起来也呈现出不同的颜色效果，风骚之极。        机身背面所采用的是3D弧面玻璃，官方宣称采用的是经过多次实验，最终找到的52°完美弧度，不得不说，上手握持时与手掌可以很好的贴合，配上玻璃的细腻触感，手感较为舒服，磨砂的玻璃面也尽可能减少了握持时的指纹痕迹。所入手的苍蓝版本，不同光线的折射之下呈现出不同蓝色，色彩柔和又清新，甚至带来了旗舰的质感。另外真我GT Neo2手机所配备的屏幕支持DC调光以及护眼模式，在低光环境或者日常玩家时，可对眼睛起到保护作用。而且还支持超高亮度阳光屏，屏幕的普通模式500nit，在阳光下的局部峰值亮度可达到1300nit，配备500万：1对比度，在阳光直射下依旧可看清屏幕内容。,1.0
选了很久给妈妈挑了这款手机，上手效果不错，颜色好看，电池容量大，使用起来很流畅。,0.9999984410769571
手机很好用，黑色很有逼格，系统很流畅，玩游戏也不卡，物美价廉，值得购买,0.9999772545247021
非常好用，感觉非常流畅，充电还很快，包装也很精致，很喜欢。,0.9996787882879787
我在拍照方面很好很好，很清晰，电池续航方面，超级续航非常耐用，通信的话，音质很清晰，质感还是看视频好友杜比，全景声音超级奈斯运行速度10分钟快显示效果也很不错，用了一周左右之前用的小米使用感合作进行了对比整体感觉还是很不错的，希望越来越好，越来越喜欢。,0.99999999999997
"真我Realone GT NEO2，绝对性价比超高，打王者荣耀和英雄联盟秒进，无比顺畅，做工我自认为不比苹果和华为差。价格优势相当明显！正好是plus 会员，有6800-600,买了3台手机，给我妈也买了一台。",0.9999992020971067
手机性能没得说，反应速度很快，870的处理器还是很不错的，电池续航能力也很强，充电快,0.9999980293679313
手机看着很高档，用起来也很舒服，屏幕分辨率高，打游戏也不卡，屏幕解锁是俜下指纹解锁，拍照效果很清晰，物流一如既往的好，好评,0.9998481136341575
65w的快充非常快，我买的绿色，配上官方送的手机壳真的非常好看，屏幕素质和指纹解锁速度都是一流的，870的性能本来就很强，加上超强的散热，玩游戏时根本不发烫,0.9987699115646964
当天买第二天就到了，到货很快，手机颜值很高，充电速度绝了，这个快充我喜欢哈哈哈哈。送的手机壳颜值也高，还贴膜了，这个是我最喜欢的，我对手机要求不高，但是这种细节很贴心,0.9999679763253841
一款高性价比的产品，手机质量绝对没得说，手机颜色也很好看，内存够大够用，拍照也很清晰好看，手机用起来很流畅，没有卡顿。超级喜欢。,0.9999992922459893
外形外观：美观屏幕音效：屏幕素质很好，音质不错拍照效果：非常清晰运行速度：极快不卡顿,0.9999988396020951
手机挺好的，没有所谓的塑料感，颜色很好看，在不同光源下反射的光泽还不一样，很好。用着感觉很顺，不怎么玩游戏，续航中规中矩，综合体验挺好的。,0.9999981502949368
外观时尚，拿着手感也不错，背面AG玻璃的，870处理器5000毫安大电池，配上65w的充电速度绝了，到手就玩了一把王者全局稳定60帧，很不错。杜比音效配上E4看电影效果也好,0.9999999729411396
已经看了很长时间这个手机了，用起来还是挺不错的，发热控制的很好。充电是真没想到这么快！！客服态度也是非常不错的。,0.9162840932985111
手机运行流畅待机时间：满意，基本一天不使劲玩可以不充，充电速度也很快。,0.9931385712444869
给妈妈买的，这个颜色很好看，屏幕大小刚好，拿着不会很重，外观时尚，主要是配置高，处理器好，充电快，拍照像素高，价格又不贵，很满意的,0.9999974296392767
真我手机不错，性价比很高，值得入手，经过几天的使用，速度流畅度，手感都很不错了，这个价位，这性能，值得拥有，还想啥，这个价位，赶紧入手吧。,0.9999999998722231
手机真不错  选了几个品牌。 最后对这个下手了  颜色漂亮  充电也快 运行完美  非常棒的一款手机,0.9999880580310194
第一次买realme的产品，体验很好。颜色超级酷炫，然后打王者也可以120帧运行，打起来特别流畅，充电速度很快。,0.9999735387001826
第二次购买，性价比真的是高，太香了。配色好好看，显得年轻，特别说下自带的手机套，真心贴合，做工很棒，这种材质摸起来特别舒服。就是拍照，虽然不是差得那么离谱，但也是不尽人意，不过价格面前，还能接受。,0.9745384936900062
小惊喜啊，头一天买了，第二天上午就到了，京东物流名不虚传。机器很漂亮，超出预期，比图片还要漂亮，打开机器，屏幕很不错，反应也很灵敏，充电是真快。,0.9994769144639702
性价比很高，很不错的手机外形外观：通用常见的外观屏幕音效：屏幕色彩相当不错运行速度：很流畅，用起来没有卡顿感待机时间：电池电量大,0.9999999964408239
外形外观：非常完美屏幕音效：音质很好拍照效果：拍照效果不错运行速度：运行速度很快，不卡顿待机时间：5000续航很强大其他特色：价格很实惠很值,0.9999999999966589
京东物流很快，手机质量很好，真我手机系统很好用很用心，高通骁龙870性能很强大很流畅，赞！,0.9999997427822722
手机看了好久了，入手的第二个真我手机了，高性价比，质量不错，手机性能、外观、电池、快充都有巨大吸引力，摄像上中规中矩，满足日常拍摄需求，总之，手机现在用起来很不错，后续的使用在进行追评,0.9999999997391429
外形外观：外形设计挺好非常喜欢这个手机屏幕音效：屏幕挺好外放声音很不错还是双扬声器声音很大拍照效果：像素很高拍照超级清晰,0.9999998123243637
第一次买realme ，5000大电池，65w快充，骁龙870，双喇叭，着实招招击中了我，经过一段时间的试用，确实不错，有点爱不释手，有点夸张哈?，还是很满意，出色的表现打败了k40一众同价位手机，棒棒哒?,0.9999738718243214
非常不错。我很喜欢，颜值担当，性价比很高，值得拥有。所以大家来买吧，外形外观：很好看我很喜欢屏幕音效：还不错有待提高拍照效果：有待提高运行速度：很快，这点很可以，我很喜欢,0.9999999999719686
昨天买的手机，已经收到了，京东快递还是一如既往的快呀~拿到手给我的第一感觉非常不错，不会太重，我这种重度游戏患者可以接受。屏幕尺寸刚刚好，打了一盘王者，还可以，滑动起来感觉不出卡顿。还送了一个手机壳，也有出厂膜，很贴心。,0.967207529968471
颜值爆表，特别喜欢这款手机外观，拍照清晰！操作流畅！开包很满意，期待游戏带来更完美体验，赞！,0.99999707760346
外包装破损，很脏，手机就这样运过来，着实让人担心！,0.014716162684442202
外形外观：漂亮，颜色不错屏幕音效：非常清晰拍照效果：智能拍照很清晰运行速度：非常快买的第二个了，给老妈买的手机，非常好用。。。值得拥有。。。。。。。。。。。。。,0.9999999799906474
外形外观：外观设计太亮眼啦这个真我gt neo2，没有一代的塑料感，质感提升明显！屏幕音效：屏幕用料十足，没的说啦！全局DC调光好评！拍照效果：拍照一般，镜头是老款型号了。日常够用，想拍的效果出众的，得考虑拍照手机啦。运行速度：骁龙870，UfS3.0，6的飞起！待机时间：5000毫安时电池不是盖的！其他特色：散热设计很好，不错！,0.9999999999919134
外形外观：非常漂亮很满意拍照效果：挺满意的运行速度：骁龙870是真的顶待机时间：充电快，续航久,0.9999974776365813
非常的好，非常流畅，屏幕音效：好运行速度：非常快待机时间：很长,0.9998671564090058
外形外观：很好看屏幕音效：好拍照效果：行运行速度：快其他特色：玩游戏好！！！！！！！！！！！！！！！！！！！！！！！！！！！！！,0.9999985577409543
27号付款，28号手机就送到了。。黑薄荷这外观不错，手机大小重量正合适，拿在手里很好操作！屏幕显示也很好，指纹解锁很快捷！至于性能方面还要再用一段时间才知道！不过我想骁龙870的处理器应该能满足各种需求！,0.9998503729840652
这款手机非常符合我的需求量，5000的电池续航久，包装非常精致，尤其这个黑薄荷颜色太帅了，而且开GT模式也帅，性能没的说真是太好太稳定了，金刚石散热稳得很！,0.9999733458292553
看了好几天终于买了，拿到手机很激动开机后有百分之四十五的电，充电十多分钟充满，充电时手机会生高一点温度，充完电后温度就下降了，安兔兔跑分715600左右，摄像头日常使用感觉还可以，蓝色颜值不错，到手后几个小时内评论,0.9998596454254678
速度挺快，手机超值，双十一下单真的超值，配置好还送原厂手机壳手机膜。导入数据比旧手机快多了，一键转移。人脸识别很方便，屏下指纹也很好用,0.9999575056811465
外形外观：外形大气，手感很好，大小合适。屏幕音效：屏幕大，声音清晰，待机时间：电池大，待机时间长，当老年机很合适的。拍照效果：拍照效果不错，给小朋友拍个视频啥的还可以，,0.9999999984174985
京东物流速度很快，头天晚上下单，第二天早上就能送货上门。黑色的手机后盖，玻璃材质，很有质感，拿在手上很舒服。系统流畅稳定，充电很快。,0.999751701872591
第一次用realme的手机，手感很好，这个价位性能很强了，大电池，快充，三星e4屏幕，x轴马达，双扬声器，首发买便宜100，性价比爆炸。,0.9985908048456763
目前为止第二款手机，结合个人情况考虑了很久，看了很多测评最终还是选择了这款质价比很高的realme neo2，颜色外观完全符合预期，新机运行极其流畅，这就是120hz高刷么? 爱了。  （照片使用先前几乎垮掉的手机拍的，像素差点）,0.9982479698045245
外形外观：外观方面非常不错的运行速度：非常的快，刚到的其他特色：屏幕色彩饱和度刚刚好，非常的奈斯真我的性价比还是非常不错的，我就是冲着这个性价比买的,0.9999999985234673
手机很好，特别的喜欢，比小米手机好多了，而且一点都不卡，非常的舒服，外观我超级喜欢，拍照效果也很好，屏幕音效：也特别的好，系统快,0.9999991825411872
外形外观：薄荷绿爱了爱了屏幕音效：很棒拍照效果：日常绝对够用运行速度：很快待机时间：电池容量大，充电速度快，完美,0.999999998938222
很好用，挺流畅的，希望能用3年，颜值方面也满意，只是相机凑合。总体达到预期，满意,0.9996418950248696
像素挺清晰的 ，温度控制的很好 ，充电很快 三十多分钟就充满了 ，电池也很耐用 ，特别是物流送的特别快 昨晚交的尾款  今天早上就到了,0.9976663455353084
这款机子外观漂亮，现在在这个新手机状况下运行速度很快，拍照效果也许我不会运用，感觉没页面介绍的效果好！赠送的人家外壳太丑了。如果是和手机颜色配套那才真的好,0.999646897923522
"快递不到一天就到了，真的很快。真我gt neo2,首先说说我认为的不足之处，1.电池续航不是很好  2.语音助手不是很聪明  。优点很多，比如说按键触感很好，屏幕不错，音质感觉也好，音量很大，充电速度也比较快，打游戏很舒服，所以说没有十全十美的手机，电子产品更是如此，毕竟更新换代速度太快了。",0.9999980707497554
京东物流确实是快，隔天早上就到了，120hz高刷确实不一样，我现在看我的手机就感觉好卡，手机现在用着特别舒服，只是这个手机壳和这个镜头不太搭,0.5969010659189212
整体来说的话 手机还是可以的运行速度：不错，挺快的外形外观：外形很好  很符合青少年的朝气,0.9999999884006902
手机是买给岳母做生日礼物的，手机屏幕很大，运行速度很快，系统很人性化，性价比超高，岳母很满意！,0.9999971955869206
外形外观：影黑，沉稳大气。屏幕音效：杜比全景声，音质出色，声音很大，无破音。拍照效果：日常拍摄够用，颜色真实，效果很好。运行速度：不愧是年度好评870，运行流畅。待机时间：出乎意料的久，不玩游戏，有时一天下来到晚上睡觉竟还有百分之六七十的电量，5000ma真太牛了！其他特色：机竟还有免单机会，竟然还中了，感谢realme!年度最佳性价比好机，祝gtneo2大卖！,1.0
外形外观：外观很好看，有特色待机时间：续航很好，祖传65w快充很稳拍照效果：拍照容易模糊,0.9999999125024946
很喜欢这个颜色，实在太好看了，为了这个颜色决定用透明的壳子，屏幕质感也不错，我对拍照要求不高，日常是绝对够用的，从教室最后一排也能把ppt拍清楚，充电很快，电也够用,0.9999988669252842
拍照效果：自己试着拿手机拍了一下，清晰度超高运行速度：很快我后面挂了几个程序打王者一点都不卡外形外观：这个黑色特别戳我爱了,0.999988657940708
手机收到了  太棒了吧这也 超级快 音质超级好声音很大  屏幕也很细腻很清晰 打游戏散热没的说 真的太满意了,0.9995450625256346
第一次用真我手机，总体感觉不错，买来偶尔玩玩游戏，再用的苹果玩游戏真垃圾，玩一会屏幕暗无法调节，通病。看中主要还是颜值这块，对比了好几款，最终因为有24免息，哈哈选真我,0.9997847752564867
当时买下来，想用几天看看，没想到这么好用，也适合我当下的情况，分期购买无压力，外观很精美，系统速度飞快，应该可以用个两年,0.9680349898112153
外观设计好看 拍照也很清楚 玩游戏更加不卡特别是玩王者绝绝子 性能强?,0.9999971836556011
太爱了，太喜欢了，手机很漂亮。性能参数散热都很好，照相好清晰 。电池续航玩一天没有问题 。颜色太棒了。,0.9999890866976237
外形外观：黑薄荷颜色造型很抓眼屏幕音效：屏幕柔和清晰，音效清亮透彻拍照效果：拍照涂抹感稍显严重运行速度：运行流畅待机时间：正常使用可用一天其他特色：机体略重,0.9999999988281847
最近太忙了，确认晚了，质量好，正品，款式好看，质量很好的外形外观：后壳挺好看的，前屏左上角的挖孔屏相对于居中的天眼好看些，期待realme的屏下摄像头屏幕音效：杜比音效加持下声场相对较好,0.9999860492507808
非常的满意，机子超出想象，我购买的12+256，影黑，简单大方。机子运行完美。值得推介。,0.9998810399267707
挺好的，很喜欢，很满意。价格实惠，系统流畅，重量还可以，手感不错，充电速度挺快。这价格顶配真的香，物流和产品都不错，性价比高，赞赞赞???,0.9999999999854288
外形外观：颜值高运行速度：丝滑般流畅待机时间：充电很快，待机时间长其他特色：玩游戏很好很强大,0.9999999844810306
我是看了发布会才来买的，可以说是今年870手机里的一匹黑马，屏幕素质很好，电池容量大，一键GT，看中的就是游戏素质强，也看了不少的评测视频，终于下决心买了，早上付的尾款，下午就到了很满意,0.9998721774846651
外形很时尚，玩起来也很流畅，5000毫安的大电池能让手机玩的更久，快递送送也挺快的,0.999993020695698
手机收到之后就立马拆开了?很喜欢，没想到能在第一时间抢道这款手机?配了很不环保的65W充电器，还有一个原装手机壳。?手机手感比想象中好很多，我都不想给他戴壳了。主要还是冲着它的870处理器买的，很适合我这种打游戏的人。?充电很快，大约半个小时就能充满，平时使用也是够的。就冲这个价位，值了值了??希望真我的牌子可以越做越好???,0.9999052236755865
外形外观：我选的是 薄荷绿很好看屏幕音效：双扬声器，非常好拍照效果：一般吧运行速度：很快,0.9999978948536815
外形外观：很好看屏幕音效：非常好，很有质感拍照效果：非常高清**运行速度：非常快，买值啦待机时间：还是挺耐用的，综合起来非常值得购买的手机,0.9999998649710107
手机收到已经四五天了，拿在手上质感挺好，拍照我个人觉得没毛病，指纹解锁很快，内存，运行都超快，传数据的时候发烫程度确实不错，值得推荐哦！还有啥在犹豫的，可以提问！,0.9997456144475647
用了一段时间，感觉系统流畅，电池耐用，充电很快，屏幕显示细腻，看起来很舒服，值得信赖,0.9999838993827824
很不错，很喜欢，质量很好，建议你们买8+256的，这个手机好像在后边，又给你加了3gb的运行内存。我的是12+256直接变为15+256。。。。。。,0.9388890026662824
手机已经用了一个月了，整体感觉非常好，电池容量大，内存256的也已经够用了，运行速度快，关键还便宜，非常nice的一次购物,0.999895066611817
不愧是京东，晚上十点钟，第二天上午就送到了，超快。手机颜值高，反应速度快，拍照清溪，玩过一天了，总体非常满意,0.9999500438236646
在京东关注了很久，最终拿下真我这个品牌，手机反应很快，照相很清晰，这个价钱可以战5年…,0.9993561705261454
外形外观：手机尺寸大，纯纯的机器感。运行速度：很快待机时间：基本上晚上充一次电。能用上一整天。,0.9999791018319323
真我gtneo2性价比高，870处理器很流畅，玩游戏不卡，5000毫安电池，出门在外很放心，不用担心怕没电?宝贝质量很好，收到货第一时间打开看了，很不错?，很满意?，客服也有问必答，感谢?,0.9999999591663785
手机很漂亮，外观很符合我的审美，使用体验很流畅，刚刚到手还有点不适应，我真的爱苍蓝的配色，好看好看好看。还没有试试拍照效果但镜头模组的设计我觉得也挺好看的，非常满意！,0.9999999828087475
外形外观：太好看了屏幕音效：比较震撼拍照效果：拍照杠杠的运行速度：一个字快,0.9998922016106482
外形外观：漂亮大气屏幕音效：屏幕显示细腻拍照效果：一般般吧运行速度：很快待机时间：充电很快,0.9999999243867991
这颜色很不错，可以变色的，闪闪发光。试用一下，很流畅。准备把老机资料转过去，游戏都下好了。?,0.9994278742816858
用起来很流畅，120hz高刷用起来感觉很不错，870处理器也能应对绝大多数游戏，手机颜值也很高，音质也不错,0.9999772462281938
手机影黑色是真的好看，颜值高，音质好，屏幕看的很清晰，反应很快,0.9991810447889735
包装很好，质量非常棒，宝贝完全符合卖家的描述，可以放心购买?感谢?实用性和颜值都非常的赞，我很喜欢。。不同角度，背面颜色不一样，很好看,0.9999780136565404
realme GT Neo 2手机 性价比很高，很不错的手机，还有线性马达，震感很好，这个价位上线性马达是我没想到的，后壳也很好看，配置很不错。,0.9999999032527527
机子性价比挺高的，上手手感情不错，颜色也比较好看，比想象中好看多了，活动时候买的价格特别合适,0.9999988838905667
很棒啊！！不管怎么说，非常的棒！屏幕尺寸比较大，CPU870很棒，5000大电池，充电也很快，带来应用也超级的快，先玩一把LOLm再说,0.9977086244799671
外形外观：外观非常不错拍照效果：拍照像素挺高的其他特色：充电速度挺快,0.9999987769034262
中午收到货了！打开看了！外观很好看！也很大气！特别适合男士使用！给老公买的！这次有活动！很给力！目前还没用！等用了再来追评！,0.9071593703307812
手机很不错，给父母买的，处理器很好，5000毫安大电池，续航很不错。真我的系统做的也很棒，操作方便，功能齐全。性价比超高，推荐！！！！,0.9999999993304192
手感不错不错，流畅度很好，值得买，外形外观：高端大气屏幕音效：音质好的很，,0.999999991296089
手机收到了，运行速度超快，颜色特别漂亮，下次买手机还选这个牌子，期待gt2,0.9994566685996752
买了有一阵子了，使用了才来评论的，总体来说很好，物有所值，屏幕三星E4屏和骁龙870的处理器对我来说就足够了，买的荧光绿色，识别度很高，满意,0.9996006650658211
非常好，手机使用很快屏幕音效：屏幕效果刷新很快运行速度：870反应很迅速其他特色：系统广告很好看,0.9985912146301806
手机真不戳，感觉很满意，性能强大，性价比高，65W快充充电速度一下子上来了，非常好，外观漂亮。,0.9999994833292567
双十一期间购入的，后盖玻璃比较的青春，没用过这个颜色，觉得还可以。手机大小不错，电池5000毫安，充电快，价格合适，总体性价比很高，后期的使用体验有时间会追评。,0.9999998997007565
这是一个不错的手机，发热很好，在个42℃左右，操作很流畅运行速度：还蛮快的,0.9991360141295835
在京东买了很多次我从来都没有评论过，但这次不一样首先这个手机的颜色和外形还有强大的配置让我觉得再千元机里   这个也算是一个很不错的手机了   拿在手里手感特别好  各方面性能玩了一下也确实很给力    希望这个牌子的手机越做越好！,0.9999994623700629
性价比超高，颜值非常高！薄荷绿非常养眼，硬件配置非常好，玩大型游戏都很流畅，真我的手机系统优化还是不错的。拍照也不错，日常够用，很棒！,0.9999999999640958
手机很不错，运行速度跟电量都很满意！配色好看，个人喜欢黑色，因此没有选择薄荷绿。第一次用realme，希望能用久一点。,0.9991079472058169
帮同事买的手机，作为他对象的生日礼物，不错，听说比较喜欢，买的薄荷绿的颜色，配色很好看，适合女的用，手机各方面的配置比较高，没有明显的短板完全满足日常需要，还自带外壳和钢化膜，省的单独再买了,0.99999436653675
游戏稳定，小巧轻便，发热控制的很好，不会很热，日常续航重度使用在5-7小时以上，正常一天一冲。不错,0.9999951137313818
外形外观：很美观，非常好看拍照效果：也不错屏幕音效：nice运行速度：很快,0.9999979753579233
手机打游戏发热控制的非常好，游戏体验很不错，绿薄荷这个颜色感觉特别的新颖，给人一种不一样的感觉，65w加5000毫安电池也特别够用。,0.9999921744008239
外形外观：老婆很喜欢这个配色屏幕音效：音效绝绝子拍照效果：同价位无敌运行速度：骁龙的不用多说吧待机时间：充电贼快，电池容量很大,0.9999993087107997
手机非常好用，黑色也是我最喜欢的颜色，系统也很流畅，玩游戏一点都不卡，物美价廉，好手机！,0.9999193984141741
物流很快，整个手机拿到以后重量一般可以接受，整体的反应速度给7-8分  12+256 感觉还是很不错的  裸机感觉光滑软件安装较快,0.9485559614166698
东东真心不错，昨晚下单的，第二天早上扰送了，机子收到后就急着打开了，高通骁龙870的机子运行速度是真的快，屏幕是三星，色彩不错，自带贴膜，一个字好！！！速度,0.8412788740212929
外观设计简约时尚，游戏界面显示细腻，扬声器音量大并且外放清晰，白天和夜间的拍照效果好都很清晰，上班待机一整天没问题，快充速度快便利,0.9999996752963192
