所属主题,文章数量,特征词,主题强度
Topic0,137,酒店、携程、服务、行程、航班、时间、导游、司机、真的、房间、体验、飞机、项目、小费、新加坡、安排、接机、送机、中国、红树林,0.056194
Topic1,786,携程、酒店、服务、导游、房间、司机、行程、不错、客服、满意、安排、出行、接机、机场、飞机、航班、特别、入住、前台、自由,0.3224
Topic2,160,携程、酒店、领队、导游、行程、认真负责、客服、航班、不错、旅行、马来西亚、飞机、时间、自由、工作、旅游、小费、游客、安排、告诉,0.065628
Topic3,155,酒店、携程、房间、客服、便宜、旅行、服务、行程、航班、机场、小费、越南、接送、入住、推荐、不错、地方、出行、体验、真的,0.063577
Topic4,998,酒店、行程、导游、携程、领队、安排、时间、不错、房间、服务、小时、满意、航班、柬埔寨、越南、飞机、景点、特别、选择、希望,0.40935
Topic5,202,酒店、房间、不错、携程、行程、服务、不好、小时、入住、香格里拉、真的、飞机、前台、早餐、客服、感觉、第二天、机场、航班、香格里拉酒店,0.082855
