id,score,content,creationTime,class,物流信息,分词
14326728556,0,京东生鲜有活动，正好天冷，想吃火锅可以买很多丸子，之前是牛肉卷羊肉卷有活动，买了很多牛肉卷羊肉卷，但是那个时候完全没有什么活动，没什么好买的。花外面不到一顿的钱，能吃两顿火锅，这个性价比挺高的，而且自己在家吃不用计算价格，想吃什么自己买什么也挺好的，很多丸子都没吃过，这次存的活动正好可以多买几种回来，以后觉得好吃，就可以盯着那几种接着骂，个人觉得还可以，挺好吃的，就是家里面的人不喜欢，下次可能不会买了或者换一个口味的吃。我吃东西还好不怎么挑，我觉得这个撒尿牛丸的味道也挺鲜的，超市里面买的味道是一样的，京东快递的速度也很快，给京东的小哥点个赞，希望京东能够继续保持住，继续加油，年前再多做一点活动多给力。,2020-06-22 13:24:07,生鲜,京东生鲜有活动，正好天冷，想吃火锅可以买很多丸子，之前是牛肉卷羊肉卷有活动，买了很多牛肉卷羊肉卷，但是那个时候完全没有什么活动，没什么好买的。花外面不到一顿的钱，能吃两顿火锅，这个性价比挺高的，而且自己在家吃不用计算价格，想吃什么自己买什么也挺好的，很多丸子都没吃过，这次存的活动正好可以多买几种回来，以后觉得好吃，就可以盯着那几种接着骂，个人觉得还可以，挺好吃的，就是家里面的人不喜欢，下次可能不会买了或者换一个口味的吃。我吃东西还好不怎么挑，我觉得这个撒尿牛丸的味道也挺鲜的，超市里面买的味道是一样的，京东快递的速度也很快，给京东的小哥点个赞，希望京东能够继续保持住，继续加油，年前再多做一点活动多给力。,京东 鲜有 活动 正好 吃火锅 丸子 牛肉 羊肉 活动 牛肉 羊肉 活动 没什么 外面 不到 一顿 两顿 火锅 性价比 在家 不用 计算 价格 丸子 没吃过 活动 正好 多买 几种 回来 好吃 几种 挺好吃 喜欢 下次 口味 东西 还好 撒尿 牛丸 味道 挺鲜 超市 味道 京东 快递 速度 很快 京东 小哥 点个 希望 京东 加油 年前 一点 活动 多给力
13545468767,0,冬天到了，围着火炉吃火锅是最好不过的了，拍了好多吃火锅的食材一大堆火锅自然少不了丸子，福州鱼丸是我们家孩子大人的最爱，这次拍的比较小的鱼丸，口感刚刚好，容易入口鞋味道不错，日期也很新鲜，快递非常棒，快递小哥服务也不错好评，这个品牌的丸子现在双11正搞活动，一次性买了很多，几乎每个口味都买了一包，带下的丸子口感很好，汁水饱满。价格也不贵，非常亲民，物流也特别的快，很有特色很美味，随便串烫一下就能吃，或者拿来跟其他菜一样好。京东生鲜的配送让人放心，送到时包装严实，东西都变得很好,2019-12-01 15:56:58,生鲜,冬天到了，围着火炉吃火锅是最好不过的了，拍了好多吃火锅的食材一大堆火锅自然少不了丸子，福州鱼丸是我们家孩子大人的最爱，这次拍的比较小的鱼丸，口感刚好，容易入口鞋味道不错，日期也很新鲜，快递非常棒，快递小哥服务也不错好评，这个品牌的丸子现在双1正搞活动，一次性买了很多，几乎每个口味都买了一包，带下的丸子口感很好，汁水饱满。价格也不贵，非常亲民，物流也特别的快，很有特色很美味，随便串烫一下就能吃，或者拿来跟其他菜一样好。京东生鲜的配送让人放心，送到时包装严实，东西都变得很好,冬天 围着 火炉 吃火锅 好多 吃火锅 食材 一大堆 火锅 自然 少不了 丸子 福州 鱼丸 孩子 大人 鱼丸 口感 入口 味道 不错 日期 新鲜 快递 快递 小哥 服务 不错 好评 品牌 丸子 活动 一次性 口味 一包 带下 丸子 口感 汁水 饱满 价格 不贵 亲民 物流 特别 特色 美味 随便 拿来 京东 生鲜 配送 放心 送到 包装 严实 东西 变得
17633082700,1,"质量非常好，完全待合卖方的描述。我真的很喜欢。这完全超出了预期。交货速度非常
快。包装非常仔细和紧密。物流公司有良好的服务态京，交结速度非常快。令人满意的
购物质量非常好。我希望更多的朋友能信任它。店主的态应很好。我将再次拜访这位好
卖家，以获得赞扬。交货很快，
态度很好，我很满意：好好！网上购物是如此快。我
没根到商店的服务这么好，商品质量好，价格低，而目卖家非第热情。下次，我希望下
次有机会在买。我祝你生意兴隆，质量好。我没想到包 裝会这么小心。下次我会有机会
再找你购物。店主很好，东东很好。找到你心中的宝贝是一件非常开心的事。质量非常
好，完全符合卖方的描达。我真的很喜欢。这完全超出了预期。交货速度非第快，包装
非常仔细和紧凑，物流公司有良好的服务态度和快速交货速序",2022-06-14 14:43:05,生鲜,质量非常好，完全待合卖方的描述。我真的很喜欢。这完全超出了预期。交货速度非常快。包装非常仔细和紧密。物流公司有良好的服务态京，交结速度非常快。令人满意的购物质量非常好。我希望更多的朋友能信任它。店主的态应很好。我将再次拜访这位好卖家，以获得赞扬。交货很快，态度很好，我很满意：好！网上购物是如此快。我没根到商店的服务这么好，商品质量好，价格低，而目卖家非第热情。下次，我希望下次有机会在买。我祝你生意兴隆，质量好。我没想到包 裝会这么小心。下次我会有机会再找你购物。店主很好，东很好。找到你心中的宝贝是一件非常开心的事。质量非常好，完全符合卖方的描达。我真的很喜欢。这完全超出了预期。交货速度非第快，包装非常仔细和紧凑，物流公司有良好的服务态度和快速交货速序,质量 待合 卖方 描述 真的 喜欢 超出 预期 交货 速度 包装 仔细 紧密 物流 公司 服务 态京 交结 速度 令人满意 购物 质量 希望 朋友 信任 店主 态应 拜访 这位 卖家 赞扬 交货 很快 态度 满意 网上 购物 根到 商店 服务 商品质量 价格低 而目 卖家 热情 下次 希望 下次 机会 我祝 生意兴隆 质量 没想到 裝会 小心 下次 我会 机会 购物 店主 找到 心中 宝贝 一件 开心 质量 完全符合 卖方 描达 真的 喜欢 超出 预期 交货 速度 第快 包装 仔细 紧凑 物流 公司 服务态度 快速 交货 速序
16476357264,0,"很好(?▽?)
1、质量非常好，与卖家描述的完全一致，非常满意，真的很喜欢，完全超出期望值，发货速度非常快，包装非常仔细、严实，物流公司服务态度很好，运送速度很快，很满意的一次购物。
2、收到货，第一时间拆包装，感觉质量还是比较好的，与卖家描述的还是一致的，非常满意，发货速度比较快，物流公司服务态度很好，运送速度很快，总的来说这次是很满意的一次购物，感谢卖家。
3、宝贝收到了，卖家发货很快，物流也非常给力,客服服务态度极好，很有耐心、给人一种亲切感，好喜欢。还有包装精美，高端大气上档次;看得出来商家很用心。宝贝真心不错，与图片相符，没有任何差异，真的是物超所值。
4、我觉得挺好的，买的时候看见评论里都说好就买了，看到发货的时候挺激动的，到了之后，满怀期待一激动得从快递员那里拿回了寝室，试一下，结果挺不错啊！而且客服小姐姐也特别的好，很有礼貌，客服小姐姐也是秒回我的疑问呢，嘻嘻，下次还会回购哒。
5、物流超级给力很快就收到货啦，卖家老板特别好建议的尺码非常合适，衣服做工精致！面料质地厚实，颜色好看，质量真的非常好！版型设计非常好看，穿上显气质！超级满意！好评！",2021-10-17 19:27:06,生鲜,"很好(?▽?)1、质量非常好，与卖家描述的完全一致，非常满意，真的很喜欢，完全超出期望值，发货速度非常快，包装非常仔细、严实，物流公司服务态度很好，运送速度很快，很满意的一次购物。2、收到货，第一时间拆包装，感觉质量还是比较好的，与卖家描述的还是一致的，非常满意，发货速度比较快，物流公司服务态度很好，运送速度很快，总的来说这次是很满意的一次购物，感谢卖家。3、宝贝收到了，卖家发货很快，物流也非常给力,客服务态度极好，很有耐心、给人一种亲切感，好喜欢。还有包装精美，高端大气上档次;看得出来商家很用心。宝贝真心不错，与图片相符，没有任何差异，真的是物超所值。4、我觉得挺好的，买的时候看见评论里都说好就买了，看到发货的时候挺激动的，到了之后，满怀期待一激动得从快递员那里拿回了寝室，试一下，结果挺不错啊！而且客服小姐也特别的好，很有礼貌，客服小姐也是秒回我的疑问呢，嘻，下次还会回购哒。5、物流超级给力很快就收到货啦，卖家老板特别好建议的尺码非常合适，衣服做工精致！面料质地厚实，颜色好看，质量真的非常好！版型设计非常好看，穿上显气质！超级满意！好评！",质量 卖家 描述 完全一致 满意 真的 喜欢 超出 期望值 发货 速度 包装 仔细 严实 物流 公司 服务态度 运送 速度 很快 满意 购物 收到 第一 时间 包装 感觉 质量 卖家 描述 满意 发货 速度 物流 公司 服务态度 运送 速度 很快 满意 购物 感谢 卖家 宝贝 收到 卖家 发货 很快 物流 给力 服务态度 极好 耐心 一种 亲切感 喜欢 包装 精美 高端 大气 上档次 看得出来 商家 用心 宝贝 真心 不错 图片 相符 差异 真的 物超所值 评论 说好 发货 激动 满怀 期待 激动 快递 寝室 试一下 挺不错 客服 小姐 特别 礼貌 客服 小姐 疑问 下次 还会 回购 物流 超级 给力 很快 收到 卖家 老板 特别 建议 尺码 合适 衣服 做工 精致 面料 质地 厚实 颜色 好看 质量 真的 版型 设计 好看 气质 超级 满意 好评
16311430593,0,丸子很好吃，夹心很美味。满满一大包，份量很足，京东物流就是快，而且生鲜还有专门配送箱配送，保障了不会融化。真的是有心了。当天到了就下锅煮粉面吃了，煮汤味道很鲜，一起买的还有其他丸子，搭配一起煮，味道多样化。海欣灌汤福建鱼丸包装精美，用料考究，每个鱼丸都是真材实料制作，个个都挺大，煮好以后咬一口，满嘴香气四溢，汤汁鲜美。丸子我们全家都爱吃，尤其爱吃这个品牌的，这家的丸子口味我几乎都买过了，丸子柔韧嫩滑，个个大只饱满，可单吃可做菜可打边炉，都好吃！好煮饱腹口味好！每次有特惠我都要买上好几大包。非常好吃的包心鱼丸，个头很大，皮有弹性，自然的鱼香，易熟，有嚼劲，里面塞的馅料很好吃，食材新鲜可口，灌汤的，咸度正好，应该能适应大部分人的口味。一大袋量还是很多的，煮熟了特别显大，建议别煮太多，不然吃不了。鱼丸拿到手还有冰，非常新鲜。灌汤鱼丸是1千克每袋的，鱼丸个头均匀大小适中，各种做法都适合，并且色泽洁白，皮薄馅大，肉馅鲜嫩，汤汁爽口，外皮Q弹。性价比很高的鱼丸，比超市同规格鱼丸便宜多了，超值，推荐！,2021-09-16 09:22:48,生鲜,丸子很好吃，夹心很美味。满一大包，份量很足，京东物流就是快，而且生鲜还有专门配送箱配送，保障了不会融化。真的是有心了。当天到了就下锅煮粉面吃了，煮汤味道很鲜，一起买的还有其他丸子，搭配一起煮，味道多样化。海欣灌汤福建鱼丸包装精美，用料考究，每个鱼丸都是真材实料制作，个都挺大，煮好以后咬一口，满嘴香气四溢，汤汁鲜美。丸子我们全家都爱吃，尤其爱吃这个品牌的，这家的丸子口味我几乎都买过了，丸子柔韧嫩滑，个大只饱满，可单吃可做菜可打边炉，都好吃！好煮饱腹口味好！每次有特惠我都要买上好几大包。非常好吃的包心鱼丸，个头很大，皮有弹性，自然的鱼香，易熟，有嚼劲，里面塞的馅料很好吃，食材新鲜可口，灌汤的，咸度正好，应该能适应大部分人的口味。一大袋量还是很多的，煮熟了特别显大，建议别煮太多，不然吃不了。鱼丸拿到手还有冰，非常新鲜。灌汤鱼丸是1千克每袋的，鱼丸个头均匀大小适中，各种做法都适合，并且色泽洁白，皮薄馅大，肉馅鲜嫩，汤汁爽口，外皮Q弹。性价比很高的鱼丸，比超市同规格鱼丸便宜多了，超值，推荐！,丸子 好吃 夹心 美味 满一 大包 份量 很足 京东 物流 生鲜 配送 配送 保障 融化 真的 有心 当天 下锅 粉面 煮汤 味道 很鲜 丸子 搭配 味道 多样化 海欣 福建 鱼丸 包装 精美 用料 考究 鱼丸 真材实料 制作 咬一口 满嘴 香气 四溢 汤汁 鲜美 丸子 全家 品牌 这家 丸子 口味 丸子 柔韧 饱满 可单 做菜 边炉 好吃 饱腹 口味 每次 特惠 好几 大包 好吃 包心 鱼丸 个头 很大 皮有 弹性 自然 鱼香 易熟 馅料 好吃 食材 新鲜 可口 灌汤 咸度 正好 大部分 口味 一大 袋量 煮熟 特别 显大 建议 鱼丸 拿到 新鲜 灌汤 鱼丸 千克 每袋 鱼丸 个头 均匀 大小 适中 做法 适合 色泽 洁白 皮薄 肉馅 鲜嫩 汤汁 爽口 外皮 性价比 鱼丸 超市 规格 鱼丸 便宜 超值 推荐
16257376932,0,海欣正宗爆汁小鱼丸很好吃，送货超及时，快递送来的时候冰都没化。打开以后是弹性很好的鱼丸，和鱼丸一起煮了米粉，汤头鲜甜，赞不绝口。特别好吃，煮面做汤涮火锅都适合，真材实料看得见，味道非常不错！丸子特别筋道！咬起来口感特别棒！味道很鲜美！还买了些牛肉丸子味道也是不错的！果断店铺关注以后还会回购的！日期也是挺不错的！一直都很喜欢吃鱼丸，这家鱼丸真的是鱼做的，特别的Q弹，我自己的做法是直接用水来煮。味道也特别的丰富。原汁原味大海的味道。很好吃的鱼丸，牛肉丸和鱼丸！这次买了好多包，在家里吃火锅煮面都可以放几个，非常好的搭配。 味道很好，口感也我吃过那么多牌子最好的一个。 吃着没有觉得都是淀粉而已， 丸子里都是真材实料，真不错！很好吃，确实和一般的丸子不一样，里面真的有鱼肉！和实体店一样，颜色正，是我喜欢的值得购买的产品！12、安维（Anwell）美国原味薯条 400g 薯条冷冻 方便速食,2021-09-06 00:46:15,生鲜,海欣正宗爆汁小鱼丸很好吃，送货超及时，快递送来的时候冰都没化。打开以后是弹性很好的鱼丸，和鱼丸一起煮了米粉，汤头鲜甜，赞不绝口。特别好吃，煮面做汤涮火锅都适合，真材实料看得见，味道非常不错！丸子特别筋道！咬起来口感特别棒！味道很鲜美！还买了些牛肉丸子味道也是不错的！果断店铺关注以后还会回购的！日期也是挺不错的！一直都很喜欢吃鱼丸，这家鱼丸真的是鱼做的，特别的Q弹，我自己的做法是直接用水来煮。味道也特别的丰富。原汁原味大海的味道。很好吃的鱼丸，牛肉丸和鱼丸！这次买了好多包，在家里吃火锅煮面都可以放几个，非常好的搭配。 味道很好，口感也我吃过那么多牌子最好的一个。 吃着没有觉得都是淀粉而已， 丸子里都是真材实料，真不错！很好吃，确实和一般的丸子不一样，里面真的有鱼肉！和实体店一样，颜色正，是我喜欢的值得购买的产品！12、安维（Anwel）美国原味薯条 40g 薯条冷冻 方便速食,海欣 正宗 爆汁 鱼丸 好吃 送货 快递 送来 冰都 没化 打开 弹性 鱼丸 鱼丸 米粉 汤头 鲜甜 赞不绝口 特别 好吃 煮面 火锅 适合 真材实料 看得见 味道 不错 丸子 特别 筋道 咬起来 口感 特别 味道 鲜美 牛肉 丸子 味道 不错 果断 店铺 关注 还会 回购 日期 挺不错 喜欢 鱼丸 这家 鱼丸 真的 特别 做法 用水 味道 特别 原汁原味 大海 味道 好吃 鱼丸 牛肉丸 鱼丸 好多 家里 吃火锅 煮面 几个 搭配 味道 口感 牌子 淀粉 丸子 真材实料 真不错 好吃 确实 丸子 真的 鱼肉 实体店 颜色 喜欢 值得 购买 产品 安维 美国 原味 薯条 薯条 冷冻 速食
16254530870,1,海欣的牌子果然不负众望，很鲜，很香，吃起来有点弹弹的感觉，用来做火锅，麻辣香锅，麻辣烫都是非常好的食材。这鱼豆腐好吃Q弹啊！味道鲜美，没有最可贵的是没有添加剂味道！都是鱼肉味道，这已经很好了！海欣大品牌，京东自营有保证！火锅首选！海欣鱼豆腐很有嚼劲，香香的，弹弹的，真的很好吃！就是现在的价格比以前贵了，但是比市场上那种按斤称的散装鱼豆腐好吃多了！每次吃火锅、方便面、烧烤都离不开海欣鱼豆腐！喜欢在京东生鲜买这些冷冻食品，送货到家，安心方便！海欣的鱼豆腐质量是非常好的，个头比较大，味道比较浓，搞活动，打折减券，买了四袋都吃光了，后来又买了五斤装的，因为儿子非常喜欢吃这块鱼豆腐，不论是涮锅泡面还是拌火鸡面，鱼豆腐用途非常大，儿子非常喜欢这个牌子口味的鱼豆腐，所以就囤了一些！,2021-09-05 13:29:03,生鲜,海欣的牌子果然不负众望，很鲜，很香，吃起来有点弹的感觉，用来做火锅，麻辣香锅，麻辣烫都是非常好的食材。这鱼豆腐好吃Q弹啊！味道鲜美，没有最可贵的是没有添加剂味道！都是鱼肉味道，这已经很好了！海欣大品牌，京东自营有保证！火锅首选！海欣鱼豆腐很有嚼劲，香的，弹的，真的很好吃！就是现在的价格比以前贵了，但是比市场上那种按斤称的散装鱼豆腐好吃多了！每次吃火锅、方便面、烧烤都离不开海欣鱼豆腐！喜欢在京东生鲜买这些冷冻食品，送货到家，安心方便！海欣的鱼豆腐质量是非常好的，个头比较大，味道比较浓，搞活动，打折减券，买了四袋都吃光了，后来又买了五斤装的，因为儿子非常喜欢吃这块鱼豆腐，不论是涮锅泡面还是拌火鸡面，鱼豆腐用途非常大，儿子非常喜欢这个牌子口味的鱼豆腐，所以就囤了一些！,海欣 牌子 不负众望 很鲜 很香 感觉 火锅 麻辣 香锅 麻辣烫 食材 这鱼 豆腐 好吃 味道鲜美 可贵 添加剂 味道 鱼肉 味道 海欣大 品牌 京东 自营 保证 火锅 首选 海欣鱼 豆腐 真的 好吃 价格比 市场 那种 按斤 散装 豆腐 好吃 每次 吃火锅 方便面 烧烤 离不开 海欣鱼 豆腐 喜欢 京东 生鲜 冷冻 食品 送货到 安心 海欣 豆腐 质量 个头 味道 活动 打折 减券 四袋 吃光 五斤 儿子 喜欢 这块 豆腐 不论是 涮锅 泡面 火鸡 豆腐 用途 儿子 喜欢 牌子 口味 豆腐
17186913543,0,海欣灌汤福建鱼丸包装精美，用料考究，每个鱼丸都是真材实料制作，个个都挺大，煮好以后咬一口，满嘴香气四溢，汤汁鲜美，丸子很好吃，夹心很美味。满满一大包，份量很足，京东物流就是快，而且生鲜还有专门配送箱配送，保障了不会融化。真的是有心了。当天到了就下锅煮粉面吃了，煮汤味道很鲜，一起买的还有其他丸子，搭配一起煮，味道多样化。家里吃的丸子都是京东自营买的，觉得品质有保证，海欣的鱼丸不错，吃面，做汤放里面都好吃很鲜，操作方便，非常喜欢。鱼丸拿到手还有冰，非常新鲜。灌汤鱼丸是1千克每袋的，鱼丸个头均匀大小适中，各种做法都适合，并且色泽洁白，皮薄馅大，肉馅鲜嫩，汤汁爽口，外皮Q弹。非常好吃的包心鱼丸，个头很大，皮有弹性，自然的鱼香，易熟，有嚼劲，里面塞的馅料很好吃，食材新鲜可口，灌汤的，咸度正好，应该能适应大部分人的口味。一大袋量还是很多的，煮熟了特别显大，建议别煮太多，不然吃不了。性价比很高的鱼丸，比超市同规格鱼丸便宜多了，超值，推荐！京东送货很快，包装仔细，，快递小哥直接背着保温箱送来的，服务还是一如既往的好，很满意！,2022-02-27 21:52:25,生鲜,海欣灌汤福建鱼丸包装精美，用料考究，每个鱼丸都是真材实料制作，个都挺大，煮好以后咬一口，满嘴香气四溢，汤汁鲜美，丸子很好吃，夹心很美味。满一大包，份量很足，京东物流就是快，而且生鲜还有专门配送箱配送，保障了不会融化。真的是有心了。当天到了就下锅煮粉面吃了，煮汤味道很鲜，一起买的还有其他丸子，搭配一起煮，味道多样化。家里吃的丸子都是京东自营买的，觉得品质有保证，海欣的鱼丸不错，吃面，做汤放里面都好吃很鲜，操作方便，非常喜欢。鱼丸拿到手还有冰，非常新鲜。灌汤鱼丸是1千克每袋的，鱼丸个头均匀大小适中，各种做法都适合，并且色泽洁白，皮薄馅大，肉馅鲜嫩，汤汁爽口，外皮Q弹。非常好吃的包心鱼丸，个头很大，皮有弹性，自然的鱼香，易熟，有嚼劲，里面塞的馅料很好吃，食材新鲜可口，灌汤的，咸度正好，应该能适应大部分人的口味。一大袋量还是很多的，煮熟了特别显大，建议别煮太多，不然吃不了。性价比很高的鱼丸，比超市同规格鱼丸便宜多了，超值，推荐！京东送货很快，包装仔细，快递小哥直接背着保温箱送来的，服务还是一如既往的好，很满意！,海欣 福建 鱼丸 包装 精美 用料 考究 鱼丸 真材实料 制作 咬一口 满嘴 香气 四溢 汤汁 鲜美 丸子 好吃 夹心 美味 满一 大包 份量 很足 京东 物流 生鲜 配送 配送 保障 融化 真的 有心 当天 下锅 粉面 煮汤 味道 很鲜 丸子 搭配 味道 多样化 家里 丸子 京东 自营 品质 保证 海欣 鱼丸 不错 吃面 汤放 好吃 很鲜 操作 喜欢 鱼丸 拿到 新鲜 灌汤 鱼丸 千克 每袋 鱼丸 个头 均匀 大小 适中 做法 适合 色泽 洁白 皮薄 肉馅 鲜嫩 汤汁 爽口 外皮 好吃 包心 鱼丸 个头 很大 皮有 弹性 自然 鱼香 易熟 馅料 好吃 食材 新鲜 可口 灌汤 咸度 正好 大部分 口味 一大 袋量 煮熟 特别 显大 建议 性价比 鱼丸 超市 规格 鱼丸 便宜 超值 推荐 京东 送货 很快 包装 仔细 快递 小哥 背着 保温箱 送来 服务 一如既往 满意
