id,score,content,creationTime,class,物流信息,分词
19053975309,1,早上下单，晚上送的。京东物流还是很赞的。但是生产日期已经过了大半，是怎么回事儿？像我这种喜欢自助购，我不喜欢麻烦客服的，一次性买了四罐，这是吃到哭啊。临期食品最好在标题标注一下。,2023-04-25 08:41:45,生鲜,早上下单，晚上送的。京东物流还是很赞的。但是生产日期已经过了大半，是怎么回事儿？像我这种喜欢自助购，我不喜欢麻烦客服的，一次性买了四罐，这是吃到哭啊。临期食品最好在标题标注一下。,早上 下单 晚上 京东 物流 很赞 生产日期 大半 回事儿 喜欢 自助 喜欢 麻烦 客服 一次性 四罐 临期 食品 标题 标注
19019797777,1,第一次是在~上买的口感好极了入口满满的奶香就又京东下单了一个结果很失望首先这个都是3/16号的日期了我4/12号好像收到快递很快就一天。这个吃着满嘴黏腻不像上次纯纯的奶味这个非常浅要仔细去感受才能感受到奶味儿每次挖都拉丝拉得很长（其它家买没有，像豆腐块不拖泥带水的）我都感觉是不是放胶了如果不是第一次买的非常好肯定再也不会买这个品牌。不知道是日期太久还是咋回事总之这次真的一般。淡淡的忧伤本来图个快但是感觉不好但是看商家不是直营店嘛不应该啊一头雾水非常无语,2023-04-13 21:35:55,生鲜,第一次是在~上买的口感好极了入口满的奶香就又京东下单了一个结果很失望首先这个都是3/16号的日期了我4/12号好像收到快递很快就一天。这个吃着满嘴黏腻不像上次纯的奶味这个非常浅要仔细去感受才能感受到奶味儿每次挖都拉丝拉得很长（其它家买没有，像豆腐块不拖泥带水的）我都感觉是不是放胶了如果不是第一次买的非常好肯定再也不会买这个品牌。不知道是日期太久还是咋回事总之这次真的一般。淡的忧伤本来图个快但是感觉不好但是看商家不是直营店嘛不应该啊一头雾水非常无语,第一次 口感 好极了 入口 奶香 京东 下单 失望 日期 好像 收到 快递 很快 满嘴 黏腻 上次 奶味 浅要 仔细 感受 感受 到奶 味儿 每次 拉丝 拉得 很长 家买 豆腐块 拖泥带水 感觉 放胶 第一次 肯定 再也不会 品牌 日期 太久 回事 真的 忧伤 本来 图个 感觉不好 商家 直营店 一头雾水
18989677557,1,正常是像奶豆腐型的酸奶，不知道是运输的问题还是仓库的问题，我打开的时候已经不成型了，没有原本的味道，网上的酸奶买的时候真要慎重,2023-04-04 23:09:21,生鲜,正常是像奶豆腐型的酸奶，不知道是运输的问题还是仓库的问题，我打开的时候已经不成型了，没有原本的味道，网上的酸奶买的时候真要慎重,奶豆腐 酸奶 运输 仓库 打开 成型 原本 味道 网上 酸奶 慎重
18974569603,1,没有快递盒，没有冰袋快递配送3天,2023-04-01 17:58:19,生鲜,没有快递盒，没有冰袋快递配送3天,快递 冰袋 快递 配送
18941293761,1,"酸奶当天晚上收到，打开包装发现从顶到底裂缝，打电话向快递员说明后，申请售后流程，直接就放门口丢掉了，然后第二天京东客服要我把包装和破损的酸奶寄回处理，否则不进行售后处理。
什么辣鸡售后态度。",2023-03-25 19:06:31,生鲜,酸奶当天晚上收到，打开包装发现从顶到底裂缝，打电话向快递员说明后，申请售后流程，直接就放门口丢掉了，然后第二天京东客服要我把包装和破损的酸奶寄回处理，否则不进行售后处理。什么辣鸡售后态度。,酸奶 当天 晚上 收到 打开 包装 发现 从顶 裂缝 打电话 快递 申请 售后 流程 门口 丢掉 第二天 京东 客服 包装 破损 酸奶 寄回 售后 辣鸡 售后 态度
18823075638,1,酸奶生产日期不新鲜，是2月9号的，过了半个月了。没有人工客服处理问题，就智能回复我：意思是&ldquo;我们的产品没过期&rdquo;。为了不过期，两大罐子我得上顿喝完下顿喝。选择生鲜当日配送，根本没意义，还不如快递送的呢！差评,2023-02-24 13:13:02,生鲜,酸奶生产日期不新鲜，是2月9号的，过了半个月了。没有人工客服处理问题，就智能回复我：意思是&ldquo;我们的产品没过期&rdquo;。为了不过期，两大罐子我得上顿喝完下顿喝。选择生鲜当日配送，根本没意义，还不如快递送的呢！差评,酸奶 生产日期 新鲜 半个 人工 客服 智能 回复 产品 过期 两大 罐子 我得 上顿 喝完 下顿 选择 生鲜 当日 配送 意义 快递 差评
18775873709,1,JD0097165069384 无冷链运输 套个塑料袋就送过来了！,2023-02-11 22:39:49,生鲜,JD097165069384 无冷链运输 套个塑料袋就送过来了！,无冷链 运输 套个 塑料袋 送过来
18596817017,1,"差评给京东商城，6日下单时提示10号送到，第二天没有通知的情况下悄悄更改为11送到，疫情原因我理解，不追究。到12日还没发货，联系京东客服投诉，只说能发的时候就发货，尽快催办，结果第二天直接改到15号送到。之后每天联系客服，都提示客服忙接不通！好不容易联系上客服，问题反映了，谁说跟领导协商，24小时内回复，可一直无人回复，最后22日才送达。这种傲慢的态度忍无可忍！疫情原因没人送货可理解，你告诉我真是的不发货原因，有那么难吗？京东客服回答问题机械化，培训的话术很无聊！尽量不在京东购物。
酸奶本身很好！",2022-12-23 21:57:58,生鲜,差评给京东商城，6日下单时提示10号送到，第二天没有通知的情况下悄更改为1送到，疫情原因我理解，不追究。到12日还没发货，联系京东客服投诉，只说能发的时候就发货，尽快催办，结果第二天直接改到15号送到。之后每天联系客服，都提示客服忙接不通！好不容易联系上客服，问题反映了，谁说跟领导协商，24小时内回复，可一直无人回复，最后2日才送达。这种傲慢的态度忍无可忍！疫情原因没人送货可理解，你告诉我真是的不发货原因，有那么难吗？京东客服回答问题机械化，培训的话术很无聊！尽量不在京东购物。酸奶本身很好！,差评 京东 商城 下单 提示 送到 第二天 通知 情况 下悄 改为 送到 疫情 原因 理解 追究 发货 京东 客服 投诉 能发 发货 催办 第二天 改到 送到 客服 提示 客服 忙接 不通 好不容易 客服 领导 协商 小时 回复 无人 回复 日才 送达 傲慢 态度 忍无可忍 疫情 原因 送货 理解 告诉 发货 原因 京东 客服 回答 机械化 培训 无聊 京东 购物 酸奶
18564829593,1,东西不错，就是在快递站没人送，自己去翻出来找到的。给予差评。店铺客服机械回答问题，让我找京东客服，你就是京东自营店，还分京东客服非京东客服，很不满意的一次购物。希望今后改进。,2022-12-18 21:42:40,生鲜,东西不错，就是在快递站没人送，自己去翻出来找到的。给予差评。店铺客服机械回答问题，让我找京东客服，你就是京东自营店，还分京东客服非京东客服，很不满意的一次购物。希望今后改进。,东西 不错 快递 没人 翻出来 找到 给予 差评 店铺 客服 机械 回答 京东 客服 京东 自营 还分 京东 客服 京东 客服 满意 购物 希望 改进
18538996733,1,"生鲜的东西直接没特别包装，也没有优先派送。早上八点开始显示配送，中午一点才送到!全程没有冷链，可想而知!
快递小哥也不容易，不是他们的问题。但是配送服务一定要跟上，既然要做生鲜的生意，配送一定要及时!",2022-12-15 13:06:28,生鲜,生鲜的东西直接没特别包装，也没有优先派送。早上八点开始显示配送，中午一点才送到!全程没有冷链，可想而知!快递小哥也不容易，不是他们的问题。但是配送服务一定要跟上，既然要做生鲜的生意，配送一定要及时!,生鲜 东西 特别 包装 优先 派送 早上 八点 显示 配送 中午 一点 送到 全程 冷链 可想而知 快递 小哥 配送 服务 跟上 生鲜 生意 配送
18500717925,1,就用图片这样一个京东塑料袋装着，连个纸盒都没有，然后发现桶底部裂了，袋子里也是流出的酸奶，客服说是物流的原因，让顾客自己联系京东物流,2022-12-09 18:31:18,生鲜,就用图片这样一个京东塑料袋装着，连个纸盒都没有，然后发现桶底部裂了，袋子里也是流出的酸奶，客服说是物流的原因，让顾客自己联系京东物流,图片 京东 塑料袋 装着 纸盒 发现 底部 袋子 流出 酸奶 客服 物流 原因 顾客 京东 物流
18361969967,1,就塑料袋快递过来的，根本没有包装和冷链。,2022-11-10 15:24:20,生鲜,就塑料袋快递过来的，根本没有包装和冷链。,塑料袋 快递 包装 冷链
18336854638,1,"这个包装的商品，希望京东能给个说法！
超出心理预期的差！！！
是商家就这样包装发货，还是快递自行拆过包装？
京东现在都是这样的服务？？？
全当花钱上香了。",2022-11-05 20:53:12,生鲜,这个包装的商品，希望京东能给个说法！超出心理预期的差！是商家就这样包装发货，还是快递自行拆过包装？京东现在都是这样的服务？全当花钱上香了。,包装 商品 希望 京东 说法 超出 心理 预期 商家 包装 发货 快递 自行 拆过 包装 京东 服务 花钱 上香
18289149342,1,买了很多次，最近两次感觉不好，酸奶打开后都是上半部分呈糊状，不像前几次的豆腐块状，下半部分稍好一点。不知道是生产问题还是运输问题，总之不正常，所以不爽！,2022-10-27 16:05:05,生鲜,买了很多次，最近两次感觉不好，酸奶打开后都是上半部分呈糊状，不像前几次的豆腐块状，下半部分稍好一点。不知道是生产问题还是运输问题，总之不正常，所以不爽！,两次 感觉不好 酸奶 打开 上半 糊状 不像 前几次 豆腐块 一点 生产 运输 不爽
18238598129,1,不好吃 有明胶  一颗星给快递员的,2022-10-19 20:05:46,生鲜,不好吃 有明胶 一颗星给快递员的,好吃 明胶 一颗 星给 快递
18116819156,1,本来保质期28天，快递到手离保质期还有一个礼拜左右，这样怎么能喝的完，赶着时间喝吗，快过期的奶还哪有新鲜奶？第一次差评，真的很无语,2022-09-25 15:38:56,生鲜,本来保质期28天，快递到手离保质期还有一个礼拜左右，这样怎么能喝的完，赶着时间喝吗，快过期的奶还哪有新鲜奶？第一次差评，真的很无语,本来 保质期 快递 到手 保质期 礼拜 赶着 时间 过期 鲜奶 第一次 差评 真的 很无语
18087042810,1,9/3日生产的酸奶，9/19日开罐准备吃，发现里面有一圈死掉的蛆，在密封圈靠内的位置。绝对不是运输途中造成的，因为按照蝇卵孵化的条件来说，需要15-40度的温度，3小时以上才会孵化，东西来的时候是放在保温箱内的，我收到后也立即放冰箱了，不可能有苍蝇产卵并孵化。也不可能是仓储过程中造成。因为死蛆是在密封圈内侧，苍蝇不可能在装罐密封后还能钻到罐子里去产卵。所以肯定是生产过程中出现的问题。最后是给我全额退款，但是我还是要曝光一下，太不负责了，无良商家。,2022-09-19 22:28:05,生鲜,9/3日生产的酸奶，9/19日开罐准备吃，发现里面有一圈死掉的蛆，在密封圈靠内的位置。绝对不是运输途中造成的，因为按照蝇卵孵化的条件来说，需要15-40度的温度，3小时以上才会孵化，东西来的时候是放在保温箱内的，我收到后也立即放冰箱了，不可能有苍蝇产卵并孵化。也不可能是仓储过程中造成。因为死蛆是在密封圈内侧，苍蝇不可能在装罐密封后还能钻到罐子里去产卵。所以肯定是生产过程中出现的问题。最后是给我全额退款，但是我还是要曝光一下，太不负责了，无良商家。,生产 酸奶 开罐 发现 一圈 密封圈 位置 运输 途中 孵化 条件 温度 小时 孵化 东西 放在 保温箱 收到 冰箱 苍蝇 产卵 孵化 仓储 过程 密封圈 内侧 苍蝇 装罐 密封 罐子 产卵 肯定 生产 过程 全额 退款 曝光 负责 无良 商家
17927669983,1,"说实话 就算有优惠券 京东卖的也比淘宝和拼多多贵 如果不是担心疫情期间快递时效问题 肯定不会京东买
多花钱的结果却是日期极差 TB拼多多一般到手也才生产出来一周 京东呢 买了三次 一次比一次差 今天到手的这两桶整整14天 总共21天的保质期 过去三分之二了 
商家没错 确实在效期呢 但是我怎么就觉得这是高价清货呢 商家说采购送到京东需要时间 京东再到我们手里 都是需要时间的 那为什么其他电商的日期就很新鲜呢 
下单三次了 前两次都是正好10天 我也不说什么了 今天来一个14天的 一般这些东西离效期不足7天才能售后理赔 我这正好卡在时间点上 商家太精明了 我多少有种赚**钱的感觉
哦对了 商家说 我可以问客服生产日期 那么为什么商家每天就不能及时主动更新信息呢 在标题里面或者详情里都可以啦 结果现在成了我不问 所以你们也不说 所以这事不赖你们 
最后找了京东 补贴了一张20的生鲜券 但是我心里清楚 这是个套 我要想把那20花了 肯定还得再搭钱 而且一桶酸奶小40 赔我20券 我还是亏 
最后劝商家一句 做生意还是别玩心眼了
不知道这个评价能不能发出来 等着看吧",2022-08-18 13:00:20,生鲜,说实话 就算有优惠券 京东卖的也比淘宝和拼多贵 如果不是担心疫情期间快递时效问题 肯定不会京东买多花钱的结果却是日期极差 TB拼多一般到手也才生产出来一周 京东呢 买了三次 一次比一次差 今天到手的这两桶整14天 总共21天的保质期 过去三分之二了 商家没错 确实在效期呢 但是我怎么就觉得这是高价清货呢 商家说采购送到京东需要时间 京东再到我们手里 都是需要时间的 那为什么其他电商的日期就很新鲜呢 下单三次了 前两次都是正好10天 我也不说什么了 今天来一个14天的 一般这些东西离效期不足7天才能售后理赔 我这正好卡在时间点上 商家太精明了 我多少有种赚*钱的感觉哦对了 商家说 我可以问客服生产日期 那么为什么商家每天就不能及时主动更新信息呢 在标题里面或者详情里都可以啦 结果现在成了我不问 所以你们也不说 所以这事不赖你们 最后找了京东 补贴了一张20的生鲜券 但是我心里清楚 这是个套 我要想把那20花了 肯定还得再搭钱 而且一桶酸奶小40 赔我20券 我还是亏 最后劝商家一句 做生意还是别玩心眼了不知道这个评价能不能发出来 等着看吧,说实话 优惠券 京东 淘宝 拼多贵 担心 疫情 期间 快递 时效 肯定 京东 多花钱 却是 日期 极差 拼多 到手 生产 一周 京东 三次 到手 两桶 总共 保质期 三分之二 商家 没错 确实 效期 这是 高价 清货 商家 采购 送到 京东 时间 京东 手里 时间 电商 日期 新鲜 下单 三次 两次 正好 东西 效期 售后 理赔 正好 时间 点上 商家 精明 有种 感觉 商家 客服 生产日期 商家 主动 更新 信息 标题 详情 不赖 京东 补贴 一张 生鲜 我要 肯定 一桶 酸奶 商家 一句 做生意 别玩 心眼 评价 发出 看吧
16789034253,1,送货安装：安装工说京东空调没有保障,2021-12-09 14:09:57,家电,送货安装：安装工说京东空调没有保障,送货 安装 安装工 京东 空调 保障
17621273855,1,快递员恶意点退货，约了四五次时间都没配送且未提前说,2022-06-12 12:31:48,家电,快递员恶意点退货，约了四五次时间都没配送且未提前说,快递 恶意 退货 四五次 时间 配送 提前
18021204794,1,送货服务，上门安装服务周到,2022-09-05 21:53:39,家电,送货服务，上门安装服务周到,送货 服务 上门 安装 服务周到
18020993391,1,物流很好，上门安装服务也很快,2022-09-05 21:09:06,家电,物流很好，上门安装服务也很快,物流 上门 安装 服务 很快
17898113328,1,物流调度态度差 强制更改送货时间 购物体验差,2022-08-11 12:01:08,家电,物流调度态度差 强制更改送货时间 购物体验差,物流 调度 态度 强制 更改 送货 时间 购物 体验
17898383885,1,还未安装，安装用后再评！快递小哥哥服务周到，还给送上二、三楼???,2022-08-11 13:25:15,家电,还未安装，安装用后再评！快递小哥服务周到，还给送上二、三楼?,安装 安装 用后 再评 快递 小哥 服务周到 还给 送上 三楼
17898371170,1,还未安装，用后再评，快递小哥服务周到，还给送上二、三楼,2022-08-11 13:22:21,家电,还未安装，用后再评，快递小哥服务周到，还给送上二、三楼,安装 用后 再评 快递 小哥 服务周到 还给 送上 三楼
17834215463,1,送货一周了也不安排人员安装客服也不回复,2022-07-27 13:35:11,家电,送货一周了也不安排人员安装客服也不回复,送货 一周 安排 人员 安装 客服 回复
16339407779,1,送货安装：送货到时挺快的，安装售后就一踏糊涂了，不会主动联系安装时间，电话联系了还说只管销售和送货，那要售后服务干嘛呢？好好向格力学习一下吧！,2021-09-21 12:01:48,家电,送货安装：送货到时挺快的，安装售后就一踏糊涂了，不会主动联系安装时间，电话联系了还说只管销售和送货，那要售后服务干嘛呢？好向格力学习一下吧！,送货 安装 送货到 挺快 安装 售后 一踏 糊涂 主动 安装时间 电话 只管 销售 送货 那要 售后服务 干嘛 格力 学习
17903880047,1,送货速度还可以，预约安装太慢了，到货了几天都不安装。,2022-08-12 20:35:44,家电,送货速度还可以，预约安装太慢了，到货了几天都不安装。,送货 速度 预约 安装 太慢 到货 几天 安装
16648600848,1,空调到货很快。物流很好，双十一也没耽误送货，。。。。可是。。空调没多少钱，安装费收了。。四  百。。多。。。。。。。。。差评,2021-11-15 12:53:20,家电,空调到货很快。物流很好，双十一也没耽误送货，。可是。空调没多少钱，安装费收了。四 百。多。差评,空调 到货 很快 物流 双十 耽误 送货 空调 安装费 差评
17427996006,1,"冷暖效果：冷效果差
静音效果：好
送货安装：师傅不错好评",2022-04-29 21:55:10,家电,冷暖效果：冷效果差静音效果：好送货安装：师傅不错好评,冷暖 效果 效果 静音 效果 送货 安装 师傅 不错 好评
17725820720,1,送货安装：售后服务慢，等到现在也没人来安装，询问客服一直是自动回复,2022-07-02 07:59:11,家电,送货安装：售后服务慢，等到现在也没人来安装，询问客服一直是自动回复,送货 安装 售后服务 没人来 安装 询问 客服 自动 回复
17669167253,1,说的618特惠，送货不准时，后期安装费也是我自己承担，跟实体店活动价一样了,2022-06-20 19:19:06,家电,说的618特惠，送货不准时，后期安装费也是我自己承担，跟实体店活动价一样了,特惠 送货 不准 后期 安装费 承担 实体店 活动
17619884531,1,送货安装：送到手十天没有人联系我安装，问客服说是会有人联系我的，白白等了十天,2022-06-12 04:45:00,家电,送货安装：送到手十天没有人联系我安装，问客服说是会有人联系我的，白等了十天,送货 安装 送到 十天 安装 客服 有人 白等 十天
16599913378,1,双十一付定金买的 10月31号下单 11月2号就收到货了 快递速度不错 货到家后很快就有人跟你联系安装 而且安装师傅态度好 安装的也挺漂亮 安装时所有要我付款的配件的价格也一一的给讲的很清楚 安装完后也试了机 就是这个京东客服这次居然跟我说这款空调不享受国家的节能减排的政策 还说没介绍有这活动就不享受 我就想问问你是不是应该相应国家政策 而不是和国家政策背道而驰,2021-11-08 15:44:58,家电,双十一付定金买的 10月31号下单 1月2号就收到货了 快递速度不错 货到家后很快就有人跟你联系安装 而且安装师傅态度好 安装的也挺漂亮 安装时所有要我付款的配件的价格也一的给讲的很清楚 安装完后也试了机 就是这个京东客服这次居然跟我说这款空调不享受国家的节能减排的政策 还说没介绍有这活动就不享受 我就想问你是不是应该相应国家政策 而不是和国家政策背道而驰,双十 付定金 下单 收到 快递 速度 不错 货到 家后 很快 有人 安装 安装 师傅 态度 安装 漂亮 安装 付款 配件 价格 安装 完后 京东 客服 这款 空调 享受 国家 节能 减排 政策 介绍 活动 享受 国家 政策 国家 政策 背道而驰
17759019630,1,可以换就换一家吧，三台空调22天到货，催商家商家说物流,2022-07-09 21:55:38,家电,可以换就换一家吧，三台空调2天到货，催商家说物流,一家 三台 空调 到货 商家 物流
17457387367,1,送货安装：安装的时候还需要买家给安装师傅购买安装工具，这个就是你们提供的免费安装？,2022-05-07 07:53:47,家电,送货安装：安装的时候还需要买家给安装师傅购买安装工具，这个就是你们提供的免费安装？,送货 安装 安装 买家 安装 师傅 购买 安装 工具 提供 免费 安装
17690937758,1,送货安装：从买来到现在已经有一个星期多 还有没安装我也不知道怎么回事 一会今天装一会明天装 难道要装到过年?吗？,2022-06-24 17:18:43,家电,送货安装：从买来到现在已经有一个星期多 还有没安装我也不知道怎么回事 一会今天装一会明天装 难道要装到过年?吗？,送货 安装 来到 星期 安装 怎么回事 一会 一会 明天 装到 过年
18346559078,1,包装挺好的，师傅送货及时。打开来看下从外观看整体效果不错，刚到货过几天联系师傅安装，美的一直都是大品牌，期待效果。,2022-11-07 16:25:13,家电,包装挺好的，师傅送货及时。打开来看下从外观看整体效果不错，刚到货过几天联系师傅安装，美的一直都是大品牌，期待效果。,包装 师傅 送货 打开 观看 整体 效果 不错 到货 几天 师傅 安装 美的 品牌 期待 效果
17831017839,1,物流慢。。安装慢。。就是一个字。。慢。。自己喊人安装不保修。。必须他们自己人安装。。就一个字。。差,2022-07-26 18:59:44,家电,物流慢。安装慢。就是一个字。慢。自己喊人安装不保修。必须他们自己人安装。就一个字。差,物流 安装 喊人 安装 保修 安装
17917359907,1,"静音效果：挺好的
冷暖效果：也不错
送货安装：非常不满意。8月4日早上下单，显示8月7日送货。后被通知北京无货，要到外地调货。之间和客服沟通几次，均被告知不知啥事到货。而且我定的产品被定义为虚拟产品。知道14日商品才送到，耽误了整整一周，太糟心了。",2022-08-15 21:55:36,家电,静音效果：挺好的冷暖效果：也不错送货安装：非常不满意。8月4日早上下单，显示8月7日送货。后被通知北京无货，要到外地调货。之间和客服沟通几次，均被告知不知啥事到货。而且我定的产品被定义为虚拟产品。知道14日商品才送到，耽误了整一周，太糟心了。,静音 效果 冷暖 效果 不错 送货 安装 满意 早上 下单 显示 送货 通知 北京 无货 外地 调货 之间 客服 沟通 几次 告知 不知 啥事 到货 我定 产品 定义 虚拟 产品 商品 送到 耽误 一周 糟心
17667084491,1,安装师傅服务很好，但是对送货很不满意，约好的时间没有来已不打电话，让我在家白白等了一天,2022-06-20 14:21:44,家电,安装师傅服务很好，但是对送货很不满意，约好的时间没有来已不打电话，让我在家白等了一天,安装 师傅 服务 送货 满意 时间 打电话 在家 白等
17637613197,1,质量没问题，就是疫情期间送货安装的问题，客服不提前说明不能安装，后期沟通也是一团糟，天气炎热等不了自己还多花了好几百安装,2022-06-15 13:30:43,家电,质量没问题，就是疫情期间送货安装的问题，客服不提前说明不能安装，后期沟通也是一团糟，天气炎热等不了自己还多花了好几百安装,质量 疫情 期间 送货 安装 客服 提前 安装 后期 沟通 一团糟 天气炎热 多花 好几百 安装
