id,score,content,creationTime,class,物流信息,分词
13271140892,1,之前一直想在京东上面买生鲜。后来抱着试试看的态度买了一两回。还不错，京东冷链运输很好。赶上搞活动价格还很实惠。相信京东，尤其是快递和售后没得说。对于我这种不能经常上街购物的人来说，京东是个很好的选择。京东加油。,2019-09-27 19:57:41,生鲜,之前一直想在京东上面买生鲜。后来抱着试看的态度买了一两回。还不错，京东冷链运输很好。赶上搞活动价格还很实惠。相信京东，尤其是快递和售后没得说。对于我这种不能经常上街购物的人来说，京东是个很好的选择。京东加油。,京东 生鲜 试看 态度 一两回 不错 京东 冷链 运输 赶上 活动 价格 实惠 京东 快递 售后 没得说 上街 购物 京东 选择 京东 加油
14980329317,0,非常满意，快递员送到家里，一点没融化，冰冻很好，一下买了很多，都非常满意,2020-11-30 09:54:14,生鲜,非常满意，快递员送到家里，一点没融化，冰冻很好，一下买了很多，都非常满意,满意 快递 送到 家里 一点 融化 冰冻 满意
14839811998,0,宝贝收到几天了，这个品牌的丸子没话说，非常的好吃，日期也是比较的新鲜，包装非常好，拿到手上都是冰冻的，京东物流真的是好，下火锅吃点非常的好啊，挺好煮的，并且也很好吃，这次做活动我买了一大堆，家人朋友都爱吃，下次再来回购,2020-11-04 09:19:48,生鲜,宝贝收到几天了，这个品牌的丸子没话说，非常的好吃，日期也是比较的新鲜，包装非常好，拿到手上都是冰冻的，京东物流真的是好，下火锅吃点非常的好啊，挺好煮的，并且也很好吃，这次做活动我买了一大堆，家人朋友都爱吃，下次再来回购,宝贝 收到 几天 品牌 丸子 没话说 好吃 日期 新鲜 包装 拿到 手上 冰冻 京东 物流 真的 火锅 吃点 好吃 活动 一大堆 家人 朋友 下次 回购
15059229096,0,已经是第二次购买了，包装很卫生，很干净，品牌也是大品牌就能到，物流很给力，两天就能送到，孩子非常的喜欢，怎么办也很喜欢，韩卫国小儿子鱼味儿很浓郁，一直满意的购物希望以后一会儿你都要干，大一点还会来购买的，因为冬天非常喜欢吃火锅，好的。,2020-12-17 14:19:26,生鲜,已经是第二次购买了，包装很卫生，很干净，品牌也是大品牌就能到，物流很给力，两天就能送到，孩子非常的喜欢，怎么办也很喜欢，韩卫国小儿子鱼味儿很浓郁，一直满意的购物希望以后一会儿你都要干，大一点还会来购买的，因为冬天非常喜欢吃火锅，好的。,第二次 购买 包装 卫生 干净 品牌 品牌 物流 两天 送到 孩子 喜欢 喜欢 卫国 小儿子 味儿 浓郁 满意 购物 希望 一会儿 一点 还会来 购买 冬天 喜欢 吃火锅
15047910648,0,这个鱼丸好吃，我是福建人，特别怀念福州鱼丸的味道。网上买不到啊，不过这种鱼丸有家长的味道了。觉得不错，给大家推荐。但要趁着京东活动时再下手购买，否则价格差别还是很大的。送货很快，有冰袋和泡沫箱保存着。全五星好评！,2020-12-15 08:20:56,生鲜,这个鱼丸好吃，我是福建人，特别怀念福州鱼丸的味道。网上买不到啊，不过这种鱼丸有家长的味道了。觉得不错，给大家推荐。但要趁着京东活动时再下手购买，否则价格差别还是很大的。送货很快，有冰袋和泡沫箱保存着。全五星好评！,鱼丸 好吃 福建人 特别 怀念 福州 鱼丸 味道 网上 买不到 鱼丸 家长 味道 不错 推荐 京东 活动 下手 购买 价格 差别 很大 送货 很快 冰袋 泡沫 保存 五星 好评
14893769792,0,回购好多次了，又趁双十一买了好多，冰箱满满的都是，比超市买优惠很多，包装仔细严实，物流很快，服务态度很好，日期新鲜，收到还是冰冰的，不管是平时直接煮着吃，放点紫菜虾皮，还是简单做个火锅，孩子都很喜欢，汤都是鲜的，馅鲜量足，还会回购的～,2020-11-13 13:45:35,生鲜,回购好多次了，又趁双十一买了好多，冰箱满的都是，比超市买优惠很多，包装仔细严实，物流很快，服务态度很好，日期新鲜，收到还是冰的，不管是平时直接煮着吃，放点紫菜虾皮，还是简单做个火锅，孩子都很喜欢，汤都是鲜的，馅鲜量足，还会回购的～,回购 双十 一买 好多 冰箱 超市 优惠 包装 仔细 严实 物流 很快 服务态度 日期 新鲜 收到 平时 紫菜 虾皮 简单 做个 火锅 孩子 喜欢 馅鲜量 还会 回购
13779110247,0,特别好吃哦，这个里面还有陷，特别香，非常喜欢，发货特别快，合适冬天火锅，家里多囤点最近少出门，楼下就是京东物流网点，派件没有问题，少出门在家里也需要补充食物，愿疫情赶紧过去，味道真的不错&hellip;&hellip;建议大家都多囤点哦，少出门少出门吧,2020-02-06 12:11:19,生鲜,特别好吃哦，这个里面还有陷，特别香，非常喜欢，发货特别快，合适冬天火锅，家里多囤点最近少出门，楼下就是京东物流网点，派件没有问题，少出门在家里也需要补充食物，愿疫情赶紧过去，味道真的不错&helip;建议大家都多囤点哦，少出门吧,特别 好吃 特别 喜欢 发货 特别 合适 冬天 火锅 家里 囤点 出门 楼下 京东 物流 网点 派件 出门 家里 补充 食物 疫情 赶紧 味道 真的 不错 建议 囤点 出门
13721426449,1,每次京东活动都会买一堆鱼丸，牛肉丸，羊肉片，羊腿肉，做火锅，烧烤，干锅都非常好吃，这次过年又把冰箱塞满了，活动价物美价廉，以前不是会员，赶上会员活动价，又开通了会员，以后会多多支持，希望京东保持品质，会一直支持，特别说一下，京东物流也是特别好，速度又快，服务又好，支持！,2020-01-14 12:13:31,生鲜,每次京东活动都会买一堆鱼丸，牛肉丸，羊肉片，羊腿肉，做火锅，烧烤，干锅都非常好吃，这次过年又把冰箱塞满了，活动价物美价廉，以前不是会员，赶上会员活动价，又开通了会员，以后会多支持，希望京东保持品质，会一直支持，特别说一下，京东物流也是特别好，速度又快，服务又好，支持！,每次 京东 活动 一堆 鱼丸 牛肉丸 羊肉片 羊腿 火锅 烧烤 干锅 好吃 过年 冰箱 塞满 活动 物美价廉 会员 赶上 会员 活动 开通 会员 会多 支持 希望 京东 品质 支持 特别 京东 物流 特别 速度 服务 支持
13507248741,1,快递很快，第一天下单第二天送到，服务很好，生鲜还可以，和超市差不多，但是送回上门，这点超市比不了，继续购买，日期很新，一直在京东购物，很不错，还可以东北大米吃起来很想，一物美价廉继续购买。，生鲜不错，物美价廉，值得购买,2019-11-22 13:43:52,生鲜,快递很快，第一天下单第二天送到，服务很好，生鲜还可以，和超市差不多，但是送回上门，这点超市比不了，继续购买，日期很新，一直在京东购物，很不错，还可以东北大米吃起来很想，一物美价廉继续购买。，生鲜不错，物美价廉，值得购买,快递 很快 第一天 下单 第二天 送到 服务 生鲜 超市 送回 上门 超市 购买 日期 京东 购物 不错 东北 大米 很想 物美价廉 购买 生鲜 不错 物美价廉 值得 购买
13436889218,0,冬天到了，围着火炉吃火锅，是最好不过的了！拍了好多吃火锅的食材，一大堆。火锅自然少不了丸子，福州鱼丸是我们家孩子大人的最爱。这次拍的是比较小的鱼丸，感觉刚刚好，容易入口些。味道不错。日期也挺新。快递非常棒，快递小哥服务也不错。好评！,2019-11-10 13:16:24,生鲜,冬天到了，围着火炉吃火锅，是最好不过的了！拍了好多吃火锅的食材，一大堆。火锅自然少不了丸子，福州鱼丸是我们家孩子大人的最爱。这次拍的是比较小的鱼丸，感觉刚好，容易入口些。味道不错。日期也挺新。快递非常棒，快递小哥服务也不错。好评！,冬天 围着 火炉 吃火锅 好多 吃火锅 食材 一大堆 火锅 自然 少不了 丸子 福州 鱼丸 孩子 大人 鱼丸 感觉 入口 味道 不错 日期 快递 快递 小哥 服务 不错 好评
13903873459,0,收到海欣 灌汤福州鱼丸 500g 约21个 火锅烧烤食材丸子了，吃火锅已经吃了一袋了，很好吃，里面有肉馅料，家人都一直喜欢吃灌汤的鱼丸，京东上购买也放心，送货也很快，如果有活动就更好了，以后会继续购买的,2020-03-11 21:17:30,生鲜,收到海欣 灌汤福州鱼丸 50g 约21个 火锅烧烤食材丸子了，吃火锅已经吃了一袋了，很好吃，里面有肉馅料，家人都一直喜欢吃灌汤的鱼丸，京东上购买也放心，送货也很快，如果有活动就更好了，以后会继续购买的,收到 海欣 灌汤 福州 鱼丸 火锅 烧烤 食材 丸子 吃火锅 一袋 好吃 肉馅 家人 喜欢 鱼丸 京东 购买 放心 送货 很快 活动 更好 购买
18663802695,1,，送货超及时，快递送来的时候冰都没化。打开以后是弹性很好的鱼丸，和鱼丸一起煮了米粉，汤头鲜甜，赞不绝口。特别好吃，煮面做汤涮火锅都适合，真材实料看得见，味道非常不错！丸子特别筋道！咬起来口感特别棒！味道很鲜美！还买了些牛肉丸子味道也是不错的！果断店铺关注以后还会回购的！日期也是挺不错的！一直都很喜欢吃鱼丸，这家鱼丸真的是鱼做的，特别的Q弹，我自己的做法是直接用水来煮。味道也特别的丰富。原汁原味大海的味道。很好吃的鱼丸，牛肉丸和鱼丸！这次买了好多包，在家里吃火锅煮面都可以放几个，非常好的搭配。 味道很好，,2023-01-07 14:46:07,生鲜,，送货超及时，快递送来的时候冰都没化。打开以后是弹性很好的鱼丸，和鱼丸一起煮了米粉，汤头鲜甜，赞不绝口。特别好吃，煮面做汤涮火锅都适合，真材实料看得见，味道非常不错！丸子特别筋道！咬起来口感特别棒！味道很鲜美！还买了些牛肉丸子味道也是不错的！果断店铺关注以后还会回购的！日期也是挺不错的！一直都很喜欢吃鱼丸，这家鱼丸真的是鱼做的，特别的Q弹，我自己的做法是直接用水来煮。味道也特别的丰富。原汁原味大海的味道。很好吃的鱼丸，牛肉丸和鱼丸！这次买了好多包，在家里吃火锅煮面都可以放几个，非常好的搭配。 味道很好，,送货 快递 送来 冰都 没化 打开 弹性 鱼丸 鱼丸 米粉 汤头 鲜甜 赞不绝口 特别 好吃 煮面 火锅 适合 真材实料 看得见 味道 不错 丸子 特别 筋道 咬起来 口感 特别 味道 鲜美 牛肉 丸子 味道 不错 果断 店铺 关注 还会 回购 日期 挺不错 喜欢 鱼丸 这家 鱼丸 真的 特别 做法 用水 味道 特别 原汁原味 大海 味道 好吃 鱼丸 牛肉丸 鱼丸 好多 家里 吃火锅 煮面 几个 搭配 味道
17970092969,1,质量好，物超所值，真的是物有所值，价格实惠，质量真的不错，与卖家描述的完全一致，收到的时候包装完整，包裹的严严实实没有任何破损，品质依旧，客服服务态度很好，详细的解答了我的问题，卖家很好，对这次购物非常满意，如有需要会回购！！真的很喜欢，完全超出期望值，发货速度非常快，包装非常仔细、严实，物流公司服务态度很好，运送速度很快，很满意的一次购物不得不赞，质量真的好，包装物流也不错。真心喜欢，入手后不会让你后悔的！掌柜态度很专业热情，有问必答，回复也很快，我问了不少问题，他都不觉得烦，都会认真回答我，这点我向掌柜表示由衷的敬意，这样的好掌柜可不多。再说宝贝，正是我需要的，收到的时候包装完整，打开后让我惊喜的是，宝贝比我想象中的还要好！不得不得竖起大拇指掌柜态度很专业热情，有问必答，回复也很快，我问了不少问题，他都不觉得烦，都会认真回答我，这点我向掌柜表示由衷的敬意，这样的好掌柜可不多。再说宝贝，正是我需要的，收到的时候包装完整，打开后让我惊喜的是，宝贝比我想象中的还要好！不得不得竖起大拇指,2022-08-26 23:00:00,生鲜,质量好，物超所值，真的是物有所值，价格实惠，质量真的不错，与卖家描述的完全一致，收到的时候包装完整，包裹的严实没有任何破损，品质依旧，客服务态度很好，详细的解答了我的问题，卖家很好，对这次购物非常满意，如有需要会回购！真的很喜欢，完全超出期望值，发货速度非常快，包装非常仔细、严实，物流公司服务态度很好，运送速度很快，很满意的一次购物不得不赞，质量真的好，包装物流也不错。真心喜欢，入手后不会让你后悔的！掌柜态度很专业热情，有问必答，回复也很快，我问了不少问题，他都不觉得烦，都会认真回答我，这点我向掌柜表示由衷的敬意，这样的好掌柜可不多。再说宝贝，正是我需要的，收到的时候包装完整，打开后让我惊喜的是，宝贝比我想象中的还要好！不得竖起大拇指,质量 物超所值 真的 物有所值 价格 实惠 质量 真的 不错 卖家 描述 完全一致 收到 包装 完整 包裹 严实 破损 品质 依旧 服务态度 详细 解答 卖家 购物 满意 回购 真的 喜欢 超出 期望值 发货 速度 包装 仔细 严实 物流 公司 服务态度 运送 速度 很快 满意 购物 质量 真的 包装 物流 不错 真心 喜欢 入手 后悔 掌柜 态度 专业 热情 有问必答 回复 很快 回答 掌柜 由衷 敬意 掌柜 可不 宝贝 收到 包装 完整 打开 惊喜 宝贝 想象 竖起 大拇指
16486121999,1,包装很好，好吃又卫生，性价比很高，做活动的时候买非常的划算。然后再加1把5块钱的火锅料，自己也可以把火锅打得风生水起。你再怎么能吃？我买的是10多块钱一包！你再怎么也吃不到100块钱，可是你出去外面吃的不怎么样。至少也要100块钱，而且还不卫生。火锅底料一放，水一放，这个肉一刷！完美！吃火锅就买小桌火锅料。特别推荐爽滑牛肉。非常的好。毛肚也是非常的不错。食材新鲜。快递方便。在家吃火锅，就是小卓火锅。这已经是第好几次买了老顾客了。火锅底料非常的好，很辣。送的辣椒油也是非常的棒。三五个朋友一起吃火锅就非常好了。,2021-10-19 16:46:55,生鲜,包装很好，好吃又卫生，性价比很高，做活动的时候买非常的划算。然后再加1把5块钱的火锅料，自己也可以把火锅打得风生水起。你再怎么能吃？我买的是10多块钱一包！你再怎么也吃不到10块钱，可是你出去外面吃的不怎么样。至少也要10块钱，而且还不卫生。火锅底料一放，水一放，这个肉一刷！完美！吃火锅就买小桌火锅料。特别推荐爽滑牛肉。非常的好。毛肚也是非常的不错。食材新鲜。快递方便。在家吃火锅，就是小卓火锅。这已经是第好几次买了老顾客了。火锅底料非常的好，很辣。送的辣椒油也是非常的棒。三五个朋友一起吃火锅就非常好了。,包装 好吃 卫生 性价比 活动 划算 再加 块钱 火锅 火锅 风生水 块钱 一包 不到 块钱 外面 不怎么样 至少 块钱 卫生 火锅 底料 一放 水一放 一刷 完美 吃火锅 小桌 火锅 特别 推荐 爽滑 牛肉 毛肚 不错 食材 新鲜 快递 在家 吃火锅 小卓 火锅 第好 几次 顾客 火锅 底料 很辣 辣椒油 三五个 朋友 吃火锅
13658144992,1,京东生鲜有活动，正好天冷，想吃火锅可以买很多丸子，之前是牛肉卷羊肉卷有活动，买了很多牛肉卷羊肉卷，但是那个时候完全没有什么活动，没什么好买的。花外面不到一顿的钱，能吃两顿火锅，这个性价比挺高的，而且自己在家吃不用计算价格，想吃什么自己买什么也挺好的，很多丸子都没吃过，这次存的活动正好可以多买几种回来，以后觉得好吃，就可以盯着那几种接着骂，个人觉得还可以，挺好吃的，就是家里面的人不喜欢，下次可能不会买了或者换一个口味的吃。我吃东西还好不怎么挑，我觉得这个撒尿牛丸的味道也挺鲜的，超市里面买的味道是一样的，京东快递的速度也很快，给京东的小哥点个赞，希望京东能够继续保持住，继续加油，年前再多做一点活动多给力。,2019-12-29 07:11:19,生鲜,京东生鲜有活动，正好天冷，想吃火锅可以买很多丸子，之前是牛肉卷羊肉卷有活动，买了很多牛肉卷羊肉卷，但是那个时候完全没有什么活动，没什么好买的。花外面不到一顿的钱，能吃两顿火锅，这个性价比挺高的，而且自己在家吃不用计算价格，想吃什么自己买什么也挺好的，很多丸子都没吃过，这次存的活动正好可以多买几种回来，以后觉得好吃，就可以盯着那几种接着骂，个人觉得还可以，挺好吃的，就是家里面的人不喜欢，下次可能不会买了或者换一个口味的吃。我吃东西还好不怎么挑，我觉得这个撒尿牛丸的味道也挺鲜的，超市里面买的味道是一样的，京东快递的速度也很快，给京东的小哥点个赞，希望京东能够继续保持住，继续加油，年前再多做一点活动多给力。,京东 鲜有 活动 正好 吃火锅 丸子 牛肉 羊肉 活动 牛肉 羊肉 活动 没什么 外面 不到 一顿 两顿 火锅 性价比 在家 不用 计算 价格 丸子 没吃过 活动 正好 多买 几种 回来 好吃 几种 挺好吃 喜欢 下次 口味 东西 还好 撒尿 牛丸 味道 挺鲜 超市 味道 京东 快递 速度 很快 京东 小哥 点个 希望 京东 加油 年前 一点 活动 多给力
13435314948,0,"质量非常好,与卖家描述的完全一致, 真的很喜欢,完全超出期望值,发货速 度非常快,包装非常仔细、严实,物流公司服务态度很好,运送速度很快,很满意的一次购物质量很好, 希望更多的朋友信赖. 店主态度特好, 我会再次光顾的好卖家 赞，发货迅速，态度很好，很满意！很好很好！网上购物这么激烈，没想到店家的服务这么好，商品质量好而价低廉， 很热情的卖家，下次还来希望下次还有机会合作祝你生意兴隆质量非常好，出乎我的意料包装非常仔细。下次有机会再找你，店家人蛮好的，东东很不错,淘到心意的宝贝是一件让人很开心的事，比心??????????????? 质量非常好,与卖家描述的完全一致, 真的很喜欢,完全超出期望值,发货速 度非常快,包装非常仔细、严实,京东物流公司服务态度很好,运送速度很快&hellip;&hellip;",2019-11-10 07:38:27,生鲜,"质量非常好,与卖家描述的完全一致, 真的很喜欢,完全超出期望值,发货速 度非常快,包装非常仔细、严实,物流公司服务态度很好,运送速度很快,很满意的一次购物质量很好, 希望更多的朋友信赖. 店主态度特好, 我会再次光顾的好卖家 赞，发货迅速，态度很好，很满意！很好！网上购物这么激烈，没想到店家的服务这么好，商品质量好而价低廉， 很热情的卖家，下次还来希望下次还有机会合作祝你生意兴隆质量非常好，出乎我的意料包装非常仔细。下次有机会再找你，店家人蛮好的，东很不错,淘到心意的宝贝是一件让人很开心的事，比心? 质量非常好,与卖家描述的完全一致, 真的很喜欢,完全超出期望值,发货速 度非常快,包装非常仔细、严实,京东物流公司服务态度很好,运送速度很快&helip;",质量 卖家 描述 完全一致 真的 喜欢 超出 期望值 发货 包装 仔细 严实 物流 公司 服务态度 运送 速度 很快 满意 购物 质量 希望 朋友 信赖 店主 态度 我会 光顾 卖家 发货 态度 满意 网上 购物 激烈 没想到 店家 服务 商品质量 好而价 低廉 热情 卖家 下次 还来 希望 下次 机会 合作 生意兴隆 质量 出乎 意料 包装 仔细 下次 机会 店家 人蛮 不错 淘到 心意 宝贝 一件 开心 比心 质量 卖家 描述 完全一致 真的 喜欢 超出 期望值 发货 包装 仔细 严实 京东 物流 公司 服务态度 运送 速度 很快
13639337106,0,海欣的产品买过多款了，鱼豆腐，蟹肉棒，鱼丸，味道都不错，没有杂味。这款鱼丸去年买过，非常适合涮火锅，每次涮锅都要来几个，否则感觉不叫吃火锅，每次趁搞活动多买一点囤起来真是划算。打开包装看，个大。下锅肉质紧实，外皮爽脆，内馅细嫩，轻咬一口汤汁四溢，肉质鲜嫩多汁非常好吃，原汁原味，每一口都让人回味无穷。京东生鲜，发货快运送和送货更快，收到时用箱子装的，打开后一点都没化，里面的干冰还是完整的，在京东上买自营商品就是好，不光送货块，而且品质也有保证，保质期也很新，不用担心假冒伪劣。价格也是相当给力，全家人都很满意,2019-12-24 07:03:46,生鲜,海欣的产品买过多款了，鱼豆腐，蟹肉棒，鱼丸，味道都不错，没有杂味。这款鱼丸去年买过，非常适合涮火锅，每次涮锅都要来几个，否则感觉不叫吃火锅，每次趁搞活动多买一点囤起来真是划算。打开包装看，个大。下锅肉质紧实，外皮爽脆，内馅细嫩，轻咬一口汤汁四溢，肉质鲜嫩多汁非常好吃，原汁原味，每一口都让人回味无穷。京东生鲜，发货快运送和送货更快，收到时用箱子装的，打开后一点都没化，里面的干冰还是完整的，在京东上买自营商品就是好，不光送货块，而且品质也有保证，保质期也很新，不用担心假冒伪劣。价格也是相当给力，全家人都很满意,海欣 产品 买过 多款 豆腐 蟹肉 鱼丸 味道 不错 杂味 鱼丸 去年 买过 非常适合 火锅 每次 涮锅 几个 感觉 吃火锅 每次 活动 多买 一点 划算 打开 包装 下锅 肉质 紧实 外皮 爽脆 内馅 细嫩 咬一口 汤汁 四溢 肉质 鲜嫩 多汁 好吃 原汁原味 一口 回味无穷 京东 生鲜 发货 运送 送货 收到 时用 箱子 打开 一点 没化 干冰 完整 京东 自营 商品 送货 品质 保证 保质期 不用 担心 假冒伪劣 价格 给力 全家人 满意
