id,score,content,creationTime,class,物流信息,分词
13580316215,0,非常不错的丸子，孩子很爱吃，每次涮羊肉的时候都要吃丸子，而且这个丸子很耐煮，煮时间长了也没问题。最主要的是丸子里面有馅，非常好吃。但是有一点刚捞出来的别着急吃，因为咬完就会流油，油特别烫容易烫嘴。而且这个丸子也能做汤吃，很不错的。快递也非常给力，送到家还是冻的很结实的。也要感谢快递小哥，谢谢了！,2019-12-10 11:50:06,生鲜,非常不错的丸子，孩子很爱吃，每次涮羊肉的时候都要吃丸子，而且这个丸子很耐煮，煮时间长了也没问题。最主要的是丸子里面有馅，非常好吃。但是有一点刚捞出来的别着急吃，因为咬完就会流油，油特别烫容易烫嘴。而且这个丸子也能做汤吃，很不错的。快递也非常给力，送到家还是冻的很结实的。也要感谢快递小哥，谢了！,不错 丸子 孩子 每次 涮羊肉 丸子 丸子 很耐 时间 丸子 好吃 一点 刚捞 别着急 流油 特别 丸子 不错 快递 给力 送到 结实 感谢 快递 小哥
13579455084,0,很喜欢吃这个小丸子，有包心，所以买了好多，很喜欢吃～自己煮小火锅时可以煮，煮面时也可以加上，也试过蒸，反正各种做法。特别喜欢咬开包心馅的味道，反正就是好吃，一袋的分量也多，值得购买！！吃完后还会买。京东冷链运输很好。赶上搞活动价格还很实惠。相信京东，尤其是快递和售后没得说。对于我这种不能经常上街购物的人来说，京东是个很好的选择。京东加油。,2019-12-10 08:20:58,生鲜,很喜欢吃这个小丸子，有包心，所以买了好多，很喜欢吃～自己煮小火锅时可以煮，煮面时也可以加上，也试过蒸，反正各种做法。特别喜欢咬开包心馅的味道，反正就是好吃，一袋的分量也多，值得购买！吃完后还会买。京东冷链运输很好。赶上搞活动价格还很实惠。相信京东，尤其是快递和售后没得说。对于我这种不能经常上街购物的人来说，京东是个很好的选择。京东加油。,喜欢 小丸子 包心 好多 喜欢 小火锅 面时 试过 反正 做法 特别 喜欢 开包 心馅 味道 反正 好吃 一袋 分量 值得 购买 完后 京东 冷链 运输 赶上 活动 价格 实惠 京东 快递 售后 没得说 上街 购物 京东 选择 京东 加油
13579453628,0,很喜欢吃这个小丸子，有包心，所以买了好多，很喜欢吃～自己煮小火锅时可以煮，煮面时也可以加上，也试过蒸，反正各种做法。特别喜欢咬开包心馅的味道，反正就是好吃，一袋的分量也多，值得购买！！吃完后还会买。京东冷链运输很好。赶上搞活动价格还很实惠。相信京东，尤其是快递和售后没得说。对于我这种不能经常上街购物的人来说，京东是个很好的选择。京东加油。,2019-12-10 08:20:41,生鲜,很喜欢吃这个小丸子，有包心，所以买了好多，很喜欢吃～自己煮小火锅时可以煮，煮面时也可以加上，也试过蒸，反正各种做法。特别喜欢咬开包心馅的味道，反正就是好吃，一袋的分量也多，值得购买！吃完后还会买。京东冷链运输很好。赶上搞活动价格还很实惠。相信京东，尤其是快递和售后没得说。对于我这种不能经常上街购物的人来说，京东是个很好的选择。京东加油。,喜欢 小丸子 包心 好多 喜欢 小火锅 面时 试过 反正 做法 特别 喜欢 开包 心馅 味道 反正 好吃 一袋 分量 值得 购买 完后 京东 冷链 运输 赶上 活动 价格 实惠 京东 快递 售后 没得说 上街 购物 京东 选择 京东 加油
13579453056,0,很喜欢吃这个小丸子，有包心，所以买了好多，很喜欢吃～自己煮小火锅时可以煮，煮面时也可以加上，也试过蒸，反正各种做法。特别喜欢咬开包心馅的味道，反正就是好吃，一袋的分量也多，值得购买！！吃完后还会买。京东冷链运输很好。赶上搞活动价格还很实惠。相信京东，尤其是快递和售后没得说。对于我这种不能经常上街购物的人来说，京东是个很好的选择。京东加油。,2019-12-10 08:20:20,生鲜,很喜欢吃这个小丸子，有包心，所以买了好多，很喜欢吃～自己煮小火锅时可以煮，煮面时也可以加上，也试过蒸，反正各种做法。特别喜欢咬开包心馅的味道，反正就是好吃，一袋的分量也多，值得购买！吃完后还会买。京东冷链运输很好。赶上搞活动价格还很实惠。相信京东，尤其是快递和售后没得说。对于我这种不能经常上街购物的人来说，京东是个很好的选择。京东加油。,喜欢 小丸子 包心 好多 喜欢 小火锅 面时 试过 反正 做法 特别 喜欢 开包 心馅 味道 反正 好吃 一袋 分量 值得 购买 完后 京东 冷链 运输 赶上 活动 价格 实惠 京东 快递 售后 没得说 上街 购物 京东 选择 京东 加油
13579450744,0,很喜欢吃这个小丸子，有包心，所以买了两袋，到现在还没吃完～自己煮小火锅时可以煮，煮面时也可以加上，也试过蒸，反正各种做法。特别喜欢咬开包心馅的味道，反正就是好吃，一袋的分量也多，值得购买！！吃完后还会买。京东冷链运输很好。赶上搞活动价格还很实惠。相信京东，尤其是快递和售后没得说。对于我这种不能经常上街购物的人来说，京东是个很好的选择。京东加油。,2019-12-10 08:19:33,生鲜,很喜欢吃这个小丸子，有包心，所以买了两袋，到现在还没吃完～自己煮小火锅时可以煮，煮面时也可以加上，也试过蒸，反正各种做法。特别喜欢咬开包心馅的味道，反正就是好吃，一袋的分量也多，值得购买！吃完后还会买。京东冷链运输很好。赶上搞活动价格还很实惠。相信京东，尤其是快递和售后没得说。对于我这种不能经常上街购物的人来说，京东是个很好的选择。京东加油。,喜欢 小丸子 包心 两袋 小火锅 面时 试过 反正 做法 特别 喜欢 开包 心馅 味道 反正 好吃 一袋 分量 值得 购买 完后 京东 冷链 运输 赶上 活动 价格 实惠 京东 快递 售后 没得说 上街 购物 京东 选择 京东 加油
13579449383,0,很喜欢吃这个小丸子，有包心，所以买了两袋，到现在还没吃完～自己煮小火锅时可以煮，煮面时也可以加上，也试过蒸，反正各种做法。特别喜欢咬开包心馅的味道，反正就是好吃，一袋的分量也多，值得购买！！吃完后还会买。京东冷链运输很好。赶上搞活动价格还很实惠。相信京东，尤其是快递和售后没得说。对于我这种不能经常上街购物的人来说，京东是个很好的选择。京东加油。,2019-12-10 08:18:43,生鲜,很喜欢吃这个小丸子，有包心，所以买了两袋，到现在还没吃完～自己煮小火锅时可以煮，煮面时也可以加上，也试过蒸，反正各种做法。特别喜欢咬开包心馅的味道，反正就是好吃，一袋的分量也多，值得购买！吃完后还会买。京东冷链运输很好。赶上搞活动价格还很实惠。相信京东，尤其是快递和售后没得说。对于我这种不能经常上街购物的人来说，京东是个很好的选择。京东加油。,喜欢 小丸子 包心 两袋 小火锅 面时 试过 反正 做法 特别 喜欢 开包 心馅 味道 反正 好吃 一袋 分量 值得 购买 完后 京东 冷链 运输 赶上 活动 价格 实惠 京东 快递 售后 没得说 上街 购物 京东 选择 京东 加油
13572120465,1,"2019-10-27
产品质量好,性价比高,味道鲜美这几年一直在京东自营店的产品吃,放心,信得过。喜欢在京东购物,由其是京东自营,一是方便快捷,二是货品可靠放心,当今假冒成风所以货真犹为重要,希望京东努力,让京东购物信得过,坚守底线,不忘初心。京东加油。非常感谢京东商城给予的优质的服务,从仓储管理、物流配送等各方面都是做的非常好的。送货及时,配送员也非常的热情,特京东商城在售后管理上也非常好的,让客户购物无忧,放心购物,予我们非常好的购物体验。",2019-12-08 10:59:27,生鲜,"2019-10-27产品质量好,性价比高,味道鲜美这几年一直在京东自营店的产品吃,放心,信得过。喜欢在京东购物,由其是京东自营,一是方便快捷,二是货品可靠放心,当今假冒成风所以货真犹为重要,希望京东努力,让京东购物信得过,坚守底线,不忘初心。京东加油。非常感谢京东商城给予的优质的服务,从仓储管理、物流配送等各方面都是做的非常好的。送货及时,配送员也非常的热情,特京东商城在售后管理上也非常好的,让客户购物无忧,放心购物,予我们非常好的购物体验。",产品质量 性价比 味道鲜美 几年 京东 自营 产品 放心 信得过 喜欢 京东 购物 京东 自营 一是 方便快捷 二是 货品 可靠 放心 当今 假冒 成风 货真 犹为 希望 京东 努力 京东 购物 信得过 坚守 底线 不忘 初心 京东 加油 非常感谢 京东 商城 给予 优质 服务 仓储 管理 物流配送 送货 配送 热情 京东 商城 售后 管理 客户 购物 无忧 放心 购物 购物 体验
13571639139,1,京东的东西真是特别好，这种鱼丸已经多次购买了，每次活动都会买，涮火锅吃，特别帮，中间的肉馅也特好吃，丸子Q弹，有嚼劲，进锅特别好熟，爱吃火锅的推荐购买，而且送货很快，京东物流非常棒，快递送货到家，快递小哥热情，大家赶紧下单吧！,2019-12-08 08:59:50,生鲜,京东的东西真是特别好，这种鱼丸已经多次购买了，每次活动都会买，涮火锅吃，特别帮，中间的肉馅也特好吃，丸子Q弹，有嚼劲，进锅特别好熟，爱吃火锅的推荐购买，而且送货很快，京东物流非常棒，快递送货到家，快递小哥热情，大家赶紧下单吧！,京东 东西 特别 鱼丸 购买 每次 活动 火锅 特别 肉馅 好吃 丸子 进锅 特别 吃火锅 推荐 购买 送货 很快 京东 物流 快递 送货到 快递 小哥 热情 赶紧 下单
13564194215,0,鱼丸收到了，买了好几样，天冷了留着吃火锅，吃好了还会回购的。。京东物流很快，快递小哥态度很好,2019-12-06 09:24:35,生鲜,鱼丸收到了，买了好几样，天冷了留着吃火锅，吃好了还会回购的。京东物流很快，快递小哥态度很好,鱼丸 收到 好几样 天冷 吃火锅 回购 京东 物流 很快 快递 小哥 态度
13556221470,0,最近想吃牛肉丸，又不想跑超市，怎么办嘞，当然选择京东自营，物流速度飞快，隔天就送到，食物品质有保证，值得信赖！收到牛丸后，发现保鲜做的特别好，专用了一个泡沫箱子，放了干冰，物流师傅直接给送到家门口，必须给大大的赞！,2019-12-04 09:12:59,生鲜,最近想吃牛肉丸，又不想跑超市，怎么办嘞，当然选择京东自营，物流速度飞快，隔天就送到，食物品质有保证，值得信赖！收到牛丸后，发现保鲜做的特别好，专用了一个泡沫箱子，放了干冰，物流师傅直接给送到家门口，必须给大的赞！,牛肉丸 不想 超市 选择 京东 自营 物流 速度 飞快 隔天 送到 食物 品质 保证 值得 信赖 收到 牛丸 发现 保鲜 特别 专用 泡沫 箱子 干冰 物流 师傅 送到 家门口
13546077467,0,每隔一段时间就撸货，优惠大酬宾，京东的冷链物流配送相当专业，配送小哥也是相当专业，白天不在家几个冷冻专用箱整整齐齐的摆在门口，下班回到家满满的惊喜。丸子是火锅配料?神器，和超市的味道一样的，这里的价格占优&hellip;&hellip;,2019-12-01 18:27:00,生鲜,每隔一段时间就撸货，优惠大酬宾，京东的冷链物流配送相当专业，配送小哥也是相当专业，白天不在家几个冷冻专用箱整齐的摆在门口，下班回到家满的惊喜。丸子是火锅配料?神器，和超市的味道一样的，这里的价格占优&helip;,每隔 一段时间 优惠 酬宾 京东 冷链 物流配送 专业 配送 小哥 专业 白天 在家 几个 冷冻 专用箱 整齐 摆在 门口 下班 回到 家满 惊喜 丸子 火锅 配料 神器 超市 味道 价格 占优
13540235929,1,海欣灌汤福州鱼丸是家里的长购款，一袋子有500克，大概21颗，到底是百年鱼丸世家，他们家的鱼丸细腻有弹性，味道也特别好，早上煮面，中午煲汤，或者吃火锅都好吃。大牌子值得信任。京东送货快，服务好，送来时放在保温箱的，一点点也没有化，日期也新鲜，从此有的京东后超市都很少去了,2019-11-30 10:55:17,生鲜,海欣灌汤福州鱼丸是家里的长购款，一袋子有50克，大概21颗，到底是百年鱼丸世家，他们家的鱼丸细腻有弹性，味道也特别好，早上煮面，中午煲汤，或者吃火锅都好吃。大牌子值得信任。京东送货快，服务好，送来时放在保温箱的，一点也没有化，日期也新鲜，从此有的京东后超市都很少去了,海欣 福州 鱼丸 家里 购款 袋子 百年 鱼丸 世家 鱼丸 细腻 弹性 味道 特别 早上 煮面 中午 煲汤 吃火锅 好吃 牌子 值得 信任 京东 送货 服务 送来 放在 保温箱 一点 日期 新鲜 京东 超市
13539845735,0,这个品牌的鱼丸已多次购买了，这次促销多买几袋，味道好品种丰富，鱼制品有营养，对于下班懒的做鱼吃就涮几个鱼丸很方便快捷，鱼的多吃一点有益健康，京东自营商品就是不错，上午下单，晚上到家收货，冷链物流快递到家，送货上门时跟刚从冰柜里拿出来的时候差不多，盒子包的很严，给京东物流点赞！,2019-11-30 09:19:43,生鲜,这个品牌的鱼丸已多次购买了，这次促销多买几袋，味道好品种丰富，鱼制品有营养，对于下班懒的做鱼吃就涮几个鱼丸很方便快捷，鱼的多吃一点有益健康，京东自营商品就是不错，上午下单，晚上到家收货，冷链物流快递到家，送货上门时跟刚从冰柜里拿出来的时候差不多，盒子包的很严，给京东物流点赞！,品牌 鱼丸 购买 促销 多买 几袋 味道 品种 制品 营养 下班 几个 鱼丸 方便快捷 一点 有益健康 京东 自营 商品 不错 上午 下单 晚上 到家 收货 冷链 物流 快递 到家 送货上门 冰柜 盒子 很严 京东 物流 点赞
13538178857,1,心怡宝贝收到了，质量和颜值都值得推荐！作为京东的老客户，已经深深信赖京东的物品与服务！近一年京东活动太给力了，红包减了N元，物有所值！值得信赖！好品质我们为您代言！??????快递服务很迅速！快递小哥很敬业！从来不会将包裹放入快递柜，细节反映出企业的形象！祝福京东商铺生意兴隆！财源滚滚！强烈要求每天继续拆红包、拼团领京豆啊！,2019-11-29 18:19:46,生鲜,心怡宝贝收到了，质量和颜值都值得推荐！作为京东的老客户，已经深信赖京东的物品与服务！近一年京东活动太给力了，红包减了N元，物有所值！值得信赖！好品质我们为您代言！?快递服务很迅速！快递小哥很敬业！从来不会将包裹放入快递柜，细节反映出企业的形象！祝福京东商铺生意兴隆！财源滚！强烈要求每天继续拆红包、拼团领京豆啊！,心怡 宝贝 收到 质量 颜值 值得 推荐 京东 老客户 信赖 京东 物品 服务 一年 京东 活动 太给力 红包 减了 物有所值 值得 信赖 品质 代言 快递 服务 快递 小哥 敬业 从来不 包裹 放入 快递 细节 企业 形象 祝福 京东 商铺 生意兴隆 财源 强烈要求 红包 拼团 领京豆
13521368939,0,海欣的蟹棒就是好，买了两包很快就吃完了，这次又买来几包。口感真的是非常好，火锅，面条，都可以放。有了他，鲜味增加不少，胃口也增加了。京东物流速度依旧那么快，快递师傅服务态度很好，按照约定时间准时送达家里，还用专业的冰包存放，到手还是冻着的。非常满意！,2019-11-25 17:59:45,生鲜,海欣的蟹棒就是好，买了两包很快就吃完了，这次又买来几包。口感真的是非常好，火锅，面条，都可以放。有了他，鲜味增加不少，胃口也增加了。京东物流速度依旧那么快，快递师傅服务态度很好，按照约定时间准时送达家里，还用专业的冰包存放，到手还是冻着的。非常满意！,海欣 两包 很快 买来 几包 口感 真的 火锅 面条 鲜味 增加 胃口 增加 京东 物流 速度 依旧 快递 师傅 服务态度 约定 时间 准时 送达 家里 专业 冰包 存放 到手 满意
13521330787,0,丸子很好吃，真的很不错啊。放在火锅里煮，不用等化开，直接煮就可以，很好吃。和买的肥羊肥牛火锅底料一起吃，煮米线放里面也很不错。京东的物流真的很快，买了第二天就到了。和好朋友在家里吃火锅比去海底捞便宜还好吃。哈哈哈哈，真的很喜欢，多做活动就可以一直买了。囤货。,2019-11-25 17:50:44,生鲜,丸子很好吃，真的很不错啊。放在火锅里煮，不用等化开，直接煮就可以，很好吃。和买的肥羊肥牛火锅底料一起吃，煮米线放里面也很不错。京东的物流真的很快，买了第二天就到了。和好朋友在家里吃火锅比去海底捞便宜还好吃。哈，真的很喜欢，多做活动就可以一直买了。囤货。,丸子 好吃 真的 不错 放在 锅里煮 不用 等化开 好吃 肥羊 肥牛 火锅 底料 米线 不错 京东 物流 真的 很快 第二天 朋友 家里 吃火锅 比去 海底 便宜 好吃 真的 喜欢 活动 囤货
13516523353,0,回购N次了，生鲜一直信赖京东，物流快，服务好，五星好评&hellip;&hellip;&hellip;&hellip;,2019-11-24 16:41:55,生鲜,回购N次了，生鲜一直信赖京东，物流快，服务好，五星好评&helip;,回购 生鲜 信赖 京东 物流 服务 五星 好评
13514938082,0,天气快冷了，准备吃火锅，送货速度很快，箱子里边还是冰冻状态，点赞,2019-11-24 10:40:26,生鲜,天气快冷了，准备吃火锅，送货速度很快，箱子里边还是冰冻状态，点赞,天气 吃火锅 送货 速度 很快 箱子 里边 冰冻 状态 点赞
13513278279,1,包装好，送货快，品质优，京东的冷链和物流速度非常棒！,2019-11-23 20:41:40,生鲜,包装好，送货快，品质优，京东的冷链和物流速度非常棒！,包装 送货 品质 京东 冷链 物流 速度
13497623018,0,方便快捷，送货到家，真的很方便，而且价格和超市价格差不多，有时比超市价格还便宜，真心不错！！！！主要是上班没时间去超市选购，在京东下单后还送货到家，等下班了，买的东西也到家了?*??(ˊ&omega;ˋ*)??*?一直支持京东～～～,2019-11-20 12:16:09,生鲜,方便快捷，送货到家，真的很方便，而且价格和超市价格差不多，有时比超市价格还便宜，真心不错！主要是上班没时间去超市选购，在京东下单后还送货到家，等下班了，买的东西也到家了?*?(ˊ&omega;ˋ*)?*?一直支持京东～,方便快捷 送货到 真的 价格 超市 价格 超市 价格 便宜 真心 不错 上班 时间 超市 选购 京东 下单 送货到 下班 东西 支持 京东
13496447538,0,非常好吃的丸子，上次吃完了也没买，主要是夏天在家里也不吃涮羊肉一类的，所以就没买，其实这个丸子做汤放上也应该很好吃，但是总觉得没有吃涮羊肉来的实在。现在冬天到了是吃涮羊肉的时候了，孩子又想起这个丸子来了，就买了一袋，吃完了在买，这个东西随买随有的。这个在我来说就是涮羊肉最佳拍档了。送货非常快，感谢快递小哥辛苦啦！,2019-11-20 08:11:26,生鲜,非常好吃的丸子，上次吃完了也没买，主要是夏天在家里也不吃涮羊肉一类的，所以就没买，其实这个丸子做汤放上也应该很好吃，但是总觉得没有吃涮羊肉来的实在。现在冬天到了是吃涮羊肉的时候了，孩子又想起这个丸子来了，就买了一袋，吃完了在买，这个东西随买随有的。这个在我来说就是涮羊肉最佳拍档了。送货非常快，感谢快递小哥辛苦啦！,好吃 丸子 上次 夏天 家里 不吃 涮羊肉 一类 丸子 汤放上 好吃 涮羊肉 实在 冬天 涮羊肉 孩子 想起 丸子 一袋 东西 随买 随有 涮羊肉 最佳 拍档 送货 感谢 快递 小哥 辛苦
13467691458,1,一直买京东的东西，作为PLUS会员的我，已经续费到2020年底了。为什么提前付费因为京东给我的性价比以及物流和质量等等都能得到最大化的满足。希望自营的和旗舰店也能做点互通的性价比活动。例如一元即可参与旗舰店的抽奖或者预约大礼包等等。或者加入心愿单提交客服得到期望价格等等活动。都还不错的。???。很不错。,2019-11-14 20:19:46,生鲜,一直买京东的东西，作为PLUS会员的我，已经续费到20年底了。为什么提前付费因为京东给我的性价比以及物流和质量等都能得到最大化的满足。希望自营的和旗舰店也能做点互通的性价比活动。例如一元即可参与旗舰店的抽奖或者预约大礼包等。或者加入心愿单提交客服得到期望价格等活动。都还不错的。?。很不错。,京东 东西 会员 续费 年底 提前 付费 京东 性价比 物流 质量 最大化 希望 自营 旗舰店 做点 互通 性价比 活动 一元 即可 参与 旗舰店 抽奖 预约 大礼包 心愿 提交 客服 期望 价格 活动 不错 不错
13453658054,0,好评，这老牌子的鱼丸肉好吃，又脆口又有韧性：在京东买得放心吃得舒心，绝对的放心，相对于在菜市场超市来讲真是好，趁着搞活动价又实惠所以又多买了些放冰箱，加上强大京东配送快捷，全程肉品冷藏冷链运输快捷配送，收到手时还是那么完美，没有一丝解冻到，特赞美京东一下，买生鲜冷藏冷冻的就他准没错！,2019-11-12 19:39:34,生鲜,好评，这老牌子的鱼丸肉好吃，又脆口又有韧性：在京东买得放心吃得舒心，绝对的放心，相对于在菜市场超市来讲真是好，趁着搞活动价又实惠所以又多买了些放冰箱，加上强大京东配送快捷，全程肉品冷藏冷链运输快捷配送，收到手时还是那么完美，没有一丝解冻到，特赞美京东一下，买生鲜冷藏冷冻的就他准没错！,好评 老牌子 鱼丸 好吃 脆口 韧性 京东 放心 舒心 放心 菜市场 超市 活动 实惠 冰箱 强大 京东 配送 快捷 全程 肉品 冷藏 冷链 运输 快捷 配送 收到 手时 完美 一丝 解冻 赞美 京东 生鲜 冷藏 冷冻 他准 没错
13451180555,0,物流很棒，日期新鲜，等着打火锅时候用。,2019-11-12 13:50:51,生鲜,物流很棒，日期新鲜，等着打火锅时候用。,物流 很棒 日期 新鲜 火锅
13448836072,0,双十一零点抢购了10袋子，价格非常优惠，算下来才半价，比超市便宜很多，京东物流是国内最完美的，速度非常快，上午十点就收到了(坐标苏州)，包装完美没有损坏，快递小哥也很热情，直接送货到家里的冰箱，足不出户即可享受京东的美食，服务。,2019-11-12 08:41:19,生鲜,双十一零点抢购了10袋子，价格非常优惠，算下来才半价，比超市便宜很多，京东物流是国内最完美的，速度非常快，上午十点就收到了(坐标苏州)，包装完美没有损坏，快递小哥也很热情，直接送货到家里的冰箱，足不出户即可享受京东的美食，服务。,双十 零点 抢购 袋子 价格 优惠 算下来 半价 超市 便宜 京东 物流 国内 完美 速度 上午 十点 收到 坐标 苏州 包装 完美 损坏 快递 小哥 热情 送货到 家里 冰箱 足不出户 即可 享受 京东 美食 服务
13448831601,0,双十一零点抢购了10袋子，价格非常优惠，算下来才半价，比超市便宜很多，京东物流是国内最完美的，速度非常快，上午十点就收到了(坐标苏州)，包装完美没有损坏，快递小哥也很热情，直接送货到家里的冰箱，足不出户即可享受京东的美食，服务。中午直接涮的火锅吃，吃了3袋子，好吃。。。美味,2019-11-12 08:40:38,生鲜,双十一零点抢购了10袋子，价格非常优惠，算下来才半价，比超市便宜很多，京东物流是国内最完美的，速度非常快，上午十点就收到了(坐标苏州)，包装完美没有损坏，快递小哥也很热情，直接送货到家里的冰箱，足不出户即可享受京东的美食，服务。中午直接涮的火锅吃，吃了3袋子，好吃。美味,双十 零点 抢购 袋子 价格 优惠 算下来 半价 超市 便宜 京东 物流 国内 完美 速度 上午 十点 收到 坐标 苏州 包装 完美 损坏 快递 小哥 热情 送货到 家里 冰箱 足不出户 即可 享受 京东 美食 服务 中午 火锅 袋子 好吃 美味
