内容,主题概率,主题类型
整体 行程 服务 符合 预期 团队 选择 携程 看重 携程 服务 团友 素质 团友 素质 碰运气,"[(3, 0.94767404)]",3
冬天 天黑 行程 夏天 有所不同,"[(0, 0.01853173), (1, 0.01852518), (2, 0.01853432), (3, 0.018529067), (4, 0.018527403), (5, 0.018524557), (6, 0.01852946), (7, 0.8517703), (8, 0.018528018)]",7
下雨 行程 人性化 导游 敬业,"[(0, 0.018533427), (1, 0.018534563), (2, 0.018532656), (3, 0.01853386), (4, 0.018533347), (5, 0.018524772), (6, 0.8517498), (7, 0.018527951), (8, 0.018529642)]",6
地陪 导游 业务 司机 大叔 开车 技术 幽默 搞笑 工作 老派 英国 作风 西装 领带 收拾 开车 携程 安排 行程 后象 旅行社 领队 小姐 负责,"[(0, 0.96578205)]",0
总体 行程 较紧 景点 值得 巴斯 曼彻斯特 张导 讲解 住宿 较差 大巴 强制 消费 较差 几次 携程 出国 五次 最差,"[(2, 0.95764554)]",2
酒店 不错 自备 洗漱 用品 酒店 提供 典型 英式 早餐 习惯 中式 童鞋 估计 司机 帮忙 搬运 行李 提供 路线 设计 一路 导游 领队 负责 行程 愉快,"[(0, 0.9682293)]",0
携程 忠实 顾客 以要 粉转 糟糕 旅行 团员 素质 极差 领队 到位 十几位 携程 家属 团费 团员 一路 大声 喧哗 手纸 爱尔兰 司机 导游 提出抗议 中国 丢脸 携程 员工 提供 福利 好事 单独 组织 家属 路线 安排 穿越 爱尔兰 海峡 轮渡 安排 晚上 酒店 已是 酒店 偏远 介绍 讲明 全程 领队 种种 理由 推迟 第二天 晚上 强烈要求 下才,"[(6, 0.9849242)]",6
行程 安排 比较满意 张导 司机 大哥 热情 服务到位,"[(0, 0.9011633), (1, 0.012352448), (2, 0.012361683), (3, 0.012353708), (4, 0.012353268), (5, 0.012351695), (6, 0.01235435), (7, 0.0123539325), (8, 0.012355709)]",0
第一次 携程 组团 出游 同行 女儿 团友 总体 感觉 全团 人员素质 相互间 理解 包容 到位 地导 出行 计划 执行 出行 线路 清晰 服务态度 质量 满意 下次 出行 选择 携程 缺陷 行程 自理 时间 只能 汉堡 三明治 路边 解决 晚上 入住 酒店 虽有 时间 地方 只能 超市 解决 尝尝 特色美食 机会 此行 遗憾,"[(4, 0.98321694)]",4
总体 携程 整体 行程 安排 预订 顺畅 交通 舒适 住宿 尚可 游玩 满意 服务 优异 饮食 购物 特别 领队 导游 服务 可谓 细致入微 尽善尽美 历次 携程 出游 感觉 携程 出行 工作人员 说完 满意 改进 签证 也许 领馆 原因 前一天 时间 实在 太紧张 拒签 影响 工作 生活 安排 航班 寒暑假 团队 行程 安排 直航 团队 扶老携幼 折腾 小时 目的地 实在 有点累 直航 转机 票价 理解 航班 订座 一家老小 座位 四散 零落 不到 只能 协商 换座 相互 照应 航空公司 旅行社 订票 名字 次序 携程 家庭 单位 出票,"[(0, 0.98965424)]",0
领队 负责 导游 感觉 知识面 风土人情 介绍 改进 宾馆 偏僻 两天 更是 位于 印度人 聚居地 吓死人 节奏 巴士 厕所 异味 避震 系统 不好 坐在 后排 颠簸 休息,"[(8, 0.96822983)]",8
行程 安排 领队 导游 尽心尽职 游客 合理要求 特别 退税 解释 填写 退税 团队 和谐 快乐 圆满完成 行程 起到 作用 全家 满意 唯一 遗憾 宾馆 安排 偏僻 风土人情,"[(0, 0.9682292)]",0
景色 天气 导游 总体 团餐 味道 一顿 全素 酒店 洗澡水 较冷 车辆 自带 厕所 应急 导致 车辆 中后 气味 难闻 一辆车 全程 厕所 旅途 全程 气味,"[(3, 0.9670521)]",3
旅行 携程 导游 领队 服务 行程 安排 中餐 安排 都柏林 欠佳 吃素 建议 剑桥 安排 小时 坐船 剑桥 购物 过季 时间 改进,"[(8, 0.96132666)]",8
行程 安排 领队 导游 热情 负责 携程 赠送 网络 全队 人员 满意,"[(0, 0.9315717)]",0
整体 不错 领队 负责 导游 行程 稍微 喜欢 长途 飞机 慎选 转机 两趟 累死,"[(4, 0.94069606)]",4
英格兰 苏格兰 爱尔兰 逊色 回来 爱尔兰 退税 只能 信用卡 能退 下次 英格兰 苏格兰,"[(1, 0.9364678)]",1
中途 转机 直飞 感到 疲倦 领队 陈鹏 工作 不错 认真负责 服务态度 算是 比较满意,"[(3, 0.93647194)]",3
酒店 市区 晚上 出去玩 早餐 清一色 难吃 导游 领队 服务 景点 安排,"[(8, 0.9315789)]",8
游程 设计 伦敦 宽松 更好 剑桥 牛津 一处 省出 时间 留给 伦敦 合同 都柏林 宝尔 势格 庄园 项目 旅游 实施 缘故 取消 改为 自由 活动 宝尔 势格 庄园 都柏林 观光 项目 随便 取消 补救 团员 公平 团员 签字 请求 付费 前往 随行 领队 一度 利用 自由 活动 时间 自行 前往 团员 予以 阻拦 携程 风格 顺便 一句 英镑 宝尔 势格 庄园 自费 项目 都柏林 巴士 都柏林 南海岸 宝尔 势格 庄园 小时 收费 欧元 小贵 表扬 导游 老王 老同志 工作 负责 内涵 专业,"[(5, 0.98928535)]",5
英国 爱尔兰 行程 安排 飞机 舒服 直飞 飞机 安排 安排 转机 飞行 时间 浪费时间 折腾,"[(0, 0.9443929)]",0
有点儿 第一天 团餐 令人 印象 深刻 汤泼 游客 衣服 饭店 老板 店员 态度 表现 傲慢 懈怠 饭店 清除 地陪 导游 遗憾 临别 赶路 忘记 打招呼 导游 刘一 表示感谢,"[(7, 0.96932584)]",7
酒店 偏远 酒店 偏远 酒店 偏远 酒店 偏远 酒店 偏远 酒店 偏远 酒店 偏远 酒店 偏远 酒店 偏远 酒店 偏远 酒店 偏远 酒店 偏远 酒店 偏远 酒店 偏远 酒店 偏远 酒店 偏远 酒店 偏远 酒店 偏远 酒店 偏远 酒店 偏远 酒店 偏远 酒店 偏远 酒店 偏远 酒店 偏远 酒店 偏远 酒店 偏远 酒店 偏远 酒店 偏远 酒店 偏远 酒店 偏远 酒店 偏远 酒店 偏远,"[(7, 0.9863231)]",7
行程 去掉 飞行 时间 安排 短时间 观摩 景点 希望 稍微 延长 行程 伦敦 逗留 两天 参观 外观 更好 司机 导游 酒店,"[(0, 0.9595547)]",0
父母 好几 天气 不太好 下雨,"[(0, 0.01852772), (1, 0.018526604), (2, 0.018528258), (3, 0.8517919), (4, 0.018523384), (5, 0.018521965), (6, 0.018530818), (7, 0.018524187), (8, 0.018525172)]",3
携程 服务 足不出户 搞定 预定 提交 资料 旅途 导游 领队 服务 不错 满意 谢谢 携程 预定 旅游 事宜,"[(1, 0.9531885)]",1
行程 第一 人数 大部分 老年人 行程 注明 经济 误区 经济 团好 第三 入住 酒店 郊区 保证,"[(2, 0.94767475)]",2
行程 规划 不合理 导游 专业 团队 服务 意识 劝退 报团 咨询 价格 路线 餐饮 服务 喜欢 团游 参加 携程 精品 毫不犹豫 报名 没想到 成熟 瑞士 路线 规划 导游 专业 行程 军训 稍微 五分钟 以内 合同 拿出 携程 感到 失望 国内 第一 旅游 平台 产品 出发 携程 同行人 位置 参加 首要 安排 座位 依旧 国内 旅游 平台 不到 理解 图片 参考 生气 携程 行程 导游 几次 客服 打电话 投诉 团友 门店 报名 门店 报名 点评 携程 首发 教堂 修葺 哭泣 狮子 修葺 携程 责任 瑞士 旅游局 有没有 旅游局 提供 相关 证明 一会 旅游局 几个 一会 出发 搞笑 去过 瑞士 随便 问问 真实情况,"[(8, 0.9912796)]",8
预定 旅游 目标 落实 每一项 内容 游客 原因 解决 国外 城镇 景点 情况 执掌 安排 吃住行 得心应手 人品 端正 敬业 务实,"[(4, 0.9595701)]",4
人生 第一次 单独 旅行 下单 携程 加价 回答 可拼 出发 后才 发现 本团 挂单 全程 享受 一间 一台 周其旭 导游 细心 匀出 一台 其间 插头 圆头 一点 周导 我他 备份 用心 客人 服务 导游 真的 开心 旅行 酒店 景点 节奏 安排 符合 休闲游 豪华车 舒服 携程 诚信 诚心 衷心感谢 周导 了不起 国内 带到 国外 语言 景点 讲解 瑞士 导游 证书 携程 服务质量 越来越 精细化 精品化 携程 自营 满意,"[(1, 0.98710907)]",1
领队 借给 转换器 行程 安排 住宿 琉森 宾馆 空调 市中心 夏天 安排 空调 宾馆,"[(2, 0.9407084)]",2
伍坚 瑞士 旅游团 伍队 开朗 真诚 实事求是 旅客 旅客 所急 和谐 全团 亲如一家 突逢 强台风 全团 航班 重组 七零八落 来回 旅客 慌乱 情绪 机场 协商 调节 繁杂 事务 始终 心系 旅客 老人 特别 关心 直至 旅游 圆满结束 值得 信托 带队 全家 由衷感谢,"[(4, 0.97931856)]",4
总体 旅行 不错 瑞士 风景 太美 领队 导游 尽责 天气 爆热 一夜 空调 团员 一夜 司机 几晚 宾馆 太晚 外面 逛街 时间 太久 感觉 身体 不行 体力 消耗 游程 安排 办法 逛街 晚才 安排 宾馆 说不过去 携程 团员 身体状况 晚上 宾馆 休息 酒店 希望 携程 安排 团员 诡异 状况 领队 评分 打不上,"[(8, 0.9832178)]",8
出行 包房 高额 房差 中途 二个 房间 很小 满意 希望 携程 提前 酒店 安排 沟通 照顾 常年 老客 安排 线路 深度 游一 半个 那种,"[(4, 0.96441966)]",4
瑞士 十日游 日内瓦 苏黎世 喜欢 火车 走走 感觉 窗外 风景如画 心旷神怡 瑞士 地方 唯一 不好 消费 太贵 太贵,"[(5, 0.9531869)]",5
台风 导致 两天 行程 延误 瑞士 整体 安排 林导 服务 携程 主动 客户 补偿 满意,"[(1, 0.9444037)]",1
五星 好评 导游 全程 介绍 详细 行程 安排 人性化 团餐 自费 项目 值得 体验 推荐 朋友,"[(0, 0.6310237), (3, 0.3231896)]",0
瑞士 值得 地方 深度 选择 几国 走马观花 行程 中餐 不错 瑞士 第一晚 酒店 机场 卫生间 淋浴房 设计 奇怪 形容 安排 酒店 浴缸 固定 不住 导致 结结实实 摔了一跤 当心 原因 还好 滑下去 姿势 小腿 乌青 中老年人 想象 第一晚 机场 酒店 这家 酒店 当心 预期 好评,"[(6, 0.98023206)]",6
瑞士 风景如画 值得 游玩 林导 小姑娘 领队 目的地 导游 搞定 着实 导游 好评,"[(1, 0.9364641)]",1
行程 轻松 安逸 达沃斯 州际 酒店 瑞士 空调 空调 完美 谢谢 携程网 师机 领队,"[(4, 0.94070435)]",4
第一次 欧洲 公司 选定 合作 携程 出行 食宿 满意 领队 樊帆 幽默 见多识广 调整 行程 告诉 折扣 力度 退税 下次 出行 携程,"[(0, 0.96132576)]",0
满意 导游 服务 到位 中途 酒店 空调 完美,"[(0, 0.4521154), (1, 0.46138355), (2, 0.012357833), (3, 0.0123604955), (4, 0.012357811), (5, 0.012355315), (6, 0.012358597), (7, 0.01235234), (8, 0.012358725)]",1
陈述 导游 行程 特别 负责 事情 帮到 用心,"[(0, 0.012355525), (1, 0.012358012), (2, 0.012356185), (3, 0.0123530775), (4, 0.012354581), (5, 0.012351711), (6, 0.01235694), (7, 0.012351084), (8, 0.90116286)]",8
连续 两次 跟随 携程 欧洲游 总体 感觉 不错 建议 携程 知识 储备 语言表达 力强 组织协调 能力 领队 导游 领队 导游 分开 国外 酒店 中国 煎蛋 美元 现象 携程 重视 点评 团队 游客 人数 控制,"[(1, 0.97458696)]",1
行程 碰到 瑞士 国庆 导游 刘丹 灵活 行程 影响 特莱斯 购物 一路上 地方 温度 起伏不定 感谢 刘丹 一路上 仔细 关照 添加 衣物 行程 景点 讲解 到位 可惜 行程 达沃斯 洲际 行程 晚上 第二天 一早 匆忙 好好 享受 遗憾,"[(6, 0.977194)]",6
曾志 领队 认真负责 负责 安排 行程 事务 辛苦 大大的,"[(0, 0.011120448), (1, 0.011117305), (2, 0.911061), (3, 0.011115737), (4, 0.011121239), (5, 0.011114803), (6, 0.01111742), (7, 0.011114752), (8, 0.011117354)]",2
行程 满意 领队 导游 宗导 风趣 幽默 不足之处 奶酪 火锅 单调 失望 琉森 那晚 酒店 空调 本次 行程 缺憾 行李 希望 找回,"[(8, 0.96132433)]",8
领队人 待人 诚恳 言语 幽默 认真负责 活动 期间 给予 很大,"[(0, 0.010116089), (1, 0.919127), (2, 0.010107726), (3, 0.010108378), (4, 0.010109617), (5, 0.010108121), (6, 0.010108379), (7, 0.010105369), (8, 0.010109345)]",1
线路 安排 住宿 餐食 不错 美女 领队 远航 认真负责 下次 出游 选择 携程,"[(0, 0.9364635)]",0
整体 行程 满意 唯一 遗憾 卢加诺 酒店 蚂蚁 还好 宗导 让出 房间 父母 希望 携程 酒店 选择,"[(0, 0.9505842)]",0
满意 有个 酒店 不让 团队 住客 早餐 煎蛋 差别待遇 希望 改进,"[(0, 0.9258715)]",0
旅游 线路 总体 安排 覆盖 较广 体验 雪峰 峡谷 湖泊 自然景观 采尔玛 特是 此行 精彩 景点 莫里茨 可惜 时间 卢加诺 城市 没法 购物 凑去 冰川 快车 坐到 安德 玛特 错失 一段 遗憾 高山 峡谷 穿行 相去甚远 冰川 快车 莫里茨 行程 紧凑 圆满,"[(2, 0.9793177)]",2
行程 总体 安排 希望 携程 行程 细节 安排 予以 完善,"[(0, 0.91914177), (1, 0.01010596), (2, 0.010111962), (3, 0.010106823), (4, 0.010107119), (5, 0.010106474), (6, 0.010107049), (7, 0.010105269), (8, 0.01010757)]",0
体验 领队 负责 累人 下次 选择 携程,"[(0, 0.8888254), (1, 0.013897215), (2, 0.013897926), (3, 0.0138970725), (4, 0.013895363), (5, 0.013895119), (6, 0.013897972), (7, 0.013893774), (8, 0.013900103)]",0
行程 开心 行程 安排 希望 景点 停留时间 一点,"[(0, 0.012357159), (1, 0.012354809), (2, 0.9011747), (3, 0.012351524), (4, 0.012351669), (5, 0.012351187), (6, 0.0123533625), (7, 0.012348288), (8, 0.012357258)]",2
工作 时间 攻略 出行 选择 行程 败笔 第四天 安排 明明 冰川 列车 采尔马特 莫里兹 冷冷清清 顺便去 排名 卢加诺 小时 第二天 驱车 小时 赶到 莫里兹 足足 行程 度假 圣地 莫里兹 少女 大大缩短 时间 冰川 列车 安排 引人入胜 阿尔 布拉 路线 可惜 路线 下车 卢塞恩 住宿 实在 标准 不符 破旧 卫生 浴缸 毛发 清理 干净 有个 建议 地接 承担 分身无术 忙不过来 只能 自行处理 游客 英语 咋办,"[(1, 0.986315)]",1
安排 比较满意 冰川 快车 风景 一段 无聊 三个 小时 时间 太久 留点 时间 卢加诺 酒店 满意 意式 酒店 电梯 拥挤 设施 简陋,"[(7, 0.9613247)]",7
建议 旅游 品质 行程 一点 提升 团费 报名 团员 三只 特级 表能 沒钱 旅游 希望 携程 国旅 愈办愈好,"[(0, 0.9531697)]",0
几天 行程 几天 导游 服务 到位 深度 几天 取消 常规 景点,"[(1, 0.9258793)]",1
导游 领队 认真负责 保养 颜值 同龄人 压力 团友 守时 天气 帮忙 瑞士 旅游业 发达 规划 设施 一流 采尔马特 旅馆 推窗 马特宏峰 卢加诺 琉森 酒店 湖边 希望 携程 位置 宾馆 采尔马特 安德马特 一段 冰川 列车 无聊 正好 错过 冰川 列车 精华 琉森 自理 错误 听取 领队 团友 建议 一家 中餐厅 黑店 烤鸭 一半 盘子 最小 价格 一路 所见 最贵 外国 情侣 三人座 中国 三口 之家 两人座 空位 给换 帐单 多列 收费 项目 服务费 信用卡 收费 太白 餐厅 友情 提示 瑞士 气候 干燥 紫外线 做好 防护 一年四季 衣服 有用,"[(3, 0.9898931)]",3
风景优美 行程 安排 住宿 吃饭 领队 认真负责 愉快 行程 体验,"[(0, 0.010108039), (1, 0.010105751), (2, 0.91915804), (3, 0.010104761), (4, 0.010104933), (5, 0.010104129), (6, 0.010105217), (7, 0.010102934), (8, 0.010106194)]",2
瑞士 深度 游行 明天 結束 行程 滿意 假如能 增加 二天 整個 行程 放緩 完美 這絲 影響 行程 滿分 評價 比較 喜歡 自由 携程 次團 隊游 經歷 這次 滿意 特別 領隊 顧琳 熱心 平易近人 專業 知識 整個 行程 我們 全體 團員 照顧 周到 這樣 優秀 領隊 保證 我們 旅途 始終 充滿 愉快 有賓至如歸 下次 選擇 携程,"[(0, 0.98411334)]",0
行程 安排 风景 美不胜收 出发 七点 天亮 湖边 晨景 特别 莫里茨 八点 出发 原定 时间 小时 莫里茨 早晨 美景 卢塞恩 酒店 国内 经济 酒店 相差无几 谈不上 早餐 羊角 每人 定量 一只 面包 水果 饮料 品种 可怜 旅游 遭遇 午夜惊魂 洛伊 巴德 十一点半 电话 无应答 发现 房间 断电 三分钟 有人 敲门 一句 听不懂 外文 打电话 领队 五分钟 领队 关心 担惊受怕 晚上 第二天 早晨 领队 一会 电水壶 延时 断电 一会 老外 错门 酒店 解释 酒店 调看 监控 答复 回到 浦东 机场 回音 携程 客服 酒店 发生 超负荷 断电 发生 身上 这一 联想 短短 五分钟 发生 电话 断电 敲门 三件 偶然 一位 团友 碰到 凌晨 两点 电话 没接 携程 此事 正确对待 当初 答案 瑞士 几晚 担惊受怕,"[(0, 0.9921962)]",0
导游 领队 小叶 五星 到位 出国 多家 公司 领队 最佳 想象 差距 较大 酒店 太累,"[(8, 0.94440335)]",8
携程 自营 十分满意 叶雯 导游 旅行 碰到 导游 服务到位 亲切 行程 安排 一处 强行 采购 总体 愉快,"[(0, 0.95057297)]",0
线路 设计 瑞士 湖光山色 轻松 休闲 工作 疲累 领队 导游 专业 素质 服务态度 行程 一路顺风 不虚此行 橄榄树 餐厅 一餐 颇为 遗憾 建议 改为 自费 项目,"[(0, 0.9657764)]",0
线路 导游 挑剔 地方 携程 客服 一个男孩 说换 现金 欧元 货币 瑞士 地区 法郎 通用 傻眼 法郎 汇率 损失 千元 不到 希望 客服 培训 改进 事情,"[(3, 0.96706176)]",3
线路 设计 经典 住宿 满意 伽诺 房间 窗外 施工 窗户 开得 空气 流通 电梯 故障 建议 另选 酒店 安排 餐饮,"[(7, 0.9576416)]",7
出发 服务 签证 专员 专业 每次 提问 很好 解答 材料 顺利 行程 瑞士 国游 风景 美丽 行程 安排 舒适 感觉 瑞士 城市 风光 景色 流连忘返 导游 朱林 尽心 负责 行程 掌控 能力 带团 经验丰富 景点 介绍 瑞士 风土人情 日常生活 历史 故事 购物 退税 知识 专业 能力 负责 称职 导游 团友 友好 谦让 和睦 行程 愉快 后续 护照 销签 配送 回来 就用 四个 工作日 配送 发票 开具 出游 致电 携程 客服 开发票 客服 电话 确认 出游 回来 打电话 发票 客服 确认 开具 发票 收到 发票 开具 真的 事情 三遍 一点 满意,"[(0, 0.99022424)]",0
总体 不错 瑞士 风光 行程 先紧 几天 时间 团餐 中餐 味道 住宿 宾馆 真的 好几万 快捷酒店 不到 四星 遗憾,"[(1, 0.8106783), (2, 0.15040457)]",1
城市 奔波 苏黎世 琉森 伯尔尼 城市 增加 行程 宽松 悠闲 预算 增加 接受 夏季 莫里茨 淡季 建议 调整 行程 金色 列车 从琉森 特拉 感觉 观赏性 司机 导游 饮食 满意 自费 项目 导游 一视同仁 态度 亲切 程度 家属 无年 单独 出行 房间 大姐 第一天 半夜 三点 吹头发 第二天 凌晨 一点 回房 洗澡 吹风 轰鸣 强烈建议 单独 出行 旅友 出行 因素 团费 两万 犹豫 单房 出行 挺累 休息 愉快 上路,"[(1, 0.98710793)]",1
领队 导游 尽职 前三天 深度 时间 紧张 领导 尽力 团队 调整 安排,"[(1, 0.9315815)]",1
很好 旅行 瑞士 一国浅 深度 总体 线路 食宿 不错 天气 琉森 小雨 晴好 建议 行程 细节 优化 行程 安排 到达 洛伊 巴德 莫里茨 酒店 时间 安排 酒店 放置 行李 小镇 湖边 天色 已暗 时间 紧促 第二天 一早 出发 感觉 此一 建议 洛伊 巴德 多半天 行程 安排 贝林佐纳 压塑 分钟 莫里茨 总体 行程 略显 贝尔 苏黎世 行程 更好 携程 兼顾 客户群 建议 携程 提供 一国 游行 提供 多种 至少 二种 游客 需求 选择,"[(0, 0.9878147)]",0
总体 行程 满意 深度 值得 推荐 王导 身兼 领队 地陪 导游 实力 二个 建议 产品 主页 显示 成队 人数 模糊 之处 误导 显示 报名 电话 咨询 告知 超过 成团 人数 人数 选择 产品质量 产品 琉森 湖畔 橄榄 地中海 餐厅 用餐 产品 亮点 失望 不到 为由 更换 餐厅 档次 价位 地中海 餐厅 相提并论 几个 团能 餐厅 疑问 善意 地提点 建议 希望 携程 改进 选择 携程 产品,"[(0, 0.986521)]",0
领队 服务 不错 行程 安排 酒店 设施 较差 早餐 品种,"[(0, 0.010106999), (1, 0.010106496), (2, 0.9191544), (3, 0.010105562), (4, 0.010104766), (5, 0.010104098), (6, 0.010105658), (7, 0.010104883), (8, 0.010107088)]",2
行程 愉快 物有所值 特別 四川 领队 导游 伍坚 专业 负责 热情 大大的 唯一 满意 第四天 晚上 入住 酒店 司机 吵架 过份 早餐 一大 面包 饮料 团队 三十三个,"[(0, 0.9682332)]",0
携程 机票 桌位 机身 尾座 机上 餐食 挑选 菜单 挑选 资格 郁闷 空姐 后排 座位 瑞士 航空 小时 提供 一顿 午餐 一顿 简餐 早餐 食品 难吃 卖相,"[(7, 0.9682348)]",7
游程 来回 重复 路程 定下 办法 带队 导游 伍坚 不错 领队 欧洲 旅游 资深 导游 服务,"[(1, 0.9476813)]",1
领队 导游 尽职 一顿 团餐,"[(0, 0.01852732), (1, 0.8517914), (2, 0.018526211), (3, 0.018525515), (4, 0.018528782), (5, 0.018526208), (6, 0.01852608), (7, 0.018523224), (8, 0.018525276)]",1
服务 携程 老客户 两天 行程 一点 总体 不错,"[(0, 0.012355162), (1, 0.012358039), (2, 0.5411083), (3, 0.37241092), (4, 0.012351572), (5, 0.01235191), (6, 0.012355983), (7, 0.012350349), (8, 0.01235774)]",2
瑞士 景色 环境 安静 干净 导游 领导 辛苦 办理 入住 手续 安排 住宿 单人 一间 拼住 行程 安排 不错 可惜 三次 到达 苏黎世 时间 转机 两次 入住 苏黎世 靠近 机场 城里 游玩 时间 碰到 公众 假期 合并 更好 几天 早餐 简单 游客 早餐 分开 内容 感觉 歧视 四星 酒店 总体 开心,"[(0, 0.9828928)]",0
日程安排 自费 项目 购物 江导 经验 旅游 体验 遗憾 苏黎世 机场 酒店 早餐 餐厅 单独 设立 食物 服务员 就餐 中国 号称 五星级 服务 导游 导游 餐厅 经理 投诉 希望 下次 改善服务 态度 瑞士 网络 酒店 收费 小时 瑞郎 小时 瑞郎 中国 同等 酒店,"[(1, 0.9797798)]",1
旅游 线路 安排 行程 比较满意 唯一 不解 出团 旅游 告示 领队 导游 行程 领队 导游 违反 合约 强烈要求 旅行社 给予 赔偿,"[(2, 0.95957035)]",2
总体 不错 第一次 苏黎世 酒店 号称 五星级 酒店 早饭 品种 排队 酒店 欧美 顾客 隔开,"[(7, 0.94441205)]",7
瑞士 采尔马特 莫里茨 团队 冰川 快车 马特宏峰 温泉,"[(0, 0.012352326), (1, 0.9011761), (2, 0.012355027), (3, 0.012359201), (4, 0.012351936), (5, 0.012350306), (6, 0.012350349), (7, 0.012353384), (8, 0.0123513555)]",1
综合 素质 很高 导游 身兼 领队 地陪 全程 安排 不虚此行,"[(0, 0.010109472), (1, 0.0101119215), (2, 0.9191287), (3, 0.010111895), (4, 0.010107511), (5, 0.010107191), (6, 0.010110419), (7, 0.010106384), (8, 0.010106481)]",2
满意 携程 安排 早餐 理想 不好 希望 改进,"[(0, 0.9011741), (1, 0.012355179), (2, 0.012354793), (3, 0.012352574), (4, 0.0123531995), (5, 0.012351349), (6, 0.012351506), (7, 0.012350647), (8, 0.012356561)]",0
阴雨 外套 羽绒服 榨菜 泡面 保暖 德国 意大利 空调 没热 水壶 办法 轻装上阵 带足 至少 每人 五六天 消炎药 感冒药 退烧药 肠胃,"[(2, 0.959574)]",2
行程 时间 完美 错开 疫情 携程 领队 合理安排 团友 免费 配置 口罩 时刻 航变 航班 给力,"[(0, 0.947671)]",0
团队 抵达 酒店 机场 提醒 确保 周边环境 前提 李欣 领队 游客 搬运 行李 协助 司机 游客 搬运 行李 每次 用餐 结束 离开 酒店 发车 提醒 团员 检查 物品 确认 后方 离开 自由 活动 期间 领队 告知 游客 位置 游客 紧急 求助 酒店 集合 位置 定位 路途 注意事项 人身安全 告知 团员 解决 中途 客车 时间 请吃 好吃 饼干 巧克力 期待 旅途,"[(0, 0.9854158)]",0
领队 携程 企业 注重 游客 感受 解决问题 态度 能力 协调 满意 下次 携程 下次 点名 何军柯 领队,"[(0, 0.9505778)]",0
在线 下报 携程 欧洲游 体验 李欣 领队 吃喝玩乐 一路上 诙谐 幽默 不厌其烦 回答 团员 碰到 很快 解决 车程 还给 零食 下次 旅游 选择 携程,"[(6, 0.96442395)]",6
领队 专业 一路 解决 行程 浪费时间 手动,"[(0, 0.013901365), (1, 0.013900296), (2, 0.01390256), (3, 0.8887989), (4, 0.013903742), (5, 0.013901342), (6, 0.013899556), (7, 0.013894132), (8, 0.013898122)]",3
自费 项目 自愿 参加 原定 行程 影响 希望 携程 规范 自费 项目 预定 勾选 前一天 现场 统计 明天 自费 项目 参加 人数 行程 前期 时间 压缩 参加 自费 项目 当天 参观 景点 情况 变相 强迫 参加 自费 项目 本次 自费 项目 包括 巴黎圣母院 因斯布鲁克 景点 门票费 威尼斯 贡多拉 琉森河 游船 巴黎圣母院 参加 人数 成行 改成 当天 九点 酒店 出发 本来 巴黎 堵车 前一天 行程 感觉 巴黎 浅度 卢浮宫 小时 讲解 打仗 着急 浅显 经典 景点 外观 可惜 希望 面团 酒店 行程 安排 要换 酒店 酒店 周边 超市 大部分 酒店 环境卫生 不错 罗马 晚上 飞机 当天 行程 安排 提供 大巴车 自由 活动 只能 坐车 前往 市区 导游 认真负责 生气 团友 显得 专业 评分 辛苦,"[(0, 0.9921968)]",0
总体 不错 意大利 行程 安排 太紧 佛罗伦萨 导游 真的 建议 赶紧 替换 目中无人 导游 影响 团队 心情 行程 开心 刘钺 领队 认真负责 期待 下次 刘钺 领队 出行,"[(4, 0.9682307)]",4
行程 安排 解决 领队 耐心 细致 好评,"[(0, 0.013900149), (1, 0.013900715), (2, 0.6331272), (3, 0.013898085), (4, 0.013897733), (5, 0.013894547), (6, 0.26959133), (7, 0.013895044), (8, 0.013895194)]",2
领队 带领 退税 辛苦 建议 携程 统一 退税 流程 语言不通 退税 窗口 工作人员 领队 建议 公司 办理 值机,"[(0, 0.95319045)]",0
本次 出游 行程 安排 导游 领队 红梅 细心 讲解 满意 领队 五星 好评,"[(0, 0.93645674)]",0
