内容,主题概率,主题类型
老人家 家人 路上 太累,"[(0, 0.022233944), (1, 0.022229202), (2, 0.022260945), (3, 0.022239208), (4, 0.8220831), (5, 0.022230158), (6, 0.02223664), (7, 0.022236746), (8, 0.022250058)]",4
整体 行程 路程 欧洲 冬令 天黑 天气 不太好 工作人员 下班 地方 天黑 下班 天鹅堡 行程 路上 好不容易 下午 多分 告知 德国 那天 行程 一晚,"[(0, 0.96441776)]",0
旅游 途中 购买 行李箱 全新 原因 丢失 是报 携程 随团 回国 于导 协调 保险公司 携程 时间 丢失 行李箱 价值 赔付 赔付 过程 扯皮 责任 推御 特别感谢 于跃 导游 感谢 携程 信任 支持 携程 旅游 浮躁 推诿 环境 携程 采用 态度 解决问题,"[(1, 0.97882366)]",1
家里 两位 老人 开心 感谢 邬俊峰 导游 携程 保障 满意 客服 信誓旦旦 申请 折腾 一圈 符合规定 失望 购物 希望 改善,"[(1, 0.95763963)]",1
出行 多半 雨天 行程 紧凑 领队 特别 认真负责 手动 十个 期待 下次 同行,"[(0, 0.9364586)]",0
特别 糟糕 旅行 全程 重点 购物 投诉 删除 告诉 国外 旅行 发微 维权 整理 欧洲 行程 投诉 维权 私信 详细 投诉 内容 无人 回复,"[(6, 0.96441996)]",6
导游 领队 专业 不错 选择 携程 出游 谢谢,"[(0, 0.90116936), (1, 0.012358918), (2, 0.012354769), (3, 0.012352706), (4, 0.012354822), (5, 0.01235038), (6, 0.012356355), (7, 0.012348588), (8, 0.012354146)]",0
飛機 飛機 時間 問題 行程 包括 絕對 問題 訊息 錯誤 訊息 亂法 分鐘 護照 通關 國際安檢 這樣 錯誤 百出 行程 你們 出現 真的 無語 澳地利 航空 一點 葷菜 咸菜 炒飯 小小的 一盒,"[(7, 0.97305596)]",7
欧洲 行程 安排 所到之处 见识 此行 领队 海军 负责 业务 精熟 好评,"[(0, 0.93155557)]",0
队长 认真负责 不厌其烦 指点 带领 平安 顺利完成 满意,"[(0, 0.9011178), (1, 0.012362414), (2, 0.012361567), (3, 0.012364248), (4, 0.01236002), (5, 0.012354933), (6, 0.012371164), (7, 0.012353229), (8, 0.012354698)]",0
携程 自营 新线路 一路 走来 吃住 不错 领队 导游 水平 贵点 体现 一分钱 一分货 价值 一句,"[(1, 0.94768053)]",1
旅游 欧洲 携程 领队 海军 带领 开心 快乐 携程 行程 自营 安排,"[(0, 0.9315728)]",0
领队 负责 讲解 详细 不厌其烦 超有 耐心 近年 出游 导游 领队 服务 行程 安排 五星 强力 推荐,"[(0, 0.3837822), (1, 0.57297796)]",1
愉快 假期 一路 特别感谢 领队 郑丹 导游 关照,"[(0, 0.01235351), (1, 0.90119344), (2, 0.01235019), (3, 0.0123513285), (4, 0.0123523595), (5, 0.0123491455), (6, 0.012350743), (7, 0.012348241), (8, 0.012350984)]",1
旅游 欧洲 旅游 感谢 郑丹 队长 一路 关照 一位 优秀 导游 工作 认真负责 屈指可数,"[(1, 0.9407059)]",1
行程 轻松 自由 符合 预期 房间 经验 客服 询问 同行 接受 拼房 回答 接受 出团 发现 同团 三口 入住 三人间 后续 回来 电话 咨询 客服 告知 酒店 情况 三人间 事前 仔细 经验 领队 辛苦 跑前跑后 零食 照顾 旅途 巧克力 饼干 皮皮,"[(8, 0.978821)]",8
对接 售后 客服 出发 前几日 不到 年前 年后 携程 电话 无人 应答 回程 联运 北京 温州 飞机 取消 航空公司 通知 旅行社 措施 通知 事发 旅行社 无所作为 等待 自行解决 无奈 之下 只能 自行 临时 购买 回程 机票 务必 赔付,"[(5, 0.9771951)]",5
行程 安排 紧张 充足 游览 休息时间 领队 服务 用车 住宿 餐饮 满意,"[(8, 0.931577)]",8
携程 签证 真的 无力 吐槽 月初 材料 邮寄 显示 材料 送往 大使馆 预计 号出 过年 消息 凌晨 三点 集合 下午 领队 翁星 出签 外地 当天 下午 出签 一行 人才 驱车 赶往 北京 期间 携程 客服 人员 形式化 告知 签让 耐心 等待 开头 糟糕 行程 糟糕 还好 行程 安排 住宿 条件 不错 伙食 挺好 满意 导游 领队 翁星 一位 优秀 北京 小伙子 讲解 融合 独特 方式 印象 深刻 细心 热情 懂得 照顾 团队 老人 孩子 耐心 解决 出行 遇见 各式各样 导游 翁星 确实 称职 优秀 一位 希望 下次 有幸 团队 出行,"[(0, 0.9902239)]",0
英国 段导 组织 安排 第一天 酒店 够不上 几年 携程 出行 住宿 最差 满意,"[(4, 0.9364647)]",4
出行 北京 出发 延误 小时 导致 中转 机场 等候 一夜 耽误 行程 行李 延误 小时 行程 结束 携程 说法 相关 人员 干什么 领队 光辉 敬业 具备 专业 水准 全程 服务 到位,"[(2, 0.34936455), (8, 0.62630713)]",8
出游 北京 雨天 延迟 起飞 误时 小时 机场 转机 延误 只能 另选 航班 英国 行李 两次 到达 期间 光辉 领队 协助 转机 催促 行李 航空公司 洗漱 用品 衣物 辛苦 情况 发生 并未 耽误 计划 行程 减少 半天 自助游 时间 旅行 途中 讲解 详细 和蔼 段永辉 领队 辛苦 公司 应予以 表扬,"[(0, 0.1468074), (8, 0.83792967)]",8
整体 感受 三天 自由 安排 自费 项目 异议 参加 自费 项目 深知 团队 陷阱 放在 团费 机关 喜欢 奥斯汀 不计成本 巴斯 一日游 行程 令人 失望 包含 温莎 城堡 门票 巴斯 浴场 没人管 奥斯汀 故居 粗略 成本 旅行社 一倍 可笑 携程网 报名 价格 团费 之下 景点 巨石阵 导游 给出 解释 导游 一再 提醒 自费 项目 暗示 工作 游客 携程 原因 省事 前提 认可 口碑 物有所值 所有人 异议 愿者上钩 姿态 无异 三天 自由 时间 选择 自费 项目 一锤子买卖 企业 信誉 价值 瓦解 提醒 未来 行程 感兴趣 游客 携程 透明 陷阱 无处不在 这部分 现金 收取 发票 何在 免责 协议 法律效力 不知 意义 何在 不清不楚 仿佛 一颗 苍蝇 携程 十几年 客户 白金 会员 携程 价格 竞争力 依旧 选择 信誉 失望,"[(5, 0.99239355)]",5
有理有据 行程 签比 签快 三天 自由 选项 升级 酒店 电话录音 证实 预订 客服 确认 升级 酒店 客服 产品 经理 确认 无误 一再 携程 沟通 酒店 名称 告诉 安排 行程 周五 出发 周一 团队 行程 迟迟 不见 酒店 信息 打电话 客服 反馈 问问 发来 短信 确认 周二 消息 周二 中午 主动 打电话 消息 下午 消息 无果 周三 早上 主动 打电话 消息 投诉 受理 投诉 专员 不耐烦 态度 职业 素养 有人 回复 态度 录音 听听 下午 告诉 说升 退钱 碰到 强盗 态度 强硬 升级 退团 终于 沟通 几轮 周四 下午 酒店 位置 伦敦 一二 交界 评分 携程 均价 团队 酒店 二百多 升级 平均 单日 打电话 质疑 告知 只能 升级 升级 周三 告知 周四 随便 告诉 转天 出发 接受 携程,"[(7, 0.99246377)]",7
事先 行程 购物 时间 比斯特 百货店 时间 长点,"[(0, 0.012353025), (1, 0.012350116), (2, 0.90119004), (3, 0.012350169), (4, 0.012352715), (5, 0.012351981), (6, 0.012350708), (7, 0.012349379), (8, 0.012351852)]",2
携程 铁杆 会员 多年 出行 选择 携程 没想到 英国 失望 预定 办理 签证 携程 主动 打电话 问询 办理 进度 客户 主动 打电话 咨询 可气 客户 办公 公证 使馆 携程 主动 通知 害得 大热天 往返 没用 英国 行程 车上 景点 小时 最多 小时 导游 介绍 英国 风土人情 历史 文化 特产 只能 两眼一抹黑 天天 机场 晚上 飞机 领队 信息 退房 英镑 酒店 没听说过 提前 退房 提前 罚钱 领队 傻子 开到 伦敦 坏掉 导游 地铁 景点 最老 老人 地铁 楼梯 景点 这件 携程 一点 团里 脾气好 事儿 这件 携程 真的 失望 旅游 订房 携程 频频 品质 从前 信任,"[(1, 0.43935722), (5, 0.5525339)]",5
刘导周 酒店 改进 很烂 携程 领队 换成 领队 颜值 人品 提高 培养 周盼式 领队 机场 托运 行李 帮忙 细节决定 亲身经历 领队 起到 一点 作用 降低 旅行 品质 影响 旅行 心情 携程 领队 抽烟 脱团 周盼 领队 感觉 舒服 旅程 轻松 愉悦 颜值 人品 携程 领队 胖子 建议 携程 客人 感受,"[(8, 0.98256016)]",8
满意 英格兰 爱尔兰 大部分 景点 玩遍 团餐 挺好 行程 安排 不合理 地方 第一天 到达 机场 开车 市内 吃饭 机场 住宿 往返 一个多 小时 行程 中前 几天 安排 酒店 安排 伦敦 自由 活动 自费 项目 收费 太贵,"[(0, 0.9759533)]",0
妈妈 签证 女儿 签证 旅行社 工作人员 不知 拒签 原因 情况 家长 出行 宾馆 机票 扣除 得知 孩子 全家人 情绪 不好 没想到 信任 携程 状况 相关 工作人员 表现 业务水平 负责 精神 携程 品牌 市场 影响力 匹配 拒签 函上 写明 拒签 原因 使馆 旅行社 索要 孩子 出生证明 旅行社 回应 携程 工作人员 发给 材料 提供 出生证明 下午 补发 出生证明 补发 收到 旅行社 确认 邮件 月份 报名 交款 出发 使馆 日发 拒签 旅行社 下午 通知 拒签 距离 出发 仅剩 工作日 第三 状况 旅行社 相关 工作人员 意识 事情 严重性 紧迫性 顾客 角度 出发 解决问题 缺乏 意外 突发事件 经验 咨询 旅行社 使馆 朋友 北京 携程 总部 协调 督促 补救措施 第四 出现意外 沟通 反馈 影响 事情 效率 表现 携程 管理 漏洞 签证 送审 发生 费用 垫付 旅游 回来 一半,"[(2, 0.87151235), (3, 0.122157514)]",2
回来 这么久 评价 特别 开心 导游 领队 耐心 时间 安排,"[(0, 0.010108562), (1, 0.010112188), (2, 0.91913223), (3, 0.010107065), (4, 0.010108923), (5, 0.01010523), (6, 0.010110101), (7, 0.010105299), (8, 0.010110449)]",2
整体 安排 满意 行程 时间 有一 晚在 古堡 住宿 房间 太小,"[(0, 0.9258632)]",0
行程 满意 唯一 遗憾 法国 老佛爷 百货 包包 半小时 不到 全部都是 中国 排队 行程 原因 买到 购物 时间 半天 确实 法国巴黎 堵车 旅游 唯一 携程,"[(2, 0.20427233), (5, 0.76579064)]",5
行程 安排 张弛 有度 行车时间 承受 意大利 德国 天鹅堡 堵车 领队 余鹏 预留 时间 赶到 关门 团队 成员 大家庭 余鹏 领队 工作 认真负责 情况 调整 行程 早餐 餐厅 给予 关照 团队餐 不错 愉快 旅行,"[(1, 0.97458625)]",1
一家 七口 出门 外语 不行 好多 老人 小孩 担心 放飞 自我 郭导 细心 经验 厕所 便宜 要钱 通知 特别 退税 再三 帮忙 解决 选择 携程,"[(1, 0.96578556)]",1
线路 行程 早出晚归 第一天 加油站 店铺 关门 地方 还好 领队 周导 司机,"[(3, 0.93157893)]",3
欧洲 领队 质量 特别 全程 不用 操心 再三 感谢 带领 顺利 陈导 黄导,"[(2, 0.21966794), (8, 0.7247294)]",8
导游 专业 安排 欧洲 董导 贴心 安排 行程 最热 下午 室内 第二天 凉快 室外 游览 领队 服务 周到 细心 司机 全程 配合 导游 安排 行程 缩短 步行 时间 帮忙 行李,"[(2, 0.9713082)]",2
携程 情侣 夫妻 一张 否者 全是 分床 欧洲,"[(0, 0.0123522235), (1, 0.012352055), (2, 0.012351402), (3, 0.012353098), (4, 0.0123504335), (5, 0.90118796), (6, 0.012352326), (7, 0.012350294), (8, 0.012350185)]",5
领队 曾队 超好 行程 安排 顺畅 需求 天气 时间 行程 微调 错开 高峰期 一路 全团 人品 爆棚 天气 配合 国行 深度 团游 携程 自营 值得 信任,"[(0, 0.9670492)]",0
领队 专业 经验丰富 合理安排 行程 介绍 历史 知识 逛得 明明白白 领队 尽力 帮忙 包括 退税 要买 东西 洗手间 行程 包含 农历 新年 团餐 好多 饺子 几次 红酒 年夜饭 贴心 本次 行程 交通 顺利 全程 天气 愉快 满意,"[(0, 0.97658753)]",0
行程 安排 郊区 罗马 佛罗伦萨 威尼斯 巴黎 古城 很远 白天 景点 晚上 酒店 出门 东西 市区 麻烦 事儿 特别 佛罗伦萨 庄园 酒店 导致 下午 佛罗伦萨 古城 集合 米卡 基罗 广场 酒店 酒店 开饭 只能 庄园 酒店 用餐 特差 景点 罗马 老师 不错 巴黎 卢浮宫 北方 导游 讲解 客人 着想 讲完 收工 送走 感觉 领队 刘霖 不错 耐心 周到 客人 着想 整体 行程 安排 调整 冬天 太坑 只能 白天 古城 晚上 郊外 感受 不到 地方 旅行 卢浮宫 讲解员 途中 中餐 安排 不到,"[(4, 0.98915315)]",4
行程 德国 行程 时间 意义 时间 驱车 小时 天鹅堡 小时 返回 意义 何在 导游 女士 全程 讲解 感觉 不耐烦 样子 声音 像是 经验不足 全程 引导 游客 旅行社 合作 购物 导游 返点高 地方 做好 攻略 去往 购物 旅客 露出 脸色 提醒 欧洲 朋友 提前 详细 攻略 少走弯路,"[(2, 0.9810768)]",2
糟糕 团游 领队 导游 本职工作 尽责 工作 流于形式 旅游 政策 无知 工作人员 政策 解读 春天 购物 护照 原件 政策 知晓 回避 旅途 中团友 提出 具备 应急 能力 不间断 暗示 诱导 团友 指定 地点 购买 名贵 商品 擅自 更改 团餐 时间 擅自 增加 购物点 压减 旅行 地点 时间 接受 团友 建议 狡辩 斥责 朋友圈 指责 抱怨 团友 善意 数位 团友 团餐 拉肚子 领队 公开 道歉 拍照 集团 购物 清单 旅途 发生 推卸责任 解释 沟通 指定 老佛爷 购物 春天 团友 指责 明知 春天 购物 护照 原件 店员 狡辩 咨询 退税 承认 介绍 熟悉 外部 店铺 购买 弥补 工作 欠缺 团友 扭伤 脚踝 次日 车上 全员 责任 签字 手续 行程 结束 小群 拉拢 不明真相 给予 网上 好评 提前 做好 应对 丧失 导游 职业道德 请问 领队 导游 符合 携程 服务 理念 企业 文化 携程 忠实 客户 真的 失望 反馈 事不关己 姿态 违心 好评 真实 利于,"[(6, 0.99373615)]",6
行程 安排 朱林 领队 经验丰富 酒店 安排 景点 介绍 到位 好评,"[(0, 0.92587054)]",0
王强 领队 近几年 旅游 领队 热情 渊博 真诚 体面 短短 十几天 像是 朋友,"[(6, 0.9364698)]",6
导游 王国 敬业 态度 好评 团友 素质 极差 自私自利 其他人 素质 令人发指 评来 威胁 王导 实在 看不下去 王导 伸冤 回程 碰到 慕尼黑 上海 航班 故障 延误 十几个 小时 王导 团友 回家 征得 全团 同意 改签 航班 飞到 香港 飞回 上海 香港 上海 航班 位置 航空公司 分成 班次 相差 小时 飞机 随机 拆分 一同 出行 分开 王导 情况 告知 全团 几对 拆分 团友 几个 阿姨 全程 分开 慕尼黑 机场 大吵大闹 王导 解释 自私自利 极点 老公 结婚 没分开 分开 飞机 连体婴 上班 一家 公司 办公室 位子 厕所 团友 反复 解释 香港 上海 分开 后才 作罢 嘴里 王导 解释 王导 真的 可怜 改签 全程 德国 机场 围观 国人 丢光,"[(7, 0.99168485)]",7
愉快 家庭 出游 带队 蔡导 认真负责 耐心 导游 行程 安排 紧凑 团餐 下次 选择 携程,"[(0, 0.94441503)]",0
运气 博学多才 姚杰 导游 普通话 说得好 出口成章 尤爱 风俗习惯 风土人情 注意事项 收获 满满 导游 表率 旅途 不如意 旅途 第二天 半夜 酣睡 房门 打开 房间 电灯 一个男孩 行李 闯入 第二天 早就 汇报 姚杰 导游 可惜 酒店 丝毫 歉意 第三天 山上 城堡 一股 霉气 扑鼻 蜘蛛网 门前 挂满 空调 开窗 那晚 确实 难熬 踩点 确实 希望 携程 有所改进 旅游界 可靠 标杆,"[(6, 0.98517734)]",6
第一天 酒店 体验 极差 名叫 高速 路旁 汽车旅馆 位置 偏僻 配套 设施 餐食 酒店 餐厅 餐厅 区别对待 中国 外国人 菜单 菜品 中国 外国人 酒店 肮脏 不堪 早餐 品种 质量 住宿 体验 国内 连锁 酒店 希望 改进,"[(2, 0.9759636)]",2
两个 老人 出游 行程 郭导 满意 旅游 订单 行程 景色 唯一 希望 类似 团餐 安排 老人 出国 自行 吃饭 困难 初始 选择 行程 是因为 界面 介绍 行程 自理 行程 单发 自理 携程 解释,"[(0, 0.9738396)]",0
领队 导游 王强 本次 行程 一路上 介绍 各国 历史 文化 风土人情 半夜 加班加点 退税 审单 机场 全程 陪同 美中不足 有时候 三个 一间 如意 巴黎 住宿 二张 很小 单人床 服务员 赶到 房间 房间 沙发 翻下来 一张 有时候 房间 实在 太小 箱子 放不下 走路 希望 携程 加以改进,"[(1, 0.9806643)]",1
雖然 行程 四個 國家 大部分 時間 路程 謝東 導遊 體貼 合理安排 整路 一路上 團友 講解 歐洲 歷史 不厭其煩 提醒 我們 什麼 盡心 盡責,"[(1, 0.9629365)]",1
行程 经典 罗祖光 导游 景点 详尽 介绍 帮忙 拍照片 事无巨细 提醒 满意,"[(4, 0.93157256)]",4
愉快 旅游 行程 领队 天气预报 调整 效果 更好 导游 水平 待人 热情 感谢 老人 一路 关照 参加 携程,"[(1, 0.95319486)]",1
领队 导游 刘霖 刘导 超级 耐心 文化 研究 导游 兼职 翻译 入住 宾馆 询问 帮忙 整理 税单 国外 旅游 携程 棒棒 导游 行程 调整 团餐 推荐 自理 餐厅 谢谢 一位 经验 导游,"[(0, 0.9730432)]",0
携程 品牌 放心 事实证明 货真价实 一分钱 一分货 导游 行程 安排 全程 贴心 细致 团友 团结友爱 蜜月旅行 超级 开心 感谢 携程 下次 团游 携程,"[(6, 0.9629403)]",6
领队 服务 专业 热心 一路上 舒适 行程 时间 安排 唯独 瑞士 那天 天气 风景 打折 酒店 住宿 餐饮 舒适 清洁卫生 本次 行程 强制 消费 额外 消费 一点 改进 欧洲 夜晚 无聊 年轻人 早早 酒店 电视 意大利语 法语 看不懂,"[(2, 0.9771923)]",2
行程 结束 导游 好评 实在 违心 好评 说实话 东西 导游 办法 控制 导游 好评率 奖金 挂钩 旅行社,"[(6, 0.95059043)]",6
三个 女生 第一次 欧洲 信任 选择 携程 自营 产品 没想到 闺蜜 期待已久 旅行 充满 恐惧 辛苦 小时 大巴 追赶 时间 签到 景点 细细 欣赏 餐饮 住宿 水准 失望 玩完 想到 携程 中国 旅行 平台 自营 管理 旅程 外籍 司机 连续 几天 微信 骚扰 同伴 外国 文化 熟悉 接受 司机 加微信 上车 司机 拥抱 文化差异 司机 揩油 发现 检点 恐惧 异国他乡 声张 恐惧 最终 全程 旅行 感觉 房间 中文 内容 不堪入目 中文 肯定 第一次 骚扰 中国 女性 携程 国外 选择 司机 骚扰 中国 游客 第一次 携程 天内 给到 回应 解释 维护 权利 全程 标间 沙发 单人床 支付 全额 团费 未退 差价 前期 询问 携程 后期 答复 雇佣 道德品质 人员 担任 司机 给到 经济 精神赔偿 损害 出行 心情 担惊受怕,"[(0, 0.99246055)]",0
本来 家人 出游 原因 只能 携程 很快 办理 退款 手续 服务 效率 旅游 整体 不错 同一个 团队 队友 挺不错 行程 王妍 领队 导游 一路 辛苦 天鹅堡 大雪 封路 没能 最起码 不用 高速公路 一晚 幸运 本来 门票 携程 退还 感觉 反正 携程 值得 信赖 感觉 购物 时间,"[(0, 0.9810717)]",0
行程 有点累 很早 意大利 酒店 特别 稍微 一点 团餐 特别 集体 投诉 一点儿 几天 拉肚子,"[(1, 0.94439924)]",1
行程 安排 陈述 领队 好评 反复 提醒 注意安全 小心 财物 欧洲 治安 全团 回国 丢失 财物 一处 讲解 历史 趣闻 欧洲 酒店 牙膏 牙刷 拖鞋 水壶 少部分 酒店 热水 满意 出行 携程 服务 到位,"[(6, 0.9745857)]",6
领队 导游 很累 行程 朱林 带领 完美 谢谢,"[(0, 0.90117383), (1, 0.012355136), (2, 0.0123536065), (3, 0.012351448), (4, 0.012356771), (5, 0.012352025), (6, 0.012355671), (7, 0.012349312), (8, 0.012352213)]",0
第一次 选择 携程 出国 导游 曾队 一路 游玩 欣赏 各国 美景 出游 团友 守时 和谐 共处 携程 安排 宾馆 不着 后不着店 宾馆 空调 曾队 跑上跑下 好多 妥善解决 退税 谢谢 下回,"[(0, 0.9713049)]",0
推荐 领队 超级 欧洲 出行 特别 姿势,"[(0, 0.0139070405), (1, 0.013903459), (2, 0.88878417), (3, 0.013895117), (4, 0.013899754), (5, 0.013904431), (6, 0.01391148), (7, 0.013897975), (8, 0.013896526)]",2
五星 伍坚 领队 经验丰富 行程 安排 人文 历史 介绍 详尽 照顾 周全 产品描述 满意 携程 市场 描述 酒店 远离 市区 酒店 安排 外出 缺少 体验 成本 至少 描述 上应 实事求是 用餐 塞纳河 船上 用餐 体验 餐饮 难吃 服务员 态度恶劣 建议 携程 更换 合作 餐厅,"[(0, 0.9802313)]",0
老爹 老妈 反馈 不错 领队 陪都 天下 影响 游船 体验 法国 酒店 早餐 国人 区别对待 现象 酒店 安排 行程 影响 游览 心情 携程 建议 酒店,"[(8, 0.96579057)]",8
本次 出行 愉快 两个 老人 本来 估计 没想到 顺利 领队 照顾 有加 非常感谢 行程 不紧不慢 老人 参加 参加 携程,"[(1, 0.9555244)]",1
领队 志在 行程 负责 旅行 体验 领队 态度 调度 期待 下次 导游 一同 哈哈哈,"[(0, 0.9406927)]",0
自费 项目 法餐 一桌 扇贝 蜗牛 总体 一般般 感觉 不值 深度 巴黎 巴黎 夜景 酒吧 小吃 一条街 埃菲尔 点灯 免费 景点 奥地利 深度 本来 行程 安排 穿过 奥地利 天鹅堡 试问 顺路 停下来 自费 商业街 放下 下午 导致 那晚 酒店 意味着 国内 凌晨 一塌糊涂 那天 晚餐 荒郊 野岭 东西 酒店 一份 牛排 罗马 下午 北京 导游 安排 深度 一他 糊涂 下午 机场 不去 听说 随便 两步 本来 行程 景点 导游 讲解 照看 不周 自费 团友 东西 导游 车上 找回 东西 表扬 行程 安排 一句 概括 行程 不好 还行,"[(8, 0.98989195)]",8
导游 亲切 行程 徐建 领队 团队 带领 团结,"[(0, 0.012354295), (1, 0.012355989), (2, 0.012353472), (3, 0.012350379), (4, 0.9011795), (5, 0.012350291), (6, 0.012353665), (7, 0.012349125), (8, 0.012353258)]",4
马导 经验丰富 行程 规划 波兰 司机 旅途愉快,"[(0, 0.8888176), (1, 0.013896317), (2, 0.013898711), (3, 0.01389882), (4, 0.013897517), (5, 0.013896495), (6, 0.013897578), (7, 0.013897008), (8, 0.013899937)]",0
携程 失望 携程 安排 描述 特别感谢 领队 孙致平,"[(0, 0.012356274), (1, 0.012355242), (2, 0.012356996), (3, 0.57821655), (4, 0.012356427), (5, 0.012353895), (6, 0.33529913), (7, 0.0123505285), (8, 0.012354927)]",3
行程 车子 抛锚 游客 钱包 意外 总体 平安 顺利 领队 荀广杰 总体 服务满意,"[(2, 0.9364747)]",2
领队 工作 认真负责 工作 辛苦 地方 负责 安排 团队 吃喝 做好 第二天 出行 计划 老年人 保证 出游 快乐 领队 导游 领队 工作 给予 好评,"[(4, 0.96442)]",4
陈仁 导游 刘桂玲 团里 阿姨 叔叔 细心 照料 税单 填好 一步 一步,"[(6, 0.93158495)]",6
携程 自营 产品品质 吃住行 不错 领队 经验丰富 一路 关照 下次 携程,"[(6, 0.92586905)]",6
第一晚 酒店 浴室 下水 庄园 酒店 房间 头顶 横梁 行程 希望 转机 谢谢,"[(0, 0.9364666)]",0
行程 安排 领队 小鲍 热情 负责 导游 专业 住宿 愉快 顺利 欧洲 感谢,"[(2, 0.93646216)]",2
行程 安排 伍坚 领队 遇上 领队 希望 下次 出游,"[(0, 0.9110629), (1, 0.011115917), (2, 0.011117917), (3, 0.011125501), (4, 0.011117093), (5, 0.01111422), (6, 0.011116074), (7, 0.011113104), (8, 0.011117268)]",0
热情 负责 一路上 关照 有加 意大利 酒店 偏远 周围环境 不好,"[(0, 0.0101091135), (1, 0.010110854), (2, 0.01010698), (3, 0.010104212), (4, 0.010107216), (5, 0.010104445), (6, 0.010108918), (7, 0.91914153), (8, 0.010106701)]",7
旅行 顺利 行程 安排 雅静 领队 导游 认真负责 第一次 碰到 负责 领队 导游,"[(2, 0.2432258), (6, 0.7011833)]",6
行程 路上 车子 团游 样子 法国 瑞士 好玩 物价 瑞士 路上 不该 总体 沟通 解决 下次 携程,"[(3, 0.95058566)]",3
旅游 总体 不错 导游 责任 平安 顺利 旅游 美中不足 科尔 小镇 晚餐 实在 建议 携程 取消 这家 中餐厅 合作 影响 携程 声誉 行程 安排 二处 不合理 自由 活动 时间 安排 不合理 浪费 好多 时间,"[(3, 0.97457993)]",3
王导 负责 全程 协调 沟通 顺利 行程,"[(0, 0.0138988625), (1, 0.013896199), (2, 0.36787513), (3, 0.01389766), (4, 0.013895042), (5, 0.013893962), (6, 0.013894784), (7, 0.5348524), (8, 0.013895991)]",7
陈述 导游 非常热心 解决 团员 提出 忙前忙后 服务 衷心 感谢,"[(0, 0.010105122), (1, 0.010108771), (2, 0.010105387), (3, 0.010107309), (4, 0.010104418), (5, 0.01010592), (6, 0.919151), (7, 0.010103697), (8, 0.010108373)]",6
感谢 陈导 五星 服务 携程 安排 团餐 特指 安排 中餐 质量 服务 难以 下咽,"[(3, 0.9406899)]",3
导游 做事 关心 时时刻刻 看着 小偷,"[(0, 0.01588024), (1, 0.015885476), (2, 0.015882192), (3, 0.015884599), (4, 0.01588633), (5, 0.87294316), (6, 0.015881117), (7, 0.015877312), (8, 0.015879558)]",5
导游 行程 导游 给予,"[(0, 0.022235813), (1, 0.8221272), (2, 0.022251314), (3, 0.02222814), (4, 0.022232162), (5, 0.0222286), (6, 0.022236142), (7, 0.022228194), (8, 0.02223243)]",1
行程 导游 左波 同行 伙伴 开心,"[(0, 0.015882647), (1, 0.015885824), (2, 0.015890107), (3, 0.015879301), (4, 0.01588171), (5, 0.015879815), (6, 0.015883947), (7, 0.015878636), (8, 0.872938)]",8
全程 好评 导游 负责 安排 司机 友好 五星 好评 范春 羚组,"[(7, 0.92586386)]",7
周毅 导游 苦口婆心 小心翼翼 语重心长 带领 住店 旅游,"[(0, 0.0123512335), (1, 0.0123530235), (2, 0.012350767), (3, 0.012351106), (4, 0.012351945), (5, 0.012350864), (6, 0.9011901), (7, 0.012349349), (8, 0.012351586)]",6
领队 热情 服务 能言善道 酒店 预想 酒店 早餐 简陋 领队 面子 希望 有所改进,"[(1, 0.936455)]",1
