时间,fenci,主题概率,主题类型
2023-11-17,回应 日方 取消 停止 食品 措施 包括 应对 措施 维护 民众 健康 正当合理 澎湃 新闻 视频 收起,"[(4, 0.3497364), (5, 0.6130629)]",5
2023-10-18,女孩 逮捕 强行 堵住 能源 会议 麻烦 女孩儿 勇敢 表情 坚定 看堵 会议 排放 核污染 飞去 堵住 会议室 遗憾 女孩 发声 支持 顺便 批评 公开 学习 排放 展现 肯定 专业 精神 筷子 重心 森林 破坏 公主 政治 制度 倾向 产物 怀疑 懂得 核污染 专业知识 依赖 提字器 听听 看法 收起,"[(0, 0.86445624), (2, 0.12207312)]",0
2024-01-30,总部 参观 信部 运营商 指标 考察 公布 数据 用户 速率 抖动 接入 时延 紧箍咒 运营商 鞭策 提高 服务质量 轮到 发言 电信 人权 倡导 全球 典范 人权 亮点 基站 辐射 危害 健康 伪科学 学历 辐射 国人 运营商 误解 很大 话费 流量 沟通 聘为 观察员 服务质量 网友 意见 建议 收起,"[(3, 0.9828637)]",3
2023-10-07,便当 水面 事件 导致 导致 出口量 下降 水产 滞销 积压 仓库 扇贝 水产 天花板 呼吁 民众 扇贝,"[(0, 0.52012426), (4, 0.44243395)]",0
2023-10-13,核污染 水排 排放 呼吁 建立 核污染 国际 安排 发布 消息 核电站 取样 海水 验出 放射性物质 浓度 辩称 采集 样本 污水 样本 小央 视频 视频 收起,"[(5, 0.9678136)]",5
2023-11-13,媒说 放射性物质 源自 核事故 废水,"[(0, 0.028044034), (1, 0.027999157), (2, 0.028088959), (3, 0.50733244), (4, 0.027934583), (5, 0.38060078)]",3
2023-10-17,记录 蓝本 纪录 生有幸 自由 潜水 漫长 人生旅途 留下 难忘 到达 万物 温柔 怀念 感动 废水 事件 人类 机会 发生 人类 听见 悲鸣 醒悟 水肺 超话 水肺 潜水 超话 视频 收起,"[(3, 0.97377485)]",3
2023-10-13,核污染 水排 排放 呼吁 建立 核污染 国际 安排 发布 消息 核电站 取样 海水 验出 放射性物质 浓度 辩称 采集 样本 污水 样本 小央 视频 视频 收起,"[(5, 0.9678137)]",5
2023-10-23,相岸 演说 声称 推动 首脑 对话 取消 水产品 禁令,"[(0, 0.016811006), (1, 0.016848477), (2, 0.6456233), (3, 0.016778782), (4, 0.016795788), (5, 0.28714263)]",2
2023-10-05,来到 祈愿 众生 海神 生灵 海鸥 哀鸣 呼吸 起伏 吃力 事情 支舞 失眠 焦虑 痛苦 疯狂 地想 贴近 痛苦 表现 前提 做出 成品 花花 听众 看官 留有 欣赏 空间 挣扎 半成品 喜欢 动作 希望 希望 听到 希望 世界 感知 感知 痛苦 挣扎 人类 求饶 人类 诉说 苦难 来到 世界 关注 地球 健康 地球 发声 老师 神树 视频 收起,"[(3, 0.9857477)]",3
2024-02-03,儿子 小儿 练完 跆拳道 吃饭 小儿 叔叔 新闻 回答 含糊 小儿 感慨 地带 可怜 地方 接话 看着 番茄酱 滑稽 感兴趣 小儿 吸溜 面条 咂巴 咂巴 演讲 题目 战争 一带 演讲 题目 小儿 还好 同学 废水 好像 金融 战争 儿子 全程 面条 爸爸 吃不完 收起,"[(0, 0.060344882), (1, 0.92466635)]",1
2023-11-17,停止 食品 本子 排放 污水 排放 排放 当成 马桶 祸害 全人类 取消 水产品 禁令 小义 良心 收起,"[(4, 0.9531923)]",4
2023-11-15,协调 时间 日本首相 峰会 会晤 创造 对话 机会 会谈 打算 撤销 水产品 措施 污水 原产地 水产品 收起,"[(4, 0.102594145), (5, 0.8597294)]",5
2024-02-28,排放 污水 排放量 时间 超过 污水 流入 电力公司 计划 年度 排放量 年度 核电站 接连 发生 污水 泄漏 火警 执意 排污 引发 担忧 国际 识局 排入 污水 收起,"[(5, 0.9701157)]",5
2023-10-06,排放 污水 事情 热度 希望 忘记 排放 污水 事情 燎原 抵制 排放 污水 保护 生态 保护 生态 小事 做起 抵制 日货 抵制 水产品 废水 超话,"[(3, 0.96781105)]",3
2023-12-01,大闸蟹 大闸蟹 甩卖 大闸蟹 便宜 公蟹 块钱 网友 螃蟹 网友 拿下 网友 给出 价格 朴朴 买菜 重量 大闸蟹 从业 人士 整体 便宜 原因 大闸蟹 整体 产量 消费者 大闸蟹 大闸蟹 礼品 属性 回忆 老主顾 送礼 公母 搭配 高端 酒店 饭店 大闸蟹 宴请 常见 不行 食用 消失 饭店 大蟹 订单 变得 有限 废水 心理 阴影 朋友 告诉 大闸蟹 大闸蟹 收起,"[(1, 0.98577356)]",1
2023-10-13,核污染 样本 检出 浓度 增高 报道 核污染 水排 排放 呼吁 建立 核污染 国际 安排 发布 消息 核电站 取样 海水 验出 放射性物质 浓度 辩称 采集 样本 污水 样本 收起,"[(5, 0.97112775)]",5
2023-11-28,听说 入选 均衡 润唇膏 老父亲 欣慰 感觉 好用 润唇膏 不火 实在 天理 颜值 颜值 内容 内容 效果 效果 价格 妥妥 便宜 坑人 倒像 韭菜 大伙 润唇膏 听说 店主 货源 成分 角鲨烷 坚果 油酯 很好 皮肤 柔润 蜡质 成分 保湿 资生堂 最爱 透明质 高贵 主打 卖点 橙皮 果油 葡糖 橙皮 抗炎 包装 粉色 润唇膏 保湿 技术 资生堂 防晒 品线 保湿 成分 资生堂 要死 抱紧 品牌 大腿 成分 要放 舅舅 奶奶 不爱 眼看 资源 势利眼 旧版 好用 程度 评价 扎实 不油 不腻 字字 属实 嘴巴 干枯 感受 深层 滋养 沟沟壑壑 嘴巴 回春 假润 润唇膏 假润 油脂 吸收 堆积 白线 死皮 嘴巴 泡成 解决不了 嘴巴 干燥 起皮 顺便 品牌 态度 废水 排海 作大 玩意 排斥 设厂 纳税 带动 就业 事情 支持 希望 日系 清醒 生产线 转移 内地 带动 产业链 纳税 牌子 识相 收起,"[(2, 0.5075369), (3, 0.4872567)]",2
2023-11-15,媒称 会谈 协商 相岸 寻找 机会 撤销 水产品 禁令,"[(0, 0.01686898), (1, 0.016697874), (2, 0.5396165), (3, 0.016764918), (4, 0.016818622), (5, 0.39323312)]",2
2023-10-30,报道 团体 言论 出版发行 机构 国际 集团 发表 联合 舆论 调查结果 电力 核电站 废水 排放 回答 担心 受访者 接近 提问 阻碍 因素 列举 风险 因素 受访者 媒称 回答 印象 恶化 恶化 历史 水平 比例 周刊 视频 收起,"[(2, 0.9778942)]",2
2023-11-03,峰会 临近 相岸 日方 力图 沟通 重申 撤销 水产品 禁令 声称 建设性 稳定 关系 敦促 承担 责任,"[(2, 0.28715962), (4, 0.1713668), (5, 0.51337147)]",5
2023-11-18,报道 声称 重申 稳定 重要性 局势 深表 忧心 军事 撤除 浮标 撤除 水产品 禁令 释放,"[(0, 0.57425356), (1, 0.010466821), (2, 0.010525809), (3, 0.010534885), (4, 0.010518727), (5, 0.38370016)]",0
2023-12-21,污水 排入 死鱼 冲上 渔船,"[(0, 0.027921373), (1, 0.027877744), (2, 0.027929042), (3, 0.8596821), (4, 0.028307706), (5, 0.028282044)]",3
2023-11-20,废水 排入 人类 生态 危害 时报 污水 危害 累计 污水 流入,"[(0, 0.013965657), (1, 0.013945371), (2, 0.013968999), (3, 0.30168355), (4, 0.6423699), (5, 0.014066503)]",4
2023-10-27,电力公司 核污染 水排 历时 排放 核污染 核污染 核辐射 发现 放射性 核辐射 浓度 低于 标准 核电站 着手 海水 稀释 注入 水槽 放射性 浓度 计划 共计 排放 核污染 放射性 辐射量 核电站 发生 核污染 过滤 管道 脱落 事故 废液 外泄 工人 身体 接触 废液 遭受 辐射 全身 遭受 废液 工人 双手 下半身 遭受 入院 治疗 报道 视频 收起,"[(5, 0.9850356)]",5
2023-12-30,评出 国际 新闻 事件 发生 时间 人工智能 产业 提速 人工智能 应用程序 用户 代表 人工智能 变革性 工具 解决 内容 表现出色 科技 巨头 竞相 加大 人工智能 投入 加速 旗下 产品 人工智能 整合 科技 产业 驱动力 人工智能 带来 机遇 有望 加快 产业 重塑 伴随 预知 风险 提出 全球 人工智能 治理 倡议 人工智能 全球 治理 提供 方案 地震 人员伤亡 靠近 边境地区 发生 地震 密集 死亡 死亡 发生 地震 人员伤亡 财产损失 灾难 发生 时间 派出 救援队 努力 拯救 提供 紧急 人道主义 物资 实际行动 诠释 构建 人类 命运 共同体 理念 斡旋 复交 带动 和解 斡旋 达成 协议 恢复 外交关系 正式 复交 地区 带动 和解 重回 恢复 大使级 外交关系 国同 关系 迈向 地区 国家 缓和 关系 谋求 势头 对话 协商 分歧 顺应 民心 符合 时代 潮流 利益 鼓吹 风险 加剧 世界 经济 困境 政客 提出 风险 概念 延续 脱钩 断链 构筑 小院 高墙 底层 逻辑 违背 经济 规律 历史 潮流 机遇 稳定 世界 经济 遭受 复苏 进程 激进 加息 银行业 风险 陡增 全球 流动性 恶化 经济体 债务 违约 风险 推进 削减 法案 芯片 科学 法案 保护主义 产业政策 引发 争相 效仿 扰乱 国际 产供 稳定 经贸 政治化 干扰 全球 市场 运行 加剧 世界 经济 困境 全球 唱响 主义 强音 金砖 机制 历史性 扩员 获邀 金砖 受邀 正式 成员 力量 壮大 全球 群体性 崛起 历史潮流 团结 共谋 呼声 意愿 全球 成员 坚定 维护 共同利益 推动 增加 市场 国家 全球 事务 代表性 反对声 核污染 水排 不顾 国际 社会 质疑 国家 单方面 强行 核事故 水排 排放 累计 超过 污水 流入 人为 排放 污水 累积 效应 不确定性 污水 事关 全人类 健康 全球 国际 公共利益 私事 日方 严肃 关切 负责 建设性 态度 妥善处理 污水 凸显 国际形势 加剧 动荡 爆发 致使 超过 死亡 酿成 人道主义 灾难 丧生 国际 社会 保护 平民 停火 止战 呼声 解决 出路 落实 方案 恢复 民族 建立 独立 危机 延宕 爆发 武装冲突 发生 政变 局部 地区 热点 国际形势 动荡 加剧 高质量 共建 一带 启新 一带 国际 高峰论坛 成功 主席 论坛 开幕式 发表 主旨 演讲 支持 高质量 共建 一带 共建 一带 方向 开辟 新愿景 注入 新动力 共建 一带 提出 国家 国际 组织 签署 相关 文件 项目 开拓 通向 机遇 繁荣 受欢迎 国际 产品 国际 平台 外交 引领 外交 谱写 主席 总统 会晤 愿景 主席 国事访问 主持 峰会 出席 金砖 国家 领导人 会晤 国事访问 出席 领导人 会议 国事访问 国际 组织 政要 会见 会谈 致电 致函 友好人士 致信 复信 外交 思想 引领 特色 外交 征程 奋进 勇毅 前行 推动 全球 倡议 全球 倡议 全球 倡议 构建 人类 命运 共同体 注入 强劲 动力 谱写 动人 气候变化 加剧 全球 记录 气候变化 加剧 洪灾 世纪 山火 灾难 热浪 天气 气候 事件 已成 常态 全球 经济社会 目标 秘书长 全球 变暖 时代 结束 全球 沸腾 时代 气候变化 大会 协定 全球 盘点 损失 损害 转型 议题 达成 共识 发出 合力 加快 强有力 信号 收起,"[(0, 0.9981203)]",0
2023-11-26,分享 眼睛 多吃含 水果 缺乏 眼睛 环境 适应能力 减退 夜盲症 预防 治疗 眼病 摄入 足够 富含 水果 甜瓜 多吃含 水果 眼睛 视网膜 储存 游离 缺乏 导致 眼睛 畏光 流泪 烧疼 发痒 视觉 疲劳 眼帘 富含 水果 香蕉 葡萄 弥猴桃 多吃含 水果 眼睛 晶状体 含量 眼睛 起到 保护 作用 缺乏 白内障 用含 水果 提高 眼睛 晶状体 含量 提高 作用 减少 自由基 眼睛 伤害 富含 水果 番石榴 奇异果 草莓 水果 水果 含有 黄素 色素 眼睛 敏感 组织 积累 组织 过滤 眼睛 起到 保护 作用 明目 枸杞 菊花 决明子 视力 健康 很大 面对 电脑 菊花茶 收到 清心 目的 效果 枸杞 明目 保护视力 很大 饮茶 视力 衰退 恢复 视力 国际 饮茶 作用 减少 计算机 荧光屏 射线 辐射 危害 收起,"[(4, 0.9927764)]",4
2023-10-11,中学 运动会 表演 刺杀 表演系 情节 事件 改编 标语 尸骨 污水 后患 教育局 学生 犯错 网友 视频 收起,"[(1, 0.9557054)]",1
2024-02-28,排放 污水 排放量 时间 超过 污水 流入 电力公司 计划 年度 排放量 年度 核电站 接连 发生 污水 泄漏 火警 执意 排污 引发 担忧 国际 识局 排入 污水 收起,"[(5, 0.9701155)]",5
2023-11-03,转发 废水 插画 日方 删帖 置顶 蜀黍 视频,"[(0, 0.018650735), (1, 0.018612955), (2, 0.018699287), (3, 0.9063074), (4, 0.018682405), (5, 0.019047173)]",3
2023-10-10,说唱 污水 发声 污水 发声 淡忘 遗忘 发声 接力 地球 发声 地球 污水 完整版 说唱 超话 视频 收起,"[(2, 0.5014014), (3, 0.46328872)]",2
2023-12-27,污水 国家 抵制 扇贝 滞销 提出 开拓 市场 方针 计划 核污染 排海 滞销 扇贝 希望 年度 人民币 目标 日方 设定 目标 人民币 人民币 目标 总额 单方面 计划 海产品 视频 视频 收起,"[(0, 0.4454957), (4, 0.22045992), (5, 0.31827354)]",0
2023-11-02,厉害 鬼子 核污染 水排 希望 就美 守护 灯火 视频,"[(0, 0.01716034), (1, 0.016961344), (2, 0.017241076), (3, 0.01689475), (4, 0.016772138), (5, 0.9149704)]",5
2024-02-02,媒称 企业界 代表团 访华 撤销 水产品 禁令 晚宴 开胃菜 金枪鱼,"[(0, 0.015198821), (1, 0.015184265), (2, 0.9237655), (3, 0.0152342655), (4, 0.0152052175), (5, 0.0154119255)]",2
2023-10-26,接触 核污染 污水 输送管 脱落 污水 工作人员 小时 体表 辐射量 达标 紧急 医院 核污染 没事 国际原子能机构 核污染 水排 背书 人员 陆战 铁骑 视频,"[(1, 0.19087814), (5, 0.78107667)]",5
2024-01-14,不知 海域 有没有 废水 陌生 环境 地方 用餐 食材 卫生 状态 不洁 痛苦,"[(0, 0.011994076), (1, 0.45743677), (2, 0.01210576), (3, 0.49435538), (4, 0.012043738), (5, 0.012064254)]",3
2024-02-08,煤西 上场 废水 滋润 顶级 变得 不酸 面瘫 煤西 态度 后果 无关 事实 情况 独立 关系 生变 前提 俱乐部 国际 股东 医学 奇迹 特区 脸面 球迷 伤口 目的 递交 名状 寻求 庇护 球迷 伤口 名状 庇护 可靠 想象 煤西 球迷 疯狂 煤球 脏东西 锦鲤 视频 收起,"[(5, 0.9821005)]",5
2023-11-07,废水 排海 排放 污水 排放 污水 排放 污水 排核 污水 放射性 成分 包括 半衰期 滞留 骨骼 肌肉组织 肿瘤 癌症 卵巢癌 膀胱癌 半衰期 导致 甲状腺癌 半衰期 人类 断裂 半衰期 半衰期 污水 废水 拒绝 冷漠 看客 收起,"[(5, 0.9766109)]",5
2024-01-25,代表团 包括 解除 水产品 禁令 找事 奉陪到底 评论 局长 视频,"[(0, 0.015236173), (1, 0.015272547), (2, 0.015388119), (3, 0.6140567), (4, 0.015307444), (5, 0.32473904)]",3
2023-12-29,献词 守住 不惑 底线 选择 值得 原创 编辑部 发表 情侣 等待 日出 记者 全文 阅读 守住 内心 守住 守住 不惑 底线 守护 人生 大盘 答案 前路 选择 值得 思考 迎接 探索 授权 转载 编辑部 积蓄 生于 迎来 创刊 人口普查 平均年龄 不惑 新闻纸 微妙 期许 诞生 现实 充满 未知 困惑 穿越 不惑 边界 求索 现代文明 答案 内蕴 基因 使命 寻刻 民族 走向 复兴 经纬 坐标 记录 个体 命运 追求 歌颂 呈现 抗拒 暴露 见证 诉说 努力 参与 壮丽 故事 故事 汲取 力量 面对 未知 困惑 背离 基因 使命 读懂 地铁 号线 稻香 中铁 工作人员 弱电 系统 专业 支架 安装 作业 记者 读懂 不惑 状态 不惑 年岁 感受 困惑 推背 变局 演变 足以 暴雨 气象 气候 支原体 肺炎 上热 流感 成热词 儿科 网约车 饱和 全职 儿女 等待 记得住 保卫 相伴 病魔 故事 摘下 口罩 感到 寒气 关系 晤谈 正确 厮杀 局中局 污水 洋流 扩散 地球 合与 取代 算法 控制 解放 人类 星辰 技术 带来 宇宙 魔咒 不惑 刷新 边界 穿越 途径 抱朴 守护 方寸 殊为 珍贵 走向 烧烤 走进 演唱会 特种兵 逝者 道别 生者 欢呼 喝彩 出演 短剧 主角 荒草 街道 魔法 舞台 主题 绿野 音乐节 风景区 现场 视觉 局中人 守住 内心 守住 守住 不惑 底线 守护 人生 大盘 加油 感受 困惑 感佩 生于 平凡 不甘 徘徊 踯躅 欣赏 迈开 脚步 理解 做出 抉择 目睹 见证 汇成 困惑 通向 醒悟 答案 前路 选择 值得 思考 迎接 探索 头破血流 闪展 腾挪 饱含 希望 奋起 升起 篝火 迎接 燃烧 降雪 天气 外卖 小哥 骑行 视觉 不惑 前行 心怀 牵挂 闯荡 背着 跳舞 扛着 世界 无可 坚强 不惑 结构 涌现 危机 萌发 生机 陷入 坚信 珍贵 遭受 厄运 志趣 光阴 淘洗 种子 破土 风华 不惑 是从 生出 创伤 明媚 暖意 驱散 焦灼 宇宙 能量 安放 不惑 直击 本质 不失 看清 热爱 洞穿 世事 心怀 慈悲 人生 绽放 不惑 见惯 在意 一滴水 倔强 柔软 兼程 不知 所起 眷念 不惑 时刻 弱者 声音 弱者 社会 来源于 自强 示弱 机会 不惑 灵魂 最亮 照亮 前路 明灯 不惑 坚定 历史 验证 共识 直面 跌宕 执手 相行 心怀 创造 不惑 坚守 正义 良知 爱心 理性 无力 悲观者 前行 力量 不惑 本源 回到 困惑 目光 梦想 地震 牛肉面 父母 孩子 课间 仅限 踏实 求解 源自 遮蔽 敲开 坚壳 触摸 答案 亲爱 读者 升起 晨曦 驱走 照进 大地 角落 照进 期待 不困 不惑 不忧 收起,"[(0, 0.997756)]",0
2023-10-08,封口费 聪明 热度 不在 排放 废水 热度 破坏 人类 世世代代 恶魔,"[(0, 0.01414577), (1, 0.013948668), (2, 0.013951285), (3, 0.85442215), (4, 0.013951456), (5, 0.08958073)]",3
2023-10-01,废水,"[(0, 0.08376077), (1, 0.08388172), (2, 0.083525404), (3, 0.58127266), (4, 0.0834591), (5, 0.08410037)]",3
2023-11-01,没见 废水 排放 机会 电火花 视频,"[(0, 0.024032569), (1, 0.024043866), (2, 0.023927193), (3, 0.024017828), (4, 0.023926543), (5, 0.88005203)]",5
2023-12-27,时间 国务 国务 长朴 购然 核污染 排放 禁止 水产品 地区 扇贝 水产品 实施 放射性物质 发现 微量 含量 提交 核素 证明 相当于 禁止 日方 计划 禁止 扇贝 日方 计划 政府 实施 海产品 严密 实施 放射性物质 新闻 网站 报道 官员 谈到 扇贝 一事 外交 渠道 提出 报道 停摆 重启 高层 经济 对话 相关 会议 讨论 水产品 民众 担心 禁止 扇贝 呼吁 解除 禁令 担忧 指出 试图 地区 扇贝 水产品 缺乏 现实 理由 阻止 情况 日方 机会 废除 水产品 禁令 排除 过程 公开 讨论 可能性 收起,"[(3, 0.5521427), (5, 0.4398376)]",3
2024-02-26,皮肤 状态 油皮 学生 时代 起痘 大学 瞎折腾 痘痘 总算 天气 饮食 皮肤 毛孔 黑头 洗完 平常 出门 化妆 瑕疵 还好 遮住 鼻子 黑头 不太能 遮住 粉底 小时 散粉 请问 姐妹 皮肤 拯救 做医 平常 水乳 废水 国货 适合 化妆品 推荐 收起,"[(0, 0.9804435)]",0
2023-11-18,希望 取消 停止 食品 措施 郑重 回应 报道 会晤 例行 记者会 污水 事关 全人类 健康 全球 国际 公共利益 严肃 关切 负责 建设性 态度 妥善处理 回应 确实 要害 日方 希望 取消 措施 维护 利益 停止 损害 全世界 利益 包括 世界 防范 应对 措施 维护 民众 健康 正当 缓和 代表 原则 让步 日方 收起 想法 做出 改变 维护 国际 社会 利益 损害 保证 利益 办法 收起,"[(5, 0.987084)]",5
2023-11-18,废水 排放 事件 不小 压力,"[(0, 0.3867999), (1, 0.027933925), (2, 0.027876643), (3, 0.5012562), (4, 0.027990002), (5, 0.028143374)]",3
2023-12-18,喜欢 游戏 朋友圈 相关 买到 粉丝 发条 爷青 朋友圈 喜欢 打卡 朋友圈 生气 废水 朋友圈 配图 没错 跟风 朋友圈 最潮 追风 收起,"[(1, 0.38096473), (5, 0.58956224)]",5
2024-02-24,参考消息 报道 电力公司 核电站 核污染 排海 节点 全国 渔业 协会 渔联 渔协 显示 渔协 回答 形象 受损 接受 团体 机构 列举 水产品 带来 损失 体现 网页 链接 收起,"[(5, 0.9711567)]",5
2023-10-04,昂贵 资生堂 废水 导致 化妆 用品 辐射 发光 换成 头皮 干爽 颅顶 护发素 容量 浪费 润泽 心疼 收起,"[(1, 0.89765465), (3, 0.06698768)]",1
2023-10-29,废水 排入 人类 危害 三维动画 废水 排入 知识 原理 视频,"[(0, 0.015208857), (1, 0.015195113), (2, 0.015238275), (3, 0.923501), (4, 0.015485965), (5, 0.015370824)]",3
2024-02-26,废水 排入 人类 生态 危害 时报 解答 大众 关切 疑问 时报 计划 排放 核污染,"[(0, 0.011177522), (1, 0.011164078), (2, 0.01117449), (3, 0.011294146), (4, 0.94389457), (5, 0.011295246)]",4
2024-01-24,经济界 团体 访问 解除 水产品 禁令 免签 脑壳,"[(0, 0.018634818), (1, 0.018671747), (2, 0.3764814), (3, 0.29309386), (4, 0.27424532), (5, 0.018872842)]",2
2024-02-15,超话 废水 确实 心虚 视频,"[(0, 0.028149856), (1, 0.027987419), (2, 0.3797579), (3, 0.028104933), (4, 0.028124513), (5, 0.5078754)]",5
2023-11-17,报道 核电站 污水 溅射 事故 电力公司 事故 原因 阀门 操作 导致 管道 内压 软管 脱落 报道 接触 废液 作业员 防范 身体 衣物 核电站 污水处理 作业员 污水 溅射 紧急 送医 掺杂 污水 废弃 液体 溅射 地面 泄漏 区域 收起,"[(1, 0.85395706), (5, 0.12882692)]",1
2023-12-11,国际原子能机构 放射性 信息系统 脚盆 核辐射 污水 排放 水域 面积 浓度 全球 核泄漏 瞒报 传统 排核 大户 霉利奸 叫嚣 核弹 毒瘤 验证 链接 网页 链接 收起,"[(3, 0.13607685), (5, 0.8379545)]",5
2024-01-02,提醒 核电站 发生 事故 地震 地震 请问 核电站 还好 电力公司 前科 公司 核电站 发生 事故 时间 顶级 核电 工程师 协助 核事故 拒绝 珐的 核能 技术 世界 顶尖 拒绝 国家 专家 堆芯 排放 污水 地震 核电站 承认 污水 排放 希望 氢弹 收起,"[(2, 0.14829922), (5, 0.8356915)]",5
2023-11-09,媒称 相岸 有意 会晤 希望 取消 水产品 禁令,"[(0, 0.01869524), (1, 0.24753097), (2, 0.28562376), (3, 0.018700687), (4, 0.018675923), (5, 0.4107734)]",5
2023-10-07,污水 计划 展开 使馆 私事 污水 排进 排放 污水 使馆 批评 日方 全世界 转嫁 核污染 风险 敦促 邻国 协商 建立 国际 机制 电力公司 污水 计划 排放 污水 日方 国际 社会 声音 利益 全球 健康 面对 发声 指摘 计划 无耻 无敌 收起,"[(5, 0.98000294)]",5
2023-10-09,核电站 污水 排海 争议 网友 排放 污水 污水 事件 无感 观光 长官 记者会 看法 有限 看待 排放 污水 现状 排放 污水 选择 收起,"[(5, 0.96505296)]",5
2024-01-01,献辞 可惜 文笔 平平 人世 开者 不诗 不歌 独有 题记 定义 想要 放弃 题目 告诉 亲爱 心路 故事 执念 朋友 散文 标题 咖位 态度 不行 浇灭 写下 文字 勇气 失散 军校 同学 懂得 承认 父母 平凡 平凡 孩子 平凡 承认 平凡 不易 承认 借用 网络 句式 可惜 文笔 平平 逝去 逝去 哲思 献辞 生长 经历 包括 生死 包括 祸福 包括 疫情 朋友 世界 组织 建议 疫情 可爱 有爱 想法 欺骗 欺骗 见面 寻常 口罩 说话 最远 远足 床铺 卧室 距离 不见 再见 天堂 战胜 疫魔 欣慰 疫情 朝日 开局 破局 放开 病毒 正面交锋 活着 思念 犹如 汹涌 洪流 席卷 急切 方向 烟火 朋友 问候 估计 内裤 烟火 全世界 新生 可惜 文笔 平平 梦想 丰满 现实 骨感 告诫 员工 突围 可悲 疫情 重创 经济 尚待 重启 复苏 地方 降薪 单位 发不出 生意 广进 声音 不确定性 化为 萦绕 不安 经历 不惑 变局 足以 暴雨 极寒 热天气 常态 新冠 甲流 乙流 支原体 肺炎 竞相 肆虐 流感 热词 股市 终成 拉锯战 覆盖 开门 扑面 寒气 关系 晤谈 正确 厮杀 局中局 污水 洋流 扩散 地球 命运 共同体 取代 算法 控制 解放 人类 星辰 技术 带来 宇宙 魔咒 见证 炎夏 房山 遭遇 侵袭 内涝 消防员 牺牲 名为 昵称 逆行 头像 背景 国旗 救援队 小时 集结 条船 冒雨 赶赴 队员 儿子 企业 上班 抛下 告诉 爷爷奶奶 出发 见证 地震 爷爷 保护 瘫痪 远离 人世 泥浆 不幸 罹难 爷爷奶奶 怀孕 姑姑 侄子 围成 走过 事情 可爱 可惜 文笔 平平 过得 还好 回到 咖位 标题 定义 想要 放弃 风靡 全网 献辞 标题 守住 不惑 底线 选择 值得 标题 好像 表达 表达 猛士 直面 人生 正视 淋漓 鲜血 看清 打不倒 强大 勇敢 骄傲 放弃 身份 技能 资源 经验 乞行 世界 真切 世界 精彩 熟悉 领域 玩法 产业 互联网 转到 消品 转到 中央 厨房 定义 机会 试着 朋友 跨界 打通 模式 质疑 谣言 风波 阻挠 堂吉诃德 坚定 梦想 看似 待遇 放弃 军事 泡泡 梦想 条路 像是 孩子 孩子 怀胎 面世 设计师 熬夜 心血 打磨 见面 当成 人生 豪赌 感谢 军地 兄弟姐妹 选择 信任 支持 呵护 火种 希望 信任 辜负 可惜 文笔 平平 不想 写下去 年岁 零碎 浪费 朋友 时间 时间 寻找 支点 杠杆 找到 撬动 人生 事业 不想 鸡血 只能 成功 激励 成功 模式 颠覆 模式 不想 风月 黑夜 清风 人生 不想 气场 善良 舒服 不想 有趣 灵魂 灵魂 有趣 性格 经历 态度 时间 不来 不想 哭诉 长出 时间 馈赠 经历 印记 生长 习惯 不想 信仰 信念 内心 交待 高尚 无关 成功 无关 不想 事业 学徒 蹒跚 学步 心得 心存 感恩 告诉 关心 朋友 平安 道声 感谢 收起,"[(1, 0.6147211), (3, 0.15373737), (4, 0.02438707), (5, 0.20631906)]",1
2023-10-04,原因 导致 信息 闭塞 污水 排放 刷遍 世界 保护 保护 废水 超话,"[(0, 0.012886476), (1, 0.012897764), (2, 0.012902998), (3, 0.93551904), (4, 0.012883073), (5, 0.012910659)]",3
2023-10-10,富士 电视 造谣 满地 游客 航班 爆满 核污 教授 太坏 仰望 视频,"[(0, 0.13332121), (1, 0.012872469), (2, 0.1009194), (3, 0.012870595), (4, 0.012867438), (5, 0.72714883)]",5
