时间,fenci,主题概率,主题类型
2023-10-22,经济 观察 消息 观光局 发布 外国游客 数量 统计 结果显示 外国游客 数量 内地 游客 数量 内地 结束 废水 事件 发酵 带来 内地 游客 数量 下滑 数量 减少 财经 视频 收起,"[(0, 0.97202665)]",0
2023-10-22,废水 恶果 显现 报道 时间 渔港 死去 铺满 水面 场面 骇人 清理 清理 总重量 水产 专家 初步判断 涌入 渔港 推测 废水 放射 死亡 原因 渔港 报告 死亡 收起,"[(2, 0.21763842), (5, 0.75912225)]",5
2023-10-22,机会 反思 不该 谴责 废水,"[(0, 0.027901951), (1, 0.027919685), (2, 0.027947651), (3, 0.8601195), (4, 0.027849425), (5, 0.02826177)]",3
2023-10-23,保护 地球 不息 女王 团队 环境污染 日益增长 人类 遭受 危机 前段时间 废水 希望 参与 保护 摇篮 地球 人类 生存 离不开 充当 人类 垃圾桶 收起,"[(3, 0.9664308)]",3
2023-10-23,排黑 废水 害死 停放 排核 污水 网页 链接 废水 后果 头条,"[(0, 0.013957463), (1, 0.013947146), (2, 0.013970254), (3, 0.9300739), (4, 0.013958152), (5, 0.014093017)]",3
2023-10-25,媒体 报道 核电站 核污染 放射性物质 过程 水管 脱落 核污染 溅出 工作人员 接触 放射性物质 核污染 佩戴 口罩 穿着 全身 防护服 身体 表面 辐射量 降低 标准值 接受 擦拭 清除 来源 新闻 客户端 核污染 标准 辐岛 核电站 员工 接触 核污染 核污染 无需 担心 清洗 核污染 收起,"[(1, 0.04546294), (3, 0.4269695), (4, 0.036049332), (5, 0.48390096)]",5
2023-10-27,亲戚 探亲 回来 女儿 说起 废水 平静 食物 溯源 不吃 识别 规避,"[(0, 0.6502599), (1, 0.012892234), (2, 0.012904558), (3, 0.2980489), (4, 0.012993751), (5, 0.0129006)]",0
2023-10-26,电视台 报道 电力公司 发布 消息 核污染 水排 电视台 报道 核污染 排海 电力公司 核污染 排放量 排放 核污染 总量 电力公司 计划 年度 排放 总计 核污染 核电站 储存 超过 核污染 电力公司 核电站 储水 妨碍 废堆 作业 核素 系统 稀释 核污染 排放 电力公司 核电站 核污染 排海 来源 收起,"[(3, 0.12689736), (5, 0.8582084)]",5
2023-10-29,在意 灾难 山火 旱灾 物种 灭绝 消失 灾难 流浪 地球,"[(0, 0.45644137), (1, 0.015238361), (2, 0.015274886), (3, 0.48261976), (4, 0.015221169), (5, 0.015204475)]",3
2023-10-30,人能 阻止 废水 人能 阻止 废水 网页 链接 作孽 报应,"[(0, 0.015188224), (1, 0.01518488), (2, 0.015301288), (3, 0.9237583), (4, 0.015270081), (5, 0.015297262)]",3
2023-10-30,废水 超话 醒醒 醒醒 醒醒 醒醒 醒醒 醒醒 醒醒 醒醒 醒醒 醒醒 醒醒 醒醒 醒醒 醒醒 醒醒 醒醒 醒醒 醒醒 醒醒 醒醒 醒醒 醒醒 醒醒 醒醒 醒醒 醒醒 醒醒 醒醒 醒醒 醒醒 醒醒 醒醒 醒醒 醒醒 醒醒 醒醒 醒醒 醒醒 醒醒 醒醒 醒醒 醒醒 醒醒 醒醒 醒醒 醒醒 醒醒 醒醒 醒醒 醒醒 醒醒 醒醒 醒醒 醒醒 醒醒 醒醒 醒醒 醒醒 醒醒 醒醒 醒醒 醒醒 醒醒 醒醒 醒醒 醒醒 醒醒 醒醒 醒醒 醒醒 醒醒 醒醒 醒醒 醒醒 收起,"[(1, 0.98931235)]",1
2023-10-31,朋友 原生 精华液 日本产,"[(0, 0.033423107), (1, 0.033424582), (2, 0.033396296), (3, 0.033401534), (4, 0.83294284), (5, 0.033411667)]",4
2023-11-01,孩子 生病 肺炎 没能 医院 儿科 疾病 高发期 抢到 心累 疫情 加核 废水 天灾 人祸 艰难 全民 体质 变得 奇差 免疫力 孩子 肺部 感染 功能 身为 父母 义务 保障 孩子 感觉 心累 孩子 早起 休闲 日子 盼头 排队 等待 日子 习惯 医院 孩子 专业 护理 人士 敏锐地 捕捉 病情 程度 治疗 孩子 发生 很大 发烧 白细胞 肺炎 发烧 体温 精神 食欲 症状 典型 拿到 肺炎 片子 大夫 肺炎 合并 细菌 感染 肺炎 常规 输液 治疗 处于 懵逼 状态 罕见 误判 病情 回去 吃药 门诊 报道 日子 感觉 欣慰 体质 沮丧 收起,"[(0, 0.1871182), (3, 0.22770925), (4, 0.33891413), (5, 0.24256496)]",4
2023-11-02,废水 超话 醒醒 醒醒 醒醒 醒醒 醒醒 醒醒 醒醒 醒醒 醒醒 醒醒 醒醒 醒醒 醒醒 醒醒 醒醒 醒醒 醒醒 醒醒 醒醒 醒醒 醒醒 醒醒 醒醒 醒醒 醒醒 醒醒 醒醒 醒醒 醒醒 醒醒 醒醒 醒醒 醒醒 醒醒 醒醒 醒醒 醒醒 醒醒 醒醒 醒醒 醒醒 醒醒 醒醒 醒醒 醒醒 醒醒,"[(1, 0.9829866)]",1
2023-11-02,顶顶 热度 废水 排海 抵制 抵制 抵制,"[(0, 0.020886177), (1, 0.15905412), (2, 0.020876441), (3, 0.7572892), (4, 0.020894742), (5, 0.020999355)]",3
2023-11-01,只能 日货 化作 刺向 同胞 身体 断送 人类 拒绝 冷漠 看客 角落里 沉默 诋毁 嘲笑 光明 照耀 抵制 日货 喜欢 产品 想置 死地 经济 抵制 经济 重新考虑 排放 污水 情况 污水 排放 排放 经济 收起,"[(0, 0.25711286), (1, 0.24972989), (3, 0.47908688)]",3
2023-11-03,全世界 恐怖组织 心痛 生灵 承受 痛苦 小鬼子 核弹 指头 高呼 新闻 关注 聚焦 清醒 谴责 施加 舆论 荒谬 泯灭 人性 消息 排放 污水 排放 污水 计划 排放 核辐射 新增 污水 小鬼子 放话 排放 技术 排放 发声 收起,"[(4, 0.5063617), (5, 0.47591493)]",4
2023-11-03,恳请 策划 废水 人类 渣子 带走 适合 地球 星球 适合 送到 太阳系,"[(0, 0.012953666), (1, 0.8351387), (2, 0.012977632), (3, 0.013113758), (4, 0.11288561), (5, 0.012930675)]",1
2023-11-04,看核 废水,"[(0, 0.056266606), (1, 0.056299444), (2, 0.056201413), (3, 0.7187063), (4, 0.056181733), (5, 0.0563445)]",3
2023-11-05,废水 图片,"[(0, 0.055822946), (1, 0.055889904), (2, 0.05567118), (3, 0.056319177), (4, 0.055623855), (5, 0.72067297)]",5
2023-11-08,抵制 日货 废水 激起 群众 抵制 日货 希望 热度 降下去 话题 发出 产品 含有 原料 产品,"[(3, 0.8574106), (5, 0.103099205)]",3
2023-11-09,小鬼子 废水 热点,"[(0, 0.041804645), (1, 0.041798238), (2, 0.041769534), (3, 0.5027056), (4, 0.32999337), (5, 0.04192866)]",3
2023-11-13,热巴 封面 家住 污水 废水 排海,"[(0, 0.02410129), (1, 0.024081992), (2, 0.024063513), (3, 0.024204163), (4, 0.024072556), (5, 0.8794765)]",5
2023-11-13,执意 废水,"[(0, 0.05577794), (1, 0.05589265), (2, 0.055683687), (3, 0.056249786), (4, 0.05571653), (5, 0.7206794)]",5
2023-11-14,战争 战争 周边国家 挑拨 废水 冷战 留学 学子 合适 看法,"[(0, 0.015288166), (1, 0.015263223), (2, 0.6613773), (3, 0.015422744), (4, 0.015264486), (5, 0.27738404)]",2
2023-11-15,电影 女娲 密谋 造反 提到 灾难 地球 核污染 农药 化肥 导致 土地 瘟疫 横行 婴儿 出生 夭折 人类基因 精子 卵子 质量 低劣 净水 不堪 地区 体验 现状 时代 开启 时代 团队 世界 神魔 支持 国家 部落 团队 超话 超话 收起,"[(1, 0.056386814), (3, 0.7340459), (4, 0.055140816), (5, 0.14608406)]",3
2023-11-17,希望 停止 废水,"[(0, 0.04179974), (1, 0.0418349), (2, 0.042360462), (3, 0.7900474), (4, 0.041855823), (5, 0.04210166)]",3
2023-11-17,废水 身体,"[(0, 0.055688884), (1, 0.055931903), (2, 0.055672593), (3, 0.7209327), (4, 0.055670395), (5, 0.05610348)]",3
2023-11-18,恋与 超话 点滴 剧情 测看 感觉 废水 感觉 正好 很好 纪录片 众神 白海豚 生存 保护 现状 点滴 结尾 希望 保护 努力 污水 发生 悲剧 伤害 融入 家园 痛苦 来源 听到 收起,"[(1, 0.20355389), (3, 0.7753979)]",3
2023-11-18,停止 废水 排海 没见 停止,"[(0, 0.027964579), (1, 0.028047591), (2, 0.02810573), (3, 0.028032957), (4, 0.027906964), (5, 0.8599422)]",5
2023-11-19,有没有 阻止 地面 战争 有没有 信仰 世纪 有没有 地面 战争 地面 战争 世界 关门 弟子 战争 小鸭子 赋予 战争 责任 安排 出世 禁止 排放 废水 化学 破坏 环境 岛国 嚣张 岛国 化学 禁止 排放 废水 失败 阻碍 化学 无能者 禁止 进门 不配 做人 学会 做起 省事 禁止 人向 投放 废水 地方 便是 大气 人类 废水 收手 全世界 负责 地方 占便宜 地方 废水 先存 停止 禁止 收起,"[(1, 0.024528068), (3, 0.7547389), (4, 0.097056426), (5, 0.11863518)]",3
2023-11-20,人核 废水 大门 全世界 要排 修有 规模 较大 酒店 客栈 产能 过剩 过热,"[(0, 0.0120384), (1, 0.011976957), (2, 0.011951914), (3, 0.9401036), (4, 0.011957259), (5, 0.011971863)]",3
2023-11-22,废水 空气,"[(0, 0.055921454), (1, 0.0557901), (2, 0.055705853), (3, 0.7204715), (4, 0.055837423), (5, 0.05627361)]",3
2023-11-22,废水 超话 醒醒 醒醒 醒醒 醒醒 醒醒 醒醒 醒醒 醒醒 醒醒 醒醒 醒醒 醒醒 醒醒 醒醒 醒醒 醒醒 醒醒 醒醒 醒醒 醒醒 醒醒 醒醒 醒醒 醒醒 醒醒 醒醒 醒醒 醒醒 醒醒 醒醒 醒醒 醒醒 醒醒 醒醒 醒醒 醒醒 醒醒 醒醒 醒醒 醒醒 醒醒 醒醒 醒醒 醒醒 醒醒 醒醒 醒醒 醒醒 醒醒 醒醒 醒醒 醒醒 醒醒 醒醒 醒醒 醒醒 醒醒 醒醒 醒醒 醒醒 醒醒 醒醒 醒醒 醒醒 醒醒 醒醒 醒醒 醒醒 醒醒 醒醒 醒醒 醒醒 收起,"[(1, 0.989031)]",1
2023-11-23,污水 排放 污水 视频 国际形势 废水 最新消息 正义 发声 小子 故事 视频,"[(0, 0.2782732), (1, 0.0129406275), (2, 0.012931355), (3, 0.669958), (4, 0.01292861), (5, 0.0129682105)]",3
2023-11-23,根本就是 刺杀 时间 请问 刺杀 成功 认知 局限 世界 很大 内容 人类 社会 社会分工 办法 提高 整体 认知 放到 层面 估计 社会 整体 认知 具备 何谈 举例 标榜 材料 核电站 泄露 废水 玻璃厂 原本 加班加点 订单 赶工 高品质 玻璃 交付 陨石 冲击波 击碎 成品 玻璃 请问 跟踪 靠近 地球 小行星 耗尽 算力 陨石 运载 贵重 商品 疯狗 货都 没了 疯狗 地震 世界 未知 事物 收起,"[(1, 0.66587055), (2, 0.036175497), (3, 0.048695754), (4, 0.02215678), (5, 0.22454078)]",1
2023-11-23,衣服 废水 支持 国产,"[(0, 0.033536386), (1, 0.36806497), (2, 0.49744377), (3, 0.03389041), (4, 0.033420008), (5, 0.033644475)]",2
2023-11-24,专家 学者 安排 废水 绝杀 视频,"[(0, 0.02394981), (1, 0.023944648), (2, 0.023949495), (3, 0.024020502), (4, 0.024047399), (5, 0.88008815)]",5
2023-11-25,会见 外相 阳子 时间 委员 外交部长 出席 外长 会见 外相 阳子 主席 会晤 重申 恪守 政治 文件 原则 确认 推进 战略 互惠 关系 定位 致力于 构建 契合 时代 建设性 稳定 提供 政治 引领 落实 领导人 共识 推动 健康 正确轨道 主席 指出 邻居 友好 互利 符合 两国人民 根本利益 战略 互惠 关系 制定 路线图 时间表 重建 战略 互惠 关系 树立 正确 认知 构成威胁 合作伙伴 尊重 正当 关切 日方 信守 承诺 切实 恪守 原则 干涉 内政 核污染 水排 事关 民众 健康 日方 作法 建立 利益 独立 推进 机制 互利 抵制 全球化 保护主义 切实 维护 产供 稳定 畅通 阳子 领导人 达成 共识 确认 战略 互惠 关系 定位 致力于 构建 契合 时代 建设性 稳定 关系 互利 应对 气候变化 全球性 日方 愿同 紧密 协调 对话 沟通 积累 积极因素 推动 关系 领导人 指明 方向 日方 立场 建设性 态度 对话 寻找 解决 废水 途径 双方同意 探讨 经济 高层 对话 交流 机制 会议 适时 战略 对话 对话 外交 当局 局势 交换 意见 来源 网站 收起,"[(5, 0.99467516)]",5
2023-11-25,时间 委员 外交部长 出席 外长 会见 外相 阳子 主席 会晤 重申 恪守 政治 文件 原则 确认 推进 战略 互惠 关系 定位 致力于 构建 契合 时代 建设性 稳定 提供 政治 引领 落实 领导人 共识 推动 健康 正确轨道 主席 指出 邻居 友好 互利 符合 两国人民 根本利益 战略 互惠 关系 制定 路线图 时间表 重建 战略 互惠 关系 树立 正确 认知 构成威胁 合作伙伴 尊重 正当 关切 日方 信守 承诺 切实 恪守 原则 干涉 内政 核污染 水排 事关 民众 健康 日方 作法 建立 利益 独立 推进 机制 互利 抵制 全球化 保护主义 切实 维护 产供 稳定 畅通 阳子 领导人 达成 共识 确认 战略 互惠 关系 定位 致力于 构建 契合 时代 建设性 稳定 互利 应对 气候变化 全球性 日方 愿同 紧密 协调 对话 沟通 积累 积极因素 推动 关系 领导人 指明 方向 日方 立场 建设性 态度 对话 寻找 解决 废水 途径 双方同意 探讨 经济 高层 对话 交流 机制 会议 适时 战略 对话 对话 外交 当局 局势 交换 意见 收起,"[(5, 0.99446326)]",5
2023-11-25,放射性 来源于 核武器 核工业 放射性 废物 排放 核事故 泄漏 辐射源 装置 射线 电视机 显像管 自然界 资源 覆盖 地球表面 面积 人类 社会 占有 地位 同学 废水 危害 体会 责任 同学 树立 保护 观念 增强 意识 溯源 文史 协会 联合 绿色 地球 协会 举办 宣讲 面对 全人类 保护 保卫 健康 努力 蓝色 星球 澄澈 底色 明辨 举办 收起,"[(1, 0.06478743), (2, 0.55327666), (3, 0.23564015), (5, 0.14037006)]",2
2023-11-26,时间 委员 外交部长 出席 外长 会见 外相 阳子 重建 战略 互惠 关系 树立 正确 认知 构成威胁 合作伙伴 尊重 正当 关切 日方 信守 承诺 切实 恪守 原则 干涉 内政 核污染 水排 事关 民众 健康 日方 作法 建立 利益 独立 推进 机制 互利 抵制 全球化 保护主义 切实 维护 产供 稳定 畅通 阳子 领导人 达成 共识 确认 战略 互惠 关系 定位 致力于 构建 契合 时代 建设性 稳定 互利 应对 气候变化 全球性 日方 愿同 紧密 协调 对话 沟通 积累 积极因素 推动 关系 领导人 指明 方向 日方 立场 建设性 态度 对话 寻找 解决 废水 途径 网站 发布 视频 收起,"[(5, 0.9912002)]",5
2023-11-27,花痴 脑腰 尾巴 霸凌 新能源 人祸 石油资源 想到 太阳能 新能源 大饼 太阳能 板块 新能源 废水 太阳能 保证 人祸 地球 全球 金主 爸爸 得罪 人祸 反复 表态 底线 太阳能 金主 得罪 退休 咸鱼 人祸 收起,"[(0, 0.17856337), (3, 0.06502723), (4, 0.1606167), (5, 0.5860752)]",5
2023-11-28,核污染 水排 事关 全人类 健康 日方 正视 国际 社会 担忧 核污染 水排 事关 全人类 健康 日方 正视 国际 社会 担忧 新闻 超话 视频,"[(5, 0.96511155)]",5
2023-11-29,废水 不吃 刺身 胆儿,"[(0, 0.033866886), (1, 0.033495728), (2, 0.03346651), (3, 0.83215046), (4, 0.033515144), (5, 0.033505294)]",3
2023-11-30,致力于 友好 事业 邦交 作出 贡献 创价 学会 名誉会长 公明党 创始人 信赖 尊重 老朋友 朋友 公明党 现任 党首 访华 计划 访问 正式 废水 导致 访华 行程 延期 例行 记者会 作出 回应 党首 公明党 代表团 访华 希望 沟通交流 推动 改善 足以 表达 访华 态度 推迟 访华 措辞 改变 释放 信号 足以 日方 沟通 交流 推动 重回 健康 稳定 正确轨道 收起,"[(1, 0.027014563), (2, 0.016609766), (4, 0.083431944), (5, 0.86734116)]",5
2023-11-30,废水 听说 爆发 猪瘟 猪肉 支原体 衣原体 感染 不让 流鼻涕,"[(0, 0.015261948), (1, 0.6696759), (2, 0.015234255), (3, 0.015289282), (4, 0.26926), (5, 0.0152786095)]",1
2023-12-03,发生 扇贝 大面积 死亡 事件 确认 死亡 影响面 水产 担忧 产量,"[(0, 0.014026901), (1, 0.303315), (2, 0.01394562), (3, 0.0139916735), (4, 0.4094625), (5, 0.24525827)]",4
2023-12-05,事件 热度 世界 发声 宁汐 视频,"[(0, 0.024039267), (1, 0.023945885), (2, 0.023929715), (3, 0.8801508), (4, 0.023939822), (5, 0.023994524)]",3
2023-12-08,关注 废水 危害 关注 新闻 网页 链接,"[(0, 0.02088546), (1, 0.020896409), (2, 0.020890959), (3, 0.4869746), (4, 0.020974172), (5, 0.4293784)]",3
2023-12-08,自称 排放 污水 干净 透明 拒绝 采样 废水 计划 污水 倾倒 排放 网页 链接,"[(0, 0.2184061), (1, 0.0111461), (2, 0.011136769), (3, 0.011225403), (4, 0.011247094), (5, 0.7368386)]",5
2023-12-09,全球 升温 首破 时代 可喜 可悲 享受 科技进步 全球化 带来 富足 便利 承受 生产力 气候变化 废水 新冠 疫情 全球,"[(0, 0.37320355), (3, 0.5929939)]",3
2023-12-08,导致 核辐射 超标 废水 数据 造假 地球 负面影响 时间 贫道 视频 跟着 渔民 出海,"[(0, 0.011144697), (1, 0.011192327), (2, 0.40976986), (3, 0.16538197), (4, 0.011194377), (5, 0.39131677)]",2
2023-12-11,核泄漏 废水,"[(0, 0.055721615), (1, 0.055711888), (2, 0.055612843), (3, 0.72156227), (4, 0.055601463), (5, 0.05578989)]",3
2023-12-14,核设施 掩盖 核泄漏 沉默 废水 态度,"[(0, 0.023917928), (1, 0.023872958), (2, 0.023877183), (3, 0.88034534), (4, 0.023851944), (5, 0.024134701)]",3
2023-12-17,废水 地球 无助 祸害 祸害,"[(0, 0.02788172), (1, 0.02792725), (2, 0.57821435), (3, 0.028185958), (4, 0.02783755), (5, 0.30995315)]",2
2023-12-17,轻易 废水 无害 言论 小央 视频 视频,"[(0, 0.020914497), (1, 0.020995768), (2, 0.020986333), (3, 0.62805575), (4, 0.021006523), (5, 0.28804109)]",3
2023-12-17,废水 超话 醒醒 醒醒 醒醒 醒醒 醒醒 醒醒 醒醒 醒醒 醒醒 醒醒 醒醒 醒醒 醒醒 醒醒 醒醒 醒醒 醒醒 醒醒 醒醒 醒醒 醒醒 醒醒 醒醒 醒醒 醒醒 醒醒 醒醒 醒醒 醒醒 醒醒 醒醒 醒醒 醒醒 醒醒 醒醒 醒醒 醒醒 醒醒 醒醒 醒醒 醒醒 醒醒 醒醒 醒醒 醒醒 醒醒 醒醒 醒醒 醒醒 醒醒 醒醒 醒醒 醒醒 醒醒 醒醒 醒醒 醒醒 醒醒 醒醒 醒醒 醒醒 醒醒 醒醒 醒醒 醒醒 醒醒 醒醒 醒醒 醒醒 收起,"[(1, 0.9885801)]",1
2023-12-17,发现 电池 废水 垃圾 倾倒 污水 想象 不到 人类 底线 希望 神灵 开眼 带走 败类 国家,"[(0, 0.5543384), (1, 0.11058532), (3, 0.23500028), (4, 0.08025678)]",0
2023-12-18,废水 恶果 享受 肯定 本子,"[(0, 0.027892223), (1, 0.027884498), (2, 0.027912118), (3, 0.86049235), (4, 0.027894953), (5, 0.027923917)]",3
2023-12-18,缺氧 导致 鱼类 死亡 废水 关系 缺氧 死亡 鱼类 食用 渔民 不用 省事 省心 轻松 愉悦 不见 棺材 落泪 造孽,"[(3, 0.11158495), (4, 0.13896988), (5, 0.72536993)]",5
2023-12-22,神仙 回路,"[(0, 0.05648231), (1, 0.0565219), (2, 0.056484688), (3, 0.056514643), (4, 0.056483664), (5, 0.7175127)]",5
2023-12-24,办法 阻止 排放 废水 核污染 排入 置于 国际 被告席 国际 社会 谴责 必要措施 包括 禁止 产品 市场 维护 废水 全球性 灾难 谴责 办法 阻止 排放 废水 全球 关注 保护环境 人类 健康 寻找 平衡 过程 确保 废水 全球性 国际 领域 找到 解决 方法 废水 释放 水域 利用 先进 技术 高标准 处理工艺 确保 无害 排放 实践 举措 环境保护 公众 健康 效果 面临 类似 创新 方法 废水 引入 先进 技术 过滤 分离 废水 放射性物质 限度 降低 环境 人体 健康 风险 可恶 负责 措施 废水 排放 废水 反噬 很大 资源 浪费 建造 维护 废水 设施 资源 资金 消耗 经济 财政 负担 环境污染 废水 含有 放射性物质 排放 环境 环境 人类 健康 不遇 海鱼 死亡 事件 潮水 海鱼 堵塞 航道 全球 震惊 国际 社会 谴责 排放 废水 国际 社会 谴责 批评 国际形象 外交关系 负面影响 经济 国家 商品 旅游业 抵制 经济 不利 风险 排放 废水 带来 缓解 电力 短缺 废水 排放 环境 人类 健康 排放 废水 全球 破坏 带来 反噬 经济 环境 国际形象 不利 权衡利弊 基础 做出 正确 决策 财富 道闻 厚生 财富 视频 收起,"[(0, 0.017480401), (1, 0.03217562), (2, 0.024980485), (3, 0.21494193), (5, 0.70942503)]",5
2023-12-27,作者 区分 好奇 惊奇 褒义 贬义 沉沦 好奇 猎奇 妥帖 思想 逗留 狮子 企鹅 阅历 富贵 权势 众人 热衷 围观 逗留 等闲 互联网 围观 连核 废水 围观 反衬 闹剧 群众 向来 野心家 得逞 存在论 论文集 开篇 求知 本性 源始 含义 翻译 本质 欲求 好奇 快乐 哲学 快乐 理解 等闲 好奇 忙于 理解 事物 跳到 放纵 世界 好奇 逗留 好奇 惊奇 闲暇 区别 开来 惊奇 寻求 闲暇 逗留 考察 好奇 不肯 逗留 寻求 激动 好奇 理解 好奇 方式 地被 闲言 好奇 好奇 封闭 闲言 理解 时间 收起,"[(0, 0.015136484), (1, 0.09057517), (2, 0.027484952), (3, 0.24889022), (5, 0.61595625)]",5
2023-12-31,痛心 居民 贫道 视频 跟着 渔民 出海,"[(0, 0.020861369), (1, 0.020939222), (2, 0.71844167), (3, 0.020914853), (4, 0.020910613), (5, 0.19793229)]",2
2023-12-31,感悟 放假 回老家 老同学 吃饭 席间 聊到 禽兽 原子弹 无辜 国家 改造 表现 评论 肯定 提到 废水 认知 能力 奴才 拉下 神坛 社会 规则 平等 居于 宽容 结论 利用 对象 收起,"[(1, 0.05601984), (2, 0.077533156), (3, 0.44192898), (4, 0.0429169), (5, 0.3762579)]",3
2024-01-01,地震 现场 画面 倭寇 废水 地球 犯罪分子 发起,"[(0, 0.37283802), (1, 0.018681156), (2, 0.5524186), (3, 0.018839654), (4, 0.018570334), (5, 0.018652208)]",2
2024-01-01,忘记 废水,"[(0, 0.7194486), (1, 0.05602787), (2, 0.05572546), (3, 0.05691448), (4, 0.05568948), (5, 0.05619405)]",0
2024-01-01,愿望 世界 罪孽 不悟 需偿 旧业 终止 废水 爱护 生养 爱护 万恶 为首 珍惜 感恩,"[(0, 0.10275453), (1, 0.0105231), (2, 0.42488906), (3, 0.44079593), (4, 0.010511647), (5, 0.01052578)]",3
2023-12-31,热点 回顾 烟花 歌舞 刷屏 烧烤 外国人 自杀 声音 停播 刀郎 复出 废水 风头 武装 收起,"[(1, 0.010045224), (2, 0.50260794), (3, 0.30831867), (4, 0.15911636)]",2
2024-01-02,对抗 废水 希望,"[(0, 0.041893363), (1, 0.041861154), (2, 0.04302459), (3, 0.7892652), (4, 0.041814346), (5, 0.042141356)]",3
2024-01-02,好像 拒绝 废水 绝食,"[(0, 0.03358453), (1, 0.03354154), (2, 0.033369757), (3, 0.83245045), (4, 0.033351976), (5, 0.03370174)]",3
2024-01-02,前段时间 废水,"[(0, 0.05568171), (1, 0.05571421), (2, 0.055617213), (3, 0.7215908), (4, 0.055598773), (5, 0.05579725)]",3
2024-01-02,废水,"[(0, 0.08375971), (1, 0.08388056), (2, 0.08352504), (3, 0.5813097), (4, 0.08345887), (5, 0.084066145)]",3
2024-01-02,核电站 事故 废水 危害 全球 海域 热度,"[(0, 0.020911941), (1, 0.020916333), (2, 0.020959517), (3, 0.89510584), (4, 0.021053681), (5, 0.021052675)]",3
2024-01-02,废水 公平,"[(0, 0.05581251), (1, 0.055723734), (2, 0.055670395), (3, 0.7208356), (4, 0.055607922), (5, 0.05634984)]",3
2024-01-02,手机 完备 手机 市场 要强 过了 购物 用到 老年人 操作 操作 简单 砍价 远离 废水 超话 网易 新闻 超话 超话 收起,"[(1, 0.7494643), (5, 0.22001366)]",1
2024-01-02,离谱 说好 严谨 工匠 废水 排海,"[(0, 0.02386772), (1, 0.02387855), (2, 0.024181645), (3, 0.6464994), (4, 0.023874242), (5, 0.25769842)]",3
2024-01-01,发生 地震 网传 目的 核试验 往事 对抗 新冠 疫情 废水 世界 心愿 努力 达成,"[(0, 0.011262476), (1, 0.011203284), (2, 0.011313203), (3, 0.64259577), (4, 0.011201735), (5, 0.31242353)]",3
2024-01-01,废水 我行我素 岛国 沉没 灭亡 国家 迁移 世界 居住 接收 伤害 伤疤 机会 霸占 亡国 重建 家门 找死 连发 强震 引发 海啸 下令 应对 领馆 提醒 连发 强震 引发 海啸 下令 应对 领馆 提醒 收起,"[(0, 0.16892545), (2, 0.61179227), (4, 0.047192976), (5, 0.16269648)]",2
2024-01-01,废水 报复,"[(0, 0.055845357), (1, 0.7201678), (2, 0.055688474), (3, 0.056572318), (4, 0.055656243), (5, 0.056069754)]",1
2024-01-01,老百姓 平安 垃圾 地震 回收 赞同 废水 垃圾,"[(0, 0.8201117), (1, 0.01863428), (2, 0.018664356), (3, 0.018754251), (4, 0.10514254), (5, 0.018692894)]",0
2024-01-03,陆地 生灵 侵犯 陆地 陆地 生物 侵犯 欺负 废水 平衡 打破 蓝色 星球,"[(0, 0.011933432), (1, 0.012028237), (2, 0.012050724), (3, 0.7010179), (4, 0.2509703), (5, 0.011999371)]",3
2024-01-02,巧合,"[(0, 0.08353457), (1, 0.08336651), (2, 0.08336662), (3, 0.5829996), (4, 0.08336659), (5, 0.083366126)]",3
2024-01-06,废水 情况 不报 太监,"[(0, 0.033778), (1, 0.03378612), (2, 0.03375251), (3, 0.033891223), (4, 0.033823494), (5, 0.8309687)]",5
2024-01-06,地震 时间 提供 燃料 废水 长点,"[(0, 0.023979824), (1, 0.024002485), (2, 0.02401223), (3, 0.024023067), (4, 0.023986435), (5, 0.87999594)]",5
2024-01-07,发现 评分 怪物 描述 部队 人类 人为 哆嗦 恐惧 愤怒 憎恨 热度 发生 废水 爆火 部队 犯下 恶行 遗忘 铭记 历史 自强 收起,"[(0, 0.14168727), (1, 0.14528619), (3, 0.62677187), (5, 0.07222606)]",3
2024-01-10,废水 事件 日料 小吃店 撇清 转型 例外 凸出 寿司 匠人 定位 菜单 量变 菜价 不值 回到 购买 双人 餐券 值得 收起,"[(0, 0.42175117), (2, 0.5474896)]",2
2024-01-12,废水 排海,"[(0, 0.055805985), (1, 0.05584204), (2, 0.05568696), (3, 0.056436498), (4, 0.05570784), (5, 0.72052073)]",5
2024-01-14,污水 排放,"[(0, 0.056161623), (1, 0.055713434), (2, 0.05581633), (3, 0.05637561), (4, 0.055900294), (5, 0.72003275)]",5
2024-01-13,废水 矛盾 市场 水产品 大谱 产量 超过 原因,"[(0, 0.018682636), (1, 0.31556407), (2, 0.018681142), (3, 0.018799175), (4, 0.018715177), (5, 0.6095578)]",5
2024-01-17,豆腐 买家 转基因 大豆 转不 转基因 方方面面 不住 鬼子 废水 海产品 有没有 渔民 总得 吃饭,"[(0, 0.010514057), (1, 0.5392144), (2, 0.010566129), (3, 0.010578854), (4, 0.23455578), (5, 0.19457082)]",1
2024-01-17,下毒,"[(0, 0.16775703), (1, 0.16693847), (2, 0.16959797), (3, 0.1635558), (4, 0.16914523), (5, 0.16300555)]",2
2024-01-18,废水 引发 扇贝 危机 超市 打折 促销 寿司店 大减价 仓库 降价 民众 网友 活该,"[(0, 0.12696894), (1, 0.44686517), (2, 0.011324618), (3, 0.39222056), (4, 0.011291441), (5, 0.011329295)]",1
