时间,fenci,主题概率,主题类型
2023-10-22,上帝 神明 无辜 孩子 废水 儿童 数字 妈妈 孩子 消息 刺痛,"[(0, 0.013959335), (1, 0.014060088), (2, 0.013969429), (3, 0.014121874), (4, 0.6225752), (5, 0.321314)]",4
2023-10-22,种草 废水 事件 放弃 疯狂 心动,"[(0, 0.02394469), (1, 0.023924245), (2, 0.023856144), (3, 0.8802341), (4, 0.024036152), (5, 0.024004674)]",3
2023-10-22,核污染 关注 废水 相关 新闻 加油,"[(0, 0.023906283), (1, 0.024394084), (2, 0.023870176), (3, 0.8796846), (4, 0.023926176), (5, 0.024218613)]",3
2023-10-22,懊恼 护肤品 不知 揪心 躲避 食物链 无可 无可 孩子 承受 代价 人类 灭亡 收起,"[(0, 0.11674576), (1, 0.011212633), (2, 0.838433), (3, 0.011179535), (4, 0.011219714), (5, 0.011209324)]",2
2023-10-22,污水 排放 降下去 危害 全世界 事情 遗忘,"[(0, 0.02113729), (1, 0.020892825), (2, 0.020909747), (3, 0.8950886), (4, 0.020972375), (5, 0.020999145)]",3
2023-10-21,武器 核弹 电核 污水 采购 水产品 排水 废水 阴谋 接受 抱歉 核电站 废水 黑色,"[(0, 0.011200162), (1, 0.011143176), (2, 0.011150076), (3, 0.011234467), (4, 0.011149481), (5, 0.9441226)]",5
2023-10-23,全人类 听令 沉沦,"[(0, 0.042525217), (1, 0.04211466), (2, 0.7860307), (3, 0.04367039), (4, 0.043168016), (5, 0.04249098)]",2
2023-10-23,秘密,"[(0, 0.08340033), (1, 0.08337248), (2, 0.5830886), (3, 0.08339407), (4, 0.083372556), (5, 0.08337198)]",2
2023-10-23,废水 流浪 动物 火星人 扫射 垃圾 泄愤 动物 活人,"[(0, 0.01680236), (1, 0.016741864), (2, 0.016742751), (3, 0.91623014), (4, 0.016733343), (5, 0.016749563)]",3
2023-10-23,核污染 关注 废水 相关 新闻 加油,"[(0, 0.023906285), (1, 0.024394067), (2, 0.023870178), (3, 0.8796856), (4, 0.023926178), (5, 0.024217734)]",3
2023-10-23,废水 超话,"[(0, 0.055771586), (1, 0.056152154), (2, 0.05638826), (3, 0.7200579), (4, 0.055735394), (5, 0.05589466)]",3
2023-10-23,爆发 集会 示威者 横幅 大喊 总理 下台 看不惯 怀府 刀客 视频,"[(0, 0.013962255), (1, 0.013977369), (2, 0.013955158), (3, 0.013977379), (4, 0.9301295), (5, 0.013998328)]",4
2023-10-24,喜欢 螃蟹 蟹肉 头疼 恶心 废水 想着 机会 好好看 朋友 顺便 自助 年轻 战斗力 不让 光现 没算 做好 菜式 开关 吃开 回来 螃蟹 增大 开销 痛风 风险 吃到 收起,"[(4, 0.97203165)]",4
2023-10-24,跃进 跃进 教授 经典 演讲 废水 地球 倭国 视频,"[(0, 0.2857055), (1, 0.01672285), (2, 0.017171586), (3, 0.6467665), (4, 0.016726214), (5, 0.016907353)]",3
2023-10-24,废水 超话 醒醒 醒醒 醒醒 醒醒 醒醒 醒醒 醒醒 醒醒 醒醒 醒醒 醒醒 醒醒 醒醒 醒醒 醒醒 醒醒 醒醒 醒醒 醒醒 醒醒 醒醒 醒醒 醒醒 醒醒 醒醒,"[(1, 0.97021735)]",1
2023-10-24,化为 减少 热恼 病疾 奇门 视频,"[(0, 0.023949414), (1, 0.75772303), (2, 0.023956114), (3, 0.02401864), (4, 0.14626934), (5, 0.024083477)]",1
2023-10-24,废水,"[(0, 0.083760105), (1, 0.083881296), (2, 0.08352515), (3, 0.58129877), (4, 0.08345894), (5, 0.08407571)]",3
2023-10-24,延年益寿 旅游网 视频,"[(0, 0.04184825), (1, 0.04191242), (2, 0.7898658), (3, 0.042066585), (4, 0.04206537), (5, 0.042241555)]",2
2023-10-24,核污染 关注 废水 相关 新闻 加油,"[(0, 0.023906277), (1, 0.024393985), (2, 0.023870172), (3, 0.8796895), (4, 0.023926172), (5, 0.02421385)]",3
2023-10-24,遗忘,"[(0, 0.08356178), (1, 0.08339019), (2, 0.08352297), (3, 0.58258057), (4, 0.0834547), (5, 0.08348981)]",3
2023-10-24,新品 女士 水乳 摊牌,"[(0, 0.21652406), (1, 0.64952445), (2, 0.033430252), (3, 0.033662084), (4, 0.03343014), (5, 0.03342899)]",1
2023-10-24,感觉 热度,"[(0, 0.055571005), (1, 0.05606417), (2, 0.05571834), (3, 0.7214015), (4, 0.055627476), (5, 0.05561747)]",3
2023-10-24,废水 危险 超标 核电 废水 危险 超标 机场 旅客 携带 核辐射 超标 辐射量 微西 小时 超出 现场 放射性物质 世卫 组织 国际 癌症 机构 列入 致癌物 清单,"[(1, 0.5330466), (2, 0.08031778), (5, 0.36789033)]",1
2023-10-24,武器 爆炸 核弹 电核 污水 采购 水产品 排放 排水 废水 阴谋 接受 抱歉 排放 核电站 废水 黑色 收起,"[(5, 0.95589453)]",5
2023-10-25,污水 排放 忘记 污水 废水,"[(0, 0.028246624), (1, 0.027848601), (2, 0.027861947), (3, 0.8601277), (4, 0.027893726), (5, 0.028021386)]",3
2023-10-25,较劲 活路 经济 成本 提高 效率 下降 缓和 高层 迹象 显示 和解 方向 转向 物理学家 经济 交互 趋于 未有 变局 世纪 疫情 交锋 战争 废水 事件 接连 爆炸 原有 价值链 打断 价值链 不稳固 处于 震荡 状态 经济运行 效率 价值观 出轨 人民公仆 企业家 中取 价值观 法律 成本 变低 察觉 收起,"[(0, 0.98316514)]",0
2023-10-25,孩子,"[(0, 0.08348397), (1, 0.08368804), (2, 0.08375883), (3, 0.08353499), (4, 0.5820322), (5, 0.08350198)]",4
2023-10-25,跃进 教授 霸气 发言 灭掉 跃进 跃进 教授 经典 演讲 国耻 废水 读书 视频,"[(0, 0.7491415), (1, 0.011170344), (2, 0.20600688), (3, 0.011265851), (4, 0.011181169), (5, 0.011234196)]",0
2023-10-25,武器 爆炸 核弹 电核 污水 采购 水产品 排放 排水 废水 阴谋 接受 抱歉 排放 核电站 废水 黑色 收起,"[(5, 0.9558891)]",5
2023-10-25,排完 风生水 国土 沦陷 可笑 休息 熬夜,"[(0, 0.020931318), (1, 0.020927332), (2, 0.020925943), (3, 0.02129057), (4, 0.020933576), (5, 0.8949913)]",5
2023-10-26,遗忘,"[(0, 0.08356163), (1, 0.08339019), (2, 0.08352299), (3, 0.5825807), (4, 0.08345469), (5, 0.08348981)]",3
2023-10-26,抵制 日货,"[(0, 0.055581935), (1, 0.05560189), (2, 0.055558264), (3, 0.72209597), (4, 0.05558759), (5, 0.05557434)]",3
2023-10-26,废水 毁灭 毁灭 全世界 世界 消失,"[(0, 0.024150485), (1, 0.024108982), (2, 0.023920871), (3, 0.8800764), (4, 0.023865217), (5, 0.023878073)]",3
2023-10-26,召唤,"[(0, 0.083594196), (1, 0.08359385), (2, 0.08359486), (3, 0.58203167), (4, 0.0835946), (5, 0.083590865)]",3
2023-10-26,武器 爆炸 核弹 电核 污水 采购 水产品 排放 排水 废水 阴谋 接受 抱歉 排放 核电站 废水 黑色 收起,"[(5, 0.95589656)]",5
2023-10-26,热度 分散 注意力 只能 看着 发生,"[(0, 0.023910705), (1, 0.024101693), (2, 0.02391802), (3, 0.88019556), (4, 0.023874007), (5, 0.024000008)]",3
2023-10-26,引流 废水,"[(0, 0.056027774), (1, 0.05608814), (2, 0.055909004), (3, 0.05650894), (4, 0.05587497), (5, 0.7195912)]",5
2023-10-26,废水 超话 醒醒 醒醒 醒醒 醒醒 醒醒 醒醒 醒醒 醒醒 醒醒 醒醒 醒醒 醒醒 醒醒 醒醒 醒醒 醒醒 醒醒 醒醒 醒醒 醒醒 醒醒 醒醒 醒醒 醒醒 醒醒 醒醒 醒醒 醒醒 醒醒 醒醒 醒醒 醒醒 醒醒 醒醒 醒醒 醒醒 醒醒 醒醒 醒醒 醒醒 醒醒 醒醒 醒醒 醒醒 醒醒 醒醒 醒醒 醒醒 醒醒 醒醒 醒醒 醒醒 醒醒 醒醒 醒醒,"[(1, 0.98562753)]",1
2023-10-26,国货,"[(0, 0.083435215), (1, 0.083569214), (2, 0.08335046), (3, 0.5829135), (4, 0.083350465), (5, 0.08338114)]",3
2023-10-26,关注,"[(0, 0.08343744), (1, 0.083558924), (2, 0.083520375), (3, 0.582039), (4, 0.08377563), (5, 0.08366867)]",3
2023-10-26,废水 超话 关注,"[(0, 0.041781966), (1, 0.041970834), (2, 0.04206557), (3, 0.7905055), (4, 0.04180655), (5, 0.041869547)]",3
2023-10-26,废水 数值 数值 产业 打击 沉默 网络 热点 打算 淡化 政治 站队 海鱼,"[(0, 0.011952693), (1, 0.012049034), (2, 0.1821358), (3, 0.7698015), (4, 0.011960986), (5, 0.012099969)]",3
2023-10-25,喜欢 糯米 糯米 疗愈 疾病 世界 灾难 不临 网页 链接,"[(0, 0.7092885), (1, 0.015227817), (2, 0.0152056245), (3, 0.015291782), (4, 0.015253599), (5, 0.22973266)]",0
2023-10-27,关注,"[(0, 0.0834374), (1, 0.08355878), (2, 0.08352082), (3, 0.5820447), (4, 0.08376879), (5, 0.083669476)]",3
2023-10-27,读得 事心 怜悯 只能 共情 犯错 受罚,"[(0, 0.8953443), (1, 0.020918136), (2, 0.020916255), (3, 0.020985382), (4, 0.020877087), (5, 0.020958833)]",0
2023-10-27,希望 排放 废水 抵制 日货,"[(0, 0.027913302), (1, 0.027844235), (2, 0.02784708), (3, 0.8606009), (4, 0.027844205), (5, 0.02795029)]",3
2023-10-27,只能 看着,"[(0, 0.055925358), (1, 0.7198211), (2, 0.0559722), (3, 0.056133293), (4, 0.055595595), (5, 0.056552436)]",1
2023-10-27,废水 超话 醒醒 醒醒 醒醒 醒醒 醒醒 醒醒 醒醒 醒醒 醒醒 醒醒 醒醒 醒醒 醒醒 醒醒 醒醒 醒醒 醒醒 醒醒 醒醒 醒醒 醒醒 醒醒 醒醒 醒醒 醒醒 醒醒 醒醒 醒醒 醒醒 醒醒 醒醒 醒醒 醒醒,"[(1, 0.97683954)]",1
2023-10-27,遇袭 废水 世界,"[(0, 0.041818667), (1, 0.041890815), (2, 0.041755192), (3, 0.791007), (4, 0.04171277), (5, 0.041815627)]",3
2023-10-27,播报 证券 指出 防晒 领域 化妆品 行业 景气 较高 细分 赛道 疫后 有望 呈现 恢复性 增长 增速 化妆品 细分 赛道 领跑 防晒 品牌 市占率 提升 空间 防晒 比高 废水 排放 背景 国货 品牌 空间 国货 龙头 防晒 领域 布局 看好 相关 公司 建议 关注 科思 股份 收起,"[(3, 0.98248893)]",3
2023-10-27,武器 爆炸 核弹 电核 污水 采购 水产品 排放 排水 废水 阴谋 接受 抱歉 排放 核电站 废水 黑色 收起,"[(5, 0.95589715)]",5
2023-10-27,世界 爆发 源点 战争 支持 格局 废水 支持 格局 战争 支持 格局 历史 说话 历史 活着 证明 看待 现状 给出 答案 世界 经历 惨痛 价值观 收起,"[(3, 0.9688871)]",3
2023-10-27,音乐 哲学家 写出 地球 神树 废水 事件 艺术 超前 哲学家 艺术家,"[(0, 0.013977621), (1, 0.92937106), (2, 0.0140245715), (3, 0.014128963), (4, 0.014513042), (5, 0.013984775)]",1
2023-10-27,听话 懂事 上位,"[(0, 0.79087764), (1, 0.04182488), (2, 0.041825384), (3, 0.04182354), (4, 0.041825246), (5, 0.04182331)]",0
2023-10-28,废水 超话 政客,"[(0, 0.041962344), (1, 0.0420695), (2, 0.62136847), (3, 0.21062575), (4, 0.04189614), (5, 0.042077847)]",2
2023-10-28,污水 废水,"[(0, 0.055883314), (1, 0.055787258), (2, 0.05569151), (3, 0.72090596), (4, 0.05570796), (5, 0.056023996)]",3
2023-10-28,最爱 老板 告诉 老板 废水 事件 求求 老板 尝尝 土豆泥 挺好吃 土豆泥 珍珠 具象化 收起,"[(0, 0.07999233), (1, 0.010483891), (2, 0.010461777), (3, 0.010489696), (4, 0.010470637), (5, 0.87810165)]",5
2023-10-28,废水 危机 加剧 意识 淡水 资源 重要性 科学家 部署 院士 化学 奖得主 核能 能源技术 研究院 名誉教授 展示 团队 发明 沙漠 凭空 造水 科技 利用 材料 吸附 沙漠 空气 水分 转化 纯净 饮用水 科学家 学会 开源节流 开源 印象 水资源 沙漠 视频 视频 收起,"[(5, 0.9805445)]",5
2023-10-28,废水 超话 醒醒 醒醒 醒醒 醒醒 醒醒 醒醒 醒醒 醒醒 醒醒 醒醒 醒醒 醒醒 醒醒 醒醒 醒醒 醒醒 醒醒 醒醒 醒醒 醒醒 醒醒 醒醒 醒醒 醒醒 醒醒 醒醒 醒醒 醒醒 醒醒 醒醒 醒醒,"[(1, 0.9754764)]",1
2023-10-28,报道 核电站 发生 工作人员 放射性 废液 溅射 事件 评论 事故 人员 伤害 日方 清洗 核素 系统 管道 发生 相关 事件 核污染 带有 辐射性 引发 风险 外界 理由 质疑 核污染 排海 可靠性 日方 核污染 接连 事故 暴露 无序 混乱 凸显 国际 社会 重要性 严肃 敦促 日方 正视 邻国 国际 社会 关切 负责 方式 处置 核污染 接受 利益 参与 国际 废水 超话 收起,"[(5, 0.9864784)]",5
2023-10-28,不排 废水 政策 宽松 废水 恶心 心情 废水,"[(0, 0.018627154), (1, 0.114334896), (2, 0.018625187), (3, 0.8111491), (4, 0.01857628), (5, 0.018687364)]",3
2023-10-28,废水,"[(0, 0.08376166), (1, 0.08388407), (2, 0.08352572), (3, 0.5812408), (4, 0.08345929), (5, 0.08412847)]",3
2023-10-28,焦虑 小事 精神 内耗 焦虑 焦虑 焦虑 公司 担心 老人 孩子 废水 焦虑 小孩子 过日子 确实,"[(2, 0.010009524), (5, 0.9504699)]",5
2023-10-28,废水 新闻 热度,"[(0, 0.04176171), (1, 0.041858878), (2, 0.041758984), (3, 0.7908239), (4, 0.0417649), (5, 0.042031657)]",3
2023-10-27,遗忘 世人 措施 可悲,"[(0, 0.033429384), (1, 0.03338344), (2, 0.03355503), (3, 0.4082678), (4, 0.03371429), (5, 0.45765004)]",5
2023-10-29,核事故 人用 降下来 日方 伤痛 延续 人类 世界 废水 内娱 板凳 视频 收起,"[(0, 0.011997442), (1, 0.2701852), (2, 0.011975962), (3, 0.012047152), (4, 0.011975571), (5, 0.68181866)]",5
2023-10-29,最新消息 渲染 厉害 报道,"[(0, 0.033376366), (1, 0.033500228), (2, 0.033427507), (3, 0.83261317), (4, 0.033430777), (5, 0.03365192)]",3
2023-10-29,废水 流向 到达,"[(0, 0.041825738), (1, 0.47529414), (2, 0.041808657), (3, 0.3573805), (4, 0.041755363), (5, 0.04193555)]",1
2023-10-29,小说 工程 废水 排放 作业,"[(0, 0.028103588), (1, 0.02802944), (2, 0.028209958), (3, 0.8596681), (4, 0.027919376), (5, 0.028069504)]",3
2023-10-29,消息,"[(0, 0.08362488), (1, 0.08339499), (2, 0.08375747), (3, 0.08375887), (4, 0.08397405), (5, 0.58148974)]",5
2023-10-29,做起,"[(0, 0.08333996), (1, 0.0835491), (2, 0.08333998), (3, 0.5830499), (4, 0.083381176), (5, 0.08333987)]",3
2023-10-29,闯祸,"[(0, 0.08384251), (1, 0.580798), (2, 0.08384376), (3, 0.08383676), (4, 0.08384311), (5, 0.0838359)]",1
2023-10-29,愿望 灭亡 小富,"[(0, 0.7912353), (1, 0.041762147), (2, 0.04176016), (3, 0.041742593), (4, 0.041743416), (5, 0.04175638)]",0
2023-10-28,外传 互联网 搞笑 废水 内娱 板凳 视频 收起,"[(0, 0.018594528), (1, 0.01867989), (2, 0.018585384), (3, 0.018808136), (4, 0.018576415), (5, 0.9067556)]",5
2023-10-28,污水 排放 忘记 热度 降下去,"[(0, 0.02815858), (1, 0.027822264), (2, 0.027845249), (3, 0.86036986), (4, 0.027866771), (5, 0.027937321)]",3
2023-10-30,刺身 自由 废水 排污 事件 到达 沾染 状态 核辐射 身体 蛮大 加剧 增多 重金属 物质 导致 人体 肿瘤 细胞 增多 人口 身体 呈现 状态,"[(3, 0.89297837), (5, 0.080135345)]",3
2023-10-30,喜欢 排核 污水 花费 精力 替代品 废水 超话,"[(0, 0.6175018), (1, 0.018655494), (2, 0.018698983), (3, 0.3076131), (4, 0.018849269), (5, 0.018681306)]",0
2023-10-30,保护 地球 不息 保护环境 全球 呼吁 观点 全世界 关注 热议 废水 事件 备受 关注 地球 人类 星球 工业 兴起 发达 化学 产品 带来 便利 环境 全球 变暖 陆地 空气 日益加剧 全世界 人类 呼吁 保护环境 绿色 出行 拒绝 化学 用品 世界 收起,"[(3, 0.97998965)]",3
2023-10-30,回应 水獭 回应 废水,"[(0, 0.033538565), (1, 0.033468068), (2, 0.033518434), (3, 0.83180845), (4, 0.033888415), (5, 0.03377811)]",3
2023-10-30,发生 废水,"[(0, 0.05584892), (1, 0.05585472), (2, 0.05582691), (3, 0.7203941), (4, 0.055790957), (5, 0.056284383)]",3
2023-10-30,刷到 博主 日货 博主 日货 发现 日货 理由 推广 产地 寒心 剩下 买货 支持 国货 废水 不卖 日货,"[(1, 0.5166472), (3, 0.448046)]",1
2023-10-30,废水 国家 严厉 禁止 水产品 老百姓 害怕 餐桌上 食物 总会 办法 人力 控制 生物 样子 领海 公海 封闭,"[(0, 0.20347112), (3, 0.07634722), (5, 0.6936092)]",5
2023-10-30,废水 超话,"[(0, 0.05577166), (1, 0.05614593), (2, 0.056415286), (3, 0.72003686), (4, 0.05573545), (5, 0.055894785)]",3
2023-10-30,眼影 很小 粉色 上妆 清透 无比 适合 肤色 眼皮 废水 类似 感觉 品牌 发现 日本产 护肤品 护肤品 收起,"[(0, 0.1842255), (1, 0.7802494)]",1
2023-10-29,日子 污水 好像 热度 海水 蒸发 废水 超话,"[(0, 0.018602772), (1, 0.01859452), (2, 0.018693553), (3, 0.90687835), (4, 0.018594958), (5, 0.018635826)]",3
2023-10-31,采购 水产品 废水 水产品 回应 样子 站台 分明 阴损,"[(0, 0.01674623), (1, 0.016728614), (2, 0.016751012), (3, 0.91610825), (4, 0.016828958), (5, 0.016836898)]",3
2023-10-31,蛛网 奇趣 超话 要闻 最新消息 来源 环球时报 新闻 潜龙 爆笑 视频,"[(0, 0.013967443), (1, 0.014111329), (2, 0.014044869), (3, 0.01410526), (4, 0.9297283), (5, 0.014042787)]",4
2023-10-31,快乐 可惜,"[(0, 0.05578764), (1, 0.0565024), (2, 0.32062197), (3, 0.45580956), (4, 0.05566165), (5, 0.055616755)]",3
2023-10-31,废水 超话 污水 奔走 呼告 自诩 无力 放弃 反抗 燎原,"[(0, 0.015247273), (1, 0.7267158), (2, 0.015237358), (3, 0.21229665), (4, 0.015250752), (5, 0.015252184)]",1
2023-10-31,废水 超话 纠正 污水 废水 污水 接触 高浓度 辐射 类比 蛋花汤 废水 接触 类比 鸡蛋,"[(0, 0.010468458), (1, 0.0104875155), (2, 0.010496739), (3, 0.0105271395), (4, 0.010642653), (5, 0.94737744)]",5
2023-10-31,普通人 普通人 月薪 抵制 抵制 抵制 水滴 汇成 做强 软骨头 记住 一分钱 武器 对准 心脏 同胞 购买 日货 建议 后续 购买 目的 抵制 经济 打压 衡量 排核 污水 降低 净化 花销 减少 损失 挽救 健康 收起,"[(3, 0.19559215), (4, 0.78630114)]",4
2023-10-31,地球 排放 废水 污水 错误 抵制,"[(0, 0.023921533), (1, 0.023863874), (2, 0.024307022), (3, 0.8799016), (4, 0.023895653), (5, 0.024110282)]",3
2023-10-31,废水 超话 醒醒 醒醒 醒醒 醒醒 醒醒 醒醒 醒醒 醒醒 醒醒 醒醒 醒醒 醒醒 醒醒 醒醒 醒醒 醒醒 醒醒 醒醒 醒醒 醒醒 醒醒 醒醒 醒醒 醒醒 醒醒 醒醒 醒醒 醒醒 醒醒 醒醒 醒醒 醒醒 醒醒 醒醒 醒醒 醒醒 醒醒 醒醒 醒醒 醒醒 醒醒 醒醒 醒醒 醒醒 醒醒 醒醒 醒醒 醒醒 醒醒 醒醒 醒醒 醒醒 醒醒 醒醒 醒醒 醒醒 醒醒 醒醒 醒醒 醒醒 醒醒 醒醒 醒醒 醒醒 收起,"[(1, 0.98774)]",1
2023-10-31,超话 生意 废水 原因 感觉 疫情 难过 水产 批发 视频,"[(0, 0.01532788), (1, 0.427854), (2, 0.5106094), (3, 0.01542062), (4, 0.015359588), (5, 0.015428563)]",2
2023-10-31,得利 废水 事件 树叶 树叶,"[(0, 0.8603575), (1, 0.027913423), (2, 0.027840141), (3, 0.028074509), (4, 0.027852854), (5, 0.027961606)]",0
2023-10-31,武器 爆炸 核弹 电核 污水 采购 水产品 排放 排水 废水 阴谋 接受 抱歉 核电站 废水 黑色 收起,"[(5, 0.9534449)]",5
2023-10-30,世纪 谎言,"[(0, 0.7216756), (1, 0.055571973), (2, 0.05579981), (3, 0.0557051), (4, 0.055656575), (5, 0.055591013)]",0
2023-11-01,难过 新闻 讨厌 无力 感觉 刷到 普通人 废水 流浪狗 捕杀 快递 孩子 校园 官方 冷漠 态度 平民 遭遇 揪心 共情 能力 罪过 社会 秩序 完善 法律 体系 只能 层面 谴责 实质性 希望 世界 毁灭 收起,"[(1, 0.68706626), (3, 0.2942394)]",1
2023-11-01,笔记 保护 保护 废水 污水 排放 分享,"[(0, 0.020949189), (1, 0.020908378), (2, 0.020903945), (3, 0.021189883), (4, 0.021012407), (5, 0.8950362)]",5
2023-11-01,名字 废水 味道,"[(0, 0.041762315), (1, 0.04176242), (2, 0.04170172), (3, 0.7909699), (4, 0.04169634), (5, 0.042107318)]",3
2023-11-01,记者 提问 溅射 放射性 废液 公布 高出 评论 试问 劣迹 企业 确保 排放 日方 宣称 透明 排海 计划 放心 事故 凸显 建立 国际 安排 重要性 敦促 日方 严肃认真 态度 回应 国际 社会 关切 负责 方式 处置 核污染 配合 建立 邻国 利益 实质 参与 国际 安排 视频 视频 收起,"[(4, 0.28986686), (5, 0.6964298)]",5
2023-11-01,不顾 国际 人员 死活 承认 国际 地位 诛之,"[(0, 0.018728824), (1, 0.564962), (2, 0.01868079), (3, 0.018839562), (4, 0.018771188), (5, 0.36001763)]",1
2023-11-01,排放 全世界 关注 热度 全人类 默认 事实,"[(0, 0.31041625), (1, 0.02092695), (2, 0.020900348), (3, 0.605799), (4, 0.020937461), (5, 0.02101995)]",3
2023-11-01,武器 爆炸 核弹 电核 污水 采购 水产品 排放 排水 废水 阴谋 接受 抱歉 核电站 废水 黑色 收起,"[(5, 0.9534375)]",5
2023-11-02,排放 核污染 排放 核污染 排放 核污染 保护 排放 污水 沉默 力量,"[(0, 0.014231407), (1, 0.01398128), (2, 0.013951967), (3, 0.3683051), (4, 0.0139841065), (5, 0.5755462)]",5
2023-11-02,废水 日料,"[(0, 0.7194253), (1, 0.056068305), (2, 0.055724073), (3, 0.05681788), (4, 0.055667583), (5, 0.056296896)]",0
2023-11-02,专注 视频,"[(0, 0.055708572), (1, 0.055696826), (2, 0.056036007), (3, 0.05598139), (4, 0.05611663), (5, 0.72046053)]",5
2023-11-02,废水 超话 遭报应,"[(0, 0.04178041), (1, 0.04194257), (2, 0.042052496), (3, 0.79064155), (4, 0.041754775), (5, 0.041828245)]",3
2023-11-02,星球 充当 核辐射 席卷 全球 肉酱,"[(0, 0.023948371), (1, 0.023895165), (2, 0.023964355), (3, 0.88020414), (4, 0.02395923), (5, 0.0240287)]",3
2023-11-03,子膈 日料 好吃 想起 不到 店里 穿着 用餐 拍照 闺女 弄脏 衣服 讨厌,"[(0, 0.012088083), (1, 0.93995106), (2, 0.011929761), (3, 0.012096577), (4, 0.0119515415), (5, 0.011982944)]",1
2023-11-03,鬼子 死光,"[(0, 0.05579125), (1, 0.05582582), (2, 0.056133844), (3, 0.71921784), (4, 0.05579156), (5, 0.057239708)]",3
2023-11-03,信息 表决 修订 环境保护 法律 施行 管辖 海域 导致 管辖 海域 生态 破坏 环境污染 部门 机构 有权 措施 排污 反制 关注 承认 废液 溅射 估算 核污染 水排 收起,"[(2, 0.65403223), (5, 0.32275242)]",2
2023-11-03,驾驶 变异 怪兽,"[(0, 0.04211137), (1, 0.042110827), (2, 0.7893832), (3, 0.042207733), (4, 0.041979305), (5, 0.042207602)]",2
2023-11-03,污水 强制 解除 水产品 禁令 老奶奶 被窝 整笑 喝下去 排排 废水 超话 收起,"[(0, 0.011988012), (1, 0.9396039), (2, 0.012097211), (3, 0.012147157), (4, 0.012062062), (5, 0.012101647)]",1
2023-11-03,骨灰 废水 欢喜,"[(0, 0.041851245), (1, 0.04186672), (2, 0.041820854), (3, 0.7907285), (4, 0.041811973), (5, 0.04192073)]",3
2023-11-03,废水 超话 醒醒 醒醒 醒醒 醒醒 醒醒 醒醒 醒醒 醒醒 醒醒 醒醒 醒醒 醒醒 醒醒 醒醒 醒醒 醒醒 醒醒 醒醒 醒醒 醒醒 醒醒 醒醒 醒醒 醒醒 醒醒 醒醒 醒醒 醒醒 醒醒 醒醒 醒醒 醒醒 醒醒 醒醒 醒醒 醒醒 醒醒 醒醒 醒醒 醒醒 醒醒 醒醒 醒醒 醒醒 醒醒 醒醒 醒醒 醒醒 醒醒 醒醒 醒醒 醒醒 醒醒,"[(1, 0.9851141)]",1
2023-11-03,拍照 宿舍 环境 发现 块钱 笔记本 名字 尾字 大学 带去 学校 床边 不到 地方 扭头 记得 好用 不见 好吃 五毛钱 吃不完 分享 价钱 衡量 感情 标准 家世 财富 基础 接受 平淡 富裕 分清 喜欢 肯定 答案 杀伤力 很大 废水 级别 持久 净化 喜欢 收起,"[(1, 0.86630446), (2, 0.0388154), (3, 0.083639905)]",1
2023-11-04,摆脱 冷气 做事 做事 发声 发声 萤火 等候 排放 废水 破坏 人类 和谐 共生 力量 反抗 废水 超话 收起,"[(0, 0.30443954), (5, 0.66182464)]",5
2023-11-04,身体素质 废水 没到 先嗝屁,"[(0, 0.034368854), (1, 0.03353538), (2, 0.03350904), (3, 0.8315359), (4, 0.033503775), (5, 0.03354712)]",3
2023-11-04,希望 灭国,"[(0, 0.056068856), (1, 0.055918373), (2, 0.7192403), (3, 0.057075348), (4, 0.055669796), (5, 0.05602736)]",2
2023-11-04,地震 战争 战争 废水 操蛋,"[(0, 0.420306), (1, 0.028051808), (2, 0.028178364), (3, 0.46758193), (4, 0.027821705), (5, 0.028060205)]",3
2023-11-04,禁止 废水 抵制 日货,"[(0, 0.03338862), (1, 0.033402704), (2, 0.03335597), (3, 0.83305424), (4, 0.03337902), (5, 0.033419453)]",3
2023-11-04,评论 名字 玷污 低贱 活着 地球 亵渎 废物 废水 不配 最低 生物,"[(0, 0.012882774), (1, 0.012869909), (2, 0.012977175), (3, 0.9355032), (4, 0.012863614), (5, 0.012903393)]",3
2023-11-04,留学 代表 忘本 废水,"[(0, 0.033715304), (1, 0.033474736), (2, 0.0334123), (3, 0.03362771), (4, 0.03342206), (5, 0.83234787)]",5
2023-11-04,登场 代表 废水 王者 完整 人类 矛盾 相爱 相杀 人类 立场 做出 奉献 唱出 人鱼 歌颂 爱情 忘记 套路 收起,"[(0, 0.13179894), (2, 0.8360767)]",2
2023-11-04,工作人员 废水 连续 活着 生物 怪物,"[(0, 0.023832407), (1, 0.023882946), (2, 0.02391791), (3, 0.880486), (4, 0.023953056), (5, 0.023927702)]",3
2023-11-04,核污染 关注 消息 全世界,"[(0, 0.03409007), (1, 0.03342591), (2, 0.033567242), (3, 0.8312913), (4, 0.033639472), (5, 0.033986047)]",3
2023-11-05,核污 投放 核污 投放 貌美 芭比 视频,"[(0, 0.0208986), (1, 0.020903736), (2, 0.020908818), (3, 0.020915508), (4, 0.020915926), (5, 0.8954574)]",5
2023-11-05,感觉 智障 题目 不算 脑子 分数线 学校 路过 时间 小院 味道 还行 拒绝 废水,"[(0, 0.011237327), (1, 0.011384177), (2, 0.011786804), (3, 0.12018424), (4, 0.011187508), (5, 0.83422)]",5
2023-11-05,废水 超话 醒醒 醒醒 醒醒 醒醒 醒醒 醒醒 醒醒 醒醒 醒醒 醒醒 醒醒 醒醒 醒醒 醒醒 醒醒 醒醒 醒醒 醒醒 醒醒 醒醒 醒醒 醒醒 醒醒 醒醒 醒醒 醒醒 醒醒 醒醒 醒醒 醒醒 醒醒 醒醒 醒醒 醒醒 醒醒 醒醒 醒醒 醒醒 醒醒 醒醒 醒醒 醒醒 醒醒 醒醒 醒醒 醒醒 醒醒 醒醒 醒醒 醒醒 醒醒 醒醒 醒醒 醒醒 醒醒 醒醒 醒醒 醒醒 收起,"[(1, 0.9865531)]",1
2023-11-05,世界 谎言 高度民主 自由 国家 遭受 苦难 聪明 日本鬼子 匠心 国家 现实 嘴脸 蛇鼠 地球 消失 全球 平和 孤立 大陆 祸害 无比 恶心 无比 无耻 历史 驱逐 迫害 理由 理解 认同 学习 日本鬼子 排放 污水 诅咒 日本鬼子 地狱 羽生 结弦 神谷 顶用 无比 憎恨 日本鬼子 日本鬼子 原罪 历史 罪人 不配 收起,"[(0, 0.9275274), (2, 0.059488524)]",0
2023-11-05,失败 神仙 付款 想到 废水 好像 干净 买兰蔻 付款 发现 少用 优惠券 原料 选中,"[(0, 0.011252867), (1, 0.7577015), (2, 0.011187572), (3, 0.19727659), (4, 0.011215868), (5, 0.011365615)]",1
2023-11-05,举报 举报,"[(0, 0.05555836), (1, 0.055576064), (2, 0.7221905), (3, 0.055558335), (4, 0.055558365), (5, 0.05555833)]",2
2023-11-05,核试验,"[(0, 0.0836348), (1, 0.083339565), (2, 0.08483519), (3, 0.5814809), (4, 0.08333958), (5, 0.08336993)]",3
