,word,counts
27,哈工大 媒体 周洋 获批 国家 青年 人才 连续 申报 国家级 人才 项目 获批 高达 国家 高层次 人才 超过 成立 哈工大 数学 研究院 简称 研究院 坚定不移 引进人才 人才 发展壮大 突破口 吸引 集聚 一批 优秀 数学 人才 扎根 哈工大 龙江 勇攀 数学 高峰 宽松 舒适 科研 环境 深深 吸引 一批 志同道合 青年才俊 纷至沓来 深深 影响 一名 科研人员 治学 生活态度 建院 研究院 限度 尊重 数学 学科 发展 优秀人才 成长 规律 全力支持 科研人员 坐冷板凳 潜心 追求 重大突破 原始 创新 研究院 成立 国内外 著名 数学家 学术 委员会 专项 人才 引进 职称 晋升 过程 学术 评价 工作 优化 完善 同行 专家 评价 周期 考核 机制 较强 科研 能力 创新能力 青年 人才 创造 发展 机遇 平台 脱颖而出 支持 信任 数学 人才 勇攀高峰 底气 快速 成长 丰硕成果 研究院 国家级 人才 平均年龄 仅为 青年 学者 入职 两三年 数学 进展 生物 统计学 数学 物理 通讯 模式分析 机器 智能 汇刊 德国 数学 年刊 美国 数学 单行本 概率论 相关 领域 美国科学院 院刊 期刊 发表 论文 干事 创业 平台 国际化 建设 吸引 留住 人才 条件 研究院 精心 打造 优势 精耕细作 研究院 分析 数论 代数 组合 概率 统计 方向 进展 交换 分析 团队 跨界 攻关 硬核 队伍 相关 领域 青年 数学 人才 发展 提供 强有力 支撑 国际化 研究院 建设 发展 因子 研究院 克服 疫情 影响 全院 之力 支持 科研人员 国际交流 访问 架起 广大青年 学者 国内外 知名 专家 交流 合作 桥梁 研究院 限度 减轻 科研人员 科研 负担 行政 团队 目标 科研人员 时间 精力 事务性 工作 解放出来 投入 科学研究 研究院 组建 一支 能力 素质 服务 意识 行政 管理 团队 全程 协助 科研人员 学术会议 组织 相关 材料 起草 日常 财务 报销 事务性 工作 各类 生活 年轻 数学 研究院 始终 坚守 人才 那份 渴望 追求 四处 寻觅 怀揣 数学 梦想 青年才俊 风雨兼程 初心 成长 年轻 数学 研究院 懂得 珍惜 人才 支持 人才 发展 人才 成就 人才 哈工大 这所 百年 名校 构筑 崭新 数学 天地,1
28,哈工大 媒体 王雪 国家自然科学基金委员会 年度 国家自然科学基金 管理工作 会议 表彰大会 在京举行 会上 年度 国家自然科学基金 管理 先进 依托 单位 先进 地区 联络网 先进 工作者 表彰 我校 荣获 国家自然科学基金 管理工作 先进 依托 单位 荣誉称号 这是 我校 荣获 年度 国家自然科学基金 管理工作 先进 依托 单位 再度 获此 殊荣 科工 基础 创新 赵伟 荣获 国家自然科学基金 管理 先进 工作者 称号 国家自然科学基金 管理 表彰 工作 组织 本次 评选 依托 单位 十三 期间 制度 建设 管理 举措 申请 质量 资助 规模 资助 成效 考量 依托 单位 综合 实力 比拼 全国 依托 单位 单位 荣获 年度 国家自然科学基金 管理工作 先进 依托 单位 科研 管理 工作者 荣获 年度 国家自然科学基金 管理 先进 工作者 十三 期间 学校 紧跟 时期 科学基金 改革 步伐 履行 依托 单位 主体 责任 面向 科技前沿 鼓励 原创 探索 面向 需求 注重 谋划 组织 精准 施策 推动 基础 研究 高质量 发展 年间 学校 累计 承担 科学 基金项目 余项 经费 突破 亿元 项目 平均 资助 青年 科学基金 资助 率高达 高层次 科技 人才队伍 壮大 承担 国家 科研任务 能力 提升 重大项目 研究 计划 集成 项目 零的突破 十四五 时期 学校 科学基金 总体 资助 规模 质量 同步 跃升 基础 研究 效能 持续 增强 学校 获批 科学 基金项目 立项 数量 经费 数屡 创新 各层次 项目 突破 刷新 学校 多项 历史 成绩 学校 牵头 承担 基础 研究 标志性 项目 余项 经费 比高 重大项目 突破 高层次 人才 团队 项目 历史性 重大突破 获批 东北地区 高等院校 首个 基础科学 中心 基础 研究 领军 人才 持续 产出 高层次 学术 团队 学科 布局 不断完善 荣获 先进 依托 单位名单,1
29,哈工大 媒体 秦江 日前 我校 申报 国家 储能 技术 产教 融合 创新 平台 正式 获批 这是 我校 储能 科学 工程 专业 储能 技术 国家 急需 高层次 人才培养 专项 获批 创办 储能 领域 获批 国家级 平台 获批 经费 亿元 中国 经费 亿元 国家 储能 技术 产教 融合 创新 平台 国家 发展 改革 联合 教育部 立项 建设 围绕 储能 产业 技术 发展 储能 高精尖 人才培养 需求 落实 国家 双碳 目标 内容 平台 采用 政府 支持 高校 牵头 联合 行业龙头 企业 深度 参与 方式 构建 新型 产学研 合作 模式 联合 建设 我校 联合 黑龙江省政府 哈尔滨市 政府 哈电 集团 东方 电气 集团 贵州 梅岭 电源 有限公司 上海 空间 电源 研究所 中国 特种设备 检测 研究院 双登 集团 比亚迪 股份 有限公司 单位 参与 平台 申报 建设 国家 储能 技术 产教 融合 创新 平台 建设周期 建成 人才培养 学科建设 科学研究 一体 综合性 开放性 创新 平台 平台 集聚 能源 学院 电气 学院 化工 化学 学院 计算 学部 优势 力量 打造 学科 交叉 融通 储能 团队 我校 航天 国防 特色 东北地区 寒地 储能 需求 平台 围绕 电化学 储能 氢能 物理 储能 储能 系统 领域 技术 攻关 人才培养 解决 国家 储能 产业 卡脖子 产业 发展 提供 人才 技术 支撑 国家 储能 技术 产教 融合 创新 平台 项目 获批 我校 国家 储能 技术 研究 领域 发展 机遇 我校 揭榜 挂帅 制订 详细 建设 方案 着力 打造 一流 学科 培养 一流人才 原创性 技术创新 国家 双碳 目标 提供 支撑,1
30,哈工大 媒体 英爽 刘志强 黑龙江省 副省长 余建 一行 来校 调研 慰问 中国工程院 院士 副校长 刘宏 中国科学院 院士 校长 韩杰 出席 调研 余建 一行 参观 哈工大 博物馆 一个个 展品 一张 老照片 哈工大 百年 风貌 我校 深厚 办学 传统 人才培养 特色 给予 高度评价 机器人 技术 系统 国家 重点 实验室 余建 一行 参观 空间 机器人 仿生 机器人 微纳 机器人 饶有兴致 机器人 灵巧 互动 我校 面向 国民经济 科技 发展 需求 战略目标 打造 高端 机器人 领域 全球 科技 制高点 竞争 新高 进展 成果 肯定 余建 刘宏 院士 空间 机器人 基础理论 灵巧 操控 技术 研究 作出 贡献 表示感谢 指出 希望 哈工大 着眼 国家 战略 需求 龙江 发展 打破常规 创新 模式 依托 学校 优势 学科 助力 黑龙江省 提升 政务 服务 能力 推动 政府 数字化 智能化 转型 挖掘 智能 机器人 解决 老龄化 潜力 推进 家庭 服务 机器人 商品化 应对 人口老龄化 带来 多重 挑战 产学研 深度 融合 盘活 现有 专利 资源 进一步 效益 推动 发展 提高 科技成果 转化 产业化 水平 黑龙江省政府 秘书长 机关 党组 成员 殷延涛 我校 副校长 孙雪 出席 调研 黑龙江省 知识产权局 我校 相关 部门 负责人 参加 调研 现场 调研 慰问 刘宏 院士,1
31,哈工大 媒体 吕晓磊 近日 中共 黑龙江 省委 宣传部 公布 全省 基层 思想 政治 工作 示范点 名单 我校 建筑 学院 榜上有名 建筑 学院 习近平 时代 中国 特色 思想 指导 习近平 总书记 贺信 精神 引领 思想 政治 工作 融入 办学 治院 教育 教学 全过程 探索 构建 完备 思想 政治 工作 体制 机制 多年 建筑 学院 立足 服务 国家 需求 始终 牢记 育人 为国 育才 初心 使命 秉承 学校 政治 引领 典型 引路 品牌 带动 校训 育人 思想 政治 工作 传统 厚植 百年 学科 优势 五大 工程 工作 着力点 不断完善 卓越 建筑 思政 育人 品牌 筑思 工作室 工程 职涯筑梦汇 建造 雪构 美育 展等 系列 特色 活动 品牌 涌现出 全国 优秀教师 中国 大学生 自强 之星 工信部 离退休 先进个人 黑龙江省 教育 系统 师德 建设 十佳 标兵 黑龙江省 优秀教师 一批 先进典型,1
32,哈工大 媒体 商艳凯 刘志强 张玉芹 常溪 下午 学校 以线 上线 相结合 方式 学习 贯彻 二十大 精神 奋力 书写 时代 人才 强校 篇章 主题 人才 工作 会议 年度 表彰大会 党委书记 熊四皓 校长 韩杰 新晋 国家 高层次 人才 青年 人才 年度 管理 拔尖 人才 称号 获得者 颁发 证书 奖杯 熊四皓 表彰大会 讲话 熊四皓 代表 学校 党委 表彰 各类 人才 团队 表示祝贺 奋战 人才 工作 一线 全体人员 表示感谢 指出 二十大 擘画 建设 现代化 国家 推进 中华民族 复兴 宏伟蓝图 学校 时期 人才 工作 指明 前进方向 注入 强大 动力 学校 人才 工作 始终 习近平 时代 中国 特色 思想 指引 把握 根与魂 与术 坚定不移 改革 创新 打开 局面 迈向 高度 奋力 开创 中国 特色 世界 一流大学 卓越 发展 境界 提供 坚强 支撑 熊四皓 抓好 下一阶段 人才 工作 作出 部署 一是 提高 政治 站位 学习 贯彻 二十大 精神 坚强有力 政治 引领 开拓 人才 工作 局面 全校 久久 为功 强化 政治 引领 引领 人才 深刻 领悟 两个 确立 决定性 意义 弘扬 哈工大 八百壮士 精神 人才队伍 扎根 东北 爱国 奉献 艰苦创业 赋好 思想 初值 提供 不竭 动力 以大行 各路 贤达 汇聚 哈工大 卓越 发展 时代 热潮 深刻 把握 教育 科技 人才 一体 部署 背后 历史 逻辑 理论 逻辑 现实 逻辑 人才 工作 推动 一体 部署 落地 落实 突破口 源源不断 高质量 人才 支撑 推动 学校 改革 发展 提档 升级 对标 紧跟 吃透 中央 精神 持续 贯彻落实 中央 人才 工作 会议 精神 策略 校准 方位 资源 上用 足用 落地 纲举目张 确保 学校 党委 人才 工作 一系列 新思路 新举措 落到实处 以善谋 良策 开创 卓越 新局 二是 强化 危机意识 深刻 学校 人才 工作 面临 严峻 挑战 坚定 改革 创新 突破 卓越 发展 瓶颈 全校 事关 哈工大 长远 未来 高度 历史使命感 责任感 抓好 人才 工作 这项 战略 工程 科学 思维 拿出 超常 举措 过硬 功夫 重点 把握 三个 关系 把握 整体 局部 关系 学院 学部 校区 扛起 人才 工作 主体 责任 全方位 抓好 各类 人才 培养 引进 工作 瞄准 本学科 领域 增长点 培养 储备 一批 新兴 交叉 领域 关键 人才 把握 高峰 高原 关系 瞄准 高峰 围绕 国家级 人才 计划 发力 蓄力 高原 超前 布局 超常 施策 青年 后备 入圈 跃升 把握 关系 事业 留人 待遇 留人 感情 留人 并举 进一步 发挥 教师 发展 中心 作用 人才队伍 心无旁骛 干事 创业 打破 人才 身份 金钟罩 完善 评价 体系 考核 激励 人才队伍 潜能 深层次 激发 三是 注重 协同 推进 充分发挥 人才队伍 主观 能动性 高质量 人才 工作 推动 学校 四项 重点 领域 改革 高质量 内涵式 发展 全校 抓好 人才 工作 人才培养 协同 联动 鼓励 支持 人才 学科前沿 新思维 科研 攻关 转化 一流 课程 优质 资源 纵深 推进 杰出人才 自主 培养 改革 注入 强大 动力 抓好 人才 工作 科学研究 协同 联动 组织 现有 高层次 人才 储备 青年 后备 人才 布局 重点 领域 前沿 方向 关键 要害 人才 成长 科研 攻关 良性 互动 推动 人才 跨越式 成长 和国 重器 持续 涌现 抓好 人才 工作 学科建设 协同 联动 先手棋 主动仗 组织 有限 人才 资源整合 学校 重点 建设 学科 方向 抢占 未来 学科 发展 制高点 学校 学科 整体 发展 水平 做好 充足 人才资源 储备 熊四皓 指出 人才 始终 习近平 时代 中国 特色 思想 武装头脑 努力 发展 国家 民族 前途 命运 紧密联系 学校 时代 征程 改革 发展 蓝图 紧密联系 哈工大 这块 人才 福地 人才 宝地 人才 地上 加速 成长 携手 哈工大 开创 卓越 发展 局面 作出 贡献 熊四皓 全校 始终 习近平 时代 中国 特色 思想 指引 习近平 总书记 贺信 精神 引领 学习 贯彻 二十大 精神 增强 战略 定力 历史 主动 埋头苦干 奋勇前进 携手 推动 学校 人才 工作 新台阶 飞跃 努力 扎实 业绩 党中央 再交 优秀 答卷 校领导 安实 曹喜滨 刘宏 甄良 孙雪 沈毅 范峰 校党委 常委 李明江 出席会议 人才 工作 先进集体 各类 人才 称号 获得者 颁奖 谭久彬 院士 劲松 院士 校长助理 帅永 陈蕊 刘挺 出席会议 副校长 刘宏作 人才 工作 报告 一年 学校 贯彻落实 中央 人才 工作 会议 精神 实施 人才 强校 战略 人才 工作 成绩 提出 一步 人才 工作思路 电气 学院 院长 王淑娟 未来 技术 学院 党委 书记 赵异 航天 学院 研究员 喜洋 获奖 集体 人才 称号 获得者 代表 会上 发言 分享 交流 人才 工作 特色 做法 个人成长 感悟 职能 部处 直属单位 学院 学部 相关 负责人 威海 校区 深圳 校区 党政 负责人 获奖 代表 教师 代表 参加 会议 熊四皓 讲话 熊四皓 韩杰 国家 学校 人才 称号 获得者 颁奖 刘宏作 人才 工作 报告 王淑娟 发言 赵异 发言 喜洋 发言 校本部 会场 威海 校区 会场 深圳 校区 会场,1
33,哈工大 媒体 刘培香 刘志强 下午 踔厉奋发 勇毅 前行 助力 高水平 科技 自立自强 主题 科研工作 会议 年度 表彰大会 活动中心 党委书记 熊四皓 校长 韩杰 出席会议 韩杰 在讲话中 指出 二十大 报告 教育 科技 人才 作出 一体 部署 学校 扎实 推进 时代 科技 强国 事业 提供 行动指南 一年 学校 习近平 时代 中国 特色 思想 指导 习近平 总书记 贺信 精神 引领 贯彻落实 二十大 精神 把握 哈工大 国之 重器 打造 历史 逻辑 始终 坚守 科技 强国 事业 同频 共振 同行 强校 之路 推动 科研工作 高度 韩杰 做好 下一阶段 科研工作 作出 部署 一是 提高 站位 强化 科技 平台 打造 能力 主动 位于 党中央 参谋 助手 高度 立足 两个 大局 心怀 国之大者 四个 面向 瞄准 打造 航天 强国 建设 战略思想 策源地 国家 战略 科技 力量 国家 战略 人才 力量 这一 目标 系统 准确 把握 国家 战略 科技 力量 内涵 外延 统筹 校内外 科技 资源整合 探索 建立 国家级 科研 平台 运行 新机制 学校 长期 稳定 科研 发展 提供 内生 动力 二是 担当 强化 航天 国防 战略 攻坚能力 强化 国家 战略 科技 力量 第一 方阵 责任 担当 实施 创新 驱动 发展 战略 国家 战略 需求 导向 方案 项目 率先 突破 航天 国防 卡脖子 尖兵 系统化 组织化 提升 学校 航天 国防 科研 攻坚能力 更好 服务 国家 高水平 科技 自立自强 三是 聚焦 源头 强化 基础科学 研究 支撑 能力 依托 学校 工科 特色 优势 深挖 卡脖子 技术 基础理论 技术 原理 善于 经济社会 发展 国家 面临 凝练 科学 集聚 力量 原创性 引领 科技攻关 进一步 强化 牵引 基础 研究 工作 领军 科学家 中心 精准 培育 基础 研究 领军 人才 创新 团队 持续 提升 学校 基础 研究 动力 四是 超前 谋划 强化 科技 项目 争抢 能力 准确 分析 把握 国家 需求 政策 走向 顶层 设计 主动 谋划 校内 重大项目 培育 提质 增效 深化 校内 培育 重大项目 选题 机制 改革 国家 需求 设立 榜单 面向 青年教师 揭榜 挂帅 持续 提升 重点 领域 布局 能力 超前 布局 主动 攻关 服务 国家 战略 发展 共同体 五是 协同 合作 强化 集群 攻关 组织 能力 不断完善 跨学科 交叉 研究成果 多元 评价 共享 机制 建设 推动 哈工大 特色 跨学科 交叉 研究 范式 打造 一大批 跨学科 攻关 集群 国内 重点 区域 合作 力度 加大 综合性 地方 研究院 拓展 办学 资源 力度 建立 同央企 行业龙头 企业 常态 交流 机制 紧密 合作伙伴 关系 提升 集群 攻关 战斗力 韩杰 始终 习近平 时代 中国 特色 思想 指引 习近平 总书记 贺信 精神 引领 贯彻落实 二十大 精神 完整 准确 贯彻 发展 理念 瞄准 未来 科技 产业 发展 制高点 持之以恒 基础 研究 谋划 部署 一批 战略性 储备 技术 研发 项目 着力 破解 深层次 创新 体制 机制 障碍 持续 激发 人才 创新 动力 改革 创新 奋发 追求 卓越 学校 一流 建设 贡献 增量 更大 力量 建设 科技 强国 高水平 科技 自立自强 作出 贡献 会上 颁发 工程 型号 贡献奖 卓越 团队 领军人物 科技成果 贡献奖 平台 建设 贡献奖 科研经费 单位 青年 科技 新星 科学 原创 探索 服务 龙江 贡献奖 专家 贡献奖 哲学 社会科学 发展 贡献奖 校领导 安实 曹喜滨 刘宏 甄良 孙雪 沈毅 范峰 校党委 常委 李明江 出席会议 获奖 代表 颁奖 谭久彬 院士 劲松 院士 校长助理 帅永 陈蕊 刘挺 出席会议 副校长 曹喜滨作 科研工作 报告 一年 学校 推进 科学研究 改革 谋划 打造 国之 重器 成绩 分析 一步 重点 工作 能源 学院 院长 高建民 交通 学院 教授 张连振 机电 学院 教授 彭高亮 会上 发言 学习 贯彻 二十大 精神 领域 科研工作 交流 职能 部处 直属单位 学院 学部 相关 负责人 威海 校区 深圳 校区 党政 负责人 获奖 代表 教师 代表 参加 会议 获奖 代表 颁奖 会议 现场 韩杰 讲话 曹喜滨作 科研工作 报告 帅永 主持会议 高建民 发言 张连振 发言 彭高亮 发言,1
34,哈工大 媒体 刘志强 上午 年度 基层 党委书记 学院 学部 校区 行政 负责人 述职 评议 会议 上线 相结合 方式 基层 党委书记 学院 院长 执行 院长 聚焦 基层 党建 改革 发展 重点 亮点 方法 举措 党委书记 熊四皓 校长 韩杰 现场 述职 基层 党委书记 学院 院长 执行 院长 逐一 点评 对下 一步 抓好 学校 党建 改革 发展 各项 工作 提出 听取 基层 党委书记 述职 熊四皓 指出 一年 学校 习近平 时代 中国 特色 思想 指导 习近平 总书记 贺信 精神 引领 学习 贯彻 二十大 精神 拓展 支部 支部 经验 优势 高质量 推进 政治 把关 支部 模式 创新 带头人 质量 提升 高层次 人才 政治 引领 基层 党建 四项 重点 举措 体系化 纵深 推进 人才培养 队伍 建设 科学研究 内部 治理 四项 重点 领域 改革 提供 坚强 保证 位于 党中央 参谋 助手 高校 国家队 第一 方阵 中国航天 第一 尖兵 高度 基层 党委 工作 述职 评议 考核 工作 抓实 基层 党建 推进 从严治党 基层 延伸 成功 做法 点评 提到 基层 党委书记 对照 举一反三 扎实 做好 各项 工作 一步 基层 党委 学习 贯彻 二十大 精神 忠诚 拥护 两个 确立 两个 维护 始终 秉承 自我 革命 精神 坚强有力 基层 党组织 引领 保障 事业 发展 党的领导 奋力 开创 中国 特色 世界 一流 哈工大 规格 卓越 发展 境界 听取 学院 院长 执行 院长 述职 韩杰 平凡 一年 学校 党委 坚强 领导 学校 深化 人才培养 供给 改革 持续 深化 人事制度 改革 超前 谋划 打造 一批 国之 重器 内部 治理 成效 推动 各项事业 高质量 内涵式 发展 面向 学院 学部 校区 习近平 时代 中国 特色 思想 指导 习近平 总书记 贺信 精神 引领 学习 贯彻 二十大 精神 深刻 领悟 两个 确立 决定性 意义 增强 四个 意识 坚定 四个 自信 两个 维护 自觉 标党 二十大 作出 各项 战略部署 特别 大会 报告 教育 科技 人才 一体 部署 主动 目标 落实 切实 以勇担 航天 第一 尖兵 重任 使命 担当 更好 服务 国家 强国 战略 助力 区域 经济 发展 扎根 东北 前列 自主 探索 走出 一条 中国 特色 世界 一流 哈工大 规格 高质量 发展 道路 基层 党委书记 学院 学部 校区 行政 负责人 书面 述职 述职 结束 评委 现场 投票 投票 相结合 方式 参加 本年度 述职 基层 党委书记 学院 学部 校区 行政 负责人 测评 在校 校领导 校党委 常委 校长助理 出席会议 职能 部处 直属单位 负责人 基层 党委书记 学院 学部 校区 行政 负责人 党支部 书记 代表 线上 参会 熊四皓 讲话 韩杰 讲话 会议 现场,1
35,哈工大 媒体 商艳凯 近日 工业 信息化 公布 年度 校企 协同 育人 示范 基地 名单 我校 依托 卓越 工程师 学院 申报 基地 成功 入选 能源 学院 哈尔滨 电气 集团 共建 高效 低碳 动力 装备 协同 育人 基地 材料 学院 中国 运载火箭 技术 研究院 共建 航天 特种 材料 协同 育人 基地 计算 学部 华为技术有限公司 共建 关键 软件 人工智能 协同 育人 基地 引导 高校 企业 加快 培养 卓越 工程师 战略 人才 力量 工业 信息化 年度 校企 协同 育人 示范 基地 认定 工作 学校 申报 形式 审查 专家 评审 认定 基地 工业 信息化 校企 协同 育人 示范 基地 工业 信息化 校企 协同 育人 示范 基地 发挥 高校 企业 优势 深化 产教 融合 科教 融汇 推动 提升 人才培养 质量 示范 载体 基地 面向 国家 战略 需求 完善 发展 规划 推进改革 创新 积极探索 工业 信息化 特色 协同 育人 模式 典型 经验 支撑 培育 政治 坚定 报国 敬业 奉献 技术 创新能力 善于 解决 工程 卓越 工程师 打造 靠得住 过得硬 科技人才 力量 发挥 作用,1
36,冬日 阳光 照进 新年 第一天 梦想 光辉 点亮 哈工大 征程 时光 流转 山河 为证 回望 走过 砥砺 奋进 奋斗 铸就 精神 底色 江山如画 使命 催征 展望 携手 前行 踔厉奋发 奋斗 谱写 盛世 华章 回首 同心 与国 同行 奋斗 未来 交出 卓越 答卷 学校 党委 深刻 领悟 两个 确立 决定性 意义 持续 推动 二十大 精神 学校 落地生根 聚焦 二十大 作出 教育 科技 人才 一体 部署 自觉 位于 党中央 参谋 助手 高校 国家队 航天 第一 尖兵 高度 主动 对标 主动 领命 部署 重点 时代 征程 卓越 奋进 力量 空前 强劲 哈工大 贯彻落实 习近平 总书记 贺信 精神 学校 第十三次 党代会 确立 三步走 发展 战略 统筹 推进 疫情 防控 改革 发展 凝聚 打造 国之 重器 培养 杰出人才 坚强 力量 扎实 做好 中央 巡视 半篇 文章 推动 管党 治校 纵深 发展 提升 党建 思政 工作 质量 拓展 支部 支部 经验 优势 推进 党建 中心 工作 双向 深度 融合 不负 重托 哈工大 奋斗 路上 停歇 奋斗 书写 征程 坚实 注脚 回首 持续 深化改革 奋斗 创新 开创 发展 境界 打造 杰出人才 自主 培养 名片 未来 技术 学院 着力 培养 国家 急需 高层次 人才 卓越 工程师 学院 学校 围绕 培养 学术 大师 工程 巨匠 业界 领袖 治国 栋梁 四类 时代 杰出人才 目标 亮出 实招 硬招 推动 本科 招生 工作 创新 局面 持续 深化 人事制度 改革 推进 学校 核岗 定编 薪酬 体系 改革 激发 人才 干事 创业 活力 接续 奋斗 筑牢 人才 高地 着力 组织 科研 空间站 实验舱 机械 持续 助力 中国 空间站 建设 首颗 导航 卫星 发射成功 地面 空间站 呼之欲出 服务 国家 高水平 自立自强 动能 愈加 扎实 推进 校院 两级 管理体制 机制 改革 内部 治理 成效 一流 建设 启航 原创性 引领 成果 接连 涌现 学生 科技 创新 持续 领跑 哈工大 迈向 一流 步伐 坚定 回首 同心 筑梦 奋斗 民心 打造 美丽 校园 一栋栋 高楼 拔地而起 一个个 亮点 项目 加速 推进 一项项 校园 规划 落地 实施 哈工大 建设 宜学 宜教 宜居 师生 梦想 师生 幸福 百年 老街 百年 名校 出新 火花 哈工大 中心 科技 文化 地标 校园 一期 工程 竣工 穿廊 雨雪 从容 开放 办学 联合 校园 迎来 首批 学子 美好 蓝图 加速 现实 本科生 人间 率先 校区 体育场 焕新 登场 着力 打造 人才 栖息地 稳步 推进 老旧 小区 加装 电梯 学校 聚焦 师生 急难 民生 工程 做成 民心 工程 提升 师生 幸福感 提振 师生 干事 创业 精气神 征程 开启 这场 充满 光荣 梦想 远征 努力 奔跑 追梦人 时代 答卷 团结奋斗 自信 自强 乘风破浪 行稳 致远 紧密团结 习近平 同志 核心 党中央 领命 先行 担当 敢为人先 拼劲 党和人民 再交新 答卷 建设 现代化 国家 推进 中华民族 复兴 团结奋斗,1
