,word,counts
49,哈工大 媒体 明星 教育部 教师 工作 思想 政治 工作 指导 电子科技 大学 主办 第四届 全国 高校 党委 教师 工作部 部长 工作 研讨会 采用 视频会议 形式 教育部 教师 工作 司长 任友群 副司长 黄小华 思想 政治 工作 副司长 葛元杰 教育部 主会场 出席会议 任友群 葛元 杰作 专题报告 高校 大会 上作 交流 发言 我校 副校长 甄良 出席会议 并作 交流 发言 甄良 站位 统筹 谋划 建强 工作 体系 高质量 强化 引领 涵养 师德师 规格 推动 落地 激活 发展 动力 系统地 介绍 学校 党委 始终 习近平 时代 中国 特色 思想 指导 习近平 总书记 哈尔滨工业大学 建校 周年 贺信 精神 引领 学习 贯彻 二十大 精神 政治 引领 典型 引路 品牌 带动 校训 育人 思想 政治 工作 传统 持续 涵养 扎根 东北 爱国 奉献 艰苦创业 师德师 提振 改革 创新 奋发 追求 卓越 精气神 着力 推动 学校 教师 思想 政治 师德师 建设 工作 高质量 内涵式 发展 培育 凝聚 时代 哈工大 八百壮士 顶层 设计 特色 做法 成效 介绍 学校 教师 思想 政治 师德师 建设 工作 一步 思考 研讨会 时代 高校教师 思想 政治 工作 师德师 建设 实践 创新 主题 本次 会议 场分 论坛 主题 研讨 与会 人员 围绕 高校教师 思想 政治 工作 师德师 建设 重点难点 交流 校党委 教师 工作部 负责人 主持 高校 青年教师 高层次 人才 政治 引领 政治 吸纳 主题 论坛 教育部 教师 工作 思想 政治 工作 相关 处室 负责同志 高校 校领导 党委 教师 工作部 部长 参加 会议,1
50,哈工大 媒体 张豆 近日 我校 航天 学院 劲松 院士 团队 智能 材料 结构 发表 题为 形状记忆 聚合物 复合材料 智能 结构 火星 探测 首次 地面 验证 火星 文章 揭示 我国 天问 一号 火星 探测器 成功 展开 五星红旗 技术细节 天问 一号 火星 探测 总体 需求 中国航天科技集团 大力支持 劲松 院士 团队 独立自主 知识产权 形状记忆 聚合物 材料 构建 复合材料 等效 力学 预测 模型 提出 形状记忆 智能 变形 结构 设计 方法 团队 精细 力学 理论 分析 巧妙 智能 结构设计 天问 一号 火星 探测器 着陆 平台 创新 设计 制备 卷绕 锁定 展开 模式 国旗 形状记忆 锁紧 释放 结构 首次 火星 中国 国旗 可控 动态 展开 中国 探测器 火星 中国 标识 我国 世界 首个 形状记忆 聚合物 智能 结构 深空 探测 工程 国家 成果 入选 年度 中国 高等学校 十大 科技 进展 中国 印迹 合影 国旗 红色 框线 示出 着陆 火星 国旗 形状记忆 锁紧 释放 结构 形状记忆 聚合物 复合材料 片层 弯曲 变形 国旗 旗面 兰州 空间 技术 物理 研究所 研制 长时间 卷绕 收纳 锁定 状态 着陆 火星 形状记忆 聚合物 复合材料 片层 回复 国旗 超低 冲击 解锁 可控 展开 团队 形状记忆 聚合物 复合材料 地面 模拟 火星 低温 存储 实验 紫外线 伽马射线 辐照 实验 综合 评估 材料 力学 形状记忆 性能 验证 材料 火星 环境 适应性 团队 地面 成功 模拟 火星 环境 国旗 解锁 可控 展开 证实 结构 高可靠性 展开 瞬态 冲击 高达 火工品 相比 国旗 锁紧 释放 结构 冲击 结构 质量 收纳 比高 优点 较大 尺寸 国旗 收拢 展开 国旗 形状记忆 锁紧 释放 结构 收拢 状态 展开 状态 国旗 形状记忆 锁紧 释放 结构 展开 示意图 此前 团队 形状记忆 聚合物 复合材料 基础理论 工程 深入研究 提出 形状记忆 聚合物 复合材料 超轻 锁紧 释放 结构 一系列 地面 实验 验证 结构 力学 锁紧 释放 性能 成功 立方 太阳能 电池 帆板 锁紧 释放 前期工作 国旗 形状记忆 锁紧 释放 结构 火星 探测 成功 奠定 坚实 基础 形状记忆 聚合物 复合材料 超轻 锁紧 释放 结构 收拢 状态 展开 状态 劲松 院士 团队 长期 形状记忆 聚合物 复合材料 智能 空间 展开 结构 研究 理论 分析 材料 设计 结构 研制 航天 积累 深厚 经验 形状记忆 聚合物 复合材料 展开 铰链 桁架 天线 太阳能 电池 阵列 离轨 锁紧 释放 结构 一系列 成果 团队 国际 首次 形状记忆 聚合物 复合材料 柔性 太阳能 电池 阵列 可控 展开 国际 首次 形状记忆 聚合物 复合材料 智能 结构 火星 未来 形状记忆 聚合物 复合材料 智能 展开 结构 技术 我国 卫星平台 商业 航天 微纳 卫星 模块化 重构 航天器 空间站 探月 工程 深空 探测 火星 探测 小行星 探测 木星 探测 航天 工程 提供 技术支持 保障 团队 生物 领域 开发 多种 形状记忆 聚合物 智能 生物 支架 人工 假体 心脏 封堵器 设计 制备 构型 力学性能 调节 重构 拉胀 力学 材料 像素 力学 材料 生物医学 航空航天 领域 前景 原文 链接 国旗 形状记忆 锁紧 释放 结构 力学 理论 分析 帆板 锁紧 释放 结构 同步 释放 结构,1
51,哈工大 媒体 马晓雪 日晚 黑龙江 广播 电视台 新闻联播 栏目 系列报道 幸福 奋斗 播出 李隆球 拼搏 求索 知著 报道 第十七届 中国 青年 科技奖 获得者 我校 机电 学院 李隆球 教授 团队 拼搏 求索 十余载 科研 突破 奋斗 故事 相关 报道 数以万计 微小 微纳 机器人 注射 进人 体内 发现异常 精准 释放 药物 杀死 癌变 细胞 这是 人类 梦寐以求 治疗 方法 哈尔滨工业大学 李隆球 教授 团队 磁驱 微纳 机器人 研究 进展 未来 肝内 胆管 细胞 早期 诊断 治疗 哈尔滨工业大学 机电 学院 教授 李隆球 头发丝 直径 四五十 微米 微纳 机器人 头发丝 直径 百分之一 光声 物理 操控 精准 李隆球 微纳 结构 交道 哈工大 本科毕业 李隆球 跟随 导师 张广玉 教授 研究 环境 微纳 结构 高端 测控 装备 国内 领域 空白 团队 常年 往返 实验室 油井 之间 冬天 大庆油田 寒冷 彻骨 身为 湖南人 李隆球 难忘 哈尔滨工业大学 机电 学院 教授 李隆球 现场 接线 电烙铁 烫手 零下 度风 一吹 呼呼 烙铁 吹得 感觉 受不了 荒郊 野岭 房子 上车 喝酒 喝完 全身 暖和 艰难 环境 磨砺 李隆球 不惧 困难 勇于 拼搏 意志 技术 积累 团队 突破 井下 环境 多种 关键 技术难题 开发 自主 可控 知识产权 井下 精细 分层 智能 注配 装备 大庆 胜利 国有 大型 主力 油田 推广应用 这项 发明 黑龙江省 专利 金奖 哈尔滨工业大学 机电 学院 博士生 译文 字来 描述 李老师 朝向 目标 坚持不懈 执着 精神 影响 深远 李隆球 跟随 张广玉 教授 团队 问天 梦天 实验舱 研制 转位 机构 地面 模拟 测试 系统 克服 转位 机构 负载 质量 惯量 地面 模拟 摩擦 高等 难题 论证 报告 撰写 二三十个 版本 哈尔滨工业大学 机电 学院 副教授 周德开 环节 解决不了 来回 推倒 重建 过程 过程 梳理 航天 领域 归零 过程 历时 年终 李隆球 团队 研制 稳定 可靠 转位 机构 地面 模拟 测试 系统 助力 问天 梦天 实验舱 成功 转位 学校 学院 人才 政策 支持 李隆球 破格提拔 教授 成立 青年 科学家 工作室 多年 团队 面向 国家 需求 微纳 结构 研究 领域 成就 前不久 李隆球 荣获 中国 青年 科技奖 哈尔滨工业大学 机电 学院 教授 李隆球 科研 高原 高铁 遇山 修路 遇水架桥 永远 奋斗 过程,1
52,哈工大 媒体 英爽 李品 记者 第一次 见到 未来 技术 学院 李品 谋时 迎新 活动 现场 穿着 迎新 工作服 学院 迎新 场地 跑前跑后 熟练地 登记 台账 发放 手册 同学 搬运 行李 误以为 高年级 学长 采访 新生 自告奋勇 地站 萌新 参与 迎新 志愿 服务 选择 工科 专业 担忧 喜欢 挑战 难度 事情 未来 依托 哈工大 机器人 领域 特色 优势 机器人 行业 领军 人才 当初 雄心壮志 回荡 耳畔 一年 哈工大 筑梦 追梦 圆梦 挑战 难度 事情 专业 成绩排名 获评 奖学金 问天 奖学金 担任 院士 特色 班长 学生会 联络 宣传 中心 主任 未来 技术 学院 学生会 文体部 部长 职务 连续 评为 优秀 团干部 标兵 优秀学生 干部 标兵 聆听 讲述 大师 引领 成长 故事 追星 缘系 哈工大 选择 哈工大 我会 追星 哈工大 这颗 记得 高考 结束 准时 坐在 学校 礼堂 第一排 聆听 哈工大 招生 宣讲会 梦寐以求 学校 宣讲 结束 哈工大 招生 陆军 教授 分数 推荐 智能 机器人 介绍 智能 机器人 特色 优势 一对一 导师制 本硕博 贯通 培养 要害 回到 家后 上网 查阅 院士 领衔 哈工大 智能 机器人 资料 意外 发现 蔡鹤皋 院士 老乡 开创 工业 机器人 新天地 故事 肃然起敬 不解之缘 毫不犹豫 哈工大 智能 机器人 第一 志愿 哈工大 追星 智能 机器人 新生 纪念品 很早 报名 参加 迎新 志愿 服务 工作 大学 入学 同学 支持 有幸 担任 智能 机器人 班长 蔡鹤皋 院士 先进事迹 组织 编排 长达 分钟 原创 舞台剧 鹤鸣九皋 志在 报国 智能 机器人 全体同学 出演 演绎 院士 中国 工业 机器人 发展 放弃 国外 优越 生活 条件 先进 科研 环境 毅然 回国 迈出 中国 工业 机器人 研究 第一步 故事 鹤鸣九皋 志在 报国 剧照 院士 看后 感动 亲笔 致信 感谢 信中 提到 中国 机器人 产业 发展 包括 几代 哈工大 在内 众多 科技 工作者 共同努力 走过 道路 坎坷不平 征程 艰辛 曲折 最终 跨越 险阻 迎来 产业 发展 春天 蔡鹤皋 院士 回信 读完 院士 回信 深受 触动 院士 身上 镌刻 老一辈 哈工大 骨子里 听党 跟党走 红色 基因 坚定 中国 机器人 产业 发展 贡献 青春 力量 信念 溯星 之源 星同辉 学习 迎来 一节 难忘 思政课 这门 授课 教师 一位 院士 讲述 国之 重器 故事 班主任 刘宏 老师 刘老师 课程 同学 谈起 科研 经历 灵巧 空间 机械 空间 机器人 讲座 刘老师 始终 肯吃苦 下功夫 支撑 机器人 领域 不懈 奋斗 动力 坚定 理想 心中 始终 挂念 重器 智能 机器人 学生 志气 人生 抱负 刘宏 院士 同学 座谈 打牢 基础 哈工大 刘老师 一番话 深深 敲打 心田 解开 大学 学习 疑惑 学习 过程 特别 注重 夯实 基础 一门 含糊 专业 成绩 配备 一对一 导师 选择 导师 机电 学院 海波 教授 老师 指导 规划 未来 科研 方向 课外 刘老师 座谈 交流 每次 交流 收获 刘老师 还给 当年 生活 班长 趣事 讲述 带领 班级 既定目标 这为 身为 班长 指明 方向 路漫漫其修远兮 吾将上下而求索 刘老师 学习 带领 智能 机器人 走向 更远 山峰 李品 谋作 交流 发言 学习 贯彻 习近平 总书记 庆祝 中国共产主义青年团 成立 周年 大会 重要讲话 精神 座谈会 学生 代表 与校 党委书记 熊四皓 分享 带领 班级 荣获 基础 学部 优秀 学风 标兵 荣幸 第一批 入党 积极分子 喜悦 党员 发展 对象 培训 结业 考试 第一名 成绩 获评 优秀 学员 顺利 本科生 第一批 党员 发展 对象 座谈会 发言 秋季 学期 未来 技术 学院 学生会 文体部 部长 紧紧围绕 学院 中心 工作 积极参与 学院 建设 累计 组织 参与 学院 活动 余次 活动 锻炼 沟通 能力 组织协调 能力 一年 萌新 身份 校长 韩杰 院士 畅聊刚 入学 感受 未来 技术 学院 学生会 骨干 参与 组织 校长 主讲 第一期 未来 技术 讲坛 点点 星光 照亮 校园 刘宏 老师 告诉 身边 培养 集体 关心 照顾 能力 集体 共建 尽责 担当 集体 成长 牢记于心 聚焦 志愿 服务 社会 实践 挥洒 青春 汗水 打磨 大一 学年 累计 志愿 超过 小时 配合 学校 疫情 防控 工作 征得 班级 同学 同意 组织 全班同学 签下 核酸 检测 志愿者 请愿书 主动 学校 相关 负责人 负责 全校 全天 核酸 检测 志愿 服务 工作 第一个 班集体 形式 负责 核酸 检测 志愿 服务 工作 班级 集体 负责 核酸 检测 志愿 服务 工作 哈工大 中心 时隔 半个 面向 市民 开放 秉承 哈工大 故事 传递 哈工大 声音 理念 组织 班级 集体 形式 负责 周末 两天 哈工大 中心 志愿 服务 志愿者 照片 疫情 防控 形势严峻 时期 申请 志愿者 同学 采买 生活用品 配送 三餐 收取 楼道 垃圾 实际行动 抗击 疫情 守护 校园 志愿 服务 记得 黑龙江 省委书记 人大常委会 主任 省委 宣讲团 团长 许勤 来校 宣讲 二十大 精神 学生 代表 现场 聆听 许勤 书记 不负 时代 放飞 青春 梦想 为题 讲授 思政课 现场 参会 宣讲 结束 走出 活动中心 内心 久久 不能平静 身处 时代 更要 不负 韶华 踔厉奋发 青春 赛道 成绩 理想 担当 吃苦 奋斗 时代 青年 一程 再扬 风帆 逐梦 前行 旗帜 召唤 青春 担当 方显本 未来 实践 造梦 旅途 奋发 智能 机器人 同学 青春 赛道 奋力 奔跑 机器人 领域 杰出人才 目标 携手 并进,1
53,哈工大 媒体 董慰 韩昀松 日前 江苏省 太仓市 绿色 持续 发展 大会 中欧 持续 发展 高层论坛 年度 中欧 碳中 创新 合作 示范 项目 签约 发布 我校 建筑 学院 绿色 乡村 智慧 设计 乡村 建筑 计算 设计 研究 实践 项目 首批 入选 项目 贯彻落实 二十大 报告 提出 加快 建设 数字 中国 推进 绿色 低碳 发展 战略部署 积极响应 中欧 领导人 作出 打造 中欧 绿色 伙伴 数字 合作伙伴 工业 信息化 联合 欧洲 国际 组织 成立 中欧 碳中 合作项目 办公室 推进 中欧 数字化 带动 绿色 持续 发展 相关 工作 面向 全球 重点 城市 区域 行业 组织 征集 年度 中欧 碳中 创新 合作 示范 项目 项目 旨在 推动 中欧 绿色 低碳 政策 技术 产业 领域 务实 合作 复制 推广 绿色 持续 碳中 发展 模式 绿色 乡村 智慧 设计 乡村 建筑 计算 设计 研究 实践 项目 紧密 围绕 创建 示范 美丽 宜居 村庄 推进 乡村 振兴 面向 碳达峰 目标 导向 生产 生活 方式 绿色 转型 需求 发挥 计算 设计 优势 协同 产学研 优势 资源 乡村 人居 环境 基础科学 突破 乡村 建筑设计 创新 技术 工具 平台 研发 旨在 打造 贯通 乡村 建筑设计 建造 维多 阶段 乡村 建筑 建设 模式 推动 建筑 产业 信息化 转型 提升 建筑 工业化 水平 助力 双碳 目标 未来 依托 中欧 碳中 合作项目 办公室 平台 面向 中欧 碳中 领域 合作 推广 工作 签约 发布 仪式,1
54,哈工大 媒体 刘新宇 近日 年度 黑龙江省 志愿 服务 五个 先进典型 学习 宣传 活动 我校 青年志愿者协会 逐光 支教 志愿 服务项目 入选 优秀 志愿 服务项目 我校 青年志愿者协会 逐光 支教 志愿 服务项目 依托 成立 逐光 助学 支教 支教 留守 儿童 撑起 蓝天 宗旨 选拔 优秀 队员 前往 山东 济宁 黑龙江 齐齐哈尔 山西 长治 短期 支教 活动 成立 支教 工作 团队 医务人员 子女 线上 课业 辅导 参与 志愿者 余人次 志愿 服务 累计 小时 传播 志愿 理念 培育 志愿 文化 发挥 志愿 服务 先进 典型示范 带动 作用 黑龙江省 精神文明 组织 年度 黑龙江省 志愿 服务 五个 先进典型 学习 宣传 活动 推选 优秀 志愿者 优秀 志愿 服务 组织 优秀 志愿 服务项目 优秀 志愿 服务 社区 优秀 志愿 服务 贡献 单位,1
55,哈工大 媒体 明星 辛然 贯彻落实 二十大 精神 推动 学校 网络安全 信息化 工作 高质量 发展 下午 我校 行政 会议室 网络安全 信息化 领导 小组会议 党委书记 网络安全 信息化 领导小组 组长 熊四皓 主持会议 讲话 校长 网络安全 信息化 领导小组 组长 韩杰 出席会议 讲话 熊四皓 指出 二十大 报告 网络 强国 建设 擘画 蓝图 首次 推进 教育 数字化 写入 报告 强化 网络 数据 保障体系 建设 提到 国家 战略 高度 部署 做好 校园 网络安全 信息化 工作 提供 熊四皓 学校 网络安全 信息化 工作 给予 肯定 进一步 做好 网络安全 信息化 工作 作出 部署 一是 提高 政治 站位 切实 思想 统一 习近平 总书记 网络 强国 思想 持续 学习 贯彻 习近平 时代 中国 特色 思想 特别 习近平 总书记 网络 强国 思想 把握 蕴含 立场 观点 方法 深刻 分析 情况 挑战 超前 预判 应对 切实 用党 创新 理论指导 网信 工作 全过程 持续 学校 网络安全 信息化 工作 统筹规划 建设 数据 赋能 增效 服务 保障 质量 提升 引领 推动 学校 网络安全 信息化 工作 持续 高质量 内涵式 发展 二是 持续 完善 数据 信息系统 加快 推进 信息 互联 共享 单位 抢抓 数字化 转型 机遇 主动 担当 协同 推进 信息系统 建设 系统 数据 打通 信息 壁垒 突破 数据 标准化 规范化 建设 数据 要素 价值 挖掘 进一步 提升 加大力度 创新 举措 分类 分级 推动 数据 有序 开放 共享 加快 推动 学校 数据服务 决策 体系 建设 高质量 信息化 建设 助力 一流大学 治理 能力 持续 提升 三是 统筹 发展 筑牢 网络安全 防护 屏障 单位 要树牢 总体 国家 安全观 严格遵守 相关 法律法规 网络安全 保障体系 能力 建设 学校 信息化 基础设施 保护 强化 网络安全 信息 共享 工作 协同 提升 数据安全 管理水平 建立健全 数据安全 管理 风险 评估 检测 认证 机制 强化 个人信息 保护 切实 维护 师生 合法权益 持续 网络安全 教育 引领 师生 合力 筑牢 网络安全 防护 屏障 韩杰 指出 提高 网络安全 信息化 工作 重要性 强化 一校 三区 信息化 工作 统筹规划 持续 助力 学校 治理 水平 治理 能力 提升 推进 核心 数据库 一体化 平台 建设 探索 数据 共建 共享 路径 进一步 优化 工作 流程 持续 完善 横向 纵向 责任 体系 协调 工作 进一步 贯通 提升 整体 工作效率 副校长 孙雪 传达 工业 信息化 会议 精神 介绍 我校 网络安全 信息化 领导小组 成员 变更 情况 网络安全 信息化 办公室 负责人 汇报 我校 数据 共建 共享 建设 情况 与会 人员 信息化 建设 数据 资源 共建 共享 提出 意见 建议 校长助理 学校 办公室 主任 陈蕊 出席会议 网络安全 信息化 领导小组 成员 单位 负责人 参加 会议 相关 单位 负责人 列席会议 熊四皓 主持会议 讲话 会议 现场,1
56,哈工大 媒体 文章 辛然 首届 同类 大学 联盟 校长 论坛 在线 工科大学 联盟 中方 常设 主席 我校 校长 韩杰 应邀出席 论坛 代表 工科大学 联盟 同类 大学 联盟 联盟 单位 相关 负责人 签署 同类 大学 联盟 优先 教育 科学 创新 领域 合作 谅解 备忘录 论坛 中国教育部 国际 合作 交流 俄罗斯 科学 高等教育部 国际 合作 主办 对外经济贸易大学 莫斯科大学 圣彼得堡 国立 经济 大学 教育部 中外 人文 交流中心 联合 承办 同类 大学 联盟 工科大学 联盟 学科 地域 划分 大学 联盟 现已 全球 双边 高校 合作 网络 同类 大学 联盟 优先 教育 科学 创新 领域 合作 谅解 备忘录 高校 深化 发展 教育 科学 创新 领域 互利 合作 发挥 同类 大学 联盟 平台 优势 引领 未来 开创 教育 人文 交流 局面 时代 战略 协作 伙伴关系 向前 发展 工科大学 联盟 中方 执行长 我校 副校长 甄良 莫斯科 国立 师范大学 校长 卢布 科夫 主持 论坛 主旨 发言 环节 工科大学 联盟 俄方 常设 主席 莫斯科 鲍曼 国立 技术 大学校长 戈尔 代表 工科大学 联盟 主旨 发言 本次 论坛 重申 同类 大学 合作 共赢 理念 深化 教育 人文 领域 互学 互鉴 共识 同类 大学 合作 开启 新的篇章 提供 平台 签署 合作 谅解 备忘录 论坛 现场,1
57,哈工大 媒体 商艳凯 辛然 兴业银行 下午 我校 兴业银行 在线 签署 战略 合作 协议 兴业银行 党委书记 董事长 吕家进 党委书记 熊四皓 出席 签约 仪式 讲话 吕家进 指出 哈工大 国家 重点 建设 大学 党和国家 培养 输送 一大批 杰出人才 作出 贡献 二十大 教育 科技 人才 作出 一体 部署 教育 放在 优先发展 位置 兴业银行 责任 义务 更好 服务 国家 战略 更好 助力 教育 事业 高质量 发展 一步 兴业银行 围绕 智慧 校园 建设 教学设备 更新改造 师生 服务 重点 领域 发挥 优势 哈工大 建设 世界 一流大学 贡献 智慧 力量 学校 科技成果 转化 提供 全方位 多层次 金融服务 进一步 人才交流 合作 推动 务实 高效 合作 成果 熊四皓 指出 签约 校企 贯彻 二十大 教育 科技 人才 一体 部署 举措 创新 校企 合作 模式 推动 一流大学 金融 行业 深度 合作 协同 发展 携手 打造 人才 高地 科研 高峰 集聚 创新 动能 新起点 签约 契机 贯彻 党中央 作出 科教兴国 人才 强国 战略部署 推动 学校 科学研究 人才培养 优势 兴业银行 产业 背景 创新 需求 相结合 依法 合规 原则 聚焦 智慧 校园 建设 金融 科技 人才培养 重点 领域 深化 交流 合作 完善 合作 对接 机制 高效 精准 推进 合作 兴业银行 党委委员 张旻 我校 副校长 孙雪 代表 签署 战略 合作 协议 协议 校企 围绕 党中央 作出 科教兴国 人才 强国 战略部署 探索 推动 银校 合作 新机制 模式 领域 推进 银校 金融业务 项目 合作 深化 智慧 校园 建设 人才培养 学术交流 文化交流 领域 合作 互利 共赢 高质量 发展 副校长 范峰 主持 签约 仪式 兴业银行 办公室 总经理 王升 金融 总经理 水泉 财富 管理部 总经理 王强 机构 业务部 总经理 刘健 哈尔滨 分行 党委书记 行长 丁武民 我校 校长助理 学校 办公室 主任 陈蕊 出席 见证 签约 兴业银行 哈尔滨 分行 代表 我校 相关 部门 负责人 参加 签约 仪式 吕家进 讲话 熊四皓 讲话 兴业银行 会场 哈工大 会场,1
