,word,counts
74,哈工大 媒体 马晓雪 光明日报 红船 专刊 整版 报道 我校 师生 学习 贯彻 二十大 精神 刊发 党委书记 熊四皓 署名文章 勇担 强国 使命 开创 发展 新局 全文如下 勇担 强国 使命 开创 发展 新局 哈尔滨工业大学 党委书记 熊四皓 二十大 报告 教育 科技 人才 独立 统筹安排 一体 部署 彰显 习近平 同志 核心 党中央 历史 发展 规律 时代 发展 特征 未来 发展 关键 深刻 洞察 深邃 思考 中国 特色 世界 一流大学 勇担 科教兴国 使命 开创 卓越 发展 新局 提供 指南 以党 二十大 精神 立足 教育 科技 人才 一体 部署 深学 细悟 习近平 总书记 哈工大 建校 周年 贺信 精神 深刻 领悟到 打造 一大批 国之 重器 培养 一大批 杰出人才 党和人民 作出 贡献 高度肯定 哈工大 多年 服务 科教兴国 战略 人才 强国 战略 创新 驱动 发展 战略 发展壮大 规律 揭示 哈工大 面向 时代 征程 发挥 航天 第一 尖兵 作用 办好 人民满意 教育 科学 指引 贯彻落实 好党 二十大 作出 战略部署 跳出 教育 教育 立足 全局 教育 放眼 长远 教育 系统 观念 战略思维 高位 谋划 中国 特色 世界 一流 百年 卓越 之道 党的领导 引领 学校 卓越 发展 征程 二十大 报告 指出 党的领导 系统 整体 系统 整体 落实 时代 哈工大 始终 领导 学校 政治 建设 高度 第四次 获评 全国 先进 基层 党组织 面向 征程 哈工大 始终 习近平 时代 中国 特色 思想 指导 健全 从严治党 体系 推动 党的领导 全面进步 过硬 健全 党的领导 制度 体系 模范 执行 党委 领导 校长 负责制 着力 制度 建设 正确性 适应性 系统性 全方位 推动 党的领导 优势 转化 一流大学 治理 效能 健全 理论 武装 体系 系统 梳理 理论 武装 举措 特色 打法 体系化 思维 夯实 四梁 八柱 补齐 短板 弱项 强化 协同 机制 健全 转化 机制 完善 评价 体系 以学思用 贯通 知信行 统一 推动 学校 高质量 内涵式 发展 建强 干部 工作 体系 对标 政治 过硬 时代 具备 领导 现代化 建设 能力 斗争 精神 斗争 本领 养成 重点 建强 干部素质 培养 知事 识人 选拔 任用 管理 正向 激励 五大 体系 学校 风险 打压 封锁 中闯出 新路 提供 坚强 保证 建强 基层组织 体系 基层 鲜明 导向 因地制宜 建强 党建 工作 中心 工作 双向 融合 机制 持续 创新 支部 支部 党建 工作 打法 确保 基层 党组织 始终 领导 哈工大 发展壮大 迈向 卓越 坚强 堡垒 培养 杰出人才 抓好 后继有人 大计 二十大 报告 指出 培养 造就 德才兼备 高素质 人才 国家 民族 长远 发展 大计 时代 哈工大 始终 立德 根本任务 东北 人才 高地 筑得 面向 征程 哈工大 贯彻 教育方针 源源不断 培养 堪当 民族 复兴 重任 时代 新人 导之以 习近平 时代 中国 特色 思想 铸魂 育人 建强 思政 课程 课程 思政 大思政课 体系 引导 学生 心怀 国之大者 践行 国之大者 以力 深化 人才培养 供给 改革 完善 五育 并举 顶层 设计 高质量 教育 教学资源 供给 支持 学生 发展 个性化 发展 强之以 弘扬 哈工大 科教 融合 产教 融合 育人 特色 优势 支持 学生 脚踏实地 造重器 真刀真枪 本领 育之以 持续 加大 人事制度 改革 力度 人才队伍 建设 力度 加速 构建 精准 全球 人才 选聘 体系 畅通 分类 卓越 发展 渠道 造就 一批 教学 科研 并举 立德 育人 并重 战略 科学家 一流 科技 领军 人才 创新 团队 青年 科技人才 办学 方向 始终 正确 内生 动力 持续 迸发 育人 生态 培育 凝聚 一批 扎根 东北 爱国 奉献 艰苦创业 时代 哈工大 八百壮士 培育 理想 担当 吃苦 奋斗 杰出人才 努力 教育 科技 人才 一体 部署 战略 谋划 持续 转化 杰出人才 自主 培养 丰硕成果 打造 国之 重器 服务 国家 高水平 科技 自立自强 二十大 报告 创新 我国 现代化 建设 全局 核心 地位 时代 哈工大 始终 四个 面向 一大批 关键 核心技术 鼎力 支撑 飞天 探月 探火 天宫 北斗 国家 重大项目 实施 面向 征程 哈工大 紧盯 国家 战略 系统 发力 加快 推进 科研 范式 组织 模式 变革 厚植 底蕴 发扬 老一辈 哈工大 手中 一颗 纽扣 想着 国家 一件 大衣 大师 团队 十年磨一剑 科研 传统 硬汉 文化 激扬 攻关 斗志 超前 谋划 聚焦 世界 科技 发展 前沿 主动 谋划 抢占 世界 科技 竞争 未来 发展 制高点 超前 布局 推进 实施 一批 战略性 储备 项目 助力 强国 战略 实施 提供 支撑 攻坚 聚焦 重点 领域 关键 核心 完善 工程 实践 凝练 科学 工作 机制 强化 科技 带动 基础 研究 努力 源头 底层 破解 卡脖子 难题 集智 攻关 推进 教育 人才 创新 产业链 深度 贯通 担纲 领衔 协同 领域 国家 战略 科技 力量 大兵团 作战 新型 举国体制 优势 汇聚 作出 贡献 强大 力量 提升 组织 科研 前瞻性 精准 系统性 持续 提升 服务 支撑 强国 战略 科研 攻关 能力 过硬本领 助力 国家 高水平 科技 自立自强 报道 链接,1
75,哈工大 媒体 马晓雪 科技日报 学习 贯彻 二十大 精神 特刊 聚焦 大学校长 高等教育 高质量 发展 校长 韩杰 发表 署名文章 中国式 现代化 提供 人才 支撑 全文如下 中国式 现代化 提供 人才 支撑 韩杰 哈尔滨工业大学 校长 二十大 报告 实施 科教兴国 战略 强化 现代化 建设 人才 支撑 单独 成章 教育 科技 人才 作出 一体 谋划 彰显 习近平 同志 核心 党中央 立足 历史 发展 规律 时代 发展 特征 未来 发展 关键 系统 观念 作出 科学 部署 凸显 教育 科技 人才 现代化 建设 战略 定位 统筹 实施 科教兴国 战略 人才 强国 战略 创新 驱动 发展 战略 教育 基础 科技 关键 人才 三位一体 部署 中国 特色 世界 一流大学 建设 擘画 蓝图 指明 路径 提供 机遇 习近平 总书记 致信 祝贺 哈尔滨工业大学 建校 周年 哈尔滨工业大学 简称 哈工大 习近平 总书记 贺信 精神 引领 立德 根本任务 服务 教育 强国 科技 强国 人才 强国 战略 深刻 把握 打造 国之 重器 培养 杰出人才 内在 逻辑 统筹 谋划 高等教育 办好 人民满意 高等教育 一体 推进 人才培养 队伍 建设 科学研究 内部 治理 四项 重点 领域 改革 围绕 强国 战略部署 制定 学术 大师 工程 巨匠 业界 领袖 治国 栋梁 四类 杰出人才 培养目标 课程 项目 双驱 互融 打造 面向 卫星 机器人 体制 雷达 人工智能 智能 制造 生命 健康 关键 领域 人才培养 创新 载体 建设 院士 担任 班主任 特色 全国 首批 未来 技术 学院 牵引 推进 人才培养 体系 改革 持续 探索 完善 哈工大 特色 杰出人才 自主 培养 之道 勇担 科教兴国 使命 深刻 把握 教育 科技 人才 三位一体 部署 背后 战略 考量 全局 视野 系统 谋划 深刻 内涵 紧迫感 危机感 坐不住 责任感 准确 识变 科学 应变 主动 求变 探索 中国式 现代化 提供 人才 支撑 路径 强化 创新 理论 武装 青年 学生 成长 凝心 铸魂 坚持不懈 习近平 时代 中国 特色 思想 武装 青年 学生 头脑 引导 青年 学生 深刻 领悟 两个 确立 决定性 意义 深刻 把握 习近平 时代 中国 特色 思想 世界观 方法论 青年 学生 打牢 许党 报国 底气 自信 打牢 一生 受用 科学 思想 基础 引导 支持 青年 学生 历史 主动 斗争 精神 变局 重任 作贡献 深化 科教 融合 产教 融合 青年 学生 成长 搭建 舞台 弘扬 哈工大 立足 航天 服务 国防 长于 工程 特色 传统 发挥 哈工大 行业 产业 区域 发展 深度 互动 发展 优势 新型 举国体制 优势 加持 谋划 推进 创新 产业链 人才 深度 贯通 创新 完善 本硕博 贯通 实践 育人 体系 打造 一批 校企 协同 育人 示范 基地 引导 支持 青年 学生 瞄准 强国 战略 导向 深度 参与 实践 解决 卡脖子 难题 打造 国之 重器 夯实 理论 根基 练就 攻关 本领 打开 合作 共进 局面 青年 英才 成长 拓展 资源 深刻 把握 百年 未有 大变局 深刻 把握 发展 外部环境 互动 变化 发挥优势 拓展 渠道 捕捉 新机遇 定位 角色 创立 优势 广泛开展 国际交流 世界 一流大学 精准 合作 绣花 功夫 打开 合作 共进 局面 努力争取 全球 优质 教育资源 助力 青年 学生 加速 成才 规格 成才 二十大 报告 举旗 定向 引领 未来 哈工大 学习 贯彻 二十大 精神 勇担 科教兴国 使命 锻造 科技 第一 生产力 培育 人才 第一 资源 建设 现代化 国家 提供 源源不断 创新 第一 动力 相关 链接,1
76,哈工大 媒体 马晓雪 光明日报 红船 专刊 整版 报道 我校 全方位 多层次 学习 宣讲 对标 党中央 决策 部署 抓好 工作 落实 师生 持续 掀起 学习 宣传 贯彻 二十大 精神 热潮 切实 学习 成效 转化 推动 学校 百年 卓越 发展 强大 动力 激发 师生 奋进 时代 坚定信念 刊发 篇文章 党委书记 熊四皓 署名文章 勇担 强国 使命 开创 发展 新局 综合 报道 实效 卓越 发展 立新功 谢宗武 教授 讲述 突破 航天 关键技术 卡脖子 难题 实效 卓越 发展 立新功 哈尔滨工业大学 师生 学习 贯彻 二十大 精神 奋进 征程 建功 时代 学习 贯彻 二十大 精神 哈尔滨工业大学 二十大 报告 提出 实施 科教兴国 战略 稳妥 推进 碳达峰 这为 学科 发展 提供 契机 抢抓 机遇 国家 推进 能源 革命 加快 发展 方式 绿色 转型 提供 人才 科技 支撑 高龄 哈尔滨工业大学 能源 学院 碳中 能源技术 研究所 教工 党支部 书记 中国工程院 院士 秦裕琨 教授 走进 实验室 学习体会 师生 党课 秦裕琨 院士 走进 实验室 青年 师生 党课 辛然 秦裕琨 世纪 年代 锅炉 专业 热能 工程 专业 学科 发展 国家 发展 需求 紧紧 相连 瞄着 前沿 拓展 服务 国家 能源 发展 需求 方向 领域 哈尔滨工业大学 全方位 多层次 学习 宣讲 对标 党中央 决策 部署 抓好 工作 落实 师生 持续 掀起 学习 宣传 贯彻 二十大 精神 热潮 切实 学习 成效 转化 推动 学校 百年 卓越 发展 强大 动力 激发 师生 奋进 时代 坚定信念 学深学 透上 下功夫 持续 掀起 学习 热潮 二十大 报告 举旗 定向 主题鲜明 思想 深邃 内涵 全校 学习 宣传 贯彻 二十大 精神 时期 首要 政治 二十大 精神 学校 未来 改革 发展 学校 党委书记 熊四皓 主持 学习 贯彻 二十大 精神 哈工大 宣讲团 成立 仪式 集体 备课 时说 二十大 胜利 哈工大 党委 第一 时间 党委 常委会 专题会议 传达 学习 研究部署 干部 师生 大会 带领 师生 进一步 深学 细悟 大会 精神实质 学习 贯彻 二十大 精神 思政课 集体 备课 引领 推动 二十大 精神 融入 思政 课程 课程 思政 校党委 理论 学习 中心组 学习 研讨 进一步 完整 准确 领会 把握 二十大 精神 制定 中共 哈尔滨工业大学 委员会 学习 贯彻 二十大 精神 宣讲 工作 方案 宣讲 重点 二十大 代表 熊四皓 走进 党员干部 青年 学生 高层次 人才 群体 切身体会 针对性 宣讲 二十大 精神 师生 学深 学透 大会 精神 辅导 学校 贯彻落实 大会 精神 重点 哈工大 一名 体育教师 肩负 传递 奥林匹克 精神 落实 体教 融合 育人 使命 冰雪 文化 冰雪 体育 影响 青少年 冬奥 时代 中国 冰雪 运动 持续 发展 作出 贡献 二十大 代表 学校 体育部 副教授 张虹 师生 分享 学习 思考 电子 工程系 教师 党支部 扎根 海南 文昌 航天 发射 基地 科研 攻关 组织 党员 观看 梦天 实验舱 发射 现场 二十大 报告 提出 加快 高水平 科技 自立自强 学习 研讨 曲拥 措姆 工作室 临时 党支部 马克思主义 学院 史纲 概论 党支部 联合 主题 党日 活动 邀请 工作室 志愿者 学院 学生 代表 围绕 铸牢 中华民族 共同体 意识 学习 交流 组织 师生 收看 大会 开幕 学习 大会 报告 形式多样 主题 党日 团日 活动 全校 基层 党委 党支部 团学 组织 专兼职 纪检监察 干部 离退休 老同志 民主党派 基层组织 结合实际 抓好 学习 切实 推动 大会 精神 入脑 入心 讲活 精上 下功夫 生动 讲好 创新 理论 年来 家乡 百姓 幸福感 马克思主义 学院 本科生 王晨阳用 图片 数字 展示 美丽 中国 建设 成就 课堂 同学 共鸣 马克思主义 学院 闫金红 副教授 主讲 习近平 时代 中国 特色 思想 概论 课上 同学 选取 二十大 报告 涉及 教育 科技 医疗卫生 脱贫 攻坚 美丽 中国 主题 演讲 小视频 制作 情景剧 表演 多种形式 展示 时代 十年 变革 加深 对党 创新 理论 认同 二十大 马克思主义 学院 组织 教师 第一 时间 学习 抓好 集体 备课 理论 研究 多种 方式 二十大 精神 融入 思政课 教学 组建 青春 学生 宣讲团 上线 相结合 方式 推动 二十大 精神 党支部 进社区 乡村 几天 国家 高层次 人才 材料 学院 宗影影 教授 正为 参加 学校 第五届 党课 大赛 备课 本次 党课 大赛 以党 二十大 精神 主题 主线 吸引 包括 多名 国家级 人才 省级 青年 人才 在内 师生 报名 参赛 二十大 报告 思路 开阔 党课 最新 理论 创新 成果 准确 传递 学生 生动 案例 鲜活 故事 国之大者 理解 科研工作 思路 方法 内容 有机 融入 二十大 报告 提出 推动 绿色 发展 人与自然 和谐 共生 研究 密切相关 未来 工作 指明 方向 中国工程院 院士 环境 学院 教授 马军 课题组 师生 专业 发展 学习 贯彻 二十大 精神 展开 热烈 讨论 围绕 协同 推进 降碳 减污 扩绿 增长 目标 推动 产学研 推进 美丽 中国 建设 共识 从思政 课程 课程 思政 从思政 实践 课到 专业 研讨 学习 课堂 实验室 一线 教师 热气 学习心得 多种形式 带到 学生 使党 二十大 精神 同学 专业 学习 科研工作 成长 成才 接地 方式 推动 二十大 精神 课堂 学生 头脑 哈工大 主楼 辛然 落细 落实 下功夫 激发 卓越 发展 动力 长期 服务 国家 航天 国防 发展 高校 充分发挥 航天 第一 尖兵 作用 建设 航天 强国 作出 更大 贡献 哈工大 义不容辞 责任 日前 空间 环境 地面 模拟 装置 国家 科技 基础设施 火星 尘舱 验收 相关 技术 填补 国内 空白 空间 环境 地面 模拟 装置 整体 试运行 建成 国内 世界 上规模 功能 最为 齐全 空间 环境 物质 作用 基础科学 研究 平台 我国 空间科学 航天技术 发展 提供 强大 支撑 梦天 实验舱 转位 成功 学校 张广玉 李隆球 教授 团队 研制 可变 组合式 超大 惯量 摩擦 变温 转位 机构 性能 地面 模拟 测试 系统 助力 梦天 实验舱 成功 转位 聚焦 国家 战略 需求 集智 攻关 哈工大 一批 硬核 技术 成功 神舟 飞天 嫦娥 天问 探火 天宫 巡游 国家 工程 持续 助力 中国 空间站 建造 航天 强国 建设 二十大 报告 提出 全面提高 人才 自主 培养 质量 着力 造就 拔尖 创新 人才 首批 国家 卓越 工程师 学院 试点 牵头 建设 单位 卓越 工程师 学院 党委 主动 对标 对表 系统 谋划 布局 学院 发展 打造 卓越 之光微 党课 卓越 校企 党日行 品牌 活动 成立 卓越 工程师 学科 交叉 社团 开设 讲堂 着力 培养 胸怀 国之大者 报国 敬业 奉献 服务 拔尖 创新 人才 希望 仰望 星空 志存高远 为国分忧 为国 解难 为国 尽责 国家栋梁 传承 规格 功夫 到家 校训 精神 脚踏实地 夯实 基础 练就 过硬本领 杰出人才 两院 院士 刘永坦 班主任 身份 走到 学生 引导 青年 学生 大志 大德 成大才 担大任 着力 培养 党和国家 拔尖 创新 人才 哈工大 设立 院士 担任 班主任 卫星 智能 机器人 永坦班 善义 四大 院士 特色 未来 技术 学院 入选 首批 国家级 未来 技术 学院 并于 揭牌 培养 学术 大师 工程 巨匠 业界 领袖 治国 栋梁 四类 杰出人才 目标 积极探索 时代 杰出人才 自主 培养 学校 自觉 党中央 参谋 助手 高校 国家队 航天 第一 尖兵 高度 打造 更多国 重器 培养 杰出人才 担当 服务 科教兴国 战略 人才 强国 战略 创新 驱动 发展 战略 实施 领命 先行 大胆 突破 闯劲 拼劲 干劲 党和人民 再交新 答卷 校长 韩杰 光明日报 记者 张士英 通讯员 商艳凯 报道 链接 突破 航天 关键技术 卡脖子 难题 讲述 哈尔滨工业大学 机电 工程学院 教授 谢宗武 前不久 梦天 实验舱 成功 入列 中国 空间站 构型 组装 我国 建成 空间站 目标 迈出 关键 一步 参与 我国 空间站 建设 一名 科研 工作者 投身于 机械 天舱 测试 科研 攻关 期间 关注 二十大 二十大 报告 加快 实施 创新 驱动 发展 战略 加快 高水平 科技 自立自强 加快 实施 一批 战略性 全局性 前瞻性 国家 科技 项目 增强 自主 创新能力 三个 加快 凸显 科技 创新 重要性 紧迫性 一名 高校教师 科技 工作者 深有感触 深感 重任在肩 参与 研制 实验舱 机械 我国 空间站 关键 装备 哈工大 技术 单位 瞄准 国际 前沿 立足 航天 服务 国防 面向 国家 需求 历时 研制成功 问天舱 机械 问天 实验舱 发射 升空 入轨 顺利完成 状态 设置 半个 机械 成功 一系列 功能 性能 测试 预期 效果 各项 指标 表现 优异 特别 神舟 十四号 航天员 乘组 第二次 出舱 飞控 现场 听见 航天员 刘洋 感叹 机械 动作 精准 心情 激动 自豪 机械 首战告捷 空间 机械 后续 奠定 坚实 基础 坚定 团队 原创性 引领 科技攻关 信心 哈工大 建校 百年 之际 习近平 总书记 致信 祝贺 提出 殷殷 希望 希望 哈尔滨工业大学 起点 办学 方向 紧扣 立德 根本任务 教书育人 科研 攻关 工作 改革 创新 奋发 追求 卓越 努力 两个 一百年 奋斗目标 中华民族 复兴 中国 作出 贡献 实验舱 机械 成功 研制 离不开 哈工大 科研 力量 强有力 支撑 哈工大 规格 功夫 到家 校训 精神 传承 体现 哈工大 集中力量 优良传统 贯彻 习近平 总书记 贺信 精神 生动 实践 十年 中国 航天事业 创新 发展 快车道 航天 强国 建设 迈出 坚实 步伐 我国 空间站 建设 关键 二十大 胜利 实际行动 贯彻 二十大 精神 科研 工作者 国家 战略 需求 导向 聚焦 航天 领域 关键 核心技术 前沿 方向 重点 突破 航天 关键技术 卡脖子 难题 科技成果 助力 我国 航天 强国 建设 高校教师 引领 学生 培养 学生 原创性 科研 创新 我国 航天 强国 建设 培养 后备 人才 光明日报 记者 张士英 通讯员 马晓雪 采访 整理 报道 链接,1
77,哈工大 媒体 商艳凯 学习 贯彻 二十大 精神 拓展 学校 支部 支部 经验 优势 进一步 发挥 全国 党建 双创 样板 支部 示范 带动 作用 引领 激励 全校师生 改革 创新 奋发 追求 卓越 日至 学校 面向 一校 三区 带头人 教师 党支部 书记 教工 党支部 书记 学生 党支部 书记 以线 上线 相结合 方式 举办 学习 贯彻 二十大 精神 专题 培训班 校党委 常务副 书记 安实 出席 开班式 讲话 校党委 常委 组织部 部长 李明江 主持 开班式 实在 讲话 指出 全校 党支部 书记 高度 责任感 使命感 带头 抓好 二十大 精神 学习 宣传 贯彻 学习 把握 全面落实 下功夫 切实 思想 统一 二十大 精神 引领 激励 广大党员 师生员工 以勇担 中国航天 第一 尖兵 重任 担当 历史 交出 优异 答卷 一是 提高 政治 站位 五个 把握 引领 学习 实践 走深 走实 切实 发挥 头雁 作用 原原本本 结合实际 融会贯通 学上 好头 党支部 学深悟 实党 二十大 精神 坚强 堡垒 二是 教育 科技 人才 一体 部署 找准 定位 作出 贡献 使命 谋划 部署 举措 主动 领命 勇担 重任 引领 带动 师生 改革 发展 出谋划策 同向 发力 建设 教育 强国 科技 强国 人才 强国 贡献 智慧 力量 三是 敢于斗争 善于 斗争 自我 革命 基层 党组织 锻造 坚强有力 拓展 支部 支部 经验 优势 历史 主动精神 迎战 风险 挑战 攻坚克难 追求 卓越 奋斗 实践 夺取 胜利 学校 学习 贯彻 二十大 精神 系列 专题 培训班 组成部分 本次 培训班 分类 分级 精准 施教 原则 安排 设置 必修课程 板块 课程 分组 研讨 邀请 校内外 专家 专题 理论 教学 教师 党支部 书记 领航 工作坊 首次 经验 分享 交流,1
78,哈工大 媒体 明星 辛然 上午 党委书记 熊四皓 创新 创业 中心 电子 实习 实践 基地 调研 团队 哪几个 院系 技术 优势 走进 位于 格物 创新 创业 中心 熊四皓 冯达 同学 展示 踏浪 四足 机器人 吸引 团队 成员 机电 学院 电信 学院 计算 学部 多个 院系 奖项 熊四皓 非常高兴 希望 专业 年级 同学 参与 创新 创业 团队 之间 交流 激发 强大 创新 创业 动能 智能 人机 协同 系统 分体 仿生 蜈蚣 机器人 智能 创新 创业项目 熊四皓 项目 进展 技术 参赛 获奖 前景 产业化 情况 我校 入选 首批 国家级 创新 创业 学院 学校 以此 契机 深化 创新 创业 教育 改革 进一步 同学 创造 施展 才干 舞台 希望 创新 创业 路上 练就 过硬本领 赛场 摘金 夺银 产业化 服务 社会 作贡献 经费 指导老师 学生 作品 展厅 打印 机械 电子 加工 设备 共享 中心 学生 团队 竞创 空间 每到 一处 熊四皓 详细 经费 技术支持 设备 场地 学生 创新 创业 条件 保障 情况 学生 需求 希望 学校 进一步 给予 支持 熊四皓 全校 高度重视 大学生 创新 创业 工作 营造 支持 大学生 创新 创业 浓厚 氛围 激发 学生 创新 精神 增强 创业 意识 培养 创新 创业 能力 目标 引导 规划 多种形式 学生 创造 相互 交流 机会 空间 创新 创业 经验 部门 学院 教师 团队 实验室 中心 基地 联动 校内外 政策 资源 创新 创业 工作 育人 平台 着力 打造 全校 支持 大学生 创新 创业 机制 中心 采用 学校 管理 学生 自主 管理 相结合 管理模式 统一 领导 开放 合作 全员 参与 多方 联动 创新 创业 生态 学生 创新 实践 能力 培养 提供 基础 平台 创新 创业 学院 相关 负责人 介绍 创新 创业 中心 改革 创新 开放 融合 共建 共享 建设 理念 总面积 平方米 规划 建设 功能区 建设 设备 采购 工作 投入使用 现已 入驻 竞赛 团队 航模 协会 上半年 入驻 创新 创业 中心 团队 负责人 卢林昌 同学 学校 提供 充足 经费 提供 场地 激发 科研 创新 兴趣 干劲 培养 学生 工程 实践 能力 解决 工程 领域 能力 提高 学生 沟通交流 团队 协作 能力 增强 实习 实践 效能 学校 启动 校内 电子 实习 实践 基地 建设 工作 并于 投入 运行 基地 总面积 平方米 校内 电子 相关 专业 学生 实习 可扩展性 兼顾 通信 技术 大赛 联网 竞赛 光电 设计 竞赛 竞赛 需求 构建 本研 一体 科教 融合 虚实 学科 相互 融合 渗透 综合 实践 平台 电子 实习 实践 基地 熊四皓 听取 联网 电子信息 创新 实践 基地 新能源 汽车 研发 实践 基地 无人机 探测 智能 感知 创新 实践 基地 无人机 设计 制造 实践 基地 建设 情况 介绍 基地 建设 学生 实践 情况 发扬 哈工大 教学 传统 持续 学生 动手 能力 培养 强化 实践 教学 环节 基地 建设 学生 中心 强化 学科 交叉 融合 校企 合作 开放 共享 建设 理念 学生 受益 副校长 沈毅 校长助理 学校 办公室 主任 陈蕊 出席 调研 相关 单位 负责人 参加 调研 熊四皓 创新 创业 中心 调研 熊四皓 电子 实习 实践 基地 调研,1
