内容,主题概率,主题类型
"书记您好：
      我是一名2020年招募的“三支一扶”人员。偶然间看到自治区党委组织部、人社厅转发《中组部办公厅、人社部办公厅关于应对新冠肺炎疫情影响做好事业单位公开招聘高校毕业生工作的通知》（内人社发〔2020〕23号，以下简称《通知》）。看到《通知》中，对今明两年（2020、2021）经省级人力资源社会保障部门统一组织招募参加‘三支一扶’计划，服务期满且考核合格的人员，所在基层事业单位有岗位空缺的可以直接聘用，并不再约定试用期”的规定.看到这个通知我想咨询一下关于2022年""三支一扶”到期，关于这项政策的落实情况。
1.请问一下，是否有针对这项政策出台的相关政策规定。还是正在研究制定这项政策的相关落实细则。
2.关于“直接聘用”问题。是指聘用制合同制还是带编制聘用。
3.岗位空缺是指本单位岗位空缺还是会集中统一再分配。工资是属于财政拨款还是本单位自行聘用支付。
      今年受到疫情影响，各项考试均已推迟。偶然间看到这个政策，想进一步了解相关政策。在政策出台到现在均没听到过本政策的相关信息。烦请上级领导关心关怀。感谢各位领导。","[(3, 0.97444963)]",3
"书记您好，请问早前已建设完成的兴城西站今年暑季可以开通运营吗？
新冠肺炎防控时期已经过去了，现在已恢复正常生活，出行恢复自由，旅游业也会逐渐恢复红火。兴城西站可与葫芦岛北行程互补，促进葫芦岛出行更便捷，助力葫芦岛旅游业。
请问兴城西站开通运营是差哪了？为什么一直不开通客运业务？葫芦岛市与沈阳铁路是否已达成共识？预计什么时候开通？
谢谢！","[(0, 0.9748111)]",0
12月25号因为新冠肺炎阳了以后身体原因加强基础病上不了班，像老板申请了离职回老家看病治疗，但是12月我上班有18天工资直到1月17号还不发，发微信不回，打电话几遍找理由推脱！最后答应给我发但是又要各种克扣我工资，工资6500一个月只给我按6000一个月算，说好的房补400也不补，老板态度恶劣。没有给我签劳动合同也没有交社保。请市长给个公道，快过年了工资就4300也不愿意给，就只打算给我3600，恶意克扣工资！,"[(1, 0.975147)]",1
尊敬的省长同志您好：劳烦您在百忙之中关注一下我们老百姓的生活困难。我是城关区医院红山西村210号居民，我们片区的暖气多少年来都不达标，尤其是今年只有十一二度，今天供热站的人把暖气烧热了后来测温，测完直接h就没有暖气了，当下正值新冠肺炎高发期，我们在家里挨冻，病情反复发作，一个多月不康复，希望省长能督办一下这个问题。,"[(2, 0.97493905)]",2
"1、基本情况：本人于2020年7月购买云谷小镇8号地块房租，合同约定交付时间为2022年9月10日。
2、问题：嵩明云谷小镇，以《昆明市人民政府办公室关于应对新冠肺炎疫情保障房地产市场平稳健康发展呢的通知》为借口向业主发送“延期交付告知函”，只是说延期，具体情况，什么时候能交付一概不提。
3、希望严查云谷小镇开发商，尽快按质量交房。
","[(3, 0.9745174)]",3
您好！本人是温州市直机关某单位的工作人员，妻子为江西上饶某县公办幼儿园在编教师。近年来新冠肺炎疫情影响，聚少离多，也无法照顾老人子女，承担家庭事物。我们夫妻俩都是本分的普通党员，为了便于工作和生活，我们不得不向党组织寻求帮助，咨询将本人配偶调入温州市区幼儿园工作的政策，恳请党组织考虑我们的实际困难，不胜感激。,"[(0, 0.97529614)]",0
领导您好，我父亲是一名参战退伍军人，大庆坪乡竹马山村人。今年7月因帕金森晚期、重症肺炎呼吸衰竭等疾病在中心医院（南院）ICU住院治疗至今。已自费医疗费用大概三万元。目前病情无明显好转，医生告知后面需要在ICU长期治疗观察，一个月的医疗费用报销后大概2万元左右。我（患者儿子）现年25岁无结婚，一个月的工资4000元，母亲有精神方面问题无工作能力。我们本是低保家庭现根本无能力承担这巨额医疗费用。希望领导核实给予我们经济上的帮助，感谢！,"[(1, 0.97499156)]",1
今年武威市外出务工人员中发现新冠肺炎阳性患者， 在这样特殊时期，我觉得疫情防控措施处置的非常到位，及时，到位在疫情防控常态化，防控点都有人员24小时人员轮换值守，发现及时，发现疫情后，处置到位，及时组织了武威市全民进行核算检测，先后进行了四次全民核检，未发现新增病例，这在很大程度上稳定了市民恐慌的情绪。非常好！,"[(2, 0.9746798)]",2
1.兴义市兴天路靠近老百姓一侧路牙高度20公分，靠近徳嘉花园一侧路牙高度15公分，国家标准是15公分。也和施工单位反应过，未得到解决。新冠肺炎疫情发生以来，实体经济已经很不景气，沿线居民基本靠房屋生活，同时因建造房屋，每年还要支付银行欠款和利息。政府修路是好事，希望不要断了沿线商家生机，老百姓的生活。打扰领导。,"[(1, 0.9750607)]",1
"朝阳公园南路，朝阳公园桥西侧，郡王府旁建筑工地方常年夜间施工扰民，投诉多次情况也并未好转，凌晨一点到四点是高峰作业时间，甚至在2020年初新冠肺炎爆发时也没有停过。噪声包括不限于货车发动机，大型机械作业的声音，还曾有高音喇叭人声循环播放。对于上班族而言这样的生活环境十分痛苦，望有关部门能帮助协调沟通。
","[(1, 0.9750171)]",1
经专家组综合研判，首都严格进京管理联防联控协调机制、北京新冠肺炎疫情防控工作领导小组研究决定，自6月6日起，除丰台区全域及昌平区部分区域外，全市其他地区进一步分区分级动态实施以下社会面防控措施，其中包括安全有序放开装修、改造、改建、维修等“散装散建”生产活动，严格社区防控，落实从业人员“一登三查”要求。,"[(0, 0.97485703)]",0
家母5月18日凌晨2点入人民医院120急诊，做了血象，CT，心电图等相关检查后，诊断急性肺炎需要住院治疗，当日16点完成入院手续。于6月1日出院结算，结算时住院后的各项费用纳入医保，但住院当天急诊费用不予纳入医保报销范围，未给予核报。经在网上查询门诊急诊费用是可以医保报销的，因此想咨询本地执行依据及人民医院处理是否合规！,"[(2, 0.9748265)]",2
我一名鸠江区的志愿者，我报名了社区志愿者，在做志愿过程中没有迟到、早退、离岗等，按照《安徽省人民政府办公厅关于印发应对新型冠状病毒肺炎疫情若干政策措施的通知》等文件，对于参加疫情防控的其他医务人员和防疫工作者，按照每人每天200元予以补助。可是到现在都没有街道、社区说补助的事。想询问下此补助是否还有，如何及何时发放？,"[(1, 0.97459376)]",1
市领导您好，近期我市新冠肺炎疫情已全面得到控制，各类场所、企业、学校已复工复产，餐厅恢复堂食，KTV、网吧等密闭场所也都正常营业，新华区公共足球场，解封当天都已投入使用，请问为什么市里建的奥林匹克公园11人制足球场，一直处于封闭状态，希望市领导可以协调尽快开放，使我市居民周末有个活动、健身的场所，也给足球爱好者一个活动的空间！,"[(2, 0.97466063)]",2
郑州地铁6号线西段于2016年动工，道路周围房屋拆迁，政府以及地铁相关施工单位告知当地居民地铁于2020年6月开通，居民配合政府开展民生工程，后因新冠肺炎疫情影响推迟至21年底，郑州720特大暴雨灾害以及贾峪疫情又推迟至22年5月，如今半个月过去，政府没有公告任何相关进度以及开通时间，当地居民苦不堪言，交通出行受到了极大的影响。,"[(2, 0.97393835)]",2
"尊敬的张书记，结合目前疫情局势，针对我市交警设卡用检测仪查酒驾一事，斗胆向您反应以下问题:
交警在检查过程中，检测仪器反复使用，期间如遇肺炎患者，极易出现交叉感染，非常的不科学。期间也不进行消毒，一直重复使用，我咨询了身边好多驾驶员，都非常不赞成这种做法，查酒驾可以，但是需要科学的方式方法。
最后，祝您工作顺利，祝我市的建设蒸蒸日上。

","[(2, 0.97488797)]",2
1，由于本人以及妻子常年在深圳工作入的是深圳职工社保，小孩于2022年3月15号在深圳出生后由于肺部吸入羊水导致肺炎在深圳治疗后由于我们夫妻双方非深圳户口小孩子的医疗费用在深圳报销不了要回到户籍地报销，现在遂平工作人员说由于我们夫妻常年没有在遂平交过新农合报销不了，现在已经错过了交新农合的时间想问一下这种情况该怎么处理？,"[(1, 0.97170055)]",1
"领导您好！
我举报丰台区彩虹城3区1号楼，中介将两居户型隔成4户(主卧、次卧、2个厅隔)，屋内住了至少五人，男女混杂，人员来源不明，流动性高。屋内嘈杂，影响周边居民正常生活。电器使用混乱，有极大的火灾安全隐患。
现正值新型冠状肺炎疫情高发期，如不及时管控，很容易造成聚集性交叉传染。
望领导给予重视，惩治此恶劣行为，尽快拆除隔断房。谢谢！","[(0, 0.97481656)]",0
"领导您好！请问1.2022年安庆市市直及各县区事业单位招聘什么时候开始？2.根据2020年3月份中央组织部办公厅、人力资源社会保障部办公厅印发《关于应对新冠肺炎疫情影响做好事业单位公开招聘高校毕业生工作的通知》,《通知》要求今明两年事业单位空缺岗位主要用于专项招聘高校毕业生，2022年政策到期后是否将不再执行？","[(2, 0.9735449)]",2
露水河平安小区两位80老人，身患肺炎、高血压、糖尿病等，供暖常年10摄氏度左右，从21年开始已在此留言请求帮助解决，第一年协商说更换管路后能改善，退回一半取暖费；第二年出钱更换管路，重新翻新室内暖气依然没有改善，供暖方依然没有解决温度问题，决定不解决就不收取暖费；第三年即今年，因为更换供暖方，供暖期开始，有当地政府人员联系我回访，告知其温度依旧白天正午太阳下13度左右，阴天与晚上10度以下，工作人员说可以去测温，测得温度确实如我所说，老人表示只要温度能达标就交取暖费，工作人员说室内管子问题，但是今年室内暖气已经全换新。之后不了了之，期间联系供暖方负责人一直不接电话，去工作点员工就说自己是烧锅炉的，负责的人阳了，持续一个月接口一直是阳了，现在供暖方直接通知不交取暖费就直接掐断供暖。镇工作人员以无法使双方满意。,"[(0, 0.97462493)]",0
1、交通极其不便利，但考虑到这是利民工程，所以虽然不堪其扰，但仍然心怀感激。2、但是！！因为常年修路，导致空气质量极其差，万科欧泊的孩子们批量出现呼吸道感染的症状，有的常年咳嗽导致肺炎，有的患有严重鼻炎，严重影响了孩子的身体健康，让整个家庭承受了巨大的压力。烦请领导们能重视，能真的给出道路疏通时间表！为我们的下一代负责！万分感激！！！,"[(0, 0.974941)]",0
尊敬的领导您好：目前在西安全域低风险！新型冠状病毒肺炎防控方案 （第九版）对于疫情防控措施都放松了许多！！！西安市莲湖区丰镐西路宁合世嘉小区不让外卖进小区，给居民生活造成了极大不便！！！给家里老人买药外卖送上楼都不行，本来老人行动不便不能下楼，买外卖送到门口可以说很正常，现在小区不让外卖上楼给人造成极大困扰，望领导给予重视，尽早解决小区防疫过分加码问题，感谢。,"[(0, 0.97449833)]",0
尊敬的领导你好：我是安徽省亳州市涡阳的，第一蚌埠市有新冠肺炎病列，是否会影响全省快递物流。第二。蚌埠市是全省物流集散中转中心，蚌埠有新冠影响是是否会影响省外快递到达蚌埠中转， 是否会影响到其他省内县市的物流的收发快递 第三，现在居民会经常网购我的的快件都需要到蚌埠中转一下才能到亳州市涡阳县会不会影响本月的快递收件工作和发件工作,"[(0, 0.9741538)]",0
位于燕沟燕翔苑小区大门口的李师烤肉店 每天经营到半夜1.2点 店外坐的喝酒的 大声喊叫 实在吵的楼上居民无法睡觉 多次给相关部门反应投诉 但相关部门只是敷衍了事 口头解决 应付差事 家里有几个月的婴儿 烤肉烟进到家里 导致宝宝得了一次肺炎住医院住了半个月 。 晚上的摇筛子 ，划拳声音更是吵的宝宝无法休息 经常哭闹 ！！希望领导帮忙监督相关部门真的解决 并不是应付差事 ！！！,"[(0, 0.9751469)]",0
领导您好！我在旅行途中发现，广州东站4号候车厅内，站内喇叭反复播报”预防新兴冠状肺炎，要避免聚集，戴好口罩勤洗手，发热及时就医”的文案。在我候车的2小时内，该播报不仅没有停歇，而且文案简短，不断循环，站内无死角式播报。虽然防疫工作是重中之重，提高群众防疫意识很重要，但这样的洗脑式宣传可能会影响到候车旅客的休息，甚至过犹不及，影响防疫工作。感谢领导的倾听，希望广州东站能越建越好，为群众谋福利。,"[(2, 0.9747984)]",2
楼下羊肉汤馆味道严重影响到楼上老老少少的居民休息和生活，一年四季都不敢开窗户透气！因油污大导致家属院内下水道堵塞，翻出污水！臭气熏天！屎粪漂一地！夏天易生病菌！物业办事处都不管！居民们也想执法部门还我们一个良好的居住和生活环境！因油污大导致家属院内下水道堵塞，翻出污水！易生病菌！空气污浊不考虑新冠肺炎吗？,"[(0, 0.14836045), (2, 0.8344424)]",2
深圳市政府3月25日印发了《深圳市关于应对新冠肺炎疫情进一步帮助市场主体纾困解难若干措施》，各区都有落实。比如在促进汽车消费方面，福田、罗湖、龙岗、龙华、宝安、盐田、光明等，都已经制定下发了2022年的购车补贴政策。请问作为深圳重要的一个区，南山区为何迟迟没有落实深圳市委、市政府的有关政策，为何自4月开始就不断有网友咨询购车补贴政策，直到现在也不见行动？,"[(2, 0.9745092)]",2
3月26日，来宾市卫健委微信公众号“来宾大健康”公布《来宾市新冠肺炎疫情风险人员健康管理服务措施表》，并不包括对相邻市南宁柳州返回人员健康管理措施，这2个市和来宾相邻，人员来往密集，而且都有存量病例，特别是南宁市最近新增病例在21号(个人查找网络资料)，建议对柳州南宁返回人员，参照其他现有病例市，增加对南宁柳州返回人员核酸检测、居家隔离、自我健康监测等健康管理措施。,"[(1, 0.9748776)]",1
"秦安县新冠肺炎疫情联防联控
领导小组办公室：
                       面对新一波突如其来的疫情，247国道入县城的国道口检查很到位，但是离国道口不远处的西川中学高中部与附近加油站之间有一处便道，(加油站区域延伸段可直达西川中学高中部旁路)，开车可直接通过，部分司机为了节省时间从此通过，给我县的防疫工作带来了不确定因素，建议物理封锁该漏洞区域。","[(2, 0.97494674)]",2
我是德阳市岷江路心悦城二期7栋业主，心悦城开发商犹豫出现自身问题延迟交房三年，交房中出现太多波折，一房多卖情况严重。导致我们二期业主一直无法拿到关于房子的所有证件，每月还得按时缴纳房贷。目前这几年又遇到新冠肺炎疫情，经济萧条无法还贷了，想想把房子售卖吧又没得任何证件。所以请书记帮帮我们心悦城的业主吧，实在没有办法了！,"[(1, 0.97501427)]",1
当前新冠肺炎疫情肆虐，人民群众核酸检测的需求日渐提升，但我市一直都在执行单人单检政策，造成了检测试剂的浪费，费用高，也极大加重了检测人员的工作量，建议推出混检（5混1或10混1），目前很多城市都采用了这种方法，价格便宜仅需10-15元，而且也能显著减轻医疗人员的工作压力，经济实惠！（价格公示栏有混检价格但医院不提供混检服务）,"[(2, 0.974455)]",2
" 建议:
1.开放24小时核酸检测绿色通道，针对急需核酸证明的群众进行采样及加急检测。
2.更换距离更近公交车站的位置为核酸采样点或者在各乡镇卫生院设立核酸检测采样点。 ","[(0, 0.013388871), (1, 0.9601403), (2, 0.013522866), (3, 0.012947997)]",1
我是一位新手宝妈，宝宝刚70多天，去社区打了一次疫苗，为什么社区小孩疫苗不全，社区疫苗人员也不给讲解一下（可以把同时打疫苗的宝妈或宝爸统一一个日子召集在一起讲解）作为新手妈妈根本不了解自费疫苗和免费疫苗都有哪些，有什么不同，问社区的人他们也答不上来，就告诉打自费的带现金，自费育苗不也是有些是必须打的吗？为什么社区人员都不告诉，轮状育苗，13价肺炎等等，主要是社区育苗不全，一旦赶上疫情有的疫苗过天数了，有些自费疫苗小孩就打不了了，就像轮状疫苗八里堡社区就没有，13价肺炎也没告诉打，虽然是自费的，咱们工作人员也应该告诉一下是有还是没有，五联就说了，要打的话带钱，咱们社区13价和轮状没有，小孩的疫苗只能在社区打，你倒是全一点的，希望二道区八里堡社区重视一下这个问题，还有就是社区打疫苗的电话，就好像摆设，连续打好几天都没人接，节假日没人可以理解，平时也没人接，接电话的说可以打疫苗，但是实际去了又说打不了，可不可以整一致了,"[(3, 0.97501016)]",3
我于2021年5月底认购中煤和悦府一套，签订合同后约定于2022年6月30日交付房产。在我们广大业主满怀期待的等着交房的时刻，今天中煤集团单方面发出了《关于受新冠肺炎疫情影响告知书》，通知我们因受新冠肺炎疫情影响项目延期交付，具体交付时间并未告知。事实上，和悦府项目不能按时完成，并非受疫情影响，而是因为中煤集团未能妥善安排好二期居民，遭到阻工，我们自己看到的是，项目曾因拖欠工程款工人多次停工讨薪，特别是2022四月份的时候，有两个星期的时间和悦府项目一直处于停工状态。业主们找开发商也找不到找销售人员就是踢皮球推来推去，为了糊弄我们，这让我们业主根本看不到交房的希望，每天生活在房屋即将烂尾的焦虑当中，我们不能接受中煤集团单方面的将责任归咎于疫情，而绝口不提自己的原因。而且中煤项目根本就没有受到长沙疫情的影响，就算受到了影响也只有几天，我们需要政府相关部门约谈中煤责任人，要开发商给我们一个准确的答复。,"[(0, 0.97468656)]",0
"尊敬的秦州区领导：
我们是秦州区坚家河7号（原庆华厂家属院）8号楼的居民，现举报8号楼4单元一楼西戶（姓名不详，女的可能姓郭）不是一年、两年，而是常年在家门口或院内用木头之类的东西焼水，昨早又在焼。
烟气四散，污染环境，邻居遭殃。烟气对人体，尤其是吸入肺内有害，在肺炎疫情严峻的形势下，住宅楼家家有烟道而不用，在外焼的行为不道德！
","[(0, 0.9748045)]",0
我在2022年7月于**城堡订下2022年7月30日的宝宝百日宴并交了36448元的押金，酒店开具了押金条。因新冠肺炎影响，举办宴席日期疫情严重，响应政府号召因此取消了宴席。我向酒店提出退还押金，酒店一直以公司规定为由拒绝退款只允许宴席举办。我向酒店说明是因不可抗力取消，政府也发文加强疫情防控餐饮单位不承接艳宴席活动，我也是响应政府防疫要求，不是出于我的主观原因，酒店仍不予退还押金。,"[(0, 0.9742638)]",0
经多方了解，平顶山市**中学高三学生于8.2日早上7点30分前进班补课，严重违反教育部规定，根据《平顶山市新冠肺炎疫情防控教育体育系统工作专班办公室关于全市各类学校暑假工作安排的通知》文件精神，市教体局要求全市各中小学校严格按照规定的时间放假、开学，未经教育行政部门同意，任何学校不准提前或延后放假时间。该学校已在7月中下旬违规一次，并做整改。,"[(3, 0.974921)]",3
目前新冠肺炎形势严峻，多地都在招募青年志愿者参与疫情防控，咱们萧县是不是也能号召假期在家的萧县籍大学生去当志愿者呢 ？这一方面可以缓解县里人手紧张的问题，另一方面也能给大学生一个参与社会公益的机会。如果咱们萧县鼓励大学生当志愿者，并且给大学生记录志愿时长，是真正实现了双赢，对目前的局来说不失为最优解。恳求领导考虑,"[(3, 0.9724444)]",3
位于越秀区广州大道中富力东山新天地F1栋的“****羊肉串”店铺，自今年3.4月份开业以来，几乎每天晚上8点开始至凌晨都散发很大油烟味，对附近居民的呼吸系统影响极大，现在晚上在家就会感觉喉咙不适，咽干咽疼，长期下去担心会出现肺炎等其他更严重肺部疾病。之前投诉过，有所改善，但没多久又恢复原状。望相关领导尽快跟进和敦促整改，还我们一个健康的家园，万分感谢！,"[(0, 0.9746191)]",0
"关于稳定住房消费的建议
尊敬的市长：
您好，为切实满足广大职工刚性和改善性购房需求，积极应对新冠肺炎疫情影响，建议借鉴其它城市经验做法，采取以下措施稳定住房消费，促进我市房地产业良性循环和健康发展。
措施一：允许提取公积金支付首付款，进一步减轻支付首付款资金压力，方便职工购买新建商品住房。
措施二：对个人购买新建商品住房的，给予全额契税补贴。
以上意见供领导决策参考，祝您身体健康，工作顺利！","[(0, 0.974639)]",0
郑州市金水区花园路国贸新领地小区内核酸检测小屋未按规定时间上下班，据郑州市新冠肺炎疫情防控指挥部发布114号通告，自6月3日起，各便民采样屋每日工作时间暂定为：6:30—10:00、13:00—15:00、17:00—20:30。这附近核酸小屋每天5:30就下班了，居民下班时间都是6点，过来之后，附近核酸小屋全都没有上班，只能自费去旁边的医院核酸检测，严重影响居民出行。,"[(2, 0.9744287)]",2
"1、玉林市区2022年3月19日发布通知:
因疫情严峻为减少人流动，暂时关停KTV、酒吧、网吧、健身房、洗浴中心、棋牌室、麻将馆、桌游室等室内密闭休闲娱乐场所。关停至今已经25天了，没有恢复营业，什么工作才能恢复营业？
2、玉林市区3月份以来不是中高风险地区，又没有新冠肺炎疫情病例，也没有接触者，长时间停业给经营者、就业者带来极大的经济压力，建议加强外防出入管控措施，适当给市民复工复业。","[(3, 0.9743347)]",3
当前新冠肺炎疫情愈加严重，各地本应积极响应国家疫情防控政策，不聚集、不扎堆、少出门。驻马店市截止投诉前本轮疫情已出现六例无症状感染者，而该市第四中学却不顾当下社会背景，该校九年级学生周六仍全天上课。个别班级已出现学生感冒情况，这已严重危害学生的健康安全。周末本就应让学生在家休息，疫情期间更应如此，恳请有关部门予以介入，还学生一个安全、快乐的双休日！,"[(0, 0.9744736)]",0
目前，我省新冠防疫进入了攻坚阶段，曙光就在眼前。4目2日，省医保局，省卫健委联合下发了新冠肺炎核酸检测降费的通知，通知中要求，辽宁省公立医院同时提供单人检测和多人混检两项股务，费用标准分别为单人次28元和8元，时间从4⺝3日起执行。沈阳，大连，盘锦，铁岭等各市均按省通知要求落实，但鞍山市各公立医院至今仍末提供混检单人次8元这项服务，督导落实亦必要。,"[(0, 0.9749099)]",0
