内容,主题概率,主题类型
"1.现在疫情严重，人人配合。但在配合的同时，大家都要上班的，不然人人不上班怎么生活。
2.睢宁县双沟镇幸福里一期疫情从早上一直广播到晚上，我们住在前面一栋，特别吵人，声音太响。而且我们配合疫情的同时，也希望政府部门也能理解。而且我想说都坐在门口有什么用，还不如多转转管理没有口罩的人","[(0, 0.0108085275), (1, 0.96782136), (2, 0.010688266), (3, 0.0106819095)]",1
"建议：
    疫情还没有结束，防控常态化。政府政策制度体系很完善，但是下面落实执行不到位。个别地方防控不负责任，门口扫码进入根本不负责，甚至有的在看手机刷视频玩游戏。还有的糊弄用笔纸登记一下，简直就是浪费国家资源。
   各小区、商场等门口保安必须关联责任人，社区负责人和物业负责人，出问题严肃处理。
   快递外卖人员坚决不允许进入小区和工业园，只要疫情没有结束，坚决执行到底。","[(2, 0.97471255)]",2
领导你好，塘汇街道正原路39号佳利电子东区园区内的祺旺信息科技有限公司，在疫情严重的当下不给员工放该放的停业假期，该企业不属于重点企业，目前本身就是停滞不前状态！多数员工小区封锁无法上班，该企业要求员工正常上班，我们每天都提心吊胆上班，下班提心吊胆，好多员工住在疫情严重的南湖区别，也每天正常上班，对此厂里没有表明态度，我们每天都担心受怕，求助领导解决此事，以免每天提心吊胆，感谢！,"[(3, 0.97474647)]",3
为加强保定市疫情防控。完善疫情防控措施。对中高风险地区来返保，建议采取“14天集中隔离+14天居家健康监测+12次核酸检测”的原则实施管控。中高风险地区及暂未调整风险等级但有阳性感染者报告地，此类人员严格限制出行，入保后严格落实“三天两检”措施。中高风险地区及本土感染者报告地来返保人员，按照非必要，不岀行，确须出行应提供48小时核酸检测证明。,"[(0, 0.9741271)]",0
领导你好，我要举报永清镇泰山路广播区后面建行家属院1**-*疫情期间每天晚上通宵聚众，声音极大扰民，望领导给予批评，谢谢。,"[(0, 0.95461386), (1, 0.01538688), (2, 0.015085778), (3, 0.014913463)]",0
关于当下桥西区的疫情现状，我想知道现在是否可以进出桥西区，是否需要携带相关证明呢，我当下不在桥西区，想进去办点事。,"[(0, 0.03234015), (1, 0.9034755), (2, 0.03229933), (3, 0.031884987)]",1
"当前疫情严重
建议:
      外卖员、快递员以及各行业的配送员，严禁进入各小区和工业园
      东西放到门口架子上，安排专人进行管理消杀。","[(0, 0.015265258), (1, 0.9544176), (2, 0.01536815), (3, 0.014949013)]",1
汾湖嘉乐城物业做为嘉乐城根本不重视疫情防控物业几个工作人经常不戴口罩在商城出入希望有关部门给予警告处罚,"[(0, 0.95339143), (1, 0.01584114), (2, 0.0154993255), (3, 0.015268138)]",0
希望可以规范一下，天津钢铁集团有限公司疫情防控，在天津防疫政策上肆意加码，过度防疫，严重影响正常生活出行。,"[(0, 0.947878), (1, 0.017333051), (2, 0.017749479), (3, 0.01703948)]",0
您好，我是安定镇的一名村民，家里有位患者需要用药，但是疫情期间不能走动，村里的药店也没卖患者所需要的药品，请问我该向谁求助，希望领导能切实解决疫情期间的用药需求。,"[(0, 0.01392148), (1, 0.013717278), (2, 0.9587497), (3, 0.013611544)]",2
书记你好，关于2021年下半年因疫情导致店铺不能营业，是否有补助或者减免租金的政策，兰州市城关区麦积山路长城山海苑商铺,"[(0, 0.9543356), (1, 0.015325712), (2, 0.015011019), (3, 0.015327721)]",0
我家住四川省自贡市富顺县李桥填大地村九组。从3月9号来到上海浦东新区临港新元南172号上海四健健工工地。因从3月28号在工地上隔离到6月1号都是我自己支付的生活费。我问一下政府有沒有疫情补贴。上海四健公司不给我们农明工的补贴望政府给我问一下上海四建公司？谢谢。,"[(1, 0.010028766), (3, 0.9700494)]",3
我是金山区依云四季二期项目外墙涂料工人，上海疫情封控79天，上海人社部门明文规定企业发放疫情期间生活工资补助，为什么我们到现在了都一分没有呢？,"[(0, 0.9591131), (1, 0.0139789805), (2, 0.01354586), (3, 0.013362049)]",0
住在上高街道办事处，施家结庄村，疫情的广播声音过大，喇叭句离家太近，时间过长，严重影响午睡休息以及要开始的网课，因为疫情居家考试严重影响学习和生活，声音太大，时间太长,"[(0, 0.963341), (1, 0.012248891), (2, 0.0122204395), (3, 0.012189722)]",0
领导你好，2022年9月18日到2022年9月22日经过介绍在**工作。**班组长说疫情补贴30一天，希望领导替我追回工资，感谢领导,"[(0, 0.023960788), (1, 0.9285016), (2, 0.023914987), (3, 0.023622625)]",1
唐山汉沽管理区是与天津宁河的接壤，天津市疫情防控都是分楼栋封控管理。希望能按小区精准区分封控区、管控区、防范区。,"[(0, 0.013816441), (1, 0.95822257), (2, 0.014109407), (3, 0.013851523)]",1
"领导好！

我在北京购置了辆新车，由于北京的指标限制，需要回户籍所在地上牌，但是疫情阻挡了我们上牌，我的车已经两个多月快3个月没有上牌了，不是邯郸疫情就是北京疫情，所以我想咨询一下可否有其他渠道可以把牌照上了？所以有以下建议：

1，为方便可以在疫情期间正常上牌，可否固定在邯郸管辖区高速服务区或者高速出口设置临时验车上牌点儿？这样既不用进市区也能满足像我这样情况的人上牌。

2，或者可以回去车管所上牌，我不回老家，只是北京邯郸市两点一线上个牌再回来？如果这种情况可行，需要怎么报备？

哪怕费用贵点无所谓， 还希望领导能够斟酌考虑，谢谢！","[(2, 0.97508883)]",2
"现海口、三亚、万宁等地疫情加重，建议政府提醒广大群众出门佩戴口罩，出入要进行消毒。
      因海南省大力发展旅游业的原因，会不断的有大量外来人员进入，现海口、三亚、万宁、白沙等地均出现疫情，无法保证不会有外来人员或者上述地区的人进入东方市，为了应对有可能存在疫情但尚未及时发现的情况，建议政府要提醒广大群众出门佩戴口罩，出入要进行消毒。","[(1, 0.9711315)]",1
希望对现在疫情防控的地区，能具体到街道还有就是对学生的政策，因为学生一直都是在学校闭环管理的，希望对这个隔离的政策制度优化一下。,"[(0, 0.9396144), (1, 0.019929875), (2, 0.020227872), (3, 0.020227818)]",0
庆阳市西峰区古象路润康家园小区在疫情期间无任何防控措施，出入小区不扫码，不盘查，外来人员随意出入，门口保安时若不见。,"[(0, 0.95658535), (1, 0.014505422), (2, 0.014562356), (3, 0.014346898)]",0
领导您好，我是双墩镇御景家苑的业主，我们小区现在的东门因为疫情于今天年初的时候封闭，一直到现在非常的影响居民的出行，虽然在前2个月之前开通一个侧门，但是只有上午和下午才会开通一个行人通道，虽然说防疫是每个人应尽的职责，但是现在合肥现在疫情也没有，所有的小区也都开放了，我们小区现在就是有点过度防疫有点影响我们的出行了，而且现在门口的扫码我们都可以接受，就是希望领导可以解决我们的出行问题，看能不能把东门解封，让业主们同行，谢谢领导！,"[(0, 0.97435904)]",0
领导好，辉县市疫情防控工作在各位领导的正确带领下，严守底线守护了这一方水土。目前，各个场所都设有场所码，但是住宅小区设置的场所码却形同虚设。小区物业只要求进入车辆扫描场所码，电动车、行人视而不见，有时甚至车辆和行人都不用扫码随意进出。五一假期即将来临，人员流动量会大增，为了小家更为了大家，建议无论任何场所，任何个人，都应该自觉主动扫描场所码，小区物业更应该尽职尽责，一视同仁，要求不漏一人一车，为疫情防控尽自己的一份力量！,"[(2, 0.9750203)]",2
西城区白纸坊街道右安门内西街，有一家超市叫****商店，这家超市从疫情开始直到现在不落实疫情防控要求，工作人员不佩戴N95口罩，不扫码，不消毒，不登记。诉求：要求相关部门关停超市！,"[(0, 0.96514875), (1, 0.011537565), (2, 0.011406128), (3, 0.011907622)]",0
您好，我是兰州市皋兰县人，现于兰州市安宁区石磊庄社区租房住，因疫情封闭管控社区无法上班，应为是在工地打工，需要还个人的一些贷款，问问政府有没有疫情这方面的补助金，如何申请,"[(0, 0.96227485), (1, 0.012495583), (2, 0.012418066), (3, 0.012811478)]",0
"1.构建开放疫情服务平台，当前疫情下，大家很紧张可以理解，但是服务和技术跟不上，会出现很多莫名其妙赋码问题，在这个过程中，给各层级的服务工作人员带了很多工作量，群众也不满意（例如只是因为一个外省的号码就将健康码赋黄）。是不是可以根据这个情况 打造疫情分析系统，如何更加精准防疫，尽量减小对经济、生活的影响。
2.统一的信息收集平台，各层级归一化，减少基层工作人员工作反复性。","[(2, 0.9746454)]",2
疫情期间停课不停工，双职工家庭无法兼顾孩子和工作，是否可以开放一部分班级，解决家中无老人帮忙带孩子的这个困难，孩子上幼儿园无法一人在家,"[(0, 0.95863855), (1, 0.013494107), (2, 0.014003556), (3, 0.013863763)]",0
问一下有关领导，实验中学高二级学生疫情期间学校让去兰州培训，而且半年时间收费高达三万多，而且星期天还没有饭吃。这样合理吗？沒人管吗？,"[(0, 0.018493032), (1, 0.01822159), (2, 0.0184897), (3, 0.94479567)]",3
中发郦苑11栋2单元外挂电梯，疫情期间小区随便出入。施工人员进入小区不带口罩，随意乱窜。施工钻墙声音巨大。严重影响中高考孩子上网课学习，希望赶快把他们撵出小区。,"[(0, 0.8072341), (1, 0.17077439), (2, 0.011014167), (3, 0.010977286)]",0
您好！目前沈阳市疫情越来越严重，被隔离的人也多了，做为家有宠物的人特别焦虑，不知道我们浑南区遇到宠主被隔离时，怎么安置家里的宠物呢？有没有具体的办法？谢谢！,"[(0, 0.94378614), (1, 0.018484114), (2, 0.018853346), (3, 0.018876396)]",0
尊敬的市领导，我是泰禾广场基层员工一名，当前疫情太严重了，家里还有小孩子还未上幼儿园，孩子小抵抗力弱，恳请领导批准并通知泰禾广场闭店让我们居家隔离减少外出，为疫情出一份力,"[(0, 0.9606576), (1, 0.0131585505), (2, 0.013126472), (3, 0.013057389)]",0
自疫情出现后，为了疫情防控，出资为各医疗机构安装了疫情防控核酸采样点云平台监控，作为一名医护人员，我个人觉得这个平台很好，希望继续保持畅通，现在好多采样点监控已经不能用了，希望尽快解决，感谢为疫情防控付出的所有人，你们辛苦了,"[(0, 0.013064931), (1, 0.013522995), (2, 0.96036744), (3, 0.01304463)]",2
想了解一下，嘉定区针对承租镇政府和村委会房产，因疫情有没有减免政策或规定，因为有家人承租安亭镇政府和塔庙村委会所属公司门面房。,"[(0, 0.11354777), (1, 0.016356243), (2, 0.854096), (3, 0.01599999)]",2
白灰围小区未做到安全的疫情防控，随意让人出入小区，对我们里面住户产生极大安全隐患，还有其他小区都能做到一个门出入，为什么白灰围还是两个门出入呢。,"[(0, 0.029948836), (1, 0.909099), (2, 0.030321296), (3, 0.030630836)]",1
我是江苏科技大学2022年6月的成人本科毕业生，我想建议请求下江苏省教育厅、江苏科技大学等在学位申报上面能否提供“人性化”政策，原因如下：一是因为疫情影响，学位申报英语考试机会比往年少。疫情以前，2年的学位申报时限内至少有8次以上的考试机会。疫情至今，贵校就组织了一次学位考试。如之后再无补救办法将会错过学士学位，对我工作影响较大。可否提供江苏科技大学关于学士学位申请的政策？,"[(1, 0.97495997)]",1
二七区华中路11号院，院内安装篮球场，疫情封控期要求人员足不出户，但小区人员打球严重聚集，对疫情防控恐造成不利影响。学生在家上网课严重噪音污染，每天七八个篮球同时打来严重噪音扰民。为什么在居民区内建篮球场，建议拆除！,"[(1, 0.010007473), (3, 0.9701187)]",3
希望领导在疫情防控上做到统一。我被站前社区通知居家健康监测。我完全配合防疫工作。但是单位让我出具证明。站前社区不给出具。单位同事在铁岭别的社区都给出具了。就站前社区不出具。请问一下领导咱们市疫情防控是统一的吗？,"[(0, 0.014896133), (1, 0.014736052), (2, 0.95562404), (3, 0.01474375)]",2
书记您好我是宁城县一名公交业主，我想咨询几件事，1、2019年从燃油补贴扣我们每车4万共284万说是用于公共交通统筹发展，请问统筹资金都需要扣燃油补贴了吗？我们没有运营亏损全靠燃油补贴艰难维持运转，如果油补都被统筹了如何能保证行业稳定发展？2、去年客车有个退坡资金为啥公交车没有？3、三年疫情饭店中小企业都有疫情补贴，为啥提倡发展的公共交通行业却没有疫情补贴？是个别地区没有还是全市没有？,"[(0, 0.9746951)]",0
尊敬的领导，您好！近来各项考试都陆续重启，但现在二连浩特又有疫情，希望领导们能关注下二连浩特等疫情地区的考生们，事业单位、公务员省考、三支一扶等考试也关乎着每个考生的就业及每个家庭。因为原定三四月省考的推迟，很多考生已经在家学习大半年了，每一次考试机会对我们来说都十分的宝贵。希望在领导们的帮助与关怀下我们能够顺利参加考试。我们共同努力，早日战胜疫情！,"[(2, 0.9746708)]",2
"尊敬的市委领导您好：
关于疫情防控期间环保方面问题向您反应，我是朝阳区红旗街和光路和光小区居民，我楼上邻居有一个老头，是单身一人，每天随意出入捡垃圾，而且不戴口罩，他捡的如果是可回收垃圾我都不会投诉，而且纯垃圾（塑料袋，一次性餐盒，卫生纸，等），整个楼道味道特别难闻，而且疫情这么严重每天还随意出入，太危险了，我家有中考生，多次反馈给社区无人回复和解决，目前我们小区还安全，疫情关键时刻特此举报。","[(0, 0.9745134)]",0
尊敬的市领导您好，我于19年五月报考的驾照，期间疫情反复不断，5.15日到期正巧遇上疫情在中高风险地区一再推迟不能参与，现在疫情过去了但是已过期，我看到别的地方都有因疫情延期的情况，希望咨询一下领导能否延迟点驾驶证的学习期，尽快完成驾考！,"[(0, 0.011380708), (1, 0.96510583), (2, 0.011785709), (3, 0.011727743)]",1
房山区良乡镇官道村卡口工作人员及保安态度特别差，对过往人员大喊大叫，大家都知道扫码测温，但是保安仍态度差，及其影响心情，希望政府多加管理，疫情防控都能理解。,"[(0, 0.9657963), (1, 0.011442157), (2, 0.011474212), (3, 0.011287398)]",0
"1:关于2022年国家出台承租国有房屋商铺减免租金的政策，是否广州市都有？
2:我承租的是市资公司的的算不算减免租金范围？
3:如果算，疫情都这么久了一直说没有公文？","[(0, 0.016729573), (1, 0.9509173), (2, 0.01619602), (3, 0.016157087)]",1
2021年底的疫情给西安疫情防控工作敲响了警钟，希望疫情防控常态化，针对不同人群定期核酸，全民核酸常态化，定期2周或一个月核酸检测一次。,"[(0, 0.018533248), (1, 0.017760945), (2, 0.018370494), (3, 0.9453353)]",3
今年四月份的时候因为疫情原因学校停课差不多一个月，然后五一左右我看市教育局和县教育局都发布学校疫情停课期间退学费，我想咨询一下阜南幼儿园学费是否退，如果退大概是什么时候退呢？,"[(0, 0.018022731), (1, 0.8011324), (2, 0.017821629), (3, 0.16302322)]",1
"尊敬的书记
            您好，我是一名来自，嘉定区，南翔镇的一家，酒店企业的员工，因为在疫情之前，辞了职，遇上疫情，现在封闭期间不能走动，被单位经理劝离宿舍，没有地方住，想回家，父母都在北京，想回北京，不让回，宿舍不让住。寻求帮助，怎么样才可以离开上海，回家。
  ","[(0, 0.010900857), (1, 0.010539053), (2, 0.9677498), (3, 0.010810337)]",2
"尊敬的领导：
您好！
我是一名学生，寒假出去江苏昆山打寒假工，现应该返校学习，由于江苏苏州疫情，返回吉水需要7天集中隔离，集中隔离需要自费，本人负担不起，所以希望领导能帮我出个主意。","[(0, 0.0144694), (1, 0.014339672), (2, 0.014439657), (3, 0.9567513)]",3
为有效防止疫情扩散，当前各市都出台了严格的防疫政策，有效守护群众健康。以省内城市为例，要求低风险省内城市来该城市之前提供核酸证明，来之后立即再做一次核酸，市民城市间出行一次即使当天或隔日往返也需做四次核酸检测，成本较大。因此建议能够常态化地根据疫情形势及时调整政策，在疫情形势好转时，两三天内往返两个城市，两地核酸检测可以通用，这样一次往返做一次核酸检测就可以了。为省内城市短途游和省内异地工作生活的人们提供便利。,"[(0, 0.14200471), (2, 0.8411172)]",2
书记您好：我是一名务工人员，长期在多地跑。但是我们天水市的疫情防控部门，现在是只要外省天水，就要隔离，隔离三天食宿自理。我建议低风险查看健康码、24小时核酸、行程码。,"[(0, 0.9601951), (1, 0.013365897), (2, 0.0133640375), (3, 0.013074936)]",0
从去年疫情开始铺面租金不减，月租13000太贵，而且限制卖同类产品，疫情期间关门，影响正常营业，也没有减免，压力太大，麻烦领导反应下，适当的减免，十月份还要涨租，实在难以生活，都是上有老下有小的成成年人，麻烦理解体谅下，现在还在上学也是问题，都直在用花呗了,"[(0, 0.9677659), (1, 0.010654598), (2, 0.010648799), (3, 0.01093071)]",0
我是桐乡市嘉凯纺织服装有限公司法人，公司受疫情影响严重，客户本是3月份开订货会，但是受疫情影响无法开展，导致下单延期，订单量严重缩减，目前经营困难，银行贷款逾期无法归还，资金链断裂！望领导重视小微企业面临的实际困难，能给予帮助！,"[(2, 0.9750997)]",2
福建沿海地区疫情严重，三明内陆虽然平稳，但是流动人口不断穿梭如往，虽然政务各务其职，防控代价需要加强。如红白喜事佛事等没人监管。特别农村麻将馆打牌持属不断，建议发动义工参与，加强娱乐场所管理，对疫情防控有必要加强管理。,"[(3, 0.97256166)]",3
340省道孝义进汾阳的入口板峪段，疫情防控点，两条道排三队车，一个口两个人查行程码，重点是五个人坐在简易房门口聊天，平常上班二十分钟的路程，堵了两个小时，疫情防控不可松懈，但也要注意大家的正常出行,"[(0, 0.010342625), (1, 0.96916646), (2, 0.010271285), (3, 0.010219641)]",1
"我是晋中市榆社县云竹湖景区公司的一名代表，我们是一个景区公司，目标客户来自各地，现云竹镇政府疫情防控办要求是外省返榆人员需提前三天纸质版报备，后方可来榆，但是外省游客并不知晓此信息，造成大量的游客不能来，或者劝返，给景区造成了负担且过于形式化并不能从根本上解决疫情防控。
在此想和政府领导提出以下建议：
1、将纸质版报备改为邮件或者是网上信息报备，由工作人员发给游客，直接在网上填写信息报备，或者工作人员发送邮件至防控办；
2、将提前三天报备调整为提前一天报备。
希望领导能予以帮助。","[(0, 0.9752381)]",0
你好，我是都江堰一名合法经营的商户，在2021年11月成都市部分地区和都江堰市地区突发疫情成为中高风险地区，导致我们租赁都江堰国资商铺的商户发生了经营困难损失惨重，好在成都市国资委下发了中高风险地区减免11月房租的文件，让我们感受到了政府和政策的关怀，然而当我们向当地直管部门满怀期待的提出了申请，却得到了失望的回复，都江堰市不在政策范围内，都是川A难道我们不归成都管，真的很无奈啊！如果领导看到我的留言，希望为我们这些遭受疫情影响的商户争取政策范围的福利，非常感谢！,"[(0, 0.9747541)]",0
疫情期间，柳絮漫天，希望领导能关注到这一块,"[(0, 0.86916256), (1, 0.043193985), (2, 0.044044085), (3, 0.04359936)]",0
我去**城乡店吃饭，发现没有扫码，要求出示健康等信息，外卖人员更是无人检查健康情况，在国家管控疫情，防疫这么严，作为食品餐饮，更应该响应国家规定，还有服务人员不戴口罩，直接点菜上菜等情况,"[(0, 0.010569051), (1, 0.9683822), (2, 0.010617197), (3, 0.010431591)]",1
近一两年的反复疫情，不是我所在的城市有疫情就是老家有疫情，现在我所在的城市还在抗击疫情，驾照考试有效时间马上到期了，老家又不建议我们回去，能不能延长驾照考试有效期？,"[(0, 0.018658934), (1, 0.94315267), (2, 0.018921513), (3, 0.019266907)]",1
尊敬的书记，您好！我是天一国际公馆7号楼的一名居民、近期气温骤降，房子里温度确只有13度左右，给物业、给供热公司都有打过电话，但是结果却令人发指，好像在玩世界杯。疫情怕热，寒冬实在冷，近期疫情，容易感冒，家里人都是在房子里穿羽绒服过冬呢。请求书记为居民做主！,"[(3, 0.9739194)]",3
金城新天地因为疫情多次延期交房，已经影响到我们居住。,"[(0, 0.038064644), (1, 0.8878792), (2, 0.03712013), (3, 0.03693606)]",1
领导好，疫情期间如何买药？请问线上买药怎么办？请完善，谢谢,"[(0, 0.043188408), (1, 0.042769797), (2, 0.8675293), (3, 0.046512567)]",2
位置：上海市普陀区莫干山路120号上海建工 ，我们于2月8号到上海建工工地务工，后因为疫情封控，工地停工两月，两月后给了一个疫情补贴收款确认单给我们签名按手印，这个我们都已经签完了，我们是属于钢筋工，我们6月份签了疫情补贴收款确认单，但这个款一直没到账过，我们是属于钢筋工，请领导实查。今天已经是8月23号了,"[(2, 0.9705826)]",2
大连市甘井子区迎客路7号一品蓝天小区7号楼1-12-*平时上课也就罢了，现在周六周日补课，疫情这么严重，一批一批的学生在家给补课，一起乘坐电梯，多危险。,"[(0, 0.014906442), (1, 0.9552094), (2, 0.014115936), (3, 0.0157683)]",1
东岗路南内环以南烧烤店疫情期间非法聚集影响群众安全。,"[(0, 0.91519606), (1, 0.02815133), (2, 0.028571699), (3, 0.028080877)]",0
本人承租恒鑫商场的房屋，但是商场没有执行疫情期间减免房租政策，阳城县政府为帮助商户最大限度减少疫情影响，共渡难关，根据阳城县工业和信息化局阳工信字【2022】131号文件“关于做好国有房屋租金减免工作的通知”精神，恒鑫商场是属于国有资产，但是目前还未执行，请领导审查一下！ ,"[(0, 0.9728972)]",0
我家住在顺义区牛山镇史家口村，西侧是右堤路，东侧是怀河，由于疫情原因导致许多人不用上班，现在状况是很多人不分昼夜的都聚集到怀河钓鱼，车就停在右堤路上，严重影响了我们的出行和破坏了水源，同时也给我们带来了严重的疫情隐患，希望政府帮忙治理一下,"[(0, 0.97287345)]",0
领导您好！我们是在外地开饭馆，因为受了疫情影响关了三次门最长一次关了三个月，因为是贷款开的饭馆受疫情影响最终导致面临破产，我听说临夏好多地方都已经领到了政府的大力支持和补助，我们前坪村没有任何动向，刚开始要我们的营业执照和所有手续之后就杳无音讯了,"[(0, 0.96817446), (1, 0.010411696), (2, 0.010994581), (3, 0.010419293)]",0
