内容,主题概率,主题类型
文苑公园广场舞噪音扰民，疫情期间不戴口罩聚集，望管理,"[(0, 0.02601323), (1, 0.9226025), (2, 0.025904143), (3, 0.025480175)]",1
领导您好，中考体育在即，国内疫情形势愈发严峻复杂，学生只能戴口罩上课，训练体育，之前因为疫情三月份本该加强训练的时候却封在家中，二十多天没有锻炼。做为家长忧心忡忡，长时间戴口罩训练，会造成肺部损伤，可能会引起肺气肿之类的问题；陕西省人民医院呼吸科主任医师田应选在接受媒体采访时说：戴着口罩剧列运动会增加呼吸阻力.容易造成心脏和大脑损伤，为了孩子们的健康和安全，很多地方今年巳已取消体育考试，希望我市也能尽快取消体育考试，让孩子们回归课堂，安心备考,"[(3, 0.9747963)]",3
"   玉桥西里小区 疫情期间，大量孩童在停车场内玩耍穿梭，不戴口罩，聚集扰民，无人看管。
   遇到车辆不避让，导致多辆车辆不得正常通行，孩子经常从两车之间，来回穿梭飞奔过来，车辆行驶中多次遭到鬼探头，十分危险！
  随意触碰他人车辆，在车上放玩具，自行车靠在汽车上，甚至踢球打闹，对车辆造成磨损，虽无大碍但十分难受而且就算有硬伤也根本找不到人了 ！
  并且 大量孩子聚集 玩闹尖叫 一惊一乍 不佩戴口罩 行办邋遢 无人管教 人心惶惶！
  没有家长陪同也根本找不到家长，疫情防控时期内，十分理解想活动的心理，但是小区内也有活动场所，健身器、公园应有尽有，在停车场，车流量大 盲区多的地方玩耍实在太过危险，这样放养不管对孩子不负责，对业主司机以及其财产更不负责。并且小区里多次有人聚集不戴囗罩在楼下跳操 ，喝酒，烧烤，打牌 大声喧哗，个人认为可以娱乐但别对他人的生活产生影响，但种种行办让人忍无可忍，神经衰弱，提心吊胆，严重影响了我的个人生活，每天回家十分煎熬。
  请相关工作人员监督管理，一定加强疫情防控，关注社区居住环境，管理小区不明文儿童泛滥成灾，无理家长不理不睬，郭视无睹的糟糕态度！","[(2, 0.9745763)]",2
双林街在海天馨苑商业街（渌水道人人乐对面）有很多小黄车，早上供应早点，下午四点到四点半之间，开始准备供应夜宵，绝大部分经营者不带口罩，或象征性带口罩，不遮盖口鼻，社区就在旁边三楼，视而不见，请予以关注，不要产生疫情传播隐患。,"[(2, 0.97409683)]",2
书记您好，我在天益街38号写字楼理想中心上班，此处物业只在个别时间段进行佩戴口罩管理，该物业只做表面功夫，应付检查。时不时拿着鸡毛当令箭阻止个别忘带口罩的市民，偶尔又完全不管。如果可以还是希望他们能认真防疫。防疫人人有责，但不是他们耍官威的地方。,"[(2, 0.9721133)]",2
工农院街19号麻将馆噪声扰民，午休受影响。诉求：1. 很明显是商业运营，有无工商经营资质？2. 要求对广大打麻将的中老年人做好监督，切实降低喧哗声音，尤其是每日12-15时午休时间。3. 公交车地铁上都戴口罩，打牌的人不戴口罩，不利于疫情防控。,"[(1, 0.97492975)]",1
现在深圳在普查大规模核酸检查，排队等待核酸检测的队伍里总有些不自觉的人摘掉口罩抽烟，不仅存在疫情传播风险，而且毒害他人健康，隔着口罩都可以闻到二手烟味，政府是否可以规定深圳的各个核酸检测点禁止抽烟？由专人进行督导，对不停劝阻者进行相应处罚或治安管理处罚？,"[(0, 0.97302747)]",0
"尊敬的领导，您好，

本人系南山区居民，经常在大沙河绿道跑步，近日发现大沙河绿道入口保安开始强制市民戴口罩进入，大沙河属于室外开放场所、空气流通情况极好，不戴口罩亦不违反防疫规定；即便出于防疫谨慎性角度，对普通散步居民尚可建议佩戴（而非强制），对满脸是汗的跑者提出此类要求，既没有意识到汗水打湿口罩会降低防护作用，也没有考虑到戴口罩跑步造成猝死的安全风险，保安此举实为懒政，甚至有故意伤害人民生命安全的意图，我们坚决不能容许纳税人的钱供养此等公职人员，还请领导审查。
此外，大沙河绿道全程仅有直饮水点、无饮品售货机，此时正值夏季酷暑，水分的补充是不足够的，还需要运动饮料及其他冷饮降温。据小范围调查，大沙河绿道的运动人群及散步市民普遍存在此等需求，还请领导考虑推动相关部门落实，为民众办实事。","[(0, 0.9747882)]",0
京*商城购买可**自营店购买口罩80枚，实际收到消毒水。,"[(0, 0.0367452), (1, 0.03803411), (2, 0.036748115), (3, 0.88847256)]",3
津桥街道，五月社区，东边城街128号东侧，废弃口罩,"[(0, 0.026036369), (1, 0.9231928), (2, 0.025497867), (3, 0.025272986)]",1
现在在户外场所游玩（如景区）是否还需要戴口罩？,"[(0, 0.04539768), (1, 0.042801708), (2, 0.8696491), (3, 0.042151485)]",2
因为我是在超过半年，才打完安徽智飞龙科马新冠疫苗第三针。因为接种第二针剂和接种第三针剂间隔时太长。想在贵阳，重新打安徽智飞龙科马三针剂的新冠疫苗。不知道那里可以打。,"[(0, 0.020190623), (1, 0.02011276), (2, 0.9393271), (3, 0.02036945)]",2
锦江春天附近哪里能打新冠疫苗的地方，家里老人未打,"[(0, 0.03392949), (1, 0.03308249), (2, 0.9000693), (3, 0.03291872)]",2
领导你好，我是临济镇黄庙社区居民，因我们这里和名山交界，在开始打新冠疫苗的时候我是在名山打的，打了两次，现说有第三针新冠疫苗了，请问我是到名山打，还是可以在邛崃打，？,"[(0, 0.016372828), (1, 0.9505785), (2, 0.0168091), (3, 0.016239535)]",1
您好，本人在天津已接种三针新冠疫苗，在天津本地健康码津心办有记录，在黑龙江本地健康码没有接种记录，请问如何补录接种记录,"[(0, 0.02113861), (1, 0.021443786), (2, 0.935726), (3, 0.021691686)]",2
尊敬的领导您好:我是乐亭县大相各庄乡一名村民，因为身体生病化疗有副作用需要长期吃药医生不建议接种新冠疫苗，今年身体好转了想接种新冠疫苗，发现我在2021年的时候已经接种了两次疫苗的信息，我根本没有接种，后来一打听说是信息被锁了，我想解开，去别处接种，不知道找哪个部门解决此事，希望领导给解决解决。,"[(0, 0.010240175), (1, 0.96947193), (2, 0.010245502), (3, 0.010042392)]",1
你好，我是孔明街道郭山村村民，家有13岁学生，如果要接种新冠疫苗，可以到哪里接种？需要带什么资料呢？,"[(0, 0.92860425), (1, 0.023747293), (2, 0.02410995), (3, 0.023538478)]",0
我想咨询一下，12-17周岁打新冠疫苗，孩子监护人都不在身边，怎样才能打疫苗呢。,"[(0, 0.028827762), (1, 0.02835445), (2, 0.9144884), (3, 0.028329404)]",2
我是夹关镇拴马村的村民，想咨询一下3岁以上的儿童可以在夹关卫生院接种新冠疫苗吗？,"[(0, 0.025846303), (1, 0.025555914), (2, 0.92288834), (3, 0.025709486)]",2
咨询一下小孩到新都区人民医院老院区（上南街）接种新冠疫苗需要核酸报告嘛，还有周末可不可以接种。,"[(0, 0.93941694), (1, 0.019933354), (2, 0.020470206), (3, 0.020179518)]",0
我是唐山市开平区开平镇欢套村村民，我家里老人想接种新冠疫苗，但是第一针还没打，就被锁定了怎么办？,"[(0, 0.93948835), (1, 0.019688925), (2, 0.020460593), (3, 0.020362142)]",0
本人想咨询一下，我市何时接种第四针新冠疫苗，有没有具体接种新冠疫苗的时间？,"[(0, 0.02940908), (1, 0.03008889), (2, 0.91105795), (3, 0.029444061)]",2
我朋友住在巴城红杨花园，自身免疫力较差，没有接种过新冠疫苗，请问现在哪里可以接种新冠疫苗第一针？,"[(0, 0.02360516), (1, 0.023449717), (2, 0.9294717), (3, 0.023473497)]",2
南关区长春大街春苑小区，由于疫情原因，新冠疫苗停止接种，询问什么时候可以开始打新冠疫苗。,"[(0, 0.9311168), (1, 0.022212384), (2, 0.023437167), (3, 0.023233645)]",0
西咸新区沣东新城在哪可以预约新冠疫苗加强针？,"[(0, 0.04209243), (1, 0.04273455), (2, 0.87311655), (3, 0.04205649)]",2
我在苏州发布上看到，苏州已经开放预约吸入式新冠疫苗了，请问昆山哪里可以预约？去年打的新冠疫苗现在还可以接种吗？,"[(0, 0.023400024), (1, 0.023347763), (2, 0.9279602), (3, 0.025291996)]",2
我在东昌区盛世花都居住，想咨询第三针新冠疫苗到哪里接种，谢谢！,"[(0, 0.023420352), (1, 0.023321185), (2, 0.92982054), (3, 0.023437914)]",2
本人居住在遵化市开元国际，因为怀孕加上哺乳期没有打新冠疫苗，然后最近想去打时候，发现被不知道哪里锁针，第一针第二针居然出现在我怀孕的时候，第三针也已经打了，现在没有地方打针，我声明没有再任何地方登记过新冠疫苗信息，希望领导可以严查这种事情，然后给我解锁，让我去正规地方接种新冠疫苗，谢谢,"[(2, 0.9701409)]",2
您好，书记，我父亲因为身体免疫系统有问题，一直没有接种新冠疫苗，请问我们新密市哪里能开新冠疫苗禁忌证明呢，没有证明在外打工的话，有些地方不让工作，另外目前还能接种第一针疫苗吗？,"[(0, 0.014371075), (1, 0.0144315595), (2, 0.9568399), (3, 0.014357476)]",2
请问什么时候才能去接种新冠疫苗呢？去哪里可以接种新冠疫苗呢？,"[(0, 0.06442218), (1, 0.0641949), (2, 0.8065006), (3, 0.06488231)]",2
我想询问一下接种的新冠疫苗没有接种凭证无法打第二针 怎么去找第一针接种凭证？,"[(0, 0.042807285), (1, 0.043692715), (2, 0.8695524), (3, 0.043947615)]",2
本人张*英还没有接种新冠疫苗第二针，确在2022年7月14日被唐山市路北区石油家园卫生服务站锁针，造成我不能回到老家接种新冠疫苗接种第二针，希望各位领导帮我解决一下，万分感谢,"[(0, 0.95800126), (1, 0.013809877), (2, 0.014162458), (3, 0.014026343)]",0
因为逐渐恢复复工，但是家里亲戚上班的地方要求打新冠疫苗加强针，所以我想请问一下什么时候可以打新冠疫苗加强针，谢谢,"[(0, 0.024135888), (1, 0.023882953), (2, 0.9282181), (3, 0.023763027)]",2
我是八大湖街道辖区居民，去年12月份接种了新冠疫苗第2针，现在可以接种加强针吗？接种后有效果吗？,"[(0, 0.92811006), (1, 0.023928402), (2, 0.024384188), (3, 0.023577387)]",0
您好，咨询一下新冠疫苗接种安排，新冠疫苗加强针（第四针）有没有计划什么开始？大部分人可能都接种了第三针新冠加强针疫苗，就我本人而言，第三针加强针接种完，到现在已经有8个多月了，想知道有没有第四针新冠疫苗的接种计划或者有没有计划什么时候开始接种？,"[(0, 0.019019222), (1, 0.94213814), (2, 0.019516831), (3, 0.0193258)]",1
书记你好:我是四川人居住义庄，我新冠疫苗前面两针在四川打的，现在时间到了，请问第三针现在在哪家医院可以打,"[(0, 0.0172706), (1, 0.017261516), (2, 0.9479384), (3, 0.017529486)]",2
请问一下夹关镇新冠疫苗接种具体点位在哪里？,"[(0, 0.37525195), (1, 0.043821637), (2, 0.53803605), (3, 0.04289033)]",2
请问，郑州可以开不宜接种新冠疫苗的证明吗？那里可以开这个证明？需要什么申报材料？两位老人都有多年沉疴，也是纠结了很久没有打新冠疫苗，希望有医疗机构能够给我们一个权威、清晰的解释，如果二位老人的病情可以接种新冠疫苗，我们还是非常希望接种的。,"[(0, 0.012008674), (1, 0.01198267), (2, 0.012573225), (3, 0.9634354)]",3
现在上海处于抗疫关键时刻，询问在此期间需要打新冠疫苗怎么办？,"[(0, 0.028946431), (1, 0.028805438), (2, 0.9136061), (3, 0.02864204)]",2
尊敬的 领导我是唐山迁西县人，新冠疫苗第三针被锁定，查询无门，人在外地想接种也不可以了！希望领导百忙之中能不能给解锁一下，给您增添麻烦表示歉意。谢谢 ,"[(0, 0.014575431), (1, 0.014285792), (2, 0.9561091), (3, 0.015029722)]",2
您好！我父母于今年1月初在郑东新区白沙镇注射的一针剂的新冠疫苗，一个月前都该注射加强针了，可是两次到可以注射新冠疫苗的社区医院，都没有一针剂的疫苗，社区医院说上面库里面没有一针剂的新冠疫苗，其他两针剂和三针剂的新冠疫苗都有。请您解决一下这个问题。,"[(0, 0.020381037), (1, 0.9376056), (2, 0.020951714), (3, 0.021061622)]",1
我是路北区丽景秦园居民，想了解一下3周半儿童是否可以接种新冠疫苗，在哪里接种还有接种时间？,"[(0, 0.026280722), (1, 0.025692627), (2, 0.02704738), (3, 0.9209793)]",3
尊敬的领导您好：我是一名川籍在中山市小榄镇的农民工，事情是这样的，我的身份证掉了还没有来得及补办，去打新冠新冠要身份证原件或者户口本，户口本的话还需要从老家寄过来很不方便，就是说建议政府能不能现场出示电子身份证就可以打新冠疫苗，因为现在电子身份证和身份证是具备同等法律效力的，而且现在很多地方政府也在推广电子身份证，这样很方便的，谢谢,"[(1, 0.9709393)]",1
我的公司在盐城市开发区，现想向相关部门咨询，盐城市区哪里可以接种北京生物和兰州生物的新冠疫苗，谢谢。,"[(0, 0.018631507), (1, 0.01841177), (2, 0.9445502), (3, 0.01840652)]",2
老人张*，因为中风从未没打新冠疫苗接种，7月5号商洛市商州区东关接种点的人来家里打第一针疫苗接种，家属已经填了接种疫苗知情书，当工作人员输入身份证号码却显示老人2021年9月14日已打新冠疫苗接种，且2021年10月10日已打第二针。请领导给协调解决一下，让老人接种新冠疫苗。,"[(0, 0.9685886), (1, 0.0104267), (2, 0.01060905), (3, 0.010375709)]",0
还有一个多月时间，我市中小学生即将开启愉快的假期生活，请问一下市领导，我市中小学生第三次接种新冠疫苗的时间是什么时候？现目前，我市中小学生已接种两针新冠疫苗，按照国家疫情防控工作的相关要求，我市中小学生需要接种第三针接种新冠疫苗吗？,"[(0, 0.013817798), (1, 0.013747472), (2, 0.95862186), (3, 0.013812892)]",2
北京已经开始为有关人群接种吸入式新冠疫苗，这种疫苗接种方便，请问四川何时开始接种此类吸入式新冠疫苗？,"[(0, 0.028581306), (1, 0.02879083), (2, 0.31286985), (3, 0.629758)]",3
找您反应问题是因为市长热线解决不了，疫情期间，疫苗对八十多岁老人的保护是公认的最有效办法，但是行动不便，卧床不起，常年出不了家门的老人打新冠疫苗就是个难题，急需设置上门服务接种新冠疫苗团队，家中两位老人都需要接种。,"[(0, 0.9674696), (1, 0.01084126), (2, 0.01100964), (3, 0.010679489)]",0
4月28日在南磨房社区心连心广场疫苗接种点接种的新冠疫苗，至今未查询到疫苗接种记录。现在幼儿园，急需这个记录，请尽快更新一下。,"[(0, 0.021755047), (1, 0.5991776), (2, 0.3563284), (3, 0.022738967)]",1
请问一下目前天津市可以为3周岁以上儿童接种新冠疫苗的接种地点和预约联系方式。我们住在河北区建昌道街道。河北区这边社区医院目前不给3周岁的儿童接种新冠疫苗。,"[(0, 0.017411545), (1, 0.017712068), (2, 0.947278), (3, 0.017598338)]",2
尊敬的领导您好，我在南京接种了新冠疫苗的第一针和第二针，现在在外地居住，这边要打加强针，但需要知道第一二针的批号，别的省市在支付宝健康码页面就可以查到自己接种的疫苗批号，而南京市健康码页面只能查到接种一二针的日期和名称，具体批号没有，请问我应该从哪查？,"[(0, 0.012860377), (1, 0.013247293), (2, 0.9611037), (3, 0.012788629)]",2
如题，想咨询一下，胶州周末哪里能接种新冠疫苗？平时工作不方便接种。,"[(0, 0.029152658), (1, 0.028745096), (2, 0.913778), (3, 0.0283242)]",2
"书记，你好：
      我爱人郭**。2022年7月15日在麦积区中医院核酸检测点进行核酸检测，结果阴性。随后在同时间段核酸检测人员中发现新冠确诊人员。于是，她于2022年7月19日被天水市麦积区疾控中心判定为新冠密接者，并于当天在麦积区赛莱顿酒店隔离点隔离。
      我现在有几个问题需要咨询：
      1.甘肃省新冠密接者在疫情隔离期间食宿费用是政府承担还是个人自理？政府相关文件能否予以公示？
      2.如果隔离期间费用个人自理，对家庭生活困难人员政府是否有补贴政策？如有，如何办理？","[(1, 0.97439003)]",1
"尊敬的领导您好，我在太仓接种了新冠疫苗的第二针，现在在外地居住，这边要打加强针，但需要知道第二针的批号，别的省市在支付宝健康码页面就可以查到自己接种的疫苗批号，而苏州市健康码页面只能查到接种第二针的日期和名称，具体批号没有，请问我应该从哪查？急！万分感谢

","[(0, 0.013563183), (1, 0.20018972), (2, 0.77276987), (3, 0.013477208)]",2
现在南关区具体哪个社区卫生服务中心可以打新冠第三针疫苗,"[(0, 0.037558954), (1, 0.036655314), (2, 0.8883776), (3, 0.037408117)]",2
尊敬的武书记，我是唐山开平区人，新冠疫苗第三针被锁定，查询无门，想接种也不可以了！希望领导百忙之中能不能给解锁一下，给您增添麻烦表示歉意。谢谢！,"[(0, 0.014812454), (1, 0.014364746), (2, 0.01503211), (3, 0.9557907)]",3
尊敬的领导您好，我在常熟接种了新冠疫苗的第一针第二针，现在在外地居住，这边要打加强针，但需要知道第一针第二针的批号，别的省市在支付宝健康码页面就可以查到自己接种的疫苗批号，而苏州市健康码页面只能查到接种第一针第二针的日期和名称，具体批号没有，请问我应该从哪查？能否告知批号。急！万分感谢 ！,"[(0, 0.012265138), (1, 0.012595633), (2, 0.9629621), (3, 0.01217714)]",2
长效防控新冠，应创新机制，人口密集地区，应定期随机进行新冠抽检测。及早发现，变被动为主动寻找，及大节约成本，防止了疲于奔命。,"[(0, 0.963213), (1, 0.012330453), (2, 0.012149377), (3, 0.012307137)]",0
书记你好!本人新冠疫苗只打了两针。2022-7-19本想去打第三针疫苗。却发现自己的后台显示第三针已经打了。是在7-18打的。经查询发现是开平办卫生服务社区中心锁针了。希望领导调查。,"[(0, 0.013076517), (1, 0.013080765), (2, 0.013441408), (3, 0.9604013)]",3
尊敬的领导，我是锦江区一名市民，个人有新冠基础疾病，请问领导如何带相关病史资料，去何医疗机构开具证明，谢谢,"[(0, 0.9469171), (1, 0.017462747), (2, 0.018244976), (3, 0.017375192)]",0
尊敬的省领导，您好，由于工作原因我于2021年在河南郑州接种了三针新冠疫苗，现已回到黑龙江省牡丹江市家里，经常出示健康码时候被问怎么不打疫苗一事，有时候还解释不清楚，很是苦恼。多方询问无果，请领导给与帮助，帮我把接种新冠疫苗信息补登一下。谢谢。,"[(3, 0.97077835)]",3
我在陕西接种新冠疫苗两针，但是国家政务平台显示错误只有一针且日期也不对，导致我在省外也显示错误无法打第三针，打了各种电话都无法解决，陕西卫健委也打不进去，求重新上传一下我的疫苗信息到国家平台,"[(0, 0.012453555), (1, 0.012557094), (2, 0.9626209), (3, 0.012368406)]",2
你好，外地人在哈尔滨市双城区打的第二针新冠疫苗，现在接种第三针，需要第二针疫苗批号，龙江健康码查询不到批号，社区卫生服务中心无人接听，现在很着急，谁知道怎么查询到，外省的健康码小程序都能查到，唯独龙江健康码查不到,"[(0, 0.010455582), (1, 0.0103052715), (2, 0.010734354), (3, 0.9685048)]",3
"领导你好，我是朝阳社区8组村民，家里面有一个初三的学生，前两天进行了肺结核的检查，并注射了预防针，现在想打新冠疫苗，需要注意哪些方面。
","[(0, 0.017371641), (1, 0.017344194), (2, 0.9478039), (3, 0.017480262)]",2
现绿园区绿园新区1－1栋四单元五楼新冠阳性病人在家俩人，希望能得到急时救助,"[(0, 0.021733852), (1, 0.021356098), (2, 0.93543124), (3, 0.021478787)]",2
"书记您好，百忙之中打扰您，只因本人遇到了自己无法解决的难题，向您求助。

我女儿于2021年8月14日在化二建医院接种第一针新冠疫苗，2021年9月21日早晨在化工医院接种了第二针新冠疫苗。她于2022年3月30日无意中发现场所码上只显示了第一针的记录，没有显示第二针记录，但孩子的接种本上手写过两次接种新冠的记录。

当时接种后有看到医生在电脑上登记，由此，我推断负责接种的医生没有上传我的接种记录。

此事给孩子打加强针造成了困扰，希望能帮忙解决这个问题。","[(0, 0.97451967)]",0
书记你好!本人新冠疫苗只打了两针。2022-7-15本想去打第三针疫苗。却发现自己的后台显示第三针已经打了。也是7-15打的。经查询发现是开平办卫生服务社区中心锁针了。,"[(0, 0.014522403), (1, 0.014520102), (2, 0.01484286), (3, 0.95611465)]",3
本人2022年7月12日新冠疫苗被路南区马家屯社区在本人不知情的情况下私自锁针，找社区半个月没有一个人管这件事，疫苗被锁加强针不能打身体健康出现问题怎么解决。,"[(0, 0.017312236), (1, 0.01797002), (2, 0.94756275), (3, 0.017154986)]",2
你好领导，我是沈阳人在三亚吉阳区田独卫生院打了新冠疫苗第三针，但是一直查不到打疫苗的信息，我现在人回沈阳了，给三亚卫生院打了无数次电话也没有人接，请领导帮忙,"[(0, 0.015264805), (1, 0.01508474), (2, 0.95427734), (3, 0.0153730735)]",2
孩子现在三周岁要上幼儿园了，体质较差，经常发烧感冒，请问这种情况是否能接种新冠疫苗？,"[(0, 0.02166128), (1, 0.02160655), (2, 0.9352362), (3, 0.021496003)]",2
本人在路北区梧桐社区打的前两针新冠疫苗，由于本人户籍在开平，导致加强针信息被锁，麻烦尽快处理，万分感谢,"[(0, 0.020306325), (1, 0.020146778), (2, 0.9384093), (3, 0.02113759)]",2
我于2022年6月24日，以暑假工身份入职新冠鞋厂印刷工，并且于2022年8月10日离职。到目前为止我以离职十六日，但是我的工资却被新冠鞋厂的厂长压着工资不发，他们以公司的规定大于一切为由，将我的大部分工资压到九月底再发，而我工作这么久也仅仅拿到六百元的工资，其余工资均被压着不发，而我本人即将在九月初入学，目前学校已经在收取学费，而我的工资被压着不发，拿不到工资就交不了学费，我的家庭十分困难，而厂里面还不发工资,"[(0, 0.9747757)]",0
请问抚州市区除了第一人民医院之外，还有哪里可以给幼儿园小朋友打新冠疫苗?,"[(0, 0.026242051), (1, 0.5444211), (2, 0.4034241), (3, 0.025912771)]",1
本人新冠前两针在唐山市玉田县县医院接种，于今年4月份回到保定，疫苗信息上显示于2022.6.29注射第三针加强针疫苗，经查询是唐山市玉田县中医院录入信息有误，多次联系当地防控办未得到解决，本人的诉求是删除本人第三针加强针的相关信息。,"[(0, 0.96804106), (1, 0.010386083), (2, 0.010958094), (3, 0.010614726)]",0
尊敬的书记，现在我市新冠疫苗接种加强针正在如火如荼地进行，但是很多人出于各种各样的原因还没有接种。我有一个不成熟的想法，能否运用一些激励手段，比如对在我市接种新冠疫苗的，给予一定的电子消费券，（可以定向到餐饮等受疫情影响较大的行业），这样可能会激发一些人去接种疫苗，也可以一定程度上刺激一下餐饮行业。,"[(0, 0.9689982), (1, 0.010239175), (2, 0.010441671), (3, 0.010320929)]",0
我是金山村2组村民我家婆婆九十三了行动不便，现在想接种新冠疫苗，建议上门接种。,"[(0, 0.022241239), (1, 0.9334354), (2, 0.022490911), (3, 0.02183242)]",1
领导你好！我是去年打过新冠疫苗第二针的，请问什么时候能打第三针，哪里可以打？需要带些什么？,"[(0, 0.03228749), (1, 0.032151897), (2, 0.9026574), (3, 0.03290321)]",2
最近看到上海，南京多地已经开展吸入式新冠疫苗接种，请问南昌有没有开展这种疫苗计划，何时可以预约？,"[(0, 0.021666223), (1, 0.021706592), (2, 0.37517262), (3, 0.5814546)]",3
我去年在海淀区甘家口接种新冠疫苗（康希诺）一针剂，现在在朝阳区金盏乡金盏西村居住，今天去金盏乡卫生院咨询，说让找村委会，去村里问了几个人，，都不知道，，我现在咋办，，,"[(0, 0.7364199), (1, 0.014422701), (2, 0.23466186), (3, 0.014495505)]",0
