内容,主题概率,主题类型
希望加大槐荫区西市场街道北大槐树家园北区电梯消毒频率，减少病毒传染风险。,"[(0, 0.015343049), (1, 0.9535479), (2, 0.015434138), (3, 0.015674908)]",1
"首先感谢疫情期间各级同志们辛苦的付出，你们的责任感和关心百姓看得到。
随着疫情的发展，病毒的病理本身也在发生变化。但除了防疫政策和现状数据的发布，对病毒本身科学的原理，毒性发展，目前致病性数据，百姓关心的如果阳性该以什么样的科学方法及理性心态去应对却教育的非常少，知识普及的非常少。
信息同步，科学应对，除了听政府的，也要懂原理，有对病毒理性的认知。
希望发挥我省我市所有官方媒体，专业媒体，大咖专家优势，将知识普及下去，大家明白了，理解了，也就放松了，听话了，接受了，心态好免疫力高了，防治更有信心了！
希望予以重视并真的去实施。感谢！","[(1, 0.97492063)]",1
朝阳区华威北里10号楼南侧，11号楼北侧绿地内，长期存在垃圾堆放问题，不仅影响城市环境，在疫情当下，更有可能滋生细菌病毒，希望相关部门认真处理，及时清理，并建立机制杜绝再次发生，死灰复燃。,"[(0, 0.010554191), (1, 0.01045633), (2, 0.010367633), (3, 0.96862185)]",3
尊敬的领导您好，我所住的小区，11号楼与10号楼之间有两个垃圾箱，原来是放在两个楼之间停车场那一侧的，不知道什么时候移动到小花园这边了。每天凌晨环卫单位清理垃圾的时候，我家都会产生垃圾的臭味，不知道其中是否有细菌，病毒。我家有一个刚出生的小婴儿。肺炎刚治愈刚出院，现在体温还是反复。恳请领导关怀，将这两个垃圾箱移动回原来的位置，不要放在我家楼下。万分感谢。,"[(1, 0.3699399), (3, 0.6127373)]",3
大连开发区旭辉公元与新青年汇交界处应该是一个美好环境。奈何不知道哪个部门不作为还是……卫生防疫做的相当不好。周围已经有人因为这样的环境生病了。希望领导重视，提上日程，让市民看到结果，没有消息只能往上面继续找。,"[(0, 0.96479475), (1, 0.011693019), (2, 0.01169792), (3, 0.011814354)]",0
"目前施家乐小区垃圾泛滥，持续已经半个多月，夏天来临，天气高温以及雨水发酵，目前已滋生了很多蚊虫、老鼠，恶臭难闻，可能会产生大量病毒，危害武陵源的生态环境以及大家的身体健康！在这样的恶臭下，老百姓如何生活呢？？吃饭的时候都不一定吃得下去！希望相关领导干部能出面解决一下！！给老百姓一个健康、干净的生活环境！感谢！

同时垃圾成堆这个事情！每年都要上演这么几出，至于是什么原因出现这类情况，作为老百姓也很疑惑，我们每年的物业费用、停车费用都是按时上交，小区还有额外收取的广告费用，难道这些还不能让物业正常运转吗？？小区财务管理到底是什么情况？我们从不得知！","[(1, 0.9746805)]",1
尊敬的领导您好，我系肾移植患者之一，咱们海南省这边的移植特殊门诊的额度只有4500。完全不够复查+抗排斥药+辅助药的！常规的复查药物浓度和彩超以及三个月一测的巨细胞病毒+jcv病毒+bk病毒检测等等。基本医疗得不到保障！对于我们这些没有收入的患者来说是雪上加霜。恳请领导帮帮我们这个急需帮助的群体吧。,"[(2, 0.97339576)]",2
4月29日，河南省医疗保障局等六部门联合印发《关于进一步降低新型冠状病毒核酸检测项目价格的通知》（豫医保办〔2022〕15号），明确自2022年5月1日起，新型冠状病毒核酸检测标本单采项目价格由18元/人次下调至14元/人次（不含核酸检测扩增试剂），新型冠状病毒核酸检测标本混采项目价格由8元/人次下调至4元/人次（含相关试剂及耗材）。然而河科大第五附属医院核酸单采费用却23.1。希望有关部门予以调整！,"[(1, 0.9748185)]",1
请问北京防疫政策中“14日内有1例以上(含1例)本土新冠病毒感染者所在县(市、区、旗)旅居史人员严格限制进(返)京”中的县(市、区、旗)是如何界定，同一城市的其他区域有本土新冠病毒感染者，影响邻区人员的进京吗？肿瘤病人手术有特殊政策吗，谢谢,"[(0, 0.010323734), (1, 0.010853156), (2, 0.96862656), (3, 0.010196568)]",2
目前，新冠疫情形势严峻，部分地区出现感染奥米克戎变异病毒，云南省考即将于3月26日举行，时间紧，今年达到30多万人的报考人数，人员之间流动较大，存在不可预知风险，即使做了核酸检测由于病毒存在潜伏期也可能存在无症状感染者，建议公务员考试时间延后以免给疫情防控带来压力,"[(2, 0.9735622)]",2
尊敬的书记先生，本人于今年7月24日在临汾市尧都区建设街564号**宠屋购买一只宠物狗，买下时商家承诺宠物健康无疾病且已接种一针疫苗。在交付时末能提供该狗的健康证明及疫苗接种证明。7月28日发现宠物狗有拉稀行为，并开始轻微呕吐。询问商家商家说吃坏肚子需喂益生菌7月29日上午见宠物狗病情未见好转，带狗去宠物医院诊疗，检测出细小病毒和犬冠病毒，了解过程中这两类病毒具有潜伏期。医生告知原告该治愈率极低并且治疗费用高昂。随即找到商家商家不予理睬，请问宠物这种问题该向哪个部门反映并且能合理解决问题。,"[(1, 0.97464615)]",1
应该全市消毒，舒兰前年新冠全市消毒，马路、小区、下水、全消毒，把病毒灭杀在空气中。,"[(0, 0.92848754), (1, 0.023988353), (2, 0.023766363), (3, 0.023757733)]",0
"城市的公共卫生间 有很常见现象 有使用者有使用后不冲水 或者 不及时冲水情况，这首先是污染了公共卫生间的环境和空气影响了市容市貌，同时，人的排泄物暴露在空气中长时间 就会形成病毒的气溶胶传播，同时因为公共卫生间又是 大量人员日常都会接触的空间，这样就会 产生传播病毒的隐患，交叉裂变传染。 

  建议改进改造 公共卫生间 蹲坑 的冲水 按键在人的正前方手可以触及的范围 现在大多数一般是在人身后 用脚踩才可以，同时配合宣传教育 让大家养成 排便立即冲水的习惯，这样一方面可以提高大家生活环境的质量，又可以对防治疫情有一定积极的效果，同时针对男厕所小便池异味现象 希望要求保洁人员每天用 84消毒液冲洗消除，可以解决问题","[(0, 0.97464484)]",0
民生路22号民香小区正门民生东五道街遗留下大批香坊区供水公司施工后的垃圾，沙子混凝土乱七八糟的，跟冰雪混合后都是泥巴了，遗留的沙子混合着泥土，占据了大部分小区的走路地面，已经一年了不清理，现在冰雪融化搞的很脏，一摊摊的造成病毒细菌大量繁殖，尤其现在防疫形势严峻，这种情况更加剧病毒的滋生，极大的危害防疫,"[(3, 0.97511804)]",3
"战胜新冠肺炎我的几点建议
——新冠肺炎传播途经的几点分析：
切断传播途经是控制传染病的一个有效办法，传播途经分很多种，呼吸道疾病的传播途经以空气传播为主要途经，但是间接传播也是不可忽视的途经，我们从各视角来分析一下：
一，空气里带病毒的颗粒与气溶胶直接传播大家比较理解，用的方法也知道用佩戴口罩来预防。
二，间接传播的路经：病人或无症状感染者的呼吸、咳嗽、打喷嚏、鼻涕、痰液等病源物直接排放在空气或地面及一些物品表面，排放在空气里的这些病毒源也与空气里的水分结合慢慢沉降于地面或物品表面；这些病源体在空中的停留时间长短与空气的湿度有关，冬天空气干燥没有水分与这些病源体结合，这些病源体在空气中漂浮时间就越久，空气传播的概率就越高。到春夏天空气湿度高，这些病源体的颗粒与气溶胶很快与空气中的水分结合，自身重量增加而下沉下来，春夏天多雨季节，雨水也清洁空气里的颗粒下沉至地面并冲走。
三，我的几点建议：
1，增加空气湿度是预防呼吸道传染病的一个有效办法，我们可以利用高层建筑物进行雾化空气，对高危病区进行全天候加湿及地面进行定期冲洗。有必要的时候进行人工降雨工程。
2，佩戴面罩：佩戴口罩手容易接触到鼻口三区，鼻口三角区是呼吸道传染病桥头堡，使用佩戴面罩有效控制手接触到鼻口三角区，佩戴有效过虑功能的面罩同样有效阻止病毒进入呼吸道。
3，佩戴手套：手是间接传播的唯一“桥梁”，佩戴手套能阻止病毒直接污染手部。
4，穿鞋套：我们为控制传染病进行全面的核酸检测，全部人员都要排队隔间一二米距离，但带病毒的人鞋底也带着病毒，因为他家里地面的病毒通过鞋底可以带到外面地面，鞋底是人体接触地面的唯一接触点，地面上的病源体经鞋底到处污染，特别污染到家里，场所。建议出门用鞋套，回家把鞋套集中在一个密封箱里统一处理。
传染病可怕，但科学地了解病毒的传染途经后解决起来也容易，我相信在我们党的领导下，最难的问题都可以解决，加油！","[(2, 0.9749034)]",2
本人生孩子检查出丙肝病毒携带者，请问在哪里可以买到吉三代，可以报销吗,"[(0, 0.9279245), (1, 0.0237677), (2, 0.0249644), (3, 0.023343377)]",0
想问一下第一针打的康希诺生物的腺病毒疫苗，加强针应该去哪打？,"[(0, 0.036420383), (1, 0.036847387), (2, 0.89054304), (3, 0.036189176)]",2
        尊敬的领导你好，我是一名乙肝患者，最近两年都在华西医院定期随访检查，看病，拿药，治疗，并在华西办了特殊病门诊，今日惊闻四川大学华西医院乙肝传染科特殊疾病门诊，自2022年12月3日下午起不能再开乙肝抗病毒的药物，韦立得 富马酸丙酚替诺福韦片；之前都是可以正常的开方拿药，乙肝抗病毒治疗不能停药，停药病毒就要反弹不受控制，之前去医院看病医生建议换成这款药，才过了几个月现在这药医院又不给开，请领导们听取广发患者的心声，帮忙处理一下这个问题。,"[(1, 0.9750429)]",1
目前嘉峪关各小区实行防疫政策非本小区车辆不允许进入，小区多个出入口封闭，仅留存一个集中出入。但是，只不让外小区车进，人可以随便进不需要任何查验证明。请问，1.是车有病毒还是人有病毒？2.这样的防疫政策导致上下班时间人车集中，严重拥堵，不知道起到了什么防疫作用！3.小区出口集中管理却不管进出的人，不知道这样的防疫政策作用何在？,"[(1, 0.9748613)]",1
路南区新华联广场物业以疫情垃圾停运为由，导致小区院内垃圾堆积，易造成病毒传染。,"[(0, 0.02003293), (1, 0.94009846), (2, 0.01979857), (3, 0.020070083)]",1
我母亲患有乙肝长期吃抗病毒药，请问相关领导需要什么样的证明？可以申办到慢性病证明,"[(0, 0.02359776), (1, 0.92943615), (2, 0.023794554), (3, 0.023171518)]",1
本应种花种草的地方被人种了菜，还浇粪又是夏天非常的臭，病毒传播途径又多了一个呢,"[(0, 0.029065916), (1, 0.02890406), (2, 0.030187806), (3, 0.9118422)]",3
大东区小北街37-1号院内垃圾点位清运不及时，导致垃圾外溢，存在病毒传播风险，请社区协调尽快处理。,"[(0, 0.020816103), (1, 0.9396085), (2, 0.019561864), (3, 0.020013535)]",1
大东区八王寺小区，园区内的垃圾点位清理不及时导致垃圾外溢，存在病毒传播风险，请社区协调尽快处理。,"[(0, 0.018999282), (1, 0.94377697), (2, 0.018405981), (3, 0.018817801)]",1
疫情峰值期间，鹿山小区的业主都在家里抗病毒，结果没叫疫情引起发烧，让暖气折腾给冻感冒发烧了。,"[(0, 0.022580389), (1, 0.93304175), (2, 0.022903323), (3, 0.021474503)]",1
"咨询我在浙江省台州市临海市涌泉镇涌泉中心卫生院何时能接种新冠疫苗第三针加强针？
出生日期2005-02-08,性别男,接种单位涌泉中心卫生院已接种针数2针,第2针疫苗名称新型冠状病毒灭活疫苗（Vero细胞）生产企业名称北京科兴中维，接种时间2021-09-16,第1针疫苗名称新型冠状病毒灭活疫苗（Vero细胞）生产企业名称北京科兴中维，接种时间2021-08-25","[(0, 0.97195596)]",0
慢性病补助都有哪些疾病？乙肝在慢性病补助范围吗？乙肝抗病毒治疗期间可以申请慢性病补助吗？,"[(0, 0.03389866), (1, 0.9028102), (2, 0.03185701), (3, 0.0314341)]",1
领导您好，请问太原市会引进康希诺腺病毒疫苗吗？如果引进了可以在哪个渠道得知去具体哪个社区接种呢？,"[(0, 0.023345547), (1, 0.02353671), (2, 0.92923826), (3, 0.0238795)]",2
摆放距离房子过近，家里经常闻到一阵阵臭味，蚊虫肆虐病毒滋生，严重影响生活望有关部门领导帮助,"[(0, 0.9512481), (1, 0.016295116), (2, 0.015964555), (3, 0.016492218)]",0
"本人于9.28在西安市雁塔区雁塔区丈八东路榕青无界6A1幢101xx商铺     西安哆xx宠物零售有限公司 购买了小狗一只  当天拿回家就出现拉肚子情况  销售售前说这种可能是应急反应  直到10.2号小狗还在拉肚子  就去附近医院检查    检查出来已经患上细小病毒多天    并且这个病毒有7天潜伏期  也就是说 发病前就已经得了这个病 本人才购买第三天 也就是购买前狗狗就带病毒了  前往售卖店铺协商   老板不与协商 
我最后让他们出示相关证件  目前具备合法的营业证件  他们只有营业执照   相关《养殖卫生许可证》《员工健康证》《犬只疫苗证明》他们都拿不出来
最后他们不给发票，正规企业 应该缴纳相应税费 ，但是我询问相关发票，尽然答复是 我们没有发票   不给开具发票 。
","[(3, 0.97476196)]",3
"尊敬的领导，您好！
本人由于咽反射过于敏感，以及过往个人经历导致的心理问题等原因，对于核酸检测咽拭子采样存在恐惧心理而无法很好的完成配合。
疫情之前两年一直在外省，当地社区为有类似困难的小部分人提供了其他替代的采样方式。
不知道我市是否也能有类似的人文关怀？
在全员采样的过程中由此产生的额外支出愿意个人承担，非常感谢！","[(2, 0.973781)]",2
大东区联合路1-2号院，车库旁边的垃圾点位清理不及时导致垃圾外溢，存在病毒传播风险，请社区协调尽快处理。,"[(0, 0.946768), (1, 0.018288655), (2, 0.017187942), (3, 0.017755412)]",0
"目前疫情已经常态化，但奥体中心篮球馆一直没有对外营业
希望能够协调尽早对市民开放，强身健体，抵抗病毒 ","[(0, 0.020559106), (1, 0.019988555), (2, 0.020447003), (3, 0.9390053)]",3
由于当前新冠病毒的严重性，避免交叉感染，建议做核酸真正做到不聚集，到百姓家门口做，这样最安全,"[(0, 0.91198343), (1, 0.029156974), (2, 0.030284569), (3, 0.028575018)]",0
这次疫情特别突出了病毒的强传播能力！尤其是在城关区的疫情发生情况尤为突出！与城关区的公共出行方式有一定的关系！只有城关区严禁动力共享单车投放，而七里河，安宁，西固都可以使用动力共享单车，而避免了乘坐人员拥挤的公交和地铁的乘坐风险！单人快速便捷的动力共享单车的使用对聚集性病毒的传播有一定的抑制作用！所以希望城关区也能够放开动力共享单车的投放使用,"[(2, 0.9746279)]",2
尊敬的领导您好，我投诉沈阳市皇姑区宁山中路18-1号院内有一辆归属北塔街道的环卫垃圾车把外面清扫来的垃圾运进小区院内进行分拣，把可回收纸壳废纸等废品存放在小区车棚中，不仅有极大的火灾隐患。还把垃圾车停放在院内，小区地面被租户弄的脏乱不堪，垃圾车内臭水直流，天热了满小区都是垃圾腐臭味，垃圾中含有大量细菌病毒通过空气传播。影响其他居民的健康，更有感染新冠病毒的危险。,"[(0, 0.9750241)]",0
大东区北顺城路144-1号院，车库旁边的垃圾点位清理不及时导致垃圾外溢，存在病毒传播风险，请社区协调尽快处理。,"[(0, 0.9503591), (1, 0.017053466), (2, 0.015994491), (3, 0.016592901)]",0
"因为遇到以下问题实在无助才求助，提交了相城区12315以及打咨询电话暂无回应：8.22日在相城区澄虹路9号1**室银鱼宠舍购买宠物 在一开始购买时卖家告知宠物已经打全疫苗没有健康问题但并未提供疫苗本或者宠物健康检测证明，中间出现一些咳嗽眼部分泌物多的情况 询问后卖家告诉我是由于品种等原因出现的正常现象，后来两次小狗突发抽搐身体僵直时候还在告诉我不用担心正常现象，听取卖家建议采取喂糖水措施不见小狗好转去了医院，检测结果也表明小狗多处出现问题，切携带潜在病毒 而之前我询问的症状也是炎症的表现，而卖家还在说没有事，现已把狗归还卖家但卖家不退款 
 卖家行为侵犯了消费者的知情权，将带有细小病毒，以及冠状病毒，体检不合格的小狗卖给我， 要求退款并赔偿小狗治疗费用 如能提供帮助，将十分感谢","[(0, 0.97462976)]",0
慢性病人自选的两个医院药物不稳定，经常碰到药吃完了，去拿药，医院药卖完了，要等一段时间，才能拿到，病毒性肝炎的丙酚替诺福韦抗病毒药物，又不能停药，服用的中成药鳖甲软肝片只有阜阳五院有，也是经常拿不到，大多数都自费到合肥买，回来报销的政策又低，想问领导，能不能让慎城镇卫生院进这两个药，或者是颖上县中医院稳定这两个药的供需，谢谢,"[(2, 0.97469604)]",2
大亚湾碧桂园星悦每一层楼道窗户全部封死，窗户无法打开通风，导致楼道有刺鼻异味而无法散去，甚至随业主回家开门进入屋内，现防疫工作仍是社会上的头等大事，而开窗通风仍是抵抗病毒保护公共卫生安全的有效方式，星悦这种不通风的密闭窗户将造成极大的病毒传播风险。为降低新冠肺炎等传染病的传播风险保卫小区业主健康。另外如不幸发生火灾，不能及时排烟通风，也存在消防隐患问题。希望领导有空能协调主管部门督促开发商及时整改,"[(2, 0.97346187)]",2
建议在省、市交界的所有道路、车站、机场设置临时隔离检查点，对来往人员的双码、核酸报告、行程做主动问询，对符合防疫政策流动的人员就地进行落地检测后就地临时隔离，待就地核酸结果正常后方可正常流动(疫情区旅居史和非疫情区旅居史人员分开隔离)。当然，在此期间需要做好人员间距、口罩佩戴、病毒消杀，避免检测期间、休息期间病毒传染。对不符合流动的人员可直接按防疫要求处理。如此可以避免发生该报备不报备、该隔离不隔离的问题。,"[(0, 0.9747636)]",0
"尊敬的区领导：
您好！当前我区有部分地区流浪狗泛滥，存在诸多社会安全问题。1.流浪狗可能携带狂犬病毒，危及人民群众生命安全。2.流浪狗可能大量繁殖，造成本地区流浪狗泛滥成灾，成群结队破坏公共设施、传播各类病毒。3.流浪狗可能嚎叫扰民，半夜影响人民群众正常休息。
希望区领导、有关部门合理解决掉城区内流浪狗问题，为人民群众办实事、办好事，提高人民群众生活的幸福感。","[(0, 0.9750293)]",0
诚挚建议，现在这段时间期间，暂停西安机动车限行，提倡自驾车通勤，减轻公共交通防疫压力，有效减少病毒感染，减轻政府和社会防疫救助压力！,"[(0, 0.9615987), (1, 0.012824415), (2, 0.0127962185), (3, 0.012780684)]",0
郑庄子大街92号8号楼前垃圾桶离一楼居民家窗户太近，夏天味道难闻，滋生蚊蝇，居民害怕有病毒传染。希望重新规划垃圾桶摆放位置。,"[(0, 0.012544997), (1, 0.0124358665), (2, 0.012420597), (3, 0.96259856)]",3
核酸检测便民服务点人太多，排队一小时也做不上，这样聚集的人太多，更加有感染病毒的风险，请领导给解决一下，谢谢,"[(0, 0.94810325), (1, 0.0172906), (2, 0.017521044), (3, 0.017085081)]",0
我是在昌图县（没有新冠病毒感染者的地区）工作的长春人，想咨询一下最新的防疫政策，我返回长春前需要做哪些准备？,"[(0, 0.022782473), (1, 0.93385273), (2, 0.021894075), (3, 0.021470703)]",1
现在保定市人民医院不开门接诊，我已经好几个月没有诊断了，正在进行抗病毒治疗，药不能停，望领导对医院正常接诊做安排。,"[(0, 0.023158291), (1, 0.92940027), (2, 0.023837686), (3, 0.023603695)]",1
"我去这个医院给猫检查，检查完说的猫得了冠状病毒需要打针。因为我不懂这个，回家百度了一下，说是看冠状病毒的试纸上有两道杠才是阳性，可是我的试纸上只有一道杠。本来想着问清楚点自己放心，就把照片发给这个医院的医生帮我确定一下，然后他非说的确是两道杠。我不太相信他，就在网上花钱找了好几个宠物医生看了一下，网上的宠物医生都是只看照片的确只有一道杠。
最后我把别的医生说的内容发给他看，他就各种狡辩，推托","[(0, 0.010077812), (1, 0.010105532), (2, 0.010232584), (3, 0.96958405)]",3
"领导您好：根据国家、省、市各级文件，序贯接种新冠疫苗第三针已经开放，允许前两针打灭活疫苗前提下，第三针打安徽智飞重组蛋白或康希诺腺病毒。
本人前两针为科兴灭活疫苗，第三针希望打康希诺腺病毒疫苗。但雨花亭街道卫生服务中心接种人员只允许接种同类型灭活疫苗。经12345市长热线反馈，左家塘工作人员回复我两针灭活的加强针序贯接种只能打安徽智飞，不允许打康希诺，请问哪里可以打康希诺？","[(1, 0.9743072)]",1
做核酸人太多，排队时间过长，希望增加检测点数量,"[(0, 0.92256063), (1, 0.02604474), (2, 0.025662582), (3, 0.025732102)]",0
"三水区是否有流感疫苗接种，听说今年的疫苗抗原成分包含针对流感病毒流行株，请问如何预约打？在那里预约？多少钱一针，打多少针？
","[(0, 0.018043436), (1, 0.018297754), (2, 0.94556004), (3, 0.018098745)]",2
323楼3单元有业主养鸡，一年有余，经常带鸡在小区四处走动，禽流感隐患和鸡粪病毒传播。物业表示没见过，也不能定位具体单元户，所以管不了。,"[(0, 0.01444682), (1, 0.014484358), (2, 0.014311601), (3, 0.9567572)]",3
"领导您好，现在小区垃圾肆意堆放，无人管理清理。给居民带来很严重的生活困扰。
恰逢沈阳疫情防控重要阶段，如垃圾堆放会产生细菌，病毒滋生。责任谁来负责。","[(0, 0.9633837), (1, 0.012531603), (2, 0.012031821), (3, 0.01205287)]",0
严重扰民，噪音太大，灰尘太大，病毒大，家人孩子出现感冒，喉咙疼，物业不管，公共场地，物业不该占用。这种有污染的，应该处理到该处理的点去弄，他们这样完全不合理！,"[(0, 0.0176166), (1, 0.9472643), (2, 0.017770993), (3, 0.017348094)]",1
西城区阜成门万通金融中心与3月17日停止供暖，违反北京市要求供暖至月底的要求，天气寒冷，上班人员容易感冒，对病毒抵抗力下降，影响防疫工作。,"[(0, 0.962723), (1, 0.012495915), (2, 0.012529117), (3, 0.012251948)]",0
从12月17以来，暖气停止供暖，打热线电话无人接听，收费不作为，没有服务意思，现在大家都在家抗击病毒确得不到合理正常的供暖服务！希望政府领导关注民生，早点解决！,"[(0, 0.014621653), (1, 0.013920836), (2, 0.95735765), (3, 0.014099849)]",2
飞跃路与富民大街交汇，早上有很多人露天剪发，碎发乱飞，污染环境，尤其是这特殊时期还有可能传播病毒，影响城市面貌，有损长春市形象，希望有关部门能治理。,"[(0, 0.011691804), (1, 0.011690674), (2, 0.011346109), (3, 0.96527135)]",3
北京市防疫政策中，14日内有1例以上(含1例)本土新冠病毒感染者所在县(市、区、旗)旅居人员严格限制进返京。其中的所在县(市、区、旗)应该如何界定？,"[(0, 0.01834988), (1, 0.9445806), (2, 0.019051056), (3, 0.018018452)]",1
1.15号楼旁边垃圾堆不及时清理，容易引发蚊蝇滋生病毒。2.南门消防通道每天早上变成运送垃圾，摆放一大堆垃圾桶，气味难闻且全是细菌,"[(0, 0.013448481), (1, 0.013073331), (2, 0.012845683), (3, 0.9606325)]",3
"1、目前世纪康城用水为自备井（2015年4月8日，就因管道破裂导致诺如病毒感染）；
2、请领导给予解决老百姓用水问题；期待用上市政供水；
谢谢。
","[(0, 0.0144899385), (1, 0.0143870525), (2, 0.0143832015), (3, 0.9567398)]",3
