名称,制定机关,出台日期,内容,fenci
国务院批转邮电部关于进一步加强电信业务市场管理意见的通知,国务院,1993.08.03,国务院批转邮电部关于进一步加强电信业务市场管理意见的通知（１９９３年８月３日国发〔１９９３〕５５号）各省、自治区、直辖市人民政府，国务院各部委、各直属机构：国务院同意邮电部《关于进一步加强电信业务市场管理的意见》，现转发给你们，请认真贯彻执行。国务院一九九三年八月三日关于进一步加强电信业务市场管理的意见国务院：为了适应改革开放和社会主义现代化建设的需要，更好地服从和服务于经济建设这个中心，邮电部门必须在努力建设一个统一、完整、先进的国家通信网的同时，充分挖掘各专用通信网的潜力，调动各方面的积极性，加快通信事业的发展。近年来，我国已将部分电信业务向社会放开经营。目前向社会放开经营的电信业务有：无线电寻呼业务；８００ＭＨｚ（兆赫）集群电话业务；４５０ＭＨｚ（兆赫）无线电移动通信业务；国内ＶＳＡＴ（甚小天线地球站）通信业务；电话信息服务业务；计算机信息服务业务；电子信箱业务；电子数据交换业务；可视图文业务；经国务院或邮电部批准允许经营的其他电信业务。为了维护正常的通信秩序，保证国家和用户的通信安全以及通信服务质量，并创造一个公平竞争的环境，必须加强对放开经营的电信业务市场的管理。为此，提出如下意见：一、对放开经营的电信业务，实行申报制度和经营许可证制度。凡在省、自治区、直辖市范围内经营的，由当地邮电管理局受理申报，负责审批、核发经营许可证，并报邮电部备案。跨省（自治区、直辖市）经营的，由邮电部受理申报，负责审批并核发经营许可证。未经审核批准，任何单位和个人不得擅自经营上述电信业务。关于申报制度和经营许可证制度的具体实施办法，由邮电部按上述意见制定、发布。已经开办经营上述电信业务的单位，应按规定补办有关手续。二、申办经营无线电通信业务的单位，必须按规定的审批权限到邮电部或当地邮电管理局申请办理经营许可证，并凭经营许可证取得无线电管理部门批准的使用频率后才可经营。三、获准经营上述电信业务的部门和单位，不得搞区域性封锁，要遵守国家有关通信的政策和法规，接受国家通信主管部门的行业管理和监督检查，保证电信服务质量，严格执行国家资费政策和有关收费标准，依法纳税，维护用户的合法权益。在业务经营中不得妨碍国家公用电信网的正常运行和通信建设，也不得防碍其他专用通信网的正常运行。四、国家通信主管部门要为邮电通信企业和其他经营通信业务的企业创造公平竞争的环境。各级邮电通信企业应按照有偿使用、互利互惠的原则，根据供需情况，相互配合，为经国家通信主管部门批准并持有电信业务经营许可证的单位，提供开办业务所需要的基本的中继设备、线路等，以保证其向社会提供良好的电信服务。五、外商不得在我国境内经营或参与经营通信业务。我国境内的公用通信网、专用通信网的有线电、无线电通信业务，不律不允许境外各类团体、企业、个人以及在我国境内已兴办的外商独资、中外合资和合作企业经营或参与经营，也不得以任何形式吸引外资参股经营。六、邮电部及各省、自治区、直辖市邮电管理局要对执行上述规定的情况实行监督检查。对违反上述规定的邮电通信企业和其他经营电信业务的单位，要分别给予警告、通报批评、限期改正、责令停止经营、没收非法经营所得、行政罚款，直至吊销经营许可证等处罚。各级邮电部门绝不允许利用发许可证之机以权谋私、走后门，一经发现要严肃处理。以上意见如无不妥，请批转各地区、各部门贯彻执行。邮电部一九九三年六月三十日,电信业务 电信业务 电信业务 电信业务 电信业务 业务 业务 业务 业务 业务 计算机信息 业务 业务 业务 业务 电信业务 用户 电信业务 电信业务 审批 备案 审批 电信业务 电信业务 业务 审批 电信业务 用户 业务 公用 电信网 业务 电信业务 业务 业务 公用 业务 电信业务 警告 罚款
中华人民共和国计算机信息系统安全保护条例,国务院,1994.02.18,中华人民共和国国务院令（１４７号）　　现发布《中华人民共和国计算机信息系统安全保护条例》，自发布之日起施行。总理　李鹏１９９４年２月１８日中华人民共和国计算机信息系统安全保护条例第一章　总则　　第一条　为了保护计算机信息系统的安全，促进计算机的应用和发展，保障社会主义现代化建设的顺利进行，制定本条例。　　第二条　本条例所称的计算机信息系统，是指由计算机及其相关的和配套的设备、设施（含网络）构成的，按照一定的应用目标和规则对信息进行采集、加工、存储、传输、检索等处理的人机系统。　　第三条　计算机信息系统的安全保护，应当保障计算机及其相关的和配套的设备、设施（含网络）的安全，运行环境的安全，保障信息的安全，保障计算机功能的正常发挥，以维护计算机信息系统的安全运行。　　第四条　计算机信息系统的安全保护工作，重点维护国家事务、经济建设、国防建设、尖端科学技术等重要领域的计算机信息系统的安全。　　第五条　中华人民共和国境内的计算机信息系统的安全保护，适用本条例。　　未联网的微型计算机的安全保护办法，另行制定。　　第六条　公安部主管全国计算机信息系统安全保护工作。　　国家安全部、国家保密局和国务院其他有关部门，在国务院规定的职责范围内做好计算机信息系统安全保护的有关工作。　　第七条　任何组织或者个人，不得利用计算机信息系统从事危害国家利益、集体利益和公民合法利益的活动，不得危害计算机信息系统的安全。第二章　安全保护制度　　第八条　计算机信息系统的建设和应用，应当遵守法律、行政法规和国家其他有关规定。　　第九条　计算机信息系统实行安全等级保护。安全等级的划分标准和安全等级保护的具体办法，由公安部会同有关部门制定。　　第十条　计算机机房应当符合国家标准和国家有关规定。　　在计算机机房附近施工，不得危害计算机信息系统的安全。　　第十一条　进行国际联网的计算机信息系统，由计算机信息系统的使用单位报省级以上人民政府公安机关备案。　　第十二条　运输、携带、邮寄计算机信息媒体进出境的，应当如实向海关申报。　　第十三条　计算机信息系统的使用单位应当建立健全安全管理制度，负责本单位计算机信息系统的安全保护工作。　　第十四条　对计算机信息系统中发生的案件，有关使用单位应当在２４小时内向当地县级以上人民政府公安机关报告。　　第十五条　对计算机病毒和危害社会公共安全的其他有害数据的防治研究工作，由公安部归口管理。　　第十六条　国家对计算机信息系统安全专用产品的销售实行许可证制度。具体办法由公安部会同有关部门制定。第三章　安全监督　　第十七条　公安机关对计算机信息系统安全保护工作行使下列监督职权：　　（一）监督、检查、指导计算机信息系统安全保护工作；　　（二）查处危害计算机信息系统安全的违法犯罪案件；　　（三）履行计算机信息系统安全保护工作的其他监督职责。　　第十八条　公安机关发现影响计算机信息系统安全的隐患时，应当及时通知使用单位采取安全保护措施。　　第十九条　公安部在紧急情况下，可以就涉及计算机信息系统安全的特定事项发布专项通令。第四章　法律责任　　第二十条　违反本条例的规定，有下列行为之一的，由公安机关处以警告或者停机整顿：　　（一）违反计算机信息系统安全等级保护制度，危害计算机信息系统安全的；　　（二）违反计算机信息系统国际联网备案制度的；　　（三）不按照规定时间报告计算机信息系统中发生的案件的；　　（四）接到公安机关要求改进安全状况的通知后，在限期内拒不改进的；　　（五）有危害计算机信息系统安全的其他行为的。　　第二十一条　计算机机房不符合国家标准和国家其他有关规定的，或者在计算机机房附近施工危害计算机信息系统安全的，由公安机关会同有关单位进行处理。　　第二十二条　运输、携带、邮寄计算机信息媒体进出境，不如实向海关申报的，由海关依照《中华人民共和国海关法》和本条例以及其他有关法律、法规的规定处理。　　第二十三条　故意输入计算机病毒以及其他有害数据危害计算机信息系统安全的，或者未经许可出售计算机信息系统安全专用产品的，由公安机关处以警告或者对个人处以５０００元以下的罚款、对单位处以１５０００元以下的罚款；有违法所得的，除予以没收外，可以处以违法所得１至３倍的罚款。　　第二十四条　违反本条例的规定，构成违反治安管理行为的，依照《中华人民共和国治安管理处罚条例》的有关规定处罚；构成犯罪的，依法追究刑事责任。　　第二十五条　任何组织或者个人违反本条例的规定，给国家、集体或者他人财产造成损失的，应当依法承担民事责任。　　第二十六条　当事人对公安机关依照本条例所作出的具体行政行为不服的，可以依法申请行政复议或者提起行政诉讼。　　第二十七条　执行本条例的国家公务员利用职权，索取、收受贿赂或者有其他违法、失职行为，构成犯罪的，依法追究刑事责任；尚不构成犯罪的，给予行政处分。第五章　附则　　第二十八条　本条例下列用语的含义：　　计算机病毒，是指编制或者在计算机程序中插入的破坏计算机功能或者毁坏数据，影响计算机使用，并能自我复制的一组计算机指令或者程序代码。　　计算机信息系统安全专用产品，是指用于保护计算机信息系统安全的专用硬件和软件产品。　　第二十九条　军队的计算机信息系统安全保护工作，按照军队的有关法规执行。　　第三十条　公安部可以根据本条例制定实施办法。　　第三十一条　本条例自发布之日起施行。,计算机信息 计算机信息 计算机信息 计算机信息 计算机信息 计算机信息 技术 计算机信息 计算机信息 计算机信息 计算机信息 计算机信息 计算机信息 计算机信息 计算机信息 国际 计算机信息 计算机信息 公安机关 备案 计算机信息 计算机信息 计算机信息 计算机信息 公安机关 数据 计算机信息 公安机关 计算机信息 计算机信息 计算机信息 计算机信息 公安机关 计算机信息 计算机信息 公安机关 警告 计算机信息 计算机信息 计算机信息 国际 备案 计算机信息 公安机关 计算机信息 计算机信息 公安机关 计算机信息 数据 计算机信息 计算机信息 公安机关 警告 罚款 罚款 罚款 公安机关 数据 计算机信息 计算机信息 计算机信息
