名称,制定机关,出台日期,内容,fenci
农业部计算机信息网络系统安全保密管理暂行规定,"



农业部(已撤销)





",1997.04.02,农业部计算机信息网络系统安全保密管理暂行规定（农业部1997年4月2日）第一章总则第一条为了加强对我部计算机信息网络的管理，保障计算机网络安全运行和网上信息交流的健康发展，根据《中华人民共和国保守国家秘密法》和中央保密委员会有关精神，制定本规定。第二条计算机网络系统的安全保密工作既要保障国家秘密的安全，又要促进信息处理技术的提高，有利于信息的共享与应用。加强计算机网络系统的安全保密工作，一靠组织管理，二靠技术进步。第三条本规定适用于联入农业部计算机信息网络的部机关各司局、直属单位及各省有关部门。规定中所称的“农业部局域网络”，指通过光缆、同轴电缆、双绞线等手段联入网络的计算机系统；所称“农业部远程网络”，指以电话线路、公用数据线路与农业部计算机信息网络联网的计算机系统。第二章涉密信息保密第四条在农业部计算机信息网络上存储和传输的信息，应根据农业部、国家保密局有关“农业工作中国家秘密及其密级具体范围的规定”精神，分清保密和非密的性质。需要在网络上存储、传输的保密信息，应遵守有关的保密要求。信息提供部门负责按照相关保密规定，明确信息秘密等级、保密期限和提供范围；网络技术安全管理部门（部信息中心或自管网络的管理部门，下同）负责实施相应的安全措施。第五条秘密级别以上的信息只限在专用的、采取了保密措施的微机（加装了干扰机或其他措施，下同）上编辑与传输。第六条农业部计算机信息网络上不存储和传输绝密级信息以及有关单位认为不宜上网的信息。其他保密信息可在“农业部局域网络”上通过采取了保密措施的微机上阅看。保密信息如果需要在“农业部远程网络”上传递，必须在传递的双方同时加接保密机（或采取保密部门认可的其他措施），目前在没有配备保密设施的情况下，“农业部远程网络”不传输秘密以上级别的信息。第七条网络上的数据库内容涉及保密的数据资料时，要在数据库设计时就提出保密要求和调用权限，由网络技术安全管理部门负责进行安全保密设计。如果委托其他单位设计，须由设计单位提供源码程序，经网络技术安全管理部门进行安全保密认证并进行保密设置后方可入网运行。第八条在网络上编发信息的部门，要根据国家和农业部有关的保密文件，确定需要保密的信息内容、划分编发等级、明确信息提供范围。对于信源单位已提出保密要求的信息，信息编发部门要严格按照信源单位提出的保密要求和提供范围确定网上编发级别；对于未明确密级但内容涉密的信息，要根据有关的保密规定，确定编发级别；对有涉密嫌疑又来源不明的信息不予编发。第九条信息使用、加工处理部门及网络管理部门，不得通过不正当的手段，超越权限查看、使用、复制保密信息，也不能擅自降低保密级别，把保密信息作为非保密信息传播。第十条“农业部局域网络”与上级或其他部委联网时的安全保密措施，按信息提供单位的要求执行。第三章网络安全管理第十一条网络建设和运行，必需有技术上的安全和保密控制措施，拒绝未经授权的访问。第十二条用户口令是进入网络的重要关卡，授权用户对自己的口令必须严格保密，不能转告非授权用户。计算机网络用户的口令和采取的安全措施，属于秘密级事项；有调阅机密内容权限的用户口令和网络系统级口令及安全措施属于机密事项。第十三条为了保证网络安全，任何单位和个人不得在“农业部局域网络”上擅自联接各类网络设备。所有网络设备的增减与变动，其技术方案必须经部网络技术安全管理部门（部信息中心，下同）认可并由其派出的技术人员予以安装和维护，任何单位和个人不得私自改动和联接。第十四条各单位联入“农业部局域网络”，需要安装主机、服务器等设备时，必须预先报部信息体系领导小组办公室（设在市场信息司，下同）核准，并由部网络技术安全管理部门进行安全和技术审核，分配网络地址和设置安全措施后，方可实施安装。第十五条本部各单位在“农业部局域网络”覆盖范围外独立建设的计算机信息网络，应事前报部信息体系领导小组办公室批准，并接受部保密委员会组织的技术安全审查。第十六条“农业部局域网络”所覆盖范围内的各司局、直属单位，如需要通过局域网与外单位进行信息（含数据）交换，应经由农业部计算机信息网络提供的统一网络信道进出。个别上级业务主管部门要求建立独立的网络信息通道时，应事先报部保密委员会和部信息体系领导小组办公室批准并经部网络技术安全管理部门进行内部技术安全审查。第十七条“农业部局域网络”所覆盖范围内的计算机，联入国际互联网络（Ｉｎｔｅｒｎｅｔ），与国外进行业务信息交流，必须经农业部计算机信息网络提供的统一进出口信道进行。第十八条在“农业部局域网络”上使用网络协议和网络软件，必须预先经部网络技术安全管理部门同意，未经同意的网络协议和网络软件，不得在网络上使用。第十九条对预先未经安全技术审核、批准，而私自接入或使用网络设备的单位以及进行其他违章操作的单位，一经发现，即停止该单位的入网资格，并拆除私自联入的设备。造成损失的，要追究责任。第二十条联入农业部计算机信息网络（包括接入国际互联网络）的单位和个人，不得利用网络系统从事危害国家安全、泄漏国家秘密等违法犯罪活动，不得编制、运行、传播危害网络安全的软件，不得制作、查阅、复制和传播妨碍社会治安的信息和淫秽色情等信息。对利用计算机网络进行违法犯罪活动的，按有关规定，严肃查处。第二十一条保密设施（保密机和干扰机）属于国家机要设施，要严格保管，防止丢失，发生故障由配发单位组织维修。使用单位在任何情况下不准自行拆卸和维修，不得委托非指定单位和个人维修，不得转借他人使用和研究。第四章附则第二十二条各有关单位应根据本部门的信息特点，参照国家和农业部的有关规定，制定有关保密信息范围、可提供信息的对象、技术安全措施、审核责任等具体制度，并报部信息体系领导小组办公室备案后执行。第二十三条由于信息提供部门没有明确保密要求或未遵守保密规定导致的泄密，由信息提供部门承担责任；信息提供部门提出了保密要求，由于网络技术安全管理部门工作失误导致的泄密，由网络技术安全管理部门承担责任。第二十四条农业部计算机信息网络的网络技术安全管理工作由部办公厅和市场信息司监督和指导，由部信息中心执行。部信息中心要根据本规定制定出保密安全技术措施，保证网络安全运行。经核准配备主机、服务器，自建网络的单位，其自建网络的安全保密工作由该网络的技术安全管理部门负责，并承担由于自建网络导致的保密和安全责任。部保密委员会定期组织有关部门对部内网络上的设备和计算机进行安全检查与培训。第二十五条上述规定如与国家或农业部新发布的相关规定抵触，按国家或农业部新的相关规定执行。第二十六条本规定由农业部负责解释。第二十七条本规定自发布之日起施行。,计算机信息 保密 计算机信息 保密 技术 技术 计算机信息 公用 数据 计算机信息 保密 计算机信息 保密 保密 保密 保密 保密 技术 保密 计算机信息 保密 保密 保密 保密 保密 保密 保密 保密 技术 保密 技术 保密 保密 入网 保密 保密 保密 保密 保密 保密 保密 保密 保密 技术 保密 用户 用户 保密 用户 用户 用户 技术 技术 技术 技术 计算机信息 保密 技术 局域网 数据 计算机信息 保密 技术 技术 业务 计算机信息 技术 技术 入网 计算机信息 保密 保密 保密 技术 备案 保密 保密 保密 技术 技术 计算机信息 技术 保密 技术 技术 保密 保密
中华人民共和国计算机信息网络国际联网管理暂行规定(1997修正),国务院,1997.05.20,中华人民共和国计算机信息网络国际联网管理暂行规定(1997修正)中华人民共和国计算机信息网络国际联网管理暂行规定（１９９６年２月１日中华人民共和国国务院令第１９５号发布　根据１９９７年５月２０日《国务院关于修改〈中华人民共和国计算机信息网络国际联网管理暂行规定〉的决定》修正）　　第一条　为了加强对计算机信息网络国际联网的管理，保障国际计算机信息交流的健康发展，制定本规定。　　第二条　中华人民共和国境内的计算机信息网络进行国际联网，应当依照本规定办理。　　第三条　本规定下列用语的含义是：　　（一）计算机信息网络国际联网（以下简称国际联网），是指中华人民共和国境内的计算机信息网络为实现信息的国际交流，同外国的计算机信息网络相联接。　　（二）互联网络，是指直接进行国际联网的计算机信息网络；互联单位，是指负责互联网络运行的单位。　　（三）接入网络，是指通过接入互联网络进行国际联网的计算机信息网络；接入单位，是指负责接入网络运行的单位。　　第四条　国家对国际联网实行统筹规划、统一标准、分级管理、促进发展的原则。　　第五条　国务院信息化工作领导小组（以下简称领导小组），负责协调、解决有关国际联网工作中的重大问题。　　领导小组办公室按照本规定制定具体管理办法，明确国际出入口信道提供单位、互联单位、接入单位和用户的权利、义务和责任，并负责对国际联网工作的检查监督。　　第六条　计算机信息网络直接进行国际联网，必须使用邮电部国家公用电信网提供的国际出入口信道。　　任何单位和个人不得自行建立或者使用其他信道进行国际联网。　　第七条　已经建立的互联网络，根据国务院有关规定调整后，分别由邮电部、电子工业部、国家教育委员会和中国科学院管理。　　新建互联网络，必须报经国务院批准。　　第八条　接入网络必须通过互联网络进行国际联网。　　接入单位拟从事国际联网经营活动的，应当向有权受理从事国际联网经营活动申请的互联单位主管部门或者主管单位申请领取国际联网经营许可证；未取得国际联网经营许可证的，不得从事国际联网经营业务。　　接入单位拟从事非经营活动的，应当报经有权受理从事非经营活动申请的互联单位主管部门或者主管单位审批；未经批准的，不得接入互联网络进行国际联网。　　申请领取国际联网经营许可证或者办理审批手续时，应当提供其计算机信息网络的性质、应用范围和主机地址等资料。　　国际联网经营许可证的格式，由领导小组统一制定。　　第九条　从事国际联网经营活动的和从事非经营活动的接入单位都必须具备下列条件：　　（一）是依法设立的企业法人或者事业法人；　　（二）具有相应的计算机信息网络、装备以及相应的技术人员和管理人员；　　（三）具有健全的安全保密管理制度和技术保护措施；　　（四）符合法律和国务院规定的其他条件。　　接入单位从事国际联网经营活动的，除必须具备本条前款规定条件外，还应当具备为用户提供长期服务的能力。　　从事国际联网经营活动的接入单位的情况发生变化，不再符合本条第一款、第二款规定条件的，其国际联网经营许可证由发证机构予以吊销；从事非经营活动的接入单位的情况发生变化，不再符合本条第一款规定条件的，其国际联网资格由审批机构予以取消。　　第十条　个人、法人和其他组织（以下统称用户）使用的计算机或者计算机信息网络，需要进行国际联网的，必须通过接入网络进行国际联网。　　前款规定的计算机或者计算机信息网络，需要接入接入网络的，应当征得接入单位的同意，并办理登记手续。　　第十一条　国际出入口信道提供单位、互联单位和接入单位，应当建立相应的网络管理中心，依照法律和国家有关规定加强对本单位及其用户的管理，做好网络信息安全管理工作，确保为用户提供良好、安全的服务。　　第十二条　互联单位与接入单位，应当负责本单位及其用户有关国际联网的技术培训和管理教育工作。　　第十三条　从事国际联网业务的单位和个人，应当遵守国家有关法律、行政法规，严格执行安全保密制度，不得利用国际联网从事危害国家安全、泄露国家秘密等违法犯罪活动，不得制作、查阅、复制和传播妨碍社会治安的信息和淫秽色情等信息。　　第十四条　违反本规定第六条、第八条和第十条的规定的，由公安机关责令停止联网，给予警告，可以并处15000元以下的罚款；有违法所得的，没收违法所得。　　第十五条　违反本规定，同时触犯其他有关法律、行政法规的，依照有关法律、行政法规的规定予以处罚；构成犯罪的，依法追究刑事责任。　　第十六条　与台湾、香港、澳门地区的计算机信息网络的联网，参照本规定执行。　　第十七条　本规定自发布之日起施行。,计算机信息 国际 计算机信息 国际 计算机信息 国际 计算机信息 国际 国际 计算机信息 计算机信息 国际 计算机信息 国际 国际 计算机信息 计算机信息 国际 计算机信息 国际 计算机信息 国际 协调 国际 国际 用户 国际 计算机信息 国际 公用 电信网 国际 国际 国际 国际 国际 国际 国际 国际 业务 审批 国际 国际 审批 计算机信息 国际 国际 计算机信息 保密 技术 国际 用户 国际 国际 国际 审批 用户 计算机信息 国际 国际 计算机信息 国际 用户 用户 用户 国际 国际 业务 国际 公安机关 警告 罚款 计算机信息
计算机信息网络国际联网安全保护管理办法,公安部,1997.12.16,中华人民共和国公安部令（第３３号）《计算机信息网络国际联网安全保护管理办法》，已于１９９７年１２月１１日经国务院批准，现予发布，自１９９７年１２月３０日起施行。公安部部长陶驷驹一九九七年十二月十六日计算机信息网络国际联网安全保护管理办法第一章总则第一条为了加强对计算机信息网络国际联网的安全保护，维护公共秩序和社会稳定，根据《中华人民共和国计算机信息系统安全保护条例》、《中华人民共和国计算机信息网络国际联网管理暂行规定》和其他法律、行政法规的规定，制定本办法。本条变迁第二条中华人民共和国境内的计算机信息网络国际联网安全保护管理，适用本办法。本条变迁第三条公安部计算机管理监察机构负责计算机信息网络国际联网的安全保护管理工作。公安机关计算机管理监察机构应当保护计算机信息网络国际联网的公共安全，维护从事国际联网业务的单位和个人的合法权益和公众利益。本条变迁第四条任何单位和个人不得利用国际联网危害国家安全、泄露国家秘密，不得侵犯国家的、社会的、集体的利益和公民的合法权益，不得从事违法犯罪活动。本条变迁第五条任何单位和个人不得利用国际联网制作、复制、查阅和传播下列信息：（一）煽动抗拒、破坏宪法和法律、行政法规实施的；（二）煽动颠覆国家政权、推翻社会主义制度的；（三）煽动分裂国家、破坏国家统一的；（四）煽动民族仇恨、民族歧视，破坏民族团结的；（五）捏造或者歪曲事实，散布谣言，扰乱社会秩序的；（六）宣扬封建迷信、淫秽、色情、赌博、暴力、凶杀、恐怖，教唆犯罪的；（七）公然侮辱他人或者捏造事实诽谤他人的；（八）损害国家机关信誉的；（九）其他违反宪法和法律、行政法规的。本条变迁第六条任何单位和个人不得从事下列危害计算机信息网络安全的活动：（一）未经允许，进入计算机信息网络或者使用计算机信息网络资源的；（二）未经允许，对计算机信息网络功能进行删除、修改或者增加的；（三）未经允许，对计算机信息网络中存储、处理或者传输的数据和应用程序进行删除、修改或者增加的；（四）故意制作、传播计算机病毒等破坏性程序的；（五）其他危害计算机信息网络安全的。本条变迁第七条用户的通信自由和通信秘密受法律保护。任何单位和个人不得违反法律规定，利用国际联网侵犯用户的通信自由和通信秘密。本条变迁第二章安全保护责任第八条从事国际联网业务的单位和个人应当接受公安机关的安全监督、检查和指导，如实向公安机关提供有关安全保护的信息、资料及数据文件，协助公安机关查处通过国际联网的计算机信息网络的违法犯罪行为。本条变迁第九条国际出入口信道提供单位、互联单位的主管部门或者主管单位，应当依照法律和国家有关规定负责国际出入口信道、所属互联网络的安全保护管理工作。本条变迁第十条互联单位、接入单位及使用计算机信息网络国际联网的法人和其他组织应当履行下列安全保护职责：（一）负责本网络的安全保护管理工作，建立健全安全保护管理制度；（二）落实安全保护技术措施，保障本网络的运行安全和信息安全；（三）负责对本网络用户的安全教育和培训；（四）对委托发布信息的单位和个人进行登记，并对所提供的信息内容按照本办法第五条进行审核；（五）建立计算机信息网络电子公告系统的用户登记和信息管理制度；（六）发现有本办法第四条、第五条、第六条、第七条所列情形之一的，应当保留有关原始记录，并在二十四小时内向当地公安机关报告；（七）按照国家有关规定，删除本网络中含有本办法第五条内容的地址、目录或者关闭服务器。本条变迁第十一条用户在接入单位办理入网手续时，应当填写用户备案表。备案表由公安部监制。本条变迁第十二条互联单位、接入单位、使用计算机信息网络国际联网的法人和其他组织（包括跨省、自治区、直辖市联网的单位和所属的分支机构），应当自网络正式联通之日起三十日内，到所在地的省、自治区、直辖市人民政府公安机关指定的受理机关办理备案手续。前款所列单位应当负责将接入本网络的接入单位和用户情况报当地公安机关备案，并及时报告本网络中接入单位和用户的变更情况。本条变迁第十三条使用公用帐号的注册者应当加强对公用帐号的管理，建立帐号使用登记制度。用户帐号不得转借、转让。本条变迁第十四条涉及国家事务、经济建设、国防建设、尖端科学技术等重要领域的单位办理备案手续时，应当出具其行政主管部门的审批证明。前款所列单位的计算机信息网络与国际联网，应当采取相应的安全保护措施。本条变迁第三章安全监督第十五条省、自治区、直辖市公安厅（局），地（市）、县（市）公安局，应当有相应机构负责国际联网的安全保护管理工作。本条变迁第十六条公安机关计算机管理监察机构应当掌握互联单位、接入单位和用户的备案情况，建立备案档案，进行备案统计，并按照国家有关规定逐级上报。本条变迁第十七条公安机关计算机管理监察机构应当督促互联单位、接入单位及有关用户建立健全安全保护管理制度。监督、检查网络安全保护管理以及技术措施的落实情况。公安机关计算机管理监察机构在组织安全检查时，有关单位应当派人参加。公安机关计算机管理监察机构对安全检查发现的问题，应当提出改进意见，作出详细记录，存档备查。本条变迁第十八条公安机关计算机管理监察机构发现含有本办法第五条所列内容的地址、目录或者服务器时，应当通知有关单位关闭或者删除。本条变迁第十九条公安机关计算机管理监察机构应当负责追踪和查处通过计算机信息网络的违法行为和针对计算机信息网络的犯罪案件，对违反本办法第四条、第七条规定的违法犯罪行为，应当按照国家有关规定移送有关部门或者司法机关处理。本条变迁第四章法律责任第二十条违反法律、行政法规，有本办法第五条、第六条所列行为之一的，由公安机关给予警告，有违法所得的，没收违法所得，对个人可以并处五千元以下的罚款，对单位可以并处一万五千元以下的罚款；情节严重的，并可以给予六个月以内停止联网、停机整顿的处罚，必要时可以建议原发证、审批机构吊销经营许可证或者取消联网资格；构成违反治安管理行为的，依照治安管理处罚条例的规定处罚；构成犯罪的，依法追究刑事责任。本条变迁第二十一条有下列行为之一的，由公安机关责令限期改正，给予警告，有违法所得的，没收违法所得；在规定的限期内未改正的，对单位的主管负责人员和其他直接责任人员可以并处五千元以下的罚款，对单位可以并处一万五千元以下的罚款；情节严重的，并可以给予六个月以内的停止联网、停机整顿的处罚，必要时可以建议原发证、审批机构吊销经营许可证或者取消联网资格。（一）未建立安全保护管理制度的；（二）未采取安全技术保护措施的；（三）未对网络用户进行安全教育和培训的；（四）未提供安全保护管理所需信息、资料及数据文件，或者所提供内容不真实的；（五）对委托其发布的信息内容未进行审核或者对委托单位和个人未进行登记的；（六）未建立电子公告系统的用户登记和信息管理制度的；（七）未按照国家有关规定，删除网络地址、目录或者关闭服务器的；（八）未建立公用帐号使用登记制度的；（九）转借、转让用户帐号的。本条变迁第二十二条违反本办法第四条、第七条规定的，依照有关法律、法规予以处罚。本条变迁第二十三条违反本办法第十一条、第十二条规定，不履行备案职责的，由公安机关给予警告或者停机整顿不超过六个月的处罚。本条变迁第五章附则第二十四条与香港特别行政区和台湾、澳门地区联网的计算机信息网络的安全保护管理，参照本办法执行。本条变迁第二十五条本办法自发布之日起施行。本条变迁,计算机信息 国际 计算机信息 国际 计算机信息 国际 计算机信息 计算机信息 国际 计算机信息 国际 计算机信息 国际 公安机关 计算机信息 国际 国际 业务 国际 国际 计算机信息 计算机信息 计算机信息 计算机信息 计算机信息 数据 计算机信息 用户 国际 用户 国际 业务 公安机关 公安机关 公安机关 国际 计算机信息 国际 国际 计算机信息 国际 技术 用户 计算机信息 用户 公安机关 用户 入网 用户 备案 备案 计算机信息 国际 公安机关 备案 用户 公安机关 备案 用户 公用 公用 用户 技术 备案 审批 计算机信息 国际 国际 公安机关 用户 备案 备案 备案 公安机关 用户 技术 公安机关 公安机关 公安机关 公安机关 计算机信息 计算机信息 公安机关 警告 罚款 罚款 审批 公安机关 警告 罚款 罚款 审批 技术 用户 用户 公用 用户 备案 公安机关 警告 计算机信息
