名称,制定机关,出台日期,内容,fenci
国家统计信息网络管理暂行规定,"



国家统计局





",1998.04.23,国家统计信息网络管理暂行规定（1998年4月23日国家统计局印发）第一条为了保障国家统计信息网络系统安全正常地运行，确保统计数据的安全性、保密性、完整性和可使用性，根据国家有关条例和规定，特制定本办法。第二条本规定所称的国家统计信息网络系统，是指国家统计局及所属各地区统计局的计算机局域网、城域网，国家统计局各局域网与各地方统计局局域网之间互联的广域网，以及接入国际互联网的所有计算机网络系统。第三条国家统计信息网络系统实行统一管理，分级负责。国家统计局负责制订网络管理的基本原则和规定，网络系统的每个部分都必须严格遵守。各地方的统计信息网由各级统计部门管理。国家统计局计算中心是国家统计信息网络系统的主管职能部门，对国家统计信息网络系统进行统一管理。第四条国家统计系统各级统计部门，各单位及个人网络前台计算机联入统计信息网络系统应当进行注册登记，并签定入网责任书。第五条各级统计部门加入国际互联网的单位和个人，必须填报联网审批表，并经各级统计机构安全保密部门审查批准后，由计算中心具体办理入网事宜。第六条未经批准任何单位和个人不得私自入网。入网的单位和个人应严格遵守有关网络管理规定，服从网络管理单位的管理；不得损害其他用户利益，不得篡改他人信息，散发恶意信息，冒用他人名义或侵犯他人隐私；不得干扰网络管理工作，不得擅自更改或盗用网址破坏网络正常运行，不得进入未经许可的计算机系统；一经发现将追究其责任，并给予停止联网，停机整顿的处罚，必要时取消当事人及其所在单位的入网资格。第七条各地以网络方式联入国家统计信息网的单位，必须填写入网报告，上报国家统计局计算中心。入网报告主要内容为：网络技术方案、服务性质和范围、网络效益分析、安全措施和管理制度等。第八条联入国家统计信息网的计算机网络，只限于统计系统内部使用，不得对外经营国际互联网络业务。有非经营性国际互联网业务的单位，应参照本办法及有关的法律法规建立网络管理中心，健全管理制度，做好网络信息安全管理工作。第九条各地统计局应根据国家统计局统一规划的域名及地址开展联网工作，并将域名、地址分配情况及入网报告上报国家统计局计算中心备案，办理国家有关规定的相应手续。第十条网络接入单位和用户必须遵守国家有关法律、法规，严格执行国家安全保密制度（国家统计信息网络系统安全保密规定另发）。不得利用国际互联网从事危害国家安全、泄露国家秘密等违法犯罪活动；不得制作、查阅、复制和传播妨碍社会治安和淫秽色情等有害信息。发现有害信息应当及时向有关部门报告，并采取有效措施，不得使其扩散。第十一条网络统计信息资源严格按国家统计局的有关规定进行管理。涉及国家秘密的信息，部门秘密信息和不宜公开的内部信息，均不得使用国际互联网传输，或利用已联入国际互联网的计算机系统进行处理或存储。第十二条进入统计信息网的信息（数据）的安全保密工作由信息（数据）的提供者（管理者）和使用者负责，严格按照“谁使用、谁负责”的原则执行，各自做好本职内的安全保密工作。凡违背保密规定造成泄密、失密的，将按照局有关规定追究所在单位领导和当事人的责任。第十三条各地和各有关单位联入国际互联网的计算机系统应按规定承担其相应的网络通信费和国际互联网费用（收费标准和有关具体规定由国家统计局另行制定）。第十四条违反本规定和有关法律、行政法规的，由国家统计机构安全保密部门会同有关机关依据有关法律、行政法规进行处罚，构成犯罪的，依法追究刑事责任。第十五条本规定自发布之日起实行。,局域网 局域网 局域网 国际 入网 国际 保密 入网 入网 入网 用户 入网 入网 入网 技术 业务 国际 业务 入网 备案 用户 保密 国际 国际 国际 数据 数据 保密 国际 国际 保密
国务院办公厅关于加强广播电视传输网络建设管理的通知,国务院办公厅,1998.06.26,国务院办公厅关于加强广播电视传输网络建设管理的通知（国办函［１９９８］３３号）各省、自治区、直辖市人民政府，信息产业部、广电总局：近年来，随着我国电信事业的发展，广播电视传输网络建设也得到快速发展。但是，由于种种原因，许多地方在网络建设中，采取自成体系独立建网的做法，出现了有线广播电视网重复建设造成国家资源和资金浪费等问题。为了切实避免重复建设，国务院近日召开总理办公会议进行了专题研究，对此作出了规定。根据国务院领导同志的指示，现将有关精神和规定通知如下：广播电影电视主管部门应坚决按照党的十五届二中全会和九届全国人大一次会议通过的政府机构改革方案和国务院批准的“三定”规定执行，即广播电视传输网络的管理，应严格实行政企分开，成立企业化的广播电视传输公司，接受信息产业主管部门的统筹规划和行业管理，广播电影电视主管部门不得进行行政干预。广播电视传输网络的建设，要搞好与国家通信主干网、专用电信用和新建网的衔接和协调，充分利用现有通信网络，切实避免重复建设。各级地方政府均不得自行批准新建广播电视传输网络项目，确需新建的，要严格按程序上报信息产业部和国务院审批。国务院办公厅一九九八年六月二十六日,协调 审批
交通部关于交通通信管理规则,"



交通部(已撤销)





",1999.06.09,交通通信管理规则（1999年06月09日交通部令1999年第1号）第一章总则第一条为加强交通通信管理，保证交通通信网的统一、畅通和通信业务的正常运行，充分发挥交通通信设施的作用，适应水路和公路交通发展的需要，制定本规则。第二条在中华人民共和国境内的交通通信工程建设、通信网络组织和设备配置以及通信运营管理，均应遵守本规则。第三条交通通信网由水运通信网、公路通信网和部分水运、公路共用通信设施组成。第四条交通通信管理实行统一领导、统筹规划、分工管理、分级负责、综合利用的原则。第五条交通部根据国家有关规定主管全国交通通信工作。中国交通通信中心根据交通部的委托具体负责全国交通通信管理工作。县级以上地方人民政府交通主管部门依据本规则主管本行政区域内的交通通信工作。长江、珠江、黑龙江航务（运）管理机构，海（水）上交通安全监督机构、港口管理机构根据本规则和交通部确定的职责，负责其管理范围内的通信管理工作。第二章网络规划、组织、管理第六条交通通信的规划和建设应充分考虑交通行业特点及全程全网统一畅通的要求，在交通部统一规划的前提下，统一技术体制和技术标准。第七条全国交通通信规划由交通部负责组织编制并发布。交通系统各地区、各单位应按交通通信总体规划的要求，编制本地区、本单位的通信发展规划和计划，并报交通部审核。第八条公路国道主干线通信网、省级交换中心、８００ＭＨｚ集群通信系统、江海岸电台建设和改造项目的技术方案，应报中国交通通信中心审核，并按照国家规定的基本建设程序和有关规定报批后实施。第九条各级交通主管部门应当根据交通行业对通信的需求，科学地组织调配通信电路，保障通信网络畅通安全。第十条交通一级长途通信网由中国交通通信中心负责组织，统一调度通信电路。第十一条公路交通通信网分为四级，实行分级管理。（一）一级网：以交通部为中心，联接各省级交通主管部门的通信网，由中国交通通信中心负责组织调度、管理；（二）二级网：省级交通主管部门联接各市（设区的市，下同）交通主管部门的通信网，由省级交通主管部门负责组织管理；（三）三级网：以市交通主管部门为中心，联接各县级交通主管部门的通信网，由市交通主管部门负责组织管理；（四）四级网：以县级交通主管部门为中心连接其所属的通信网，由县级交通主管部门负责组织管理。第十二条全国交通系统的应急、战备通信网，由交通部负责组织管理。地区性应急、战备通信设施，由省级交通主管部门负责组织管理。第十三条新建、扩建和改建的交通通信设施，如需与交通一级长途通信联网，应按照交通部的有关规定向中国交通通信中心办理入网申请，获批准后，方可建设和入网运行。未经批准的各类通信业务和用户不得引入交通通信网。第十四条水上移动通信网由交通部负责组织和协调，由电台及设施所属单位负责具体的经营和管理；公路通信网由所属的省级交通主管部门负责组织管理。第十五条交通系统水上无线电频率、电台呼号和识别，无线电台（站）设置，由交通部统一审批、管理。公路移动通信电台设置、频率管理按交通部有关无线电管理规定办理。第十六条交通系统无线电设备的研制、生产、购置和进口，按国家和交通部有关无线电管理规定办理。未按规定办理设台审批手续，不得擅自设置和使用无线电台（站）。第三章业务管理第十七条交通系统各单位应根据交通部有关规定建立和完善通信业务管理制度。交通通信业务发生变更，应事先按第十条至第十五条规定的管理权限报批，并提前将有关情况通知各用户单位。第十八条交通系统各单位应按照规定的业务范围编制地区性通信业务资料并报中国交通通信中心。第十九条交通系统各单位应在每年３月底以前将本网范围内通信组织、设备及通信人员状况等统计资料用软盘和报表形式报送中国交通通信中心；江海岸电台应按有关规定定期上报通信统计资料。第二十条交通系统各单位必须严格执行国家和交通部有关通信资费规定，不得随意变动收费标准，增加收费项目。第二十一条交通系统各单位必须加强对交通通信网的经营服务、话务等工作人员的管理，通信用语应文明规范。实行承诺服务的单位，应把承诺的内容、标准及违约责任公开，接受用户和社会监督。第四章技术管理第二十二条交通通信设施的配备和建设，应符合《交通通信网技术体制》、《公路通信技术要求及设备配备总则》和《公路通信技术要求及设备配备和组网技术要求》等国家或行业标准的要求。不符合规定的，不得入网使用。第二十三条交通通信的机线设备管理，应按交通部通信导航设备管理的有关规定贯彻执行。第二十四条通信专业技术人员应经过专门训练，熟悉所管设备的性能、操作方法和要求，经考核合格后才能上岗工作。第二十五条交通系统各单位通信机构应当加强技术文件和技术资料的管理，建立技术档案管理制度。第二十六条交通系统各单位要严格贯彻执行国家和交通部颁布的有关通信质量标准，定期测试检查各项技术指标，认真做好设备的维护保养，降低机线设备的故障率，保证交通通信网可靠运行。第五章附则第二十七条本规则由交通部负责解释。第二十八条本规则自一九九九年七月一日起施行。,交通 交通 交通 业务 交通 交通 交通 交通 交通 交通 交通 交通 交通 交通 交通 技术 交通 交通 技术 交通 交通 交通 交通 交通 交通 交通 交通 交通 交通 交通 交通 交通 交通 交通 交通 交通 交通 交通 入网 入网 业务 用户 交通 协调 交通 审批 审批 交通 业务 用户 业务 交通 交通 交通 用户 技术 交通 交通 技术 技术 技术 技术 入网 交通 技术 技术 交通
铁路计算机信息网络国际联网保密管理暂行规定,"



铁道部（已撤销）





",1999.08.16,铁路计算机信息网络国际联网保密管理暂行规定（铁办95号铁道部1999年8月16日）第一条为了加强铁路计算机及计算机信息网络国际联网的保密管理，确保国家和铁路企业秘密信息的安全，根据《中华人民共和国保守国家秘密法》、《中华人民共和国计算机信息网络国际联网管理暂行规定》和国家保密局《计算机信息系统保密管理暂行规定》，制定本规定。第二条本规定所称铁路用户，是指将计算机和计算机网络与国际计算机网络联网并进行信息交流的铁路单位或职工。接入单位，是指负责为铁路用户提供国际网络接入服务的铁路单位。铁路用户及接入单位均应遵守本规定，承担保密责任和义务。第三条铁路计算机信息网络国际联网的保密管理，实行控制源头、归口管理、分级负责、有利发展的原则。部保密工作部门主管全路计算机信息网络国际联网的保密工作，部属单位各级保密工作部门主管本管辖范围内计算机信息网络国际联网的保密工作。机关业务部门负责本业务系统内计算机信息网络国际联网的保密工作。第四条铁路计算机信息网络国际联网的审批权限为局级单位的保密委员会。部保密工作部门负责办理部内各单位、部直属单位的入网审批工作；部属各局级单位保密工作部门负责办理分管单位的入网审批工作，审批入网后均报部备案。铁路公安局（处）和电子计算技术中心主管计算机安全监察及技术管理的部门，负责计算机信息网络国际联网的安全及技术审查工作。第五条铁路计算机信息网络拟上国际互联网，应填写部保密委员会办公室统一制定的《铁路计算机信息网络国际联网单位审批（备案）表》上报审批，并与负责办理审批手续的保密工作部门签订保密协议，方可入网。铁路职工个人计算机自费上网不履行报批手续，但上网后应严格遵守保密法规，自觉接受保密检查及监督。已经入网的单位，在本规定发布之日起三个月内补办报批手续。第六条铁路涉密的计算机及计算机信息网络不得进行国际联网，并在物理上与国际网络完全隔离。涉密计算机信息网络进行或不进行国际联网，都应采取保密、加密等防范措施。第七条涉及国家秘密的信息（包括对外交流与合作中经审查批准可与境外交换的秘密信息），不得在与国际联网的计算机上存储、处理、传递。涉及商业秘密（企业秘密）、工作秘密的信息原则上不许上网，确需上网的应经主管的局级领导批准。第八条提供主页制作服务的接入单位，对要求建立主页的用户，应提出保密要求。上网发布信息必须建立保密审查制度，逐级负责，归口把关。重要用户应建立保密管理组织，指定专人负责保密审查及保密检查。第九条使用电子邮件等方式进行网上信息交流，应遵守保密规定，不得传递、摘抄或变相泄露涉密信息。严禁任何单位或个人利用国际联网从事危害国家安全、泄露国家秘密和损害国家利益的违法犯罪活动。第十条铁路用户及接入单位均实行保密工作领导责任制，谁主管、谁负责，确保涉密信息不上网。对违反规定造成泄密的，在追究当事人责任的同时追究单位领导人的责任。第十一条各级保密工作部门要加强对计算机国际联网的保密检查，发现问题认真查处。对违反本规定的用户，可给予警告、责令停机整顿、直至取消其国际联网资格的处罚。第十二条接入单位和用户应主动接受并配合保密部门实施保密监督、检查，协助查处泄密事件。发现泄密或严重泄密苗头，应向保密工作部门和网络管理部门报告，及时采取防范或补救措施。第十三条违反本规定，在国际互联网上故意或者过失泄密构成犯罪的，依法追究刑事责任；不够刑事处罚的，视情节轻重给予党纪、政纪处分。第十四条与港、澳、台地区联网的计算机信息网络的保密管理，参照本规定执行。第十五条本规定由铁道部保密委员会办公室负责解释，自发布之日起施行。,计算机信息 国际 保密 计算机信息 国际 保密 计算机信息 国际 计算机信息 保密 用户 国际 用户 国际 用户 保密 计算机信息 国际 保密 保密 计算机信息 国际 保密 计算机信息 国际 业务 计算机信息 国际 计算机信息 国际 审批 保密 保密 入网 审批 保密 入网 审批 审批 入网 备案 技术 技术 计算机信息 国际 技术 计算机信息 国际 保密 计算机信息 国际 审批 备案 审批 审批 保密 保密 入网 保密 保密 入网 计算机信息 国际 国际 计算机信息 国际 保密 国际 用户 保密 保密 用户 保密 保密 保密 保密 国际 用户 保密 国际 保密 用户 警告 国际 用户 保密 保密 保密 国际 计算机信息 保密 保密
