名称,制定机关,出台日期,内容,fenci
邮电部关于发布《计算机信息网络国际联网出入口信道管理办法》的通知,"



信息产业部(含邮电部)(已撤销)





",1996.04.09,关于发布《计算机信息网络国际联网出入口信道管理办法》的通知（邮部〔１９９６〕４９２号）各省、自治区、直辖市邮电管理局：《计算机信息网络国际联网出入口信道管理办法》，已经１９９６年４月８日第８４次部长办公会议审议通过，现予以发布，自发布之日起施行。邮电部一九九六年四月九日计算机信息网络国际联网出入口信道管理办法第一条为加强对计算机信息网络国际联网出入口的管理，根据《中华人民共和国计算机信息网络国际联网管理暂行规定》，制定本办法。第二条我国境内的计算机信息网络直接进行国际联网，必须使用邮电部国家公用电信网提供的国际出入口信道。任何单位和个人不得自行建立或者使用其它信道（含卫星信道）进行国际联网。法宝联想：法学期刊2篇第三条邮电部责成中国邮电电信总局（以下简称电信总局）设置计算机信息网络国际联网出入口局（以下简称国际出入口局）及其网络管理中心，并负责国际联网出入口信道的提供和管理。第四条直接进行国际联网的计算机信息网络运行单位（以下简称为互联单位），应向邮电部申请办理使用国际出入口信道手续。互联单位在办理手续时，应提供有效批准文件及有关网络规模、应用范围、接入单位、所需信道等相关资料。互联单位在办理手续后，应将前款事项变更情况，每半年向邮电部申报一次。第五条邮电部对互联单位的申请进行审核，对符合规定条件的，由电信总局在３０日内提供所需的国际出入口信道。未经邮电部批准，任何单位不得为计算机信息网络国际联网提供出入口信道。第六条电信总局应加强国际出入口局和出入口信道的管理，向互联单位提供优质可靠的服务。第七条互联单位使用专用国际信道，按照现行国际出租电路标准收费；对教育、科研部门内部使用的国际信道资费实行优惠。第八条国际出入口局对国家有关部门依法实施的信息安全检查和采取的相应措施，应予以配合。第九条违反本办法第二条规定的，提请公安机关依据《中华人民共和国计算机信息网络国际联网管理暂行规定》给予处罚。第十条违反本办法第五条第二款规定的，由邮电部责令其停止提供信道，并建议其主管部门给相关责任人及其负责人以行政处分。第十一条本办法自发布之日起施行。,计算机信息 国际 计算机信息 国际 计算机信息 国际 计算机信息 国际 计算机信息 国际 计算机信息 国际 公用 电信网 国际 国际 总局 总局 计算机信息 国际 国际 国际 国际 计算机信息 国际 总局 国际 计算机信息 国际 总局 国际 国际 国际 国际 国际 公安机关 计算机信息 国际
邮电部关于发布《中国公用计算机互联网国际联网管理办法》的通知,信息产业部(含邮电部)(已撤销),1996.04.09,关于发布《中国公用计算机互联网国际联网管理办法》的通知（邮部〔１９９６〕４９３号）各省、自治区、直辖市邮电管理局：《中国公用计算机互联网国际联网管理办法》，已经１９９６年４月８日第８４次部长办公会议审议通过，现予以发布，自发布之日起施行。邮电部一九九六年四月九日中国公用计算机互联网国际联网管理办法第一条为加强对中国公用计算机互联网国际联网的管理，促进国际信息交流的健康发展，根据《中华人民共和国计算机信息网络国际联网管理暂行规定》，制定本办法。第二条中国公用计算机互联网（即，以下简称中国公用互联网），是指由中国邮电电信总局（以下简称电信总局）负责建设、运营和管理，面向公众提供计算机国际联网服务，并承担普遍服务义务的互联网络。第三条中国公用互联网根据需要分级建立网络管理中心、信息服务中心。第四条接入中国公用互联网的接入单位应具备下列条件：（一）依法设立的企业、事业单位或机关、团体；（二）具有由计算机主机和在线信息终端组成的局域网络及相应的联网装备；（三）具有相应的技术人员和管理人员；（四）具有健全的安全保密管理制度和技术保护措施；（五）符合国家法律、法规和邮电部规定的其他条件。第五条要求接入中国公用互联网的接入单位，应经其主管部门或主管单位的审核同意，到电信总局办理接入手续。办理接入手续时，接入单位应报送接入网络的系统构成、应用范围、联网主机数量、域名地址及终端用户数据等资料。接入运行后，上述事项发生变更时，应及时向电信总局申报。第六条个人、法人和其他组织（以下简称用户）的计算机和其他通信终端进行国际联网，必须通过接入网络进行。用户可以通过专线或通过公用电信交换网进入接入网络。第七条电信总局作为中国公用互联网的互联单位，负责互联网内接入单位和用户的联网管理，并为其提供性能良好、安全可靠的服务。第八条接入单位负责对其接入网内用户的管理，并按规定与用户签订协议，明确双方的权利、义务和责任。第九条接入单位和用户应遵守国家法律、法规，加强信息安全教育，严格执行国家保密制度，并对所提供的信息内容负责。第十条任何组织或个人，不得利用计算机国际联网从事危害国家安全、泄露国家秘密等犯罪活动；不得利用计算机国际联网查阅、复制、制造和传播危害国家安全、妨碍社会治安和淫秽色情的信息；发现上述违法犯罪行为和有害信息，应及时向有关主管机关报告。法宝联想：法学期刊2篇第十一条任何组织或个人，不得利用计算机国际联网从事危害他人信息系统和网络安全、侵犯他人合法权益的活动。法宝联想：法学期刊1篇律所实务1篇第十二条互联单位、接入单位和用户对国家有关部门依法进行国际联网信息安全的监督检查，应予配合，并提供必要的资料和条件。第十三条凡利用国际互联网络信息资源，在国内经营计算机信息服务的，按放开经营电信业务的有关规定审批。法宝联想：法学期刊1篇第十四条接入单位和用户违反本办法第五条、第六条规定，未经批准，擅自接入中国公用互联网进行国际联网的，由电信总局停止接入服务；情节严重的，提请公安机关依法予以处罚。第十五条违反本办法第九条和第十条、第十一条规定的，由邮电部或邮电管理局给予警告、撤销批准文件并通知公用电信企业停止其联网接续的处罚。情节严重的，由公安机关依法予以处罚；构成犯罪的，提请由司法机关依法追究刑事责任。第十六条违反第十三条规定的，由邮电部或邮电管理局按有关规定予以处罚。第十七条本办法自发布之日起施行。,国际 国际 国际 国际 国际 计算机信息 国际 公用 总局 总局 国际 公用 公用 保密 技术 公用 总局 数据 总局 用户 国际 用户 公用 总局 公用 用户 用户 用户 用户 国际 国际 国际 用户 国际 计算机信息 电信业务 审批 用户 公用 国际 总局 公安机关 警告 公用 公安机关
国内贸易部关于发布《全国食品流通电子网络管理试行办法》的通知,"



国内贸易部(已变更)",1997.01.27,国内贸易部关于发布《全国食品流通电子网络管理试行办法》的通知（１９９７年１月２７日内贸商统办字〔１９９７〕第５号）各省、自治区、直辖市、计划单列市商委、商贸厅（局）：为利用电子联网技术规范食品、副食品商业企业统计、信息工作，推动信息产业的发展，我部制定了《全国食品流通电子网络管理试行办法》，现予发布，请认真组织实施。在实施过程中，有什么问题和意见，请及时告我部商业统计管理办公室。（联系人：刘援朝电话：６６０９５４４５、６６０９５６７６）全国食品流通电子网络管理试行办法（一九九七年一月二十七日国内贸易部发布）第一章总则第一条为利用电子联网技术规范食品、副食品商业企业统计、信息工作，推动信息产业的发展，制定本办法。第二条全国食品流通电子网（以下简称电子网）是由全国重点食品、副食品批发、零售企业以及食品类批发市场和重点食品、副食品生产、加工企业组成，以信息及电子商务服务为目的的系统网络。第三条组建电子网，旨在依照市场信息既为政府宏观调控市场服务，又为企业经营服务的原则，促进食品生产和经营向现代化和信息化方向发展。第四条电子网受国内贸易部领导，由国内贸易部商业信息中心组织和承办。电子计算机网络总站设在商业信息中心。第五条电子网的主要功能是：（一）为用户及时提供国家及有关部门对食品、副食品生产、经营和进出口的政策、法规，维护市场的正当秩序，减少食品、副食品生产经营的盲目性；（二）通过电子计算机联网，实现产销见面，互通信息以及直接交易，堵住假冒伪劣产品的生产和流通；（三）为政府监控市场、稳定食品、副食品供应提供信息服务。第六条食品电子网采取网员制。第二章电子网络的服务方式和内容第七条电子网提供的信息内容包括：（一）国家和各部委有关食品、副食品生产、市场的政策法规和行业发展介绍；（二）全国各地粮油、肉、蛋、菜及加工食品、副食品的市场行情和价格动态；（三）全国１００多家重点批发、零售食品、副食品商业企业的销售统计月报和市场分析；（四）全国各省级商贸主管部门的肉、蛋、糖副食品价格月报表及价格分析；（五）全国大中城市主要牌号名酒、名烟价格月报及分析。第八条电子网为网员提供的服务包括：（一）网员可每日上网登录本单位商品供求信息和商情；（二）为每个网员建立电子信箱，开展电子邮件服务；（三）建立网员企业和产品的电子档案，为网员和客户提供查询等中介服务。（四）开展代理购销、代理结算等电子商务服务。第三章网员及其权利与义务第九条遵守本办法的食品生产、加工、经营企业及有关管理部门申请并经电子网络总站批准后，可成为正式网员。第十条每个网员单位要指定专人负责本单位的具体工作。第十一条网员的权利是：（一）参加电子网的各项活动；（二）享有电子网提供的各种服务；（三）对电子网的工作提出意见和建议；（四）参加电子网提供的有关培训。第十二条网员的义务是：（一）遵守电子网的有关规定；（二）自觉维护电子网的利益，提供真实、可靠的上网信息；（三）按规定缴纳入网费。第四章组织与管理第十三条国内贸易部商业信息中心市场指导部承担电子网的具体管理和运行。其主要职责是：（一）规划电子网的运行方式和内容并负责实施和运行；（二）负责网员入网及退网的具体事宜；（三）起草电子网的管理制度与办法；（四）出版发行网刊《食品经营导刊》；（五）收集有关食品市场的国家法规和市场行情，加工处理有关食品市场信息。第十四条电子网定期或不定期召开网员工作会议，研讨电子网的工作内容，评比网员工作业绩。对工作业绩突出的，给予奖励，并在网上通报表扬；对工作有问题的，提出改正意见并限期改正。第十五条对违反国家政策及有损电子网行为的网员，在网上通报批评，直至取消网员资格。第五章附则第十六条本办法由国内贸易部商业统计管理办公室负责解释。第十七条本办法自发布之日起施行。附：全国食品流通电子网络第一批成员名单１、北京市清真公司２、北京市东城区糖业烟酒公司３、北京市宣武区糖业烟酒公司４、北京市东方友谊食品配送公司５、北京市西郊食品冷冻厂６、北京西单购物中心７、北京西单菜市场８、北京地安门副食商场９、北京北太平庄副食商场１０、北京鑫帝大厦１１、北京银地大厦１２、天津市食品公司１３、天津市糖业食品公司１４、天津市贵阳路副食商场１５、天津河西区佟楼副食综合商场１６、天津市宏海商贸总公司三号路菜市场１７、天津大天津食品商厦１８、天津市宝林祥食品公司１９、天津市东海食品商厦２０、天津市官银号副食商２１、山西省糖酒副食公司２２、山西太原市副食市场２３、内蒙食全食美股份有限公司２４、内蒙包头食品世界２５、辽宁大连糖酒副食品集团公司２６、辽宁沈阳皇姑副食商场２７、吉林长春市糖酒集团公司２８、吉林白山市糖酒副食品采购供应站２９、吉林长春市副食品集团公司桂林商场３０、吉林长春市永昌副食品公司永昌商场３１、吉林吉林市蔬菜副食品公司龙华副食品市场３２、吉林通化市新华副食品商场３３、吉林白山市副食品商场３４、吉林延吉市解放路副食品商场３５、黑龙江哈尔滨市第一食品商场３６、黑龙江哈尔滨道里菜市场３７、黑龙江哈尔滨奋斗副食品商场３８、黑龙江齐齐哈尔市副食品中市场３９、黑龙江佳木斯市茶菜公司佳西商店４０、黑龙江大庆市龙凤购物中心４１、上海龙华食品公司４２、上海市食品（集团）公司沪东蛋品公司４３、上海市捷强烟草糖酒集团连锁公司４４、上海市捷强烟草糖酒集团配销中心４５、上海市蔬菜总公司第二分公司４６、上海市蔬菜总公司绿苑配销公司４７、上海市第一食品商店股份有限公司４８、上海市第二食品商店４９、上海市第三食品商店５０、上海市第六食品商店５１、上海市第八食品商店５２、上海大祥食品（集团）公司大祥分公司５３、上海市老西门冠生园食品公司５４、上海星火日夜实业公司５５、上海长春（集团）燎原食品公司５６、上海愚园食品经营公司５７、上海市虹口区三角地菜场５８、上海绿鹿实业公司５９、上海市八仙桥副食品商场６０、上海崂山副食品商场６１、上海市静安区陕西北路菜场陕北超市６２、上海亚细亚食品（集团）公司６３、上海家乐超市连锁公司６４、上海宁东食品分公司６５、上海四季情商厦６６、上海北斗星商苑６７、江苏南京市糖烟酒公司６８、江苏常州市糖烟酒股份有限公司６９、江苏南京市鼓楼食品商场７０、江苏徐州市副食品大楼７１、浙江宁波市糖业烟酒批发公司７２、浙江杭州市采之斋食品有限公司７３、浙江杭州市永安商厦（原食品商店）７４、安徽马鞍山市糖业烟酒公司７５、安徽安庆市糖业烟酒采购供应站７６、安徽宿县地区食品公司７７、安徽宿县地区糖酒公司７８、安徽六安地区糖酒采购供应站７９、福建福州市糖酒副食品批发公司８０、福建厦门市糖酒副食品批发公司８１、福建漳州市糖酒副食品采购供应站８２、福建福州市台江副食品公司８３、江西省糖酒副食品总公司８４、江西新余市糖酒副食品总公司８５、山东烟台糖酒茶副食品总公司８６、山东淄博糖酒茶副食吕公司８７、山东莒南县食品总公司８８、河南安阳市糖业烟酒公司８９、河南南阳市副食品公司９０、河南郑州市花园春有限公司９１、河南郑州市刘胡兰有限公司９２、湖北省糖酒副食品总公司９３、湖北荆门市糖酒副食品公司９４、湖北武汉市毓华商厦（原建新公司）９５、湖南长沙市食品公司９６、湖南株州市糖酒副食品采购供应站９７、湖南湘潭市南北特产食品总公司９８、湖南岳阳市副食品公司批发公司９９、湖南郴州市糖酒副食品总公司１００、湖南益阳市糖酒副食品总公司１０１、湖南长沙市糖酒副食品公司国风商场１０２、湖南长沙市糖酒副食品公司怡丰商１０３、湖南长沙市糖酒副食品公司沙星食品店１０４、广东省糖烟酒集团公司１０５、广东佛山市食品企业集团１０６、广东湛江市糖烟酒总公司１０７、广东东莞市食品公司１０８、广东广州市副食品公司十甫商店１０９、广西柳州中糖股份有限公司１１０、广西柳州市柳州自选商场１１１、海南省食品公司１１２、海南省糖烟酒公司１１３、四川宜宾县糖酒公司１１４、四川成都市红旗商场１１５、贵州省糖业烟酒总公司１１６、贵州贵阳市食品商场１１７、云南省食品公司１１８、云南省糖业烟酒蔬菜公司１１９、云南玉溪地区糖业烟酒副食品公司１２０、云南昆明副食品大楼１２１、陕西咸阳市糖酒副食品公司１２２、陕西延安地区副食品公司１２３、陕西商洛地区糖酒副食品公司１２４、陕西西安市食品店１２５、甘肃省食品公司１２６、甘肃兰州市食品公司１２７、甘肃兰州市糖酒副食采购供应站１２８、甘肃天水市糖酒副食采购供应站１２９、甘肃省食品购物中心１３０、甘肃省糖酒副食公司商场１３１、甘肃兰州市蔬菜公司酒泉路副食商场１３２、青海省肉食品集团公司１３３、青海省糖酒副食品总公司１３４、青海西宁市解放副食品商场１３５、宁夏区糖酒副食品总公司１３６、宁夏银川丽华商场１３７、新疆区食品总公司１３８、新疆区糖酒副食品总公司１３９、新疆乌鲁木齐市食品公司１４０、新疆乌鲁木齐市蔬菜副食品总公司１４１、新疆阿克苏地区糖酒副食品总公司１４２、新疆石河子市糖业烟酒公司１４３、新疆乌鲁木齐市大十字糖酒商厦１４４、新疆兵团糖酒副食品公司１４５、新疆兵团农四师商业处糖烟酒公司１４６、新疆兵团农七师商业处糖烟酒公司,食品 食品 食品 食品 食品 食品 食品 食品 食品 用户 食品 食品 食品 食品 食品 食品 食品 食品 入网 食品 食品 食品 食品 食品 食品 食品 食品 食品 食品 食品 食品 食品 食品 食品 食品 食品 食品 食品 食品 食品 食品 食品 食品 食品 食品 食品 食品 食品 食品 食品 食品 食品 食品 食品 食品 食品 食品 食品 食品 食品
