,word,counts
69,重庆大学 附属 肿瘤医院 高层次 人才 统战 人士 座谈会 领导 职能部门 负责人 高层次 人才 统战 人士 代表 参加 座谈会 会议 党委 书记 张维 主持 张维 通报 医院 年度 学科建设 人才 统战工作 成绩 阐述 高层次 人才 统战 人士 医院 发展 作用 意义 鼓励 要紧 医院 发展 步伐 医院 高质量 发展 添砖加瓦 奉献 一份 力量 座谈会 围绕 临床 工作 平台 建设 科研 转化 科研 支持 教学 工作 展开 热烈 讨论 建言献策 相关 职能部门 负责人 听取意见 建议 面对面 交流 会后 整改 主动 回应 关切 党委书记 吴永忠 发言 思路清晰 直面 会后 医院 行政 职能部门 梳理 研究 采纳 落实 工作 提高 医院 人才 服务水平 扩展 医院 人才 服务 内涵 人才 推动 医院 发展 核心 竞争力 创新 驱动力 职能部门 牢固 树立 服务 意识 全力支持 服务 人才 工作 科主任 加大 人才 团队 培养 力度 科创 成果 利用 全国 科普 教育 基地 平台 科创 科普 两手抓 推动 科普 产品 切实 提升 医院 影响力 青年 人才 医院 科室 三者 关系 带头 立足 岗位 苦练 本领 锐意 创新 努力 学科 发展 生力军,1
70,下午 自动化 学院 党委 在线 年度 党支部 书记 述职 考核 大会 自动化 学院 党委书记 林景栋 主持会议 自动化 学院 党委委员 组织 党支部 书记 参会 林景栋 党支部 书记 述职 考核 指出 党支部 书记 党支部 建设 支部 工作 党务工作 落地 发挥 作用 党支部 书记 述职 考核 支部书记 履职 能力 检验 党支部 建设 体检 对照 考核 思考 学院 党支部 支部书记 履职 情况 原因 分析 一步 工作 思考 顺序 依次 述职 林景栋 本次 会议 指出 本年度 学院 党建 工作 离不开 党支部 书记 辛勤工作 特别 学习 宣传 贯彻 二十大 精神 疫情 防控 党支部 建设 三会 一课 制度 落实 各支部 学校 学院 党委 扎实 组织 相关 工作 后续 工作 思考 提升 党支部 书记 履职 能力 不断加强 党建 工作 中心 工作 深度 融合 更好 发挥 党建 引领 作用 推动 学院 更好 发展,1
71,近日 中国 科学技术 信息 研究所 机构 联合 研制 期刊 评价 报告 世界 期刊 影响力 指数 报告 科技版 简称 报告 发布 重庆大学 科技期刊 入选 重庆大学 学报 土木 环境 工程学 中英文 纳米材料 科学 英文 镁合金 学报 英文 地下 空间 工程学 西部 人居 环境 学刊 中国 药房 报告 期刊 分类 评价 分类 体系 借鉴 国际 数据库 分类 基础 前瞻性 实用性 评价 期刊 划分 学科 类别 中外 期刊 实行 统一标准 学科 定量 评价 报告 年版 来源 期刊 中国 期刊 中国 期刊 指数 均值 世界 第九 学校 科技期刊 入选 标志 学校 高水平 学术期刊 培育 建设 不断进步 期刊 社将 面向世界 对标 一流 追求 卓越 目标 着力 打造 期刊 国际化 专业化 数字化 集约化 品牌化 建设 持续 推动 学术期刊 高质量 发展,1
72,上午 重庆大学 海内外 青年 学者 秋季 论坛 数据 软件 学院 论坛 线上 方式 美国 澳大利亚 中国香港 青年 学者 网络 视频会议 齐聚大 数据 软件 学院 分会场 聚焦 学术 科研 最前沿 交流 学术研究 最新 动态 成果 学院 党政领导 学术 委员会 委员 系主任 相关 教师 参加 论坛 论坛 由大 数据 软件 学院 院长 刘铎 教授 主持 数据 软件 学院 党委书记 文俊浩 教授 代表 学院 参会 海内外 青年 学者 热烈欢迎 文俊浩 介绍 学校 学院 情况 特别 介绍 学院 人才 引进 政策 学校 领导 支持 数据 软件 学院 聚焦 国家 软件 发展 战略 凝练 学科 特色 培养 科研 创新能力 强化 人才 引进 措施 各项事业 蓬勃发展 软件工程 学科 排名 全国 文俊浩 热烈 邀请 青年 学者 加盟 学院 投身于 国家 特色化 示范性 软件 学院 建设 我国 软件产业 数据 人工智能 产业 科研 人才培养 贡献力量 青年 学者 教育 科研 经历 研究成果 未来 研究 规划 精彩 报告 与会 专家教授 青年 学者 研究 方向 丰硕 成果 提出 感兴趣 展开 热烈 讨论 交流 刘铎 发言 希望 论坛 举办 契机 海内外 青年 学者 搭建 学术交流 成果 展示 平台 进一步 互联互通 人才 汇聚 世界 内吸揽 优秀青年 人才 充实 国家 特色化 示范性 软件 学院 师资队伍 加速 学院 发展 学校 一流 建设 国家 特色化 示范性 软件 学院 发展 提供 创新 动力,1
73,近日 我国 民主党派 全国代表大会 圆满 闭幕 重庆大学 同志 当选 民主党派 新一届 中央委员 分布 民主党派 民盟重庆市委 主委 沙区 区委 主委 科学院 王林 教授 民盟重庆市委 常委 委员会 主委 物理 学院 院长 吴兴 教授 当选 民盟中央 委员 民建 重庆市委 主委 总支 主委 财务处 处长 清泉 教授 当选 民建 中央委员 中国工程院 院士 重庆市 科协 主席 重庆大学 材料 学院 潘复生 教授 当选 九三学社中央 委员 台盟 重庆市委 主委 肿瘤医院 吴桂英 当选 台盟中央 委员 一届 民主党派 中央委员 我校 同志 当选 分布 党派 民进 刘占芳 教授 九三学社 潘复生 院士 杨丹 教授 王林 吴兴 清泉 钟代笛 曾忠 赵良举 魏子栋 马欣 同志 代表 参加 党派 全国代表大会,1
74,近日 经报 中央 批准 重庆市政协 近期 履职 贡献奖 评选 表彰 工作 重庆大学 外语学院 彭静 教授 建筑 城规 学院 铁军 教授 获评 优秀 市政协 委员 历届 现任 市政协 委员 中共 获此 殊荣 科学院 王林 教授 提升 重庆 突发事件 商品 应急 保供 能力 建议 经管 学院 周孝华 教授 加快 推进 我市 建设 国际 金融中心 建议 建筑 城规 学院 铁军 教授 编制 重庆市 传统 村落 保护 条例 建议 优秀 提案 第五届 市政协 立案 提案 中共 评选 优秀 提案,1
75,下午 首届 长江上游 生态 检察 论坛 重庆市 公益 诉讼 检察 研究 基地 线上 会议 直播 形式 重庆市 人民检察院 党组 成员 副检察长 梁田 重庆大学 副校长 李剑 中国法学会 环境 资源 法学 研究会 副会长 陈德敏 出席会议 致辞 全市 检察机关 公益 诉讼 检察干警 重庆大学 法学院 师生 社会 人士 观摩 会议 直播 重庆市 人民检察院 党组 成员 副检察长 梁田 梁田 致辞 指出 二十大 报告 提出 检察机关 法律 监督 工作 完善 公益 诉讼 制度 公益 诉讼 发展 检察 公益 诉讼 工作 指明 方向 完善 公益 诉讼 制度 立法 实践 关键 理论 研究 支撑 公益 诉讼 理论 研究 学界 司法 实务 部门 发力 希望 基地 进一步 发挥 理论 研究 平台 作用 基地 研究员 进一步 发挥 引领 示范作用 全市 公益 诉讼 检察干警 特别 专业 团队 成员 进一步 发挥 公益 诉讼 检察调研 主力军 作用 勤思 善思 善写 带动 全市 公益 诉讼 理论 研究 迈上 新台阶 重庆大学 副校长 李剑 李剑 发表 致辞 希望 切实 发挥 重庆市 公益 诉讼 检察 研究 基地 作用 检校 共享 合作 努力 打造 全国 影响力 公益 诉讼 人才培养 基地 教育 基地 实践 基地 为筑牢 长江上游 生态 屏障 建设 山水 美丽 之地 提供 司法 保障 发展 完善 中国 特色 公益 诉讼 制度 法治 轨道 推进 国家 治理 体系 治理 能力 现代化 贡献力量 中国法学会 环境 资源 法学 研究会 副会长 陈德敏 陈德敏 致辞 希望 本次 论坛 契机 推动 西部 开发 法律 专业 委员会 公益 诉讼 检察 研究 基地 长江上游 地区 检察机关 通力合作 为筑牢 长江上游 生态 屏障 提供 更好 司法 实践 理论 研究 推进 长江 经济带 发展 生态 文明 建设 提供 智力 支持 作出 贡献 会上 最高人民检察院 第八 检察厅 副厅长 徐全兵 中国政法大学 法治 政府 研究院 教授 刘艺 贯彻落实 二十大 精神 推动 构建 中国 特色 公益 诉讼 制度 中国 检察 环境 公益 诉讼 成效 为题 主旨 报告 长江上游 省区市 青藏 川黔 检察机关 代表 围绕 生态 检察工作 发言 重庆市 公益 诉讼 检察 研究 基地 举办 检察 公益 诉讼 五周年 主题 征文活动 获奖 作者 代表作 交流 发言 研究 基地 研究员 重庆大学 教授 宋宗宇 研究 基地 研究员 重庆市 人民检察院 法律 政策 研究室 主任 朱刚 参加 会议 阶段 重庆大学 法学院 院长 黄锡生 重庆大学 生态 法治 研究 中心 主任 秦鹏 重庆市 人民检察院 检察 五部 主任 彭劲荣 主持 本次 会议 重庆市 人民检察院 重庆大学 共建 公益 诉讼 检察 研究 基地 中国法学会 环境 资源 法学 研究会 西部 开发 法律 专业 委员会 主办 重庆市 人民检察院 检察 五部 重庆大学 法学院 承办 重庆大学 生态 法治 研究 中心 协办,1
76,下午 数据 软件 学院 党委 采用 线上 会议 方式 党支部 书记 基层 党建 工作 述职 评议会 会议 由大 数据 软件 学院 党委书记 文俊浩 主持 党委委员 教职工 支部书记 学生 支部书记 共计 参加 本次 述职 评议会 文俊浩 介绍 本次 述职 评议 考核 工作 考核内容 述职 工作 学习 贯彻落实 习近平 时代 中国 特色 思想 二十大 精神 情况 基层 党建 服务 疫情 防控 基层 治理 乡村 振兴 科研 攻关 中心 发挥 党支部 党员 作用 情况 落实 基层 党建 重点 情况 对标 增强 党组织 政治 功能 组织 功能 短板 措施 四个 考核 教工 党支部 学生 党支部 共计 支部书记 年度 基层 党建 工作 情况 述职 报告 介绍 支部 概况 对照 七个 支部 工作 提出 支部 一步 整改措施 计划 一位 支部书记 述职 结束 文俊浩 各支部 党委委员 履职 情况 改进 措施 现场 点评 努力 方向 提出 建议 意见 党委委员 现场 述职 平时 工作 情况 支部书记 党建 工作 测评 文俊浩 党支部 书记 一年 工作 肯定 期望 一年 各支部 支部 建设 七个 进一步 发挥 党员 先锋 模范 党支部 堡垒作用 立足本职 党建 工作 引领 学习 贯彻落实 二十大 精神 融入 支部 工作 方方面面 建设 国家级 特色化 示范性 软件 学院 贡献力量,1
77,学校 党委 党委 常委会 会议 形式 年度 二级 党组织 书记 基层 党建 工作 述职 评议会 教育部 党建 工作 联络员 西南 大学 党委 书记 徐晓黎 指导 会议 由校 党委书记 舒立春 主持 校长 中国工程院 院士 王树 校领导 参会 会上 现场 述职 二级 党组织 书记 汇报 一年 基层 党建 从严治党 工作 第一 责任人 履职 尽责 情况 述职 一述 一评 方式 分管 校领导 党委书记 二级 党组织 逐一 点评 舒立春 指出 一年 学校 成功 第十四次 党代会 时代 党建 双创 工作 推进 党组织 广大党员 干部 疫情 防控 人才培养 学科建设 科学研究 队伍 建设 对外开放 资源配置 管理 服务 重点 工作 彰显 责任 担当 充分发挥 基层 党组织 堡垒作用 党员 先锋 模范作用 述职 书记 工作 体检 生动 党建 交流 一步 工作 奠定 良好基础 舒立春 二十大 报告 首次 教育 科技 人才 一体化 部署 赋予 教育 工作 战略地位 历史使命 学校 党委 始终 习近平 时代 中国 特色 思想 指导 深刻 领悟 两个 确立 决定性 意义 增强 四个 意识 坚定 四个 自信 两个 维护 团结 带领 全校师生 员工 奋发有为 精神 谱写 学校 高质量 发展 新篇章 学习 贯彻 二十大 精神 学校 工作 领导 强化 党组织 政治 功能 组织 功能 不折不扣 贯彻落实 党中央 决策 部署 习近平 总书记 教育 论述 高质量 党建 引领 学校 高质量 发展 二要 立足 两个 大局 胸怀 国之大者 抓好 基层 党组织 建设 服务 学校 中心 人才培养 学科 发展 科学研究 队伍 建设 发挥 基层 党组织 党员 作用 三要 中心 发展 思想 强化 导向 效果 导向 党建 发扬 斗争 精神 增强 忧患意识 奋力 答好 单位 必答题 切实 师生员工 贯彻落实 二十大 精神 成效 校党委 常委 党委委员 纪委 委员 全国 人大代表 党群 部门 负责人 二级 党组织 书记 基层 党支部 书记 教师 代表 余人 参加 评议会 会后 参会 人员 采用 无记名 方式 二级 党组织 书记 履职 情况 评议 考核,1
78,校党委 第十次 理论 学习 中心组 学习 学习 二十大 报告 专题学习 习近平 治国 理政 第四卷 相关 内容 党委书记 舒立春 主持 学习 讲话 校长 王树 校党委 理论 学习 中心 组成员 参加 学习 围绕 习近平 总书记 全过程 民主 依法治国 论述 工作 体会 一步 贯彻落实 工作 王树 指出 二十大 报告 第七 依法治国 推进 法治 中国 建设 首次 专章 形式 法治 建设 部署 充分体现 习近平 同志 核心 党中央 依法治国 高度重视 彰显 法治 建设 国家 治理 地位 越来越 围绕 努力 法治 中国 建设 贡献 力量 主题 一要 法治 宣传教育 担当 大学 使命 组织 专家学者 研究 阐释 宣传 工作 推进 习近平 法治 思想 二十大 法治 建设 论述 部署 教材 课堂 头脑 发挥 大学 优势 发动 师生 参加 普法 相关 社会 实践 志愿 服务 活动 深入基层 社区 法治 宣传教育 弘扬 法治 精神 二要 服务 法治 中国 建设 做出 大学 贡献 进一步 法学 学科建设 推动 法学 信息 学科 医学 学科 人文学科 交叉 融合 支持 相关 专家 发挥 专业 特长 积极参与 我国 领域 立法 司法 执法 理论 实践 研究 抢抓 机遇 大胆 领域 方向 努力 打造 特色 优势 推进 法治 中国 建设 做出 更大 贡献 三要 提升 依法 治校 水平 大学 前列 推进 依法 治校 关键 贯彻 教育方针 不断加强 学校 工作 领导 认真贯彻 执行 党委 领导 校长 负责制 聚焦 一流 建设 育人 本位 学术 导向 持续 深化 内部 治理 结构 改革 创新 治理 理念 方法 加快 建立 中国 特色 大学 制度 大学 治理 体系 治理 能力 现代化 舒立春 聚焦 二十大 精神 习近平 总书记 重要讲话 精神 专题学习 深刻 领悟 时代 十年 民主 政治 法治 建设 丰硕成果 坚定不移 发展 全过程 民主 坚定不移 中国 特色 法治 道路 立足本职 工作 创新 形式 法治 思维 法治 方式 推进 学校 改革 发展 谱写 时代 民主 办学 依法 治校 新篇章 健全 决策 机制 完善 治理 结构 着力 民主 科学 之治 完善 党委 领导 校长 负责制 核心 领导 体制 治理 体系 进一步 完善 学术 委员会 核心 学术 治理 体系 深化 校院 两级 管理 体制改革 落实 学院 办学 主体 责任 健全 法律顾问 制度 发挥 教职工 代表大会 制度 学生 代表大会 制度 作用 推进 决策 管理 科学化 民主化 法治化 保障 师生 依法 学校 章程 有序 参与 学校 管理 二要 构建 系统 完备 规章制度 体系 着力 良法 之治 提高 制度 供给 水平 制度 建设 质量 学校 章程 核心 制度 体系 推进 规章制度 管理 信息化 公开化 畅通 校领导 接待日 渠道 听取 师生 意见建议 依法 解决 师生 诉求 三要 持续 深化 普法 宣传 着力 提高 法治 教育 之效 贯彻落实 学校 八五 普法 实施方案 宪法 教育 核心 法治 教育 健全 领导 干部 师生 学法 制度 法治 理论 研究 阐释 推进 精准 普法 引导 干部 师生员工 法治 忠实 崇尚 自觉遵守 坚定 捍卫者 时代 征程 建设 现代化 重庆 中国式 现代化 推进 中华民族 复兴 作出 重大贡献 力量 会上 认真学习 纪检监察 部门 提供 学习 内容 提出 本次 学习 以线 会议 形式 腾讯 会议 校办 统战部 纪检监察 部门 巡视 学工部 工部 保卫部 机关党委 虎溪 党工委 工会 校团委 发规处 离退休 党委 负责同志 列席会议 参加 学习,1
79,日至 中国 信息 协会 主办 北京大学 发起 第十六届 大学生 创新 创业 大赛 线上 重庆大学 推荐 项目 克服 疫情 影响 一个月 一对一 项目 专题 辅导 激烈 竞争 斩获 一等奖 全国 二等奖 全国 三等奖 一等奖 获奖 数量 全国 第一 历史 成绩 学生 清华大学 高校学生 荣获 创新 之星 学校 荣获 优秀 组织 单位 创新 赛道 许耘 负责 能量 张鹏浩 负责 厚积薄发 杨国林 负责 冰语 张炳飞 负责 电连 科技 薛梓心 负责 自然 之眼 斩获 一等奖 全国 创业 赛道 谢涵宇 负责 一脉相传 斩获 一等奖 全国 博云 科技 微振天 微分 科技 喜获 二等奖 悬壶 脊世 同行 锦心 觉示 艺织 独绣 喜获 三等奖 第十二届 大学生 创新 创业 大赛 一等奖 获得者 陈丹 始终 创新 创业 创造 荣获 年度 创新 之星 大学生 创新 创业 大赛 北京大学 发起 秉承 自信 梦想 精神 旨在 发现 培养 高校 潜力 创新 创业 优秀青年 人才 本届 大赛 首次 设置 创新 赛道 创业 赛道 设立 分赛区 吸引 全国 高校 项目 参与,1
80,教育部 港澳台 事务 办公室 关心 支持 重庆大学 内地 港澳 大中小学生 师生 交流 计划 项目 万人 计划 第三届 风雅 传统 文化 体验 线上 方式 顺利 重庆大学 港澳台 办公室 主任 黄河 出席 开营 仪式 致辞 黄河 给予 本次 活动 大力支持 教育部 单位 衷心 感谢 参加 本次 活动 同学 热烈 勉励 同学 体验 加深 祖国 传统 文化 将来 学习 研究 进一步 相互 合作 交流 期待 相聚 重庆 未来 本次 体验 内容 形式多样 涵盖 巴渝 历史 文化 川剧 脸谱 知识 制作 中国戏曲 精神 川剧 艺术 鉴赏 讲座 川剧 绝活 川剧 赏析 我学 川剧 造型 学唱 川剧 戏歌 专家 详实 介绍 细致 讲解 精彩 展示 表演 同学 品味 风雅 领略到 传统 文化 之美 专家 讲授 互动 深受 港澳 学生 喜爱 同学 踊跃 点赞 川剧 艺术 音乐 专家 探讨 体验 营由 重庆大学 港澳台 办公室 重庆大学 教育部 川剧 文化 传承 保护 基地 联合 举办 澳门大学 香港中文大学 重庆 剧院 大力支持,1
81,近日 科爱 期刊 大奖 评出 年度 杰出 成就奖 重庆大学 英文 期刊 镁合金 学报 英文 纳米材料 科学 英文 荣获 奖项 本次 评奖 标准 排名 相关 学科 领域 共有 期刊 奖项 镁合金 学报 英文 中国科学院 文献 情报中心 期刊 分区 位于 期刊 大类 重庆大学 英文 期刊 入选 学校 英文 期刊 国际 学术 影响力,1
82,近日 重庆市 科学技术 协会 发布 资助 建设 高水平 科技 社团 高品质 科技期刊 通知 科协 公示 年度 重庆市 科协 资助 建设 高水平 科技 社团 高品质 科技期刊 名单 重庆大学 期刊 入选 高品质 科技期刊 名单 镁合金 学报 英文 重庆大学 学报 土木 环境 工程学 中英文 纳米材料 科学 英文 西部 人居 环境 学刊 地下 空间 工程学 中国 药房 高品质 科技期刊 评选 自愿 申报 第三方 评估 科协 党组 研究 入选 高品质 科技期刊 项目 建设 单位 予以 专项经费 资助 重庆大学 入选 期刊 入选 期刊 高品质 科技期刊 入选 彰显 我校 科技期刊 学术 引领 期刊 品牌 影响力 推动 我市 科技期刊 持续 发展 作出贡献,1
83,学校 腾讯 会议 形式 年度 学院 考评 工作 学院 工作 考评 党委书记 舒立春 校长 中国工程院 院士 王树 校领导 班子成员 出席 会议 学院 负责人 相关 职能 部处 负责人 参加 会议 会议 副校长 邓绍江 主持 邓绍江 介绍 考评 相关 情况 指出 考评 形式 学院 工作 评价 考核 更是 交流 学院 学科 之间 交流学习 平台 相互了解 发展 情况 工作 特色 学习 借鉴 取长补短 考核 差别 评价 要严 标准 严格考核 解决 一个样 干多 干少 一个样 导向 发现 分析 解决问题 不断改进 提升 工作 效能 推动 学校 高质量 发展 学院 负责人 依次 工作汇报 学院 高度重视 充分准备 围绕 学院 党的建设 人才培养 科学研究 队伍 建设 国际交流 合作 展开 汇报 工作 学院 汇报 结束 邓绍江 代表 学校 学院 一年 付出 努力 表示感谢 成绩 表示祝贺 希望 学院 领导班子 成员 把握 机遇 谋划 立德 人为 加快 推动 学校 一流 内涵 建设 特色 建设 高质量 建设 考评组 成员 学院 负责人 工作汇报 学院 学科建设 关键 指标 情况 本年度 工作 学院 工作 综合 评价,1
