,word,counts
48,重庆大学 学习 贯彻 习近平 总书记 教育 论述 全面落实 立德 根本任务 思想 政治 教育 贯穿 人才培养 全过程 着力 发挥 每门 课程 育人 作用 体系化 科学化 特色化 推进 课程 思政 建设 各类 课程 思政 课程 同行 努力 培养 堪当 民族 复兴 重任 时代 新人 完善 工作 机制 唱响 立德 主旋律 成立 党委书记 校长 担任 组长 课程 思政 建设 工作 领导小组 统筹 推进 全校 课程 思政 建设 学校 党委 常委会 校长 办公会 定期 研究 相关 工作 经常性 组织 课程 思政 专题 推进 三全 育人 工作 例会 着力 构建 党政 齐抓共管 本科生 牵头 相关 部门 联动 院系 落实 推进 教师 全员 参与 课程 思政 建设 工作 格局 课程 育人 学校 三全 育人 综合 改革 工作 重点 分类 梳理 教学 科研 实验 技术 七类 岗位 育人 职责 纵深 打造 教室 实验室 图书馆 宿舍 食堂 场馆 六大 育人 阵地 制定 课程 育人 体系 建设 方案 课程 思政 建设 实施办法 课程 思政 教学 指导 手册 课程 思政 建设 目标 优化 实施 机制 努力 确保 建设 成效 探索 建立 科学 多元 课程 思政 建设 评价 标准 教学 设计 挖掘 转化 测评 指标 纳入 评课 评教 体系 年度 工作 考核 绩效 工资 核定 专业 技术 职务 评聘 工作 课程 思政 专任教师 岗位职责 重点 考核 评价 推动 教师 课程 承担 育人 责任 守好 一段 种好 责任田 分类 推进 抓牢 课程 建设 主战场 持续 推进 习近平 时代 中国 特色 思想 三进 工作 实施 专题 课程 建设项目 评选 优秀 案例 探索 优化 课程 思政 建设 内容 途径 载体 系统 梳理 各类 课程 蕴含 思想 政治 教育 元素 纳入 教学大纲 教案 课程 讲授 重点 内容 学生 考核 关键 知识 汇编 重庆大学 课程 育人 元素 拾萃 营造 门门 思政 课课 特色 浓厚 氛围 公共 基础 课程 实施 专家 领衔 组建 名师 教学 团队 鼓励 跨校 联合 授课 地域 特色 建设 红岩 精神 大国 工匠 特色 课程 开设 文明 经典 课程 引导 学生 世界 文明 宏观 视野 把握 世界 大势 理解 中华民族 复兴 逻辑 专业 教育 课程 融入 家国 情怀 社会 责任 科学家 精神 人文精神 职业 素养 元素 整理 编撰 课程 思政 教案集 认定 校级 课程 思政 示范课 获批 市级 课程 思政 示范 项目 数理统计 土建 概论 研讨 入选 教育部 课程 思政 示范 课程 教师 入选 教育部 课程 思政 教学 名师 教学 团队 实践 课程 注重 知行合一 推进 实践 教学改革 课程 入选 国家级 社会 实践 一流 本科课程 推行 第二课堂 成绩单 制度 青年 红色 筑梦之旅 创新 创业 树声 志愿 服务 启邦 社会 实践 熔炉 深造 就业 扬帆 四大 实践 载体 拓展 实践 育人 平台 引导 大学生 实践 熔炉 中受 教育 才干 作贡献 深化改革 创新 夯实 课堂教学 主渠道 实施 教育 教学 创新 计划 修订 本科课程 建设 规范 研究生 课程 教学管理 办法 课程 思政 贯穿 课堂 授课 教学 研讨 实验 实训 作业 论文 环节 开发 教学资源 建设 课程 思政 案例库 共建 共享 余个 课程 思政 教学 优秀 案例 开通 时代 高校 课程 思政 数据库 教师 提供 思政 元素 教学 案例库 名师 视频 课程 教学资源 学校 课程 思政 教学研究 中心 获批 市级 课程 思政 教学研究 示范 中心 重视 教材 建设 科学 编排 有机 融入 切实增强 思政 元素 融入 课程 教材 准确性 系统性 强化 课程 思政 理论 研究 设立 课程 思政 教育 教学改革 专项 完善 培训 立项 评选 工作 机制 立项 课题 参与 教师 余人 广泛开展 学院 跨专业 课程 思政 建设 改革 教学 研讨 活动 探索 思政课 教师 学科专业 教师 合力 育人 机制 马克思主义 学院 会同 材料科学 工程学院 联合 开设 学术论文 写作 课程 科研 报国 学术 道德 融入 课堂教学 提升 教育 教学质量 效果 课程 思政 教学情况 专项 检查和 指导 推动 专业 教育 思政 教育 有机 融合 协同 育人 注重 能力 提升 建强 教师队伍 主力军 发挥 国家级 教师 教学 发展 中心 作用 课程 类型 面向 学校 课程 教师 课程 思政 能力 培训 组织 课程 思政 教学 工作坊 研修 活动 鼓励 支持 学院 课程 专业 课程 思政 能力 培训 面向 重庆市 高校 开设 课程 思政 研修班 培训 学员 余人 课程 思政 建设 岗前 培训 课程 轮训 骨干 研修 内容 提升 教师 课程 思政 意识 能力 打造 立德 专题 展览馆 网上 展馆 珍贵 口述 史料 教案 工作 笔记 实物 资料 生动 教材 展示 历代 献身 教育 事业 潜心 治学 治教 优良传统 编印 出版 大学 大师 之谓 重庆大学 教授 概览 发挥 榜样 先进事迹 教育 示范作用 加大 政策 引导 激励 评选 表彰 课程 思政 优秀 案例 优秀 教案 健全 教师 教学 荣誉 体系 教学 比赛 评审 体系 设置 课程 思政 相关 指标 鼓励 支持 教师 教学 实践 挖掘 思想 政治 教育 元素 努力 知识 传授 价值 引领 统一 润物无声 育人 效果 提高 人才培养 质量 二维码 打开 原文 链接,1
49,西部 重庆 科学城 重庆大学 科学 中心 建设项目 正式 开工 市政府 市长 西部 科学城 重庆 高新区 党工委 书记 熊雪 市政府 秘书长 凌凡 市委 教育 工委 书记 市教委 主任 黄政 科技局 党委书记 局长 明炬 西部 科学城 重庆 高新区 党工委 书记 管委会 主任 左永祥 高新 开发 集团 党委书记 董事长 杜国平 重庆大学 党委书记 舒立春 重庆大学 校长 中国工程院 院士 王树 校领导 党委 常委 校长助理 出席 开工 活动 高新区 管委会 办公室 改革 发展局 科技 创新 高新 开发 集团 规划 建设部 城市 建设 集团 重庆大学 校办 发规处 基建处 实设 部门 相关 学院 负责人 建设项目 工人 代表 参加 活动 重庆大学 科学 中心 项目 施工现场 熊雪 听取 项目 情况汇报 重庆大学 副校长 重庆大学 西部 重庆 科学城 科学 基础设施 虎溪 建设 指挥部 指挥 刘贵文 介绍 项目 概况 进度 情况 王树 代表 重庆大学 致辞 市委 市政府 高新区 管委会 给予 学校 事业 发展 关心 支持 衷心感谢 项目 顺利 开工 热烈祝贺 重庆大学 建校 年来 扎根 巴渝 大地 办学 始终 重庆 这座 城市 相伴 相随 同行 重庆 发展 作出 贡献 学校 各项事业 迈上 新台阶 王树 指出 建设 西部 科学城 习近平 同志 核心 党中央 国家 发展 大局 成渝 地区 双城 经济圈 建设 作出 决策 部署 重庆大学 主动 需求 对接 顶层 谋划 推动 优化 校区 功能 布局调整 国家 重点 实验室 国家级 平台 依托 建设 重庆大学 科学 中心 集聚 理学 信息 学部 工程 学部 创新 资源 着力 打造 西部 重庆 科学城 核心 阵地 创新 高地 发展 引擎 希望 项目 建设 团队 质量 至上 科学 中心 科学城 标志性 示范 工程 学校 认真学习 贯彻 二十大 精神 市委 市政府 部署 科学 中心 建设 契机 推进 国家级 平台 科研 方向 更新 机制 模式 变革 强化 组织 体系化 科研 创新 引领 带动 学校 科技 创新 西部 科学城 高质量 发展 熊雪 重庆大学 科学 中心 开工 据介绍 西部 重庆 科学城 重庆大学 科学 中心 位于 重庆大学 虎溪 校区 投资 亿元 占地面积 建筑面积 万平方米 项目 探索 国家 战略 科技 力量 新途径 打造 一流大学 支撑 服务区 充分发挥 重庆大学 工科 特色 综合 优势 组织 创新 打造 规模化 集成化 综合化 西部 地区 科技 创新 高地 高校 科技体制 改革 综合 示范区 项目 现有 国家级 平台 核心 板块 构建 载体 推动 相近 学科 相近 领域 整合 优化 构建 先进 制造 智慧 能源 低碳 技术 先进 材料 电子器件 人工智能 前沿 交叉 公共 平台 科学 传播 国家 储能 技术 产教 融合 创新 平台 创新 主体 板块 相互 交叉 协作 创新 环境 引领 支撑 重庆 国家 西部 地区 基础 研究 创新 发展 高端 实验 研究 高地 高端 研究 人才 聚集 高素质 人才培养 高地 基础 前沿 研究 科技 需求 策源地 摄影 吴友华 中建 八局 重庆 分局,1
50,下午 体育 学院 党委 组织 学院 工作 总结暨 干部 述职 考核 学校 党委 宣传部 部长 蒋研川 同志 体育 学院 教职工 参加 会议 会议 体育 学院 党委书记 兴建 同志 主持 兴建 同志 代表 学院 党政领导 汇报 学院 年度 工作 学院 党建 人才培养 学生 工作 队伍 建设 体育竞赛 学生 体测 科研 抗击 疫情 展开 学校 党政 正确 领导 大力支持 我院 学习 贯彻 二十大 精神 省部级 领导 干部 专题 研讨班 讲话 精神 全党全军 全国 各族人民 党建 引领 凝心 力促 发展 各项 工作 台阶 夯实 基础 保证 党政 领导班子 率先垂范 强化 责任 担当 履职 尽责 带领 全院 教职工 饱满 工作 热情 务实 工作作风 克难 奋进 锐意进取 衷心感谢 全院 师生员工 团结奋斗 衷心感谢 学校 部处 体育 学院 工作 支持 展望 到来 充满信心 二十大 我国 体育 文化 事业 发展 部署 广泛开展 全民 健身活动 青少年 体育 工作 群众体育 竞技 体育 发展 加快 建设 体育 强国 学院 党政 领导班子 兴建 李永 落云柯 建华 逐一 一年 廉等 情况 客观 汇报 查找 剖析 提出 努力 方向 真诚地 希望 全院 教职工 开诚布公 指出 学院 领导班子 不足之处 提出 合理化 意见 建议 推动 学院 更好 发展 学院 健康 第一 教育 理念 教学质量 水平 学科建设 突破 群体 活动 品牌 竞技 体育 辉煌 工作思路 师生 日益增长 精神 文化 需求 真抓实干 团结 进取 浓厚 校园 体育 文化氛围 更好 发挥 体育 体育 独特 功能 学校 人才培养 一流 建设 发挥 作用 蒋研川 发表 讲话 学校 工作 安排 民主测评 采用 线上 方式 学院 工作 总结暨 干部 述职 考核 学校 立德 推动 学院 发展 进一步 增强 领导班子 整体 功能 激励 领导人员 时代 担当 学院 党政 领导班子 干部队伍 建设 意义 干部 考核 工作 政策性 原则性 程序性 很强 工作 希望 学校 负责 学院 负责 领导人员 负责 精神 原则 领导班子 领导人员 测评 参会 教职工 学院 领导班子 成员 述职 学院 领导班子 成员 平时 工作 表现 登录 今日 校园 干部 考核 程序 依次 领导班子 领导人员 测评 学院 年度 干部 考核 参评 比例,1
51,日晚 数据 软件 学院 线上 举办 千里 同心 迎新年 跨年 活动 学院 党委书记 文俊浩 书记 萧倩 老师 同学 相聚 跨年 跨年 活动 师生 收看 习近平 主席 发表 二三年 新年贺词 主持人 杨选博 梁彩丽 两位 同学 数据 软件 学院 跨年 活动 正式 文俊浩 代表 学院 致辞 学院 学习 贯彻 习近平 时代 中国 特色 思想 二十大 精神 学院 工作 领导 落实 立德 根本任务 强化 优势 特色 争创 一流 学科 多项 工作 进展 一年 希望 同学 格局 努力奋斗 虚度 大学 时光 共建 辉煌 数据 软件 学院 跨年 活动 第一项 乐趣横生 答题 活动 题目 文化 习俗 主题 同学 感受 新春 之际 浓浓 年味 愉快 轻松 氛围 中国 传统 文化 爆竹声 一岁 春风 送暖 屠苏 故节 当歌守 新年 烛迎 一首首 古典 诗词 这场 活动 增添 一分 古韵 同学 积极参与 听歌 猜曲 唱歌 表演 环节 活动 氛围 推向 高潮 听歌 猜曲 环节 同学 积极参与 抢答 唱歌 表演 环节 凯华 杨杰 张旭 吴子 四位 同学 美妙 歌声 参加 活动 老师 同学 喝彩 李泽坤 杨富 窦一冉 曹真晨 四位 同学 带来 诗朗诵 学习 二十大 奋进 征程 朗诵 回顾 一年 光荣 不凡 学院 学习 贯彻 二十大 精神 之际 展现 学院 学子 自信 自强 踔厉奋发 勇毅 前行 精神风貌 激发 全院 学生 饱满 热情 投入 学习 工作 至此 数据 软件 学院 跨年 活动 顺利 结束 旅程 开启 数据 软件 学院 全体师生 将会 一年 踔厉奋发 勇毅 前行,1
52,上午 计算机 学院 腾讯 会议 线上 年度 中层 领导班子 领导 干部 述职 民主测评 会议 人事处 人才交流 开发 中心 主任 陈滢 干部 考核 工作 组成员 参加 会议 会议 学院 党委书记 杨守 主持 全院 教职工 参会 学院 院长 廖晓峰 代表 学院 班子 党的建设 学科建设 队伍 建设 人才培养 科学研究 交流 合作 年度 述职 报告 指出 学院 习近平 时代 中国 特色 思想 指导 迎接 二十大 学习 宣传 贯彻 二十大 精神 学校 党委 行政 正确 领导 学院 教职工 共同努力 全面落实 立德 根本任务 持续 推进 学院 各项 工作 突破 年度 学院 班子 认真贯彻 习近平 时代 中国 特色 思想 二十大 精神 落实 学校 各项 提升 班子 建设 水平 努力实现 学院 高质量 跨越式 发展 班子成员 杨守 廖晓峰 松涛 向涛 依次 分管 工作 述职 工作 成绩 分析 提出 一步 工作思路 举措 参会 人员 听取报告 学院 领导班子 领导 干部 民主测评,1
53,下午 房地产 管理处 组织 全处 职工 采用 腾讯 线上 会议 形式 年度 领导班子 成员 述职 副校长 刘贵文 学校 干部 考核 组成员 纪检监察 机构 综合 业务室 李慧芳 同志 出席会议 会议 房地产 管理处 处长 邱荣富 主持 邱荣富 代表 房管 领导班子 述职 汇报 年度 房管 领导班子 思想 政治 建设 领导 水平 工作实绩 党风廉政 建设 情况 指出 房地产 管理处 学校 党政 正确 领导 校内外 职能部门 单位 大力支持 围绕 学校 办学 目标 中心 工作 年度 重点 工作 立足 工作 主动 担当 履职 尽责 贯彻落实 学校 第十四次 党代会 精神 着力 提高 学校 房产 资源配置 效率 配套 保障 效益 助力 学校 新一轮 一流 建设 公房 资源 调配 房地产权证 办理 教职工 周转 保障 危房 处置 疫情 防控 工作 年度 各项 目标 展望未来 使命 光荣 繁重 房管 学习 领会 二十大 精神 进一步 习近平 时代 中国 特色 思想 武装头脑 指导 实践 推动 工作 努力 我校 房管 事业 发展 领导班子 成员 邱荣富 德里 杨海华 逐一 述职 陈欣 副处长 参加 虎溪 校区 管委会 工作 述职 本次 房管 会上 述职 工作 成绩 分析 提出 一步 打算 措施 刘贵文 房地产 管理处 一年 成绩 给予 充分肯定 成绩 离不开 房管 全处 干部职工 勇于 担当 踏实 工作 攻坚克难 团结奋斗 房管 工作 提了 三点 希望 一是 提高 政治 站位 领会 学校 战略 全局 思维 二是 担当 创新 努力提高 资源配置 利用效率 三是 压紧 压实 一岗双责 深化 从严治党 全处 职工 会后 今日 校园 干部 考核 程序 对处 领导班子 成员 民主测评,1
54,下午 重庆大学 电气 工程学院 党委 线上 党支部 书记 述职 评议 考核 学院 党委书记 胡建林 书记 主持会议 学院 党委委员 党政 班子成员 党支部 书记 参会 学院 党支部 书记 围绕 学习 贯彻落实 习近平 时代 中国 特色 思想 二十大 精神 情况 服务 国之大者 发挥 堡垒作用 情况 贯彻落实 高校 基层 党组织 工作 条例 情况 述职 导向 年度 工作 情况 查摆 提出 一步 改进 党建 工作 思路 措施 听取 各支部 汇报 学院 党委书记 胡建林 对接 支部 党政 班子 领导 逐一 党支部 书记 履职 情况 支部 工作 情况 点评 提出 一步 工作 建议 与会 同志 支部书记 履职 情况 综合 评价 打分 胡建林 肯定 支部 一年 辛苦工作 各支部 学习 贯彻 二十大 精神 首要 政治 深刻 领悟 两个 确立 决定性 意义 增强 四个 意识 坚定 四个 自信 两个 维护 各支部 稳扎稳打 落实 党建 重点 基础 增强 支部 政治 功能 组织 功能 围绕 中心 服务大局 电气 学科 方向 探索 支部 特色 品牌 进一步 发挥 支部 堡垒作用 党员 先锋 模范作用 打造 时代 电气 先锋 精神 内涵 标杆,1
55,日前 重庆市 教育 委员会 公布 重庆市 优秀 博士 硕士学位 论文 评选 重庆大学 自动化 学院 宋永端 教授 指导 博士 研究生 周淑燕 获批 重庆市 优秀 博士论文 国家 一流 高校 建设 推进 研究生 培养 质量 越来越 受到重视 省部级 优秀 博士论文 无疑 衡量 博士 培养 水平 标志 值得一提的是 几年 宋永端 教授 培养 多名 博士 相继 获此 殊荣 详情 下表 王玉娟 黄秀财 赵凯 曹晔 国家一级 学会 中国 电子 学会 中国 自动化 学会 优秀 博士论文 宋永端 教授 团队 研究生 重庆市 优秀论文 情况表 自动化 学院 分类 评价 代表作 评价 多元 评价 原则 推进 建立 科学 申请 学位 创新 成果 评价 体系 优秀 学位 论文 评选 契机 倡导 科学 严谨 学风 勇于创新 精神 积极探索 优秀 学位 论文 培育 激励 制度 努力提高 研究生 教育培养 水平 博士生 培养 质量 逐年 提升 近三年 毕业 博士 优博率 学校 认定 提升 超过,1
56,厦门 海辰 储能 科技股份 有限公司 简称 海辰 储能 铜梁 人民政府 简称 铜梁 负责人 来校 交流 座谈 座谈会 主教 会议室 海辰 储能 联合 创始人 总经理 鹏程 铜梁 区长 万隆 副区长 建平 重庆大学 党委书记 舒立春 副校长 李剑 出席会议 舒立春 海辰 储能 铜梁 一行 来访 热烈欢迎 指出 重庆大学 获批 国家 储能 技术 产教 融合 创新 平台 依托 创新 平台 集聚 学校 能动 电气 材料 资安 化工 优势 学院 力量 海辰 储能 铜梁 合作 希望 一步 合作 办好 新型 储能 产业 发展 研究院 储能 产业 卡脖子 难题 联合攻关 打造 一流 储能 专业 培养 储能 行业 人才 提升 储能 领域 原始 创新能力 储能 产业 提档 升级 服务 重庆 铜梁 经济社会 高质量 发展 万隆 铜梁 区正 推动 产业 转型 培育 壮大 新能源 材料 装备 制造 电子信息 主导产业 加快 构建 产业 体系 成功 引进 海辰 储能 西南 智能 制造 中心 研发 中心 项目 希望 推动 海辰 储能 重庆大学 深度 合作 助力 铜梁 打造 西部 储能 新城 新型 储能 产业 高地 新型 储能 高新技术 产业化 示范 基地 新型 储能 场景 推广 示范区 鹏程 介绍 西南 智能 制造 中心 研发 中心 智能 厂房 智慧 产线 建设 情况 希望 重庆大学 人才 技术 深度 合作 加快 产业 人才 储备 技术创新 持续 推进 海辰 储能 高质量 稳健 经营 高速度 成长 构建 厦门 重庆 双子星 规模化 发展 格局 助力 重庆大学 高质量 发展 海辰 储能 合伙人 鲁承诚 总经理 助理 张晓兰 铜梁 区政府 主任 文波 区经 信委 主任 陈瑜 重庆大学 校长助理 劲松 朱才 合办 校友 主任 胡友 强及 党办 校办 科发院 单位 负责人 参加 会议,1
57,日至 重庆大学 研究生 第二课堂 书画 系列讲座 于线 顺利 结束 本次 讲座 邀请 重庆大学 建筑 城规 学院 教授 博导 中国美术家协会 会员 中国书法家协会 会员 龙红 老师 主讲 教师 讲座 内容 形式 新颖 收获 我校 师生 众多 高校 同学 好评 本次 书画 系列讲座 腾讯 会议 重庆大学 研究生 视频 直播 形式 重庆大学 学院 研究生 报名 参加 本次 活动 吸引 北京大学 中国人民大学 复旦大学 南开大学 二十余 兄弟 高校 同学 累计 余人 报名 参与 本次 讲座 线上 直播 观看 万余人次 本次 系列讲座 中国 书法 继承 创新 核心 主题 分为 优雅 书写 写字 书法 取法乎上 古人 对话 意象 之美 中国 传统 书画 笔墨 意趣 近乎 书法 继承 创新 四大 专题 书画 格调 优雅 追求 书画 临摹 技巧 触发 同学 美的 感受 想象 引领 同学 领会 刚柔相济 博散 东方 审美 情调 走向 赏心悦目 气息 贯通 高远 典雅 意境 龙红 书画 创作 颐养 性情 培育 人格 提升 审美 品位 欣赏 书画 超越 书画 笔墨 触摸 背后 展现 生命 境界 哲学 意蕴 书画 传承 创新 之道 讲座 互动 增加 参会 师生 书画艺术 我校 研究生 课余 生活 增进 高校 之间 书画 交流 弘扬 中华 优秀 传统 书画艺术 图片 孙文琪 龙敏琦,1
58,近日 重庆市 卫生 健康 科学技术 科协 联合 发布 重庆市 中医药 创新 团队 评审 项目 重庆大学 附属 肿瘤医院 中医肿瘤 治疗 中心 主任 王维 带领 中医药 防治 肺癌 传承 创新 团队 入选 重庆市 中医药 创新 团队 建设项目 据介绍 中医药 防治 肺癌 传承 创新 团队 重庆大学 附属 肿瘤医院 牵头 重庆大学 重庆 医科大学 北京大学 重庆 数据 研究院 单位 联合 申报 团队 学科 交叉 创新型 人才 团队 涵盖 中医学 中药学 肿瘤学 基础医学 生物医学 人工智能 数据 统计学 软件工程 学科 领域 高精尖 专家 人才 团队 围绕 肺癌 防治 相关 中医药 交叉 创新 研究 开发 肺癌 诊断 技术 构建 肺癌 精准 防治 体系 创新 研发 康复 技术 研发 新型 药物 初步 成果 未来 团队 前期 合作 基础 大力发展 中医 推动 中医 现代化 智能化 鼓励 中医 创新 传承 中医药 精华 战略 需求 致力 解决 肺癌 防治 关键 难题,1
59,年度 第十九届 王大珩 光学 评审会 线上 会议 中国 光学 学会 理事长 龚旗煌 院士 主持 会议 中青年 科技人员 申请者 申报材料 审议 讨论 无记名 投票 评选 第十九届 王大珩 光学 中青年 科技人员 获得者 会议 初评 学生 候选人 终评 选出 学生 获得者 重庆大学 光电 工程学院 光学 工程 专业 博士 研究生 道福 学生 光学 道福 中共党员 光电 工程学院 博士 研究生 道福 担任 光电 学院 团委 研究生 主席 博士 年级 博士 期间 新能源 转化 成像 相关 研究 第一 作者 包括 第一 作者 通讯 作者 身份 发表 论文 申请 国家 发明专利 主持 研究生 科研 创新 项目 博士 研究生 国家 奖学金 第一届 中国 研究生 双碳 创新 创意 大赛 全国 二等奖 义渡赛 创杯 第十一届 重庆市 科慧 研究生 创新 创业 大赛 一等奖 第十六届 大学生 创新 创业 大赛 重庆 赛区 二等奖 重庆大学 研究生 十佳 学术 之星 奖励 荣誉 余项 王大珩 光学 设立 奖项 评选 十九 评选 中青年 科技人员 获奖者 学生 获奖者 获奖 人员 成长 贡献 获奖者 行业 领域 领军人物 部门 负责人,1
60,下午 机械 运载 工程学院 腾讯 会议 在线 领导班子 领导人员 述职 民主测评 会议 学院 党委书记 陈晓慧 主持 人事处 劳资科 副科长 张衍超 出席会议 学院 教职工 参加 会议 会上 陈晓慧 代表 班子 述职 学院 党委 发挥 党组织 政治 核心作用 筑牢 理想信念 基石 对标 增强 党组织 政治 功能 组织 功能 面对 疫情 快速 响应 部署 彰显 使命 担当 学院 重点 四个 落实 基层 党建 重点 一是 强化 理论 学习 思想 政治 建设 二是 党风廉政 教育 师德师 建设 三是 做好 党员 发展 教育 工作 夯实 基层 党支部 建设 四是 党建 工作 引领 学院 高质量 发展 谈到 全院 教职工 努力 学院 年度 不菲 成绩 学院 工作 工作 学院 以党 二十大 精神 指引 学习 贯彻 工作 学科建设 人才培养 队伍 建设 文化 建设 政治 优势 组织 优势 转化 发展 优势 凝心 聚力 推动 学院 各项 工作 高质量 发展 学院 领导班子 成员 依次 述职 一年 廉等 情况 教职工 听取 述职 报告 日常 工作 情况 今日 校园 干部 考核 程序 领导班子 领导人员 民主测评,1
