所属主题,文章数量,特征词,主题强度
Topic0,23,特别、环境、房间、酒店、干净、真的、这家、服务、下次、卫生、喜欢、民宿、老板、江景、舒服、推荐、长沙、前台、入住、超级、窗外、位置、设施、漂亮、细节、咖啡、蜗牛、院子、电梯、泡澡、需求、湘江、服务态度、机会、地方、公寓、浴缸、阳台、周边、热情、第一次、小姐姐、法式、哥哥、不错、帅哥、五星、窗户、装修、异味、哈哈哈、咖啡店、很新、提供、赶上、布局、帮忙、对面、担心、中心地带、来往、屋内、沙发、精致、整洁、优惠期、落地窗、名副其实、水晶灯、拍照、接触、壁炉、冲冲、热情周到、长沙市、离店、十足、心动、好评、好吃、注定、高效、洛可可式、格调、贴心、饭店、风情、相遇、店家、惊喜、室内、舍不得、名宿、格局、住客、打扫、一种、走不开、船只、公寓式,0.11917
Topic1,8,不错、民宿、卫生条件、情况、墙上、灰尘、洗衣机、卫生间、老板、头发、分享、国金、有一、桌面、十五分钟、难受、黄兴、冰箱、攻略、顾客、晚上、过关、朋友、长沙、住宿、步行街、不符、走路、选择、沟通、小伙伴、真的、开张、出行、超级、随处、空空、第一、被子、到位、位置、值得、客厅、设施、旅游、网上、安静、姐姐、很久、遗留、东西、卫生、参考、还行、态度、上位、推荐、体验、房间、特别、尝试、热情、酒店、床单、水渍、第三、换房、最舒服、服务、干净、环境、满意、舒服、下次、旁边、入住、舒适、店家、前台、交通、地方、小姐姐、商家、好好、厕所、温馨、挺不错、超值、分离、齐全、很漂亮、贴心、客服、开心、整洁、江景、很大、地理位置、好吃、很棒,0.041451
Topic2,6,房间、环境、卫生、服务、楼下、小姐姐、适合、舒服、提供、姐妹、几分钟、下次、真的、设施、长沙、贴心、居住、旅游、出行、干净、老板、装修、舒适、前台、安静、喜欢、充足、出差、投影仪、打电话、公交车站、值班、升级、名宿、国金中心、印象、简约、小时、风格、回并、很漂亮、商务、二号线、市中心、美食节、地铁站、超级、开心、步行、电影、免费、情侣、情屋、姐姐、走路、帮忙、洗衣机、眼罩、漱口水、太漂亮、位置、热情、有问必答、管家、坡子街、影响、配备、冰箱、保安、很大、文和友、解决、门禁、非常适合、分离、客服、白色、干湿、厕所、周到、蒸汽、家具用品、地铁、感觉、完善、酒店、耳塞、院子、蜗牛、咖啡、咖啡店、哈哈哈、细节、表现、麻溜儿、喝杯、抱歉、隔壁、换回去、每一处,0.031088
Topic3,16,酒店、房间、干净、不错、民宿、舒服、入住、设施、阿姨、服务、环境、满意、卫生、客人、店家、态度、体验、特别、嚣张、简约、友好、图片、收拾、安静、窗户、冰箱、贴心、米粉、回复、五一广场、很棒、齐全、这家、好找、嘴巴、红枣、说教、恶劣、出行、单身、外面、优惠、一瓶、一只、遗留、宽敞、复式、坡子街、长点、青年、行李、装潢、寄存、总得来说、出门、无礼、规章、几点、充满、和小红、临走时、创意、社恐、赠送、老街区、帆布袋、落地、水温、不到、橘子洲、事业、物资、小猫咪、地铁口、老房子、放在、地方、一米、全屋、朋友、帅哥、不远、中部、黄兴路、环境优美、好吃、一句、前台、选择、异味、把酒、拍照、湘江、赔偿、看着、记性、回电、仓库、稳定、牛奶,0.082902
Topic4,15,干净、房间、民宿、老板、推荐、交通、朋友、距离、入住、环境、五一广场、不错、特别、温馨、位置、延时、简单、躲开、咖啡厅、庭院、解决、天宝兄弟、出行、潮宗街、位于、服务到位、下午、好找、退房、快捷、冬瓜山、养眼、一百分、性价比、吃饭、那条、布置、不用、喝咖啡、微雨、找到、灯光、空气清新、楼上、消食、冲冲、打麻将、网红、孩子、一家、还给、逛逛、整洁、看得出来、精致、贴心、打卡、湘江、手续、情调、聊天、主打、喜欢、一条街、车票、适合、睡觉、整体、卫生、楼下、哥哥、很好、一圈、精心设计、清晨、地方、感受、拍照、值得、柔和、舒服、小姐姐、长沙、情侣、前台、十分钟、成功、楼底下、地理位置、舒适、从众、商家、齐全、态度、客服、设施、满意、下次、服务、酒店,0.07772
Topic5,24,不错、真的、超级、舒服、民宿、地方、感觉、特别、卫生、服务、房间、环境、下次、长沙、出行、地理位置、值得、好吃、小姐姐、安静、推荐、老板、酒店、五一广场、干净、选择、衣服、阿姨、齐全、咖啡、设施、这家、星级、放松、热情、正好、江美、装修、体验、周边、太阳、一块、晚上、随便、很棒、夜景、温馨、图片、好看、路线、情况、楼下、电梯、床上、微风、来住、落地、一道、巨好、大厅、烟花、目的地、茶颜悦色、垃圾、心情、时分、介绍、订房、老板娘、太棒了、距离、性价比、床品、小时、说法、山景、热闹、拥有、夜宵、干干净净、傍晚、小红书、待遇、庭院、现磨、安逸、拍照、地铁站、城市、肯定、满意、河东、第三次、味道、景点、责任、服务态度、玻璃窗、来定、总体,0.12435
Topic6,21,满意、干净、房间、不错、长沙、舒服、民宿、整洁、地理位置、安静、下次、特别、环境、公寓、很大、酒店、推荐、庆幸、几个、尴尬、一点、几分钟、室内、马路边、地垫、外卖、两张、确实、热情、厕所、退房、照片、首选、拍照、楼道、空间、朋友、观景、双人床、卫生间、收拾、江景、复式、外面、不好、只能、走进、全房、坡子街、提前、小朋友、居住、预约、地段、安排、开心、投影仪、很好、选到、阿姨、烟花、榻榻米、忘记、隔音、排队、机会、开房、客服、超级、一家、内外、露台、脚感、真心、好久、海信广场、舒适、楼下、小姐姐、重点、洗衣服、还好、手续、洗衣机、一齐、态度、找到、上拍、选择、系统、聊天、办理、适合、入住、投屏、通风、绝佳、会员、号线、小巷,0.10881
Topic7,1,前台、沐浴露、洗发水、哥哥、舒服、好闻、免费、智能家居、香皂、绿茶、挺舒服、热情、哈哈哈、不错、房间、环境、干净、服务、满意、特别、卫生、老板、推荐、下次、民宿、设施、位置、入住、体验、旁边、长沙、值得、店家、舒适、真的、超级、感觉、小姐姐、贴心、超值、整洁、地段、非常感谢、酒店、地理位置、交通、五一广场、适合、好吃、房东、装修、好好、厕所、开心、楼下、地方、温馨、很棒、齐全、安静、很大、商家、江景、挺不错、朋友、阿姨、周边、喜欢、小吃、完美、精心设计、到位、一条街、厨房、真心、衣服、美食、内外、强力、看得出来、提供、服务到位、出行、安心、入睡、地铁站、提前、东西、攻略、好找、烟花、有家、耳塞、住宿、便利、哈哈哈哈、第二次、介绍、旅游、耐心,0.0051813
Topic8,6,长沙、商圈、距离、民宿、干净、房间、蜗牛、旅行、地理位置、小院、院子、酒店、很棒、交通、不错、下次、选择、很漂亮、一共、重工、推荐、第二次、溪湖、地铁站、优越、木质、床品、独自一人、颜值、绝佳、旅游、细节、美食、情趣、服务、四通八达、潮宗街、满分、茶颜、便利、生活、周边环境、这家、打扫、消防局、旁边、安静、步行、家具、位于、的的、五一广场、贴心、价格、亲民、房东、在线、即可、舒适度、攻略、店家、阿姨、卫生、惊喜、愉快、小姐姐、热情、客服、晚上、房型、亲切、整洁、朝宗、老板、环境、满意、特别、体验、位置、入住、舒服、设施、舒适、真的、超级、值得、地方、装修、喜欢、商家、住宿、温馨、齐全、朋友、前台、开心、楼下、周边、挺不错、好好,0.031088
Topic9,6,不错、房间、便利店、楼下、喜欢、齐全、老板、完善、国金、药店、小小的、水渍、安静、设备、门口、公交、公寓、地铁站、步行、服务到位、洗衣机、自助、景色、交通、稍远、冰箱、电动车、排气扇、很漂亮、广场、描述、退宿、美食、朋友、飘窗、挺不错、水果店、很大、共享、推荐、猫猫、舒服、介绍、厕所、可爱、地铁口、便利、环境、入职、小吃、打卡、住宿、出行、火车、地都、入住、干净、五一广场、卫生、蛮意、下楼、进门、提前、设施、感觉、满意、下次、特别、服务、位置、超级、酒店、舒适、体验、民宿、旁边、真的、商家、长沙、店家、地理位置、热情、值得、小姐姐、开心、地方、好好、拍照、好吃、整洁、非常感谢、晚上、很棒、房东、地段、贴心、前台、周边、温馨、这家,0.031088
Topic10,17,房间、干净、不错、民宿、超级、服务、入住、漂亮、拍照、地方、整洁、设计、感觉、酒店、下次、潮宗街、贴心、安静、好看、好吃、房东、环境、位置、阳台、晚上、老板、体验、舒服、值得、热心、行李、打卡、江景、前台、帮忙、完美、哥哥、客厅、小姐姐、楼下、舒适、适合、小吃、卫生、地理位置、装修、设施、攻略、真的、满意、推荐、北欧、采光、明星、最爱、场地设施、一只、驱寒、回来、餐室、外卖、能出、年轻人、到位、远离、放心、旅行、开会、餐馆、友友、完备、沉醉、分钟、夜间、明亮、榻榻米、回去、半夜、美景、主义、每天晚上、周边、用具、周到、等候、小型、姜枣、用品、两杯、寻找、楼梯、早上、烘焙、洗手间、感应、果茶、松懈下来、茶颜悦色、投影、细心,0.088083
Topic11,7,房间、干净、民宿、好好、下次、小姐姐、马桶、前台、推荐、喜欢、潮牌、店铺、机会、热情、隔壁、这家、宽敞、文艺、高级、戴森、一次性、表演、随便、管家、停车场、烟花、朋友、客服、观看、入住、玩偶、遇上、用心、服务周到、地下、拍照、热门、位置、景点、设计、智能、惊喜、浴缸、性价比、厕所、清新、满意、出行、闹中取静、吹风机、周边、车程、服务、方向、开心、异味、好吃、特别、长沙、出片、到位、满满、设施、卫生、小店、清爽、地标、门口、不错、老板、环境、舒服、酒店、体验、旁边、超级、商家、舒适、店家、值得、地方、真的、干湿、挺不错、房东、温馨、地理位置、很大、超值、贴心、安静、交通、江景、便利、住宿、漂亮、楼下、很棒、齐全、五一广场,0.036269
Topic12,10,房间、不错、服务员、设施、舒服、环境、空间、离开、厕所、服务、卫生、交通、长沙、距离、行李、楼下、温馨、解决、满意、跃层、便利店、不好意思、导致、感觉、地下、下午、尴尬、烧烤、马桶、老街、出入、提着、无线网、布局合理、房卡、便利、地铁站、抽风机、拥挤、太平、时间、上上下下、态度、车票、吃吃喝喝、退房、之行、洗漱、干湿、当天、地段、膀子、很快、原先、美食、改进、下次、保安、店家、周到、旁边、整洁、清洁卫生、生活、存放、夜宵、位置、两个、冬瓜山、麻烦、公寓、瘫水、体验、投影、分离、一次性、电梯、中午、一条街、每次、干净、齐全、同事、更好、入住、小吃街、回家、一间、耐心、特别、推荐、老板、酒店、民宿、超级、值得、地方、小姐姐、商家、热情,0.051813
Topic13,6,房间、干净、老板、超级、民宿、服务、距离、地铁、提供、小姐姐、房东、入住、太平街、浴缸、外卖、到位、位置、坡子街、管家、橘子洲、五星、视野、景色、提前、卫生、五一广场、出行、设施、窗外、茶颜悦色、帮忙、高铁、便利、洗脸、事情、整体、湘江、布草、音乐节、快递、完美、外立面、很漂亮、冰箱、全身、担心、民国、好找、无早、整洁、环境、地址、日式、逛下来、解决、韩老板、朋友、接送、无所谓、解答、泡腾球、一次性、泡澡、炫起、告诉、开阔、海信广场、期间、两站、榻榻米、对了、快速、周边、步行街、商业街、解决问题、密码、中暑、旁边、吃饭、商圈、不用、面镜、岳麓山、房卡、合适、机会、国金中心、分钟、饮用水、蒸汽、吹风机、眼罩、临江、建议、耳塞、聚会、一级、不错、楼下,0.031088
Topic14,7,干净、房间、位置、卫生、不错、真的、客栈、咖啡、厨房、环境、推荐、楼下、特别、地方、图片、温馨、民宿、一次性、早餐、出行、洗衣机、舒服、超级、五一广场、小院、枕头、浴缸、多点、安静、完美、预定、路上、喝咖啡、界面、床品、旁边、吵闹声、重点、小姑娘、闹中取静、齐全、好喝、茶具、眺望、茶颜、服务态度、门口、蒸汽、天宝兄弟、一晚、投屏、杀猪、设施、眼罩、停车场、耳塞、理想、旅游、洗脸、漱口水、贴心、江景、对面、吃饭、泡茶、平台、地址、冬瓜山、优雅、植物、床边、泡澡、卫浴、他家、橘子洲、整洁、店家、电梯、情况、路线、感觉、好看、窗台、指引、不用、风味、气派、下楼、细节、特别感谢、阳光、二楼、地理、发给你、夜景、冰箱、超棒、坐地铁、坡子街、回答,0.036269
Topic15,11,房间、长沙、不错、橘子洲、位置、入住、下次、环境、外卖、喜欢、孩子、市中心、空调、灰尘、粉店、很大、五一广场、晚上、天花板、干净、推荐、民宿、第二次、江景、风格、增加、提前、地道、唯一、烟花、扇门、声音、鲁哥、就定、外面、自助、闹市、大床、巷子、娟娟、美食、商圈、酒吧、控制、不到、姐姐、开放、新开、餐馆、遗憾、好找、库房、搭配、不愧、清爽、装修、一点、地理位置、性价比、夜晚、床头、楼层、周记、房东、分离、商业街、店主、米粉、菜馆、安静、鳞次栉比、老板、智能、粉面、对面、舒服、老街、充电、哈哈哈、折叠、卫生用品、来住、解决问题、适合、旅行、阿姨、总体而言、古风、文艺、厅里、时间、预约、各类、隔音、天顺、配备、垃圾、增放、酒店、食肆,0.056995
Topic16,1,好评、温柔、越来越、宽敞明亮、真心、民宿、卫生条件、实际上、过硬、细腻、房间、魁梧、希望、老板、不错、环境、干净、下次、服务、满意、位置、推荐、卫生、舒服、值得、超级、设施、特别、入住、旁边、舒适、体验、长沙、热情、真的、店家、酒店、商家、很棒、地理位置、感觉、小姐姐、温馨、交通、地方、整洁、房东、好好、装修、阿姨、周边、地段、喜欢、超值、前台、出行、哥哥、安静、厕所、挺不错、齐全、朋友、五一广场、开心、这家、住宿、江景、贴心、拍照、楼下、仓库、小朋友、出入、优惠、游玩、嚣张、一条街、习惯、回电、一瓶、到此为止、清新、傲慢、服务周到、把酒、非常感谢、义务、丫头、临走时、选错、总得来说、恶劣、一句、中部、推脱、开封、做不了、几点、干静、嘴巴,0.0051813
Topic17,8,下次、服务、这家、卫生、民宿、满意、推荐、地方、值得、冰箱、酒店设施、长沙、洗衣机、一家、夜市、精心、强推、地理位置、交通、选择、超乎、布置、安稳、潮宗街、楼下、预期、摆设、茶颜悦色、密码锁、携带、后巷、江景、无需、关了、房主、不错、闹中取静、穿出去、冬瓜山、离吃、安心、入睡、房卡、舒适、入住、环境、开心、干净、房间、舒服、老板、位置、酒店、特别、旁边、体验、真的、店家、设施、超级、商家、安静、热情、温馨、很棒、住宿、适合、挺不错、朋友、感觉、好好、出行、房东、小姐姐、五一广场、前台、公寓、很漂亮、很大、喜欢、齐全、整洁、超值、好吃、名宿、第二次、小店、好看、哥哥、晚上、坡子街、拍照、投影仪、距离、湘江、很好、旅游、从众、吃饭、态度,0.041451
