所属主题,文章数量,特征词,主题强度
Topic0,295,日本、孙导、行程、东京、不错、酒店、携程、陈导、旅行、自由、导游、大阪、富士山、服务、希望、景点、地铁、领队、安排、感觉,0.031303
Topic1,1950,导游、不错、酒店、行程、自由、日本、安排、时间、大阪、领队、景点、京都、东京、满意、出行、总体、两天、购物、热情、推荐,0.20692
Topic2,123,行程、不错、安排、导游、时间、旅行、日本、购物、地方、匆忙、酒店、冲绳、休闲、住宿、愉快、满意、体验、森林、时光、自由,0.013052
Topic3,2347,导游、日本、领队、服务、安排、满意、行程、携程、旅行、讲解、热情、北海道、感谢、特别、周到、旅游、专业、下次、景点、贴心,0.24904
Topic4,135,酒店、日本、度假村、星野、滑雪、行程、大阪、满意、真的、东西、购物、特别、车程、推荐、不错、京都、东京、渊博、导游、干净,0.014325
Topic5,2375,行程、领队、导游、安排、自由、日本、不错、时间、携程、景点、开心、讲解、旅行、选择、满意、下次、第一次、购物、负责、两天,0.25202
Topic6,2199,酒店、行程、导游、不错、日本、时间、韩国、自由、温泉、安排、购物、特别、景点、满意、房间、领队、大阪、携程、东京、服务,0.23334
