,word,counts
68,本站 通讯员 姜贺颖 刘子泉 中国 医学 救援 协会 天津市 救援 医学 学会 主办 天津大学 应急 医学 研究院 天津大学 天津 医院 天津市 救援 医学 学会 肾病 分会 承办 天津市 救援 医学 学会 年度 学术年会 中国 医学 救援 协会 生命 支持 技术 分会 成立 大会 于线 顺利 天津市 卫生 健康 委员会 主任 杜洪印 天津市 救援 医学 学会 会长 夏群 天津大学 常务 副校长 胡文平 天津医科大学 校长 雷平 天津大学 医学部 应急 医学 研究院 院长 侯世科 出席 开幕式 胡文平 致辞 充分肯定 应急 医学 研究院 团队 医学 救援 领域 做出 贡献 勉励 应急 团队 挖掘 深耕 迎难而上 天津市 救援 医学 学会 纽带 天津市 救援 领域 各方 力量 持续 深度 合作 交流 分享 前沿 凝聚 共识 资源 聚合 优势 突破 全国 应急 救援 行业 发展 增砖添瓦 胡文平 致辞 雷平 天津医科大学 天津大学 战略 合作 由来已久 希望 以此 次年 会为 契机 天津市 应急 医学 领域 资源 进一步 整合 技术创新 资源共享 产业 发展 局面 推进 两校 科学研究 人才培养 学科建设 领域 交叉 融合 应急 研究 领域 联合攻关 健康 中国 建设 做出 更大 贡献 雷平 致辞 杜洪印 指出 天津市 突发 公共卫生 事件 应急 制度 建设 补短 漏洞 强弱 发挥 行业 监管 社会 监督 作用 不断完善 突发 公共卫生 事件 应急 管理体系 长效 制度化 提高 应急 处置 能力 提升 卫生 应急 人才队伍 能力 建设 成效 市卫 健委将 天津大学 合作 突发 公共卫生 事件 处置 打造 坚实 人才 基础 杜洪印 致辞 天津市 救援 医学 学会 年度 学术年会 上午 主题 报告 环节 中国 医学 救援 协会会长 李宗浩 天津大学 应急 医学 研究院 院长 侯世科 常务副 院长 樊毫军 上海市 肺科 医院 党委书记 陈昶 天津大学 天津 医院 肾内科 风湿 免疫科 行政 主任 定位 郑州大学 附院 体外 支持 中心 主任 李军 广东省 医院 体外循环 科主任 周成斌 专家 空中 急救 时代 救援 方舱 医院 建设 创新 技术设备 猝死 急救 实践 研究 移植 新进展 一体化 超纯 透析 实践 路径 生命 机会 郑大一 附院 临床 漫谈 创伤 救治 主题 展开 分享 与会 人员 带来 最新 专业 前沿 临床 案例 主题 报告 下午 应急 救援 交叉学科 领域 学术 研讨 由樊 毫军 教授 主持 天津大学 胸科 医院 李春洁 天津医科大学 总医院 柴艳芬 靳衡 杨清 王春立 谢克亮 急诊 医学 心脏病学 外科学 麻醉学 重症 医学 领域 专家 心肺 复苏 拯救 生命 计划 主题 探讨 依托 公益 项目 对接 单位 科室 特色 研究 合作 需求 天津大学 体外循环 技术 团队 代表 孟祥艳 主持 天津医科大学 总医院 吴乃石 陈军 天津市 第一 中心医院 李俊 杰等 心脏外科 肺部 肿瘤外科 移植 肝移植 外科 专家 体外循环 技术 器官 灌注 技术 主题 展开讨论 设备 研发 出发点 分析 器官移植 技术 短板 探寻 设备 研发 前景 中国 医学 救援 协会 生命 支持 分会 正式 成立 下午 中国 医学 救援 协会 批准 中国 医学 救援 协会 生命 支持 技术 分会 成立 大会 第一届 理事会 以线 线下 相结合 方式 胜利 大会 天津大学 应急 医学 研究院 主办 共有 全国 多个 单位 理事 参加 会议 选举 李昭颖 尉辉杰 理事 孙荣 李海洋 常务理事 以樊 毫军任 分会 会长 解立 陈昶 人为 副会长 刘子泉 秘书长 第一届 领导班子 中国 医学 救援 协会 生命 支持 技术 分会 成立 大会 分会 会长 天津大学 医学部 应急 医学 研究院 院长 樊毫军 分会 副会长 解放军总医院 呼吸 重症 学部 学部 主任 解立 首都医科大学 医院 人工 中心 主任 陈煜 解放军总医院 肾病 学部 主任 张利 北京理工大学 医工 院长 陈端 天津 医院 肾内科 主任 定位 天津医科大学 总医院 麻醉科 重症 医学科 主任 谢克亮 复旦大学 中山 医院 急诊科 宋振举 同济大学 附属 上海市 肺科 医院 党委书记 陈昶 郑州大学 附院 体外 生命 支持 中心 李军 广东省 医院 体外循环 科主任 周成斌 天津大学 精密仪器 光电子 工程学院 院长 刘秀云 秘书长 天津大学 医学部 应急 医学 研究院 刘子泉 生命 支持 技术 分会 第一任 会长 樊毫 军代表 分会 描绘 分会 长远 建设 发展 目标 分会 制度 建设 充分发挥 组织 协调 桥梁 纽带 作用 整合 相关 学科 资源 以此 基础 构建 一张 全国 学科 生命 支持 技术 网络 科研 网络 更好 服务 我国 健康 产业 生命 支持 技术 分会 第一任 会长 樊毫军 教授 致辞 同期 天津市 救援 医学 学会 第二届 理事会 第四次 会议 成立 天津市 救援 医学 学会 医工 转化 分会 天津市 救援 医学 学会 烧伤 创面 修复 分会 天津市 救援 医学 学会 应急 护理 分会 天津市 救援 医学 学会 呼吸 急救 分会 主委 人选 依托 单位 变更 编辑 刘晓艳 梅羽彤,1
69,本站 中国共产党 党员 天津大学 离休干部 抗战 老兵 天津大学 老干部 党总支 委员 天津大学 关心 下一代 工作 委员会 传统 组组长 刘振昌 同志 医治无效 天津 逝世 享年 刘振昌 同志 生于 河北省 徐水县 中国共产党 参加 革命 工作 历任 徐水县 合作社 干事 康保县 二区民教 助理 多伦县 二号 区长 康保县 区委书记 康保 县委 组织部 部长 部长 县委 书记 天津大学 工作 曾任 天津大学 党委 组织部 部长 处长 水利系 党总支 书记 集体经济 办公室 主任 劳动 服务公司 经理 光荣 离休 离休 担任 老干部 党总支 六村 党支部 书记 老干部 党总支 委员 关工委 传统 组组长 天津市 离退休 干部 创先争优 优秀党员 天津市委 教育 工委 关心 下一代 工作 先进 工作者 天津市 教育 系统 优秀 共产党员 荣誉 建党 百年 之际 刘振昌 老干部 撰写 回忆 文章 戎马倥偬 康保 入选 教育部 心路 教育部 直属 系统 老同志 庆祝 中国共产党 成立 周年 文集 一书 刘振昌 同志 对党 忠诚 严于律己 兢兢业业 无私奉献 学校 事业 发展 关心 下一代 工作 作出 突出贡献 青年 师生 树立 榜样 学习 弘扬 精神 品格 逝世 一位 令人尊敬 老前辈 老战士 党员 重大损失 深切 怀念 刘振昌 同志 家属 意愿 丧事 从简 编辑 焦德芳,1
70,本站 通讯员 徐剑 北极 气候 海洋环境 发生 深刻 变化 北极 地区 科研 经济 价值 日益突出 北极 海洋 环境恶劣 实验 困难 水下 探测 借助 声学 设备 分析 想要 准确 利用 声学 设备 环境 分析 借助 海洋 声场 分析模型 北极 海域 海洋环境 影响 区域 海冰 覆盖 影响 声场 分析 计算 近日 海洋学 团队 国际 主流 期刊 发表 一篇 题为 研究 论文 本文 第一 作者 我院 硕士 研究生 鹿灿 通讯 作者 海洋学院 徐剑 副教授 高纬度 地区 覆冰 北极 海域 环境 特征 覆冰 环境 浮冰 一般性 结构 微观 结构 一般性 结构 参数 描述 浮冰 形态 如冰 密集度 厚度 微观 结构 参数 描述 浮冰 内部 声学 特性 如冰内 温度 密度 孔隙 覆冰 海域 声场 建模 常见 方法 海冰 边界 描述 随机 分布 自由 刚性 基底 表面 椭圆形 突起 海冰 光滑 介质 海冰 视为 盐水 非饱和 多孔 弹性介质 方法 覆冰 环境 声场 计算 声场 模型 缺少 对海冰 状态 准确 描述 包括 冰层 均匀 特征 冰面 粗糙 散射 边界 耦合 作用 常规 声场 计算 模型 理论 计算结果 试验 数据 之间 误差 冰芯 实测 参考 数据 样本 统计 示意 现有 方法 本文 融合 浮冰 一般性 微观 结构 参数 提出 一种 浮冰 参数 聚类 有限元 声场 计算 模型 方法 解决 实测 数据 出发 阐述 覆冰 海域 声场 建模 重点 利用 多源 数据 描述 浮冰 结构 参数 特性 动态 浮冰 划分 一般性 三种 典型 浮冰 类型 精细化 建模 提供 参考 浮冰 视为 随机 粗糙 起伏 浮冰 尺寸 分布 特征 多层 均匀 弹性介质 浮冰 材料 声学 属性 高度 还原 利用 耦合 边界 建立 边界 相互作用 验证 捕捉到 冰下 散射 特征 有限元 求解 离散 冰层 离散 若干 浮冰 开阔 水域 对模型 影响 文章 提出 新型 声场 计算 模型 冰下 实验 高度 吻合 模型 相关 参数 响应 示意图 本文 提出 覆冰 海域 声场 新思路 研究 价值 覆冰 海域 以聚类 方法 提供 区域 一般性 浮冰 声学 参数 声场 建模 参数 困惑 选取 提供 参考 耦合 条件 有限元 算法 其时 域解 保证 计算精度 更好 捕捉到 冰下 声场 特征 算法 精度 提高 准确 捕捉到 多个 到达 波峰 时延 差异 出冰厚 参数 变化 声场 响应 规律 提供 一种 北极 冰层 探测 方案 海洋学 团队 致力于 北极 海洋环境 信息技术 相关 研究 研究成果 国际 高水平 期刊 发表 团队 现有 成果 后续 算法 工作 团队 毕业生 前往 系统工程 研究院 国防 单位 中国科学院 厦门大学 单位 工作 深造 冰厚 变化 声场 响应 示意图 编辑 赵晖 杨璇,1
71,本站 日至 中国工程院 院士 天津大学 校长 金东寒 一行 甘肃省 陇南 宕昌县 考察 调研 定点 帮扶 工作 座谈会 天津大学 党委 常委 副校长 巩金龙 宕昌 县委书记 王强 副县长 王硕 苟睿 参加 座谈 座谈会 王强 主持 天津大学 定点 帮扶 宕昌县 工作 座谈会 金东寒 讲话 金东寒 宕昌县 县政府 多年 给予 天大 事业 发展 大力支持 衷心 感谢 提高 思想认识 学习 贯彻 二十大 精神 首要 政治 天大 所能 宕昌 深度 融合 充分发挥 高校 科技 人才 智力 教育资源 优势 科技 创新 人才资源 赋能 乡村 振兴 进一步提高 帮扶 成效 推进 提质 增效 注重 对标 对表 做好 顶层 设计 注重 因地制宜 做好 调查 研究 注重 发挥优势 做好 教育 帮扶 聚焦 精准 施策 对接 需求 教育 帮扶 科技 帮扶 医疗 帮扶 发力 助力 宕昌 乡村 振兴 示范村 建设 天大 智慧 宕昌 乡村 环境 美丽 乡村 文化 更具 特色 乡村 产业 更富 活力 乡村 更得 实惠 实际行动 践行 宕昌 天大 庄严 承诺 天津大学 宕昌县 建立 结对 帮扶 关系 走过 十载 春秋 做好 时代 定点 帮扶 工作 使命 光荣 意义 任务艰巨 天津大学 一如既往 坚定 支持 宕昌 发展 携手 宕昌 拓展 脱贫 攻坚 成果 推进 乡村 振兴 持续 贡献 天大 力量 天大 智慧 王强 讲话 王强 代表 宕昌县 县政府 对金 东寒 一行 到来 天津大学 倾力 帮扶 支持 衷心感谢 拓展 脱贫 攻坚 成果 第二年 宕昌县 拓展 脱贫 攻坚 成果 工作 天津大学 帮扶 成效 面临 困难 希望 天津大学 更好 发挥 百年 名校 优势 人才队伍 建设 未来 产业 培育 教育 帮扶 规划设计 协作 加速 推动 宕昌 拓展 脱贫 攻坚 成果 乡村 振兴 衔接 一步 宕昌县 完善 思路 务实 对接 强化 举措 感恩 奋进 拓展 脱贫 攻坚 成果 乡村 振兴 衔接 进一步 深化 天津大学 协作 接续 奋斗 创新 佳绩 金东寒 一行 沙湾镇 大寨村 大寨 九年制 学校 实地考察 调研 金东寒 考察 调研 大寨村 海棠 广场 大寨村 海棠 广场 学校 派驻 大寨村 第一书记 杨帆 介绍 大寨村 组织 产业 环境 文化 乡村 振兴 建设 成果 大寨村 供水 金东寒 详细 环境 学院 专家 自主 研发 振兴 净水 消毒 系统 运作 原理 高度肯定 大寨村 健康 饮水 工程 金东寒 考察 调研 大寨 九年制 学校 大寨 九年制 学校 该校 校长 杨亚红 介绍 天津大学 校园文化 建设 基础设施 改善 帮扶 工作 该校 支教 天津大学 研究生 支教团 代表 汇报 支教团 学习 工作 情况 金东寒 勉励 秉承 实事求是 校训 教育 帮扶 深耕细作 天津大学 校办 合作 环境 学院 部门 单位 负责同志 宕昌县 教育局 科技局 水务局 建局 农业 农村 乡村 振兴 自然资源 局等 部门 负责同志 陪同 调研 编辑 赵晖 佳丽,1
72,近期 天津大学 化工学院 仰大勇 教授 团队 功能 材料 细胞 可控 组装 新进展 团队 设计 质子 驱动 动态 组装 体系 细胞 信号 驱动 可控 组装 构建 人工 过氧化物 相关 成果 发表 仰大勇 教授 姚池 副教授 通讯 作者 作者 包括 硕士生 徐毓玮 博士生 唐建普 工作 国家自然科学基金 资助 支持 活性氧 细胞 代谢 信号 分子 过量 清除 导致 细胞 氧化应激 损伤 细胞 结构 完整性 细胞器 功能 影响 细胞 增殖 分化 代谢 生物学 多种 疾病 发病 机制 进程 密切相关 过氧化物 一种 多功能 细胞器 含有 用于 清除 氧化 还原酶 平衡 细胞 水平 至关重要 失衡 细胞 构建 人工 过氧化物 对胞 清除 研究 细胞 生物学 变化 有望 探索 疾病 干预 治疗 新机制 新途径 细胞 分子 动态 组装 构建 人工 过氧化物 仰大勇 教授 团队 构建 一种 氧化 纳米 复合物 细胞 动态 组装 构建 人工 过氧化物 清除 研究 失衡 细胞 生物学 影响 氧化 枝状 磷酸 骨架 配位作用 纳米 尺寸 复合体 细胞 依次 响应 早期 内涵 晚期 内涵 溶酶体 酸性 环境 发生 自主 组装 组装 细胞 内部 原位 细胞 氧化 功能 模拟 过氧化物 清除 高浓度 功能 细胞 氧化应激 分子 可控 组装 赋予 组装 材料 理性 可调 尺寸 效应 好地解决 材料 细胞 摄取 细胞 滞留 矛盾 纳米 尺寸 有利于 细胞 摄取 细胞 组装 尺寸 增大 延长 滞留 时间 增强 清除 功效 此基础 氧化应激 模型 研究 细胞 生物学 影响 结果表明 降低 细胞 水平 稳定 谷胱甘肽 浓度 保护 细胞骨架 损伤 细胞 迁移 能力 线粒体 膜电位 浓度 水平 测定 证明 细胞 攻击 代谢 生理 活动 细胞 活性 相关 实验 验证 细胞 高浓度 环境 高活性 抑制 细胞 凋亡 工作 证明 细胞 原位 构建 可行性 验证 清除 能力 这是 未来 进一步 基础 这项 工作 启发 研究者 利用 生物 环境 细胞 细胞 水平 生物 刺激 差异性 特定 位置 可控 组装 调控 细胞 细胞器 功能 疾病 干预 治疗 探索 途径 资讯 材料 天津大学 仰大勇 课题组 利用 功能 材料 细胞 构建 人工 过氧化物 编辑 焦德芳 佳丽,1
73,本站 天津大学 化工学院 青年教师 赵志坚 教授 应爱思 唯尔 出版 集团 邀请 出任 旗下 权威 化工 期刊 执行 主编 负责 催化 工程 领域 稿件 遴选 创刊 致力于 发表 化学工程 领域 基础性 研究 工作 化工 领域 三大 顶级 期刊 研究 领域 涵盖 生物化工 材料 合成 过程 系统工程 工程 催化 科学 分离 工程 化工 热力学 物质 传递 现象 流体力学 诸多 领域 该刊 定期 发表 原创性 研究 论文 综述 论文 国际 深远 影响力 赵志坚 博士 浙江大学 德国 慕尼黑 工业 大学 学士 硕士 博士学位 美国 普渡大学 斯坦福大学 博士后 研究 工作 并于 年入 天津大学 化工学院 教学 科研工作 多相 催化剂 理论 筛选 研究 主线 理论指导 多相 催化剂 开发 工作 承担 科技部 重点 研发 基金委 重点项目 多个 能源 化工 基础 相关 课题 采用 人工智能 加速 理论 模拟 方法 成功 设计 多种 高性能 丙烷 脱氢 加氢 催化剂 赵志坚 教授 出任 期刊 执行 主编 标志 我校 化工 学科 国际 同行 认可 国际 影响力 进一步 编辑 赵晖 佳丽,1
74,本站 通讯员 韩莹 广明 上午 天津大学 年度 国家自然科学基金 科研 仪器 研制 项目 申报 交流会 会议 邀请 国家 科研 仪器 研制 项目 获得者 精仪 学院 李小英 教授 项目 申报 专题报告 邀请 机械 学院 仇巍 教授 自动化 学院 庞彦伟 教授 交流 项目 申报 经验 本次 会议 以线 形式 科研 院长 建军 出席 主持会议 单位 附属 医院 相关 教师 参会 李小英 经验 申请 撰写 提纲 申请书 打磨 修改 三个 系统地 介绍 国家自然科学基金 科研 仪器 项目 指南 内涵 项目 定位 申报 注意事项 科学仪器 科学技术 发展 工具 内容 准确 把握 项目 申请 原创性 科学性 可行性 层次 侧面 展示 创新性 申请书 撰写 提纲 统筹 梳理 阐述 侧重 做好 整体 结构 安排 逻辑 流畅 语言 简洁 有限 篇幅 展示 充实 内容 仇巍 仪器 项目 申报 研究 内容 领域 科学 发展 紧密结合 前沿科学 方向 研究 需求 准确 凝练 出拟 解决 科学 充分体现 重要性 必要性 庞彦伟 仪器 项目 选题 契合 国家 需求 剖析 科学 仪器 三个 关键 属性 准确 把握 国家自然科学基金 仪器 项目 科学性 做好 申请书 总体 结构设计 精益求精 会议 研讨 交流 环节 与会 教师 围绕 项目 选题 科学 凝练 科研 团队 申请书 细节 优化 提升 交流 研讨 国家 科研 仪器 研制 项目 面向 科学 前沿 国家 需求 科学 目标 导向 资助 科学 发展 探索 自然规律 开拓 研究 领域 作用 原创性 科研 仪器 核心部件 研制 提升 我国 原始 创新能力 编辑 焦德芳 张铭艺,1
75,日到 天津大学 考点 全国 硕士 研究生 招生 考试 初试 工作 圆满完成 天津大学 北洋 校区 卫津路 校区 天津大学 附属小学 考生 天津大学 多名 监考 老师 余名 工作人员 护航 逐梦之旅 这是 史无前例 研考 疫情 研考 影响 以往 疫情 影响 考生 返回 报考 考试 教育部 两轮 全国 就近 借考 第一轮 借考 研究生院 一周 之内 日夜 赶班 以往 两周 试卷 印制 分装 工作 命题 试卷 寄出 第二轮 借考 研招办 学工 队伍 密切配合 带给 考生 困难 留给 逐一 请假 离校 应届 考生 电话 跟进 落实 外地 借考 考生 科学 分类 一类 一策 准确 划分 各类 考场 上午 学校 校内 考生 发放 抗原 试剂盒 校区 设置 核酸 检测点 校外 考生 提供 服务 研究生院 严格执行 教育部 天津市 政策 检测 考生 类型 重排 考场 增设 考场 调换 考场 多种手段 考场 准确 划分 情况 考生 交叉 布置 考场 考场 考场 开辟 备用 隔离 考场 用于 应急 状况 天大 必作于 党委书记 杨贤金 关切 研考 情况 做实 各项 工作 细节 反复 追求 考试 得以 平稳 减少 重排 考场 考生 走错 风险 一名 考生 座位 签上 打印 去向 监考员 第一 时间 重排 考场 命题 科目 调配 错误 多份 试卷 逐人 核对 抽取 加班 凌晨 三点 星光 不负 赶路 路上 有研 这是 一届 不易 考生 三年 刚刚 入学 新冠 病毒 突袭 三年 学习 很大 影响 今年以来 奥密克戎 侵扰 干扰 考生 复习 备考 考前 考生 身体 不适 高烧 大部分 社会 考生 入校 查阅 资料 上课 断断续续 更是 只能 孤军奋战 学校 深知 一位 考研 学子 考试 应考 尽考 平安 研考 教育 系统 庄严 承诺 齐抓共管 多方面 做好 服务 体现 人文 关怀 彰显 天大 品格 学校 月底 党政 联席会 招生 领导 小组会 听取 研究生院 招生 组考 工作汇报 由党 校办 研究生院 牵头 部门 密切配合 制定 详细 工作 方案 应急 预案 校党委 常委会 讨论 考前 全校 官方 微信 平台 网站 轮次 发布 防疫 考生 须知 考试 纪律 考场 安排 交通路线 用餐 休息 考生 关注 信息 考生 云端 查询 提前 食堂 校内 考研 提供 考研 套餐 学院 学生 社团 考研 加油 加油卡 方式 多方 关爱 研招协 举办 口号 征集 活动 征集 优秀作品 制成 横幅 悬挂 考试 楼前 校外 考生 教学楼 二层 开辟 场地 考生 中午 用餐 休息 举措 考生 营造 舒适 考试 环境 天大 之爱 校长 金东寒 考试 期间 巡视 考场 特别 指出 考生 出现意外 做好 多方 预案 考试 期间 迟到 考生 赶路 校园 清洁 环卫工 开着 清洁 车直 考场 早点 考生 眩晕 物业 人员 纷纷 掏出 手机 抢刷 自动 售卖机 购买 食品饮料 心脏 不适 考生 校医院 大夫 赶到 妥善处置 守护 一名 考生 求学 希望 学校 使命 这是 一场 艰苦卓绝 考前 三周 征集 监考 疫情 蔓延 报名 老师 得知 情况 学校 党委 指标 动员 机关 部处 院级 单位 扛起 责任 党委书记 杨贤金 特别 指出 考场 专用 考场 监考 机关 党员干部 冲锋在前 勇挑重担 学院 纷纷 共产党员 青年 导师 约翰霍普金斯 归国 青年 学者 蓝色 隔离 刚刚 方舱 陪伴 学生 回来 学院 书记 连续作战 学院 书记 院长 上阵 教授 博导 主动 请缨 考前 转运 试卷 人手 严重不足 研究生院 退烧 老师 返岗 参加 一百六十多 试卷 箱子 刚刚 退烧 尚未 康复 老师 粗气 一个个 箱子 清点 装车 押运 回校 卸货 码放 搬运 转移 保密室 入库 天大 之志 后续 两周 报名 监考 老师 中招 阴着 老师 顶上 阴着 老师 中招 刚刚 阳康 老师 顶上 一早 监考 人员 整整齐齐 全员 之中 三分之一 岗位 报名 名字 同一个 姓名 天大 监考 老师 招生 考试 育人 诠释 天大 攻坚 乐于 奉献 精神 一门 考试 铃声响起 考生 放下 手中 老师 放下 这场 史无前例 研考 交上 一份 令人满意 答卷 编辑 焦德芳,1
