,word,counts
35,本站 学工部 供稿 年度 学生 日常 思想 政治 教育 情况 院级 单位 工作 交流 提升 近日 天津大学 年度 院级 单位 学生 工作 述职 北洋 校区 行政 报告厅 校党委 书记 雷鸣 校党委 书记 韩庆 出席 讲话 学工部 校团委 负责同志 机关 辅导员 教辅 辅导员 现场 工作 日常 工作 表现 学院 评价 专职 辅导员 线上 参会 面对 各类 风险 挑战 院级 单位 学生 工作 负责人 紧密 围绕 统筹 做好 疫情 防控 各项 学生 工作 聚焦 基础 质量 求实效 重点 学院 引领 学生 学习 贯彻 二十大 精神 坚守 疫情 防控 底线 扎实 推进 三全 育人 五育 并举 人才培养 综合 改革 顶层 设计 经验 做法 工作 实效 展现 天津大学 学生 工作 队伍 以校 为家 责任 担当 久久 为功 务实 态度 他途 坚定信念 韩庆 充分肯定 院级 单位 一年 日常 思想 政治 工作 代表 学校 党委 辅导员 辛勤 付出 表示感谢 多年 求学 从教 经历 分享 时期 参与 见证 学生 工作 难忘 时刻 面对 时代 形势 辅导员 锤炼 过硬本领 持续 提高 工作 能力 水平 争做 思政 教育 主力军 立足 时代 引导 学生 树立 远大理想 唱响 思政 教育 主旋律 守正 创新 推动 三全 育人 五育 并举 人才培养 改革 落地生根 牢思政 教育 主阵地 把握 成长 规律 注重 思政 工作 方法 育人 实效 提升 担当 学生 发展 主心骨 发挥 学工 队伍 学校 人才培养 各项事业 发展 作用 建设 中国 特色 天大 品格 世界 一流大学 作出 贡献 雷鸣 讲话 系统 各项 学生 工作 面临 疫情 冲击 学生 思政 挑战 学工 队伍 始终 奋斗 抗疫 一线 始终 坚守 工作岗位 责任 担当 给予 充分肯定 指出 疫情 大考 工作 基础 牢固 学生 关系 妥善 应对 网络 学生 思政 工作 挑战 更好 统筹 发展 育人 体系 健全 工作 格局 宽广 学生 发展 难点 痛点 更好 完善 大思政 工作 格局 育人 队伍 工作 状态 团结奋进 始终 经受 疫情 大考 更好 应对 未来 各项 风险 挑战 育人 工作 更具 特色 学科专业 紧密 持续 发挥 全员 育人 优势 更好 提升 思想 政治 教育 工作 质量 切实加强 学生 理想信念 教育 学生 党建 学生 骨干 培养 持续 下功夫 探索 特色 情怀 能量 担当 学生 工作 体系 培养 堪当 民族 复兴 大任 时代 新人 作出 贡献 编辑 张华 王菁伟,1
36,本站 通讯员 红星 进一步 推进 工程 博士 培养 改革 试点工作 沟通 协调 深化 校企 合作 强化 培养 保障机制 建设 建立健全 产教 融合 长效机制 天津大学 工程 博士 培养 改革 试点 校企 交流会 会议 以线 上线 相结合 方式 天津大学 党委 常委 副校长 郑刚 出席会议 天津大学 工程 硕博 培养 改革 专项 试点 合作 九家 单位 代表 学院 主管 研究生 教育 院长 研究生院 常务副 院长 李斌 办公室 主任 参加 会议 会议 研究生院 院长 何芳 主持 郑刚 在讲话中 合作 单位 天津大学 工程 硕博 培养 改革 专项 试点 中所 工作 努力 表示感谢 指出 高水平 研究型 大学 科技 领军 企业 国家 战略 科技 力量 组成部分 深化 工程 博士 培养 改革 关键 主体 期待 共同努力 依托 天津大学 工科 优势 合作 单位 工程 实践 优势 培养 造就 一大批 卓越 工程师 工程 硕博 培养 改革 专项 试点 提供 推广 示范 样板 更好 服务 国家 工程 科技 产业 发展 建设 教育 强国 科技 强国 人才 强国 中国式 现代化 推进 中华民族 复兴 贡献力量 交流会 通用 技术 集团 张杜 航空工业 集团 张芮迪 中国 五矿 集团 张岩 国机 集团 陈敏敏 张立强 中核 集团 刘晓禹 中国 船舶 集团 汤清 崂山 实验室 周会会 合作 单位 代表 介绍 专项 试点 工作 举措 实施 进展 试点 改革 合作 单位 天津大学 紧密 协作 高质量 工程 硕博 招生 工作 全日制 推免 工作 校企 导师 匹配 校企 沟通交流 企业 培养 保障机制 工作 保障 专项 试点 改革 顺利 实施 单位 代表 介绍 试点 改革 推进 过程 实际困难 需求 提出 进一步 校企 需求 对接 校企 导师 研究生 互动 建立 校企 分层 交流 机制 制定 联合 培养 协议 培养 方案 校企 共建 课程 改进 授课 方式 意见 建议 研讨 环节 天津大学 材料 学院 院长 马哲 环境 学院 院长 吕学斌 建工 学院 院长 师燕超 药学院 院长 杜云飞 学院 层面 更好 推进 校企 合作 保障 试点 成效 交流 发言 研究生院 招生 办公室 主任 卢铮松 培养 办公室 主任 关静 学位 学科建设 办公室 主任 庆岭 围绕 招生 培养 学位 授予 环节 相关 分享 交流 研究生院 常务副 院长 李斌 交流 讲话 指出 进一步 推进 工程 博士 培养 改革 试点工作 招生 环节 提早 谋划 加大 校企 招生 宣传 力度 培养 环节 强化 联合 进一步 落实 联合 培养 协议 校企 共建 课程 授课 举措 学位 授予 环节 推进 校企 导师 交叉 指导 保障 工程 学位 工作 有机 融合 统一 就业 环节 校企 共同努力 提升 学生 单位 学习 工作 认同感 归属感 研讨会 交流 研究生院 院长 何芳 一步 试点工作 推进 部署 顶层 设计 规划 制定 年度 工作 计划 完善 校企 沟通 机制 联合 培养 机制 激励机制 举措 保障 专项 试点 改革 切实 成效 编辑 张华 王菁伟,1
37,本站 通讯员 郭艳余 天津大学 纪委 卫津路 校区 会议 第五 会议室 全委会 会议 传达 学习 二十 中央纪委 二次 全会 天津市 纪委 十二届 二次 全会精神 研究部署 贯彻落实 工作 学校 纪委 委员 参加 会议 纪检监察 机构 纪检监察 干部 列席会议 会议 校党委 书记 纪委书记 国家 监委 天津大学 监察 专员 曲凯 主持 曲凯 重点 领学 习近平 总书记 二十 中央纪委 二次 全会 重要讲话 精神 二十 中央纪委 二次 全会 公报 中央纪委 书记 国家 监委 主任 喻红秋 中管 高校 纪检监察 机构 述职 会上 讲话 精神 中央政治局 委员 天津市委 书记 陈敏尔 天津市 纪委 十二届 二次 全会 讲话 精神 天津市 纪委 十二届 二次 全会 决议 曲凯 学习 贯彻落实 习近平 总书记 重要讲话 精神 二十 中央纪委 二次 全会精神 天津市 纪委 十二届 二次 全会精神 重点 聚焦 二十大 目标 战略 举措 学校 十四五 规划 目标 推动 落实 从严治党 履职 尽责 攻坚克难 扎根 中国 大地 建设 世界 一流大学 提供 坚强 纪法 保障 曲凯 学校 纪检监察 机构 纪检监察 干部 贯彻落实 相关 会议 精神 作出 部署 一是 学习 贯彻 习近平 总书记 重要讲话 精神 思想 统一 坚决贯彻 党中央 决策 部署 二是 对标 习近平 总书记 讲话 精神 二十 中央纪委 二次 全会 天津市 纪委 十二届 二次 全会 部署 保障 学校 重点 工作 贯彻落实 三是 进一步 队伍 建设 打造 一支 忠诚 干净 担当 纪检监察 铁军 会议 审议 事项 编辑 张华 王菁伟,1
38,本站 通讯员 原博 我校 亚琛 工业 大学 集团 线上 合作 会谈 校长 金东寒 亚琛 工业 大学 能源 转换 系统 热力学 主任 集团 总裁 出席会议 未来 深化 合作 议题 交流 会谈 党委 常委 副校长 巩金龙 主持 国际 合作 交流 内燃机 研究所 内燃机 燃烧 国家 重点 实验室 负责同志 参加 会议 金东寒 介绍 天津大学 内燃机 学科建设 情况 愉快 回顾 多年 教授 亚琛 工业 大学 集团 学术交流 合作 历史 天津大学 内燃机 学科 培养 优秀人才 亚琛 工业 大学 集团 建立 合作 基础 未来 希望 进一步 围绕 感兴趣 领域 深化 合作 互利 共赢 邀请 教授 到访 天津大学 教授 感谢 金东寒 校长 邀请 校长 已有 长时间 合作 基础 天津大学 渊源 父亲 曾于 二十世纪 八十年代 天津大学 任教 详细 介绍 亚琛 工业 大学 集团 合作 领域 希望 互访 人员 交流 深化 机构 人才培养 科研 合作 与会 人员 一步 合作 计划 对接 讨论 建立 合作 工作组 常态 合作 机制 推动 学生 培养 实习 实训 科研 合作 合作 方向 达成 共识 亚琛 工业 大学 建于 世界 一流 理工科 大学 该校 矿物 采矿 机械工程 材料科学 电气工程 化学工程 学科 位于 世界 世界 大学 学科 排名 我校 该校 签署 合作 学术交流 备忘录 联合 发表 师生 交流 科学研究 领域 合作 独立 发动机 工程技术 公司 业务 拓展 覆盖 五大洲 多个 国家 吸纳 多名 发动机 研发 领域 精英 我国 一汽 上汽 华晨 汽车 制造商 供应商 建立 合作 关系 编辑 张华 王菁伟,1
39,本站 通讯员 刘超 近日 天津大学 毕业生 就业 工作 推动 研判 就业 形势 进一步 工作 统筹 学校 毕业生 高质量 就业 党委书记 杨贤金 党委 书记 雷鸣 韩庆 党委 常委 组织部长 贾启君 出席会议 杨贤金 在讲话中 指出 年度 部门 做好 毕业生 就业 工作 付出 艰苦 努力 学校 毕业生 就业 工作 有序 推进 面临 较大 挑战 充分利用 国内 经济运行 整体 好转 态势 细致 研判 就业 形势 增强 信心 发挥优势 共同努力 应对 形势 切实 提高 政治 站位 增强 时时 放心不下 责任感 标准 更大 力度 更实 举措 持续 推进 就业 工作 高质量 杨贤金 就业 工作 学校 工作 就业 工作 检验 学生 培养 质量 指标 育人 为国 育才 检验 标尺 教育引导 学生 祖国 志愿 价值观 自觉 理想 融入 服务 党和国家 事业 发展 进一步 就业 工作 内涵 做好 全方位 就业 调研 发挥 就业 数据 教育 教学改革 专业 设置 反馈作用 推动 专业 设置 人才培养 机制 改革 统筹 布局 加大 政策 宣传 力度 提供 充足 高质量 就业 岗位 学生 各行各业 关键 岗位 建功立业 创造 机会 努力 提升 学校 社会 声誉 鼓励 学生 堪当 民族 复兴 重任 时代 新人 底色 引导 学生 国家 经济社会 发展 做出 更大 贡献 会上 雷鸣 传达 学习 全国 普通高校 毕业生 就业 创业 工作 网络 视频会议 精神 党委 学生 工作部 汇报 我校 就业 工作 情况 就业 形势 研判 工作进展 会议 韩庆 主持 希望 学院 部门 深刻领会 全国 普通高校 毕业生 就业 创业 工作 网络 视频会议 精神 拿出 真招 实招 抓好 工作 落实 稳步 推进 我校 毕业生 就业 工作 科学技术 研究院 校友 基金 事务处 相关 负责同志 介绍 协同 推进 就业 工作 情况 微电子 学院 经管 学部 相关 负责同志 介绍 学院 就业 工作 重点 举措 化工学院 研究生 导师 金利 分享 研究生 导师 参与 就业 工作 经验 心得 机关 相关 部门 负责人 学院 负责人 分管 学生 就业 工作 负责人 参加 会议 编辑 刘晓艳 王菁伟,1
40,党委书记 杨贤金 看望 天津市 政协 原副 主席 北洋大学 天津大学 天津 校友会 会长 何国 校友 党委 常委 常务 副校长 胡文 平等 陪同 杨贤金 何国 校友 亲切 问候 简要 介绍 学校 一年 工作 成绩 感谢 何国 校友 学校 事业 发展 关心 支持 学校 建设 中国 特色 天大 品格 世界 一流大学 校友 天津大学 事业 发展 宝贵财富 学校 离不开 校友 母校 鼎力相助 提到 何国 学长 北洋大学 学习 留校 工作 天津 校友会 领导 服务 母校 情深意重 母校 发展 倾注 心血 杨贤金 邀请 学长 春节 学校 参观 交流 学校 发展 给予 指导 祝愿 学长 身体健康 新春愉快 阖家幸福 何国 校友 追忆 母校 学习 工作 往事 言谈之间 尽显 母校 牵挂 听到 母校 发展 最新进展 非常高兴 关注 母校 校友 分享 母校 成就 学校 领导班子 带领 师生员工 务实 奋进 充分肯定 期盼 母校 早日 建成 世界 一流大学 中华民族 复兴 作出 更大 贡献 编辑 焦德芳 王菁伟,1
41,本站 组织部 供稿 摄影 程岩 近日 学校 年度 机关 部门 及群 团组织 述职 述廉 测评 会议 北洋 校区 地震 装置 仿真 中心 一层 报告厅 党委书记 杨贤金 校长 金东寒 出席会议 讲话 校领导 党委委员 纪委 委员 中层干部 市级 党代表 人大代表 政协委员 特邀 监察员 民主党派 负责人 教代会 代表 学生 代表 参加 会议 会议 党委 常委 常务 副校长 胡文平 主持 会上 机关 部门 及群 团组织 负责同志 代表 单位 年度 述职 述廉 报告 述职 述廉 内容 包括 学校 中心 工作 情况 围绕 中心 工作 党建 情况 思想 政治 工作 落实 意识形态 工作 责任制 情况 党支部 推动 机关 校内 巡视 整改 工作进展 情况 落实 党风廉政 建设 责任制 廉政 风险 防控 党章 党规 党纪 教育 践行 第一种 形态 情况 贯彻落实 中央 八项 精神 作风 建设 情况 领导班子 建设 部门 内部 建设 情况 努力 方向 参会 人员 单位 正职 领导人员 民主测评 金东寒 充分肯定 单位 工作 成绩 全校 单位 学校 事业 发展 付出 努力 表示感谢 指出 十四五 期间 学校 面临 改革 难度 更高 挑战 更大 责任 更重 单位 中层干部 锚定 建设 中国 特色 世界 一流 天大 品格 大学 发展 目标 推动 综合 改革 积极主动 三个 做好 一段 时期 工作 一是 树立 改革 创新 思维 强化 政治 担当 强化 责任 重于泰山 意识 触及 矛盾 解决问题 责任 担当 时不我待 只争朝夕 紧迫感 使命感 投入 工作 全力以赴 做好 各项 工作 二是 努力 专家型 干部 提升 岗位 胜任 水平 锤炼 担当 本领 落实 能力 发扬 安专迷 精神 践行 一线 规则 调查 研究 持续 改进 工作作风 提高 工作 效能 三是 狠抓 工作 落地 落实 注重 提质 增效 制度 保障 依法 治校 依规理校 制度 弹性 进一步 改革 管理 服务 流程 提升 师生 满意度 幸福感 合理配置 资源 开放 共享 提高 资源 效率 努力 发挥 现有 资源 价值 干部 教师 牢记 使命 团结奋斗 脚踏实地 埋头苦干 凝心 聚力 推动 学校 事业 发展 新台阶 杨贤金 在讲话中 指出 全校师生 坚定信心 埋头苦干 战胜 前所未有 困难 挑战 学校 事业 发展 成绩 贯彻 二十大 精神 开局 实施 十四五 规划 承上启下 关键 切实 思想 统一 二十大 精神 习近平 时代 中国 特色 思想 武装头脑 指导 实践 推动 工作 学习 把握 全面落实 二十大 精神 真功 实效 二十大 精神 融入 贯穿 学校 战略部署 之中 统筹 教育 科技人才 工作 发挥 三个 第一 结合点 独特 作用 带头 逐项 逐条 对照 党中央 施工图 推动 实景图 围绕 推进 教育 评价 改革 落实 全面提高 自主 人才培养 质量 基础学科 新兴学科 交叉学科 建设 建设 国家 战略 科技 力量 提升 教育 服务 经济社会 发展 能力 国际 科技交流 合作 谋划 领域 关键环节 突破 带动 全局 工作 科学 精准 防控 兜住 底线 程度 保障 师生 生命 健康 举一反三 预防 化解 风险 底线 思维 忧患意识 充分体现 工作 保障 假期 校园 稳定 杨贤金 学校 第十一次 党代会 谋划 推进 中国 特色 世界 一流大学 建设 新思路 新举措 中层干部 分管 工作 思考 研究 谋划 听取 师生 意见 汇聚 各方 智慧 学校 事业 发展 贡献 成绩 编辑 焦德芳 王菁伟,1
42,天津大学 党委 常委会 会议 传达 学习 习近平 总书记 中央政治局 民主 生活 会上 重要讲话 中央 通报 精神 传达 学习 习近平 总书记 重要讲话 二十 中央纪委 二次 全会精神 学习 习近平 总书记 二三年 新年贺词 全国政协 新年 茶话会 重要讲话 精神 学习 习近平 总书记 发表 署名文章 谱写 时代 中国 宪法 实践 新篇章 纪念 现行 宪法 公布 施行 周年 研究 贯彻落实 意见 传达 学习 天津市 两会 市委 经济 工作 会议 精神 研究 贯彻落实 意见 校领导 班子成员 民主 生活 会会前 学习 情况 交流 学习体会 会议 指出 中央政治局 民主 生活 全党 树立 标杆 作出 表率 习近平 总书记 重要讲话 站位 高远 思想 深邃 贯彻落实 二十大 决策 部署 纵深 推进 从严治党 领导班子 干部队伍 建设 提供 会议 学习 贯彻 习近平 总书记 重要讲话 深刻 坚定 维护 党中央 集中统一 领导 深刻 提高 履职 能力 深刻 担当 深刻 强化 系统 观念 深刻 弘扬 优良作风 贯彻 习近平 时代 中国 特色 思想 学习 把握 全面落实 二十大 精神 上带 好头 表率 坚定 维护 党中央 集中统一 领导 自觉 地用 实际行动 捍卫 两个 确立 两个 维护 习近平 总书记 重要讲话 精神 贯穿 开好 年度 民主 生活 主动 对标 对表 查摆 深刻 剖析 开诚布公 坦诚相见 高质量 开好校 领导班子 民主 生活 指导 基层单位 民主 生活 确保 会议 开出 实效 会议 指出 习近平 总书记 中纪委 二次 全会 发表 重要讲话 深刻 分析 独有 难题 原因 表现 破解 之道 深刻 阐述 健全 从严治党 体系 目标 实践 贯彻落实 二十大 精神 纵深 推进 党的建设 伟大工程 指明 方向 提供 会议 学校 党组织 党员干部 学习 贯彻 习近平 总书记 重要讲话 精神 坚定不移 推进 从严治党 战略部署 思考 习近平 总书记 提出 解决 独有 难题 六个 高度 政治 责任感 政治 监督 确保 二十大 决策 部署 落地 见效 自觉 党中央 集中统一 领导 具体化 精准 常态 化上 下功夫 确保 学校 执行 党中央 决策 部署 偏向 变通 走样 强化 作风 建设 持续 深化 落实 中央 八项 精神 以党 优良作风 引领 校风 学风 强化 纪律 建设 教育引导 督促 党员干部 牢固 树立 党章 意识 自觉 学习 党章 遵守 党章 贯彻 党章 维护 党章 党章 党规 党纪 约束 一言一行 进一步 养成 监督 约束 环境中工作 生活 习惯 持续 推进 反腐败 斗争 深化 标本兼治 系统 治理 一体 推进 不想 持续 深化 学校 纪检监察 体制改革 积极探索 破解 同级 监督 难题 纪检监察 机构 建设 铁的纪律 打造 忠诚 干净 担当 铁军 会议 习近平 总书记 二三年 新年贺词 全国政协 新年 茶话会 重要讲话 充满 家国 情怀 情怀 历史 情怀 天下 情怀 温暖 人心 催人奋进 进一步 读懂 我国 发展 殊为 不易 成绩 增强 忠诚 拥护 两个 确立 两个 维护 思想 自觉 政治 自觉 自觉 胸怀 国之大者 紧紧围绕 贯彻落实 二十大 精神 主线 统筹 做好 教育 科技 人才 工作 落实 立德 根本任务 全面提高 人才 自主 培养 质量 助力 加快 高水平 科技 自立自强 加快 建设 中国 特色 世界 一流大学 优势 学科 统筹 疫情 防控 学校 事业 发展 各项 工作 学校 疫情 防控 形势 精准 研判 谋划 做好 开学 返校 工作 确保 师生 生命安全 身体健康 统筹 发展 风险 隐患 排查 整治 确保 校园 持续 稳定 会议 贯彻落实 习近平 总书记 署名文章 精神 学习 现行 宪法 公布 施行 年来 伟大成就 经验 坚定不移 中国 特色 法治 道路 进一步 增强 宪法 意识 弘扬 宪法 精神 推动 宪法 实施 宪法 理论 研究 推进 宪法 全面实施 推进 国家 治理 体系 治理 能力 现代化 做好 学术 支撑 发出 天大 声音 贡献 天大 智慧 完善 宪法 宣传教育 工作 格局 知识 普及 理论 阐释 观念 引导 发力 推动 宪法 宣传教育 常态 长效 健全 学校 章程 实施 机制 加快 完善 章程 核心 校内 规章制度 体系 依法 治校 依章 办学 提供 强有力 制度 支撑 会议 大学 城市 滋润 相互 赋能 找准 定位 深挖 资源 干字 实字 为先 融入 科教兴市 人才 强市 工作 全面落实 二十大 决策 部署 制定 学校 建设 中国 特色 世界 一流大学 施工图 项目 清单 逐个 目标 逐个 事项 逐个 节点 推进 把握 高质量 发展 首要任务 高校 工作 领导 充分发挥 学校 高等教育 资源优势 推动 基础 研究 科技 创新 深化 产教 融合 校企 合作 高标准 参与 天开 高教 科技园 建设 成果 转化 天津 企业 论文 津沽大 地上 提高 政治 站位 振奋精神 状态 锤炼 过硬 作风 科学 方法 凝聚 强大 合力 积极主动 服务 天津 建设 现代化 大都市,1
