,word,counts
0,本站 通讯员 郭星彤 学习 贯彻 二十大 会议 精神 有序 推动 学习 实践 走深 走实 财务处 党支部 党员大会 二十大 精神 专题学习 研讨 会议 邀请 法制办 主任 徐万鹏 讲授 题为 学习 二十大 报告 落实 习近平 法治 思想 党课 会议 财务处 党支部 书记 张鹏 主持 会上 徐万鹏 学校 发展 现状 多年 工作 经验 从党 二十大 报告 阐述 习近平 法治 思想 内涵 落实 工作 三个 与会 党员 一堂 深入浅出 精彩 生动 党课 二十大 报告 首次 单独 法治 建设 专章 论述 充分体现 习近平 同志 核心 党中央 依法治国 高度重视 高校 管理 干部 学法 懂法 用法 制定 学校 规章制度 习近平 法治 思想 方向 指引 充分体现 师生 为本 理念 原则 保护 学校 根本利益 推进 学校 各项事业 高质量 发展 上级 关系 尊重 配合 盲从 同事 关系 互爱 扶持 拆台 学生 关系 平等 服务 指责 法治 思想 贯彻 日常 工作 落实 张鹏 国家 战略 依法治国 学校 章程 依法 治校 全面推行 贯彻 习近平 法治 思想 财务 工作者 弘扬 法治 精神 履行 法律责任 用党 二十大 精神 指导 做好 财务 核算 财务管理 工作 树立 高度 自觉 大局意识 学校 改革 事业 发展 强大 合力 拼搏 勇攀高峰 与会 党员 纷纷表示 自觉 把学 深悟 透党 二十大 精神 首要 政治 切实 思想 统一 大会 精神 理论 武装 学以致用 忠诚 信念 转化 推动 学校 事业 内涵式 高质量 发展 动力 持续 推进 师生 办实事 实践 活动 着力 解决 师生 急难 推动 二十大 擘画 各项 目标 全面落实 努力奋斗 会议 按程序 支委 补选 接收 预备党员 预备党员 转正 工作 财务处 党支部 注入 新鲜血液 进一步 学校 基层 党组织 建设 提高 党组织 战斗力 发挥 党组织 核心作用 编辑 赵晖 王菁伟,2
