评论内容,fenci
环境优美，管家服务很好，住的有私汤的，泡澡很舒服，有下午茶，坐在泳池边上和朋友品茶聊天真的很不错，晚上夜景灯光也很不错，下次还会来入住,环境优美 管家 泡澡 舒服 下午茶 坐在 泳池 朋友 品茶 不错 夜景 灯光 不错 入住
在网上看了好久选了这家民宿，还是不枉此行的，民宿后院很大，可在院子里围炉煮茶并欣赏美景，管家服务不错会时刻关注着我们的动态，周边也方便100米有多家中西餐厅吃饭不用出远门。还是挺适合放松的一个地方,民宿 民宿 后院 很大 院子 围炉 煮茶 欣赏 美景 管家 不错 时刻 关注 动态 西餐厅 吃饭 不用 出远门 适合 放松 地方
整体来说蛮不错的，位置离岳麓山很近，附近还有梅溪湖，室内有大幕布的投影仪和私泡，山上有可以打坐发呆的地方，早餐味道不错,整体 不错 位置 有大 幕布 投影仪 私泡 打坐 发呆 地方 早餐 味道 不错
环境好，绿化做的很好，服务贴心，还有工作人员帮忙拍照，下次再来，姐妹们冲冲冲,环境 绿化 很好 贴心 工作人员 帮忙 拍照 姐妹
第二次来了，果然还是这种感觉，服务和氛围都太好了，爱上了这里,感觉 氛围
有次公司团建来过她们家，当时看了房间和环境就特别喜欢，民宿加餐厅一起有两栋楼，还有前院后院，整体还是非常大的，拍照打卡点很多根本拍不完，我们平时喜欢拍照只是不是专业的，后来和她们聊天知道了她们有专业拍照的小管家下次来可以享受一下，不得不说她们的每一位服务是真的赞，细心、细致、周到，点赞。,公司 团建 房间 环境 喜欢 民宿 餐厅 前院 后院 整体 拍照 打卡 喜欢 拍照 专业 专业 拍照 管家 享受 细心 细致 周到
服务很好，小姐姐们很，也会主动给我们送甜点。早餐很好吃。唯一遗憾是我们到的时候刚好降温游不了泳,甜点 早餐 好吃 遗憾 降温
1、民宿位置好找就在新修的含浦大道旁边，周边是民宿村有很多民宿和餐饮馆，出门、停车都挺方便的 2、民宿服务也是很棒的，从订房就会有店长联系，到店会有管家接待并赠送很多东西，还有洗衣服务只要拿给她们并告诉她们就行了 3、民宿环境也是相当不错的，除了住宿还可以团建，开会，吃饭，总之是一应俱全,民宿 位置 好找 新修 大道 民宿 民宿 餐饮 出门 停车 民宿 很棒 订房 店长 管家 接待 赠送 洗衣 拿给 告诉 民宿 环境 不错 住宿 团建 开会 吃饭
民宿环境特别好，工作人员都特别热情，私汤很舒服，设施齐全，住着挺舒服的,民宿 环境 工作人员 热情 舒服 设施
非常好，小琴同学服务很好,同学
环境还好 值得一去,环境 还好 值得
房间很干净，早餐也狠好吃，环境很好,房间 干净 早餐 好吃 环境
民宿有两栋楼，除了住宿还可以在隔壁喝咖啡围炉煮茶，我们就在房间的阳台围炉也挺惬意的正好可以看到一楼院子，民宿有几种房间我们体验了两种房间各有特点，适合出游,民宿 住宿 围炉 煮茶 房间 阳台 围炉 惬意 正好 一楼 院子 民宿 房间 体验 房间 适合
整体环境还可以，比较小清新，但民宿前庭和后院面积都不是很大，私汤池也有点小，没什么小朋友可游玩的地方，户外的木质桌椅多少有点霉斑，房间里有些灯不亮，电动窗帘拉上就打不开了，感觉性价比一般般，亲子游不是很合适~,整体 环境 清新 民宿 前庭 后院 面积 很大 小朋友 游玩 地方 木质 桌椅 霉斑 房间 灯不亮 电动 窗帘 打不开 感觉 性价比 亲子 合适
房间干净整洁 服务：服务很好，管家小姐姐会帮忙搬箱子，退房后出去玩，行李寄存在这里比较方便，为了帮我减轻负担，店长直接告诉我可以帮我把行李箱直接滴滴送高铁站，这样我们就不用带着行李出去玩了，哈哈。另外小院子有桂花树，这个季节坐在院子里不要太舒服呀。,房间 干净 整洁 管家 帮忙 箱子 退房 出去玩 行李 寄存 减轻负担 店长 告诉 行李箱 滴滴 高铁 不用 行李 出去玩 院子 季节 坐在 院子 舒服
环境很好，国庆后来度假的 人不是特别的多，安静，舒适 店长和小姐姐们都很热情 发现他们家后院非常大 下次可以跟同事来团建,环境 度假 舒适 店长 热情 发现 后院 同事 团建
管家式客製化入住体验、温暖迎宾接待服务、舒心小食水果、泡澡的同时看个电影卸下一身的舟车劳顿.,管家 入住 体验 温暖 接待 舒心 小食 水果 泡澡 电影 卸下
有一种去朋友家玩的感觉，随时随地准备着服务我们，认真做事的人应该生意兴隆哦,朋友家 感觉
入住这家民宿的体验非常棒！首先，地理位置优越，周围很多湘菜馆和咖啡厅很方便。接待我们的小管家热情而周到，充分展现了贴心的服务。房间装饰给人一种家的温馨感。床铺舒适，确保了我一夜的良好睡眠。卫生问干净整洁，配备齐全，让人感到方便舒适。此外，民宿提供的早餐既美味又营养，十分令人满意。整体来说，这次住宿体验超出了我的预期，我会向朋友和家人推荐这里，并期待下次再次入住。,入住 民宿 体验 地理位置 优越 湘菜馆 咖啡厅 接待 管家 热情 周到 展现 贴心 房间 装饰 床铺 舒适 确保 睡眠 卫生 干净 整洁 配备 感到 舒适 民宿 提供 早餐 营养 整体 住宿 体验 超出 我会 朋友 家人 推荐 期待 入住
设施：有的都有哦 卫生：很干净 环境：拍照地方很多，很出片 服务：管家小姐姐们都十分热情，服务很好 早餐:早餐这个粉面真的惊艳到我了，很好吃。 适合情侣，家人来打卡休息，离城市不远，空气挺好，拍照的地方很多，强烈推荐的一个民宿。,设施 卫生 干净 环境 拍照 地方 管家 热情 早餐 早餐 粉面 惊艳 好吃 适合 情侣 家人 打卡 休息 空气 拍照 地方 民宿
环境很好，服务也很棒，还有免费的烧烤吃 暖冬2-3人围炉煮茶:好吃,环境 很棒 烧烤 暖冬 围炉 煮茶 好吃
环境美，围炉煮茶很适合泡温泉的时候喝，管家小姐姐还贴心准备了篝火，下次还会来哦,环境 围炉 煮茶 适合 管家 贴心 篝火
设施：泡澡很舒服 卫生：一客一换很卫生 环境：还碰到接亲队伍在这举办活动（虽然有点吵） 服务：小琴同学很优秀！,设施 泡澡 舒服 卫生 卫生 环境 碰到 接亲 队伍 同学 优秀
私汤很好，还配玫瑰花和牛奶泡泡，服务很好，但是隔音不好。,玫瑰花 牛奶 泡泡 隔音
房间不错 环境很好 但是有蚊子 后山有很多可以玩的 可惜都没去,房间 不错 环境 蚊子 可惜 没去
服务体验不错，吃的也好吃，拍照很出片，纯躺平住着也很舒适。,体验 不错 好吃 拍照 躺平 舒适
野奢双人下午茶:很好吃 影院泡池房牛奶泡泡浴、玫瑰花:很舒服,双人 下午茶 好吃 影院 泡池 牛奶 泡泡浴 玫瑰花 舒服
服务态度非常好，环境也打理得非常有特色，时候拍照出片,服务态度 环境 打理 特色 拍照 出片
很好的一次住宿体验，民宿很漂亮，房间很舒服，店长和管家都很热情，很贴心的为我们准备了水果，围炉煮茶，还特意给我家宝贝现烤了点心，后山很大，宝贝说，夏天还要来他们家，值得推荐,很好 住宿 体验 民宿 很漂亮 房间 舒服 店长 管家 热情 贴心 水果 围炉 煮茶 点心 很大 值得 推荐
店长服务态度很好，房间也干净卫生,店长 服务态度 房间 干净 卫生
环境很好，店里的小姐姐们很热情,环境 店里 热情
服务态度非常好，房间很干净,服务态度 房间 干净
"服务态度非常好,环境不错。",服务态度 环境 不错
店长人很好 环境也很哇塞,店长 环境
卫生有点欠缺，早餐不太理想,卫生 欠缺 早餐 理想
环境好，服务不错！,环境 不错
环境美，服务好！,环境
住宿体检挺好的,住宿 体检
管家热情装修特色,管家 热情 装修 特色
房东非常热情,房东 热情
很好很不错,不错
民宿的环境很好，早餐也很丰富，小贺的服务很到位，后面还有后花园，送的下午茶也很适合拍照，店门口还有免费的停车场，打车也挺方便，下次还会再来,民宿 环境 早餐 到位 后花园 下午茶 适合 拍照 店门口 停车场 打车
来长沙旅游，一来就被这里的环境给惊艳到了，环境优美易出片，每一处都适合拍照打卡。房间干净整洁舒适，睡起觉来特别舒服，早餐也很美味，管家小姐姐霞霞人很不错，对我提出的问题都能一一解答。总体来说，是不会踩雷的一家民宿，值得推荐！！！,环境 惊艳 环境优美 适合 拍照 打卡 房间 干净 整洁 舒适 睡起 觉来 舒服 早餐 管家 不错 提出 解答 总体 民宿 值得 推荐
位置真的难找，其次酒店卫生真的好差劲，一开始有油脂，店主说换房间，我嫌弃麻烦就没有去换，结果洗完澡之后，又发现浴巾也不干净，有毛絮和其他的人毛发，然后枕头也不干净，好多灰尘以及脏东西，最重要的就是酒店不隔音加上附近有个小学早上无法睡懒觉，酒店早上八点开始就很吵，吵的无法早上睡懒觉，总体下来，全部是雷点，真的，在长沙所有的雷点居然在一个名宿酒店全部体现出来，这家名宿酒店避雷啊～ 想早上睡懒觉的 千万别订这个酒店 想需要隔音效果很好的，也不要订这个酒店，不隔音，一楼按门的时候，在房间能听的到～,位置 酒店 卫生 差劲 油脂 店主 说换 房间 嫌弃 麻烦 洗完 发现 浴巾 干净 毛絮 枕头 干净 灰尘 脏东西 酒店 隔音 小学 睡懒觉 酒店 睡懒觉 总体 雷点 雷点 名宿 酒店 体现 名宿 酒店 避雷 睡懒觉 酒店 隔音 效果 很好 酒店 隔音 一楼 房间
位置优越，就是不太好找，建议房东在入住前能主动告知一下怎么走比较方便，电梯太小，且慢，驻店管理人员只有一位保洁人员，她的保洁车占据电梯时也只能爬楼或等着，体验略差。预定的房间有下水道的味道，房东马上给更换了房间，但保洁阿姨有点不会说话，说是我鼻子太灵了，我也服气了，退房也可以延时退房，也跟房东沟通好了，但保洁还是一直敲门，建议对驻店员工加强服务培训吧，抛去保洁人员的问题一切都还好！,位置 优越 不太好 建议 房东 入住 前能 告知 电梯 太小 驻店 管理人员 保洁 人员 保洁 占据 电梯 只能 爬楼 体验 预定 房间 下水道 味道 房东 更换 房间 保洁 说话 鼻子 服气 退房 退房 房东 沟通 保洁 敲门 建议 驻店 员工 保洁 人员 还好
民宿设计很棒，很喜欢！在这里住了两晚，很宁静的一个民宿，这个我太喜欢了！民宿旁边的巷子竟然就是苏家巷丰盈西里等小巷子，吃吃喝喝超级方便。下次来长沙继续住～,民宿 很棒 喜欢 民宿 喜欢 民宿 巷子 丰盈
房间很好，这个床垫很舒服，软硬适中最解乏啦。。有的酒店床垫非常松软，但是睡觉有种陷落感，第二天醒了腰痛。。这家完全不是，枕头和床垫的质感都很好，也没有那种清洗的滞涩感，舒适！配备新风系统，位置也在五一商圈内，方便。,房间 床垫 舒服 软硬 适中 解乏 酒店 床垫 松软 睡觉 陷落 腰痛 枕头 床垫 质感 清洗 滞涩 舒适 配备 新风 系统 位置 商圈
尊嘟很爱这种色调的民宿，温馨感 位置在市中心附近，点外卖什么的都很方便 床也太软软软了叭！！！好喜欢 浴室和厕所是干湿分离，洗漱台在中间 马桶是智能马桶，用起来很舒适 房间放了一个小冰箱，买的东西怕坏的放里面保鲜就好啦，很贴心,色调 民宿 位置 市中心 外卖 太软 软软 喜欢 浴室 厕所 干湿 分离 洗漱 马桶 智能 马桶 舒适 房间 冰箱 贴心
位于网红的东茅街，是一个闹中取静的好地方，旁边还有是东茅街小学，日料啊，中古店还有各种小吃应有尽有，而且价格非常的实惠，不远处还有笨萝卜，他家的环境可以算是法式复古风跟现代的完美结合吧。东西都是用的最新的，而且奶油风让人特别的放松，管家很贴心。他家的牙具。还有拖鞋，质量都不错。洗澡的水非常的热，驱寒很好，茶杯我也很喜欢的，还有小冰箱下次有朋友来，我还要来这里,位于 网红 地方 小学 日料 小吃 价格 萝卜 环境 算是 法式 完美 是用 奶油 放松 管家 贴心 牙具 拖鞋 质量 不错 洗澡 驱寒 茶杯 喜欢 冰箱 朋友
闹中取静 出门的巷子就有茶颜很方便 离笨萝卜很近 去五一广场步行不到十分钟 很方便,出门 巷子 萝卜 步行 不到
环境非常整洁，房间很宽敞很有氛围，拍照很好看，阿姨服务态度不错，酒店很安静。,环境 整洁 房间 宽敞 氛围 拍照 好看 服务态度 不错 酒店
推荐入住这家民宿环境超级好 价格也很美丽 晚上睡觉很安静很舒适 设施：很棒卫生：干净环境：美服务：一级棒,推荐 入住 民宿 环境 价格 睡觉 舒适 设施 很棒 卫生 干净 环境
推荐长沙这家民宿，服务和床品质量都很好，环境安静性价比超高，就在黄兴广场附近，出门走一下就到了笨萝卜，别挑来长沙就住这家，真的超值的,推荐 民宿 床品 质量 环境 性价比 超高 广场 出门 萝卜 挑来 超值
房间出乎意料的好，价格也非常便宜。地段就在五一广场附近，但是很安静。走路一百米附近就有很多小吃店。超好的一次住房体验，以后来长沙还会住这里的。,房间 价格 便宜 地段 走路 小吃店 超好 住房 体验
房间的感觉让人很舒服，管家阿姨的态度也很好，民宿位置也很好，去哪都方便，而且路口就有茶颜悦色。笨萝卜也很近,房间 感觉 舒服 管家 态度 民宿 位置 萝卜
酒店位置出行超级方便，很近黄兴步行街的地铁站，走几步就有很多吃的和网红店，闹中取静，房间干净够宽敞，下次还来啊！,酒店 位置 出行 步行街 地铁站 红店 房间 干净 宽敞
环境很不错 性价比很高 服务很好 很划算 下次还会来住,环境 不错 性价比 划算
房间很干净，床睡的很软，楼下就有笨萝卜和茶颜，很方便，下次来还要住,房间 干净 很软 萝卜
房间设计的很漂亮，住着很舒服，阿姨很热情态度很好，下次来还会住这家。,房间 很漂亮 舒服 热情 态度
房间不错 卫生也搞的挺干净  环境和服务都物有所值性价比值得肯定,房间 不错 卫生 干净 环境 性价比 值得 肯定
房间很干净 装修也很漂亮 出行方便 阿姨也很热情～,房间 干净 装修 很漂亮 出行 热情
特别好！出门就是步行街，晚上很多好吃的！房间好看，干净舒服,出门 步行街 好吃 房间 好看 干净 舒服
房间很大，性价比很好，位置很好找。,房间 很大 性价比 位置 好找
很安静，卫生也很好,卫生
房间很干净很惊喜，比预想的空间还要大~很喜欢风格，床垫很软很舒适，很适合逛累了好好休息！ 民宿位置真的不错，闹中取静，又在市中心，又不会吵闹~,房间 干净 惊喜 预想 空间 喜欢 风格 床垫 很软 舒适 适合 逛累 休息 民宿 位置 不错 市中心 吵闹
房子位置处于黄兴街附近，出门右拐就是笨萝卜，在闹市中也不会有杂音吵，就是早晨小学生上学会吵到，不影响休息，房间里有投影，小桌，卫生间适合情侣使用，总体入住体检是不错的，值得再次入住,房子 位置 处于 出门 萝卜 闹市 杂音 学会 休息 房间 投影 小桌 卫生间 适合 情侣 总体 入住 体检 不错 值得 入住
民宿是独栋的，房间很大很干净，虽然在小学旁边原以为会很吵，但是还好不影响休息，位置很好，周围什么都有，步行几百米都可以到，赞赞赞！,民宿 房间 很大 干净 小学 还好 休息 位置 步行 赞赞
各方面都挺好的，特别是地理位置，非常好！ 阿姨也特别热情友爱，会主动问需要什么 就是旁边是学校，有点小小不隔音,挺好 地理位置 热情 友爱 学校 隔音
位置特别好，虽然不像高层有很好的视野，但是居住环境真的特别特别到位，出门就是步行街，好愉快的住房体验，投影房很是舒服！,位置 高层 很好 视野 居住 环境 到位 出门 步行街 愉快 住房 体验 投影 舒服
房间干净整洁，服务很好，住的很舒适，隔音效果好，休息的很好，出行很方便。住的很满意！值得推荐,房间 干净 整洁 舒适 隔音 效果 休息 很好 出行 满意 值得 推荐
房间设施设备齐全 环境好 客服小姐姐人也好 很喜欢他们家的洗护沐很香 推荐,房间 设施 环境 客服 喜欢 洗护 推荐
环境、服务，没得说。离五一广场也近，而且还安静。如果有下次还会选择这家。,环境 选择
房间大 和露台看日出很漂亮,房间 露台 日出 很漂亮
房间挺干净的,房间 干净
国庆来长沙旅游，长沙本地人朋友帮忙定了这家酒店：长沙蒲舍民宿（国金中心店）市中心，国金中心旁边独栋民宿，出门就是黄兴地铁站，在黄兴路步行街很方便，出去岳麓山橘子洲还有火车站都是地铁直达。就在网红店笨萝卜旁边，真的辣，味道的确好吃。旁边吃喝玩乐点满方便，舒适的五星级酒店同款床品，好梦连连床睡起来支撑性很好，房间颜值也高，住起来就是心情好，随便拍照很出片，舒服到不想退房……24小时私人管家服务，房间小冰箱放饮料和吃的蛮方便，换洗衣服可以给周姐洗干净、烘干,本地人 朋友 帮忙 酒店 民宿 国金 市中心 国金 中心 民宿 出门 地铁站 步行街 火车站 地铁 直达 网红店 萝卜 味道 好吃 舒适 酒店 同款 床品 支撑 房间 颜值 心情 拍照 舒服 不想 退房 小时 私人 管家 房间 冰箱 饮料 换洗 衣服 干净 烘干
设施：房间很大，很宽敞，躺在床上看投影超级奈斯.房间有个大浴缸，玩累了泡个泡泡浴很爽 服务：有求必应 环境：外面看一般，进来确实别有洞天，烧烤、露营、卡拉、泡温泉、游泳、围炉煮茶、围炉红酒都有都有…….,设施 房间 很大 宽敞 床上 投影 房间 浴缸 玩累 泡泡浴 很爽 环境 确实 烧烤 露营 围炉 煮茶 围炉 红酒
房间很舒适，很有特色的地方，外面坐上半天就很岁月静好的感觉。店员服务也很好，没有爱搭不理的样子，来长沙想住好的可以选择这边，靠近大学城，下面还有个公交站，交通很方便，停车场也有不过主要是不是旺季否则停车位会很少,房间 舒适 特色 地方 感觉 店员 不理 样子 想住 选择 靠近 大学城 公交站 交通 停车场 旺季 停车位
真的体验感太棒了 一进门就可以做围炉煮茶还有吃下午茶晚上我和朋友一起去泡了温泉 真的巨巨舒服 还有牛奶花瓣浴 泡完之后整个人特别的舒服 皮肤特别的光滑住的名宿也特别高级,体验 进门 围炉 煮茶 下午茶 朋友 舒服 牛奶 花瓣 舒服 皮肤 光滑 名宿
周末和小姐妹们出来聚会找了这一家民宿，可以围炉煮茶泡温泉而且房间的床很舒服，每个地方拍照都好看很出片，公司团建聚会可以选择在列表里面哦,姐妹 聚会 民宿 围炉 煮茶 房间 舒服 地方 拍照 好看 公司 团建 聚会 选择 列表
  是我在长沙发现的宝藏泳池民宿酒店，冬天不仅可以围炉煮茶还能泡温泉，池子非常干净，提前一小时放水。公共活动空间大，房间舒适温馨。,发现 泳池 民宿 酒店 围炉 煮茶 池子 干净 提前 小时 放水 空间 房间 舒适
以前没有住过民宿，住惯了酒店，在网上挑了半天，选了什么柠檬泳池名宿，很喜欢这个名字，来了之后，觉得很是温暖，比酒店温暖多了，有个帅小伙帮忙接行李，带我们办理入住，领我们去房间，房间整体很温馨，处处都体现了老板的用心，总之很不错,民宿 住惯 酒店 柠檬 泳池 名宿 喜欢 名字 温暖 酒店 温暖 帮忙 行李 办理 入住 房间 房间 整体 体现 老板 用心 不错
跨年我们选择了郊区，这里有私汤温泉，玫瑰牛奶浴，很舒服的过了一下午，泡完还有下午茶，酒店设施齐全安逸，早上还有管家准备的精美早餐~,选择 玫瑰 牛奶 舒服 下午茶 酒店设施 管家 精美 早餐
服务很好，柜台小姐姐很热心，周围环境也很不错，设施设备什么的都是很齐全的 还有牛奶玫瑰泡泡浴，喜欢和对象或者玩的好的朋友一起来都很不错喔,柜台 热心 不错 设施 牛奶 玫瑰 泡泡浴 喜欢 对象 朋友 不错
之前和团队团建来这里啦！这次和女朋友来住他家民宿！体验也很好餐食 卫生 环境都很好 女朋友很满意,团队 团建 女朋友 来住 民宿 体验 餐食 卫生 环境 女朋友 满意
房间环境和整个民宿环境都非常好！干净卫生！主要是娱乐项目也非常多！可以露营烧烤、唱歌、围炉煮茶、还有温泉！真的很！,房间 环境 民宿 环境 干净 卫生 项目 露营 烧烤 唱歌 围炉 煮茶
冬天到了，在长沙却意外发现了一个绝美的圣地——什么柠檬泳池民宿。简直温暖了我整个寒冬。听说什么柠檬泳池温泉是老板最近才搞好对外营业的，正好被我赶上了，简直一整个爱住。先来说说它的环境吧，一年前我就来过的地方，那个时候就感觉好美，有泳池、有民宿、有啤酒有炸鸡，还有外国人时不时会来聚会。真得非常热闹，也一直人气不减。居高不下。不过今年老板重新装修了下，搞得比之前更美了，瞬间提升了一个档次温泉的水老板都是现泡现放，而且不用担心会冷什么的，因为老板还很贴心的生起了炉子，水温也是可以自己调节的。所以泡在里面一点也不冷，真得特别舒服，下水的那一刻一整个人都会立马放松。老板还特意搞了牛奶和玫瑰花瓣，放在池子里，泡在里面真的是无比享受。泡完澡还有一些果子、糍粑、板栗什么的可以围炉煮茶，真的是一种极致的享受。对了，集美们下次来一定记得提前预约澡堂哟。设施：齐全智能 卫生：干净整洁 环境：优雅宜人 服务：热情周到,意外 发现 圣地 柠檬 泳池 民宿 温暖 听说 柠檬 泳池 老板 搞好 营业 正好 环境 地方 感觉 泳池 民宿 啤酒 炸鸡 外国人 聚会 热闹 人气 不减 老板 装修 了下 更美 提升 档次 老板 是现 泡现 不用 担心 老板 贴心 生起 炉子 水温 不冷 舒服 下水 放松 老板 牛奶 玫瑰 花瓣 放在 池子 无比 享受 完澡 果子 糍粑 板栗 围炉 煮茶 享受 记得 提前 预约 澡堂 设施 智能 卫生 干净 整洁 环境 优雅
小红书与本地宝推荐的打卡网红民宿。性价比啥的不说，但是绝对是情侣，朋友聚会，公司团建的首推民宿~夜晚可以烧烤，啥都好，有精致下午茶有早餐~下次再来玩~,推荐 打卡 网红 民宿 性价比 情侣 朋友 聚会 公司 团建 民宿 烧烤 精致 下午茶 早餐
去年来住过泳池房这次不记得了定的树屋，到民宿才发现定错了房型，管家知道后立马给我免费升级了房型，服务一如既往的好。听说私汤泡池马上建好了还会再来体验的！,泳池 记得 了定 树屋 民宿 发现 定错 房型 管家 房型 听说 私汤 泡池 建好 体验
这里环境很好，服务很用心，小姐姐很客气，东西也好吃，房间很舒服，很高级又干净整洁，温泉很舒服，玫瑰很香,环境 用心 客气 好吃 房间 舒服 干净 整洁 舒服 玫瑰
公司团建来过上次没住，觉得她们家太美了，赶紧就带上家人来了，民宿管家服务亲切，房间还配备下午茶，拍照很出片，早餐味道好，停车也免费，位置方便，妥妥的宝藏民宿,公司 团建 没住 带上 家人 民宿 管家 亲切 房间 配备 下午茶 拍照 早餐 味道 停车 位置 妥妥 民宿
有被这里惊喜到 环境超棒 超级出片 夏天有泳池 冬天有温泉 嘻嘻嘻 爱了爱了 适合爱拍照的小姐姐,惊喜 环境 超棒 出片 泳池 适合 拍照
