评论内容,fenci
和照片基本没有区别，庆幸没有订错 五星商用公寓中的宝藏民宿，卫生挺干净的 来的时候看到保洁正在打扫房间，沙发清洁 马桶拖鞋消毒，很细致。毛巾浴巾也洗得很柔顺 他们家的床品、洗漱用品都不错，用着舒服， 老板是花了心思。配备了洗手液、洗衣液、一次 性马桶垫，细节考虑得到位。两个独立房间对于我们 几个朋友出行很棒，晚上可以在客厅看着电影喝着小酒 还能看到一线江景，美美的。,照片 区别 庆幸 订错 商用 公寓 民宿 卫生 干净 保洁 打扫 房间 清洁 马桶 拖鞋 细致 浴巾 柔顺 床品 洗漱 用品 不错 舒服 老板 心思 配备 洗衣 马桶 细节 独立 房间 朋友 出行 很棒 客厅 看着 电影 小酒 江景
公寓内的宝藏民宿，要管家安排一个安静的房间，还真是隐藏在一个角落，找了两遍差点没找到房间，隐私性太棒了，房间无比宽敞，沙发卡座区还有地台品茶区，下午还能晒到太阳，江景也不错，就是还高一点就好了，管家说有百米的房间，下次来体验体验，这个国风感觉很治愈，爱了,公寓 民宿 管家 安排 房间 隐藏 角落 差点 找到 房间 房间 无比 宽敞 地台 品茶 江景 不错 管家 房间 体验 体验 国风 感觉 治愈
天气很好，阳光很棒，可以照进房间，整面落地窗，地台上喝茶，这样的冬天不光暖身还暖心，楼下就是网红餐厅天宝兄弟，最近不排队，马路对面也有宵夜一条街，很适合我这样的吃货，这里可以多住几天，太舒服,天气 很棒 照进 房间 落地窗 喝茶 网红 餐厅 兄弟 排队 马路 对面 宵夜 一条街 适合 吃货 舒服
位置挺不错的，离文和友，五一广场等都可以走路到～还走了半个多小时溜达去了橘子洲，悠哉悠哉游挺好 酒店环境还可以，设备略微有点旧，对住宿条件要求不高的可以推荐～,位置 离文 走路 小时 溜达 酒店 环境 住宿 条件 不高 推荐
民宿装备太齐全了，应有尽有，啥都不缺，那个地台太适合我们广东人的口味，能喝上一口茶，还能欣赏绚丽的湘江夜景，和照片看，没有区别，这家店没有骗人，有机会会常住。,民宿 装备 地台 适合 口味 欣赏 绚丽 夜景 照片 区别 骗人 机会 常住
单位旁边的公寓民宿，为了图方便，就近选了这家。房间很舒适，虽然是公寓，但设计上区分了客厅卧室，还有吧台厨房，设施齐全，对出差人士很友好，洗衣机洗衣液都配备，再用空调吹一晚就可以干。虽然楼层不高，但也能看到部分湘江和橘子洲，夕阳落下岳麓山前，在江面洒下的橙光，不要太迷人。,单位 公寓 民宿 房间 舒适 公寓 区分 客厅 卧室 吧台 厨房 设施 出差 人士 友好 洗衣机 洗衣 配备 空调 楼层 落下 江面 洒下 橙光 迷人
预订的时候看图片期待值很高，但是入住后很失望。说是百米江景，其实都看不了，被旁边的大楼挡住了。就一商业住宿两用的写字楼里的一个房间。这房型还是最贵那一档，没想到房间门对着就是这层写字楼的男厕所，膈应。。更吓人的是，一进门就三只蟑螂迎接我们。有一说一，看似光鲜亮丽，打造一个现代风氛围感，其实沙发蛮脏的。枕头又高又硬，有一个房间的门还是有问题的，开门关门都发出巨大声音。不推荐。。。,预订 图片 期待值 入住 失望 江景 大楼 挡住 商业 住宿 两用 写字楼 房间 房型 最贵 房间 写字楼 男厕所 吓人 进门 蟑螂 迎接 看似 打造 氛围 蛮脏 枕头 房间 开门 关门 发出 声音 推荐
设计非常有特色，是我喜欢的诧寂风，拍照很出片，让人感觉很温馨，泡澡还能看城市夜景，真是没有选错，小哥哥的服务也很棒，给我们准备了一次性泡澡袋，很贴心，宝子们，可以冲，和照片没区别！,特色 喜欢 诧寂 拍照 感觉 泡澡 夜景 选错 很棒 泡澡 贴心 宝子 照片 区别
每次出差都住这边，没有别的，就是方便，发密码就可以入住，醒了就离店，特别便捷，江景也不错，正是橘子洲这一段，据说在房间就能看到烟花，只是不知道哪次出差能碰上！,出差 密码 入住 便捷 江景 不错 房间 烟花 出差 碰上
房间挺好看的 位置也很方便离各个景点都很近 服务态度也很好 房间卫生也挺干净有洗衣机和冰箱 设施完善 住宿体验感不错,房间 好看 位置 景点 服务态度 房间 卫生 干净 洗衣机 冰箱 设施 完善 住宿 体验 不错
跟朋友过来长沙玩，在五一附近订了这家，店员很热情，房间布置装修都很用心，环境很悠闲安逸，卫生整洁，体验拉满，个人极力推荐,朋友 店员 热情 房间 布置 装修 用心 环境 卫生 整洁 体验
酒店位置好找方便，办理入住退房都方便快捷，服务很及时效率，房间安静舒适，窗外风景不错，挺满意的,酒店 位置 好找 办理 入住 退房 效率 房间 舒适 风景 不错 满意
很喜欢房间的布置，有点中式元素，灯光又很现代，坐在罗汉床上还能看到江，投影特别清晰，没有选错值得再来,喜欢 房间 布置 中式 元素 灯光 坐在 投影 清晰 选错 值得
酒店环境很好，空间够用安全感十足，设施齐全好用，卫生干净整洁，非常满意的体验，推荐,酒店 环境 空间 够用 设施 卫生 干净 整洁 满意 体验 推荐
环境很干净，设备完好，体验很棒，下次还会再来的，暖气很足，不怕冷天气！！经济实惠,环境 干净 完好 体验 很棒 再来 暖气 很足 天气 经济
在天宝兄弟楼上，对面是冬瓜山。出行十分方便。房间干净整洁。投影也很不错。,兄弟 对面 冬瓜 出行 房间 干净 整洁 投影 不错
地理位置很不错，去哪里都方便，睡觉也不吵闹，旁边就是天宝兄弟，下楼就可以吃吃吃！店家很好，走时还送了茶颜悦色的茶！,地理位置 不错 睡觉 吵闹 兄弟 下楼 店家 走时
交通餐饮便利，房间干净卫生,交通 餐饮 便利 房间 干净 卫生
非常好 地点好 很干净 房间特别舒服,地点 干净 房间 舒服
房间宽敞明亮，布局合理，设施齐全。地理位置也十分优越：马路对面汇湘楼餐馆为书院路地区排名第四的好口味当地餐馆；多个公交车在大椿桥设站，就在楼下；楼下有美宜佳超市，不远有绿叶水果和几家早餐店。店家很热心，元旦还送了伴手礼酱板鸭一只！稍有不足的是房间隔音效果不太好：元旦前一晚隔壁的年轻人欢度节日的欢笑持续到很晚，比较影响休息。,房间 布局合理 设施 地理位置 优越 马路 对面 餐馆 书院 地区 排名 口味 餐馆 公交车 设站 超市 绿叶 水果 早餐 店家 热心 伴手 礼酱 板鸭 房间 隔音 效果 不太好 年轻人 欢笑 休息
江景房，风格简约个性。非常满意，下次还会来,江景 风格 个性 满意
很好哦拍照很好看楼下就是湘江,拍照 好看
房间很好，卫生也很干净，环境不错,房间 卫生 干净 环境 不错
非常满意 隔音好 安静 干净 下次来还住,满意 隔音 干净
很不错、店家服务也很热情,不错 店家 热情
这个城景房能看到江，算是意外的喜欢，虽然楼层不高，但又不是来度假的，在酒店不出门，能看到橘子洲，岳麓山，出门100米就到江边，江边是一条超长的风景走廊，绿树成荫，很美,景房 算是 意外 喜欢 楼层 度假 酒店 出门 出门 超长 风景 走廊
房间很好看，品质也很好，宣传图与现实一样，所见即所得，小朋友非常喜欢，还可以看到江景哟，而且去橘子洲，文和友，五一广场都很近☺️，管家人也很好，我们早到了，还给我们办理了提前入住，感觉很好的旅程,房间 好看 品质 现实 所得 小朋友 喜欢 江景 文和友 还给 办理 提前 入住 感觉 很好 旅程
酒店距离地铁口很近，步行3分钟左右，旁边就是橘子洲头，节假日橘子洲头人真的太多了，在酒店江边看橘子洲观望毛主席画像也是很不错选择！老板很贴心让我们放心玩，延迟了两个半小时退房！,酒店 距离 地铁口 步行 酒店 观望 毛主席 画像 不错 选择 老板 贴心 放心 延迟 退房
办理入住很便捷，提前联系了管家，在小程序上办理了入住，到了酒店直接用密码进房间，房间有房卡，非常丝滑顺畅，退房也是小程序操作，直接离开，节省了很多时间,办理 入住 便捷 提前 管家 程序 办理 入住 酒店 密码 房间 房间 房卡 丝滑 顺畅 退房 程序 操作 离开 节省 时间
房间除了小一点没毛病，但是比一般的经济型酒店还是大，特别是卫生间很精致，投影幕布很大，两个人看看电影 床品很舒服，舒适。性价比很高￼,房间 毛病 经济型 酒店 卫生间 精致 投影幕 很大 电影 床品 舒服 舒适 性价比
床垫舒服，枕头也合适，床品都不错，让我睡了一个安稳觉，那个沐浴露的香味很喜欢，问管家要链接，管家也不知道，送了我两瓶，服务真棒,床垫 舒服 枕头 合适 床品 不错 安稳 香味 喜欢 管家 链接 管家 真棒
房间的地台很舒服，中间还有软垫，可以当一张床，地台上有懒人沙发，躺在上面看书，最重要的是可以到湘江和橘子洲，在这里发呆都很享受,房间 地台 舒服 软垫 懒人 看书 发呆 享受
酒店附近就是汇景，位置很好，附近停车也是很方便。房间挺大的，设施齐全，吹风筒这些小家电也是很实用，整体很满意,酒店 汇景 位置 停车 房间 挺大 设施 吹风 小家电 实用 整体 满意
很不错的一个酒店，装修布置非常细节，拍照很好看，房间的小家电也比较实用，风筒吹得舒服，热水也很快就有，挺满意的,不错 酒店 装修 布置 细节 拍照 好看 房间 小家电 实用 风筒 舒服 热水 满意
小程序办理入住，退房也是在小程序里操作就可以了。对社恐人士特别友好，也非常便捷，重点是服务也不错，有什么需要，管家都尽量满足,程序 办理 入住 退房 程序 操作 社恐 人士 友好 便捷 重点 不错 管家
环境不错，位置也合适，屋内设施都很新，干净卫生，服务态度好，卫生清理及时，有任何问题都及时反馈，下次再来！,环境 不错 位置 合适 设施 干净 卫生 服务态度 卫生 清理 反馈
到长沙找朋友玩住的这个酒店很不错，房间空间挺大的，一次性用品质量很好，卫生整洁干净，住得很舒服,朋友 玩住 酒店 不错 房间 空间 挺大 用品 质量 卫生 整洁 干净 舒服
和几个朋友一起聚会，晚上住在这个酒店，整体装修很好，停车方便，毛巾床单这些质量都很好，卫生干净,朋友 聚会 酒店 整体 装修 停车 床单 质量 卫生 干净
房间装修风格简约时尚，很干净，周边有夜市还有各种美食餐厅，设施准备的很贴心，宠物友好特别满意,房间 装修 风格 时尚 干净 夜市 美食 餐厅 设施 贴心 宠物 友好 满意
五一广场人很多很热闹，美食选择很多，价格也不算贵，公寓的位置很好，很方便，房间挺干净的，整体很满意,热闹 美食 选择 价格 不算 公寓 位置 房间 干净 整体 满意
房间很宽敞 干净 窗户直接可以看到江景 跨年夜去的还送了份伴手礼 非常满意 推荐大家去,房间 宽敞 干净 窗户 江景 份伴 手礼 满意 推荐
很不错的一次体验，房间布局很用心，温馨舒适，空间也够宽敞，设施很齐，卫生做的很到位，给个好评,不错 体验 房间 布局 用心 舒适 空间 宽敞 设施 卫生 到位 好评
环境很不错，交通出行很方便，房间空间很宽敞隔音效果很好，卫生很干净整洁，整体住的很满意,环境 不错 交通 出行 房间 空间 宽敞 隔音 效果 卫生 干净 整洁 整体 满意
这家酒店确实很棒！住过好几次都满意，房间也非常干净酒店员工也很友好，我度过了一段愉快的时光！￼,酒店 确实 很棒 满意 房间 干净 酒店 员工 友好 度过 愉快 时光
酒店周边环境挺好的，附近吃饭啥的都方便，房间空间挺大的，装修布置很用心，温馨的风格很喜欢,酒店 吃饭 房间 空间 挺大 装修 布置 用心 风格 喜欢
这里环境很好，房间装修布置非常用心，给人很温馨的感觉，窗景更是一流，床垫也很软，体验感非常满意,环境 房间 装修 布置 用心 感觉 窗景 一流 床垫 很软 体验 满意
酒店店员服务热情及时，环境很好，安静舒适宽敞明亮，卫生做的很细致，设施很完善，下次还来,酒店 店员 热情 环境 舒适 卫生 细致 设施 完善
民宿的大楼环境没得说，像五星酒店大堂大堂的前台姐姐24小时都在。会帮我刷电梯卡，感觉很不错￼,民宿 大楼 环境 酒店 大堂 大堂 前台 姐姐 小时 电梯 感觉 不错
公寓位置很好，酒店周边环境很好，房间的空间挺大的，设施齐全，很适合朋友聚会，玩得很开心,公寓 位置 酒店 房间 空间 挺大 设施 适合 朋友 聚会 开心
服务：很热情周到及时 环境：温馨舒适宽敞 卫生：整洁干净无异味 设施：完善齐全够用 整体都满意,环境 舒适 宽敞 卫生 整洁 干净 异味 设施 完善 够用 整体 满意
房间干净整洁舒适，布置宽大而温馨，设备都很齐全。住房感觉很安静舒服。客服人也很好耐心解答各种问题。值得信赖,房间 干净 整洁 舒适 布置 宽大 住房 感觉 舒服 客服 耐心 解答 值得 信赖
酒店房间挺大的，装修很好， 牙刷牙膏这些包装都很好，质量都不错，隔音效果很好，很满意,酒店 房间 挺大 装修 牙膏 包装 质量 不错 隔音 效果 满意
附近最好性价比的一家酒店，吃喝玩乐很多地方都有，店长进出都问好，服务真热情，真的是太棒了！,性价比 酒店 地方 店长 进出 问好 热情
酒店的景色超级美啊！房间的装修和布局也很赞！卫生也做的很到位，下次有机会我还会入住的。,酒店 景色 房间 装修 布局 卫生 到位 机会 入住
体验很好的一家酒店，店员都很热情有求必应，房间布置很温馨别致，环境很安逸悠闲，住的相当惬意,体验 很好 酒店 店员 热情 房间 布置 别致 环境 惬意
和朋友一起在五一广场附近吃完饭，就住了这家酒店，房间布置很喜欢，而且卫生做得很好，很满意,朋友 酒店 房间 布置 喜欢 卫生 满意
体验很好的一次入住，管家服务热情友好，房间布置别致优雅，热水很大，床铺柔软，非常舒服,体验 很好 入住 管家 热情 友好 房间 布置 别致 优雅 热水 很大 床铺 柔软 舒服
酒店的房间配置很好，一次性物品很齐全，还有小家电热水壶 都很干净的！可以放心使用。,酒店 房间 配置 物品 小家 电热水壶 干净
公寓房间挺大的，装修风格很喜欢，床垫很软，睡得很舒服。公寓位置很好，周边环境很好,公寓 房间 挺大 装修 风格 喜欢 床垫 很软 舒服 公寓 位置
第二次入住了，住着舒服，安静便捷，中央空调太热，只用穿一件衣服。卫生间很大很漂亮。,入住 舒服 便捷 中央空调 只用 衣服 卫生间 很大 很漂亮
酒店的环境非常整洁，布局也堪称完美，优雅不失情调的那种！设施也很完善 住的很舒心,酒店 环境 整洁 布局 堪称 完美 优雅 不失 情调 设施 完善 舒心
这家酒店的装潢非常的现代和时尚！特别好看我很喜欢，房间的设施使用也很便捷智能,酒店 装潢 时尚 好看 喜欢 房间 设施 便捷 智能
酒店很棒附近环境好好看！城市的繁华超好看！房间的装修也很有感觉！超级不错👍很推荐,酒店 很棒 环境 好好看 繁华 好看 房间 装修 感觉 不错 推荐
酒店住的很不错很满意！设施也很完善，房间的装修我也很喜欢！超级不错的一家酒店,酒店 不错 满意 设施 完善 房间 装修 喜欢 不错 酒店
酒店附近就是五一广场！很热闹也很有购物场所和美食店！这次体验很棒！还是很推荐的！,酒店 热闹 购物 场所 美食 体验 很棒 推荐
和朋友一起到五一广场聚餐，完了一起住这里，晚上一起玩玩桌游，房间空间挺大的，设施齐全,朋友 聚餐 玩玩 桌游 房间 空间 挺大 设施
酒店附近有一个五一广场！昨天周末人超级多，都来过平安夜了哈哈哈 还是很好玩的,酒店 好玩
位置很方便出游，房间挺满意，装修都很新，洗漱用品质量都很好，住的很安心，推荐,位置 房间 满意 装修 洗漱 用品 质量 安心 推荐
酒店的居住体验很棒！房间的设施也很完善，使用起来超便捷，卫生也很干净 我超喜欢,酒店 居住 体验 很棒 房间 设施 完善 便捷 卫生 干净 喜欢
房型不错，可以看到江景。有个榻榻米，躺着嘎嘎香。而且还有投影仪。在里面喝着小酒看茶啊二中挺开心的,房型 不错 江景 榻榻米 投影仪 开心
推荐这家，很适合出游入住，快捷方便，服务贴心，房间环境很好，干净舒适，体验很好,推荐 适合 入住 快捷 贴心 房间 环境 干净 舒适 体验
公寓位置挺好的，附近吃饭逛街都很方便，房间的配置设施齐全，很温馨，下次来旅游还住这里,公寓 位置 吃饭 逛街 房间 配置 设施
酒店装修挺好的，房间一次性的用品比较齐全，包装质量很好，热水热得也快，很满意,酒店 装修 房间 用品 包装 质量 热水 满意
这家酒店的房间设施很齐全的，也很完善，看起来也很新，这次居住体验我很满意 给个赞,酒店 房间 设施 完善 居住 体验 满意
地理位置非常好，周围的环境非常优美宁静，房间卫生非常干净整洁，床铺非常舒适,地理位置 环境 优美 房间 卫生 干净 整洁 床铺 舒适
酒店景色超棒！房间的布局也很好，附近还有超多的景点游玩，一天下来没有闲的时间😂,酒店 景色 超棒 房间 布局 超多 景点 游玩 时间
这个酒店的设施很齐全，房间的布局也很不错！装修也很有品味，超级不错的一家酒店。,酒店 设施 房间 布局 不错 装修 品味 不错 酒店
酒店装修很好看！我很喜欢这里的房间设施～使用方便看着也很干净！我要给一个赞,酒店 装修 好看 喜欢 房间 设施 看着 干净
酒店住起来很舒服，房间的设施也很齐全 装修也很棒，总体体验很不错的一家酒店啊,酒店 舒服 房间 设施 装修 很棒 总体 体验 不错 酒店
这家公寓真的太棒了，服务很热情，客房很舒适卫生很干净整洁，一次愉快的住宿体验,公寓 热情 客房 舒适 卫生 干净 整洁 愉快 住宿 体验
酒店住起来超级赞！景色也很好看，附近太热闹了，马上就是平安夜，大家都很开心,酒店 景色 好看 热闹 开心
这家酒店的房间很宽敞！卫生间我也比较注重细节，超级干净呢那种，很不错很推荐。,酒店 房间 宽敞 卫生间 注重 细节 干净 不错 推荐
房间很漂亮，房间内的小度语音很好用，非常方便，小管家也非常热心的为我服务，体验感很棒,房间 很漂亮 房间内 小度 语音 管家 体验 很棒
位置很方便出游，周边景点很多，房间宽敞明亮卫生，布置很好看，住的很安逸,位置 景点 房间 卫生 布置 好看
交通出行很方便，房间装修设计很有创意，卫生很干净整洁，床很柔软睡的很舒服,交通 出行 房间 装修 创意 卫生 干净 整洁 柔软 舒服
和朋友一起住的这家酒店很不错，面积挺大的，装修布置都很好，卫生干净，很满意,朋友 酒店 不错 面积 挺大 装修 布置 卫生 干净 满意
酒店附近有一个五一广场呀 前几天超级热闹！装修也很喜欢，地理位置超级赞,酒店 热闹 装修 喜欢 地理位置
这家酒店位置挺好出门很便利，办理入住退房都方便快捷，房间装饰别致温馨，推荐,酒店 位置 出门 便利 办理 入住 退房 房间 装饰 别致 推荐
位置好找，房间布置很别致，非常干净简洁，采光很好，设施非常齐全，体验不错,位置 好找 房间 布置 别致 干净 简洁 采光 设施 体验 不错
酒店位置很好，出游很方便，房间也很舒适，干净清爽，宽敞明亮整洁，推荐这家,酒店 位置 房间 舒适 干净 清爽 整洁 推荐
酒店的设施超级棒呢，使用起来很方便，床单也很洁白舒服，整体可以给个好评！,酒店 设施 床单 舒服 整体 好评
房间装修布置非常用心，床垫很软，枕头被子的质量挺好的，晚上睡得很舒服,房间 装修 布置 用心 床垫 很软 枕头 被子 质量 舒服
周边都很繁华热闹，酒店房间挺安静的，设施够用，宽敞明亮，卫生做的很细致，好评,繁华 热闹 酒店 房间 设施 够用 卫生 细致 好评
酒店房间装修挺好的，布置风格很喜欢，牙刷牙膏毛巾这些用品质量都挺好的,酒店 房间 装修 布置 风格 喜欢 牙膏 用品 质量 挺好
酒店位置便利，很适合出游，房间也够宽敞，东西都很新，卫生干净整洁，推荐,酒店 位置 便利 适合 房间 宽敞 卫生 干净 整洁 推荐
这家酒店景色超棒！视野超宽阔！卫生也做得很棒，角角落落都很干净 非常推荐。,酒店 景色 超棒 视野 宽阔 卫生 很棒 角角落落 干净 推荐
房间很宽敞，天气好的时候还能看到江景～还送了个长沙酱板鸭特产哈哈哈,房间 宽敞 天气 江景 板鸭 特产
房间装修布置很不错，周边环境挺好的，床垫枕头的质量很好，睡得很舒服,房间 装修 布置 不错 床垫 枕头 质量 舒服
位置很好，出门交通便利，房间设施很齐全，洗漱用品都很干净整洁，住的非常安心,位置 出门 交通 便利 房间 设施 洗漱 用品 干净 整洁 安心
酒店房间很喜欢，很大特别干净，床铺枕头被子都很柔软舒适，休息得很好,酒店 房间 喜欢 很大 干净 床铺 枕头 被子 柔软 舒适 休息
位置很方便好找，设施齐全好用，房间布局很温馨别致，卫生做的很到位，好评哦,位置 好找 设施 房间 布局 别致 卫生 到位 好评
交通很方便，房间配套设施很齐全，卫生做的很细致，床铺很柔软住的很舒服,交通 房间 配套 设施 卫生 细致 床铺 柔软 舒服
这家酒店房间打扫的很干净！我们出门看见保洁阿姨打扫都会带好帽子穿着保洁服,酒店 房间 打扫 干净 出门 保洁 打扫 帽子 穿着 保洁
公寓的主题很棒！很照顾带宝宝的家庭，设施也很齐全房间也很宽敞 非常不错。,公寓 主题 很棒 照顾 家庭 设施 房间 宽敞 不错
很不错的一个酒店，设施齐全，房间面积够大，几个朋友一起小聚玩得开心,不错 酒店 设施 房间 面积 朋友 开心
酒店位置很好，房间也很喜欢，卫生整洁，设施方便，装修还很新，满意,酒店 位置 房间 喜欢 卫生 整洁 设施 装修 满意
这家还是很不错的，位置很便利，服务及时，卫生做得很到位，满意的体验,不错 位置 便利 卫生 到位 满意 体验
酒店品质很棒！装修风格超好看的那种！房间也干净整洁，服务人员也很热情,酒店 品质 很棒 装修 风格 好看 房间 干净 整洁 人员 热情
酒店的设施很棒！房间也很宽敞 采光我看了很棒的，窗帘遮光性也很厉害。,酒店 设施 很棒 房间 宽敞 采光 很棒 窗帘 遮光 厉害
和朋友小聚住了这家酒店，房间面积挺大的，整体布置也好看，比较满意,朋友 聚住 酒店 房间 面积 挺大 整体 布置 好看
酒店装修很好，房间布置很好，风格很喜欢，前台接待非常热情，很满意,酒店 装修 房间 布置 风格 喜欢 前台 接待 热情 满意
酒店管家服务很到位，有求必应效率高，房间风景不错，风格也很喜欢,酒店 管家 到位 效率高 房间 风景 不错 风格 喜欢
酒店设计不错！那个地台布置了户外桌椅和天幕，追剧看城景，挺惬意😂,酒店设计 不错 地台 布置 桌椅 天幕 追剧 城景 惬意
入住体验很不错，房间挺满意的了，设施装修都是我喜欢的，给个好评,入住 体验 不错 房间 满意 设施 装修 喜欢 好评
酒店管家服务及时热情，房间设施布置很人性化，非常舒适方便，体验很好,酒店 管家 热情 房间 设施 布置 人性化 舒适 体验
老板特别好！！！！！耐心又细心，环境舒适！！！！！性价比高,老板 耐心 细心 环境 舒适 性价比
房间很干净，房间内设施齐全，房主人很好，有求必应，下次出差还来她家,房间 干净 房间内 设施 主人 出差
位置很方便 设施：好 卫生：好 环境：好 服务：好,位置 设施 卫生 环境
装修挺漂亮的，卫生环境各方面都很棒，位置也很方便,装修 漂亮 卫生 环境 很棒 位置
