user-name,comment-date,content,评价,content1,分词
匿名用户,2021年5月5日,夏天就是坐坐船，也没啥可玩的！,0.0,夏天就是坐船，也没啥可玩的！,夏天 坐船
匿名用户,2021年2月17日,开车将近三个小时到了景区停车场，走了二十多分钟到景区入口，先去看了一下冰灯展，然后还想去看看别的，结果发现都不开放，没其他地方可以去，冰灯展还凑合吧，但是一百块就看个冰灯展，很不值，也就二十多分钟就看完了，完全不推荐，现..,0.0,开车将近三个小时到了景区停车场，走了二十多分钟到景区入口，先去看了一下冰灯展，然后还想去看别的，结果发现都不开放，没其他地方可以去，冰灯展还凑合吧，但是一百块就看个冰灯展，很不值，也就二十多分钟就看完了，完全不推荐，现.,开车 三个 小时 景区 停车场 二十多分钟 景区 入口 先去 灯展 发现 开放 地方 灯展 凑合 一百块 看个 灯展 不值 二十多分钟 推荐
LiptonR,2021年2月18日,初七下午过来，到处堵车，走了好久才走进去，特别的冷，由于疫情很多景点都没有开，没什么意思，滑道排队两个小时！船也坐不了，腾龙电梯没开，百花洞进不去，我也是无语了！逛了一会出来了，又堵车一个小时，无语！！！,0.0,初七下午过来，到处堵车，走了好久才走进去，特别的冷，由于疫情很多景点都没有开，没什么意思，滑道排队两个小时！船也坐不了，腾龙电梯没开，百花洞进不去，我也是无语了！逛了一会出来了，又堵车一个小时，无语！,初七 下午 堵车 好久 走进 特别 疫情 景点 没什么 滑道 排队 两个 小时 腾龙 电梯 百花 进不去 无语 一会 堵车 小时
匿名用户,2021年2月17日,非常值得一去，下午四点以后去，不仅可以看冰雕还可以看冰灯展，六点十五还有灯光秀，人山人海，风景很美！去了一定穿厚点，带上手套和帽子，温度比较低！,1.0,非常值得一去，下午四点以后去，不仅可以看冰雕还可以看冰灯展，六点十五还有灯光秀，人山人海，风景很美！去了一定穿厚点，带上手套和帽子，温度比较低！,值得 一去 下午 四点 冰雕 看冰 灯展 六点 十五 灯光 人山人海 风景 穿厚 带上 手套 帽子 温度
張鵛,2021年5月5日,还行吧  喜欢看山看水的可以去    ！！,1.0,还行吧 喜欢看山看水的可以去 ！,还行 喜欢 看山 看水
hbt829388072,2021年5月1日,"【交通】太拥挤了，
【环境】还算不错
【项目】都挺好看的中宁",1.0,【交通】太拥挤了，【环境】还算不错【项目】都挺好看的中宁,交通 拥挤 环境 不错 项目 好看 中宁
鑫泽584649,2021年2月28日,里边冰灯特别少，能逛30分钟就不错了！,0.0,里边冰灯特别少，能逛30分钟就不错了！,里边 冰灯 特别 分钟 不错
DOD935056902,2021年2月1日,周末带孩子前往龙庆峡风景区看冰灯，我还是小的时候去过，很多年没去了，心里也有很多期待。我们是晚上六点多到的，没进景区门，就能看到山上布置的彩灯，长城的造型，还有龙庆峡三个大字，进去景区后，穿过紫红色的同心桥，进入冰灯流光...,1.0,周末带孩子前往龙庆峡风景区看冰灯，我还是小的时候去过，很多年没去了，心里也有很多期待。我们是晚上六点多到的，没进景区门，就能看到山上布置的彩灯，长城的造型，还有龙庆峡三个大字，进去景区后，穿过紫红色的同心桥，进入冰灯流光.,周末 孩子 前往 龙庆峡 风景区 冰灯 去过 很多年 没去 期待 晚上 六点 多到 景区 山上 布置 彩灯 长城 造型 龙庆峡 三个 大字 景区 穿过 紫红色 同心 冰灯 流光
superbxs,2021年4月24日,挺不错的，规模，效果不次于其他地方的冰灯，带着家人孩子来的，都很满意,1.0,挺不错的，规模，效果不次于其他地方的冰灯，带着家人孩子来的，都很满意,挺不错 规模 效果 次于 地方 冰灯 家人 孩子 满意
w1a1n1g1meng,2021年5月4日,缘来缘去终会散，花开花谢总归尘,1.0,缘来缘去终会散，花开花谢总归尘,缘来 终会散 花开花谢 总归
w1a1n1g1meng,2021年5月4日,烟花不美谁痴美，烟花不笑谁人绸,1.0,烟花不美谁痴美，烟花不笑谁人绸,烟花 不美 痴美 烟花 不笑 人绸
快乐少年上月球,2021年4月28日,龙庆峡风景区有投到山体上的影片，内容丰富生动有趣,1.0,龙庆峡风景区有投到山体上的影片，内容丰富生动有趣,龙庆峡 风景区 投到 山体 影片 内容 生动有趣
OpJ432118595,2021年2月21日,很满意，购票后直接刷身份证入园，夜景很美，让人如痴如醉，流连忘返。,1.0,很满意，购票后直接刷身份证入园，夜景很美，让人如痴如醉，流连忘返。,满意 购票 身份证 入园 夜景 如痴如醉 流连忘返
w1a1n1g1meng,2021年5月4日,在春天播下种子，在秋天收获快乐,1.0,在春天播下种子，在秋天收获快乐,春天 播下 种子 秋天 收获 快乐
匿名用户,2021年2月27日,环境挺好的，从昌平过去一路没堵车，景区花灯还可以，冰灯有些化了，整体还不错。,1.0,环境挺好的，从昌平过去一路没堵车，景区花灯还可以，冰灯有些化了，整体还不错。,环境 昌平 一路 堵车 景区 花灯 冰灯 整体 不错
西贝小木家,2021年4月6日,下午去的，冰灯鬼斧神工，雕刻的特别好，通过不同颜色的灯折射出美丽逼真的造型，可以逛一个小时，晚上院里的灯光也特别美，不虚此行。,1.0,下午去的，冰灯鬼斧神工，雕刻的特别好，通过不同颜色的灯折射出美丽逼真的造型，可以逛一个小时，晚上院里的灯光也特别美，不虚此行。,下午 冰灯 鬼斧神工 雕刻 特别 颜色 折射出 美丽 逼真 造型 小时 晚上 院里 灯光 特别 不虚此行
a飞a157,2021年5月1日,比较期待，去后比较失望，和想象差太远了,0.0,比较期待，去后比较失望，和想象差太远了,期待 失望 想象 差太远
快乐少年上月球,2021年4月28日,龙庆峡冰灯大世界非常好看，大家玩的开心?！,1.0,龙庆峡冰灯大世界非常好看，大家玩的开心?！,龙庆峡 冰灯 世界 好看 开心
leea_526,2021年2月13日,晚上灯光效果还是很好看的，下午五点开始进去看冰灯，出来的时候外面还有山上的灯都开了，很漂亮！,1.0,晚上灯光效果还是很好看的，下午五点开始进去看冰灯，出来的时候外面还有山上的灯都开了，很漂亮！,晚上 灯光效果 好看 下午 五点 冰灯 外面 山上 很漂亮
anniejiao,2021年3月7日,很不错,1.0,很不错,不错
Nov4th,2021年5月4日,山清水秀,1.0,山清水秀,山清水秀
匿名用户,2021年2月25日,很差，没什么意思，停车一次20，。里边灯少的可怜，100的门票真的很不值，也就和北京文旅年票里30的冰灯差不多。。山里真的特别的冷，连个休息的地也没有。。。,0.0,很差，没什么意思，停车一次20，。里边灯少的可怜，10的门票真的很不值，也就和北京文旅年票里30的冰灯差不多。山里真的特别的冷，连个休息的地也没有。,很差 没什么 停车 里边 灯少 可怜 门票 真的 不值 北京 文旅 年票 冰灯 山里 真的 特别 休息
yHN456801939,2021年2月17日,还是很值得一去，冰灯和花灯都很漂亮，晚上6:15，6:45有灯光秀。初五这天太冷了真的冻成了狗。大家去看灯一定要多穿衣服。我们是下午三点到的，孩子和爸爸先爬到山上玩了滑道，然后我们去看了冰灯（看了两遍）花了一个半小时，出...,1.0,还是很值得一去，冰灯和花灯都很漂亮，晚上6:15，6:45有灯光秀。初五这天太冷了真的冻成了狗。大家去看灯一定要多穿衣服。我们是下午三点到的，孩子和爸先爬到山上玩了滑道，然后我们去看了冰灯（看了两遍）花了一个半小时，出.,值得 一去 冰灯 花灯 很漂亮 晚上 灯光 初五 这天 太冷 真的 冻成 看灯 穿衣服 下午 三点 孩子 山上 滑道 冰灯 两遍 一个半 小时
zorro1666,2021年4月28日,全程用时10分钟，没有什么可看的，太差,0.0,全程用时10分钟，没有什么可看的，太差,全程 用时 分钟 可看
匿名用户,2021年3月7日,冬天也就冰灯凑合看看，范围挺小的。其它没啥看头，建议春夏季再来,0.0,冬天也就冰灯凑合看，范围挺小的。其它没啥看头，建议春夏季再来,冬天 冰灯 凑合 看头 建议 春夏季
匿名用户,2021年4月26日,过年的固定节目了，年年看冰灯，年年有惊喜。,1.0,过年的固定节目了，年看冰灯，年有惊喜。,过年 固定 节目 冰灯 惊喜
cpc5723515285896,2021年3月20日,"我们去的时候冰期已经快结束了，有一些已经开始化了，室外的雪雕都没了，只剩下室内的冰灯展了，基本上逛下来一个小时，“上山”“下山”每次大概一公里的路程，可以坐电车10/次，没去过的可以去看看，个人觉得一般
好像索道还蛮有意...",1.0,我们去的时候冰期已经快结束了，有一些已经开始化了，室外的雪雕都没了，只剩下室内的冰灯展了，基本上逛下来一个小时，“上山”“下山”每次大概一公里的路程，可以坐电车10/次，没去过的可以去看，个人觉得一般好像索道还蛮有意.,冰期 结束 室外 雪雕 剩下 室内 灯展 逛下来 小时 上山 下山 每次 公里 路程 电车 去过 好像 索道 有意
FAN826505860,2021年2月1日,进去景区可坐摆渡车，十元每人，走着也没多远，还可沿途赏灯，没有了过去景区内沿途的饭店，旅游品店，倒是多了一份清静，一两个小时足够了，值得一看，不够门票100还是贵点，也没什么服务项目。,1.0,进去景区可坐摆渡车，十元每人，走着也没多远，还可沿途赏灯，没有了过去景区内沿途的饭店，旅游品店，倒是多了一份清静，一两个小时足够了，值得一看，不够门票10还是贵点，也没什么服务项目。,景区 摆渡 十元 每人 没多远 沿途 赏灯 景区 沿途 饭店 旅游品 一份 清静 一两个 小时 足够 值得一看 门票 贵点 没什么 服务项目
Candy.GCT,2021年4月27日,带着爸妈去的 挺不错的游玩体验,1.0,带着爸妈去的 挺不错的游玩体验,爸妈 挺不错 游玩 体验
林平之1979,2021年4月25日,感觉特别一般 以后都不回去了 一脚泥,0.0,感觉特别一般 以后都不回去了 一脚泥,感觉 特别 回去 一脚
匿名用户,2021年4月21日,确实冰雕规模不小，也够水平，没看过的看看也不错我觉得,1.0,确实冰雕规模不小，也够水平，没看过的看也不错我觉得,确实 冰雕 规模 不小 水平 看过 不错
看天想你,2021年2月13日,环境挺好，就是灯少点，带孩子去看看还算不错,1.0,环境挺好，就是灯少点，带孩子去看还算不错,环境 灯少点 孩子 不错
Rco990801036,2021年4月24日,人太多，也不怎么样，就是看人去了，不推荐去,0.0,人太多，也不怎么样，就是看人去了，不推荐去,人太多 不怎么样 看人 推荐
bxl729861577,2021年3月25日,"耸岭叠峰入宇空，扬波泻水困峡中。
苍松荡叶层层翠，领袖题词点点红。
圣象吸涛留妙影，仙驼踏顶塑奇形。
船夫岸上邀游客，月亮湾边聚笑容。",1.0,耸岭叠峰入宇空，扬波泻水困峡中。苍松荡叶层翠，领袖题词点红。圣象吸涛留妙影，仙驼踏顶塑奇形。船夫岸上邀游客，月亮湾边聚笑容。,耸岭 叠峰入 宇空 扬波 泻水 困峡 苍松 荡叶层 领袖 题词 点红 圣象 吸涛 留妙影 仙驼 踏顶 塑奇形 船夫 岸上 游客 月亮 笑容
看天想你,2021年2月13日,冰灯少，但是花灯多，感觉还凑合，就是百里画廊没开,1.0,冰灯少，但是花灯多，感觉还凑合，就是百里画廊没开,冰灯 花灯 感觉 凑合 百里 画廊
HlC380343641,2021年2月23日,太失望了，因为天气原因，冰灯都化成水了。冰灯展区就是水塘，好多人物之类的已经不成样子。室外灯展还算可以吧。,0.0,太失望了，因为天气原因，冰灯都化成水了。冰灯展区就是水塘，好多人物之类的已经不成样子。室外灯展还算可以吧。,失望 天气 原因 冰灯 化成 冰灯 展区 水塘 好多 人物 样子 室外 灯展
Ptq615847129,2021年3月4日,什么破玩样儿，山也上不去封了，就个冰灯，屁大点地方，开车过去一个半点，门口排队2个小时，进去就慢点玩样儿，这是我出来玩花钱最少的一次，一来一回不算车费，连300块钱都没花完，买个煎饼15，帽子手套40，两个烤肠10，一杯...,0.0,什么破玩样儿，山也上不去封了，就个冰灯，屁大点地方，开车过去一个半点，门口排队2个小时，进去就慢点玩样儿，这是我出来玩花钱最少的一次，一来一回不算车费，连30块钱都没花完，买个煎饼15，帽子手套40，两个烤肠10，一杯.,破玩 样儿 冰灯 屁大 地方 开车 半点 门口 排队 小时 慢点 样儿 花钱 最少 一回 不算 车费 块钱 花完 买个 煎饼 帽子 手套 两个 烤肠 一杯
z老兵,2021年2月20日,一般吧，场地不大，效果也不咋样，停车场很拥挤，还单独收费，与门票价格100元不匹配，而且景区里其它地方都看不了；上午去了永宁古城，与这里间隔半小时路程；从这里返京需要一个半小时，交通还算便利,0.0,一般吧，场地不大，效果也不咋样，停车场很拥挤，还单独收费，与门票价格10元不匹配，而且景区里其它地方都看不了；上午去了永宁古城，与这里间隔半小时路程；从这里返京需要一个半小时，交通还算便利,场地 效果 咋样 停车场 拥挤 单独 收费 门票价格 匹配 景区 地方 上午 永宁 古城 间隔 半小时 路程 返京 一个半 小时 交通 便利
果果优优21,2021年2月17日,明年有机会再去，山里有点冷，去的可以多保暖，值得一去,1.0,明年有机会再去，山里有点冷，去的可以多保暖，值得一去,明年 机会 山里 保暖 值得 一去
IPu935541445,2021年4月24日,热闹，还不错,1.0,热闹，还不错,热闹 不错
冯老师等着别人请,2021年2月13日,"【交通】特别堵车，千万早点停车
【环境】非常有意境",1.0,【交通】特别堵车，千万早点停车【环境】非常有意境,交通 特别 堵车 早点 停车 环境 意境
IPu935541445,2021年4月24日,不错，推荐,1.0,不错，推荐,不错 推荐
AhT429066007,2021年2月17日,驱车单程两小时去的。人巨多，并没有很惊艳，而且再好看的冰灯五分钟后也会审美疲劳。如果不是离得近真的不建议折腾。,0.0,驱车单程两小时去的。人巨多，并没有很惊艳，而且再好看的冰灯五分钟后也会审美疲劳。如果不是离得近真的不建议折腾。,驱车 单程 小时 巨多 惊艳 好看 冰灯 五分钟 审美疲劳 离得 真的 建议 折腾
太久没去流浪,2021年4月16日,还好吧，地方不大，但是确实还不错,1.0,还好吧，地方不大，但是确实还不错,还好 地方 确实 不错
OEN843901633,2021年3月4日,正月十六，温度高了，冰雕开始大面积融化，人物造型都缺胳膊少腿了，票价还一分都没有优惠。,0.0,正月十六，温度高了，冰雕开始大面积融化，人物造型都缺胳膊少腿了，票价还一分都没有优惠。,正月 十六 温度 冰雕 大面积 融化 人物造型 胳膊 少腿 票价 一分 优惠
匿名用户,2021年4月18日,全化了，都是水，要去早点去，不然不值得,1.0,全化了，都是水，要去早点去，不然不值得,全化 早点 值得
HuR965639944,2021年4月17日,这几年没有多大变化，修了路，多一座山上的景,1.0,这几年没有多大变化，修了路，多一座山上的景,几年 多大 变化 一座 山上
FuD163914762,2021年2月12日,对于过年不能出京，是个值得一去的地方。,1.0,对于过年不能出京，是个值得一去的地方。,过年 出京 值得 一去 地方
匿名用户,2021年2月15日,设施简陋，人员看管极差，有一个小的冰做亭子，里面挤满了孩子，有的成人也在里面挤，儿童被挤的哇哇叫，极易造成挤塌危险??！另外进停车场拥堵差不多一个多小时吧！只能游玩一个小时结束，出来停车费收20元，够黑的！特别是网上按限... ,0.0,设施简陋，人员看管极差，有一个小的冰做亭子，里面挤满了孩子，有的成人也在里面挤，儿童被挤的哇叫，极易造成挤塌危险?！另外进停车场拥堵差不多一个多小时吧！只能游玩一个小时结束，出来停车费收20元，够黑的！特别是网上按限. ,设施 简陋 人员 看管 极差 亭子 挤满 孩子 成人 儿童 极易 挤塌 危险 停车场 拥堵 一个多 小时 只能 游玩 小时 结束 停车费 特别 网上 按限
wjwljm,2021年2月17日,高科技灯光秀不错！就是景区停车有点混乱没有人指挥调度自己找车位，通往景区只有不到5公里开车快2小时【交通】堵车,0.0,高科技灯光秀不错！就是景区停车有点混乱没有人指挥调度自己找车位，通往景区只有不到5公里开车快2小时【交通】堵车,高科技 灯光 不错 景区 停车 混乱 指挥 调度 车位 通往 景区 不到 公里 开车 小时 交通 堵车
qvp261379467,2021年2月17日,太垃圾了真的！几年前就这样，至今没变过，还少了很多冰灯游览项目，开车俩小时，走路半小时，看冰灯10分钟就出来了…这不就是骗钱骗感情吗？奉劝大家不要再去了，真的垃圾！,0.0,太垃圾了真的！几年前就这样，至今没变过，还少了很多冰灯游览项目，开车俩小时，走路半小时，看冰灯10分钟就出来了…这不就是骗钱骗感情吗？奉劝大家不要再去了，真的垃圾！,垃圾 真的 几年 没变 还少 冰灯 游览 项目 开车 小时 走路 半小时 冰灯 分钟 骗钱 感情 奉劝 真的 垃圾
匿名用户,2021年2月17日,绝对值得一去，冰灯和冰雕太好看了,1.0,绝对值得一去，冰灯和冰雕太好看了,值得 一去 冰灯 冰雕 好看
KCv625683152,2021年3月9日,没有多少景、冰滑梯太小了、附近有农家院、豆腐锅挺贵的,0.0,没有多少景、冰滑梯太小了、附近有农家院、豆腐锅挺贵的,滑梯 太小 农家院 豆腐 锅挺贵
匿名用户,2021年2月9日,挺好的，很漂亮,1.0,挺好的，很漂亮,很漂亮
LoZ480339628,2021年2月26日,就说我们到的晚，晚上九点半到，门口检票也不提醒还有半小时就关灯，直接给我们检票进园，十点直接灯全关了，七张票，三个老人一个孩子，愣是摸黑走了三四公里下到停车场，路边彩灯关了咱理解，居然连路灯都关了真是醉了，这龙庆峡冰灯也...,0.0,就说我们到的晚，晚上九点半到，门口检票也不提醒还有半小时就关灯，直接给我们检票进园，十点直接灯全关了，七张票，三个老人一个孩子，愣是摸黑走了三四公里下到停车场，路边彩灯关了咱理解，居然连路灯都关了真是醉了，这龙庆峡冰灯也.,晚上 九点半 门口 检票 提醒 半小时 关灯 检票 进园 十点 全关 七张 三个 老人 孩子 摸黑 三四 公里 停车场 路边 彩灯 关了 理解 路灯 龙庆峡 冰灯
xuepiao天晴,2021年2月17日,场地有点小啊，还是晚上好看，下午三点多到的，正好看了夜景。场地有点小啊，还是晚上好看，下午三点多到的，正好看了夜景。场地有点小啊，还是晚上好看，下午三点多到的，正好看了夜景。场地有点小啊，还是晚上好看，下午三点多到的，正好看了夜景。,0.0,场地有点小啊，还是晚上好看，下午三点多到的，正好看了夜景。,场地 晚上 好看 下午 三点 多到 正好 夜景
LqL815623445,2021年2月4日,我拍这么好看，商家给版权费吗?,0.0,我拍这么好看，商家给版权费吗?,好看 商家 版权
JrO881605147,2021年4月5日,不错玩的很开心，冬天不错的好去处，大人孩子都能玩,1.0,不错玩的很开心，冬天不错的好去处，大人孩子都能玩,不错 开心 冬天 不错 好去处 大人 孩子
匿名用户,2021年2月16日,还算是不错的一次旅行，晚上要走的时候飘起了雪花，是真冷，需要多穿！,1.0,还算是不错的一次旅行，晚上要走的时候飘起了雪花，是真冷，需要多穿！,算是 不错 旅行 晚上 飘起 雪花
饿饿饿o鹅鹅鹅,2021年2月27日,冰灯已经化了，就这卖100？全程不到200米。,0.0,冰灯已经化了，就这卖10？全程不到20米。,冰灯 全程 不到
ycdivw,2021年2月25日,人很多，孩子喜欢玩儿，总体来说还不错，,1.0,人很多，孩子喜欢玩儿，总体来说还不错，,孩子 喜欢 玩儿 总体 不错
ycdivw,2021年2月25日,人很多，冰灯不错，孩子喜欢玩儿，满意,1.0,人很多，冰灯不错，孩子喜欢玩儿，满意,冰灯 不错 孩子 喜欢 玩儿 满意
雪糕v杀手,2021年2月20日,人太多了，冰灯挺好看的，堵车太要命了,1.0,人太多了，冰灯挺好看的，堵车太要命了,人太多 冰灯 好看 堵车 要命
JbK168363654,2021年2月15日,不错值得一看！,1.0,不错值得一看！,不错 值得一看
匿名用户,2021年2月13日,还不错,1.0,还不错,不错
gnj270089650,2021年4月3日,小学生游览胜地，人流还行。确实平时不多见,1.0,小学生游览胜地，人流还行。确实平时不多见,小学生 游览胜地 人流 确实 平时 不多见
LX芾晓,2021年3月16日,地方特色  如果有庙会更好了 希望疫情赶快回去吧,1.0,地方特色 如果有庙会更好了 希望疫情赶快回去吧,地方 特色 庙会 更好 希望 疫情 回去
LX芾晓,2021年3月16日,给朋友买的票  他们都说挺好的，明年孩子大了也去看看,1.0,给朋友买的票 他们都说挺好的，明年孩子大了也去看,朋友 明年 孩子
匿名用户,2021年4月1日,算是打卡地 其实展厅就那么点地方 感觉真亏,0.0,算是打卡地 其实展厅就那么点地方 感觉真亏,算是 打卡 展厅 地方 感觉 真亏
LX芾晓,2021年3月16日,还不错  带孩子过来的  小宝贝儿很喜欢呢,1.0,还不错 带孩子过来的 小宝贝儿很喜欢呢,不错 孩子 宝贝儿 喜欢
gnj270089650,2021年4月3日,可以，去还是可以的，适合小学生参观。,1.0,可以，去还是可以的，适合小学生参观。,适合 小学生 参观
LX芾晓,2021年3月16日,虽然画了许多水但还是很好的，下次还来,1.0,虽然画了许多水但还是很好的，下次还来,下次 还来
JbK168363654,2021年2月15日,不错！适合晚上来,1.0,不错！适合晚上来,不错 适合 晚上
匿名用户,2021年2月17日,"冬天封山，什么都不能玩，什么地方都不能去，基本只能看冰灯展，然而这个冰灯展区面积不算太大，东西不太多，总体来说完全不值票价，吃顿麦当劳不香么
 开车单程两小时，停车场到景区入口步行差不多半个小时，里面逛半个多小时，结束",0.0,冬天封山，什么都不能玩，什么地方都不能去，基本只能看冰灯展，然而这个冰灯展区面积不算太大，东西不太多，总体来说完全不值票价，吃顿麦当劳不香么 开车单程两小时，停车场到景区入口步行差不多半个小时，里面逛半个多小时，结束,冬天 封山 地方 只能 看冰 灯展 冰灯 展区 面积 不算 东西 不太多 总体 不值 票价 吃顿 麦当劳 不香 开车 单程 小时 停车场 景区 入口 步行 半个 小时 半个 小时 结束
xuepiao天晴,2021年2月17日,场地有点小啊，还是晚上好看，下午三点多到的，正好看了夜景。,1.0,场地有点小啊，还是晚上好看，下午三点多到的，正好看了夜景。,场地 晚上 好看 下午 三点 多到 正好 夜景
lucky粑粑爸爸,2021年4月3日,一般吧，不去会后悔，去了更后悔。,0.0,一般吧，不去会后悔，去了更后悔。,不去 后悔 后悔
epI166422049,2021年3月15日,非常壮观的一个地方。非常壮观的一个地方。,1.0,非常壮观的一个地方。,壮观 地方
Composure3,2021年2月24日,去晚了，冰化了，里边的灯确实挺好看的，人特别多，不过不是很凉。,1.0,去晚了，冰化了，里边的灯确实挺好看的，人特别多，不过不是很凉。,冰化 里边 确实 好看 特别 很凉
chenzeng1986,2021年3月28日,一般般，没什么看的，不值得去看，下次可能不会再去了。,0.0,一般，没什么看的，不值得去看，下次可能不会再去了。,没什么 值得 下次
tangbilan1976,2021年2月20日,非常漂亮，就是有点冷，大家多穿点,1.0,非常漂亮，就是有点冷，大家多穿点,漂亮 穿点
Composure3,2021年2月24日,去的太晚了，外边的灯比较好看，里边的冰都化掉了，踩了一脚水。,1.0,去的太晚了，外边的灯比较好看，里边的冰都化掉了，踩了一脚水。,太晚 外边 好看 里边 冰都化 一脚
hu_hu,2021年2月18日,灯光不错，挺美的，孩子很喜欢。,1.0,灯光不错，挺美的，孩子很喜欢。,灯光 不错 美的 孩子 喜欢
