content,fenci,聚类结果,二级-聚类结果
你提的很好吗你提的好有锤子用啊玩足球，比得是身价比得是人际关系你那个道上的不知道足球是赚钱的职业吗,锤子 足球 身价 足球 职业,1,0
别的都同意，中国足球一飞冲天还是别报什么一样了,中国 足球,1,0
中国人又有自己的足球了，哈哈哈,中国 足球,1,0
只能说这才是足球的意义,足球 意义,1,0
太你就最后那句太武断了：“从此中国足球一飞冲天”，把足协拿去全部毙了，让贵州这帮人上，估计才能一飞冲天,中国 足球 贵州,1,0
也许说的中国足球的未来，不是指世界杯名次，而是全民爱运动,中国 足球 世界杯 名次 全民,1,0
以前，我对中国足球是没什么信心的，中国足球没救了。但现在看到贵州村超，才发觉，不是中国足球完了，是某些不思进取的蠢货完蛋了，中国足球仍然星火依旧，只待燎原之日一飞冲天!,中国 足球 信心 中国 足球 贵州 中国 足球 蠢货 中国 足球 星火 燎原,1,0
这才是中国足球未来的希望,中国 足球,1,0
一飞冲天算了吧 先把现在的国足那一堆解散了在说把 还在哪里天天吃海参呢,国足 海参,1,1
这才是看足球的氛围鸭,足球 氛围,1,0
这才是中国足球,中国 足球,1,0
不知道为什么看到自己家乡的时候反而哭了，我在想到底是因为为什么呢可能我看到的不只是足球，同样的是那颗赤诚之心，国足姑且不做评价，贵州村超让我感受到了什么才是真正的足球,家乡 足球 赤诚 评价 贵州 足球,1,0
那些国外的教练虽然懂足球但是不懂官场。,足球 官场,1,0
纯粹的足球就是要享受足球带来的快乐。我想想我上学的时候，不管球技怎样，比赛输赢，大家在一起踢球的时候真的很开心，即使回家被父母骂，我们也毫不在乎。村超也是如此，大家都是把享受足球带来的快乐放在了第一位，这就是村超火爆的根本原因,足球 足球 上学 球技 踢球 回家 父母 足球 根本原因,1,0
大家都在说村超是人民群众的运动，足球要回到大众。可是存超的支持者大多目光只局限于贵州，忽视了自己当地的足球。张口闭口谈“人民群众的足球”，这些人有没有付费支持过自己家乡球队的比赛有多少人与周围的邻居朋友去踢一场球很多人对村超的支持仅仅停留在打几个字上，甚至连看一场完整的村超比赛直播都做不到。,群众 足球 大众 支持者 目光 局限于 贵州 足球 张口 闭口 群众 足球 家乡 球队 朋友,1,0
中国一天不变成发达国家，或者不堕落成粪坑国家，足球都好不了。,中国 粪坑 国家 足球,1,0
足球不是打打杀杀，足球是人情事故,足球 足球 人情事故,1,0
先不说村超中超好与坏，我认为中国足球环境差，有两点，第一校园，第二社会。,中国 足球 环境 校园 社会,1,0
中超狗都不看，村超才是中国足球的未来,中国 足球,1,0
村超业余足球你爱看看，爱踢踢。非要跟职业足球扯关系，还村镇一级一级淘汰赛选拔去踢世预赛都来了。我只说一个，你村超上15个人，随便找一家职业俱乐部17梯队，你看村超队能进得了一个球吗球盲别显得自己很能耐，职业足球还真就是精英运动，百里挑一都说少了。人家职业足球的市场也跟你村超没关系，职业足球市场是在城市里，你村里培养个蛋的足球市场。,业余 足球 踢踢 职业 足球 关系 村镇 淘汰赛 职业 俱乐部 梯队 超队 盲别 能耐 职业 足球 精英 职业 足球 市场 职业 足球 市场 城市 足球 市场,1,0
前几天评论了下村超好，动了人家的经济链，结果下面就有骂的，说你懂个屁，什么看到你的评论才知道中国足球有多少球盲之类的,评论 下村 经济 评论 中国 足球 球盲,1,0
中国足球缺的是什么缺的是海参啊 还有去参加比赛 回来报销900万啊,中国 足球 海参,1,1
我们的职业足球，因果关系颠倒了,职业 足球 因果关系,1,0
虽然我不懂足球~~但我喜欢贵州朋友们的热情啊~~~我不会说我是想去吃东西的…~~,足球 贵州 朋友 热情 东西,1,0
村超火了是好事，很多孩子可能会因此喜欢上足球。我希望各位不是足球迷的路人，骂国足可以，他们该骂。但不要把任何跟足球有关的东西都扯到骂国足上。村超火了你们说国足不如他们，说高手在民间，这些言论除了吸引一些路人给你点个赞一起骂国足除此之外没有任何意义。国足踢的不好确实该骂，但如果社会主流言论毫无底线的贬低侮辱国足，甚至用自己错误的认知评价国足，那只会让更多的人对中国足球嗤之以鼻。一个对足球如此极端的社会是孕育不出良好的足球环境的。现在很多年轻人本来就不愿意出门了，他们更乐意在网络中需求快乐，想想他们了解足球的时候看到无数的漫骂，他们还会去接触足球吗。一个国家的足球需要社会的支持，只有家长愿意带孩子去看球去踢球，我们才能发现自己的梅西和罗。,好事 孩子 足球 足球迷 路人 国足 足球 东西 国足 高手 民间 言论 路人 国足 意义 社会 言论 底线 错误 评价 中国 足球 足球 社会 足球 环境 年轻人 乐意 网络 足球 足球 国家 足球 社会 家长 孩子 踢球 梅西和罗,1,0
我觉得什么成绩什么中国已经不重要了 重要的是人民高兴爱好,成绩 中国,1,0
中超的足球也很纯粹，别的没有，只有杂质,足球 杂质,1,0
网友是这样的捏，永远见不得好，永远在骂，环境不好在骂，现在搞点纯粹一点的，又说是炒作，要不你来组织振兴中国足球,网友 环境 中国 足球,1,0
中国足球最失败的是过早把商业化作为足球发展的主方向。,中国 足球 商业化 足球 方向,1,0
有些人在足球这个行业就是为了捞钱捞名，有些人踢球，他就只是在踢球,足球 行业 踢球 踢球,1,0
中超很纯粹，没有足球,足球,1,0
有个地方你得承认，青训很重要，而中国足球体系里青训一言难尽,地方 青训 中国 足球 体系 里青训,1,0
麻烦吧我们去掉，那个是足鞋的足球。村超才是我们的足球。,麻烦 足球 足球,1,0
村超自媒体，啥都有，就是里头不会出现足球,媒体 足球,1,0
这才对嘛就是那句，中国那么多人，喜欢足球的人那么多，怎么可能找不到踢的好足球的人,中国 足球 足球,1,0
让它继续纯粹几十年，中国足球不就有希望了，自己往上面蹭热度，说些片汤话，真的好吗这些不相干的人和事，跟村超有半点关系吗,中国 足球 往上面 热度 人和事 关系,1,0
唉，资本进入贵州村超，这下真成足球丁真了,资本 贵州 足球 丁真,1,0
关键是踢得好就能踢职业吗什么叫做把孩子送去踢球他喜欢去玩当然可以，强身健体有什么不好，想走职业就别费力气了，中国足球踢得不是球，是他妈人情世故,关键 职业 孩子 踢球 职业 费力气 中国 足球,1,0
之前和梅州队的人聊过…他说进中超很难，并不是因为你能力好就能进，那是我第一次和职业足球聊天，其实足球运动员在面前身材超级好,梅州 能力 职业 足球 聊天 足球 运动员 身材,1,0
另一个足球很纯粹的已经世界杯4强了。贵州这个本质上还是吸引旅游的吧,足球 世界杯 贵州 本质,1,0
其他地方的足球有跳舞转圈跳舞和吹头发。不然不纯粹了,地方 足球 转圈,1,0
还是取消职业足球吧，咱不丢这人了。,职业 足球,1,0
这里面能有多少人关心中国足球发展，而且纯不纯粹你怎么就敢确定呢,关心 中国 足球,1,0
资本运作而已，理想很好，能顶多久，中国人不爱足球，记者这句话，三个月后见,资本运作 理想 能顶 中国 足球 记者,1,0
这里的足球是爱好,足球,1,0
一群海参都吃不起的也配踢球,海参 踢球,1,1
你还是没有说到关键点，到底谁对中国足球负责，负责就是好的不好的都必须要承担后果，这个才是关键。,关键点 中国 足球 后果 关键,1,0
没有中国足协的中国足球才是真的中国足球,中国足协 中国 足球 中国 足球,1,0
当我这个不看足球的人 都知道村超了 看来这个事情又开始要不纯粹了呀,足球 事情,1,0
只要是足球，就没啥可信度,足球,1,0
希望有一天足球能够纯粹,足球,1,0
怎么少了官办足球呢,官办 足球,1,0
中国足球最好的归宿是监狱，哪个家长想把自己的孩子送进去?,中国 足球 监狱 家长 孩子,1,0
足球只是走的比别人快一些罢了。现在放眼望去，大部分都是这个节奏。所以，他们还能生存很久。,足球 节奏,1,0
中国要靠学校青训足球  免费踢球 可以学美国只交一点伙食费包吃包住,中国 学校 青训 足球 踢球 美国 伙食费,1,0
我去过摩洛哥，那里的足球很纯粹,摩洛哥 足球,1,0
不只是足球大学，媒体等等,足球 大学 媒体,1,0
标题让我想起了摩洛哥，那里的足球很纯粹。,标题 摩洛哥 足球,1,0
虽然但是，除非我的小孩以后真的很喜欢足球，我作为父亲会尽力。（尤其足“鞋”盛行的当下）,小孩 足球 父亲,1,0
"我现在有点理解为什么有""国足粉""，这帮人根本就不热爱足球，就是为了赌，就是""利益相关""。",国足粉 足球 利益,1,0
中国是啥都有 就是啥都做不长久、做不精,中国,1,0
看了这么多年球第一次听说足球还有什么第一第二第三节的，村超搞了什么新赛制吗,足球 赛制,1,0
只要没足协参与其实国内足球还是能搞的,足球,1,0
我喜欢中国足球，不喜欢中国足球队,中国 足球 中国足球队,1,0
海参不够吃啊,海参,1,1
这是老百姓的足球?，不是某些圈子的?,老百姓 足球 圈子,1,0
你都不热爱足球，怎么能带领好这个业务呢。所以说，中国足协，你得先热爱足球，才能出成绩。,足球 业务 中国足协 足球 成绩,1,0
村超就是全民足球很好的方式,全民 足球 方式,1,0
三四线城市才是中国足球的希望之地,城市 中国 足球,1,0
还是要每个地方都能这么搞，把社区足球发展起来，足球氛围很重要的，能影响到下一代。,地方 社区 足球 足球 氛围,1,0
体制内搞不好足球,体制 足球,1,0
这才是中国的足球纯粹的干净的足球,中国 足球 足球,1,0
中国的足球死了，可球迷还在。不是他们不爱中国足球，是不能爱中国足球了。村超说明，他们是有多么热爱足球,中国 足球 球迷 中国 足球 中国 足球 足球,1,0
中国足球总是让你觉得他不行了就整个活，这次是褒义的。,中国 足球 褒义,1,0
很难不担心以后的发展...尽管我并不在意足球,足球,1,0
还有拿现场安全说事的，说人多拥挤易发生事故，我觉得如果全中国都有这样的足球氛围，范志毅甚至死在这里都没有遗憾了,现场 事故 中国 足球 氛围 范志毅,1,0
我跟你说技术，你跟我说足球环境，现在有足球环境，你又跟我说没技术,技术 足球 环境 足球 环境 技术,1,0
中国的裁判还没进去呢,中国,1,0
中国足球确实十年一次大整顿，2012年整顿后，2015年亚洲杯还可以，之后世预赛踢得也可以，虽然最后成绩不咋样，但给大家很多希望。,中国 足球 亚洲杯 成绩,1,0
是摩纳哥那种纯粹的足球吧,摩纳哥 足球,1,0
足球丁真来咯,足球 丁真来,1,0
主要是反骨大，干一行恨一行讨厌一行， 足球不是职业了，就好了,足球 职业,1,0
所以说嘛，热爱足球和国足稀烂，足协稀烂有关系吗没有关系。我上大学的时候和同学们组队踢球，去看球，大家都是凭借着热爱去从事的。你足协专家啥的也别说什么中国青训不行，我就说现在有几个家长不愿意孩子多锻炼锻炼身体的足球作为第一运动，是可以让许多小孩子作为兴趣爱好参加的，这就是土壤，从来都没消失过。,足球 国足 关系 关系 大学 同学 组队 踢球 专家 中国 青训 家长 孩子 锻炼身体 足球 小孩子 土壤 消失,1,0
同意中国足球不差，但是你现在就把这些人弄到国家队练几年，还真比不了国足,中国 足球 国家队,1,0
凑完热闹了该干吗 干吗去吧。给足球一点活路吧。,足球 活路,1,0
单凡真正懂点足球的都知道他们对中国任何一支职业队都是完败,单凡 足球 中国 职业,1,0
我喜欢纯粹的足球,足球,1,0
就是西甲巅峰来村超都得挨一嘴巴子差的不止是国足差的是中国的足球环境。有这时间多了解了解中国足球环境，再看看韩日足球环境就知道我们差在哪辣一个村超能带动什么一个个口口声声说着中国足球不行，一看见踢球的就一口一个海参队，让你自己去踢球了死都不去。,西甲 巅峰 嘴巴 子差 国足差 中国 足球 环境 时间 中国 足球 环境 韩日 足球 环境 中国 足球 踢球 海参 踢球,1,0
村超的最大的贡献是开启了足球的普及性，让更多人有踢球的机会，这是从零到有的突破，可以大幅提升中国的足球人口，目前我们的注册足球球员不到7000人，日本100万，德国600万，巴西200万，就连阿根廷全国人口不到5000万都有16万注册球员。如果全国都像贵州一样大力发展业余足球联赛，大家想一下，哪怕100家庭里有1个孩子被点燃火种，我们庞大的人口基数下，会涌现出多少足球天才。,贡献 足球 普及性 踢球 机会 中国 足球 人口 足球 球员 日本 德国 巴西 阿根廷 全国 人口 球员 全国 贵州 大力发展 业余 足球联赛 家庭 孩子 火种 人口基数 足球 天才,1,0
第一基层足球和职业足球不是对立关系，第二国足是我国最高足球水平代表，第三 县一级也有足协没有足协这些活动是组织不起来滴。希望各位对足球环境有正确的认识,基层 足球 职业 足球 关系 国足 足球 水平 代表 足球 环境,1,0
这才是中国该有的足球盛宴中,中国 足球 盛宴,1,0
哈哈，贵州足球火，是因为没足协的指导。哈哈,贵州 足球 指导,1,0
中国不是没有人能踢而是能踢的人没钱去踢!,中国,1,0
只要不要沾到资本沾到足协，纯净足球。中国足球就有希望,资本 足球 中国 足球,1,0
只要取消了中国足协，中国足球一定会走的很远,中国足协 中国 足球,1,0
折耳根的足球提升能力远胜于海参，希望中国男足全面引进,耳根 足球 能力 海参 中国男足,1,0
这氛围没得说，是真好。海参队也是真的烂，但是说村超吊打海参队的大可不必，标题还说堪比世界杯，我只能说还是别捧杀了吧,氛围 海参 海参 标题 世界杯,1,1
能不能推广到各个省，提升全国足球氛围,全国 足球 氛围,1,0
这才是我热爱的足球??,足球,1,0
只要足协不插手，足球就大有希望。,足球 大有希望,1,0
这不比海参队强一百倍,海参,1,1
没有利益，没有商业，纯粹足球爱好者在一起为足球而踢球，前面有村，现有村超，就问你足协篮协脸疼不,利益 商业 足球 爱好者 足球 踢球,1,0
只能说是中国人太多了，都愿意看短视频,中国 视频,1,0
满满炒作的味道，欧文像是在读稿子，希望对中国足球有点帮助吧,味道 欧文 稿子 中国 足球,1,0
唉国内还是不看球的多 说到底 这是和职业足球比不了的 别被带了节奏,职业 足球 节奏,1,0
真正的热爱是为之拼尽一切，海参队。。。就是一群乌合之众罢了,海参,1,1
世界级的，中国足球的希望。国家队应该从这里发现培养人才，真正冲出亚洲，走向世界,世界级 中国 足球 国家队 培养人才 冲出亚洲 走向世界,1,0
你跟我说没对比没伤害但是国足的人笑笑不说话，有海参吃不用干活工资高为啥要拼命,国足 海参,1,1
足球踢的好就能进国足拿编制，想什么好事呢。你唯一现在是大宋么,足球 好事,1,0
中国盲人足球，女足也都很厉害呀，差的只有中国男足,中国 盲人 足球 女足 中国男足,1,0
只有很贫穷和很富裕的地方才能发展足球。很贫穷的地方需要足球带来的快乐，并可以不计投入地参与；很富裕的地方没有什么竞争，大可以放心地去投入去参与。我们大部分地区都太累太卷了，没有多少人愿意且能够本心地参与足球的,地方 足球 地方 足球 地方 地区 足球,1,0
国足肯定水平更高，但是足球应该作为平民运动走进百姓家，中国足球缺的不是国家队，而是热爱足球的土壤,水平 足球 平民 百姓家 中国 足球 国家队 足球 土壤,1,0
只要那一群足协官员，就能把中国足球毁了，永远别跟他们扯上关系,官员 中国 足球 关系,1,0
只有基层足球普及中国足球才有希望,基层 足球 普及 中国 足球,1,0
看哭了，终于再次感受到了小时候的足球氛围（八几年），不过小疼你个音乐,小时候 足球 氛围 音乐,1,0
热爱的人越多就越赚钱，越赚钱就越黑，所以感觉中国足球永无出头之日，谁掉到那个泥沼里都爬不出来...,感觉 中国 足球 泥沼,1,0
无资本的足球才是纯粹的足球,资本 足球 足球,1,0
我一个对足球完全不感冒的人看了村超都来兴趣了,足球 兴趣,1,0
人民的足球才是真正的足球,足球 足球,1,0
足蟹：犯规，他们没有证，他们踢的就不能算足球??,足球,1,0
村超，让每一个人都感受到，足球带来的快乐，这才是足球运动存在的价值。,足球 足球运动 价值,1,0
足球不管普及不普及，都是外国人赢，中国文化输。等中国足球普及了，再去国际上玩，又是被收割。你会发现一个俱乐部的名额就要几十亿美刀，而别人只要拿个本本，写个名字就几十亿就拿下了。恒大2000多亿签俱乐部，暴风科技50多亿美元，签转播权，亏了一千多亿。都是教训。,足球 普及 普及 外国人 中国 文化 中国 足球 普及 国际 俱乐部 名额 本本 名字 恒大 俱乐部 暴风 科技 转播权,1,0
我儿子要是不好好读书，只能保送中国男子足球大学了,儿子 读书 中国 男子 足球 大学,1,0
国足里应该也有热爱足球的，差的是足协和足协背后的资本,国足 足球 资本,1,0
不要分离社区足球和中国足球,社区 足球 中国 足球,1,0
他们是热爱好不好，如果只把足球拿来赚钱，这是赌钱的，那这项运动，是不会好的，和那些国足就不一样，他们拿着大把大把的钱，不会干事的，只会赌球似的，玩，想踢好足球，技术是一方面，首先也要热爱，不然其他的都是扯，就那么现实，没有热爱，没有梦想，没有为国争光，只把足球，赚钱的工具，那就不行，看到这个让我想起咱们中国第1支国足，民国时期，人家大部分人也和贵州村超一样，也是来自各行各业的人，人家也是热爱，也是为了为国争光，看看人家去，海外多不容易啊，和现在的人，真的是没法比，真的是一个天上一个地下，很多人都参军抗日去了，有些人都牺牲了，看看人家，为国争光不说，还有抗日烈士的，真的这些人该学着点了，学不了，该解散解散吧，真的是谁有能力谁上吧，无论是县或者市，或者省，就应该打比赛，谁行谁上，代表国家出战，我才行，国足弄不好就该解散解散吧，还有足协，真的是瞎指挥。,足球 国足 干事 赌球 足球 技术 现实 梦想 足球 工具 中国 支国 贵州 参军 抗日 抗日 烈士 学着点 能力 代表 国家,1,0
这就是在打国足的脸嘛。但是每天海参是不能停的,海参,1,1
贵州这得贡献不少足球运动员了吧,贵州 贡献 足球 运动员,1,0
中国球迷还看什么国足 就配看村超,中国 球迷,1,0
国足不配拥有中国球迷,中国 球迷,1,0
这才是足球最本质的模样，只有纯粹的热爱与快乐,足球 本质 模样,1,0
这或许才是中国足球的出路，变成群众性运动，而不是什么金元足球校园足球,中国 足球 群众性 金元 足球 校园 足球,1,0
中国足球的希望在村超，村超的希望在贵州,中国 足球 贵州,1,0
骂了隔壁的，操，看中国足球糟心，但是这个村里的足球怎么没那么糟心，真搞不懂，还以为足球没希望了呢，努努力希望能参加之后的比赛,中国 足球 足球 足球,1,0
谁有资源，我想看完整的。又好像看到了足球的希望,资源 足球,1,0
这才是足球本该有的样子。,足球 样子,1,0
请问:海参到哪里去了,海参,1,1
去年是篮球吧  今年是足球  明年了,篮球 足球,1,0
中国足球开始了从源始进化之路，一次重新寻找足球出路的行动有什么不好的这时候最好的办法就是推倒所有桎梏，自然发育看看它能进化到何种地步，就是最后变成橄榄球或板球也是中国足球和球迷的自然选择。,中国 足球 足球 办法 桎梏 橄榄球 板球 中国 足球 球迷,1,0
社区足球，学生足球才是正道，这是让人有归属感的东西，某种意义上比当地的职业俱乐部还重要,社区 足球 学生 足球 归属感 东西 职业 俱乐部,1,0
滑稽了，欧美的社区足球也很发达。反而这是中国足球走向复兴的转折点,欧美 社区 足球 中国 足球 转折点,1,0
有没有一种可能，村超在篮协备个案，用篮球代替足球继续踢?,个案 篮球 足球,1,0
国足协发明了足球没他批准不能踢球,足球 踢球,1,0
这是中国足球的希望你拼什么叫停,中国 足球,1,0
什么村超，这是鸭勃。不懂不要乱说。鸭勃会踢球吗鸭勃能影响到我们海参队。,踢球 海参,1,1
足球专营  任何个人或组织私自触摸足球均属于违法,足球 足球,1,0
问职业是不是吃干饭太无知，努力的海参都快当饭吃了还有人不知道吗,职业 海参,1,1
这些技巧是真的燃再看可悲的中国足球。。。唉,技巧 中国 足球,1,0
你要有足球证才能踢球，一个证10万,足球 踢球,1,0
这才是足球作为体育项目应该存在的意义,足球 体育项目 意义,1,0
希望全国效仿，这才是中国足球发展第一步也是最重要一步：普及,全国 效仿 中国 足球 普及,1,0
中超敢这样发言就是在惹众怒，稍微有点脑子就别说话，要是敢这样发言就可以去死咯，什么足球人口，没那个条件还想注册，要是中超那群逼没下限到这样，那中国就别搞什么联赛了，老是去丢人要它干什么,众怒 脑子 足球 人口 条件 中国,1,0
现有的足球还能发展还有退步空间吗,足球 空间,1,0
海参都吃不起踢什么足球,海参 足球,1,1
这难道不是事实  中国人是不爱足球啊  你身边同事难道不是只有世界杯才关注的吗 中国足球本来就不行  有个村超就想追赶五大联赛了吗,事实 中国 足球 同事 世界杯 中国 足球,1,0
我看了十来年球也不敢说能说清中国足球该怎么做，评论区这群魔乱舞，中国足球差归差，但火箭爆炸了，养牛的说该烧牛粪，炸油条的说该把油条带上去，有人看到初中物理老师评上优秀教师就呼吁把他加到研发团队里面，这样大家都在自己的认知里说话更是热闹且没用,年球 中国 足球 评论 中国 足球 火箭 养牛 牛粪 炸油条 油条 物理 老师 优秀教师 团队,1,0
村超的意义在于让更多的人喜欢上足球，而不是让更多的人喜欢上足球的段子。,意义 足球 足球 段子,1,0
中古足球在发展什么啊真的有在发展吗,中古 足球,1,0
不能地下打黑拳，所以足球也是,足球,1,0
中国这么大，可以举行北方和南方联赛，没有必要在一个绳上。,中国,1,0
是因为没买海参吗,海参,1,1
这种模式挺好的，足球本来就源于社区，但看过站拍的模糊版本，水平比国内专业的差几个数量级，如果这种模式能在全国铺开同时接轨职业体系整个中国足球会慢慢走上正轨，但是有足协，以上都不可能。,模式 足球 社区 版本 水平 专业 数量级 模式 全国 职业 体系 中国 足球,1,0
村超的存在是为了增加足球从业人员基数 只有这样才能有海选 更多好的苗子被发现 再进一步培养 没有基数 足球哪来未来,足球 基数 海选 苗子 基数 足球,1,0
任其野蛮发展并不利于现有的金融足球发展,金融 足球,1,0
如果村超真的被停了，我就再也不相信中国体育了,中国,1,0
影响国足吃海参了呗,国足 海参,1,1
摸足球是违法行为,足球,1,0
中国足球的出路在村超,中国 足球,1,0
屁，中国哪来的足球那场地明明是给人家丢飞盘遛狗的,中国 足球 飞盘,1,0
前几天跟朋友说起这个事，就说用不了多久村超就会被叫停，动了资本的蛋糕。所以说我太爱中国了，但同时也太恨中国某些人了。,朋友 资本 蛋糕 中国 中国,1,0
拉几把倒什么样的海参利于中国足球发展怕不是村队都踢不过怕丢人吧,海参 中国 足球 村队,1,0
