content,fenci,聚类结果,二级-聚类结果
星期天我刚从中国瘪王那里来，没碰上,中国,1,0
说实话，村超真的不能太吹，咱就不说别的，你说他能吊打国家队，我不信我个人认为来个中冠都能吊打一众。毕竟人家实力摆在那呢，中国足球个人能力中等还行，但是就是没有配合,国家队 中冠 实力 中国 足球 能力,1,0
没有办法，总有杠精要拿村超球员跟中超球员比，非专业肯定是踢不过的，毋庸置疑，可是村超的热度也是中超遥不可及的，村超可没有百万奖金，也不会踢假球，也没有海参，只有凉拌折耳根牛瘪火锅，村超的意义就是热爱，影响下一代对足球的热爱，让中国足球看到希望,办法 球员 球员 热度 奖金 假球 海参 耳根 火锅 意义 足球 中国 足球,1,0
我记得电影球迷心窍》中有一句台词：中国足球的希望在农村,电影 球迷 心窍 台词 中国 足球 农村,1,0
中国足球就需要接地气才有希望，那些所谓专业的别整天端着个架子还说大众啥也不懂,中国 足球 专业 架子 大众,1,0
恳请大家不要让“村超”成为又一个女足或泾川文汇，沦为消费国家男子足球队的道具。如果你真正了解“村超”，了解中国足球，就知道“村超”既不是用来打脸足协的道具，也不可能是中国足球的万能解药。反之只要没有脱离科学发展的轨道，就要让“村超”这个群众体育品牌原生态的生长，成为广大农村、广大青少年接触足球、认知足球、爱上足球的契机，最终受益的还是中国足球和国足。这才是足改方案里所说的“夯实足球发展的人口基础、设施基础、管理基础、文化基础，持续用力，久久为功。”,女足 泾川 文汇 国家 男子 足球队 道具 中国 足球 道具 中国 足球 万能 科学 轨道 品牌 原生态 生长 农村 青少年 足球 足球 足球 契机 中国 足球 国足 方案 足球 人口 基础 设施 基础 基础 文化 基础 用力,1,0
上次还有个人质问我周围有没有人踢球，父母给不给踢球，有没有朋友踢职业，我真的想怼死他（被拉黑了），我们小时候没场地2个书包当门，随便拿个球就开踢了，足球难道是只给专业的人踢的我们知道村超不一定能打得过职业，也知道中国没几个职业的，但你知道中国有多少球迷吗村超的意义是给我们看到了足球的本质，就是人民的娱乐和球员的拼搏对抗，不是一群职业公务员拿着高额工资在摆烂和怼自己的球迷，也不是设高门槛（金钱交易，搞颜色）把人民拒之门外的贵族运动。,质问 踢球 父母 踢球 朋友 职业 小时候 书包 个球 足球 专业 职业 中国 职业 中国 球迷 意义 足球 本质 球员 职业 公务员 高额 球迷 门槛 金钱 交易 颜色 贵族,1,0
总之我希望更多人喜欢足球，这种联赛啊比赛办的越多越好，让更多人知道足球这项运动的乐趣，但真没必要捧一个踩一个，真要比起来真比不过的。,足球 足球,1,0
怎么贵州足球在中冠被按在地上打啊，咱们村超呢,贵州 足球 中冠,1,0
从这个视频的标题和下面的评论来看，我只能说国足的水平确实配得上中国人的足球理解,视频 标题 评论 水平 中国 足球,1,0
村超和国家队比那只是玩梗，就算去和缅甸国家队比也至少被罐5个。但就是要那种热情，如果全国有一半的省像贵州这样举办村超，那中国足球未来可期，至少是对足球的重视和热爱,国家队 玩梗 缅甸 国家队 热情 全国 贵州 中国 足球 足球,1,0
谈村超氛围之好，对足球普及之贡献，引起足球之热情都是好的。,谈村 氛围 足球 普及 贡献 足球 热情,1,0
但是谈村超血虐中超，我只能说中国人对足球的了解配得上中国足球的成绩。嘴上说着兴趣热情爱好，说到底心里还是名次。,谈村 中国 足球 中国 足球 成绩 兴趣 热情 名次,1,0
村超无疑是中国足球需要的氛围，但水平远超国足就有点离谱了，个人感觉标题有待商榷,中国 足球 氛围 水平 超国 离谱 个人感觉 标题,1,0
国足老老实实吃海参就完了，管人家村里吃什么干啥,海参,1,1
想知道中国足球为什么不行，看站评论区就明白了,中国 足球 评论 明白,1,0
本来村超是一件好事，既能让发展发展足球在人民群众之间的水平和影响力，又能使广大人民群众又多了一个茶余饭后的娱乐项目，还能发展一下贵州本地的，三赢，何乐而不为呢但是在网络上，村超的负面影响被无限放大，无数的营销号和云球迷借着村超来抨击国足，只能说咱们真的就是足球荒漠,好事 足球 群众 水平 影响力 群众 项目 贵州 网络 负面影响 球迷 足球 荒漠,1,0
村超很好，足球也不是富人游戏，但是职业和业余差距不是一星半点，硬要把村超和职业足球对比只能是贻笑大方,足球 富人 游戏 职业 业余 差距 职业 足球,1,0
很反感这种把“村超”和职业足球对立起来的说法。真正的足球应该是扎根社区的，庞大的基层足球金字塔再反哺职业和国家队，这点上“村超”无疑是很好的。,职业 足球 足球 扎根 社区 基层 足球 金字塔 职业 国家队,1,0
而有些“观众”根本不看足球，对中国足球的现状和困境漠不关心，就知道天天瞎喷，连村超赢国足这种梦话都能讲出来。你们有功夫在这瞎扯，不如好好去看两场比赛。,观众 足球 中国 足球 现状 困境 连村超 国足 梦话 功夫,1,0
他们怕，怕被埋没的踢球人抢走了他们的海参,踢球 海参,1,1
这标题和评论，只能说国足的表现对的起中国的足球土壤,标题 评论 中国 足球 土壤,1,0
足球是大众体育吧，又不是高尔夫这种贵,足球 大众 高尔夫,1,0
动了人家的海参人家的能同意嘛,海参,1,1
你都在站看足球了，我还有什么好说的呢,足球,1,0
抖音看过几次直播，大概就是这样：一会直播比赛，一会直播跳舞，解说员一半说足球，一半卖旅游，就像在念广告词。解说员非常卖力，应该是有考核指标要求，一定要念够多少广告。说实话，看得我有点反胃。村超根本不是纯粹的足球，只是一场炒作，跟足球操没有什么区别。这不是一场球赛，而是一场足球题材的大型旅游广告。中超很烂，但是中超从足协到球队到裁判到媒体到球迷，哪怕是踢假球吹黑哨，他们至少还围着足球在转。也许村超曾经很纯粹，但是，现在的村超，吃相有点难看了。,解说员 足球 广告词 解说员 卖力 指标 广告 足球 足球 区别 球赛 足球 题材 广告 球队 媒体 球迷 假球 黑哨 足球,1,0
本来就是炒作，还非得说个什么 “足球该有的样子”，说点难听的，我去现场看铜梁龙对成都蓉城那场如果要是没有现场气氛加持都能无聊死，业余村级联赛还是网络转播真能有人看的下去不搞点炒作的那帮吹村超的十分钟都看不下去吧，你这个其实和足球文化一点关系都没有，就是一个大庙会没收你门票而已。后面了解了一下当地文旅局介入才搞起来的村超，本质上就跟淄博烧烤也是一回事，各级地方在找一个刺激旅游经济的方式，本来是好事。可惜炒作的有点过头了，广告才是主题，所谓的足球只不过是整个运营策略的一环罢了。虽然中国是个足球荒漠，但是足球带来的流量还是很大的，一边播村超一边骂国足，这流量就来了，你要是个搞个拔河比赛，肯定没流量。如果这大多数人都无脑跟风跟着你的视频为村超叫好，那我就只能说，这两者区别就是职业体育有输赢，村超就是表演，要是连体育和表演都分不清区别，那就是国家的问题，九年义务教育还是没普及到位,足球 样子 现场 铜梁 成都 蓉城 现场 气氛 业余 村级 网络 足球 文化 关系 庙会 门票 文旅局 本质 淄博 地方 经济 方式 好事 过头 广告 主题 足球 策略 中国 足球 荒漠 足球 流量 播村 国足 流量 拔河比赛 流量 无脑 视频 区别 职业 区别 国家 普及,1,0
你们只会拿海参讽刺国足，你们知道那个海参曾是男足和女足的赞助商吗，就因为你们这些人的诋毁和“开玩笑”，厂商终止了赞助，让本来就举步维艰的女足雪上加霜，这些你们知道吗你们前阵子用女足，现在又用村超来当舆论武器，你们还要毁掉多少中国足球的希望这次是村超，下一次是什么,海参 海参 男足 女足 厂商 女足 阵子 女足 舆论 武器 中国 足球,1,0
评论区很符合我对中国足球氛围的想象,评论 中国 足球 氛围 想象,1,0
也不知道说什么了，无知者无畏，只能说国足成绩和国民对足球的认知是完全匹配的上的，喜欢这种足球氛围还行，没必要逮着水平说，村超球员水平也不是业余的，但真的一般,无知者 成绩 国民 足球 足球 氛围 水平 球员 水平 业余,1,0
这是一个契机，是一次转变中国足球处境的机会，把握好这次热度，中国足球会迎来转变,契机 中国 足球 处境 机会 热度 中国 足球,1,0
不专业国足也没见专业啊我不玩足球，但是不妨碍我鄙视国足，反正都是输，我上我也行，呸,专业 国足 专业 足球,1,0
实力远超国家队是不可能的，真的不能拿爱好挑战人家的职业。足球不仅仅是看能不能做高难度动作，业余球员很多都可以做倒勾、远射、各种单车过人，但是真的踢不了职业足球。身体对抗和足球意识差的很远。不信吗不信和职业球队随便踢一场就知道了,实力 国家队 职业 足球 动作 业余 球员 倒勾 单车 职业 足球 身体 足球 意识 职业 球队,1,0
啊对对对，你在中超把门将换成业余的，每一轮十几个世界波，我就有优越感你能怎么我，中国足球就这环境你能让足球发展起来,门将 业余 世界 中国 足球 环境 足球,1,0
村超的技术不一定够好，但是球员对足球的热爱，看球观众的热情是真的。让观众喜欢看，有人想去踢，才能真正的让足球好起来。,技术 球员 足球 观众 热情 观众 足球,1,0
也就是在这个评论区真的可以看出中国的足球水平是完全对得起观众的，,评论 中国 足球 水平 观众,1,0
中国真正玩完,中国,1,0
不是优不优越感，而是村超能跟国足比的说法过于低智，要知道所谓黔东南苗岭在中国第四级别联赛三场全败，鼓励村超对足球的热情，好，但拿来碰瓷国足大可不必。,黔东南 苗岭 中国 级别 全败 足球 热情 瓷国,1,0
看了评论区我知道国足的排名配得上现在的中国足球环境。,评论 国足 中国 足球 环境,1,0
难绷，不愧是足球荒漠,足球 荒漠,1,0
只能说国足已经对得起这种足球氛围了,足球 氛围,1,0
200多万播放，10多万点赞，真是足球荒漠,足球 荒漠,1,0
中国14亿人口，就算10万人组个足球队，全国也可以组建14000个足球队，能代表中国足球的队员，每个位置应该1万4挑1,中国 人口 足球队 全国 足球队 代表 中国 足球 队员,1,0
国足可能对不起真球迷，但一定对得起中国人,球迷 中国,1,0
就这个标题，我只能说足球文化确实没有,标题 足球 文化,1,0
问梅西对足球有什么建议,梅西 足球 建议,1,0
了，上过正经比赛吗你，什叫村超的技术比中国国足的技术高不想支持中国足球，不要到处瞎叫，专业的话都听不进去，你还学什么足球看几个国外进球锦集，就觉得自己很牛逼了是吧这评论区80%的球盲，中国足球就这环境，你拿什么踢好，整天就知道口嗨，又不去付出行动，,什叫村 技术 中国 国足 技术 中国 足球 专业 足球 进球 锦集 评论 球盲 中国 足球 环境,1,0
纯粹的足球当然有，中国大街小巷都有热爱足球的人。可是热爱能有什么用呢回归现实，大家都需要学习和工作，哪儿有固定时间去踢球啊。就现在内卷的这股态势，我们能有多少时间放在业余爱好上不要总和别的国家比，人文和环境都不一样。我们总说搞足球搞来的是什么现在想找一个足球场都难，疫情过后飞盘介入北京这边的足球场有的都翻倍了。凡是涉及竞技，都不会是简单的“纯粹”二字。上至足协，下至俱乐部，所谓的足球都是人情世故。说句实在话，贵州发展落后，需要村超等网红选题带动发展。可热度过后，谁能想起足球呢在骂国足的时候，有没有想过，你是否真正了解足球，真正有负面出现时，没有一味跟风骂街，去了解这项运动。现在的年轻人，有几个不是天天刷抖音打的，有几个人能真正保持运动，打篮球踢踢足球的我上大学的时候，一个系四个年级800多男同学，勉强能凑20度人的足球队，很多都是门外汉，参与度不够，如何让大家热爱啊这就是一个死循环。在流量之上的年代，有谁能够认真思考呢,足球 中国 足球 现实 时间 踢球 内卷 态势 时间 总和 国家 人文 环境 足球 足球场 疫情 飞盘 北京 足球场 竞技 俱乐部 足球 实在话 贵州 选题 热度 足球 足球 负面 骂街 年轻人 音打 人能 打篮球 踢足球 大学 男同学 足球队 门外汉 参与度 流量 认真思考,1,0
我之前跟朋友说，中国足球的问题根本不在我们这些百姓，还不被认同，这次村超狠狠的证明了这一点，中国明明随便一组织就可以有如此高的足球热情，到底是谁把中国足球搞的冰凉又是谁指使授意的,朋友 中国 足球 百姓 证明 中国 足球 热情 中国 足球,1,0
他们不能吃海参，也没钱坚持天天吃,海参,1,1
那至少我们村超氛围好能推动基层足球发展啊（村超小朋友指着国家队队徽骂海参队）那我们只为了那一份热爱，踢的纯粹的足球（村超开盘了，可以下注了）我们开心就好,氛围 基层 足球 小朋友 国家队 队徽 海参 足球,1,0
视频开头什么村超水平远超国足，就水平来说，村超比国足不知道低多少级别，别开什么比国足强的玩笑了，云南最强足球俱乐部最近在中冠(第四级别联赛)一胜两败，在云南可以说大杀四方，村超比中冠还低两个级别，跟中冠球队都没得比，还想跟国足比这比国足能进世界杯还搞笑。视频最后说的确实是中国足球的实际情况，值得我们深思，热爱纯粹才是唯一的必杀技，一点都没错，中国足球太不纯粹了，中超球员不一定真正热爱足球，但村超球员是绝对的热爱。再就是怼足协的话太好了，拍案叫绝，中国足球变成这样足协脱不了责任。,视频 超水平 国足 水平 国足 级别 比国 云南 足球 俱乐部 中冠 级别 云南 中冠 级别 中冠 球队 国足 国足能 世界杯 视频 中国 足球 情况 深思 必杀技 中国 足球 球员 足球 球员 中国 足球 责任,1,0
村超有它存在的价值，但在中国的大环境下，民间运动不会给中国足球带来任何改变，中国足球需要做的是低龄普及和顶层建设。,价值 中国 环境 民间 中国 足球 中国 足球 低龄 普及 顶层,1,0
站足球荒漠真难绷,足球 荒漠,1,0
我觉得国足来了还真不一定踢得过（本人不追足球，希望懂的大佬分析一波）,足球 大佬,1,0
你也不看球，你也不懂球，你也不关心中国足球发展，你只是个骑在舆论头上狂恰流量的,关心 中国 足球 舆论 流量,1,0
说的根本就不是村超本身吧，氛围是好的，任何一个喜欢足球，想要为中国足球发展做贡献的人或者是踢球的人，都会非常喜欢这种这个比赛，碰的是你们这种嗯，贬低国足，贬低中国足球水平，你们这种纯粹博流量的人，或许你们觉得没什么，可是经过这次世界杯，足球氛围明显好了很多，你这是什么意思你有看过国家队的一场比赛吗别的不说，中超你看过吗又或者说嗯，你知道武磊是谁吗武磊去哪里留的洋你懂吗嗯，如果说这也不是专业的事儿，只要是喜欢足球，随便就能知道的，你踢足球吗嗯，又或者说你不知道，但是你喜欢足球还是说你单纯因为这种事情来博流量像董老师那种就是单纯批评像你这种人你知道人家董路对中国足球有多大贡献足球小将你知道吗像西甲那些青训队伍打遍了，你知道吗麻烦你了解清楚好吗,氛围 足球 中国 足球 贡献 踢球 中国 足球 水平 流量 世界杯 足球 氛围 国家队 武磊 武磊 专业 事儿 足球 踢足球 足球 事情 流量 老师 董路 中国 足球 贡献 足球 小将 西甲 青训 队伍 麻烦,1,0
村超和董路都为中国足球切实的做了点事情，不管对不对。而主在干嘛泼凉水吗,董路 中国 足球 事情 干嘛 凉水,1,0
看看评论区就知道这那是足球荒漠啊，这是足球地狱，只要你不是国家队的，你颠个球都能超过国足,评论 足球 荒漠 足球 地狱 国家队 个球,1,0
真正热爱足球的人，不可能否定这么纯粹的比赛,足球,1,0
不是说村超有多牛逼踢得有多好才喜欢的，是看到了希望懂吗，会有更多的孩子喜欢足球，足球才能更加普及全国，中国足球才有希望懂吗,孩子 足球 足球 普及 全国 中国 足球,1,0
无语別给足球甩黑啊,无语 足球,1,0
为什么整个评论区都在玩梗，这种氛围还想中国足球出成绩就行一个孩子被天天打骂你觉得他未来还能是光明的第一，海参事件是因为海参是赞助商，第二，白切鸡事件是因为别人刚伤愈复出，而且别人那场还进球了，第三，国足工资对比事件是低的那档，这成绩很合理，而且这钱不是国家给的，是俱乐部给的，能给国家赚钱的体育国足是最多的，第四，躲球这种东西五大联赛也并不少，第五，天天说有钱才能的你能从国足阵容了找到五个家里是豪门的第六，国足对比国内工资高是因为他们就是中国足球的前五十，别跟我你们行业做到前五十的赚不到钱,评论 玩梗 氛围 中国 足球 成绩 孩子 光明 海参 事件 海参 白切鸡 事件 进球 事件 成绩 国家 俱乐部 国家 国足是 东西 国足 阵容 豪门 中国 足球 别跟我 行业,1,0
我没记错的话是去年还是前年，中国足球在国际上一败涂地，事后足协还腆着个13脸说人民不应该谴责他们，不知道他们训练啥的多辛苦。。真是像极了那些不读书的混子还要嘴硬说自己怎么怎么努力了,中国 足球 国际 读书 混子,1,0
被村超炸出来的这帮球盲不正好证明了中国足球为什么不行了吗,球盲 证明 中国 足球,1,0
足球本来就是属于人民大众的运动,足球 人民大众,1,0
可野，中国足球的成绩很对得起评论区,中国 足球 成绩 评论,1,0
举报，不谢，什么鬼标题，水平远超中超，请问你看过中超嘛或者请问你看过一场全场比赛的球赛吗村超的成功源于热爱，是一个给热爱足球的人施展的平台，把一个这么好的大众交流平台，抬起来和中超对比，你们这些媒体又是何居心呢你可以说村超办的好，说明中国足球群众基础没有想象的那么差，可以说中国足球的青训和选拔制度不完善。等等。。。但你硬要说村超水平远超中超。就因为几个精彩的进球集锦能踢出精彩的进球就代表联赛水平高中国的足球发展成现在这样，足协责任百分之80，你们这些媒体就是那百分之20吧，我觉得，作为一个媒体，在发表一个观点，一个看法，引导观众观念的时候，还是要自己做好功课，建议多了解了解足球，再来发布视频。,标题 水平 全场 球赛 足球 平台 大众 交流平台 媒体 居心 中国 足球 群众 基础 想象 中国 足球 青训 制度 超水平 精彩 进球 集锦 精彩 进球 代表 水平 中国 足球 责任 媒体 媒体 观点 观众 观念 功课 建议 足球 视频,1,0
还是这种比赛看起来有意思真的，谁都是热爱，这不就足球的初衷嘛,足球,1,0
就这评论区，完全对得起国内足球的成绩,评论 足球 成绩,1,0
笑了，这里实打实的足球荒漠，评论区有几个是碰过足球的,足球 荒漠 评论 足球,1,0
这个评论区就是喷子的狂欢，过度消费村超百害而无一利，不要让村超沦为讽刺国足，讽刺青训的工具，中国足球要崛起只能靠青训，不是村超火了就靠村超,评论 喷子 过度 青训 工具 中国 足球 青训,1,0
评论区，足以证明中国是足球荒漠,评论 证明 中国 足球 荒漠,1,0
就这个营销号蹭热度还能火，一堆人跟着玩梗，我就知道中国足球没好了,热度 玩梗 中国 足球,1,0
看评论区就知道中国足球差是有道理的，所谓的群众基础就是一群球盲,评论 中国 足球 道理 群众 基础 球盲,1,0
现在看倒觉得有优越感的是一些平时不看足球却可劲说“村超＞国足”的观众,足球 观众,1,0
站还真就是足球荒漠，看个乐呵得了，别当真,足球 荒漠 别当真,1,0
欧洲五大联赛也都是从这样的“村超”一步一步做出来的，没有纯粹的热爱，光有商业，拿什么支撑足球的发展,欧洲 商业 足球,1,0
中国足球缺的不是专业，而是有一个喜爱足球的氛围，国足（男）和足联给不了，村超能给。这不是水平多高，待遇多好，级别多大的问题，这是热爱，不要过度商业化也不要过度神话，就是喜爱足球的人们用各自的方式一起参与其中而已，希望村超能一直存在下去。,中国 足球 专业 足球 氛围 水平 待遇 级别 过度 商业化 过度 神话 足球 方式,1,0
我们都希望有更多村超的出现，希望有更多喜欢足球的人。但请你不要当标题党,足球 标题,1,0
宇宙足球希望在村超,宇宙 足球,1,0
其实村超的水平确实比不上专业的，但是村超带动了中国的足球氛围，让热爱足球的但又对中国足球氛围心灰意冷的人看到希望。因此向村超至敬，有机会一定到现场看一看。作为一个贵州人我十分骄傲，因为他让足球脱离了贵族，回归了平民。,水平 专业 中国 足球 氛围 足球 中国 足球 氛围 向村 机会 现场 贵州 足球 贵族 平民,1,0
足球拼的是技术，而不是职业问题,足球 技术 职业,1,0
来来来，到底是谁先把村超跟国足比的只要关于足球的事情，别人上来就先说什么县队踢得过你们中超的球队，你知道那是什么比赛吗这就这队那队的了海参，海参，海参是人家赞助商的，你掏钱让他们坐飞机去国外参加比赛吗真傻假傻呀，还中国罗梅西姆巴佩，关键在于青训关键在于管理方式关键在于制度，就搁这中国梅西罗了,足球 事情 县队 球队 海参 海参 海参 坐飞机 中国 罗梅西 关键在于 青训 关键在于 方式 关键在于 制度 中国 西罗,1,0
足球丁真,足球 丁真,1,0
世界赛事里总有中国的身影，只有足球，国人在叹气,世界 赛事 中国 身影 足球 国人,1,0
我一看到这标题我就知道中国足球还有很长的路要走,标题 中国 足球,1,0
足球我从小就踢，从来都是热爱。身边朋友踢的好的，进入梯队青训。像我这样一般水平的，学习成绩不错的，父母有所顾虑就一直读书了。热爱本身没有错，错就错在拿这个抢别人的饭碗。就跟游戏少年跟职业电竞比赛一样，只能显示你的无知。你说热爱，人家每天从早到晚都在训练，你拿头比我们要承认国足问题很大，但不是正确分析，随便恶搞歪曲国足实力，形成扭曲的足球价值氛围，中国足球谈何进步。中国足球从来不是贵族运动和村超也没有任何关系。只有正视差距，戮力同心，扎扎实实搞青训，中国足球才能越来越好。（最近国足两连胜，亚运队赢韩国，键盘侠怕是看不到）,足球 朋友 梯队 青训 水平 学习成绩 父母 读书 饭碗 游戏 职业 实力 足球 价值 氛围 中国 足球 谈何 中国 足球 贵族 和村超 关系 差距 青训 中国 足球 两连胜 韩国 键盘,1,0
足球在欧洲就是在群众中发展出来的，村超就是再走这条路,足球 欧洲 条路,1,0
当流浪地球》打开了中国科幻片的大门，给上海堡垒》关上了。当“村超”打开了中国足球的热清，给“中超”浇灭了。,流浪 地球 中国 科幻片 大门 上海 堡垒 中国 足球,1,0
