content,fenci,聚类结果,二级-聚类结果
最近我才发现中国足协只是足协和中国足球才是中国足球,中国足协 中国 足球 中国 足球,1,0
海参：那我走,海参,1,1
这可比大海参好多了,海参,1,1
这才是真正热爱足球的人，看的热泪盈眶的,足球,1,0
从他们的奖品来看，相信他们是为足球而战，为荣誉而战,奖品 足球 荣誉,1,0
海参瞬间不香了,海参,1,1
奖励点海参。,海参,1,1
足协：马上给他们赞助海参，我不信他们不软。,海参,1,1
这是足球该有的样子,足球 样子,1,0
猪脚以后也许会成为中国足球的最高荣誉,猪脚 中国 足球 荣誉,1,0
"这才是干净的足球??"" 希望它继续延续下去",足球,1,0
组织村超的这个领导如果当选足球协会会长，中国足球一定世界排名前十。,领导 足球 协会会长 中国 足球,1,0
天啊，他们居然不吃海参,海参,1,1
能不能把吃海参踢足球的工资，给大家奖励一下，我们的足球都不会是那个样子,海参 踢足球 足球 样子,1,0
原来吃火腿也可以把足球踢好，不用吃海参。,火腿 足球 海参,1,0
海参吃的少，足球踢的好,海参 足球,1,1
不是应该发海参吗,海参,1,1
纯粹的足球是快乐的足球,足球 足球,1,0
现在一看到足球就让我联想到海参鲍鱼,足球 海参 鲍鱼,1,0
没有权力和利益渗透的纯粹足球。,权力 利益 足球,1,0
如果中国足球没有足协的干预，我们绝对能在世界杯有一席之地,中国 足球 世界杯,1,0
这就是百姓足球与贵族足球的区别,百姓 足球 贵族 足球 区别,1,0
足协不是去了吗没发海参吗,海参,1,1
足协插手的话，就玩完了。期待让乡村足球快乐发展。,乡村 足球,1,0
为什么一看见足球，国足每次都叫网暴一次，下一场，足协不叫举办了,足球 网暴,1,0
村超--镇超--县超--市超--省超--国超，第一名代表国家出战。取消足协和中超。中国足球就盘活了,国超 代表 国家 中国 足球,1,0
希望这么干净的足球不被资本干扰,足球 资本,1,0
中国足球有希望了，总算是看到了。,中国 足球 总算,1,0
借用以前天下足球的一句话:最纯粹的足球，最高级的享受,天下足球 足球,1,0
去掉利益，就变成纯粹的足球了,利益 足球,1,0
没发海参差评,海参,1,1
能吃海参,海参,1,1
评论区的有关足球的越位当然是必然的,评论 足球 越位,1,0
中国真是繁荣富强了,中国,1,0
卡卡：耶勒些人 足球好攒劲～,耶勒 足球,1,0
人家这才是热爱足球,足球,1,0
真的是卡卡啊我当年最爱他，后来中国队越来越烂，我看到足球就生气，慢慢就不看足球了,中国队 足球 生气 足球,1,0
所以是比另一个球星强哈，请来中国在中国不踢日本请的就去那边踢了,球星 中国 中国 日本,1,0
对足球不了解，但是知道这个卡卡，长得是真的帅,足球,1,0
怎么现在才刷到，以前是刷到贵州足球的，金丝楠木是真的吗,贵州 足球 金丝 楠木,1,0
中国欢迎这样的,中国,1,0
没有中超我们足球也是可以的吧,足球,1,0
村超请发展另一支足球事业吧,足球 事业,1,0
我的足球先生，终于出来了,足球,1,0
这才是足球最初始的样子呀,足球 样子,1,0
因为这个地方是真的热爱足球 其他的请他都是商业呀,地方 足球 商业,1,0
去中超。面对的是一堆油腻男。还可能被迫吃海参。他担心自己堕落。去孙超他看到的是一群热爱足球的人。更能理解踢球的意义。,油腻 海参 孙超 足球 踢球 意义,1,0
这是可能中国足球世界之巅,中国 足球 世界,1,0
踢踢踢 中国的足球一定要加油,踢踢 中国 足球,1,0
一个县，那么多块标准足球场，还是全民开放，这得多热爱足球啊,标准 足球场 全民 足球,1,0
打脸那些吃海参买海参的人啊，啪啪响,海参 海参,1,1
希望足协可以远离中国足球最后的这片净土…,中国 足球 净土,1,0
董路真是飘了一，用职业去较真业余，是多么不自信和恐惧二，村超本身没有攻击国足中超的意思，是“群众的眼光”看到然后得出的三，关于道德，拿那么多钱干那么点事，这也叫道德四，最重要的是，即使再骂再调侃中国足球的人，都是喜欢中国足球关心中国足球的不爱的，骂都懒得骂,董路 职业 业余 恐惧 国足 群众 眼光 道德 道德 中国 足球 中国 足球 关心 中国 足球,1,0
村超不够职业，全中国都知道，报道的时候，都说了全是业余球员，不用你提醒。骂国足不是盲目的，是大家的习惯，讽刺国足是大家一乐。可能，中国并不需要职业足球，中国不需要大力神杯，而是全民健身的氛围。,职业 中国 业余 球员 国足 盲目 习惯 国足 中国 职业 足球 中国 大力神杯 全民 氛围,1,0
这东西为什么不说说足球的纯粹难道对足球的热爱还分职业和不职业。,东西 足球 足球 职业 职业,1,0
村超没吃海参。,海参,1,1
村超存在最大的意义是让我们看到对足球的特爱和真诚,意义 足球,1,0
我们大家都知道村超不是职业的球队，但是我们都感觉到了村超对足球的热爱，感觉到了对足球发自内心的真情，这才是足球精神,职业 球队 感觉 足球 感觉 足球 真情 足球 精神,1,0
全民足球，选精英，砌低国家队,全民 足球 精英 国家队,1,0
让中超和村超比一场 就怕中超吃海参太多 万一又输了怎么办,海参,1,1
体育彰显得是一种精神，村超足球是底层民众纯碎的对足球的热爱，跟国足什么时侯拿世界冠军有关系呢每场村超比赛必看,精神 足球 底层 民众 足球 国足 时侯 世界冠军 关系,1,0
国足已经把中国球迷对足球的热情消磨殆尽了,中国 球迷 足球 热情,1,0
谁说村超过度渲染攻击职业足球那只是自媒体的戏谑和人们情绪的宣泄，急啥子哟。村超就是好,职业 足球 媒体 情绪,1,0
国足都不敢这么玩，到底是谁阻止了中国足球的发展,国足 中国 足球,1,0
看完这些评论。。。能知道中国足球的舆论是有多恶劣。。。所谓的球迷有多可笑,评论 中国 足球 舆论 球迷,1,0
村超不专业，但是能点燃人民群众对足球的热情，能让孩子们感受到足球的魅力，我们国家的足球就有希望，国足专业，但是带给大家的除了堵心还有什么,专业 群众 足球 热情 孩子 足球 魅力 国家 足球 专业,1,0
足球就是一项运动，强身健体，不是人人踢足球都为了职业，那么多人都是踢职业谁来发工资董某真是董个“球”啊村超也足球真正的土壤，会让更多人爱上足球，去踢球，让孩子踢球，中国足球能不能拿世界冠军不重要，重要的是足球能给更多的人带来运动的快乐。让足球真正像中国乒乓球一样，人人都能参与一下。,足球 踢足球 职业 职业 董某 足球 土壤 足球 踢球 孩子 踢球 中国 足球 世界冠军 足球 足球 中国 乒乓球,1,0
村超没吃海参,海参,1,1
拿着职业足球的钱，踢着停球10米远的业余水平，也是不道德的行为,职业 足球 停球 业余 水平,1,0
村超怎么敢跟你专业的比，村超的目的不是为了把国足比下去，而是为了让更多热爱足球的少年们将来能为国争光，这是一种精神，而不是讽刺,专业 目的 足球 精神,1,0
贵州足球的最初目的是跟国足比吗只是人民热爱，激发大家对足球的热爱罢了,贵州 足球 目的 足球,1,0
村超虽比不上中超，但是村超反而是更纯粹的足球，中超踢的却是人情世故。所以大家为什么嘲讽国内的职业联赛，心里没点数吗,足球 职业联赛 点数,1,0
不管够不够职业，但是他让中国球迷看到了希望，怎么多年国足看的到未来吗就是需要这样的热情才会提升中国足球发展，你们国足踢不好，中国有很多人都能提好足球，不努力没有成绩，随时都可以超越可以代替你们,职业 中国 球迷 热情 中国 足球 国足 中国 足球 成绩,1,0
村超要是演变为一种补充中国足球制度，那就有利于推进全民参与足球，给民间球队发展空间，倒逼国足进步。说不定村超以后代表中国参加世界杯，能取得更好超级,中国 足球 制度 全民 足球 民间 球队 空间 代表 中国 世界杯,1,0
就像当初相声要死了的时候，郭德纲说：先搞笑吧，不搞笑就太搞笑了。足球先调动起来人民的参与吧，人民看见就骂那不要也无所谓,郭德纲 足球,1,0
足球的本职是让人快乐，既然，国足无法让人快乐，那就让村超给我们快乐吧,足球 本职,1,0
村超是不够职业，也不可能踢的过国足，但是中国足球需要村超这种氛围。,职业 过国 中国 足球 氛围,1,0
知道什么叫做足球氛围吗街头足球个人爱好，自己非要对号入座，踢不好还不让说，玻璃心,足球 氛围 足球 对号入座 玻璃心,1,0
跟一帮各行各业的足球爱好者讲不够职业，这要是真职业了，国足就要洗牌了,足球 爱好者 职业 职业,1,0
一堆平不看球的懂哥现在跳出来质疑董哥彰显自己有多懂足球人家村超娱乐性的普及群众让更多人爱上足球 你非得说他能踢赢中国顶级联赛的球队 中国足球再不济中超球队也是受专业训练的职业队伍你以为个个都是梅州客家啊,董哥 足球 娱乐性 普及 群众 足球 中国 顶级 球队 中国 足球 不济 球队 专业训练 职业 队伍 梅州 客家,1,0
海南的9人业余和职业排球比赛既然赢得北京和上海，业余的既然赢了职业，哈哈，不知懂不懂，卧虎藏龙这四个字不。足球也好，不是职业才能踢球比赛， 董路有本事 出一千万作为慈善比赛，就贵州村超球员和您所谓的足球职业球队对对呀。村超踢的是对足球的爱好，让中国的足球更上一层楼,海南 业余 职业 排球比赛 北京 上海 业余 职业 卧虎藏龙 足球 职业 踢球 董路 慈善 贵州 球员 足球 职业 球队 足球 中国 足球,1,0
他不会认为中国真的没人能踢赢国足了吧,中国,1,0
笑话本来就是农民、教师、木匠等等组队的，哪来的足球职业具足球职业的你们，职业到哪个层次了,笑话 农民 教师 木匠 组队 足球 职业 足球 职业 职业,1,0
人家渲染的是足球运动氛围，给中国足球发展提供新鲜血液，还不道德，就你道德，还给国足说话呢,足球运动 氛围 中国 足球 新鲜血液 道德,1,0
为什么要你的十万块钱一个纯粹的足球 非得让你弄成资本化,足球 资本化,1,0
想出名，也是只有这样说。厉害。应该用中小学的足球来跟国足比才合适吧村超太厉害了。,足球,1,0
国足也进不了世界杯啊，我宁愿喜欢一个纯粹的足球，也不会喜欢一个黑暗的中超。,国足 世界杯 足球,1,0
十万还不够人吃一顿海参,海参,1,1
确实，村超吃海参不够专业,海参 专业,1,1
十万很多吗够不够中超吃海参如果踢赢了把中超解散，你敢吗,海参,1,1
足球如果以输赢论英雄，国足该上耻辱柱了村超是什么是足球的人间烟火董路是把自己封在他以为的足球象牙塔里放!,足球 英雄 耻辱柱 足球 人间烟火 董路 足球 象牙塔,1,0
海参队敢来应战吗,海参,1,1
如果赢了海参队，他们立马解散，足协解散。感应下来我们就比,海参,1,1
一，中超踢赢村超也没什么好骄傲二，村超的成功是让大家喜欢上足球三，有人酸了见不得人成功四，十万对于中超富豪太小意思了吧,足球 富豪 太小,1,0
这不废话吗人家就是业余的，但是，国足让国人失望多少次了村超点燃了全国热爱足球的人民的热情，你海参队能做得到吗大家就是调侃一下，你在急什么有本事你让海参队进个球给国人看阿,废话 业余 国足 国人 全国 足球 热情 海参 队能 海参 个球 国人,1,0
足球最本质的是什么是快乐他不够职业不够技术但是丝毫不影响我开心国家队够不够职业够不够技术是个问号，但是他们带给我的痛苦是实实在在的。我为何要去支持他们你给我一个理由董生，你是不是很怕足球在中国有了草根文化怕涌现出一批天才，怕你的培训班打了水漂,足球 本质 职业 技术 国家队 职业 技术 问号 痛苦 理由 董生 足球 中国 草根 文化 天才 培训班 水漂,1,0
你们知道为什么说村超不够职业嘛 （因为他们没有吃海参）,职业 海参,1,1
你那十万够干啥的，够吃几个海参,海参,1,1
足球不就是给人带来激情和欢乐的吗和职业有什么关系有懂的吗 请教一下,足球 激情 职业 关系,1,0
至少村超让大家知道中国人对足球的热情比要进国家队还要被薅羊毛进不去的好，你可闭嘴吧,中国 足球 热情 国家队 羊毛,1,0
因为国足太丢人了，转着圈的丢人，让国人引以为耻，村超激起了国人对足球的热爱，因为他们是村超，他们没有年薪百万，也不每天吃海参，只凭着对足球的热爱努力去踢足球，所以国人爱了，就这么简单。,国足太 国人 国人 足球 年薪 海参 足球 踢足球 国人,1,0
足球是一项运动，梅西过来都说要享受这项运动，什么职业业余，自己喜欢又能影响别人，还能给村里带来经济效益，国足带来了什么，海参年薪,足球 梅西 职业 业余 经济效益 海参 年薪,1,0
你猜他为什么叫村超  真是无语了 贵州人自己的娱乐项目 足球一定要职业才能踢吗 本就是平民百姓自己的娱乐项目 为什么还要被骂 说白了怕村超成为主流 中国足球挣不了钱了 一定要让足球在中国变成有钱人的游戏 吗 无语了,贵州 项目 足球 职业 平民百姓 项目 中国 足球 足球 中国 有钱人 游戏,1,0
他是搞足球青训的，价格不菲，现在大家都不喜欢国足，导致他学员减少，他靠青训捞的盆满钵满，他自己在直播都说了，儿子在西班牙，海参很便宜，家里房子值3千万，还有几套。他的生活都是靠足球获得的，村超如果搞起来，就会占用了他队员当球员名额，这样更没有家长让孩子到他这花钱踢足球了。,足球 青训 价格不菲 学员 儿子 西班牙 海参 房子 足球 队员 球员 名额 家长 孩子 花钱 踢足球,1,0
都知道职业和业余的区别，主要问题是态度，不承认态度问题，中国足球难改变。,职业 业余 区别 态度 态度 中国 足球,1,0
不是看到“村超”，我还不知道中国也有足球，第一次在抖音里看到足球，这个叫董路的这么叫啸，你带领国足在抖音直播，看看能不能超过“村超”的观看率，啥也不是的董路。,中国 足球 足球 董路 国足 董路,1,0
中国足球有董路一等人在，中国亿万年都摸不到世界杯决赛圈的门,中国 足球 董路 中国 世界杯 决赛圈,1,0
村超没吃海参，肯定不够职业,海参 职业,1,1
人家只是玩玩而已，重要的足球带来的快乐，你呢，动不动就十万块奖励，就跟人家没见过钱似的，足球是纯洁的。别动不动就用钱来衡量,玩玩 足球 足球,1,0
我觉得村超的意义是让喜欢足球的去踢足球 而不是没钱连球都踢不上 改变环境的唯一方法是足球场免费 建更多足球场 更多的人喜欢踢足球 继续靠着十几亿人口国家 足球注册人数1的足球运动员来拯救国足 不出成绩还被骂 当然最重要的还是足协内部的决策问题,意义 足球 踢足球 连球 环境 方法 足球场 足球场 踢足球 人口 国家 足球 注册人数 足球 运动员 成绩 决策问题,1,0
村超才是为中国足球未来发展做实事的组织，也是给了很多因为种种原因被埋没的足球人才展现自己的机会，说大一点，中国足球崛起真得靠这种民间组织。,中国 足球 实事 种种原因 足球 人才 机会 中国 足球 民间组织,1,0
这人如果不查查，我觉得足球一辈子好不了,足球,1,0
人家没渲染，人家也没攻击，只不过被国内足球环境搞得这帮球迷更喜欢这种纯粹的足球，所以他们有了流量，然后代表资本市场的足协也好这个什么路也好想进来分一杯羹，人家为了保持纯粹的足球不带他们玩，就急眼了,足球 环境 球迷 足球 流量 代表 资本 市场 分一杯羹 足球,1,0
这不是好不好的问题，是对足球热爱的精神，国足让人失望，还不让人喜欢村超了，你踢不好我们还要哄着你呗，有空抨击好好反省大家为啥要攻击国足和你们这些职业足球人，,足球 精神 国足 反省 国足 职业 足球,1,0
村超水平不够职业，这是为什么因为他们每个人都有自己的工作和生活，只能在空闲时练球，大家并不是因为有多职业而喜欢，更多是看到他们对足球的热情，希望这份热情可以感染更多人，星星之火可以燎原，这就是足球的希望,超水平 职业 空闲 练球 职业 足球 热情 热情 燎原 足球,1,0
《足球报》点评认为，“村超”真正的意义其实不在于竞技层面，而是从最基层改变足球的生态：中国足球常年来一直以竞技为核心，却忽视了足球生态和足球文化的建设，忽视球迷群体的维护和提升，由此竞技层面也便成为了无源之水。,足球报 意义 竞技 层面 基层 足球 生态 中国 足球 竞技 核心 足球 生态 足球 文化 球迷 群体 竞技 层面,1,0
10万有什么用，还不够一餐海参，人家看不上,海参,1,1
董路说的没毛病，但是国足的表现和中国足球发展的现状屡次让国人寒了心，虽然村超的水平与国家队还有较大的差距，但人家那种足球氛围，踢足球的初衷难道不是值得大力宣传和弘扬的吗如果中国到处都可以见到这样的场景，那中国足球发展能不好吗,董路 毛病 国足 中国 足球 现状 国人 水平 国家队 差距 足球 氛围 踢足球 弘扬 中国 场景 中国 足球,1,0
虽然我不看足球但我知道足球真的很差劲谁都比不过我们那么大个国家有那么多人口难道找不出几个会踢球的人吗国足实在太差了还不如这个村超,足球 足球 差劲 国家 人口 踢球 国足,1,0
人家碍着你什么了 人家踢自己的足球又怎么攻击职业赛了 是不是人家没有请你来解说,足球 职业赛,1,0
村超不够职业所以叫村超，国足为什么被骂又是什么水平和职业道德，李铁代表的什么，一个足球评论员不支持中国足球氛围是什么心态,职业 水平 职业道德 李铁 代表 足球 评论员 中国 足球 氛围 心态,1,0
为什么会有这种想法难道大家的想法不是因为村超让中国人看到了中国足球的另一种可能性起码还是有希望...,中国 中国 足球 可能性 起码,1,0
中国只村足没所谓的什么国足。,中国,1,0
为什么会这样还不是国足太垃圾了村超给球迷看到了中国足球未来的希望然而在国足身上只有一次次的失望,国足太 垃圾 球迷 中国 足球 国足,1,0
不论这人说的对与错。不论这人对国家足球付出了什么。我就是不待见这个人。,国家 足球,1,0
不懂就问，国足不是专业吃海参的吗,专业 海参,1,1
你职业也还是世界最低层，还是没人看，还是被骂，人家业余也有人喜欢有人爱看，我们看的是对足球的热爱是希望，你看到的是技术输赢，但是你赢了吗,职业 世界 业余 足球 技术,1,0
国足不敢对抗村超，国足怕吃零蛋，不怕吃海参，按理说，同在中国，国足应该出来表演一下,零蛋 海参 中国,1,0
谁都知道职业的比村超的要强很多，主要是中超太水了，球迷气不过讽刺一下中超而已这些人还给我们普及中超水平高，我们需要你讲吗我们需要的是中国足球的改变,职业 比村 球迷 普及 超水平 中国 足球,1,0
笑死，人家是为了初心去用心去踢足球，而某些球队为了去钱去参加球队吃海参养身体，足球最初的初心不是以热爱足球而去努力踢好每一场足球吗,用心 踢足球 球队 球队 海参 身体 足球 初心 足球 足球,1,0
评论区是看见董路就开始喷呀，人家说了村超很好，但是借用村超去攻击中国职业足球是不道德的，你们喷的啥呀,评论 董路 中国 职业 足球,1,0
这是混淆概念，村超是建立群众足球基础的，中超是提高足球事业能力的，没有基础何来能力，没事别哗众取宠,概念 群众 足球 基础 足球 事业 能力 基础 能力,1,0
这真是现在浮躁社会的一股清流，无关中国足球，无关竞技体育，就是一个娱乐，我也相信它能引起这么大的关注，并不是因为足球本身，这么多人奔赴贵州，也不是因为村超足球水平有多高，去的也不是球迷。村超已经超越体育本身，真的让我叹为观止，太好了。,社会 清流 中国 足球 竞技 足球 贵州 足球 水平 球迷,1,0
村超比国足好看多了，国足海参对都打不过,国足 海参,1,1
竟吓抬杠 村超没有中超职业球员的系统训练 村超里可以从年轻人中选拔优秀选手来踢中超 让热爱足球的人拥有更职业的足球舞台机会,职业 球员 系统 年轻人 足球 职业 足球 舞台 机会,1,0
解散足协，重查董路，踢个足球碍着谁,董路 足球,1,0
我认为他说的对的，不能用业余的跟职业的比，但是从某些方面来说，过度的宣传村超，是对职业的一种激励和鞭策，让国足能够走出去，也能为足球事业在中国发展提供很大帮助,业余 职业 过度 职业 鞭策 国足 足球 事业 中国,1,0
村超已经影响你们足球专业的收入了,足球 专业,1,0
董是在害怕什么全民有足球热情和激情不好吗村里面有足球比赛让这些人害怕什么影响到他们吃海参了,全民 足球 热情 激情 足球比赛 海参,1,0
"我们办村超就是娱乐，大多数都是农民，都没有专业训练过，但我们都有颗热爱足球的心??"" ，纯属娱乐娱乐而已，大家别拿中超相比较了，就让我们好好玩吧，如果有热爱足球?"" 的欢迎大家来一起玩",办村 农民 专业训练 足球 纯属 玩吧 足球,1,0
啥叫国足吃海参的那个吗,海参,1,1
村超是一群热爱足球的人组到一起踢足球这是热爱，中超是一群有钱人组到一起，不是为了踢球是为了挣钱，这是对足球的侮辱,足球 踢足球 有钱人 踢球 足球,1,0
村超的目的不是进多少个球，而且让大家都喜欢足球并行动起来，我认为什么都没有比热爱更重要，知道为什么巴西能成为足球王国吗因为巴西人民喜爱足球，大街小巷都有踢足球的而不是像他这种人一样泼冷水,目的 个球 足球 巴西 足球 王国 巴西 足球 踢足球 泼冷水,1,0
什么职业，足协董路用足球歉钱确实够职业的，只是十几年没有在足球上取得一点点成绩。,职业 董路 足球 职业 足球 成绩,1,0
我就搞不懂，一个地方小镇，一群热爱足球的人，凭什么每天让你们这个来评判，那个来建议的，能不能让原本纯粹的足球回归自己的本质,地方 小镇 足球 建议 原本 足球 本质,1,0
人家地方 举行 足球赛….足协 插手做什么 你话说的也没错…人家也没说跟国足 跟 职业足球 对比….,地方 足球赛 国足 职业 足球,1,0
村超不够职业，但让很多人喜欢上了足球，国足够职业，但让很多人厌恶了足球,职业 足球 职业 足球,1,0
用村超的体育竞技精神为指引，让国人看到干净的足球，看到中国足球的崛起，是每个国人最热衷看到的结果,体育竞技 精神 国人 足球 中国 足球 国人 热衷,1,0
吃了中超的海参还是,海参,1,1
这个董路好像快要疯了。我们就不要职业足球又咋了，我们要的是足球爱好者努力拼搏的精神... ... ... 因为像董路这些人特别肯定一些没用的或者反足球的事儿，我们的足球就不会发展。村超特别好，我们永远支持,董路 职业 足球 足球 爱好者 精神 董路 足球 事儿 足球,1,0
村超只是想表达对足球的热爱，从而网友表达的是对比，但也不否认全中国也热爱足球，同时也希望足协能改变足球的种种劣迹，更希望中国球队能在世界上占一席之地。,足球 网友 中国 足球 足球 劣迹 中国 球队,1,0
怎么好意思站出来讲这番话的，体育运动本就是兴趣爱好，14亿人口里选出来的足球运动员把足球踢成什么了现在人家玩一玩，高下立判，受不了了,这番话 体育运动 人口 足球 运动员 足球 高下,1,0
"我只能说村超的足球?"" 是很纯粹的体育精神，",足球 体育精神,1,0
人家从来没想和别人比，村级队伍怎么能和国家队比不懂球的都应该知道这个，这没啥好说的。只是想表达国足不应该才是现有的水平，有点伤国民心了。村超给我们带来的是积极的影响，让我们感受到了好的足球氛围，一个纯粹热爱足球的氛围。,村级 队伍 国家队 国足 水平 国民 足球 氛围 足球 氛围,1,0
