content,fenci,聚类结果,二级-聚类结果
足球，我们还有希望,足球,1,0
无敌多么寂寞，有本事让村超踢世界杯，看谁还说中国足球差。,世界杯 中国 足球,1,0
没钱 踢不了中国足球,中国 足球,1,0
为什么我一个几十年不看足球的人，看哭了，让我想起我的初中和高中,足球,1,0
突然有这样一个想法，是不是有其中一个原因是因为以前我们只有一个足协，只有这样一个国超，所以我们如何唾骂，他们都视而不见，他们依然存在，我们的希望依旧无处可放，只得眼巴巴看着，而这时多出一个村超，他们真的太努力拼搏也太耀眼了，无数人的希望有了着落，垃圾足协国超什么的不再是唯一的选择，他们不再是中国足球唯一的中心了，我们有了冉冉升起的新星，有了新的选择，我们曾经对足协一次次失望却又不得不指望着它有一天真能好起来，而这次，任何人的目光，无论是好是坏，没有人会再去看足协那帮人了，我们有了中国足球真正的希望。,原因 国超 眼巴巴 垃圾 国超 中国 足球 中心 冉冉升起 新星 目光 人会 中国 足球,1,0
我不懂足球，但我从以前到现在对于中国足球那点微不足道的认知来看，这就是这次风波给我留下的深刻印象。,足球 中国 足球 风波 深刻印象,1,0
挺搞笑的，为什么足球会被喷篮球不会呢不在自己身上找毛病，就会对人说三道四，你丫的工资给他们开一个月一你看看他们还踢不踢。,足球 篮球 毛病,1,0
男世界杯这种我只看外国球队，估计也只能看到外国男足，中国足球也就女足能争气些。中国未来的男足变强动了哪些流量蛋糕,世界杯 外国 球队 外国 男足 中国 足球 女足 争气 中国 男足 流量 蛋糕,1,0
村超是中国足球黑暗历史中的一束烟花，照亮了在黑暗中踢球以及热爱足球的人。村超他们绝对不能说技术多高，他们打不了职业但是他们的热爱是顶级。中国从不缺少热爱足球的人，只是希望了太多年。董路老师绝对是为了中国足球未来努力的人，你侮辱他就是无礼,中国 足球 历史 烟花 踢球 足球 技术 职业 顶级 中国 足球 董路 老师 中国 足球,1,0
足球要的是激情和拼博。不要海参和散步。,足球 激情 海参 散步,1,0
不为名利，真正热爱足球的一群人。,名利 足球,1,0
足球要从娃娃抓起，想要中国足球有个好的未来需要相关部门与足球领域的投资者还有家长和孩子共同努力，但是目前应该力不从心，好多问题解决不了，面对的实际困难和顾虑也太多。人口也太多了，先解决吃饭养老的问题吧，什么时候中国人口减半了可能就开始转变了。,足球 娃娃 中国 足球 部门 足球 领域 投资者 家长 孩子 实际困难 人口 养老 中国 人口,1,0
村超应该不怕足协恶势力，毕竟有那么多人支持，即使从来没看过球的人也跑去看村超，并能发表关于足球的观点，村超让很多人第一次认识足球，说明这条路走得对。,足球 观点 足球 条路,1,0
比起足球，道歉我是专业的,足球 专业,1,0
最近端午节站有村超的直播，热度最高的直播间弹幕也是稀稀拉拉的，更离谱的是这些弹幕聊的内容完全与足球无关。媒体都在说吹村超是“纯粹的足球”，但究竟比分是几比几，谁是射手王，谁是，但凡跟足球有关的技术统计却寥寥无几。媒体都在报道什么“比赛盛大举行，观看人数达，带动经济”，这样的报道是给人民群众看的吗相反，这是领导最喜欢看的。,热度 直播间 弹幕 离谱 弹幕 内容 足球 媒体 足球 射手 足球 技术 媒体 人数 经济 群众 领导,1,0
中超能叫足球吗那踢得都是生意,足球,1,0
不懂足球 但是是这个国家最后一块足球净土,足球 国家 足球 净土,1,0
这才是足球该有的样子，这才是人民的足球?和足球比赛，国足不过是个职业机构，不代表中国，真正代表中国的是最广大的中国人民,足球 样子 足球 足球比赛 职业 机构 代表 中国 代表 中国 中国,1,0
我想要开头那位姑娘联系方式，主要探讨足球?,姑娘 足球,1,0
中国踢球厉害的人多了去了，可惜国足里头一个都没有。,中国 踢球,1,0
看了村超之后让我又热爱足球了。,足球,1,0
足球氛围很好，保持这种热情  希望二十年后贵州能走出足球巨星，也希望二十年后国足能进世界杯,足球 氛围 热情 贵州 足球 巨星 后国 世界杯,1,0
足球只能富二代踢是吧←_←,足球,1,0
村超没有海参,海参,1,1
足球协会妨碍中国足球发展,足球 协会 中国 足球,1,0
农村人没摸过足球,农村 足球,1,0
热爱足球的人为了生活奔波，一帮吃干饭的跳梁小丑却吃喝不愁，真讽刺,足球 跳梁小丑,1,0
如果村超能够全国普及，那中国足球十年之内能不能崛起,全国 普及 中国 足球,1,0
足球就是要沉下去，才能孵出来。,足球,1,0
中国这么大，就一个足协是不够的，应该多一两个,中国,1,0
在村超这看到了足球的激情,足球 激情,1,0
我似乎看到了中国足球崛起的希望,中国 足球,1,0
评论区里怕是没几个是真正关注足球的,评论 足球,1,0
这就是中国足球，武大郎开店，不许高个儿的进。,中国 足球 武大郎 开店,1,0
那些会扎马步的腿功硬气功高手也去踢足球，中国功夫足球都能踢世界杯,高手 踢足球 中国 功夫 足球 世界杯,1,0
反正国足结局都一样，为什么不能是真心喜欢足球的人去踢这些比赛呢。,结局 足球,1,0
国内的专业足球 女足除外 当真是狗看了都摇头,专业 足球 女足,1,0
国外的足球也商业化，只是体制….,足球 商业化 体制,1,0
我不看足球，但是被村超感动了，他们真的太棒了,足球 太棒了,1,0
不爱足球，但想去感受氛围,足球 氛围,1,0
什么国足没听过，只知道海参,国足 海参,1,1
这就是最纯粹的足球了吧,足球,1,0
国足:你们连海参都吃不起也配跟我们踢,海参,1,1
害怕吃不上海参了,海参,1,1
如果这都搞不明白，实际上就是有很多人搞不明白这点。所以中国足球才这么差。,明白 明白 中国 足球,1,0
长这么大还没在学校里学过足球,学校 足球,1,0
理论来说，从古到今中国的足球应该底不差，但现在国足已经商业化,理论 中国 足球 商业化,1,0
我不懂足球，但我认为这样对比没有意义，球场强弱是要看对手的，让这村超上世界赛事的话，或许连球都摸不到，倒勾、远射只能说明有点足球技术而已。,足球 意义 球场 世界 赛事 连球 倒勾 足球 技术,1,0
郭德纲：当年我学足球 教练说我踢球前途无量 但是只有两样东西阻碍了我的发展,郭德纲 足球 踢球 东西,1,0
足协看重利益，而央视是真希望中国足球崛起,利益 中国 足球,1,0
不说别的对足球的热爱绝对是远超国足,足球 国足,1,0
虽然她没多说，但足球嘛...,足球,1,0
就是，村超算是什么啊，能每天吃一根海参吗,海参,1,1
球让你们踢了，足协怎么捞钱呢国足怎么吃海参呢,国足 海参,1,1
中国足球是富二代踢的，不是平民踢的，足球学校动不动就几十万一年学费。,中国 足球 平民 足球学校 学费,1,0
昨天晚上的友谊赛让我看到了中国足球是没什么希望的，就看第三节比赛那两个进球让的吧，5分钟让了两个球，硬是从2-0变成2-2。在这个体制内，中国足球还有很长的路要走。,友谊赛 中国 足球 进球 体制 中国 足球,1,0
这国家的足球很厉害，连村队都有国家队的水平,国家 足球 村队 国家队 水平,1,0
我知道你为村超骄傲，也觉得村超营造了国足这几乎十年内都没达到的影响力，但是你这标题这样写很容易引起冲突，“其水平远超国足”，谁都知道国足水平低十几亿人发展不起来足球，足协一群吸血虫抓都抓不完，骂声一片没人反驳因为事实如此，但我们不能说与事实不符的东西，竟然也有别人跟你说了职业和半职业业余的区别，你就该知道，扭曲事实反而容易给村超招黑破坏了现在这个纯粹的足球环境，互联网你把握不住，咱们就宣传宣传村超近况分享一下足球氛围别搞对立，我已经很理智了，我很羡慕贵州能搞出这样的氛围，也很想来看看，但是把纯粹的足球带到肮脏的互联网本来就得承受质疑，你还搁这搞对立，贬低国足可以，但千万别说假话，有心人会抓住尾巴,国足 影响力 标题 水平 国足 水平 足球 吸血虫 骂声 事实 东西 职业 职业 业余 区别 事实 足球 环境 互联网 近况 足球 氛围 理智 贵州 氛围 足球 互联网 假话 有心人 尾巴,1,0
国家队除了张玉宁家有钱外，其他都是平民出身，随便举个例子，前国家队的蒿俊闵是湖北黄陂农村的，踢得好一路保送。至于村足，看看热闹就好。像中国这样的大国，发展足球也是从城市社区足球开始。,国家队 张玉宁 平民 例子 国家队 蒿俊闵 湖北 黄陂 农村 村足 中国 大国 足球 城市 社区 足球,1,0
为什么啊，因为这里有的是对足球的热爱，而那里的热爱的除了足球都有,足球 足球,1,0
 不是中国足球不好，是资本,中国 足球 资本,1,0
说实话吧，中国足球人才肯定有，但是足协跟中超那边……唉,中国 足球 人才,1,0
中国足球看村超 ,中国 足球,1,0
看人家业余比那些专业踢得好就蚌埠住了吧，自己苦苦维护的高贵的“专业”形象被贵州村超轻易超越，这些人心里不知道有多恨呢，我们说运动不就应该是这样吗难道一个运动还分高低贵贱为什么国外的足球风气那么好，不管是城市还是乡下，西装革履的中年男人会踢，光脚穿粗布的孩童在踢，路过的人看到有人在玩足球都愿意去凑个热闹。而看国内，很多人嘴上骂着国足，事实上根本不懂球，没碰过球，地方非专业搞出较高水平足球却被叫停，非专业就不配踢足球吗我想这才是中国足球落后的原因，风气太不好，太多人置身事外当旁观者。泱泱大国，蹴鞠自战国时期出现，汉代盛行，你要说全中国找不出来会踢足球的人，我不信。,业余 专业 蚌埠 专业 形象 贵州 足球 风气 城市 光脚 孩童 足球 国足 过球 地方 高水平 足球 踢足球 中国 足球 原因 风气 旁观者 蹴鞠 战国时期 中国 踢足球,1,0
没有海参的足球不是好足球,海参 足球 足球,1,1
中国足球的未来在哪在土豆，在白菜，就是不在海参和鲍鱼,中国 足球 土豆 白菜 海参 鲍鱼,1,0
不好意思这个才叫做体育精神。比海参足球高级太多了。喷子还是用键盘踢球吧。,体育精神 海参 足球 喷子 键盘 踢球,1,0
村超从各方面讲都对中国足球有帮助，至少可以培养很大一批球迷，但是现阶段和职业比有点扯，希望村超也来越好，带动更多的国人喜欢上足球,中国 足球 球迷 职业 国人 足球,1,0
干脆中国解散所有职业足球吧，以后预选赛就让普通人自发报名，反正现在国家队也是输，随便上吧，兴许还能进几个球,中国 职业 足球 预选赛 普通人 国家队,1,0
四川足球，广东篮球。,四川 足球 广东 篮球,1,0
说这些话的都是吃了海参的,海参,1,1
足球是一门生意，这就是专业性,足球 专业性,1,0
那至少我们村超氛围好能推动基层足球发展啊（村超小朋友指着国家队队徽骂海参队）,氛围 基层 足球 小朋友 国家队 队徽 海参,1,0
什么项目最揪心，足球，中国?。二十多年了，一如既往的稳定水平,项目 足球 中国 水平,1,0
农村包围城市，实力夺取机会。中国就是这么打出来的，希望足球也可以做到,农村 城市 实力 机会 中国 足球,1,0
中国足球等不到足协来发展了，靠的是咱们国人真正的热爱和纯粹，参考历史当年的巴西足球不就是这样崛起的嘛。,中国 足球 国人 历史 巴西 足球,1,0
就是多发展这些，中国足球才有发展,中国 足球,1,0
纯路人，不懂足球，谁能告诉我中超是什么,足球,1,0
巴西街头足球,巴西 足球,1,0
就是要这种越来越多，足球才能变得大众起来，中国才能出更多足球人才,足球 大众 中国 足球 人才,1,0
这有什么好说的，不管什么运动什么赛事，不都分专业与非专业?虽然村超技术远不敌国足，但人家至少激发起大家对足球的兴趣，使百姓重燃起对足球的热情，给中国足球新生代埋下启蒙的种子。所以这样的活动为什么会有这么大争议呢?莫不是在职业上踢不过越南，又眼红国内业余比赛举办大成功?亦或是动了某块神秘的蛋糕?当然，职业和业余是没有可比性的，过分地吹捧村超也是不可取。但若是那些有着专业训练场地和专门训练计划、拿着几十万年薪的球员非要来和这些老师啊，保安啊什么的比比高低，以此来证明自己的实力，那我的评价是——海参吃得还不够多,赛事 专业 技术 敌国 足球 兴趣 百姓 足球 热情 中国 足球 新生代 种子 争议 职业 越南 眼红 业余比赛 蛋糕 职业 业余 过分 专业 训练场地 计划 年薪 球员 老师 保安 证明 实力 评价 海参,1,0
对中国足球，满屏的谩骂和嘲讽，只有我在默默的支持，加油没用的东西。,中国 足球 满屏 东西,1,0
中国足球和一样的，一说就是专业竞技，一说就是你不懂，一问世界成绩就是没有。,中国 足球 专业 竞技 世界 成绩,1,0
中国足球足协都已经烂成这样了，这时什么样的改变都可能是新的希望，而那些抵制和反对的，都可以理解为主动或者被动的辫子军,中国 足球 辫子,1,0
国足：海参要没得吃了,海参,1,1
中国震撼,中国,1,0
很多足球强国还没贵州省人多。,足球 强国 贵州省,1,0
中国原本是足球也就是蹴鞠的发源地，老祖宗留下来的东西被国足玩成这样真不嫌丢脸，自己不行还眼红他人，现在的国足真的配代表中国出赛吗,中国 原本 足球 蹴鞠 发源地 老祖宗 东西 国足 眼红 国足 代表 中国,1,0
我说:功夫+足球有没有搞头啊,功夫 足球,1,0
村超才是中国足球，中超韩国的吧,中国 足球 韩国,1,0
一边说着中国足球荒漠一边嫌弃村超,中国 足球 荒漠,1,0
中国足球水平差，是全方位的，不仅球员，球迷，还有自媒体。,中国 足球 水平 球员 球迷 媒体,1,0
但凡路边足球场免费且多点，少一些玩飞盘的狗我觉得中国足球可能会好点,足球场 飞盘 中国 足球,1,0
我真是看不下去了，这件事根本就没有啊，不要消费人们的兴趣啊，就发这种对立谈什么振兴足球，这个还装的挺无辜的,兴趣 足球 无辜,1,0
那些吃着海参的中国足球运动员能跑的动吗,海参 中国 足球 运动员,1,0
好想再踢几场足球青春阿,足球 青春,1,0
不吃海参就是好,海参,1,1
不爱足球就离开吧，让爱足球的人更好地爱下去。,足球 足球,1,0
干得漂亮，这才是真正的足球。,足球,1,0
其实中国大部分人都知道，中国不是没有会踢球的人，而是会踢球的人，踢不上正式球赛而已。中国足球，根本不是体育项目，恶心的资本,中国 中国 踢球 踢球 球赛 中国 足球 体育项目 恶心 资本,1,0
现实版的功夫足球开始了,现实 功夫 足球,1,0
真是有够离谱的，难道哪天我想踢个足球，还得去申请一个足球执照吗,离谱 足球 足球,1,0
足球看的一部分是技术，但是大部分看的是精气神，是激情，村超足球比国足看起来积极敢拼，那大家喜欢看村超合情合理的,足球 技术 精气神 激情 足球 比国 合情合理,1,0
中国足球 不是球员的问题  是整个足协的问题 商业化 只说球员技术踢得差只是表面问题  本质是足协  大家都不瞎 知道谁踢的好 踢的差  问题踢的好的人进不了足协  进了甚至把你腐败了 赚钱嘛 不寒碜  没有比足协还大的手去整治（国家）你就当中国没有足球这个职业吧,中国 足球 球员 商业化 球员 技术 表面 本质 腐败 整治 国家 中国 足球 职业,1,0
足球不足球的我不懂，谁说广场舞毫无价值的给老娘滚出来。,足球 足球 广场 老娘,1,0
本质就是足协垄断了中国足球，如果能有两家以上真正的竞争平台出现就好了，当一个足球爱好者需要交钱才能进队踢球的那一刻起，这个行业就有问题了。,本质 中国 足球 平台 足球 爱好者 交钱 进队 踢球 行业,1,0
吃海参我也会,海参,1,1
国足先砍工资吧。大约3000-5000，这样就留下存粹热爱的足球运动员了。,存粹 足球 运动员,1,0
让足球回归运动的本质，挺好的,足球 本质,1,0
村超从各方面来说肯定比不过中超，但我们需要村超，因为村超是足球群众基础的一部分，我们需要从社区足球到各个级别青训的联赛，需要低级别职业联赛到职业联赛，需要把足球人口做成一个金字塔结构，让其屹立不倒。但我们并不需要你这种若至营销号，只知道蹭流量，不知道足球是什么。,足球 群众 基础 社区 足球 级别 青训 级别 职业联赛 职业联赛 足球 人口 金字塔 结构 流量 足球,1,0
村超迟早会被你这样的营销号和球盲害了，现在发了视频夸一夸，热度过去你们还会关注吗看了中冠的比赛吗，去现场看过中超吗，你们没有，只是跟风输出情绪，玩两句烂梗，搞得自己好像懂足球，好像心系中国足球事业发展似的,迟早会 和球 视频 热度 中冠 现场 情绪 足球 心系 中国 足球 事业,1,0
没用的 海参他们是真爱吃,海参,1,1
回归足球的原始属性,足球 属性,1,0
没有什么优越感，只是你真的不懂职业足球和业余爱好的差距，你只是在找热点蹭热点制造对立罢了。国足很烂，可是人家是专业的，我有朋友跟范大将军的老克勒队踢过，他们一帮小年轻，每周也会聚在一起训练，可是面对大他们很多的退役球员，踢的真的是痛苦。专业的人做专业的事，村超真的很好，纯粹且有趣，村超的好不用你说，但是足球跟任何工作一样，需要训练的，中国依然有徐根宝这样的人在为足球培养人才，尽管很难。所以，像你这样不懂不看只会嘲笑的人，就不要拿国足跟村超比，因为你不爱足球,职业 足球 差距 热点 热点 专业 朋友 大将军 球员 痛苦 专业 专业 足球 中国 徐根宝 足球 培养人才 国足 足球,1,0
海参队就跟海参一样软,海参 海参,1,1
不吃海参吗,海参,1,1
哎，所以说大家都说中国足球不行，其实中国足球水平不行也包括了中国足球的群众对足球的理解水平不行啊，连什么村超水平远超国足这种话都说得出来，啥都不懂，还好意思发视频带节奏，然后还真炸出一群无脑黑的所谓球迷。也算是中国足球不行的一个缩影吧,中国 足球 中国 足球 水平 中国 足球 群众 足球 水平 超水平 国足 视频 节奏 无脑 球迷 中国 足球 缩影,1,0
能把专业足球玩成全国人民反感，也是挺佩服这些垃圾,专业 足球 全国 垃圾,1,0
一旦有资本的入驻，也会变得啥也不是了。足球就是足球别掺杂乱七八糟的东西。老百姓开心点得罪谁了加油，人活的本来就不容易。加油。加油。,资本 足球 足球 东西 老百姓,1,0
要我说，现阶段国内根本没有搞职业足球的必要,职业 足球,1,0
贵州村足球就是比男足有激情。,贵州 足球 男足 激情,1,0
我们在搞国际龙舟赛，没空看足球,国际 龙舟赛 足球,1,0
海参还在坚持吃吗,海参,1,1
足球这种运动要的就是热情，没有热情什么都白瞎，国外的球星很多都是贫民窟出来的，要的就是那份对足球的热爱,足球 热情 热情 白瞎 球星 贫民窟 足球,1,0
我对董路老师比较失望，都是弄足球事业的，敬佩你能靠一己之力发展中国足球小将，立志提高中国足球实力，但这样盲目抨击贵州村超，贬低这么一个大众都喜闻乐见的足球盛宴，只会寒了支持你的球迷们的心。以后请专业的人，不要讲些这么不专业的话吧，属实丢脸,董路 老师 足球 事业 敬佩 中国 足球 小将 立志 中国 足球 实力 盲目 贵州 大众 足球 盛宴 球迷 专业 专业,1,0
村超确实体现了中国人民队足球的热爱，也为下一代中国足球的发展打下了基础，但竞技水平我实在不敢恭维，没有经受过专业训练的人组的队连中冠都踢不过的，这题目起的有点太外行了,中国 足球 中国 足球 基础 竞技 水平 专业训练 人组 中冠 题目 外行,1,0
中国足球只要足协不插手能踢世界杯了,中国 足球 世界杯,1,0
原来中国也有这样好看的足球,中国 足球,1,0
村超踢中冠(四级联赛，业余最高水平）都被干的妈都不认识，吹实力真没必要但村超这种基层比赛的热情对足球的热爱和青少年培养这种基础才是中国足球需要的根基，也是猪协最不重视的环节,业余 水平 实力 基层 热情 足球 青少年 基础 中国 足球 根基 环节,1,0
真以为技术好就高贵呢，说到底是表演给人看的，足球也好篮球也好，不管是世界杯还是没观众你啥也不是,技术 足球 篮球 世界杯 观众,1,0
我不是很懂足球，也不是很了解一些相关的技术，但是那一脚世界波属实震惊到我了,足球 技术 世界,1,0
留给中国足球的时间不多了,中国 足球 时间,1,0
不管专不专业，至少村超充满了对于足球的爱。这是中超比不了的。,专业 足球,1,0
你这样，他们没海参吃当然发声明,海参,1,1
你是懂趁热度的，你这个比较就相当于武术爱好者和职业搏击运动员，村超的足球氛围是值得鼓励的，欧洲好多球员都是从社区足球和村里的足球出来的，但是这不代表哪些足球运动员就不需要经过训练直接去踢职业足球，真正希望中国足球能够变好，不是偏执的说国足解散之类的，这相当于暴论，任何职业运动都需要规范化训练，不是满腔热血，动不动就打鸡血。,热度 武术 爱好者 职业 运动员 足球 氛围 欧洲 球员 社区 足球 足球 代表 足球 运动员 经过训练 职业 足球 中国 足球 暴论 职业 规范化 鸡血,1,0
举报了，起这种标题获取流量，还打着为了中国足球未来的旗号，不要脸,标题 流量 中国 足球 旗号,1,0
这给吃上海参那还了得,海参,1,1
足球永远都是需要热爱和激情的运动，水平不够可以去练，激情没了踢什么足球，国足没有这种激情,足球 永远都是 激情 水平 激情 足球 激情,1,0
人家踢的是熱情，對足球熱愛超過了本身利益關係。,熱情 足球 利益,1,0
對足球有真正熱愛，中國足球才真正好起來。,足球 中國 足球,1,0
中国足球的成绩对得起中国足球的环境，但凡一周踢两场稍微正规点点球，都说不出这么逆天的评论,中国 足球 成绩 中国 足球 环境 点球 逆天 评论,1,0
真讽刺啊，这是刺痛了某些海参人吧，那么快就破防了,海参,1,1
让你们不吃海参,海参,1,1
要不海参队换人,海参,1,1
国足：他们吃的海参肯定比我们多，不然怎么会比我们踢得好,海参,1,1
中国人不是踢不了足球只因国足全是生意,中国 足球 国足 全是,1,0
国足：只要把比我强的都禁了，我就是中国最强的,中国,1,0
职业国足只有敷衍，农村足球才能看得出热爱,职业 农村 足球,1,0
他们是热爱生活，选择足球这个体育运动，纯粹的竞赛，没有所谓弄虚作假，更别说踢出什么人情世故。,足球 体育运动,1,0
不说别的，现在中超能办的这么热闹吗踢的尼玛跟屎一样臭。伤了亿万中国球迷的心是一点都不知道，我早已经不支持国足了，从08年以后就再也没关注过中国足球。我宁愿去看台球也不会去看中国足球。,中国 球迷 中国 足球 台球 中国 足球,1,0
国足那些人只是把足球当做赚钱的途径罢了，真正热爱足球的孩子根本没有上专业赛场的希望,足球 途径 足球 孩子 专业 赛场,1,0
村超能吃几根海参啊,海参,1,1
足球如此昂贵的运动器材，是这些穷人能踢的吗，他们不配，在中国足球只有富贵人才踢得起,足球 运动器材 穷人 中国 足球 人才,1,0
